id,title,content,likes,url,author,views,created_at,updated_at
1515347,저도 ID4 시승기 하나,"차 사기 전에 시승한적이 거의 없는데아내분과 상의하기 위해서 ID4 있는지 문의하고 시승가능한지 문의 후 방문했습니다내외관구경ID4 매장에서 구경했는데 ev6 풀옵 gt라인에 있는거랑 같은 스웨이드 가죽? 뭐 그런 재질이더라구요그리고 2열 착촤감이 침대같더군요그리고 2열 가운데 좌석 탑테더도 있고5.2인치 계기판도 귀엽고 내장재도 폭바답지 않게 아기자기하고 예쁘더군요센터 디스플레이는 몇인치인지 기억이 안나는데 복잡하다는것만 들었고선루프가 아오5처럼 엄청 넓은거 같던데 두차종다 안열리니..그리고 터치로 키고 끄는 불들이랑 양옆에 들어오는 트렁크 등은 깔끔하고 마음에 들더군요541L인가? 용량은 수치적으로는 큰데 큰건지는 잘.. 어쨌든 작진 않다내부에 마사지 시트운전석 조수석 메모리 2개 기억 시트운전석 안마기능?조수석 뒷편 탑테더2열 가운데 볼록 솟은 부분 없는 것1열 2열 트렁크까지 충분히 여유로운 점아오5랑 높이 +2.6cm 길이 -5.1cm 차폭 -3.8cm 로 휠베이스 차이가 나긴 하지만 실내차이는 잘 모르겠다 용량환산하면 수십 L 작은 수준으로 나올거 같기도 하고 모르겠다 정도였습니다시승 - 출발그리고 주행을 했는데 미리 블로그 리뷰 및 동영상 몇개를 보고 나서 가서 시동 버튼 따로 사용 안하고 브레이크 밟고 D 누르면 갈 수 있다는거랑 같이 시승하신 딜러분이 애플카플레이를 친히 연결해주셔서 좀 어색하긴 했는데 센터디스플레이에 카링킷이나 엠스틱 달면 좋을거 같아 보였네요룸미러 사이드미러 잘 조정하고 밟아봤고D모드는 회생제동 임의 감속 없고 B모드는 5km 까지 엑셀 떼면 감속해준다고 들었네요(이트론은 15km 까지 해주는데... 다른건가...)시승 - 가감속주행은 200마력임에도 제로백 토크 등 고려하면 팍팍 나가는 느낌은 아니었고 컴포트 모드라서 그런지 첫 출발이 부드럽게 안되고 꿀렁 한번 하고 가더라구요..(이거 꼭 해결해야 될꺼같은데 어떻게 할지는 차받고 나서..)감속이 진짜 어색했는데 브레이크를 꾹 눌러볼려고 눌렀는데 깊이가 제가 예상한 정도가 아니라 더 깊게 눌러야 급브레이크가 되더군요 그래서 이것도 적응에 시간이 걸려야 될 것 같았고밟아보라고 한번 이야기했는데 원래 과속도 안하거니와 밟는데 취미도 없어서 그냥 스무스한 가속했는데 50km 60km 수준으로 운전하기엔 정말 좋은 차 같았습니다100km 이상 고속도로 달려보면 어떨지 좀 궁금하기도 하네요시승 - 반자율주행반자율주행도 핸들 왼쪽 버튼 눌러서 켜보았고 차간거리 5단계 조정 가능해서 멀리서 쫓아가기는 좋아 보이는데 시내라 속도가 낮아서 그런지 차간거리가 많이 안멀어지더라구요.그리고 출발 감속 등이 부드럽다고 해서 이트론의 그것을 기대했는데 부드러운게 도대체 어디 대비 부드러운건지 테슬라보다 부드럽다인걸로 보였습니다. 제기준에선 그럼에도 가속이 좀 빠르다 인걸로..차선 유지나 앞차 인식 등은 요즘 차들은 대부분 상향 평준화 된거 같이 큰 문제 없어 보였고요설정 속도가 무조건 10km 씩 올라가고 내려가서 딜러분이 옵션 들어가서 조정할 수 있다는데(딜러는 안믿는 주의라..)나중에 설명서 찾아봐야겠습니다시승 - 승차감 및 아내 의견편승차감은 전기차 중 좋다 정도로 q4랑 같은 플랫폼이므로 좋다라고 생각하고 탔을때 뭐 이정도면 괜찮은 수준이지 했는데 2열에 탄 아내 왈 i30랑 똑같이 엉덩이로 노면 읽으면서 왔다고..(아오5도 그래서 서브카가 되었다는 과거가...)1열하고 2열하고 승차감이 좀 차이가 나는건가? 싶었습니다총평오랫동안 전기차를 여러대 거치면서 타보고 안전제일 주의 패밀리카를 벗어날 수 없는 운명에 맞춰서제주도 코나ev 렌트 -> 레이ev -> 페리 아이오닉ev -> 이트론 + 아이오닉5(판매예정) -> ID4뿐만 아니라 부모님 전기차 까지 나열하면 끝도 없어서 대충 보면오랫동안 전기차 타보고 사고도 나보고 뉴스도 끊임없이 보고 화재건 하나도 안놓치고 본 사람 입장에서는egmp?ID4 예쁘게 잘 타볼 생각입니다윈터타이어 블랙박스 선팅브랜드 고르러 가야겠네요~제가 ID4 단점을 단점이라고 생각 안하는 이유를 말씀드릴께요~단점에 대한 생각- 드럼브레이크그래서 이거 달면 사고로 죽는가? 전혀아님 근데 왜 난리인건지? ICCU처럼 고속도로에서 멈추거나 가족 여행가는데 멈추지도 않는데 무슨 상관일까...그냥 생각을 아예 안해도 되는 문제- 커넥티드 기능 부재진짜 필요한건 안전 기능을 옵션이 아닌 필수로 넣어서 모두 사용자를 보조해주는 것, 커넥티드는 부과적인 것.예약 공조 사용은 차에서 설정 가능하다고 들었음원격으로 에어컨 못키는건 좀 아쉽긴 하나 거의 쓰지도 않음그리고 옛날 차들은 더 커넥티드 기능 없었음실제로 부모님은 커넥티드 기능 쓰는걸 본적이 없음있는데 안쓰는거랑 없어서 못쓰는거랑 다르다고 생각할 수 있으나 이게 안전하고 상관이 있는것이냐면 그것도 아니고테슬라처럼 차내부 온도라도 알려주고 센트리모드라도 해주냐고 하면 그것도 아니라- 통풍시트지금 차도 안씀..현기차나 선풍기처럼 불어주지 외제차는 흡수방식이라 시원한건지.. 그냥 테슬라 처럼 에어컨 간접바람 빵빵하게 나오는게 최고.. 그리고 정 불편하면 통풍 매트 같은거 하나 깔아서 작동시켜도 차이가...- 2열 열선열선도 원래 안..- 2열 선쉐이드이제 수동 탈부착을 자석으로 하느냐 흡착으로 하느냐 알루미늄인지 철인지 자석가지고 실험해보기로- 에어컨 이슈이트론하고 비슷한걸로.. 근데 id4는 리콜을 안해주는..?- 네비게이션 없음카링킷 vs 엠스틱 중 택1해서 행복한 카플레이 생활이 정신건강에 도움이... 순정네비가 아무리 좋아진다고 해도...",2,https://cafe.naver.com/ca-fe/ArticleRead.nhn?clubid=21771803&page=1&userDisplay=50&inCafeSearch=true&searchBy=0&query=%EC%95%84%EC%9D%B4%EC%98%A4%EB%8B%89+iccu&includeAll=&exclude=&include=&exact=&searchdate=2024-02-292024-08-30&media=0&sortBy=date&articleid=1515347&referrerAllArticles=true,도미l트론아5l경기,"2,143",2024-07-24 16:16:00,
1514974,아이오닉 6타시는분들 어떠세요?,이번에 중고로 하나 업어올까하는데 추천할만한지 ?,0,https://cafe.naver.com/ca-fe/ArticleRead.nhn?clubid=21771803&page=1&userDisplay=50&inCafeSearch=true&searchBy=0&query=%EC%95%84%EC%9D%B4%EC%98%A4%EB%8B%89+iccu&includeAll=&exclude=&include=&exact=&searchdate=2024-02-292024-08-30&media=0&sortBy=date&articleid=1514974&referrerAllArticles=true,쎄이I김해부산,406,2024-07-24 12:00:00,
1513075,ev3 배터리는 좀 더 안전할까요??,모카 유튜브 보다 보니 ev3 테크데이 내용 나오던데이번 ev3 에서는 배터리가 조금 바뀌었다고 하네요.내용으로는 현대랑 엘지랑 공동개발한 배터리를 인도네시아 에서 만들어서 탑재하고 열폭주나 배터리 화재시 시스템 알림기능이 추가되고 자체적으로 화재 테스트도 되었다고 한거 같은데요.기존 아이오닉5나 ev6 대비 좀더 안전해졌을까요?400v 배터리 아키텍쳐 사용이면 iccu도 해결이 된건지..,0,https://cafe.naver.com/ca-fe/ArticleRead.nhn?clubid=21771803&page=1&userDisplay=50&inCafeSearch=true&searchBy=0&query=%EC%95%84%EC%9D%B4%EC%98%A4%EB%8B%89+iccu&includeAll=&exclude=&include=&exact=&searchdate=2024-02-292024-08-30&media=0&sortBy=date&articleid=1513075&referrerAllArticles=true,쿨라l서울,"1,066",2024-07-22 15:38:00,
1512510,bmw전기차 괜찮나요?,요즘 모터 이슈나 구동관련 글과 영상이 많던데요자극적인 이슈라 계속 나오는건지실제 차주분들은 어떤 상황인지 궁금합니다구매를 앞두고있는 상황에서 이런 이슈를마냥 무시하고있기도 뭐하고.걱정이 앞서네요.안사면 그만이겠지만.내장재나 주행시 안락함은 비엠이 좋더라구요ㅜㅠbmw카페보다 여기에 올려야좀더 객곽적인 대답을 들을수있을까해서 올립니다,1,https://cafe.naver.com/ca-fe/ArticleRead.nhn?clubid=21771803&page=1&userDisplay=50&inCafeSearch=true&searchBy=0&query=%EC%95%84%EC%9D%B4%EC%98%A4%EB%8B%89+iccu&includeAll=&exclude=&include=&exact=&searchdate=2024-02-292024-08-30&media=0&sortBy=date&articleid=1512510&referrerAllArticles=true,골드버디I서울,762,2024-07-22 00:11:00,
1512142,아이오닉5 12v 배터리도 방전이 되나요?,"완속충전 완충후 맛이 갔네요,,현대 sos 이용하면 그냥 무상으로 견인 및 수리까지 완료해주나요?상담사 이야기로 아예 계기판에 불이 안들어오는건배터리 방전때문이라고 하네요이것도 일반 차처럼 배터리 소모품인건 첨알았네요 ㅎㅎiccu가 아니라서 다행입니다 ㅜ",1,https://cafe.naver.com/ca-fe/ArticleRead.nhn?clubid=21771803&page=1&userDisplay=50&inCafeSearch=true&searchBy=0&query=%EC%95%84%EC%9D%B4%EC%98%A4%EB%8B%89+iccu&includeAll=&exclude=&include=&exact=&searchdate=2024-02-292024-08-30&media=0&sortBy=date&articleid=1512142&referrerAllArticles=true,아이오닉ldaftpul경기,305,2024-07-21 12:42:00,
