post_id,cmt_content,cmt_author,cmt_created_at
1533858,음 엔이부러워서 그런갑네요 이해합니다 알아서 생각하시고 그냥 지나가다 이브이나인 이미지 가격대비 고급은 아니라는거 말씀드린겁니다,정상길l오닉Nl해운대,2024-08-09 22:27:00
1533858,차도없으면서 무슨 엔타령이세요 엔부러웠음 엔샀죠 더 싼 차를 왜 부러워할꺼라 생각하시죠? ㅋㅋ,드라이버IEV9l제주,2024-08-09 22:46:00
1533858,이브이나인 차잘모르는 분한테 물어보세요 3천대 같습니다,정상길l오닉Nl해운대,2024-08-10 00:25:00
1533858,잘모르니까 개소리하는거죠 그게 마치 답인거마냥 보통 보면요 중고차만타서 차도 그지같은사람들이 꼭 그쪽같은소리 많이해요 ㅋㅋㅋㅋ 뭐 좋은차나 타면서 입터는거면 몰라도ㅋㅋㅋ 신형아이오닉이나 빠는 수준 이면서 무슨 대단하다고 ㅋㅋㅋㅋㅋㅋㅋㅋ,드라이버IEV9l제주,2024-08-10 00:59:00
1533858,님차 그정도아닙니다 아이오닉엔이 훨 좋아보임 일반인이보면,정상길l오닉Nl해운대,2024-08-10 01:14:00
1533858,금액대부터가 급이다른차인데 뭘 자꾸 맞다고 우겨대십니까ㅋㅋㅋ그리고 당신 차도 아닌 드림카라고 올려치기 심하네 ㅋㅋㅋㅋㅋ 친구없죠?,드라이버IEV9l제주,2024-08-10 01:28:00
1533858,차없다고 믿으셔도 괸찮아요 전 그저 ev9은 그냥 싼타페랑 동급처럼 보인다는것을 말씀드립니다,정상길l오닉Nl해운대,2024-08-10 02:54:00
1533858,있든 없든 관심크게없고요 아이오닉 빠는수준이면서 이렇네 저렇네 헛소리하는게 그냥 웃겨요ㅋㅋㅋ님이 그렇게본다고 그게 팩트는 아니고 세상이 그냥 님 중심으로 돌아가는거같고 가르치고싶은성격이라 친구없고 여기저기 분란만들고싶어하는거 보입니다만 까는소리 그만하세여 ㅋㅋ..,드라이버IEV9l제주,2024-08-10 02:58:00
1533858,ev9의 치명적인 단점은 그가격처럼 안보인다는건데 (3천정도로보이는.) 반면 오닉엔은 비싼값하게 보이죠,정상길l오닉Nl해운대,2024-08-10 03:27:00
1533858,클린봇한테 제지당하셧네 어른답게 말슴하시지,정상길l오닉Nl해운대,2024-08-10 03:52:00
1533858,ev9이 3천같아 보이는 말이 왤케 웃기죠 ㅋㅋㅋㅋㅋ 확실히 비싸보이지는 않지만 쏘렌토만해도 옵션 조금 넣으면 4천대인데 ㅋㅋㅋㅋㅋ,뽀동Iev9I경기,2024-08-11 11:58:00
1533858,네네,정상길l오닉Nl해운대,2024-08-11 12:00:00
1533858,아이오닉n은 아이오닉5랑 일반인이 보기엔 같아서 3천도 안되보이는데.. 택시도 너무많이 돌아다니고... 아반데인데 아반떼 n 강조안하면 모르듯이.. 그닥 혼자 본인차 좋다고 자위하는듯.ㅋㅋㅋ 상길씨.. 정신차리세요.. 본인차 그냥 아이오닉5랑 같아요 남이볼땐...ㅉㅉ,성남lev9l봄이파더,2024-08-11 22:36:00
1533858,노인네 아직도 꼴깝떨고있네.... ㅋㅋㅋㅋ,드라이버IEV9l제주,2024-08-11 17:44:00
1533858,현기 입장에서는 이런 사고가 많은 게 유리함인적 사고 없고 물적 사고 극히 적은 ... 그리고 차주한테 확실한 보상만 해준다면안전에 관한 기술이 엄청나게 발전 할 것임.현기는 이번 사고를 교훈 삼아서 더 안전한 자동차를 전 세계에 보급 해야 함,고라파l모델Yl동탄,2024-08-09 13:43:00
1533858,"EV6 사례를 교훈삼아 BMS업데이트를 꼭 해야한다고 생각합니다. 사고를 겪는건 안타깝지만, 이를 통해서 더 발전하고 더 나은 로직으로 빠르게 개선해 나가는 노력을 보여준다면, 소비자는 더 신뢰할 것입니다.",초보와이I모델YI미국,2024-08-09 14:00:00
1533858,뇌피셜은 일기장에…,은하철도999Iid4I인천,2024-08-09 14:16:00
1533858,"둘다 불난건 맞는데 어딜봐서 ev6가 더 심하다는건지,, 불 난뒤 두 차량 상태보세요 벤츠는 뼈대만 남았고 ev6는 거의 멀쩡",김타스I경북,2024-08-09 14:43:00
1533858,뭔 갑자기 벤츠 하부에 큰 충격있다는 뇌피셜을 서두부터 흘리고 시작하나요? 전혀 근거없는 얘기로 논점 흐리지 마세요.,경기l아이엑스오공,2024-08-09 14:45:00
1533858,글 첫부분부터 뇌피셜ㄷㄷ,메이플꿀l경남,2024-08-09 15:11:00
1533858,뇌피셜을 뭐이리 장황하게 풀어쓰셨나,차아일체I창원,2024-08-09 15:12:00
1533858,똥글인데 빨간줄까지 정성 ㅋㅋ,폴l아이오닉6l용인,2024-08-09 16:48:00
1533858,근데 이런 추측은 뭐하러 여기다 쓰는건지 모르겠네요. 혼자서 생각하면 되는거 아닌가요?? 여기가 개인일기장이면 상관없는데 회원수가 제일 많은 전기차 카페여서 논란이 되는것 같네요.,달콤해l타이칸l서울,2024-08-09 15:43:00
1533858,문제의 관점을 꿰둟는 좋은 글인거 같습니다배터리 불량이나 충격보다BMS가 근본적인 문제인데제조사들이 눈가리고 있는 듯 하네요80프로짜리차량으로는,q4etron세종시,2024-08-09 15:48:00
1533858,"ㅋㅋㅋ 참 왠만해서 이정도 수준의 글은 지나치려고 하는데. 1. 화재난 EV6가 아무런 외부 충격 받은 적도 없고 오로지 BMS 문제 근거는 있나요? 2. EQE는 배터리 잔량 얼마 상태에서 불 났대요? 이건 EV6 까려다가 EQE까지 맥이는 글인데 ㅋㅋ 그리고 두 차종 모두 판매대수 대비 지금까지는 주차, 충전 상태 화재 극히 적은 차들인데 뭘 이리 호들갑 떨고 글 적으신답니까? 테슬라 안전마진이 10% 초반정도로 E GMP에 대략 5% 수준에 비해서 2배 이상 큰데. 님이 게임에 능력치 10% 비유했듯이, 전체용량 대비 안전마진 크게 잡는 건 소비자한테는 좋은 게 전혀 아닌데요? 님이 말한 그 뽀인트가 님이 타는 테슬라는 이미 훨씬 크게 잡혀서 팔아왔는데 ㅋㅋㅋㅋㅋㅋㅋ 이건 몰랐나봄",독개구리l아6l부산,2024-08-09 16:59:00
1533858,뇌피셜은 혼자서 글 쓰시고 보세요. 근거도 없이 뭐가 더 위험하다 해대지 말고,아리지원I아5l경기,2024-08-09 17:08:00
1533858,상식적으로 전기차주분들은 하부충격시 걱정되서 떠봤을꺼임 정비이력없다면 충격없었다고 생각됨,소고기I오닉6I전남,2024-08-09 17:29:00
1533858,어정쩡한 지식이 더무섭다는말이 이런말아닐까요,식이lEV3l광주,2024-08-09 17:40:00
1533849,근데 저도 전기차 타지만 이게 최근 연식대비로 하면 조금 높긴 합니다..문제는 리콜된건 좀 조정 해야 할것같은데 리콜떄문에 더 높게 나오는거 같아요,대전ll흐구,2024-08-09 12:08:00
1533849,그러니까 그건 나중에 필요한 문제죠 지금 현상황은 내연노후차 화재위험이 훨씬 더 크다는 이야기가 펙트죠.전기차도 노후돼서 화재율이 높아진다는건 가정일뿐입니다.노후돼도 지금처럼 화재비율이 유지될수도 있구요~,초보자영업IID4I서울,2024-08-09 12:10:00
1533849,일어나지도 않은 일을 미리걱정해서 전기차 지하주차장 금지?라면 지금 현재 일어나는 노후차 지하주차장출입금지가 먼저겠죠~,초보자영업IID4I서울,2024-08-09 12:12:00
1533849,그렇다고 연식이 있는 전기차가 불이 더 많이 난다는 데이터가 없어요오히려 코나 사태이후 전체대비 화재비율이 내려가는 중,소멸은신I모델YI인천,2024-08-09 12:12:00
1533849,전기차도 사실 특정 모델이 초기에 많이 났습니다.그 모델들 걷어내면 줄어들거라..,코ITycanEtron55I인천,2024-08-09 12:13:00
1533849,연식이 있는차가 불이 많이 난다는 통계가 있으면 지하주차장에 10년 넘은 차들도 못들어 오게 해야 겠죠.,카노lQ4l인천,2024-08-09 12:17:00
1533849,그렇군요. 그런데 전기차화재가 폭팔력이 쎄고 소화하기가 어려우니 문제인것 같습니다.,포용IEVI용인,2024-08-09 12:08:00
1533849,그건 이미 스프링클러 미작동으로 종결되는 분위기죠~,초보자영업IID4I서울,2024-08-09 12:14:00
1533849,"폭발은 가솔린차도 납니다..소방서 화재실험에서는 같은 레이 전기차 및 가솔린차에 불붙이는데 전기차는 완충, 가솔린은 폭발 위험 때문에 고작 3L만 넣고 진행했습니다.빨리 불붙고 온도가 높은건 내연기관, 늦게 붙고 더 저온으로 오해 타는게 전기차입니다.실제 응축 에너지가 기름이 훨씬 큽니다.",적무화IiX3I경기,2024-08-09 12:40:00
1533849,전기차가 더 고온이쥬..ㅋ,포용IEVI용인,2024-08-11 12:18:00
1533849,전기차 온도가 더 낮습니다,적무화IiX3I경기,2024-08-11 12:28:00
1533849,이런글 때문에 조롱거리만.. 늘어나요 ㅠㅠ,하아lev6l경기,2024-08-09 12:13:00
1533803,차종 특정하면 그나마 다행인듯해요전기차 전체로 몰아가는 분위기도 있어서 ㅋㅋ,허니콤보IEV9I대구,2024-08-09 11:29:00
1533803,와.....ㅋㅋㅋㅋㅋ양심들 없으시네,츕파츕스IEQSI경기,2024-08-09 11:31:00
1533803,나만아니면 된다. 좋네요! ㅎㅎ,구스I이트론I인천,2024-08-09 11:32:00
1533803,카페 특성상 각각의 오너분들 생각이 틀림은 인정하나 외부에서 보면 전기차 모두가 잠재적 화재가능차라고 보고 있네요... 특정차 제한은 같이 죽자는 말같네요...,하율lEQEl인천,2024-08-09 11:33:00
1533803,음...이건 타른전기차 타는 사람 입장이고....같은 논리로...지하주차장에 내연차는 되는데...전기차를 금지 시키는 거죠..ㅠ.ㅠ,가온I경북,2024-08-09 11:33:00
1533803,극한이기주의라는 게 이런 거군요. 이런 분들이 있으니 내연기관 타는 사람들이 전기차 신나게 까는 거겠죠?ㅎㅎㅎ 수적으로 밀리는 전기차 차주들은 속수무책으로 당할 수밖에 없고요. 우리끼리 뭉쳐도 모자랄 판에 에휴...,피카츄IeqeI서울,2024-08-09 11:38:00
1533803,못 배운티 내지마시고 조용히 삭제하고 가세요 ㅋㅋ,힐스leqel대전,2024-08-09 12:23:00
1533803,왜 그런 생각을 못하실까? 우리나라에서 가장많이 팔린 전기차가 현대기아 전기차인데 그만큼 화재사고가 많아요^^ 이렇게 재수없이 큰 사고에 휘말리면 현대기아도 출입금지 당합니다 그럼 제조사에 항의할거에요!?,힐스leqel대전,2024-08-09 12:43:00
1533803,와 .. 진짜 당사자들 죄인 만드는거네요...,리우Ix3I전북,2024-08-09 11:31:00
1533803,bmw디젤 때 처럼 특정차종으로 제한하는가 보네요.파라시스 배터리라 좀 볼때 신경이 쓰이긴 하더라구요 근데 내연차던 전기차던 그렇게 하면 살아남을 차들이 없을텐데,망지I모델YI천안,2024-08-09 11:53:00
1533803,좀 있으면 금방 사그라 듭니다. 코나EV가 더 심했는데 ...그때는 전기차가 많지 않았어서 그런가?,개냐옹I아오5I천안,2024-08-09 11:32:00
1533803,그때는 전기차 수도 많이 없었고 초기라 생각하고 현기차면 그럴수 있지 라는 쪽에 사고들 피해가 이렇게 까진 크지 않았구요. 현대 대응도 좋았을겁니다. 사활걸기 시작한 사업이라.. 지금은 이미 이미지가 나빠진 상태에서 사고가 크게 터진 문제라.. 그냥 차량 몇대만 탔으면 이렇게까진 안됐겠죠,좀비성기사I니로I광주,2024-08-09 11:39:00
1533803,자기네들이 소방시설 문제없도록 관리하면 될텐데 뭔 짓꺼린지 참,금빛동전I오닉5I대구,2024-08-09 11:32:00
1533803,"이게 옳은걸까요,,,, 진짜 소방시설부터 관리 잘 하는게 맞다고 봅니다ㅠ",곧미녀IEQBI인천,2024-08-09 11:33:00
1533803,대의를 위해 소를 희생하는게 맞는건지...당분간 고생길이겠네요,화재보상I포터evI인천,2024-08-09 11:38:00
1533803,벤츠 차주들 억울하겠네 현기차 불날때 욕만했지 주차금지 이런얘기는 안했는데..다른 전기차 차주들이 나서서 이런 얘기를 하니...,보더스I예정I경기,2024-08-09 11:40:00
1533803,이 내용 언론제보 해도 될까요?,무사lEQS53l서울,2024-08-09 11:40:00
1533803,아니요…. 문제가 심해지는설 원치 안아요…. 아파트 마다 다 다르기때문에…,서울ll아우디e트론,2024-08-09 11:41:00
1533803,님이 원치 않으셔도 이 카페에 기자들 엄청 많이 들어와있는 걸로 알아요. 기사화되는 건 시간문제죠.,피카츄IeqeI서울,2024-08-09 11:42:00
1533803,"지하 주차장 특정 차량 불허는 노후차량, 내연차량, 하브차량, 전기차, 수소차 등 모두 차량에 적용해야 할듯..지하 주차장은 어린이 놀이터로 전용하면 폭염에 아이들이 뛰어다닐 공간으로 하는 것이 어떻신요?",전기 초보ID,2024-08-09 11:50:00
1533803,예전에 BMW 화재 때도 해당 제조사차량은 주차금지 했었는데 그때도 그리 오래가진 않았었던걸로 기억해요 이번에도 잘 마무리 되고 그런 편견없이 주차 편하게 했으면 좋겠네요,쩡I코나EVI제주,2024-08-09 11:56:00
1533803,그럴수도있다고 이해는됩니다 지상주차할 공간만있다면..,연군ㅣ볼트ㅣ경기,2024-08-09 12:12:00
1533803,저런식으로 대응하는건 무식한거죠 입대의가 꼰대로 구성되면 저렇게 됩니다,힐스leqel대전,2024-08-09 12:31:00
1533803,참…. 이상한카페네요… 여긴 전기차카페인지…. 아닌것 같은데요 ㅋㅋㅋㅋ 일인 시위하던 여성분 욕할게 아니였네요 저위에분… 쯧,행복매일IeqaI전남,2024-08-09 12:52:00
1533803,어우 진짜 멍청한 결단이네요. 화재시설이나 재정비하지…,후아lid4l경기,2024-08-09 13:22:00
1533803,다행히 저희 아파트는 그런 공지따윈없네요 휴~,스태틱IEQEI서울,2024-08-09 13:57:00
1533803,주차를 금지시는거라기보단 진상이 파악되고 벤츠코리아에서적절한 조치를 치해줄때까지 비교적 안전한 장소에 주차를유도한다는게 덜 자극적인 내용전달방법이지 않나 생각해봅니다.언제나 다음엔 내일이 될수있을거 같은...,봉우리l이트론SBl부산,2024-08-09 17:03:00
1533803,맞습니다 다음엔 어떤차가 될지 아무도 모르죠,행복매일IeqaI전남,2024-08-09 17:06:00
1533803,그나저나 벤츠의 지금 대응은 너무...아직까진 무책임하다고 느껴집니다...동종 배터리 탑재차량에 대해서 충전제한권고나긴급점검이라도 해야 하는거 아닌가 합니다.그래야 이대혼란이 그나마 진정되죠.,봉우리l이트론SBl부산,2024-08-09 17:08:00
1533803,맞습니다… 특히나 성격급한 한국에서… 너무 기다리기 힘드네요… 담주에는 뭔가 액션이 있겠죠….,행복매일IeqaI전남,2024-08-09 17:10:00
1533803,기계식도 안된다고 지상에 몇자리없는데 만들어주던데요.. 지상주차가 편해요~,빈스파더2,2024-08-10 10:32:00
1533803,허어..너무하네요,김해 마칸전기사,2024-08-11 18:12:00
1533627,나중에 에프터마켓 사업으로 베터리교환 하는 곳도 생길거에요.교환된 베터리 사양에 맞게 BMS 또한 만지는 곳 많이 생길듯합니다.,개냐옹I아오5I천안,2024-08-09 09:31:00
1533627,배터리 교환하는 순간 보상 물건너감요....우리나라 법이 그럼.,아싸I볼트I광주,2024-08-09 09:33:00
1533627,핵심은 사고 대비죠. 노후 전기차 얘기 하는건데 교환이나 보상 문제는 별 상관 없어 보입니다.,오니크크ㅣ서울,2024-08-09 09:36:00
1533627,보증이 지났으니 배터리 교환을 하겠죠,FSDI모델SI충청,2024-08-09 09:36:00
1533627,외국에서는 테슬라모델s 막 30만 타던데요??,멍멍이I모델3I수원,2024-08-09 09:36:00
1533627,국내에도 한 28만 타신분 있어요 타이어만 갈구요,FSDI모델SI충청,2024-08-09 09:36:00
1533627,"안전 사고에 대비 하자는건데 그게 큰 상관이 있을까요? 28만, 30만이 큰 표본도 아닌데.",오니크크ㅣ서울,2024-08-09 09:38:00
1533627,아 님이 말씀하신건 저도 필요하다고 생각하는데요 노후 전기차가 아직까지는 안전해보여서 한 말입니다,FSDI모델SI충청,2024-08-09 17:46:00
1533627,유투브 보심 코나 영업이 아닌 개인이 50만킬로 타시분도 있어요.엔진차 같음 쉽지 않을텐데 배터리는 오래 주행한다고 소음이 발생하는 것도 아니고 배터리 주행거리 좀 줄어든다면 충전 주기만 좀 짧아지면 되니 이론상으로는 엔진보다는 유리한 것 같아요. 단 화재만 안난다면요배터리 성능 저하 없고 브레이크패드도 교환 안해도 될 정도로 양호하데요,떡갈나무I오닉5I충북,2024-08-09 09:57:00
1533597,김필수 ㅇㅌㄱㅇ 가져오는건 거름,소멸은신I모델YI인천,2024-08-09 08:56:00
1533597,100% 충전한다고 불나면 제조사 책임이라고 생각합니다. 100%충전이 문제가 맞다면 주행거리 스펙늘리고 보조금 많이 빼먹으려고 제조사에서 안전마진을 너무 적게 설정한거 같아요.,차lgv60egv70ev6l광주,2024-08-09 08:59:00
1533597,극동의 합니다. 100프로 충전을 안전때문에 운전자가 선택해야하는 상황 자체가 말도안되는 논리입니다. 100프로 충전은 제조사가 홍보하고 판매한 주행거리입니다. 90프로 충전으로 낮춰야한다면 그정도의 보상이 필요하지 않을까요?,창원코나lgv60l창원,2024-08-09 09:02:00
1533597,맞습니다. 90%만 충전해야된다면 주행거리 과대광고나 다름없죠.,차lgv60egv70ev6l광주,2024-08-09 09:03:00
1533597,제조사책임이겠죠그런데 벤츠차주처럼 되면 제조사책임을떠나서 삶이 송두리채 없어질껄요?,리허설l양산,2024-08-09 09:11:00
1533597,"현기차가 안전마진이 적죠, 코나 사태도 그렇고요",여행I니로I경기,2024-08-10 08:29:00
1533597,그런데 애초에 과충전 방지를 위한 안전 마진이 있지 않나요?예전에 한참 불 나던 코나는 안전 마진이 3%였지만 최근 차량들은 거의 8~12% 가량을 마진으로 잡는다고 알고 있습니다. 이정도면 충분 할 것이라 보는데...,두세방I아5I서울,2024-08-09 09:00:00
1533597,금산 EV6도 안전마진 있겠죠,리허설lQ4l양산,2024-08-09 09:17:00
1533597,아 제 말은 안전 마진을 이미 제조사에서 충분히 잡았을텐데 100%를 충전 못하게 하는건 제조사 과실이라는 의미였습니다. 물론 유저들이 조심하는건 조심하는건데..안전 마진을 잡아두고도 80%까지 충전 해야 한다는 건 실제로 탑재된 배터리 대비 70% 정도 밖에 사용 못한다는 건데 이건 사실 거의 사기를 치는거나 마찬가지니까요.,두세방I아5I서울,2024-08-09 09:23:00
1533597,사기치는걸수도 있고 과대과장광고일수도있어요라텍스 침대 샀는데 라텍스 10%만들어있어도 라텍스침대닌깐요우리는 항상 그렇게 속아서 물건삽니다.,리허설lQ4l양산,2024-08-09 09:28:00
1533597,앞으로 차량 광고나 인증받을때 90%로 표시해야 될거 같네요. 옛낫 lpg차량들이 85%인가 그렇게 밖에 충전되죠.,카마니아lEV6l대구,2024-08-09 09:01:00
1533597,네 제차는 80% 권장한다고 떡하니 인포에 뜨네요,리허설lQ4l양산,2024-08-09 09:16:00
1533597,"김필수 교수 찾아보니 뭐 제대로 학문에 대해서 활동한건 없고 방송으로 교수행세 다닌거같은데요. 박병일 ""정비"" 명장이랑 동급",레토l아이오닉5l서울,2024-08-09 09:01:00
1533597,김필수 교수 저양반 며칠전에 김현정의 뉴스쇼에 나와서 이야기하는거보고 정말 깜짝놀랐습니다.일개 유투버들보다도 배터리 지식이 없는것같았어요.제조사 안전마진이 아예 없는것처럼 이야기하더군요.,코ITycanEtron55I인천,2024-08-09 09:06:00
1533597,하도 말들 많으셔서 김필수 뺐습니다.,리허설lQ4l양산,2024-08-09 09:16:00
1533597,본의아니게 스트레스 드리게되어 죄송합니다.,레토l아이오닉5l서울,2024-08-09 09:19:00
1533597,"좋으신 말씀입니다. 먼저 BMS에 문제가 있었다는게, 해당 제조사 배터리 관리 시스템 기술력에 신뢰가 안가네요.해당 제조사는 이일을 해결해야 될것이고, 사용자도 보수적인 입장에서 충전해야 겠습니다.",병아리l볼트EVl원주,2024-08-09 09:02:00
1533597,지금의 이 모든 사태가 제조사의 기술력 부족이라 볼수있으닌깐요어쩔수 없이 구매한 이상화재 안나게 탈 수 밖에 없는 상황이라 생각합니다.,리허설lQ4l양산,2024-08-09 09:15:00
1533597,그리고 배터리 표시할때 100퍼가 진짜 100퍼가아닙니다. 제조사가 마진을 둬요. 계기판상에서 저희눈에만 100퍼라고 띄워줄뿐,레토l아이오닉5l서울,2024-08-09 09:02:00
1533597,모르고 쓴글아닙니다,리허설lQ4l양산,2024-08-09 09:15:00
1533597,이런 글은 제조사가 소비자가 알아서 80까지 충전하니 우리는 거기에 맞게 개발해야지. 하게 만들어서 전기차 기술 발전을 저해하는 행위입니다.,소멸은신I모델YI인천,2024-08-09 09:03:00
1533597,테슬라도 어플에 평소 90% 충전하라고 나오지 않나요?,리허설lQ4l양산,2024-08-09 09:14:00
1533597,"저도 4개월정도 운행중인데 100% 완충은 딱 한번 강원도 여행에서 출발할때 97%, 돌아올때 100% 해봤고그 외에는 항상 80%로 진행하고있습니다.20%더 채우면 더 좋은건 맞는데 제 성격상 그게 아쉬웠으면 애초에 전기차를 안샀고 이트론은 더더욱 안샀을거라.. ㅎㅎ 그리고 하나 더, 충전이 완료된 충전기를 빼주는 운동은 어떨까싶습니다.그동안은 개인의 재산이라 강제로 빼는건 다들 부정적이셨겠지만 충전기만 빨리 뽑아도 상당히 도움이된다고들 하니까요.",코ITycanEtron55I인천,2024-08-09 09:05:00
1533597,네 장거리 100% 맞습니다. 쓰지도 않을꺼 100% 꼬박꼬박 채울이유 없죠,리허설lQ4l양산,2024-08-09 09:14:00
1533597,1분 남은상태에서 충전완료가 안되요.그래서 전 충전완료 10분전 알람오게 설정해놓구 사용중 입니다.,지워니IEV6I아산,2024-08-09 09:05:00
1533597,목표치는 100%네요,리허설lQ4l양산,2024-08-09 09:13:00
1533597,2시간 지난후 확인해도 충전완료 1분 표시됩니다 ㅠ,지워니IEV6I아산,2024-08-09 09:15:00
1533597,신기하네요,리허설lQ4l양산,2024-08-09 09:17:00
1533597,저도 그렇습니다에버온 충전기 사용중입니다표기는 100이지만 차에선 실제론 99.99고충전기에선 100근접시 전류를 아주 약하게 흘려보내서 이지 않을까요100인식시 차에선 충전전류 흘려보내던 말든 제어장치가 종료시켜버리고 충전기도 종료바 되겠지요 99프로 근접시 충전속도 확인해보면 좋겠네요,찬란한앵오,2024-08-10 04:33:00
1533597,왜 님 앱에선 충전속도 표기가 안나오죠,찬란한앵오,2024-08-10 04:32:00
1533597,100프로 설정에 100프로 충전 되있어서 그런듯요.100프로 전 충전중일때 6.9~7KW표시 됩니다,지워니IEV6I아산,2024-08-10 04:35:00
1533597,,지워니IEV6I아산,2024-08-10 04:35:00
1533597,저도 100퍼 충전시 항상 그래서.. 스캐너 차에 물고다니며 현재 완속 167회 스캐너표기는 항시 97.5로 충전되며 과충전은 전혀 없어습니다. 충전기마다 다를 수도 있으니 다른데 꽂아보시고 비교해보심이 충전기내에서 일부러 설정해놓은걸 수도 있고 일단 과충전시 강제로 차에서 전력차단하는 걸로 알고있습니다,찬란한앵오,2024-08-10 04:48:00
1533597,불안하시면 알람설정 30분 해두시고 30분알람오시면 바로 어플에서 종료 눌러버리세요 강제로 전력차단하며 충전기는 자동으로 종료됩니다,찬란한앵오,2024-08-10 04:49:00
1533597,일단 98%앱말고 100%앱 에 보이다시피 완속충전중 옆에 속도표기 없는거보니 전류는 흐르지 않으니 표기 안되는게 아닐까 생각해봅니다 아 요즘 앱 업데이트해서 충전중일때 색이 녹색표기 보이지죠 검은색표기는 충전중 메시진 있지만 실제론 전류가 흐르지 않으니 검은색이 아닐까도 생각해 봅니다,찬란한앵오,2024-08-10 04:54:00
1533597,회사 개인 충전기라 다른곳에서 충전 할 일이 없네요.이상한건 그전엔 100프로 완료 잘 되다 이번 iccu업데이트후 부터 그러니 답답하네요,지워니IEV6I아산,2024-08-10 04:54:00
1533597,회사면 눈떠 있을태니 충전이 몇분 후 완료됩니다 메시지보시면 그냥 종료 해버리세요,찬란한앵오,2024-08-10 04:56:00
1533597,네현재 10분전 알람오면 99프로 충전으로 나옵니다.커넥트 앱에서 충전종료 누르고 맘 편히 일하고 있습니다.,지워니IEV6I아산,2024-08-10 04:58:00
1533597,실제로 10분 후에 알림 오는지 확인하시고 당분간 90만 충전하시고 오토큐 한번 가셔서 점검 받으시고 스캐너 확인결과 확인하시고 모르겠다고 하는분들 많습니다 그럴땐 더럽다라도 센터로 증상말씀하시고 가심이 좋을 것 같습니다,찬란한앵오,2024-08-10 07:26:00
