post_id,cmt_content,cmt_author,cmt_created_at
1533597,현재 사용중인 스캐너입니다항시 온도와 셀 편차 보고 있습니다셀 이상일경우 그럴 수도 있을것 같지만셀 이상시 주행거리 말도안되게 적어지고 그렇다 들었습니다,찬란한앵오,2024-08-10 07:31:00
1533597,스캐너 구매 링크 알수 있을까요?,지워니IEV6I아산,2024-08-10 07:36:00
1533597,이보아 스캐너라고 검색하시면 됩니다 지금은 조금 비싸졌습니다,찬란한앵오,2024-08-10 07:47:00
1533597,거름,꼼질꼼질lGV60l고양,2024-08-09 09:07:00
1533597,바꾸고 김필수도 뺐습니다.,리허설l양산,2024-08-09 09:16:00
1533597,그럼 안전하게 타려면 30%~80% 구간(50%)만 쓰라는건데 이게 말이 된다고생각하시나요??,둥둥이ㅣ서울,2024-08-09 09:14:00
1533597,그럼 100% 타시면 되죠,리허설lQ4l양산,2024-08-09 09:17:00
1533597,조심해서 나쁠건 없죠^^ 저도 별 문제는 없었지만 완속100%에서 90%로 설정 변경했네요..장거리 뛸 일이 별로 없어서 그런것도 있지만,미래I아이오닉5I인천,2024-08-09 10:26:00
1533597,네 조심해서 나쁠건 없죠,리허설lQ4l양산,2024-08-09 10:28:00
1533597,저도 작성자님 생각에 동의합니다.제조사들이 한 번 충전에 몇 km 갈 수 있다를 경쟁적 마케팅 포인트로 삼아서 세일즈를 하다보니... 배터리 제조사들도 코발트 양을 줄이면서 리튬양을 경쟁적으로 늘리는 것도 비슷한 맥락인거 같고.과거 사례를 보면 이윤을 추구하는 기업 믿다가 큰 일 생긴 경우 많습니다. 기업은 늘 수익창출이 목적이니까..조심해야죠...,아우라lID4l서울,2024-08-09 11:23:00
1533597,차량설명서에 한달에 한번 100프로 충전하면 밧데리성능이 좋아진다고 적혀 있습니다,디노l니로l울산,2024-08-09 12:05:00
1533597,"완속 충전기에 타이머가 (계산기가 있으면 더좋구요 내차량 배터리 용량 및 잔여량) 있으면 좋겠습니다. 콘센트에도 타이머 콘센트가 있듯 , 타이머 설정 오류가 아닌이상 과충전에 대한 예방을 될것 같다는 생각입니다. 안전마진이 몇% 인진 모르겠으나.",핑lEV6l이천,2024-08-09 16:50:00
1533597,기아 커넥트로 완충시 알림이 오는데 최근엔 이상하게 충전완료시까지 10분 남았습니다. 이렇게 알람이 오곤하는데 실제로 충전이 완료되었다는 알림은 한~참뒤에오기도 하더라구요. 알림이 늦는건지 실제로 과충전이 일어나는건진 알수없습니다.집밥 먹일때도 이상하게 50%정도 충전하는데 10시간이 넘어서 완료됬다고 충전업체에서 알림오기도하고..5.5시간이면 끝나야 할시간인데,핑lEV6l이천,2024-08-09 16:53:00
1533597,에버온 충전기 사용중입니다충전할 때마다 충전종료 후 메시지는 한참뒤에 옵니다단지 과충전은 아닙니다스캐너 달고 눈으로 보고 확인중이며 과충전 한번도 없었습니다 현재 완속 167번충전 충전기 오류로 현재설정퍼센트보다 과충전시 차에서 강제로 종료해버리며 전력 차단합니다. 전력차단하는 순간 충전기는 자동으로 종료되고요,찬란한앵오,2024-08-10 04:42:00
1533597,"그러면 90퍼 설정시 93이렇게 까지 충전되시는분들은 왜그럴까요,, 통신오류일까요",핑lEV6l이천,2024-08-10 07:01:00
1533597,다시한번 찾아보고왔는데 대부분 iccu 업글받고 동일현상이 일어나고있다네요. 2~3퍼씩 과충전 글이 상당히 있네요 타카페입니다,핑lEV6l이천,2024-08-10 07:12:00
1533597,iccu저도 업뎃했는데 90퍼에 93퍼 이런적은 없어서.. 충전기 다른거 쓰시는게 좋으시거나 오토큐가셔서 bsm 인가 정확히 명칭을 모르겠는데 그거 점검말씀 하세요 과충전된다고 겨울철엔 온도 좋을땐 90퍼충전인데 갑자기 따뜻해져서 91퍼 이런분들은 만습니다,찬란한앵오,2024-08-10 07:18:00
1533597,"저도 평상시언 에버온이고 오늘은 부모님집 클린일렉스 맥여놓고왔는데,, 5시쯤 이제 10분 남았다 연락왔는데 지금도 충전중으로떠서 ...",핑lEV6l이천,2024-08-10 07:20:00
1533597,,핑lEV6l이천,2024-08-10 07:21:00
1533597,"충전 설정은 어플에서도 가능한가요? EV6 입니다, 아니면 차량에서 설정을 하면 되는지요?",즐I서울,2024-08-09 16:51:00
1533597,저는 어플은 없어서차량내에서 제차는 가능한데EV6도 가능하지 않을까요?,리허설lQ4l양산,2024-08-09 16:53:00
1533597,"넵, 차에서는 가능하네요~ 감사합니다.. 어플은 확인해도 자주 사용을 안해서 잘 모르겠습니다..;;",즐I서울,2024-08-09 16:56:00
1533597,어플에서도 가능합니다. 더보기란에 ev 서비스 보시면 목표 배터리량 설정있습니다.,핑lEV6l이천,2024-08-09 16:57:00
1533597,어플로 변경시 배터리컨디셔너 풀려버립니다.차에 다시 가셔서 체크 되있나 확인하심이 좋습니다 컨디셔너가 겨울철에만 생각하시는데 배터리 온도 40도 이상 올라가면 서서히 안좋아진다 합니다 이여름날씨에 차오래운행하시면 36도 이상 되시는데 냉각수가 조절하긴 하는데 혹시 이런날씨에 고속이나 초고속물리면 배터리온도 40넘어갈 때 있습니다 배터리 컨디셔너가 이럴때 빨리 냉각수 기능 잘하도록 여름철도 관여한다 들었습니다 실제로 스캐너엔 41도 찍었는데 10분 운행중 36도로 바로내려가고 30분후 32도로 가더군요 신기했습니다.,찬란한앵오,2024-08-10 07:56:00
1533597,기계공학과 나오고 생산라인 설계쪽에서 일했던 사람으로써 나름 배터리회사쪽에서 들은게 있어 동의합니다.현재 NCM리튬이온 배터리들의 한계라고 보면되죠ㅠㅠ,파비오IEV6I수원,2024-08-10 14:56:00
1533597,"솔직히 내연기관탈땨도 남은 주행거리 100km미만 될때 5~7만원정도로 주유하고 가득 채운적은 한번도 없었음. 연료량이 20~80,90퍼 안쪽으로 채우고 운행해야 좋다고 들어서 물론 지금 바꾼 전기차 이슈 전에도 그렇게 해오고 있으며, 급속 80 완속 90으로 설정해놓음",에라이ㅣEV6ㅣ전주,2024-08-10 22:10:00
1533597,ncm은 그렇겠지만 lfp는 제조사에서도 최소 주1회는 100프로 충전 권장합니다. 우리끼리라도 구분할 필요가 있겠습니다.,지미l모델Yl경기,2024-08-11 14:23:00
1533578,리콜때리고 영구보증형태는 가능할수도 있는데교환은 글쎄요,엘리트I서울,2024-08-09 08:39:00
1533578,가장 최악의 대처는 교환 안해주는거죠.그럼 EQB 차주분들은 그 차에 자녀와 와이프 혹은 다른 사람을 태우고 운전할수 있을까요 ? ㅜㅜ모든 전기차가 다 비슷한건 알지만 이번 화재가 워낙 임팩트가 있는 큰 사건이라조금 더 주목받고 그 중심에 벤츠가 있어서 안타깝습니다.,별나무lQ4l안양,2024-08-09 08:42:00
1533578,가족들태우고 전기차탄다라... 책임앖는쾌락..,인트론IIev9II대전,2024-08-09 08:40:00
1533578,본인은 ev9을 혼자타세요?,동나파lEQSe208l인천,2024-08-09 08:44:00
1533578,;;;;;,벨로즈I서울,2024-08-09 08:44:00
1533578,"네 전혼자타고 결혼,자녀낳을시 카니발탈예정입니다.",인트론IIev9II대전,2024-08-09 08:52:00
1533578,차인증도 하지 않으셨네요. 카니발 화재도 많은데 조심하세요^^ 걸어다니시는게 나으실듯...,동나파lEQSe208l인천,2024-08-09 08:54:00
1533578,교체는 비용이 어마어마해서 점검정도로 끝내지 않을까요,앵글러IeGV70I구미,2024-08-09 08:40:00
1533578,코나정도로 불 나야 교체 해 줄겁니다.,개냐옹I아오5I천안,2024-08-09 08:42:00
1533578,교환 안해줄겁니다.벤츠가 해줄놈들이 아님,벤츠EQCI광주,2024-08-09 08:42:00
1533578,사견입니다. 배터리 분리막 등 배터리 문제 일 경우 같은 배터리 사용하는 EQE 전수 정밀 검사 후 문제시 교체해주지 않을까요 ?,델마IEV6 모3l부천,2024-08-09 08:44:00
1533578,완전한 배터리 결함으로 결과가 나오지 않는한.. 1건으로는 전체 교환까지 해줄지는 잘모르겠네요.,레바IEQESUVI경기,2024-08-09 08:45:00
1533578,문제가 있으면 리콜해서 교체해주지 않을까요? 저도 볼트탈때 어느정도 규모였는지 모르겠는데 연식별로 나눠서 엄청 많이 교체해줬는데요… 조사 결과를 봐야겠네요… 에휴..,호두lEQAl경기,2024-08-09 08:45:00
1533578,코나때처럼 해줘야하는게 아닌지..,에스I아이오닉5I경기,2024-08-09 08:46:00
1533578,절대 안해줍니다 ㅋㅋ bms 업데이트 해주고 이제 불안납니다 ~ 안심하세요. 100% ...,레딧Ii4I송도,2024-08-09 08:50:00
1533578,222,연군ㅣ볼트ㅣ경기,2024-08-09 09:30:00
1533578,베터리를 속인거 제외하고 첫화재입니다.냉정하게 코나정도로 되야 전체 교체갈겁니다.제 생각은 하부충격이 있었을거 같네요.그냥 난거면 3000대중 벌써 몇백대는 터졌겠지요.딜러한테 연락온게 모든차종 재고소진후 주문생산만 받고 할인 줄인답니다.팔아봤자 손해고 친환경 대수는 하이브리드로 채우겠죠,민leqsev6l서울,2024-08-09 08:58:00
1533578,eqe는 판매한지얼마되었나요? 구코나는 3ㅡ4년차에 집중적으로 터진거같은..,연군ㅣ볼트ㅣ경기,2024-08-09 09:32:00
1533578,저런 싸구려 배터리를 넣었는데 팔아서 손해라는건 이해가 안되는부분이네요 ㅋㅋ,썬더l충남,2024-08-09 09:43:00
1533578,"리콜비용이 가늠할수 없을정도라서 불가할거 같고, 같은 배터리 장착된 차종의 유저라면 ㅂㅊ코리아로부터 배터리 화재시 전부 책임 진다라는 각서정도는 받으서야 하는거 아닐지요. 그래도 불안한데 말이죠.",썬더l충남,2024-08-09 09:42:00
1533578,지금도 BMS리콜로 때우고 있는 중인데 대응할 방법이 없네요 배터리 제조사도 바로 안알려주니 입대위나 주위에 항변할 방법도 없네요,준에보IEQElEV9l용인,2024-08-09 09:45:00
1533578,벤츠 차주 분들 모두 모여서 본사 앞에서 시위라도 해서 뭔가 목소리를 내야하지 않을까요? 이대로 대처만 기다리기엔….,마린보이l예비l경기,2024-08-09 09:45:00
1533578,아직 제대로 된 결과도 나오지 않았습니다.,동나파lEQSe208l인천,2024-08-09 10:17:00
1533578,동나파님도 EQS 운행중이신거 같은데 .... 향 후 계획은 어떻게 되시는지요?,규버늼,2024-08-09 10:48:00
1533578,네 맞네요. 확실한 조사로 정확한 결과와 적절한 조치가 되기를 바랍니다.,마린보이l예비l경기,2024-08-09 10:50:00
1533578,위에 댓글대로 아직 제대로 된 결과가 아무것도 없습니다. 단지 추측일뿐 화재 난 차량과 같은 차량도 아니며 사용자의 과실인지 배터리나 차에 문제인지 모릅니다. 결과보고 진행해도 무리없을듯 합니다.,동나파lEQSe208l인천,2024-08-09 12:59:00
1533526,안팔리면 재고쌓이면 할인하지않을까요 올해초처럼,덕덕구스l오닉5I부산,2024-08-09 07:29:00
1533526,아마엄청 토할듯..하지만 당분간못산다는 ㅜ.ㅍ,자마I뉘로l평택,2024-08-09 07:48:00
1533526,취소하고 연말 기다려보셔요,쭈쭈ev6충남,2024-08-09 08:03:00
1533526,현대차 화와이 3박4일 숙박권 추가로 준대요,미경이당l코나l충북,2024-08-09 08:11:00
1533526,ㅋㅋㅋ 비행기 표는 각자 사서 ? ㅋㅋㅋㅋㅋ,별나무lQ4l안양,2024-08-09 08:27:00
1533526,이미 보조금이 지역별로 없는곳도 있습니다.,별나무lQ4l안양,2024-08-09 08:27:00
1533526,할인 많이 해줘도 돈이 없어요 ㅜㅜ,한우사장님l용인,2024-08-09 08:40:00
1533526,이번에 벤츠덕인지 역대급 재고쌓일듯 내년상반기까지ㅡㅡㅋ 코페 전기차페스타 기타등등 할인할듯 그래도 기존전기차기변정도지 일반차주들은 구매꺼릴듯,연군ㅣ볼트ㅣ경기,2024-08-09 10:04:00
1533526,코나 뽑은지 얼마 안되는데 눈물납니다 ㅎㅎㅎ,아르마다Iioniq5I경북,2024-08-09 13:20:00
1533416,"많이 있습니다... CATL과 BYD서 공급받습니다. 니로, 코나, 레이, 코란도, 토레스... 이중 레이, 코란도, 토레스는 LFP이고요.",아담이l레이l경기,2024-08-09 01:03:00
1533416,현행 니로EV와 캐스퍼 일렉트릭은 CATL사의 NCM 배터리 입니다.레이는 CATL LFP / 토레스 EVX 및 코란도 EV는 BYD LFP가 들어가구요,월급쟁이I없음I천안,2024-08-09 01:19:00
1533416,캐스퍼 엘지꺼로 알고있는데요?,제리I오산,2024-08-09 06:53:00
1533416,캐스퍼 ev3와 동일배터리요,페르마타IEV6I대구,2024-08-09 08:31:00
1533416,중국산 배터리 문제라기 보단 NCM 배터리의 열폭주 현상이 근본적인 문제라고 보면 됩니다.LFP 단점도 많지만 안전 측면에선 NCM대비 어나더 레벨입니다.,전기차ㅣ인천,2024-08-09 01:23:00
1533416,2222222222222,은호I트론q4아6I원주,2024-08-09 05:07:00
1533416,지금은 진실보다는 중국 베터리라는게 문제죠. ㅜㅜ 안타까운 현실입니다. 태풍은 피하고 봐야죠,별나무lQ4l안양,2024-08-09 08:18:00
1533416,토레스와 레이 그리고 국산차는 아니지만 판매량 1등 테슬라 모델Y가 중국산 LFP 배터리입니다.우리나라에서 아직까지 위의 모델들 화재사고 단 한건도 없습니다.중국산이라고 후려치시는분들 보면일본이 한국산이라고 후려치는 모습과 똑같아 보이는게 안타깝기도 합니다.,얼큰이I고양,2024-08-09 15:16:00
1533369,뒤숭숭한 시기에 현명한 결정 박수보내드립니다. 안전운전하세요!,파생상품I인천,2024-08-08 23:19:00
1533369,감사합니다 ㅎㅎㅎ 그냥 타보고 싶은걸로 가자 싶어서 구매햇습니다 ㅎㅎ,윤쓰I코나evI부산,2024-08-08 23:27:00
1533369,금방 적응 하실 겁니다ㅋ,차크닉IGV60I일산,2024-08-08 23:27:00
1533369,한번씩 손이 방황합니다 ㅋㅋㅋ 감사합니다,윤쓰I코나evI부산,2024-08-08 23:28:00
1533369,허벅지밑에 손 깔아두세요.. 축허드려요🥹,하지만없죠I코나l경기,2024-08-08 23:46:00
1533369,ㅋㅋㅋㅋㅋㅋㅋ 거기 두먄 되눈가보구요 ㅋㅋㅋㅋㅋ 예상치 못한 답변에 웃고 갑니다 ㅎㅎㅎ감사합니다,윤쓰I코나evI부산,2024-08-09 10:42:00
1533369,축하드립니다,용I코나SX2I시흥,2024-08-09 00:22:00
1533369,감사합니다 ㅎㅎ 안전운전하세요,윤쓰I코나evI부산,2024-08-09 10:43:00
1533369,축하합니다 저두 저 컬러 코나입니다만족하고 있어요,와인글라스창원,2024-08-09 00:53:00
1533369,생각보다 깔끔하니 이쁘더라구요 ㅎㅎㅎㅎ 마음에 쏙 듭니다 ㅎㅎ,윤쓰I코나evI부산,2024-08-09 10:43:00
1533369,저도 똑같은 코나차입니다. 만족합니다,금원산,2024-08-09 05:04:00
1533369,길에서 같은 코나 차량보면 반갑고 그렇네요 ㅎㅎ,윤쓰I코나evI부산,2024-08-09 10:45:00
1533369,Catl 523 매우 안정적인 배터리 입니다. ~~,안양모델Y로비킨,2024-08-09 10:38:00
1533369,저도 막 찾아보고 했는데 최근 화재나는 차량들의 베터리가 811 즘되는 높은 사양의 차량들인거 같더라구요 물론 아닌 경우도 앗겟지만 ^^;; 조심히 오래타보려구 합니다 ㅎㅎㄹ,윤쓰I코나evI부산,2024-08-09 10:45:00
1533369,예쁘네요. 저도 기어봉 적응기가 필요했어요.,래빝,2024-08-09 12:57:00
1532897,해당 기사 링크좀 알수있을까요?,뿌물liX3레이l경기,2024-08-08 16:19:00
1532897,https://www.incheonilbo.com/news/articleView.html?idxno=1261377,그랜져없음I충북,2024-08-08 16:42:00
1532897,입대의에 이런거 적극홍보해야합니다,초보와이I모델YI미국,2024-08-09 00:10:00
1532863,그냥 남들이 올리는글 읽으면서 거를건거르고 참고할건 참고하는게 제일 인것 같네요 뻘글 올리는 사람보면 다들 등업하려고 올리는 사람같아요,우와앙IEQAI경기,2024-08-08 15:33:00
1532863,맞아요. 등업 때문에 억지로 올리는 영혼없는 막글 너무 많은 것 같습니다 ㅜㅜ,완속IEV3I경기,2024-08-08 15:32:00
1532863,불안감을 유발하는 검증되지 않는 글들도 많이 올라와서 피곤을 유발하네요.,좀비성기사I니로I광주,2024-08-08 15:36:00
1532863,좀더 기다리세요 좀 가다가 조용해지고 한건씩 가끔올라올겁니다 ㅎ,아이폰ㅣ아5ㅣ안산,2024-08-08 15:38:00
1532863,한동안은 계속 이러지 않을까싶네요. 전기차에 대한 불만들이 이번 사건으로 터진게 아닌가 싶습니다.,좀비성기사I니로I광주,2024-08-08 15:46:00
1532863,계속 터지는 기사 내야 인이 박혀 다들 관심에서 멀어져요 ..ㅎㅎ 계속 기사 내주세요 기레기님들,조지브라운I 서울,2024-08-08 15:43:00
1532863,한동안은 계속 공격거리가 될거같습니다. 대중이 익숙해진만큼 전기차에 대한 안좋은 인식도 예전보다 높아진 상태로 유지 될것 같습니다,좀비성기사I니로I광주,2024-08-08 15:47:00
1532863,저희 아파트는 아무런 제스쳐도 없네요. 신식 아파트는 지상 주차공간이 없어서 싸워봤자 방법이 없어요,조지브라운I 서울,2024-08-08 15:53:00
1532863,소방시설 점검 및 대비와 충전완료시 이동 권고정도가 정상적인 대처라고 생각합니다만 세상사 이성적으로만 돌아가진 않으니까요.,좀비성기사I니로I광주,2024-08-08 16:38:00
1532863,공감합니다.,굿즈I 아5 l대구,2024-08-08 16:19:00
1532828,"선생님, 놀랍게도 여기는 전기차 카페랍니다...!",순돌이I코나I대전,2024-08-08 15:02:00
1532828,전기차카페지 화재토론장이 아닙니다만...화재 위험도 충분히 다 이번사건으로 인지 했구요,초보자영업IID4I서울,2024-08-08 15:03:00
1532828,각자 걱정되니까 얘기하는걸 뭐 어쩌겠습니까.코나 화재로 난리났었을 때는 이거보다 더했답니다......,순돌이I코나I대전,2024-08-08 15:04:00
1532828,그렇군요 뉴비라 몰랐네요~,초보자영업IID4I서울,2024-08-08 15:04:00
1532828,잊를만하면 꺼내고하네요 ㅋ,청풍lEV9GTLl울산,2024-08-08 15:02:00
1532828,설탕으로 불끄기 ㄷㄷㄷ,빠떼리I모XI세종,2024-08-08 15:02:00
1532828,그만큼 전기차 사용자들에게 큰 이슈고 끝나지 않는 일이 있으니까 계속 이야기가 나오는 거죠 전기차 카페에 모여서 방탄이야기나 하자는 겁니까,코끼Ii3I서울,2024-08-08 15:08:00
1532828,방탄이야기를 하자는게 아닌데요 충분히 다 인지했는데 화재사건 복붙만 하고 걱정글만 올라와서 해본 말인데요.계속 그런글만 올리면 뭐가 달라지나요?불안감만 커지지 않을까요?어떤 도움이 되는지 궁금하네요~,초보자영업IID4I서울,2024-08-08 15:10:00
1532828,어그로들도 몰리고 있어요.,소멸은신I모델YI인천,2024-08-08 15:12:00
1532828,아 그런가 보네요~,초보자영업IID4I서울,2024-08-08 15:13:00
1532828,문제점이니 보완되기전까지 화재이야기는 끝나지않을거에요,아리아I아이오닉I청주,2024-08-08 15:12:00
1532828,그러게요 ㅋㅋㅋㅋ 다른데는 연예 이야기 하는데 여기만 다른 세상 😆ㅋㅋ ㅎㅎ,뽕알밑쉰내ID4l서울,2024-08-08 15:14:00
1532828,"주차금지, 이동 등 생활에 변화가 생기니 그럴 수 밖에요. 예전 코나때는 잘 모르지만 생활의 변화는 없었을 것 같습니다.",잼프l볼트ev6l경기,2024-08-08 16:06:00
1532823,해야죠 현대도 코나 배터리 새거로 다 리콜해줬자나여,리브레lEQAl평택,2024-08-08 15:03:00
1532800,전기차 이미지는 우리 전기차동호회에서 만들어갑시다...당신이 망치는중임..,로버l오닉5l인천,2024-08-08 14:43:00
1532800,ㅇㅈㅋㅋ본인이 눈치보이면 내연기관으로 바꾸면되는것을...,강쥐Iid4I경기,2024-08-08 15:07:00
1532800,지상주차장이 엄서요,송이글lev6l동탄,2024-08-08 14:44:00
1532800,없으면 외부월주차하세요... 저도 회사사옥 지하밖에없어서 외부월주차 계약했습니다,콜렉터l타이칸l판교,2024-08-08 14:45:00
1532800,싫은데여. 집에서 가장 가까운 주차장이 3km 시청주차장인데요.,송이글lev6l동탄,2024-08-08 14:47:00
1532800,미국 같이 땅이 넓으면 되겠지만 그게 아닌 상황에서 외부 주차 강요는 그냥 타지말라는 거나 마찬가지지요 지킬 수 있는 일을 가지고 얘기를 하셔야지,테리lQ4l서울,2024-08-08 15:09:00
1532800,최대한 이웃들 불편하지 않게 해야겠지만 글타고 집 놔두고 외부월주차까지 해야하나요?전기차 배터리 개판으로 만든 넘들이 잘못인데 소비자가 무슨 죄를 지었다고 이렇게까지 해야하나요.아파트 주차장 놔두고 월주차까진 오바 같아요. 월주차장에는 다른 차 없습니까..,올더타임lgv60ev9서울,2024-08-08 15:11:00
1532800,인정. 지상 주차장이라곤 세 자리 정도 있는데 다 장애인 주차구역이네요. 뭐~ 전 지상에 주차하라면 하려고요. 지상에는 애들 때문에 위험하다고 오토바이도 못 다니게 하는데 얼씨구나 주차하죠. 뭐,국남ㅣ모델3ㅣ경기,2024-08-08 16:15:00
1532800,어그로 표시,소멸은신I모델YI인천,2024-08-08 14:44:00
1532800,인증점..,대전ll흐구,2024-08-08 14:44:00
1532800,자. 이제 타이칸 투리스모부터 인증해보자.인증부터 박고 글쓰지않으면 영원한 구라쟁이가 될뿐이다~,미니Iix3I파주,2024-08-08 14:44:00
1532800,지상에 주차장 없어요..,영우I ID4 I인천,2024-08-08 14:44:00
1532800,님 모델X든 타이칸이든 인증좀요??????????????인증없이 똥글은 그만쓰시고.....,아잉훗Ii4I성북,2024-08-08 14:44:00
1532800,차 인증이라도 해야 카페분들이 글이라도 읽으실 듯ㅋㅋ 의견이 될 지 허언증 환자가 될 지,레쓰비I코나I대구,2024-08-08 14:45:00
1532800,인증했나요?아닌거 같은데 말이죠 판교어디 사나요?메인배터리 얼마짜리 쓰는지 아세요?,다다익선IEv6I의왕,2024-08-08 14:45:00
1532800,이사람 아직도 차단 안하신분 없죠??,빠떼리I모XI세종,2024-08-08 14:45:00
1532800,이분 영자님이 활동정지 했습니다 ㅎㅎ,혜성처럼I모델3YI경기,2024-08-08 14:48:00
1532800,마트/영화관/백화점 이런 지하주차장도 이제 못 가시겠네요 ㄷㄷ,아리랑I모델YI대구,2024-08-08 14:45:00
1532800,타이칸은 누가 안전하다고하나요 ㅋㅋㅋ,애진이네IEV6I안산,2024-08-08 14:46:00
1532800,내글로 돌아와 임마 어디가,진급누락아6I세종,2024-08-08 14:46:00
1532800,보통 핸들손잡이 + 아이디적은 종이 정도로 인증해주시면 약간의 믿음이..,와우l아이오닉5l광주,2024-08-08 14:47:00
1532800,자기 생각을 남에게 강요하지마요 알아서 잘하시면됩니다 스프링클러도 없이 밖에 주차해서 아파트 외벽부터 홀라당 태우시면 안되니 차 폐차하시는게 답이아닐까요? 차량 인증 좀 해주세요,엘앰오십I아5I파주,2024-08-08 14:48:00
1532800,문제는 이런사람이 네이버댓글만봐도 차고넘친다는거죠,양양희I타이칸I대전,2024-08-08 14:48:00
1532800,1. 타이칸 인증 해주세요2. 지붕 있는 지상 주차장 만들어주세요,삐뚤IEV6I아산,2024-08-08 14:48:00
1532800,이분 영자님이 활동정지 했습니다 ㅎㅎ,혜성처럼I모델3YI경기,2024-08-08 14:48:00
1532800,"고소먹고 벌금, 민사걸려 손해배상 할려면 타이칸 팔아도 모자랄 듯 ㅋㅋㅋㅋ",금빛동전I오닉5I대구,2024-08-08 14:49:00
1532800,ㅋㅋㅋㅋ 어그로는,청주IEQBI청시,2024-08-08 14:50:00
1532800,몇댸 않팔리는 차량이라서 불이 않나지 않았나요 비싸서요 글케 따짐 제네시스 전기차들도 화재 이슈 없던데요 이런글 올리실 필요가 있나요 분탕질인가요,쭈쭈ev6충남,2024-08-08 14:51:00
1532800,더위많이먹은듯 ㅋㅋㅋ,하임Igv60퍼포I대전,2024-08-08 14:51:00
1532800,구조적 결함이네요,아얼I볼트오닉5I서울,2024-08-08 14:52:00
1532800,어그로 오지네요,꼼질꼼질lGV60l고양,2024-08-08 14:52:00
1532800,ㅋㅋㅋㄱ아니 어이가없네왜 아예 밖에 나가지도 마시지그래요교통사고 날지도모르는데,전준태l충남l아오5,2024-08-08 14:54:00
1532800,타이칸 지상주차 하는것만 올리셔도 믿을텐데 멋진 타이칸 인증좀 해주세요,컴초I아이오닉5NI김포,2024-08-08 14:55:00
1532800,호구인증,소년lGV60l충남,2024-08-08 14:58:00
