post_id,cmt_content,cmt_author,cmt_created_at
746721,급발진이란 단어가 필요없는 세상이 왔으면 좋겟어요....,꿈같은시간I경기,2021-12-20 14:37:00
746721,급발진 걱정되면 그냥 전기차 안사면 됩니다~ 이런 질문 올려봐야 댓글 달리는건 뻔해요 ㅎㅎ,원오빈I오닉5I진주,2021-12-20 19:22:00
742785,전용이 공간이 잘나와 좋긴한데 그냥 좋은차는 전용 아니어도 좋다가 요즘 의견이네요.g80 예로 들면서 그렇게 설명하드라구요,크리스l니로모Yl경기,2021-12-14 10:18:00
742785,중요하죠. egmp 아닌차는 무조건 거릅니다,귀연lgv60l부천,2021-12-14 10:34:00
742785,중요한 이유 좀 알려주세요,호피다l서울,2021-12-14 10:36:00
742785,공간감. 주행거리. 충전속도가 좋은걸로 압니다.,귀연lgv60l부천,2021-12-14 10:39:00
742785,아 그렇군요 감사합니다,호피다l서울,2021-12-14 10:49:00
742785,공간감과 배터리를 위한 안전한 설계가 장점이지 주행거리와 충전속도는 무관합니다,gv60스타박스부산,2021-12-14 13:28:00
742785,,귀연lgv60l부천,2021-12-14 13:38:00
742785,이것은 egmp의 장점이죠 폭스바겐그룹에서쓰는 meb플랫폼은 충전속도 느립니다,gv60스타박스부산,2021-12-14 13:42:00
742785,egmp아닌건 거릅니다. 라고 덧글 썼는데요. 그래서 egmp장점 쓴거구요. 폭바는 관심밖이라 잘 모르겠네요,귀연lgv60l부천,2021-12-14 13:44:00
742785,e g80은 전용플랫폼 아니죠? 주행거리 떨어지던가요?,gv60스타박스부산,2021-12-14 13:44:00
742785,밧데리가 큰거 들어가잖아요.,귀연lgv60l부천,2021-12-14 13:45:00
742785,질문하신분이 국산차기준으로 물어보신게 아니잖아요,gv60스타박스부산,2021-12-14 13:47:00
742785,바뻐서 잘 못봤네요.,귀연lgv60l부천,2021-12-14 13:47:00
742785,저도 아무래도 전기차 전용플랫폼이 아니면 꺼려지더라구요...,구조급IGV60Q4I동탄,2021-12-14 10:22:00
742785,왜 그런지 말씀 좀 해주세요~,호피다l서울,2021-12-14 10:36:00
742785,배터리를 넣을수 있는 공간 확보를 하며 실내공간 설계를 한 것 및 배터리 보호를 최적화한 설계 등등 부터가 일반 내연기관 설계 한 차들과 다르다고 생각하거든요!,구조급IGV60Q4I동탄,2021-12-14 10:45:00
742785,아 그렇군요. 감사합니다~,호피다l서울,2021-12-14 10:54:00
742785,"전혀 중요하지 않습니다.운전자, 탑승자가 느끼는게 중요한겁니다.단점이 무엇이냐 물엇을 때 공간이 부족하다고 말한다고 하지만, 실 사용자와 탑승자가 못느낀다면 문제가 없는겁니다.무조건 전기차 플랫폼이어야 한다는 사람의 말을 믿지 마세요. (제대로 알지도 못하는 사람이 대부분,....)",수원l대우,2021-12-14 10:30:00
742785,헐~~ 중요하지 않다는 분은 첨 보네요. 제대로 알지 못하다뇨. ㅎㅎ,귀연lgv60l부천,2021-12-14 10:32:00
742785,"혹시, 전문가이신지요!??",수원l대우,2021-12-14 10:32:00
742785,이렇게 나오시면 할말이 없네요.,귀연lgv60l부천,2021-12-14 10:34:00
742785,"결국, 제 말이 틀린게 없네요.",수원l대우,2021-12-14 10:35:00
742785,혹시 전문가 이신가요?!,구조급IGV60Q4I동탄,2021-12-14 10:43:00
742785,"전문가 까지는 아니지만? 관련 업계 종사자이기에 많이 접했네요. 국내 양산 전기자동차(EV, PHEV) 설계 경력 입니다.",수원l대우,2021-12-14 10:45:00
742785,관련업계 종사자이시면 더더욱 전혀 중요하지않다고 당당하게 말하실수 없다고 생각하는데요... 단순히 실사용자가 문제를 못느낀다면 괜찮은걸 왜 제조사들이 막대한 예산 쏟아가며 전기차 전용플랫폼을 만드나요? 일반 내연기관 차들 가져다가 쓰면되는걸...,구조급IGV60Q4I동탄,2021-12-14 10:50:00
742785,만년필을 쓰나 수성펜을 쓰나 중요한가요?? 저는 실 사용자 입장으로 말씀드리는 것 입니다. 제조사가 왜 전용 플랫폼을 개발했냐고요? 하부 배터리 부착에 의한 강성 높이기 말고는 없다고 보셔도 무방합니다. 결국 마케팅입니다. 전용 플랫폼이 적용된 전기차. 그럴듯해 보이죠. 더 잘 팔리죠.,수원l대우,2021-12-14 10:55:00
742785,"실사용자 입장이라고만 하면 뭐 할말 없지만 저는 전기차 전용 플랫폼으로 나온차들이 충돌안전성 및 전후 무게배분, 실내공간 설계등등 이 내연기관 플랫폼 전기차들보다 훨씬 낫다고 생각하거든요. 이런저런 정보 알려주셔서 감사합니다ㅎ",구조급IGV60Q4I동탄,2021-12-14 11:01:00
742785,배터리의 구조와 위치가 적절하지 않아서 전기/전자 장치를 억지로 꾸겨넣어야 합니다.. 당연히 효율이 좋지 않고 그로인해 문제점이 발생할 수 있지요기존 내연차 플랫폼을 배터리 등의 장치를 위해 개조해야 됩니다 내연차 완성차로 만들어진 안정성이 모두 깨지겠지요전용 플랫폼이 아니더라도 잘 만들 수는 있겠지만동등한 상황이라면 전용플랫폼이 더 나을 수 있겠습니다,블랙쿱I아5l경기,2021-12-14 10:38:00
742785,말씀 감사합니다,호피다l서울,2021-12-14 10:38:00
742785,"억지로 욱여넣을 수 있는 유연한 전기/전자 장치가 있나요?? 그렇게 유연한 전기 장치는 아직 플렉서블 버스바 밖에 없으나 현재 시판중인 전기차에는 적용된 경우가 없습니다.LayOut은 기존의 내연기관 플랫폼에 공간 효율을 높여서 작업 하지만, 발열부위, 교체부위 등은 약간의 공간을 두고 설계 합니다. 배터리 모터 효율은 전혀 상관이 없습니다.내연기관 플랫폼은 전기장치를 위하여 개조되지 않습니다. 플랫폼 설계 비용은 무지막지하죠;;;안전성은 배터리 화재 및 폭발 외에는 문제 될 것이 없습니다. 엔젠룸에 모터가 들어가기 때문에 어차피 정면 추돌 시 발생하는 오버랩은 내연기관차와 동일하게 필요합니다. 문제는 하부 및 후미의 배터리 화재가 관건이겠죠;;;",수원l대우,2021-12-14 10:44:00
742785,물리적으로 욱여넣는다는 말이 아니고 원래 내연기관 레이아웃에 맞춰서 넣는다는 말씀같으신데요... 솔직히 내연기관 베이스는 센터터널같은게 남아있잖아요. 이런 남는 공간부터가 전용 플랫폼과 차이라는거죠,구조급IGV60Q4I동탄,2021-12-14 10:47:00
742785,"네, 글 수정해주신 마지막 문단에는 공감합니당",수원l대우,2021-12-14 10:49:00
742785,"엔진룸에 모터로 대체되어도 안정성에 문제가 발생합니다. 엔진룸에 엔진이 빠지고 가벼운 모터가 들어간다고 이상없진 않습니다 예를들면 무게배분도 달라지고 추돌시 충격의 흡수와 배분도 달라지겠지요전기차로 전환하기 위해서는 전기차를 구동하기 위한 전기장치가 추가되고 이를 제어하기 위한 전자장치가 추가됩니다그런데도 ""전기창치를 위하여 개조되지 않는다""라는 말씀은 틀린 말입니다 안전성은 배터리 화재 및 폭발 외에 문제 될 것이 없다는 말씀은.. 약간 의도를 잘 못 쓰신 듯 싶지만배터리의 구조, 위치 등의 문제, 설계 오류 등의 문제가 코나에서 발생하여화재가 자주 났었지요.. 그렇다면 연관성이 전혀 없다라고 생각되진 않습니다 아5에서 냉각수를 분리한 것만해도 전기차용 디자인이 된 것이고 그 전 코나등에는 냉각수를 공유했었지요..",블랙쿱I아5l경기,2021-12-14 10:55:00
742785,"엔진보다 모터가 부피가 적고 가벼워 전방 추돌 시 위험성은 적어지겠죠.... 전기 장치는 모듈사에서 메이커로 공급이 되는데, 차체를 개조하는게 아니라 적절한 위치에 설치합니다. 엔진&기어박스는 모터&감속기로 대체 되는거긴 하겠지요. 전기차 엔진룸엔 또 어떤 전자장치가 들어갈까요? 코나 화재는 메이커에서 OO같이 해서 그런겁니다. 같은 플랫폼인 니로와 대조해서 보시면 확실히 와닿죠.",수원l대우,2021-12-14 11:05:00
742785,코나화재는 lg엔솔 배터리 자체결함 아니었나요?!,구조급IGV60Q4I동탄,2021-12-14 11:04:00
742785,"""모터가 부피가 적고 가벼워 전방 추돌시 위험성이 적어지겠죠""=> 틀린 말입니다 부피가 작아졌다면 그에 대한 설계가 달라져야 합니다 무조건 없으면 충격 흡수가 달라집니다전기장치는 모듈사에서 공급이 됩니다. 맞습니다 그렇지만 내연차 구조에 배터리가 들어가기 위하여 차량 바닥 트렁크 등에 들어가도록 기존 프레임등이 개조가 되어야 합니다. 그냥 바닥에 붙이지 않습니다엔진기어박스는 모터감속기로 대체됩니다 맞습니다. 전기차 엔진룸에는 BMS가 들어들어가고 LDC도 들어갑니다. 코나 화재는 메이커에서 OO같이해서 그렇습니다 . 세부적인 화재 원인을 보면 냉각수 문제, 배터리 셀문제, 배터리 팩의 조립문제 등 다양합니다. 특히 냉각수 문제의 경우 내연차와 유사한 구조에서 배터리팩 내부로 일반 냉각수가 흘러들어가는 과정에 새어나가서 화자가 발생한 경우도 있습니다. 즉 내연차 구조를 그대로 전기차로 적용하여 발생한 것입니다",블랙쿱I아5l경기,2021-12-14 11:10:00
742785,코나 화재 원인 중 배터리 문제도 있고 냉각수 문제도 있습니다,블랙쿱I아5l경기,2021-12-14 11:11:00
742785,그렇군요! 답변 감사드립니다.,구조급IGV60Q4I동탄,2021-12-14 11:13:00
742785,"엔솔이랑 현차랑 합의는 했는데, 현차 타지만 개인적으로 현차를 싫어해서....ㅎㅎㅎㅎ 결함은 공식적으로 어느 회사 100% 귀책이라고 나오진 않은걸로 알고있습니다.",수원l대우,2021-12-14 11:13:00
742785,자동차안전연구원 발표에배터리 연관화재 분석 결과에는 말씀하신대로 배터리의 어느 부분이 문제가되어 화재라는 보고서는 없습니다. (추가. 보고서는 있고 보고서에 그런 내용이 없다는 말씀입니다)배터리에 이상이 생겨 원인이 될 수 있다 정도입니다 또한 최초 초기 화재중 2건은냉각수로 인한 화재입니다,블랙쿱I아5l경기,2021-12-14 11:15:00
742785,"절연 냉각수가 적용되는 것은 봤는데, 화재가 사례가 있는줄은 몰랐네요. 좋은 정보 감사합니당",수원l대우,2021-12-14 11:16:00
742785,"생각할수록 어이가 없네요, 냉각수 때문에 화재라니.... 아무리 생각해도 제조사가 땡땡이 확실하네요;;;;;",수원l대우,2021-12-14 11:20:00
742785,코나 배터리팩으로 절연냉각수가 아닌 일반냉각수가 들어가서 쇼트가 나서 화재가 났습니다이 내용은 현대차 내부 문서로 있습니다 이로인해 중간에 냉각수를 절연으로 바꿔준 사례가 있었고이후에는 다시 안 바꿔줬었고 코나 단종 이후 아5는 아예 냉각수가 구분되었습니다,블랙쿱I아5l경기,2021-12-14 11:21:00
742785,블랙쿱님은 차에 대해 어찌 이리도 잘 아실까요? ^^ 진짜 전문가 같으세요.😊,귀연lgv60l부천,2021-12-14 11:27:00
742785,잘 안다기보다는..코나부터 타다보니.. 불나는거에 열받아서 이거저거 조사했었지요.. 저는 처음에 전기차 옹호자였는데... 어느 순간 코나 증오자가 되었습니다.. 뭐.. 현기차를 싫어하는 것은 아니고 코나가 싫어졌지요 지금은 아5를 타고요.. 현기차만 계속 타고있네요,블랙쿱I아5l경기,2021-12-14 13:08:00
742785,그런 일이 있었군요. ㅠ.,귀연lgv60l부천,2021-12-14 13:11:00
742785,"공간 효율이 떨어지겠죠 그렇지만 그게 문제고 안좋다는말에는 동의하기어렵습니다 뒷자리 중앙부분이 불룩하고 본네트안이 텅비어있는데 활용되지않고 덮개로 덮혀있는 ix3가 그런공간을 활용하면 좋겠지만 그러기 힘든거고 그게 그차가 전기차전용 플랫폼 보다 안좋다 문제다라고 보는건 아니라생각해요 차밑으로 배터리 배가 튀어나온것도 없고 트렁크 용량도 내연이나 다른 전기차만큼은 됩니다 충분히 공간에 성능, 즐겁게 운전하는데 지장없다고 생각됩니다",지승사랑llX3l서울,2021-12-14 10:45:00
742785,독일 B 사와 비교 하는 부분이 웃기지만..현대 코나만 보셔도 왜 전용 플랫폼이 중요한지 아실거 같아요^^ 억지로 배터리를 바닥에?깔아서 만드니..항상 배터리 때문에 방지턱 이나 많은 부분에서 신경을 안쓸수가 없내요~ 당연 비엠은 이런 부분에서 보완이 되었겠지만요~,퓨리I오닉5I경기,2021-12-14 10:45:00
742785,제 개인적인 뇌피셜인데 BMW 순수전기차 만들생각으로 새로운 차대를 공간 다 생각해서 만든거 같아요 근데 왜 프렁크를 안만들어준거지 .. ㅅx ㅋㅋㅋ 앞으로도 내연기관이랑 섀시 공유하면서 순수전기차 출시한다네요 . 24년 i5 기대 됩니다.,서울ll수호아빠ix3,2021-12-14 12:06:00
742785,,서울ll수호아빠ix3,2021-12-14 12:04:00
742785,확실히 다르긴 하네요^^,퓨리I오닉5I경기,2021-12-14 12:11:00
742785,"전기차 전용 플랫폼만의 장점이 없다면 원가절감의 달인인 현기가 뭐할려고 돈을 들여가면서 전기차 전용 플랫폼을 만들어 냈을까요? 아이오닉5는 싼타페 플랫폼 가져다 쓰면 될꺼고, EV6는 쏘렌토 플랫폼 가져다 쓰면 돈도 적게 들고 이익은 클건데요. 전용 플랫폼을 만들었을땐 그만한 이유와 장점이 있어서 아닐까요? ^^",WhiteBlEV6l부산,2021-12-14 10:45:00
742785,"e-GMP 플랫폼은 코나, 니로랑 똑같이 그냥 바닥에 배터리 깔면서 입 터는 수준이고요.....2~3년 안에 새로운 플랫폼으로 다시 입 털 계획으로 알고있습니다.",수원l대우,2021-12-14 10:47:00
742785,새로운 플랫폼이 나온다는 자체가 플랫폼이 중요하단 이야기지요점점 최적화 시키는거니깐요,흠l아5l 용인,2021-12-14 12:49:00
742785,양산차 설계 해보셨다는 분이?? 최소한 고장분석은 해보셨을텐데 입털려고 몇천억을 쓰고 그 인력을 투자할까요?,오즈IEV6I수원,2021-12-14 13:01:00
742785,음.... 저가 고분보 작성하는 조직이 아니라서 그럴까요??? 몇천억원이라는게 어떻게 산출된 것 인지 혹시 아시나요?? 제가 아는대로라면 그렇게 합리적인 비용 산출은 아니어서요^^;;;;,수원l대우,2021-12-14 13:07:00
742785,제일 중요하죠..,네온I니로I서산,2021-12-14 10:49:00
742785,중요하다기 보다는 최적화했다는 표현이 맞을거 같습니다.,요미나리l코나l일산,2021-12-14 11:05:00
742785,전용플랫폼을 쓰면 평균은 한다. 이렇게 생각하시면 될 것 같습니다. 최상의 성능을 원하시면 전용 플랫폼이 아니더라도 주어진 특정 상황에서 항상 최적화는 가능합니다.,ㄷㅈI광주IMYL,2021-12-14 11:10:00
742785,전 안전성에 한표 유투브영상이나 안전성 테스트에서 보통 전방이나 후방충격시 딱 전기차 플랫폼까지 즉 밧데리 있는 전 부위까지 찌그러지는듯한 느낌이더라구요,토토리하 남원,2021-12-14 11:19:00
742785,걍 대충 타면되지 뭘 머리아프게들 그래요. 전용 플랫폼 차량 타고 있지만 비전용 플랫인 G80e 타라면 당연 그거 타겠습니다. ㅋㅋ 내가 좋으면 됐지 뭘 언쟁들 하고 그래요.,가와사키맨I볼트I부산,2021-12-14 11:38:00
742785,내연기관이랑 공유해야 돈이되죠 ㅎㅎ 소비자 입장에선 전용플랫폼이 더 좋게느껴지긴 합니다. 테슬라 !! ㅎㅎ,서울ll수호아빠ix3,2021-12-14 12:23:00
742785,"맘에 드는거 타면 됩니다 전용 플랫폼이 있어도, 차 못 만드는 회사가 만드면 의미가 없겠죠",아련다솜I모델3l경북,2021-12-14 12:13:00
742785,"실 소비자 입장에서는 큰 상관 없겠지만 개발하는 입장에서는 의미가 있지 않나요?근데 관련 일 하신분이 의미 없다는 식으로 말씀하시는 거는 참 의외네요.제로백 0.1초, 실내공간 1mm 더 확보 등 작은 수치지만 더 나은 결과를 위해 기술과 비용을 투자하는 분야가 자동차분야 아닌가요?다른 산업도 마찬가지고요.",판다루I530eI전남,2021-12-14 12:42:00
742785,"플랫폼 개발하는 부서 빼고는 죄다 의미 없을듯요....ㅎㅎㅎ 자기가 맡은 부품이나 모듈만 신경쓰면 되니까요. 다만 한 가지 개선(?)된 점은 충전구가 차체 측면으로 간 점 이죠. 니로EV, 코나EV 같이 차체 전면에 충전구가 있는 차종이 전방 추돌을 한다? 그러면 충전도 못하고 렉카에 질질질 끌려가거든요.",수원l대우,2021-12-14 12:55:00
742785,"전용플랫폼이라는게 쉽게 말하면 자동차 안에 얼마나 컴팩트하게 부품들을 넣는가 인데 이걸 왜하냐면 공간성, weight, cost effective 의 효과가 있어서 그렇습니다. 즉, 원가절감이 가능하고 주행거리가 늘어난다는 점인데 소비자가 예를들어 어떤 차를 살때에 주행거리가 길고 가격도 괜찮고 내가 쓰기에 공간성이 좋다라고 생각하면 그거로 끝입니다. 전용플랫폼이 비전용플랫폼보다 좋다가 아니라 전용플랫폼을 하였을때 보통은 주행거리가 좋고 공간성이 좋기 때문에 전용플랫폼 차량이 좋다라고들 하는 겁니다. 전용플랫폼 vs 비전용플랫폼의 접근은 잘못되었다고 생각합니다.",위젠I서울,2021-12-14 13:18:00
742785,"내연기관차와 전기차의 다른 점은 1. 배터리가 들어간다 2. 동력계와 구동계의 설계가 서로 완전히 다르다 3. 따라서 무게 배분이 달라진다(엔진룸의 유무, 배터리의 위치, 동력계와 구동계의 위치) 4. 각 설계가 다르므로 무게 배분 특성을 고려해서 부품 위치를 잡아줘야 한다 5. 충돌안정성을 대비해 차체 구조의 변경이 필수적이다 6. 생산효율면에서도 내연기관 생산라인과 달라 이를 공유하기 어렵다 등의 차이가 있습니다.위와 같은 문제점을 해결하기 위해서는 당연히 전용 플랫폼으로 설계된 전기차가 훨씬 효율적일 수 밖에 없습니다길게 말하긴 어렵지만 저정도 문제만 보더라도 일단 차이가 없다는 의견에는 동의하기 힘드네요",알팔I모델3I서울,2021-12-14 14:10:00
742785,사고시에 배터리 보호요 죽습니다 죽어요,제알칠I모델3I광주,2021-12-14 14:47:00
742785,이게 정답이죠. ㅎㅎ전용 플랫폼으로 충전속도나 주행성능을 향상시킨다는 논리라면 E-GMP는 망작이죠.,빛틀I니로I대전,2021-12-17 16:44:00
742785,댓 중에 답이 있네요 효율적이다 제조사 입장에서 더욱더 효율적이다,용이랑l부경,2021-12-14 16:00:00
742785,전문가 천지네 거참 왜 기업들이 목숨거는지 알아야할텐데 의미가 없다니.. 하드웨어 측면에서만 보니까 그런 말이 나오는거.. 아무리 전문가여도 자기 분야만 알고.. 소프트웨어측면까지 보면 지금 제조사들 미는방향이 맞음,넹,2021-12-14 16:39:00
742785,1. 전용플랫폼 = 원가절약 2. 휠베이스 늘어남 = 거주공간여유 3. 배터리로인한 최저지상고 높힘 4. ncap 등 안전평가 지수 높아짐 5. 차대강성 높아짐(울트라스틸 등.),특급이다l볼트EVl세종,2021-12-14 22:22:00
742785,"댓글 중에 egmp 적용 되어야 충전 속도 높다는 말에서 웃고 갑니다 ㅋㅋㅋㅋㅋㅋ 무게 중심, 배터리 보호, 공간 활용에 큰 장점이지뼈대하고 충전 속도하고 무슨 상관입니까 ㅋㅋㅋㅋㅋㅋ",마루한조,2021-12-21 22:12:00
742785,모가됫든 전용플랫폼이 더 좋을꺼 같습니다. 최신 기술을 반영하고 트렌드도 반영하니까요,내 목표는 가족차,2022-03-10 16:10:00
742785,"IX3는 CLAR 플랫폼입니다.G바디 내연기관, 플러그인하이브리드,순수전기차까지 만들수 있습니다.IX3,I4,IX40,IX50모두 CLAR 플랫폼입니다.BMW는 CLAR 플랫폼을 사용합니다.저는 재미있게 만족하며 타고있습니다^♡^",달구알l IX3 l경북,2022-03-10 20:13:00
742606,화재 위험? 생각보다 좁은 실내,오닉I아이오니I익산,2021-12-14 00:21:00
742606,"실내,트렁크가 좁다 정도요...?",트트l니로오닉l강원,2021-12-14 00:25:00
742606,"전기차 전용플렛폼이 아니라 실내공간이 좁아요니로랑 다르게요 니로는 하이브리드, 전기차 전용",다이나믹I볼트evI부산,2021-12-14 00:50:00
742606,니로 내연차 플랫폼입니다. 전기차 전용플랫폼도 아니예요^^,죤기촤l코나I경남,2021-12-14 17:24:00
742606,"네 ㅎ 하이브리드, 전기차전용으로 만들었죠",다이나믹I볼트evI부산,2021-12-14 20:36:00
742606,2인승용~~제일큰점 배터리 화재가능성..가끔 이야기 나왔던 브레이크 미작동...,로타소주I쏘포GI인천,2021-12-14 00:45:00
742606,감속기 및 모터 내구성 안 좋은 것그리고 내연기관 플랫폼이라 공간의 비효율성 및 배터리 보호 미비로 인한 배터리 파손 위험,파우워I포터I경남,2021-12-14 01:08:00
742606,출시한지 3년만에 단종.. 하자가 끊임없었습니다..,하늘아ISM3zeI경기,2021-12-14 01:09:00
742606,11만키로 주행중 9만이후 배터리 교체 현재까지 리콜외 문제없음,친환경I꼬나I진천,2021-12-14 01:31:00
742606,현재 12만 타는중 베터리교체이후 다른문제 없이 잘타고 있어요,용용왕자 코나 아산,2021-12-14 01:48:00
742606,저는 왜 하자가 없을까용~,포커스l코나l경기,2021-12-14 07:48:00
742606,뒷자석이 최고 작음. 반대로 보면 혼자타기는 좋죠,청도팬더l볼트e6l대구,2021-12-14 07:59:00
742606,"2열, 트렁크가 너무 작아요 ㅜㅜ",후니훈IEV6모YI경기,2021-12-14 08:41:00
742606,"4인 가족 만족하면서 잘 타고 있습니다. 뒷좌석도 탈만 합니다. 타면서 문제 no ,정비소 간적 없구요. 디자인은 최고로 잘 빠졌다 생각해요 주행거리 최상,전비 최상 잘 팔리고 예쁘니 시샘은 덤이죠 ㅋㅋ 가성비 최강 코나 !!",엠파I코나I부산,2021-12-14 09:51:00
742606,배터리도 리콜로 무상교체 가능한 연식은 키로수 좀 있어도 배터리도 쌩쌩하고 좋을 듯요.,엠파I코나I부산,2021-12-14 10:01:00
742606,그게 그거라고 생각 합니다. 두종류 다 시승해보시고 결정 하는게 맞다 생각하고요 ~,메탈ㅣ쏘울ㅣ분당,2021-12-14 12:46:00
742606,코나혼자 출퇴근용인데 만족중이긴합니다. 헌데 저는 니로 운전석 착좌감이 더 좋습니다. ㅎ 혼자탈거아니면 니로추천드려요 내부공간 차이가 많이나요,팡팡I코나EVI강원,2021-12-22 11:03:00
742417,이번 q4이트론,선혜파파II코나II포천,2021-12-13 19:48:00
742417,이트론이 보조금 혜택 받을수 있을까요?? 아우디 깡통은 처음이라ㅠ,vv일렉트로닉vv,2021-12-13 19:50:00
742417,옵션은 따로고 차량가액 22년 기준 (깡통가)5499만원만 되면 보조금 100% 되서 요즘 인기가 좋죠 혹시나 모르니 예약은 해놓으셔요~ 이번 2월경 금액이 나온다던데 2월예약은 많이 늦어질거라서요,선혜파파II코나II포천,2021-12-13 19:51:00
742417,이미 전기차 모든종류를 다 예약중입니다 ㅋ,vv일렉트로닉vv,2021-12-13 19:51:00
742417,개인적의견이지만.... 이젠 현대는 안살거같아요. 차라리 기아 사고 아니면 전기차는 옵션질 조금 받더라도 수입이 맞는거 같습니다,선혜파파II코나II포천,2021-12-13 19:52:00
742417,현대나 기아나 같은거 아닌가요? 현대가 무슨 문제라도...?,vv일렉트로닉vv,2021-12-13 19:53:00
742417,전 다르다 생각해요 ^^ 이건 지극히.개인적...,선혜파파II코나II포천,2021-12-13 19:54:00
742417,"코나 : 화재 , 잔고장 많고 니로 : 화재 없고 , 잔고장 없고 디자인도 현대보단 기아가 더 나은거같구요. 현대는 ( 제네시스 제외 )",선혜파파II코나II포천,2021-12-13 19:54:00
742417,답변 감사합니다~ 언능 집밥 먹이고싶네요ㅋ,vv일렉트로닉vv,2021-12-13 19:55:00
742417,좋은 양품차량 구매하시고 좋은 시간되세여~,선혜파파II코나II포천,2021-12-13 19:55:00
742417,q4이트론이 5499만원 으로 나오냐 안나오냐가 요즘 이슈긴 해요 ㅋㅋ 저도 기다리고잇구요,선혜파파II코나II포천,2021-12-13 19:51:00
742417,초고속충전되는 현대기아 추천드립니다. 일단편해야죠. 하차감은 e클 있으시니까요.,소울이I쏘울EV17I서울,2021-12-13 19:55:00
742417,저도 테슬라 가격인상 때문에 국산으로 기울긴 합니다ㅠ,vv일렉트로닉vv,2021-12-13 19:58:00
742417,사업하시는분이면 시간=돈=체력 인데 충전한다고 시간버리는건 인생과 돈 낭비인거 같아요. 충전 갈수록 빡세지고 있습니다.,소울이I쏘울EV17I서울,2021-12-13 20:01:00
742417,좋은 말씀이시네요ㅎ 인프라는 역시 국산이 답이죵,vv일렉트로닉vv,2021-12-13 20:03:00
742417,현기하고 고속전비 많이차이 날까요?,vv일렉트로닉vv,2021-12-13 20:18:00
