post_id,cmt_content,cmt_author,cmt_created_at
769354,300mm면 정말 가까운데요!?,모카l부천,2022-01-24 12:09:00
769354,ㅋㅋㅋ300m 아닐까요?,지엠피씨I쏘울I안성,2022-01-29 18:20:00
769354,제가차량만 100대정도사봤는데 전기차는 테슬라모3롱 코나ev 볼트ev이고 가성비로는 볼트가 최고인거같습니다 여유있으시면 좋은거가심되구요,창근ll대구,2022-01-24 12:12:00
769354,전기차 환영해요.,태순I볼트I서울,2022-01-24 12:20:00
769354,예산에 따라 다를 것 같아요!,모모코IEV6I경기,2022-01-24 12:34:00
769354,고속도로 타시는 구간이 얼마정도 되는지도 중요 할 듯 합니다. 여기계신 전기차 오너분들은 다들 아시겠지만 고속도로에서는 전비(연비) 많이 줄어들어서 이 그간이 길다면 연료비에서는 생각만큼 절감 안될 수 있습니다.,마데테스I모Y롱I경기,2022-01-24 12:47:00
769354,"왕복60km 면 자금여유가 되신다면, 볼트추천, 자금이 부족하시다면, 쏘울EV 2세대(혹은1세대 리콜한것)",고고고I볼트EVI서울,2022-01-24 12:56:00
769354,니로ev 미만잡입니다. 가격대비 성능 좋아요. 다른분들 안좋은 전기차 사는거 맘 아파서 남겨요.,비밀I니로evI서울김포,2022-01-26 10:54:00
769354,"가성비를 원하신다면 쏘울 2세대 배터리 30kwh 2017년 09월식 추천합니다.2017년 09월식 히트펌프, 가죽시트, 네비 기본장착이유는 2018년 식은 히트펌프, 가죽시트, 네비 기본장착 아님. 장착된 모델은 비쌉니다.이것저것 따져보니 2017년 09월식이 좋더라구요.쏘울 EV는 10년 16만 전기관련부품 보장 되서 보증기간 5년 정도 남았고 SK배터리라서 화재위험도 없고요~한달에 출퇴근 4주 주5일근무 기준 최소 1200km 이것저것 해서 1년에 2만정도 타신다고 하면 7-8만 짜리 구매하시면 좋을듯 합니다.겨울 주행거리는 고속도로에서 150~170 (안전충전을 위해 2~30km 빼면 실 주행거리는 120~140km)시내는 180~210km(안전충전을 위해 2~30km 빼면 실 주행거리는 150~180km) 주행습관 신경쓰고 안쓰고 차이 큽니다.충전관련해서일단, 고속도로에는 차데모급속충전기가 거의다 있습니다. 그렇지만 60km만 타시면 집밥충전기로도 충분할거 같습니다.충전시 단점이라면 충전이 조금 번거로우실 수 있습니다. 60km 주행시 대략 2~3일에 저녁에 완속충전하셔야 할 것 같습니다.조금만 더 보태면 볼트가 좋긴한데... LG배터리라 언제 화재날지 모르는 불안감이 있어서...",지엠피씨I쏘울I안성,2022-01-29 18:21:00
768158,선계약 후고민 추천입니다..잊고 계시다가 1년뒤에 결정하시는게..,서울 션샤인,2022-01-22 10:35:00
768158,계약을 하면 그때부터 차 언제 나오나 끙끙 앓을까도 걱정이 되네요. 출고까지 1년이 넘어간다니...언제쯤 정상화가 될까요?ㅠㅠ,수원ll똥집튀김,2022-01-22 10:39:00
768158,제 개인적인 생각으로 전기차가 내장제를 제외하곤 거의 대부분 내연기관은 이미 제쳤다고 생각됩니다. ㅎㅎ해외에서 설문조사한게 있는데 전기차 탄사람중에 다시 내연기관으로 돌아가고 싶다고 한 비율은 8%뿐 안되더군요.그만큼 만족도가 높은거죠. 저도 이제는 내연기관 탈 엄두가 안납니다. 일단 계약 하는걸 추천드리고요. 조금만 기다려볼까 하면 올해는 못받는다고 생각하시면 됩니다. 저도 작년 이맘때 관심가져서 사전계약 했지만 11월에 차 받았습니다. 처음에는 분위가가 자신이 원하는 차를 고르는 분위기인데 뒤로 갈수록 보조금이 떨어지면서 옵션과 상관없는 취소차 잡는다고 난리더군요.. ㅎㅎㅎ,트니아빠I아5I부산,2022-01-22 10:40:00
768158,"좋은 말씀 감사합니다. 원래 계획은 2~3년 더 관망하면서 안정적이고 주행거리 좀더 긴(전고체배터리?) 긴 전기차를 알아보자.... 이거 였는데, 코로나 때문에 신기술은 커녕 기존 원자재도 폭등하면서 난리가 났더라구요. 일단 계약하고 관망하는걸 고려해봐야 겠네요",수원ll똥집튀김,2022-01-22 10:43:00
768158,"전고체배터리는 출시해도 코나ev 화재처럼 예측 불가능한 배터리 성능불량 때문에 출시하고도 2-3년 안정성을 보면 4~5년 뒤에나 타지않을까요?? 어차피 컴퓨터도 하드디스크가 1TB인게 엊그제 같은데 이젠 테라에서 페타로 넘어가는거 처럼 기술은 매년 발전하더라구요!! 결론은 5년 뒤 전고체 배터리가 나와도 그 뒤에 나올 차세대배터리도 눈부시게 빨리 나올걸 생각한다면 그냥 지금 수준의 전기차(1회 충전 후 4-500km)가 만족한다면 사고 주행거리가 부족하면 기다리는게 정답일 것 같습니다!! 어차피 내연기관차도 연료탱크 용량이 달라서 아반떼 만땅 주유하는 시간보다 카니발 만땅 주유하는 시간이 더 길어요 물론 몇 초에서 몇 십초 밖에 차이가 안나서 불편함이 없겠지만, 전기차는 지금도 77kWh 배터리를 50kW 충전기로 충전하면 1시간 반 걸리는데 150kWh 배터리는 1시간 40분 걸리고 그런문제가 아니라 3시간 걸립니다. 용량이 2배기 때문에 2배만큼 충전시간이 걸리는거죠, 충전속도를 2배로 올리면 되지 않냐는 얘기도 많던데 그럼 전국적으로 전력수요를 잡기위해선 전봇대도 2배, 철탑도 2배, 원자력발전소도 2배 이런식으로 모든 전력시설이 갖춰져야 충전속도를 올릴 수 있지 마냥 충전기만 높은 용량 쓴다고 해결될 문제가 아닙니다. 또한 정부에서 급속충전기 1회 사용가능 시간을 정해놓은 상황에서 고용량 배터리를 써도 3시간을 연속으로 충전하기도 힘들뿐더러 77kWh배터리팩이 2000만원인데 용량 2배짜리는 수리비로 얼마를 처먹을지도 모르는 상황이고 하니 기다려도 손해볼거 없고, 지금사도 손해볼게 없는 상황 같아요!!",아이I오닉5I강원,2022-01-22 11:06:00
768158,전기차는 사고싶을때 내가 사는게 아닙니다 우주의 기운을 모아서 점지당하는거에요,아마도 ㅣ MYSㅣ경기,2022-01-22 10:39:00
768158,아! 제가 우주의 기운이 부족했군요!! ^^;;;,수원ll똥집튀김,2022-01-22 10:44:00
768158,신형 그랜저 하브 출시해도 빨리 받을 수 있을지는 카마역량일듯 해요 ㅠㅠ,오꼬니I I경기,2022-01-22 10:48:00
768158,출고적체 때문에 그랜져도 연말 출시 후 출고 받기는 내년 중순이 넘어야 될거 같아서 더 고민이네요. 하나가 빠르면 그냥 빨리 나오는거 선택하면 되는데....ㅠㅠ,수원ll똥집튀김,2022-01-22 12:06:00
768158,저희는 작년이맘때 k7하브 재고차를 좀 저렴히 출고했었는데 전기차 타보고싶어 일단 두군데 예약은 해두고 고민중이에요~캠핑족아니고 시내주행 조금씩이고 한달에 한번꼴 장거리주행인데 지금차 연비잘나오긴하는데 전기차가 맞는건지…혜택이 계속줄어드니 지금이라도 잡는게 현명할까요?비슷한 고민이신듯해서요…^^,Icel코란도l일산,2022-01-22 11:34:00
768158,"품질과 안정성, 주행거리 등은 기다리는게 확실거고, 보조금은 기다릴수록 없어지는게 확실하고.... 이도저도 못하는 고민입니다. 기술 발전으로 배터리 단가가 좀 낮아지면 보조금이 필요없지 않을까? 예상했는데, 코로나 때문에 원자재 가격 폭등이라 기술 발전도 요원하고...ㅠㅠ",수원ll똥집튀김,2022-01-22 12:08:00
768158,어디서 보신글인지 모르겠지만 말도 안되는소리죠.... 전기차나 내연차나 지금사는게 젤좋은찹니다.... 내연차는 이제 마지막이니 젤좋다?? 앞으로 나올차량들이 같은 가격에 스펙만 올라갈일이 없죠 그니깐 결국은 지금 당장 계약을 먼저 하시고 ㅋㅋㅋ 하루라도 빨리 받아서 타시는게.... 최고입니다 ... 저도 한달전까지 3.0 타다가 전기차 입문 볼트로 왔는데... 치고 나가는 느낌 이나 언덕 오르는 느낌은 그랜저 보다 볼트가 더 맘에 듭니다 승차감은 ㅠㅠ,백반2인분 양산,2022-01-22 18:22:00
768158,2023년되면 많은 전기차 신차출고되고 2024년되면 통합운영되는 순수전기차출시된다하니 어짜피기다리실거 2024년까지 기다리시죠 지금계약해봐야 내년에 받는다면...,희망I쏘울I광명,2022-02-06 17:16:00
765810,코나전기차화재-코로나등이 겹쳐서 이미지 훼손이 있으니 안나(ANNA)는 어떨까요.,요미나리l코나l일산,2022-01-19 10:55:00
765810,최고이십니다^^,태연아빠l코나l남양주,2022-01-19 10:59:00
765810,투싼 처럼 변했네요,60Q4l오닉l경기,2022-01-19 11:12:00
765810,오 디자인 저러면 예쁘네요,동백누I미정I평택,2022-01-19 11:34:00
765810,전기차도 같이 나오겠네요^^,따발권총l경기,2022-01-19 12:57:00
765810,첫차로 코나 풀체인지 사려고 기다리고있어요~~ 니로보다 싸게나왓으면좋겟네요 ㅎㅎ,서울C이민규,2022-01-21 18:41:00
765810,광교현대프래미오아파트 주차장에서 하이브리드 모델 봤습니다.,갓택시l니로플I서울,2022-10-15 19:57:00
765118,"한국 기사, 협회는 현대차가 광고주, 돈줄이기 때문에믿을게 못되고코나만 봐도 딱 답이 ㄷㄷㄷ",머신러닝I모델3I안양,2022-01-18 16:01:00
765118,"소방청, 한국자동차 수입차산업협회가 레퍼런스라고 딱적어놨는데, 무지성 불신하신다구요?ㄷㄷㄷ",원츄I전주,2022-01-18 16:06:00
765118,폴스타2가 인버터랑 냉각수 히팅 장치 문제로 리콜한적 있는데 그것때문이 아닐까 싶어요. 엇 한국차네. 어느정도 볼보랑 공유해서 비슷하지않을까요,리슬릿l천안아산,2022-01-18 16:02:00
765118,저 자료에서 현대차는 코나EV가 포함된 자료겠죠? 현대차가 전기차 기준 1만대당 화재발생 건수가 가장 높다면 내연차 기준 1만대당 화재발생 건수는 현대가 가장 낮겠죠?,삼규아빠I순천,2022-01-18 16:08:00
765118,화재의 대명사 코나가 떡하니 있는데 ㅋㅋ,뽀노l전남,2022-01-18 16:15:00
765118,현대차 속에 포함되 있겟죠,벤츠EQCI광주,2022-01-18 16:31:00
765118,다 브랜드명 써있는데 차 이름 말구..여기서 무슨 코나를 따로찾으세요,테슬I모3I대전,2022-01-18 16:34:00
765118,브랜드명순이었군요 제가잘못봤습니다ㅎㅎ,전깃I경남,2022-01-18 16:35:00
765118,"화물, 건설기계 포함이라면?볼보는 덤프도 많아요",미메시스IEQAI경남,2022-01-18 17:08:00
764054,마이현대 어플에 리콜대상인지 나옵니다. 전 대상차량이라 알라서 연락 오더군요. 작년 12월에 배터리 리콜 받았습니다.,포스I코나I남양주,2022-01-17 12:30:00
761764,핵폭탄급일듯 합니다,풀매도I오닉5I서울,2022-01-13 20:06:00
761764,그.... 그렇군요ㅠㅠㅠㅠㅠㅠ,봉봉l볼트evl경기,2022-01-13 20:08:00
761764,한달에 천키로 정도 타네요.. 전비 4키로 잡아도 250kw 정도네요 집에서 쓰는 전기량이 합쳐서 계산해보세요,구입예정울산,2022-01-13 20:14:00
761764,음...급속이랑 병행하면서 사용량 봐가며 써야겠네요ㅠ 급할때만 ..ㅠ,봉봉l볼트evl경기,2022-01-13 20:15:00
761764,많이 안타는 사람은 집 전기 끌어다 쓰는 사람들도 있더라구요..,구입예정울산,2022-01-13 20:16:00
761764,그냥 아주 급박할때만 써야겠어요......ㅠㅠㅠㅠㅠ집밥 먹이고 싶네요 정말,봉봉l볼트evl경기,2022-01-13 20:24:00
761764,저희집이 600키로와트에 엄청비싸던데말입니다,꿀벌이ㅣeG80ㅣ부천,2022-01-13 20:23:00
761764,안그래도 사용량 봐가면서 급할때만 쓰려구요 ㅋㅋㅋㅋㅋ,봉봉l볼트evl경기,2022-01-13 20:24:00
761764,금액을 떠나 창문으로 내리는 것 자체가 힘들 듯요.비나 눈이라도 내리면.ㅠ.ㅠ.그냥 근처 급속 이용이 더 좋을 듯합니다.,아미쿠스l쏘울l인천,2022-01-13 20:24:00
761764,창문위로 꽤 넓게 어닝이 있어서 그 눈이나 비 걱정은 안되더라구요ㅎ 그런데 어차피 지금 댓글 달리는거보구 누진세를 피하지 못할거같아서 포기하려구요ㅋㅋㅋㅋ,봉봉l볼트evl경기,2022-01-13 20:49:00
761764,현재 집에서 한달 전기 사용량이 얼마인지요?? 2-300킬로 사용한다면 그다지 많이 안나와요 한달에 1000km타면 전기 200킬로 정도 충전량입니다,달빛l아이오닉l세종,2022-01-13 20:39:00
761764,어플깔아서 몇달 사용량좀 봐야겠어요ㅋ,봉봉l볼트evl경기,2022-01-13 20:49:00
761764,급할때만 쓰시구요..올해 언제가 될지는 모르지만 계실별 요금제가 나옵니다. 제주도는 이미 있구요. 그 요금제 나오면 기본료랑 키로와트당 요금은 오르지만 누진세가 없어져서 할만한 상황이 온답니다~^^;,노래하는님l오닉l인천,2022-01-13 20:54:00
761764,좋은 정보 감사드립니다!,봉봉l볼트evl경기,2022-01-13 21:00:00
761764,4인가족 한달 평균 전력사용량 270kw 전기세 4만원정도 한달13000키로 타면 210kw 누진세가 적용구간까지갑니다,구찌l창원l아5,2022-01-13 21:17:00
761764,넵 감사합니다,봉봉l볼트evl경기,2022-01-14 01:04:00
761764,아뇨. 파워큐브 충전기 구입에 기본 사용료 감안하면그냥 콘센트에 전용충전기 꽂아쓰는것과큰차이 안납니다,천천 I 인천,2022-01-13 21:36:00
761764,조금은 써도 괜찮을거같네요,봉봉l볼트evl경기,2022-01-14 01:04:00
761764,충분할거 같은데요. 한전 요금표 보세요. 평소 전기사용량이 중요하겠지만 1000kW 한달 이상 쓰지 않는이상 급속 보다 저렴합니다.아래 영상이 도움 되실 듯https://youtu.be/HIxyhBbq-WE,토레타I이트론l용인,2022-01-13 22:01:00
761764,감사합니다!,봉봉l볼트evl경기,2022-01-14 01:04:00
761764,윗분말처럼 집전기 쓰세요 누진촤고구간보다 급속이 더 비쌈,김반장 I 코나 I 대구,2022-01-13 22:20:00
761764,네 사용량 봐가며 좀 쓰는게 더 나을거같기도하네요 ㅎ,봉봉l볼트evl경기,2022-01-14 01:04:00
761764,제기억으로 최고 누진단계 요금이 급속보다 싼걸로 알고 있어요~,김반장 I 코나 I 대구,2022-01-14 01:38:00
761764,저같은 경우 한달 전기 사용량이 260 정도 나옵니다. 한달에 10번정도 야간에만 사용할 계획을 세우고 5번 정도 사용하니(23:00-0600 7시간 기준)이번 달 330 나왔습니다.,콰트로SI니로EVl청주,2022-01-13 22:55:00
761764,그정도면 또 고려해볼만하네요 감사합니다!,봉봉l볼트evl경기,2022-01-14 01:03:00
761764,....그냥 하브사세요 생활환경이 전기차에 맞지 않아요,마크사l모델3l양산,2022-01-13 23:03:00
761764,주변에 급속 충전기는 많아서 괜찮아요 그리고 이미 볼트 탄지 3년이 넘었어요ㅎ,봉봉l볼트evl경기,2022-01-14 01:03:00
761764,제가 한달에 5000 km 정도 타는데 대략 700kw 정도 충전합니다^^ 가정용 전기는 1000kw 까지는 kw당 250원 정도라 크게 비싸지 않습니다^^ 빌라 2층이면 양호하신겁니다 4층5층에서도 릴선 내려서 충전하시는분들 많아요^^ㅎㅎ 아니면 집주인에 문의해서 세대 공동전기 사용해도 되냐고 물어보시고 된다고하면 거긱에 계량기 하나 달고 충전하셔도 됩니다^^,전기만I레코아5I서울,2022-01-14 05:49:00
761764,정보 감사드려요👍🏻,봉봉l볼트evl경기,2022-01-14 05:51:00
761764,누진세 폭탄이어도 밖에서 급속물리는것보다 쌉니다.,쭉쭉I볼트I서울,2022-01-14 08:10:00
761764,번갈아가면서 충전해야겠어요ㅎ 정보 감사합니다,봉봉l볼트evl경기,2022-01-15 15:55:00
761764,그냥 재밌을거 같아서ㅋㅋㅋㅋㅋㅋㅋㅋㅋㅋ,봉봉l볼트evl경기,2022-01-15 15:55:00
761764,잘 타고있으니 신경 안쓰셔도 될 거 같은데...ㅋㅋㅋㅋㅋㅋㅋㅋㅋㅋㅋ,봉봉l볼트evl경기,2022-01-15 15:59:00
761764,아 예예 ~,봉봉l볼트evl경기,2022-01-15 16:01:00
761764,실례가 아니라면.. 혹시 40대이신가요?,강원II천연물분석,2022-01-30 21:14:00
761622,왜자꾸타는거야..,그렇l코나l대전,2022-01-13 15:46:00
761622,험험 배터리 교체 했단 소리로 중고로 가저왔는데...험...,구매l코나evl전남,2022-01-13 15:48:00
761622,코나중고알아보고있는데 일단 보류합니다 이런ㅜ,달마l남양주,2022-01-13 16:17:00
761281,https://auto.v.daum.net/v/20220112175747902 배터리는 불이 안붙었네요. 30분만에 진화됬다길래 배터리 문제는 아니라고 생각했는데,치킨로이드,2022-01-13 05:42:00
761281,게시글에서는 우리 회원이셨고기사말을 100% 신용못하겠습니다. 제조사 리콜이 들어갔고 베터리 불이 아니라고 하지만리콜을 하고도 불이난다를 제조사에서 입막음할 가능성도 있다고 생각해요.,햄주먹l니로l대구,2022-01-13 08:39:00
761281,저희 회원 이신것 같아요 ㅠ,이든IEQSI서울,2022-01-13 07:12:00
761281,현대는… 코나가 모두 사라지기전까지 반복될 것 같아 안타깝습니다. 자업자득이겠지만.,noral이트론l경기,2022-01-13 07:44:00
761281,배터리에 불이 안붙으면 더 심각한 문제 아는가요?,훈다I니로EVI경주,2022-01-13 08:53:00
761281,듣고보니 그렇네요. 또다른 새로운 하자 발생..,하늘아ISM3zeI경기,2022-01-13 09:07:00
761281,화재의 원인이 어떤거든 코나ev이미지 타격이크네요,전깃I경남,2022-01-13 08:54:00
761106,이유가 멀까요? 🔥 날 이유는 밧데리밖에 없는것 같은데요,귀연lgv60l경기,2022-01-12 19:57:00
761106,허얼,오십살래Iix50I순천,2022-01-12 20:00:00
761106,,방뎅이 NEXO 창원,2022-01-12 20:02:00
761106,"배터리도 문제일 수 있지만, 현대 합작사가 만든 BMS의 버그 등도 원인이 아닐까 생각됩니다. 생각보다 현대의 SW개발능력이… 좀 그렇죠.",noral이트론l경기,2022-01-12 20:01:00
761106,그마저도 현대가 안해요….BMS도 외주…..,수녕군IMYI서울,2022-01-12 20:04:00
761106,"더 심각하네요.. 하청을 안주는게 있는건가… 전 sw가 문제가 있을거라는데에… 무게 실어봅니다 코나 팔고 독일차로 갈아탔는데… 아직도 해결 안되는게 너무 안타까워요. 해외는 또 조용한게, 굳이 한국만 그러는지도 이해 안되고.",noral이트론l경기,2022-01-12 20:06:00
761106,해외는 100% 충전을 잘 안하다보니 괜찮은게 아닌가…. 싶은 제 생각…. 하나 더 멀하자면 해외는 고속충전기에 과전압 과전류 방지등이 잘 되어있을거 같다는 생각…. 울나라 고속충전기 과전류 과전압 그냥 뿜어내니…. 그걸로 인해 배터리에 손상이 조금씩 가지 않을까 하는 배터리알못….. 생각ㅋ,수녕군IMYI서울,2022-01-12 20:09:00
761106,만약 그게 문제라면다른전기차특히 니로에서도 문제가 되야죠,구민I코나evI화성,2022-01-12 20:36:00
761106,니로랑 코나랑 bms 업체가 달라요….배터리도 다르고….뭐 소수 섞여 있긴 하지만ㅋ,수녕군IMYI서울,2022-01-12 20:46:00
761106,어제 코나 전소됐는데 배터리는 하나도 안탔어요,현기싫어Ix3I청주,2022-01-13 10:56:00
761106,"bms, 모터 단락, 전선 합선 등 많은 요인이 있습니다.",막걸리병나발l충북,2022-01-12 20:07:00
761106,이정도면 bms 문제 아닌가요 ;;,마루마루I모델3I하남,2022-01-12 20:18:00
761106,리콜완료 모델이면 2018에서 2019년식인데 배터리교체해도 문제가 생긴다면 배터리문제가 아니네요,멀더l코나l안산,2022-01-12 21:51:00
761106,ㅎㅎㅎㅎㅎ 태안 거 배터리 멀쩡하다고 이미 기사 다 공유됐시유,치이타아I청주,2022-01-12 22:44:00
761106,어쩐지 30분만에 진압 됐다해서 이상하다했네요 배터리면 더오래걸릴텐데,멀더l코나l안산,2022-01-13 07:49:00
761063,ㅜㅜ큰일이네요..,토튼,2022-01-12 18:59:00
761063,이런거 보면 선택을 잘한건지 못한건지 고민이,대전떡팔이,2022-01-12 19:44:00
761054,감사합니다!,드드드I코나EVI경기,2022-01-12 19:14:00
761054,글잘봤습니다!!,토튼,2022-01-12 19:00:00
761054,긴글 봐주셔서 감가합니다 ㅎ,드드드I코나EVI경기,2022-01-12 19:14:00
761054,정말 좋은 글이네요. 글 쓰느라 정말 수고하셨습니다. 잘 읽고 추천 드리고 갑니다.,삼규아빠I순천,2022-01-12 20:30:00
761054,감사합니다 ㅠ,드드드I코나EVI경기,2022-01-13 00:02:00
761054,맞습니다 19말코나 오너이고 다신현기안봅니다 와이프차 폐차로 볼트로타고있고 euv 모3 둘중빠르게나오는 차로 코나에서 기변합니다 올해받겠지요 왜 불나는지 솔까 관심없어요 사후처리가중요하지,놀깡l코나evl고양시,2022-01-12 20:39:00
761054,"그러게요... 저는 전자기기 사서 업데이트 끊기면 바로 기기 바꾸는데, 올해나 내년에는 저도 갈아탈거 같습니다.",드드드I코나EVI경기,2022-01-13 00:08:00
761054,저도 코나 3년 유저인데 블루핸즈 하도 들락거려서 직원 마주치기 부끄러울 정도 입니다. 옆아파트 지하에서는 코나 불도 있었고요. 다음 차는 현대는 절대 피하렵니다.,핑크I코나I대구,2022-01-12 20:56:00
761054,"제 차를 출고시켜주신 키마스터님, 제 차 웃으면서 고쳐주시던 블루핸즈 사장님들... 어찌보면 다 현대차로 이어진 분들인데, 현대차가 방향 잃고 휘청거리는게 안타깝습니다.",드드드I코나EVI경기,2022-01-13 00:07:00
761054,좋은 글 잘보고 갑니다 그런데 아슬아슬해 보여요 강퇴 당하실까 무섭네요 ㅠㅠ,여행I아5I경기,2022-01-12 21:28:00
761054,"네, 근데 진짜 이제 조금 더지나면 이렇게 말하지 않아도 무너질거 같아서 참 안타깝습니다. ㅠ",드드드I코나EVI경기,2022-01-13 00:06:00
761054,좋은 글 써주셔서 감사합니다. 현대차의 현재 기업정신으로는 영업이익과 상관없이 2류를 벗어나지 못 할 것입니다. 정의선은 삼성이 1류인 이유를 궁금해 하지도 않네요. 이 글 다른 동호회에 공유해도 될까요?,유소정I넥쏘I춘천,2022-01-12 22:03:00
761054,"우리 카페에 규정에 어긋나지 않고, 출처만 잘 밝혀주시면 저는 어디에 공유를 하셔도 상관없습니다! ㅎ",드드드I코나EVI경기,2022-01-13 00:05:00
761054,감사합니다 ~,유소정I넥쏘I춘천,2022-01-13 20:45:00
761054,법정소송은어떻게 되가는지 아시는분글잘보고갑니다,코나l코나l문경,2022-01-12 22:17:00
761054,저는 법정소송은 어떻게 되고 있는지 일절 모릅니다.. 다만 제가 느낀 점을 적었습니다! ㅎ,드드드I코나EVI경기,2022-01-13 00:05:00
761054,“진실은 하나다” 현대자동차 기아자동차 국토부 환경부 검찰 법원 언론등등 너무나 크고 단단한 “Big one team” 이게 현실입니다. 너무 싫네요.,비해l코나l부산,2022-01-12 22:33:00
761054,2025년. 이때는 팔때가 아니라 살때인데....,드드드I코나EVI경기,2022-01-13 00:09:00
761054,잘 누르지않는 좋아요 하나 누르고갑니다. 옳으신말씀!,죤기촤l코나I경남,2022-01-13 00:29:00
761054,"코나EV사고 차가 너무 마음에 들어서 주식도 살정도로 현대차를 사랑했었는데, 아마 제 짝사랑인것만 같습니다.",드드드I코나EVI경기,2022-01-13 00:33:00
761054,,연군ㅣ볼트ㅣ경기,2022-01-13 01:31:00
761054,,드드드I코나EVI경기,2022-01-14 01:15:00
761054,"""화재원인 보다는 기업의 대처방안"" 적절한예시.. 논리적이고 좋은글 잘보고갑니다!",비빔면lEV6l구리,2022-01-13 04:49:00
761054,"지금까지 독과점 시장이 안무너진 경우가 없는데.,,. 참 아쉽습니다.",드드드I코나EVI경기,2022-01-14 01:15:00
761054,"글 처음부터 마지막 글 한자 한자 정독 하고 갑니다~ 이 글을 현대차 정의선 회장이 직접 보고, 많이 깨닫게 되기를 진심 바래봅니다~☆좋은글 감사합니다.",LU1I레이코나I인천,2022-01-13 16:17:00
761054,,드드드I코나EVI경기,2022-01-14 01:16:00
761054,"진심으로 현대라는 기업이 잘되길 바라는 마음이 섞여있다는게 느껴지네요^^ 근데 현실의 현대는 맛이갔죠--;10년전 기아차에 질려버려서 수리비폭탄; 고가as, 어려운 외제차만 타고있지만 알려진 어려움이니 제가 감내하고 타고 있습니다. 가성비에 현기차를 잠깐 흥미를 가지다가도 과거의 경험과 그 경영진이 현재의 경영을 하고 있다는 생각에 다시 외제만 보네요.그래서인지 정신적인 스트레스는 없네요. 전기차 시대가되니 이제 현대는 제네시스를 끝으로 무너져내릴것 같네요.. 안탑깝습니다.",가네샤ㅣ조에ㅣ경기,2022-01-13 17:05:00
