"id","title","content","likes","url","author","views","created_at","updated_at"
"18448400","아이오닉6 ICCU 불량 수리 후기","https://www.clien.net/service/board/cm_car/18435156 CLIEN안녕하세요.Ryung이라고 합니다.11-22일에 고속도로를 달리는 중간에 ""전원 공급 장치 점검"" 불량이 발생하여 인천 하이테크에 입고하였고, 23일에 다행히도 부품재고가 있어 수리 진행되었습니다.수리부분에서는 딱히 다른 이야기는 없었고 ICCU 불량으로 판정나서 교체하고 시운전까지완료해서 문제 없다고 연락받고 23일 저녁에 찾으러 갔습니다.딱히 뭔가 있는 후기는 아니지만 동네 블루핸즈보다는 하이테크에 입고 시키시는게 좋을거 같습니다.","1","https://www.clien.net/service/board/cm_car/18448400?combine=true&q=%EC%95%84%EC%9D%B4%EC%98%A4%EB%8B%89+iccu&p=9&sort=recency&boardCd=&isBoard=false","Ryung","3654","2023-11-29 12:29:58",""
"18440701","ev6스탠 계약 걸었는데 모델y가 아른거리네요","지난달에 폐차하고 차가 없는 뚜벅이입니다..제주도라 집밥 회사밥 충분히 있는 환경입니다보조금 추가까지 받아 예산 생각하고 ev6 스탠 어스 (하이테크+메리디안 스피커) 옵션해서 취득탁송기타포함 4450정도 나오네요. 계약건지 이제 거의 한달되어가는데 중고로 처분할땐 스탠 아예 똥값이다 겨울에 200밖에 안된다 이런저런 소리를 들으니 6개월 계약 기다리고 테슬라 모델y나 모델3하이랜드해야하나 고민이 참 많네요회원분들의 조언이 필요할때인듯합니다날씨가 급격히 추워지는 요즘 감기 조심하시고 안전운전하세요!","1","https://www.clien.net/service/board/cm_car/18440701?combine=true&q=%EC%95%84%EC%9D%B4%EC%98%A4%EB%8B%89+iccu&p=9&sort=recency&boardCd=&isBoard=false","찔레꽃향기는","4442","2023-11-25 10:15:19",""
"18437358","V2L 덕분에 집밥설치 수월하게 하고 있어요.","기다리고 기다리던 집밥 설치 업체분들이 오셔서 집밥을 설치중입니다.그런데 작업을 하려면 전기가 필요하다 하셔서 50미터 릴선을 꼽았는데도 마당 넓이 때문에 줄이 닿질 않습니다..결국 오닉이 꺼내서 V2L 연결해 공사중이네요. 덕분에 점심 먹으러 밖으로 나가지 못하고 집에 고립...오닉이는 밖에서 열심히 기사분들을 돕고 있습니다 ㅎㅎ 집밥 먹으려면 밥값해야하니까요.차박 외에 요렇게 또 써보네요V2L 벌목 ㄷㄷㄷㄷ","23","https://www.clien.net/service/board/cm_car/18437358?combine=true&q=%EC%95%84%EC%9D%B4%EC%98%A4%EB%8B%89+iccu&p=9&sort=recency&boardCd=&isBoard=false","chatGPT","8290","2023-11-23 11:38:33","2023-11-23 12:48:37"
"18435156","아이오닉6 전원공급 장치 점검! 경고등","안녕하세요.아이오닉6 구매한지 6개월이 지났네요.너무 만족하고 타고 다니고 있습니다.어제 퇴근길에 청계터널에 진입하자마자 전원공급장치점검! 빨간색 경고등이 표시 되네요ㅠㅠ고속도로 2차로로 달리다가 갑자기 30키로 이상 속도가 안나오고 차는 쌩쌩달리고갓길까지 차선변경하는데 정말 식은땀이 줄줄 여차여차 해서 정차하고 블루링크 SOS 버튼 누르고담당자자와 통화해서 가좌 블루핸드 하이테크에 입고하고 대차로 아이오닉5 받아서 집에 도착하니 12시가 넘었네요.4륜이라서 어부바 차량 기다리는데만 1시간을 넘게 기다리는데 4차선에서 화물차와 버스가 무서운 속도로지나가니 정말 무섭더라고 배터리는 완전 방전되어서 다행이 렉카 기사님이 여분의 12V 베터리로 점퍼해서어부바 하고 이제 수리 완료 될때까지 기다려야겠네요.Iccu 업데이트는 안받고 있었습니다.8시30분~9시 사이에 청계터널 근처 2~4차로에서 불편을 격으셨던 분들 계시면 죄송합니다.충전환경은5월달에 구매해서 집밥 에버온 7Kw 완속으로 충전하고 있습니다. 6개월 동안 급속은 SK일렉링크 3번이 끝이네요 전류 제한은 100%로 따로 설정은 변경한적이 없습니다.","1","https://www.clien.net/service/board/cm_car/18435156?combine=true&q=%EC%95%84%EC%9D%B4%EC%98%A4%EB%8B%89+iccu&p=9&sort=recency&boardCd=&isBoard=false","Ryung","5231","2023-11-22 08:57:28","2023-11-22 09:04:43"
"18427496","EV6 중고차를 구매할까합니다. 확인할게 뭐가 있을까요?","안녕하세요. 싼타페 하브 기다리는 도중에 -_- 10개월 기다리는 사이에 타다가 큰차 필요하면 그때 싼타페 사자는 마음으로...오늘 EV9을 시승했지만 시트포지션이 제 스타일과는 에바쎄바하게 안맞고 실주행을 해보니 빠운스빠운스한 승차감으로 역시 선호하지 않게 되어 돈을 모두 EV9에 꼬라박는것보다는 증명된 EV6를 중고로 구매해서 1년간 타볼까합니다.EV6는 4륜 GT라인에, 풀옵, 주행거리는 3만을 넘지 않았으면 하는 생각으로 찾아보니엔카기준http://www.encar.com/dc/dc_cardetailview.do?pageid=dc_compare&listAdvType=compare_list&carid=360088664550만원, 무광그레이http://www.encar.com/dc/dc_cardetailview.do?pageid=dc_compare&listAdvType=compare_list&carid=359253404399만원, 화이트두차량으로 대략 좁혀져있는 상태입니다.다른 차량은 옵션이 부족하거나, 가격이 좀 높거나, 주행거리가 엄청 길더라구요.다음주 쯤에는 한번 실물을 보러 다녀올 생각입니다.여기서 질문드릴게1. 취등록세는 380만원정도로 나오는데, 전기차는 취등록세 140만원까지 할인된다고 봤습니다. 맞겠죠?2. 일단 시운전이라든지 차 내부에서 담배냄새나 악취여부를 확인하고, 시트 하단에 오염이 있다던가 브레이크 캘리퍼등에 심한 녹이 있는지정도 확인해볼까 하는데, 추가로 어떤점을 확인해보는게 좋을까요?...추가로 아이오닉5를 보니까http://www.encar.com/dc/dc_cardetailview.do?carid=36365768&listAdvType=zzim_index이것도 괜찮아보여서 수원 갈때 같이 볼까합니다 ㅎ","0","https://www.clien.net/service/board/cm_car/18427496?combine=true&q=%EC%95%84%EC%9D%B4%EC%98%A4%EB%8B%89+iccu&p=9&sort=recency&boardCd=&isBoard=false","호윤","3858","2023-11-17 17:47:05","2023-11-17 18:17:52"
"18420492","GV80 EV, 아이오닉7","제목의 두 차종이 24년 7월 양산 예정인데거의 비슷한 시기에 출시를 할 거 같은데 GV80 EV가 1억 넘긴다고 보면 아이오닉7은 1억 안넘겨줄까요?","0","https://www.clien.net/service/board/cm_car/18420492?combine=true&q=%EC%95%84%EC%9D%B4%EC%98%A4%EB%8B%89+iccu&p=9&sort=recency&boardCd=&isBoard=false","아마노카","4706","2023-11-14 08:45:29",""
