post_id,cmt_content,cmt_author,cmt_created_at
1525581,일단 보험에서 해줄지 자차로 할지 모르지만 차주 인생은 많이 피곤해질듯요,코일I경기,2024-08-02 18:42:00
1525581,2일 손해보험업계에 따르면 이번 전기차 화재로 피해를 입은 차량 소유주들은 우선 본인이 가입한 자차담보(자기차량손해담보)를 통해 보상을 받을 수 있다. 이후 각 보험사들이 발화가 시작된 벤츠 전기차 차주의 보험사에 구상권을 청구하게 된다.​자차담보에 가입하지 않았다면 우선 피해 차주가 개인적으로 수리 등을 진행해야 한다.​라고하네용,대학원생l서울,2024-08-02 18:42:00
1525581,근데 이걸 피해차주가 다 부담할수 있을까요 ? 피해자 분들도 힘드시겠지만... 벤츠 차주분도 굉장히 힘드실듯요 😭,코카I9l경기,2024-08-02 18:44:00
1525581,피해차주가 뭐 튜닝을 한게 아닌이상 피해차주가 보상하진 않구요~ 벤츠가 부담하겠죠 베터리잘못이면 베터리사랑 같이요 ㅎㅎㅎ 어쨋든 피해자들은 그런걱정안해도되구요자차에서 된다고합니다,대학원생l서울,2024-08-02 18:46:00
1525581,ㅋㅋㅋ.. 저게 수리해서 타고 다닐 상태인가요?,상상하라I하이브I광주,2024-08-02 19:00:00
1525581,2일 손해보험업계에 따르면 이번 전기차 화재로 피해를 입은 차량 소유주들은 우선 본인이 가입한 자차담보(자기차량손해담보)를 통해 보상을 받을 수 있다. 이후 각 보험사들이 발화가 시작된 벤츠 전기차 차주의 보험사에 구상권을 청구하게 된다.​자차담보에 가입하지 않았다면 우선 피해 차주가 개인적으로 수리 등을 진행해야 한다.​우선 자기 보험으로 빠르게 받을수있어서 다행이네요,대학원생l서울,2024-08-02 18:42:00
1525581,벤츠차주 대물금액 이상 나오면 차주한테 구상할거같네요,구름이요I경기,2024-08-02 18:44:00
1525581,피해금액 어마어마할거같습니다 아파트 위층도 집에 시커먼먼지 다 들어왔다는데 청소비까지 ㄷㄷ,구름이요I경기,2024-08-02 18:45:00
1525581,벤츠 차주도 자차보험으로 자기차만 우선 보상받으면 됩니다~ 나머지는 보험사들끼리 알아서~,대학원생l서울,2024-08-02 18:47:00
1525581,대물금액이 있어요 무한정이 아니고,구름이요I경기,2024-08-02 18:48:00
1525581,피해금액이 대충 때려봐도 30억이상 나올거 같은데 대물 10억 이라치면 과연 20억을 차주 한테 구상한다는게 현실적이지 못한 관계로 대물 넘어가는 금액은 우선 보험사에서 처리하고 제조사와 소송 하는게 현실적일듯,톤토니쵸파l경기,2024-08-02 19:05:00
1525581,보험사가 자선사업가도 아니고 그렇게 안하죠 계약이 10억으로 되어있으면,구름이요I경기,2024-08-02 19:22:00
1525581,"피해자 -> 자기보험처리 피해자들보함사 ->차주보험사 청구 차주보험사 -> 대물한도 넘어도 우선 변제 차주보험사->화재원인에 따라 차주혹은 제조사등에 구상권청구 문제는 차량화재로인한 연기흡입등의 인명피해는 누가 보상인가? 자동차 보험사에서 대인접수할것인가? 주차장보험? 거주지에 있었으니 아파트 화재보험? 굉장히 복잡한 문제이고, 이로인해서 남겨지는 판례가 향후 동일사건의 판례가될것이기에 귀추가 주목되는건 맞습니다. 만약 제조사 책임없이 차주 독박으로 판결나면, 전기차 보급사업은 망하는 거죠. 내가 편하자고 남을 위험에 빠뜨리는건데, 100만분의1의 확율로 불났는데, 그것도 차주 책임이다? 저같은 전기차 매니아도 전기차 안탑니다.",고고고I니로아5I서울,2024-08-02 18:59:00
1525581,정확히 짚으셨다고 저도 동감합니다 이걸 차주에게 덮어씌운다면 앞으로 한국에서 전기차 팔지 않겠다고 공언한것과 같다고 봅니다,톤토니쵸파l경기,2024-08-02 19:08:00
1525581,이말에 동감 전기차 망하면 한국 도 망하는겁니다 ㅎ 저도 결과가 궁굼합니다 저는 결론만 봅니다,아이폰ㅣ아5ㅣ안산,2024-08-02 19:09:00
1525581,벤츠 대물보험 10억 들었다면 벤츠 보험사는 10억까지만 책임. 나머진 차주 책임. 벤츠는 책임지려할까?,오닉이I아5I김해,2024-08-02 19:07:00
1525581,이번일은 쉽게 안넘어갈듯 한데.. 앞으로 전기차 타기 꽤나 불편해질지도 모르겟네요,고조파l모3l세종,2024-08-02 19:24:00
1525581,차도 문제지만 아파트 데미지는 또 어떻게 차보다 비싼게 집값인데,토라노몬Iid4I서울,2024-08-02 19:46:00
1525569,많은 차량으로 화재가 확대되어 불을 끄는데 많이 시간이 소요됐네요.,슬로우실버ㅣ오닉ㅣ충,2024-08-02 18:29:00
1525569,다행인건 큰인명피해는 없어서죠,봉구야Iix1l서울,2024-08-02 18:29:00
1525569,큰 인명피해 없오서 다행이네용 ㅠㅜ,킴소토IEQBI경기,2024-08-02 18:32:00
1525569,보상은 차주가 다해야되나요 민사소송에 신불자되는건가;;,딱지lQ4l서울,2024-08-02 18:45:00
1525569,기사마다 40 80 다 다르네요,크리스l모SYEV9l경기,2024-08-02 19:04:00
1525569,너무너무 무섭네요.. 뭔 이런일이ㅜ.. 전기차사용자로서....어떡해야할지 남편과도 의논중이네요.. 너무 너무 심각합니다,쉐보레볼트하늘색,2024-08-03 00:16:00
1525561,배터리에 열이 가해지면 열폭주가 발생하는거같네요 방염 방열 처리자체가 미진한거아닌가싶네요 ...,정온lM3l전북,2024-08-02 18:21:00
1525561,"불이 작게튀었는데 그게 번져서 배터리에 가해지고, 그게 갑자기 터져버린경우네요. 가장 합리적인 의심이네요",해물모lix3l서울,2024-08-02 18:22:00
1525561,그래서 더욱 전기차 자체에 대한 혐오감정으로 번지는게 이해가 안가고 이해를 해선 안된다고생각하는데 왜이렇게들 난리인지모르겠네요 이건 벤츠가 잘못한거같은데...결과가 좀 빨리 나왔으면 좋겠는데 그냥 사람들은 전기차 자체에 대한 혐오만 계속 자가증식해가겠죠,정온lM3l전북,2024-08-02 18:26:00
1525561,벤츠만의 문제가 맞다고 봅니다 저도. 배터리에서 자연발화? 말도안됩니다.,해물모lix3l서울,2024-08-02 18:28:00
1525561,무섭네여,국자,2024-08-02 18:22:00
1525561,eqa는요? eqb는? 두모델도 해죠야죠,봉구야Iix1l서울,2024-08-02 18:25:00
1525561,배터리 문제를 피해가려는 꼼수가 아니길 바랍니다....그런데 이 생각을 지울 수 없네요.,두꺼티l인천,2024-08-02 18:28:00
1525555,첫날 현기차 아니냐고 하는 사람들 엄청 많았어요,소멸은신I모델YI인천,2024-08-02 18:13:00
1525555,화재는 전기차 전체의 문제라는 큰 교훈이지요,정상길l오닉Nl해운대,2024-08-02 18:14:00
1525555,그러게요 전기차 다 리스크가 있다가 답이네요,여내집ㅣ인천,2024-08-02 18:15:00
1525555,맞습니다,정상길l오닉Nl해운대,2024-08-02 18:18:00
1525555,현기 전기차 화재 : 플라스틱 하우징이 어쩌구 ... 내가 이래서 현기 안샀다는 저쩌구 ...벤츠 전기차 화재 : 남일 아닙니다. 다같이 대응해야합니다!,코니I코나SX2I성남,2024-08-02 18:28:00
1525555,극공감합니다 비엠유저분들도 당황한 기색이. .,정상길l오닉Nl해운대,2024-08-02 18:28:00
1525555,ㅎㅎ 중국산 배터리라고 엄청 까는데요,가즈아leqesuvl청주,2024-08-02 18:42:00
1525555,우리나라에서 불난것만 해도 LG가 제일 많을텐데 ㅋㅋ 어휴 ㅋㅋ,코니I코나SX2I성남,2024-08-02 18:45:00
1525555,특정 배터리나 제조사를 비난할 생각은 없지만 좀 너무해요 이때다 싶어서 물어뜯는거 같아요 그래도 이번 화재에 인명피해는 없어보여서 다행입니다,가즈아leqesuvl청주,2024-08-02 18:46:00
1525555,당황할이유가있나요 ??,똥꾸리Ii4I서울,2024-08-03 00:45:00
1525555,네 ㅋ,정상길l오닉Nl해운대,2024-08-03 01:01:00
1525555,"아파트 안전진단 통과가 안 된다면. 아파트도 벤츠에서 배상해야 되면, 사업 철수 해야 될지도",수IeGV70I경기,2024-08-02 18:29:00
1525555,심각하네요상황,정상길l오닉Nl해운대,2024-08-02 18:41:00
1525555,중궈 배터리 실드치는사람은 진짜 이해 안가요 이건 그냥 중국인이라고 봐야할듯,순천사랑I닉5모Yl순천,2024-08-02 18:46:00
1525555,배터리가 어디냐가 중요한게 아닌것같기도하고..,정상길l오닉Nl해운대,2024-08-02 19:19:00
1525555,"태세전환, 내로남불 쩔면서 뻔뻔하게 글쓰는 사람들 보면, 얼굴가죽이 보통 두꺼운게 아니더군요.",에코비엠wI아6I전북,2024-08-02 18:59:00
1525555,현기 플라스틱 모듈은 원가절감이라더니 독일차 중국 배터리 원가절감에는 눈감는 사람들이죠,드라이브갈까II경남,2024-08-02 19:00:00
1525555,극공감합니다,정상길l오닉Nl해운대,2024-08-02 19:19:00
1525555,분쟁글 쯪쯔,크리스l모SYEV9l경기,2024-08-02 19:05:00
1525555,ㅉㅉㅉ 이때다 싶어 다 나와서 한마디씩,아수라발발타II4I세종,2024-08-02 19:05:00
1525555,그 독삼사가 알루미늄 커버와 격벽하고 화재 전이를 막는 이유가 있다고 독일 기술 어쩌구저쩌구 하시는분들 다 조용해지심 ㅋㅋㅋㅋㅋ 전문가라고 자칭하셨던 닉네임 몇분 기억하고있는데 하루종일 안보이심요 ㅋㅋㅋㅋ내가 분명히 리튬들어가면 어떤 알류미늄 할애비가와도 못막는다고 그렇게 이야기했는데 현기차 탄다고 커버친다고 엄첨 비난하더니,킥스I아이오닉5NI제천,2024-08-02 21:26:00
1525555,비엠오너들도 아이오닉을 그렇게 싫어하더군요,정상길l오닉Nl해운대,2024-08-02 21:57:00
1525555,그럴만도해요... 아5n이나오고나서부터는 완전 판세가 뒤집혔으니 좀 아니꼽긴하던데 m5타는 친구도 아5n 태워주고나니까 너무재밋다는데 ㅋㅋㅋ,킥스I아이오닉5NI제천,2024-08-02 22:01:00
1525555,얇은 알루미늄 조가리론 화재지연 효과 없다는거.. 오히려 열전도를 높여 단점도 있다그러더니. 이렇게 확인되네요.,공삼공I아5I경기,2024-08-03 15:40:00
1525555,이분 계속 분쟁유도글 쓰시네. 운영자님 이런분 재제 안해주시나요?,개쌀Ii4gv70l울산,2024-08-05 06:58:00
1525555,확실한건 ICCU 하자 화재 최고많은 흉기는 줘도안탐,혀니IEQE SUVI구미,2024-08-08 22:47:00
1525555,이번 아파트대규모화재사건 차종이 벤스입니다,정상길l오닉Nl해운대,2024-08-09 04:59:00
1525545,아아 감사합니당,후니혀니팦I강원,2024-08-02 18:27:00
1525545,오 받기힘들다던데 가능성 보아네여,국자i모델yi진주,2024-08-02 18:28:00
1525533,"이 사건이 전기차 전체의 혐오로 바뀌지 않았음 합니다. 그리고 벤츠사는 이번 피해보상에 적극적으로 임해야 할 것이며, 국토부는 모든 전기차량에 대해 배터리제조사를 공표해 줄 것을 건의 드립니다. 소비자의 선택에 중요한 영향을 미칩니다.",해피트리D,2024-08-02 17:58:00
1525533,벤츠화재인데 왜 모든 전기차가 연대책임을 져야하나요? 코나 불날 때도 그랬나요?,슬로우실버ㅣ오닉ㅣ충,2024-08-02 18:11:00
1525533,글을 잘 읽어 보시는게.. ㅡㅡ 어려운 글이 아닌데..,해피트리D,2024-08-02 20:28:00
1525533,글좀 정독해보세요...,타고싶다Iev6l경기,2024-08-03 10:57:00
1525533,일이나면 해결할 생각보다는 누구때문인지 잘잘못 찾는사람들..,제발legv70아5l천안,2024-08-03 12:47:00
1525533,책임이 아니라 전기차혐오로 번지지 않기를… 이잖아요 글 좀 잘 보세유,테슬라모델ioi,2024-08-03 15:56:00
1525533,중국 묻으면 뭐든 다 이상해지네요. 벤츠 지분 20% 가까이가 중국이던데..,RX78lID4l서울,2024-08-02 18:05:00
1525533,국내 배터리에 들어가는 코발트도 거의 다 중국 지분이에요,쀏l아5넥쏘l경기,2024-08-02 18:31:00
1525533,코발트 흑연 네오디뮴 이런건 중국산인거하고 배터리는 다른거 같은데요.,슈타인99Iegv70I서울,2024-08-02 20:11:00
1525533,다음주 전기차 출고인데 이번 사건으로 인해서 아파트 주민들 눈치를 봐야할것 같아 걱정이 크네요..ㅠ.ㅠ현재 모든 전기차는 지하주차장에 주차를 못하게 하자는 여론이 생기기 시작하네요..ㅠ,친환경IQ4이트론I경기,2024-08-02 18:08:00
1525533,로터스 엘레트라도 catl ncm 811 배터리라 저도 마음 접었습니다. 내연기관으로 가야겠네요. ㅠㅠ,루팡I엘레트라I서울,2024-08-02 18:23:00
1525533,최근에 지하2층에서 배터리화재 사건에서 이상한 점은배터리에서 발화가 시작되었지만 열폭주까지는 안갔다고 기사에 나와 있어관련 사진을 찾아봤습니다.LG배터리의 기술력 때문인지 아니면 운이 좋았던건지 알수가없네요.,볼트I볼트EUVI경기,2024-08-02 18:25:00
1525533,전기차 전체를 죄인 취급하는 물타기는 사라졌으면 합니다.,볼트I볼트EUVI경기,2024-08-02 18:24:00
1525533,전세계적으로 엄청나게 팔리는 catl배터리인데 위와 같은 논리면 기사가 한두건이 아니고 수백건은 올라올텐데 맞아요? 생각좀 하고 삽시다,힐스테이트,2024-08-02 19:03:00
1525533,중국에서 숨겨진 사실들이 많습니다선생님은 중국배터리 들어간 전기차만 평생타십시오전 국내 배터리 들어간걸로 타렵니다 ^^,씨온I타이칸I송도,2024-08-02 19:14:00
1525533,씨온님 의견에 동감합니다예전에도 제가 중국산 배터리의 우려로 글을 썼는데 중국산 이제 무시 못한다는 글로 언쟁이 있었는데요아무리 중국산이 많이 바뀌었다 해도 중국산은 중국산입니다,길동gv70화성,2024-08-02 19:29:00
1525533,그래요? 타이칸 화재 없길 바래요ㅎㅎㅎ^^ 비싼돈 주고 샀는데 터지면 슬프잖아요,힐스테이트,2024-08-02 19:30:00
1525533,https://www.autoevolution.com/news/mercedes-benz-eqe-loaner-burns-to-a-crisp-in-florida-garage-speculations-abound-218388.html작년에 플로리다에서도 eqe한대 차고에서 혼자 탔었네요.,슈타인99Iegv70I서울,2024-08-02 20:13:00
1525533,그러니까 그거 말고 또 있냐는거죠,힐스테이트,2024-08-02 21:07:00
1525533,2020년도 catl 811 아이온에 처음 장착하고 출시 이후 4개월 만에 3건의 화재로 이후 523으로 배터리 교체해서 판매,차단판독기I울산,2024-08-03 09:14:00
1525533,eqe 2건이면 적은거고 그 외에 몇건 더 있는건 아는데 다른 회사 배터리가 화재 더 많은건 알고 있죠?,힐스테이트,2024-08-03 09:47:00
1525533,시진핑바보 해보세여,차단판독기I울산,2024-08-03 09:47:00
1525533,더 심한욕도 하고 싶은데 시진핑바보 됐나요?,힐스leqel대전,2024-08-03 09:49:00
1525533,아 eqe오너여서 catl배터리 쉴드 치시는거였나요? 왜그래요? 차와 몰아일체 하셧나요?,차단판독기I울산,2024-08-03 09:54:00
1525533,뭔 똥개훈련인가 싶네 catl배터리가 문제 있다면 객관적인 자료를 가지고 반박해요 중국시장 제외하고도 판매량 1위인데 다른 배터리보다 화재건수 많은지 확인하고요,힐스leqel대전,2024-08-03 10:06:00
1525533,네이버라고 검색하면 관련자료와 뉴스를 보여주는 인터넷 웹사이트가 있습니다 거기에 catl 811 검색해보시면 위에 말한 아이온 화재건과 이미 4년전부터 안전성 이슈에 대해 정보를 얻으실수있어요 지금보니 차와 몰아일체가 아니라 배터리랑 몰아일체하신 재밌는 분이시네,차단판독기I울산,2024-08-03 10:08:00
1525533,그러게요 ㅋㅋㅋ,씨온I타이칸I송도,2024-08-03 10:08:00
1525533,그정도는 누구나 다 압니다 근데 객관적인 자료로 타사 배터리랑 비교하면 화재가 많냐는거죠 그거 몇건되는데요? 판매량대비 화재건수 엄청 적은건데 계산 안돼요?,힐스leqel대전,2024-08-03 10:28:00
1525533,아니그럼 catl811ncm화재 적은 데이터 보여주세요 내가보기엔 lfp전문 회사가 기술(특허)없이 무리하게 도전했다가 문제생긴걸로 보이는데요?? 하이니켈 특허피하기 어려운거 팩트인데??짱깨 아이온 811 출시했다가 불 ㅈㄴ나서 523배터리로 바꾼거 팩트인데??,차단판독기I울산,2024-08-03 10:57:00
1525533,특허 피하기 어렵단 이유로 못 만들 것이라는 추측이 맞아요? 그럼 현대기아도 특허 피하기 어려워서 하이브리드 자동차 못 만든다고 봐야 되나요? 반박 해 보세요,힐스leqel대전,2024-08-03 11:06:00
1525533,??그래서 토요타랑 구동방식이 다르잖아요 암것도 모르시는 양반이시네요,차단판독기I울산,2024-08-03 11:04:00
1525533,그러니까 특허 피하기 어렵다는 이유로 말도 안되는 억지 부리지 말라고요,힐스leqel대전,2024-08-03 11:07:00
1525533,"억지는 누가 부리는지 미취학자녀,조카,지나가는 초등학생 정도 아이들에게 댓글 보여주면 알려줄겁니다",차단판독기I울산,2024-08-03 11:21:00
1525533,배터리가 문제 있는지 아닌지는 통계가 알려주는데 떼쓰는 사람이 누군지 원...,힐스leqel대전,2024-08-03 11:22:00
1525533,통계가 무었인지 네이버에 검색 해보세욬ㅋㅋㅋㅋㅋㅋㅋㅋㅋㅋ,차단판독기I울산,2024-08-03 11:23:00
1525533,화재건수 몇건 있다고 위에 언급했는데 논리적으로 못따질거면 그냥 조용히 가요 ㅋㅋㅋ 그냥 애잔하네,힐스leqel대전,2024-08-03 11:27:00
1525533,같은 고등교육은 받은 사람이 맞나 싶어요 이제 그만 하고싶으니 차단할게욬ㅋㅋㅋㅋㅋ,차단판독기I울산,2024-08-03 11:28:00
1525533,그쪽은 논리가 뭔지 모르는걸로 보아 초등교육도 못받으신거 같아요 안쓰럽습니다 잘 가시길^^,힐스leqel대전,2024-08-03 11:29:00
1525533,"세계 배터리 판도는 LFP 중국, NCM 한국이죠. CATL이 한국 NCM 따라 만들겠다고 했는데 기술력이 딸려 이 사단이 난거고 한국도 LFP좀 만들어 보겠다고 작년부터 개발 들어간거고...",라온74I미보유I용인,2024-08-02 19:15:00
1525533,타이칸 중국산 배터리인가보네요 엄청 터지네,힐스테이트,2024-08-03 07:23:00
1525533,수고많으십니다 ^^,씨온I타이칸I송도,2024-08-03 09:57:00
1525533,지금 타이밍에서 다 피할순 없고 catl의 해당베터리차량은 무조건 중고로라도 사지 말아야죠,왕실람보l서울,2024-08-03 12:03:00
1525533,ncm 523은 문제가 없나용?,물기운i니로evi부산,2024-08-03 19:32:00
1525519,겁나 심각한거죠 당장 팔아버리고 싶은데,봄봄ll경기,2024-08-02 17:36:00
1525519,그래서 아전인수라는 사자성어가 있는듯요.,상상하라I하이브I광주,2024-08-02 17:36:00
1525519,당연한거죠 다른곳은 태반이 전기차 안타니까 욕하는거고...여긴 타니까 덜 욕하는거고요또 여기는 관심있으니까 리콜된 차라는것도알고 차종 브랜드에도 더 잘알거고요,정온lM3l전북,2024-08-02 17:37:00
1525519,뭐가 당연한가요 ㅋ현실 파악을 못 하고 있다는 얘긴데,오니크크ㅣ서울,2024-08-02 17:38:00
1525519,온도차 큰게 당연하다는거고 거기에 대한 근거를 말했는데요...?남들이 욕하면 같이 욕해야하나요?,정온lM3l전북,2024-08-02 17:40:00
1525519,욕같이 안해주면 현실파악못하는거임? 전기차 타면 무조건 불나는것도아니고 ㅋㅋㅋ 지가뭔데 결론을내려,이쫀지 인천,2024-08-02 18:04:00
1525519,사고를 가볍게 별 거 아닌 것 처럼 생각 하는 사람들이 문제라는 건데 뭘 욕을 같이 하고 안 하고를 논하심? 그리고 마녀 사냥 어쩌고 하시는데 마녀 사냥은 사실이 아닌 걸 왜곡해서 피해자를 만들 때 쓰는 말인데 청라 화재 사고가 왜곡임? 뭔 되도 않는 예시를 들고 있으심? 그리고 댓글 수정 좀 그만 하셈. 생각을 정리 하고 글을 다시던가.,오니크크ㅣ서울,2024-08-02 18:11:00
1525519,님아 글을 잘 읽으셈. 괜히 긁혀서 반 말 하지 말고,오니크크ㅣ서울,2024-08-02 18:10:00
1525519,ㅋㅋㅋㅋㅋㅋㅋㅋㅋㅋ 아니 내가 사고를 가볍게 여긴다고 했음? 이 사건을 보고 온도차가 나는 이유를 설명한거잖아,정온lM3l전북,2024-08-02 18:11:00
1525519,ㅋㅋㅋ긁혀서 반말 하는 수준,오니크크ㅣ서울,2024-08-02 18:13:00
1525519,초딩인가... 고생하쇼,정온lM3l전북,2024-08-02 18:14:00
1525519,님은 가정교육이나 잘받으세요 ㅋㅋㅋ 받을수도 없겠지만 ㅋㅋㅋ,이쫀지 인천,2024-08-02 18:19:00
1525519,님 같은 사람 한테 받는 것 보단 나을 듯~~아..못 시키려나?? ^^,오니크크ㅣ서울,2024-08-02 18:25:00
1525519,"저번 EV6화재도 충격이 좀 컸지만, 이전 청라 화재는 그 때랑은 충격이 많이 다르네요. 일단 청라 주민들 피해 본 거 생각하면 내가 당사자였다면 제 잘못이 아니어도 엄청 괴로울 듯.",오니크크ㅣ서울,2024-08-02 17:37:00
1525519,그니까요..ㅠ,오니크크ㅣ서울,2024-08-02 17:39:00
1525519,전기차 운행 경험이 있는 사람과 없는 사람의 차이 같습니다. 문제는 전기차를 구매할 신규 수요가 줄어들면 국내 전기차 시장 자체가 작아져서 기존 전기차 사용자들도 어떤 형태로든 영향을 받는다는 점입니다.,사과I아이오닉I경기,2024-08-02 17:39:00
1525519,심각하죠 그리고 이웃이 전기차면 걱정되죠;;,후끄니I예정I수원,2024-08-02 17:41:00
1525519,엉청난 사건이죠 지하에서 불나면 정말 대책이 없네요,일산 월칼,2024-08-02 17:42:00
1525519,이걸 심각하게 생각 안 하시는 분들은 .. 참.. 평소 생활이 궁금해지네요,쩡유우l모Yl서울,2024-08-02 17:42:00
1525519,마녀사냥에 내가 마녀다 라고 안외치는거죠 전기차를 탄다고 부끄러움까지 느껴야하는건 정상이 아닌거같습니다,정온lM3l전북,2024-08-02 17:55:00
1525519,심각하게 생각하고 싶지 않은거겠죠 전기차도 큰돈 들어가는 자산인데 자산가치가 떨어지는 것이라 생각하니까요...,조간I없음I인천,2024-08-03 00:13:00
1525519,졸라 심각하죠.. 현기차야 늘 그렇듯 니들이 그렇지 머 잘 못 만들었나보다 하는데 브랜드 빨 높은 벤츠전기차 자연 발화하니... 믿을 놈 하나도 없다고 느끼는거죠.. 여기에 catl 이라서 그렇다는 쉴드 치고 있으니 참 한심합니다.,아수라발발타II4I세종,2024-08-02 17:45:00
1525519,CATL드립은 진짜 ㅋㅋ,오니크크ㅣ서울,2024-08-02 17:46:00
1525519,내연 전기 2대를 운행하는 제입장에서도 전기차가 지하서 제차옆에 대면 별로일듯해요. 코나 화재 종종 날때 저또한 충전시 외엔 지하에 들어가질 않았어요. 당분간 코나는 지상에만 대야겠네요,연천l코나l양택이,2024-08-02 17:47:00
1525519,캐즘 돌파가.. 결국 이렇게.. 안되나 싶기도 하네요,그깐아이오티l성남,2024-08-02 17:47:00
1525519,주변에서 자꾸 물어봐서 스트레스 받습니다,칠오ㅣ오닉5ㅣ 경기,2024-08-02 17:50:00
1525519,차량 1대로 아파트 14백 세대에 피해를 준거니 엄청 큰일이죠.. 피해복구도 언제 이루질지 알 수 없는 상황이고..피난민도 생겼으니 재해에 해당할 정도로,비개인오후I부산,2024-08-02 17:51:00
1525519,코나 때가 더 심각한거 아니였나요?,바른시민l l부산,2024-08-02 17:51:00
1525519,코나 때보다는 피해규모가 막대해서 이번 화재사건이 임팩트가 더 있을걸로 보여집니다,쀏l아5넥쏘l경기,2024-08-02 18:44:00
1525519,아무리 배터리 화재라고는 하지만 40대나 불이날 화재인지 이상 하네요 스프링클러 있었을텐데 몇년전 지하주차장 스팀세차 담배불 화재가 생각나는 사건이네요 그때도 스프링클러 작동 안했다 했는데,바른시민l l부산,2024-08-02 17:53:00
1525519,바로 진압되고.물 뿌려도 안꺼진거예요.밧데리가 전소되어야 꺼지는거라구요.,내인생의너는별ㅣ인천,2024-08-02 18:05:00
1525519,리스크를 안고 불안감에 차를 계속 몰아야 하는게 진짜 큰 단점이네요 ㅜㅜ차라리 지상에 주차라도 하면 맘이라도 편할텐데 요즘 신축은 지상에 주차공간이 거의 없으니...,증기I코나I파주,2024-08-02 17:54:00
1525519,지하에 못 대게 할 거면 지상에 만들어줘야죠. 대안은 마련해줘야...물론 각자 아파트 커뮤에서 알아서 할 일이겠지만,오니크크ㅣ서울,2024-08-02 17:55:00
1525519,저 청라주민이예요 .어제 도시가마비되었어요.겁나요.저는 사람이죽지않은게 감사할 따름이예요.ㅜㅜ.만약 대낮에 폭발이였다면 더 무섭네요. 6시에 일어난 사고라 시민들 대처가 빨랐고 소방대원이 1500세대 일일이 문 두들겨서 집안에 사람있나없나 확인해서 못 빠져나간사람 구출했어요. 지금도 사람들 집에 못 들어가요. 유독가스 있고.온통 난리예요.너무 무서워요,내인생의너는별ㅣ인천,2024-08-02 18:05:00
