post_id,cmt_content,cmt_author,cmt_created_at
1532847,심증은 백프로나 물증이 나와야죠 다탓는데?,새빛l코나l경기,2024-08-08 15:23:00
1532847,"그렇죠, 저렇게 다 타버리면 결국은 책임소재 불분명하다고 결과 나올까봐 그것도 걱정입니다.",집갸I모델3I서울,2024-08-08 15:27:00
1532847,"밴츠차주 책임이라고 말하는 분들은, 본인들도 소비자인데, 소비자권리를 내려놓는 주장이라는걸 모르고있는듯합니다. 현재까지 노출된 정보로는 벤츠차주님도 결국 무과실에 피해자이실텐데 말이죠.. 소비자들끼리 싸우는게 무슨 상황인가 싶습니다....",와우l아이오닉5l광주,2024-08-08 15:23:00
1532847,제 글의 포인트가 이거였습니다. 왜 소비자들끼리 싸워야 하는지 모르겠습니다.차 잘 충전해서 세워둔건 누가봐도 정상적인 차량의 사용이라고 밖에는 볼 수 없지 않을까요..,집갸I모델3I서울,2024-08-08 15:30:00
1532847,차주 잘못했다고 비난한 글은 아직 못본거같아요~,하늘맑을ii구리,2024-08-08 15:30:00
1532847,이번 화재로 전기차를 타는 것 자체를 뭐라고 하시는 분들도 계십니다그냥 그런 부분들이 안타깝습니다. 이 사건의 본질을 흐리는것 같아서요..,집갸I모델3I서울,2024-08-08 15:36:00
1532847,당장 네이버나 유튭에 가시면 혐오댓글들 수두룩합니다.전기차를 화장차라고 하는 것들도있는데 분통터지죠,양양희I타이칸I대전,2024-08-08 15:49:00
1532847,타 사이트 말고 여기서요,하늘맑을ii구리,2024-08-08 16:33:00
1532847,여기는 전기차카페니 저도 못봤어요,양양희I타이칸I대전,2024-08-08 16:37:00
1532847,있긴한데 그냥 분란유발자인것 같네요 https://cafe.naver.com/allfm01/1532679?tc=shared_link,아르마I모Y볼트I인천,2024-08-08 22:54:00
1532847,좋은 말씀이시고 주변에 알리려고하나 해명이되버립니다.그리고 모두 귀를 닫고있고요 답답하기 그지없네요.,양양희I타이칸I대전,2024-08-08 15:48:00
1532847,기존에 전기차 안좋게 보던 사람들이 좋은 공격거리가 생겨서 그런듯 합니다.,좀비성기사I니로I광주,2024-08-08 15:52:00
1532847,진짜 게시판이고 댓글들 보면 카라큘라가 생각나요 .. 겁나 정의로운척 하면서 분탕 치는 게시글 쓰는사람 많은거 같아요 그런사람들 넘 역겹습니다!! ^^ 무슨 신격화 라도 받고싶은 관종들이 일케 많은지...답답하네요..ㅎㅎ,쭈니lev6l서울,2024-08-08 15:54:00
1532847,"세상에는 정상적인 판단을 하기에는 너무도 지식이 부족하거나 지능이 떨어지는 사람들이 많습니다. 그런 사람들이 착하기라도 하면 좋은데, 그렇지 못하고 인성까지 고약한 사람들이 있습니다. 그런 사람들은 일종의 장애자들입니다. 너그러이 감싸주기가 어려우면, 그냥 무시하시기 바랍니다. 인간사회가 그렇습니다.",무벌타,2024-08-08 15:57:00
1532834,"차주로서 기분 나쁘시겠지요.....그 마음 잘 압니다.소수의 분탕도 있겠지만, 다수는 걱정되서 하는 얘기일겁니다.세상이 무관심하지는 않을 거에요.이런저런 뉴스들로 무뎌질 수는 있겠지만요.피곤하시겠지만, 다 지나갑니다......-지나가던 코나 차주-",순돌이I코나I대전,2024-08-08 15:06:00
1532834,같은 전기차타는 마음으로 걱정해주시는분들 마음을 잘 알죠...근데 그렇지 못한 소수로 인해 일이 점점 커지는것같아서요...,저시IEQEI분당,2024-08-08 15:08:00
1532834,울 아파트도 잠잠해요.잠잠한 사람은 글을 안쓰기 땜에 엄청 많은곳에서 이슈가 되보이죠.사실 완전 신축 아팟은 쪼매 관심이 일듯요.,포비l팔공오닉5l경남,2024-08-08 15:06:00
1532834,완전 신축은 관심 없음 ㅋㅋㅋ어차피 지상주차장이 없어서,빠떼리I모XI세종,2024-08-08 15:10:00
1532834,타워주차장은 원래 무게때문에 suv 대형세단 전기차가 대부분 주차금지였는데 그것가지고도 타워주차장 출입금지당했다고 하시는분들도 있더라고요그런글쓰시는분들은 전기차 소유자가 아닌것같더라고요,저시IEQEI분당,2024-08-08 15:10:00
1532834,신축은 커뮤니티 활동도 왕성하고 자기아팟에 대한 애정이 구축보다 큽니다. 지상 주차장 없으니 쿨하게 오케이 한다구요? ㅋㅋ,포비l팔공오닉5l경남,2024-08-08 15:13:00
1532834,세종은 조용한데요??문제 있나요???,빠떼리I모XI세종,2024-08-08 15:41:00
1532834,지금 짓고있는 아파트 기다리는 중인데 26년 완공.. 지상주차장 없고 상가용 지상만있는데 전기차 올리자고 의견 나옵니다,경기ll열사마,2024-08-08 15:14:00
1532834,지극히 공감합니다,착한남자,2024-08-08 15:18:00
1532834,한동안은 동호회 신규가입을 제한하는것이 동호회에도 좋겠다는 생각입니다. 서로 언쟁해봐야 결국 그 끝은 막장이더라구요,낙파리알I블루온I경남,2024-08-08 15:19:00
1532834,"공감합니다. 우려와 정보를 공유하고자 하는 마음이라고 하지만 실제로는 정보를 알려주어도 부정하는걸 보면 그냥 분위기를 조성하여서 여론이나 언론에서 부정적인 인식을 만들어주기를 바라는거겠죠. 원인이 무엇인지 조사결과를 기다리고 예방을 위한 방법은 이후에 대책을 고민해도 늦지 않을듯 싶습니다. 어차피 개인이 현재로서 해결할 방법도 없구요. 지금의 분위기는 결국, 예비구매자 입장에서는 할인이나 시세하락을 바라는 사람들도 있을테고 전기차에 대해 부정적인 사람들에게는 이용을 제한시킬 수단으로만 이용될뿐이죠.",마루몽IEV6I경기,2024-08-08 15:33:00
1532834,신축은 오히려 젊은 애들이라 그냥 조용 하지만 구축 나이 잠잠하면 아주 노발대발 남 꼴깝을 넘어섬,아이폰ㅣ아5ㅣ안산,2024-08-08 15:51:00
1532834,우리 아파트는.. 앞에서 주민 몇분이 일인시위 중입니다;;;;,나뚜르,2024-08-08 17:01:00
1532834,"저희 아파트 오히려 충전기 증설중입니다. 조용하고 눈치 안봅니다. 다들 시기가 그런지라 심리적으로 더 그럴꺼라 생각합니다. 이카페에서 가장 어의없던 댓글이 생각나네요. “벤츠 전기차 주차장 출입금지 시키자"" 지금 생각해보면 그냥 분탕질 하려고 들어온 인간이였을꺼예요!!",하율lEQEl인천,2024-08-08 17:12:00
1532823,해야죠 현대도 코나 배터리 새거로 다 리콜해줬자나여,리브레lEQAl평택,2024-08-08 15:03:00
1532817,3천대면 자체 결함 조사 후 리콜 하겠네,빠떼리I모XI세종,2024-08-08 14:55:00
1532817,리콜하면 벤츠가 인정하는 꼴인데~~~그러면 벤츠가 피해보상 ?,부엉이l전북,2024-08-08 15:01:00
1532817,어차피 인정 안하면 저 3천대중 얼마나 불탈지 모름 전기차 사업 접겠다는거임,빠떼리I모XI세종,2024-08-08 15:03:00
1532817,국토부 리콜은 강제 리콜임~ 벤츠가 인정하고 말고 할 것도 없음.. 증거도 여러곳에 명확하고~,올더타임lgv60ev9서울,2024-08-08 15:05:00
1532817,전기차 가진 차주분들이 많이 불안하네요~ 아무래도 사태처리가 굉장히 중요한데~ 언제쯤 결론이 날까요?,쏭송ㅣix3 l 인천,2024-08-08 15:16:00
1532817,벤츠가 하기 나름이겠죠? 인정하고 사죄하고 배상하면 넘어갈 수도 있으나~ 아무 죄없는 소비자 한 명과 소송하겠다고 나서면 국내시장 퇴출이죠.,올더타임lgv60ev9서울,2024-08-08 15:19:00
1532817,청라아파트 화재같은사태는 진행형이라는거네요 ㅜ,은호I트론q4아6I원주,2024-08-08 17:32:00
1532802,내연차 판촉하는건가보네요,콜렉터l타이칸l판교,2024-08-08 14:44:00
1532802,D급 20kg 소화기 주면 인정,개냐옹I아오5I천안,2024-08-08 14:47:00
1532802,이건 뭐 티배깅하는건가;;;,막장판금IEV9I아산,2024-08-08 14:49:00
1532802,다른 브랜드면 그러려니 하겠는데 이건 뭐...,킹스턴l아이오닉l김해,2024-08-08 14:50:00
1532802,벤츠때문에 전손 난 차주한테 차량용 소화기지급ㅋㅋㅋㅋㅋ 이정도면 싸패 맞죠? 저는 다른 브랜드가 저리했다해도 소화기지급 이런건 꼭 놀리는거같고 이해 안가네요,울산llID4l서울,2024-08-08 14:53:00
1532802,이거 진짜 상황파악 못하는 것들이네요. 지들이 그 아파트가서 자원봉사해도 부족할판에.,어려워요IEV6I전북,2024-08-08 14:52:00
1532802,와 이건 진짜 ㅋㅋ,컴초I아이오닉5NI김포,2024-08-08 14:53:00
1532802,역배들어가는거 쩌네요 증말,도나텔로IEUVI파주,2024-08-08 14:53:00
1532802,20%도 아니고 2%라니....,클라비ll군포,2024-08-08 14:53:00
1532802,이건 도를 넘어섰네요...,그림통IM3IID4I대전,2024-08-08 14:53:00
1532802,다른곳에 퍼가도되나요??,달달달I코나I경기,2024-08-08 14:56:00
1532802,갈때까지 갔군요 ㅡㅡ,쭈쭈ev6충남,2024-08-08 14:56:00
1532802,출고시 소화기 증정 ㅋㅋㅋㅋㅋㅋㅋ 와 싸이코패스도 아니고 이게 뭐하는짓이지,바람Iix50폴스타I성남,2024-08-08 14:58:00
1532802,"벤츠땜에 본인차 홀라당 다 타버린 사람한테, 벤츠 홍보 ㅋㅋㅋㅋㅋㅋㅋㅋ",오이잉o,2024-08-08 14:59:00
1532802,이거야말로 창조경제군요,울산llID4l서울,2024-08-08 15:07:00
1532802,교x 동xx전시장 딜러ㅋㅋㅋ,달려라l트위지l서울,2024-08-08 15:02:00
1532802,독일2사라고 해야할듯..흉기보다 양아칠세...,꽝손l아이l사천,2024-08-08 15:04:00
1532802,보고 열 받아서 꾸겨 버렸다가 아 그래도 사진 찍어서 올려야지 다시 펴자.. 이런 느낌이라ㅋㅋㅋ,베놈로드IEQS4AI서초,2024-08-08 15:04:00
1532802,저도 이생각ㅋㅋ,연군ㅣ볼트ㅣ경기,2024-08-08 15:11:00
1532802,미친거아닌가요 ㅋㅋㅋ,사월Iix50,2024-08-08 15:09:00
1532802,영업잘하네요 벤츠판매왕인듯ㅋㅋ 저거주다가 한대 맞을텐데ㅋ,연군ㅣ볼트ㅣ경기,2024-08-08 15:12:00
1532802,재난지역으로 선포하네 마네 하는 곳에가서 저걸 돌린거 생각하니 소름이 확~~~,하바l아이오닉l청주,2024-08-08 15:17:00
1532802,와 용기가 대단 욕 엄청 먹겠지만 자기 영업직으로 봤을때는 대단한분이네요,민leqsev6l서울,2024-08-08 15:25:00
1532802,주작같은데~~~,하늘맑을ii구리,2024-08-08 15:34:00
1532802,그 생각을 하긴 했는데 이미지를 저렇게 포토샵 하기 힘들어요.,하바l아이오닉l청주,2024-08-08 16:35:00
1532802,ㅋㅋㅋㅋㅋㅋㅋㅋ매맞아 죽을지언정 굶어죽진 않겠네요,망지I모델YI천안,2024-08-08 15:37:00
1532802,힘들긴하겠지만 이런건 어떻게 좀 법적인 제재 안되나요?,울산llID4l서울,2024-08-08 15:39:00
1532802,사망시 장례비용도 지급 한다 라고도 넣지?.........,태윤I아이오닉6I제천,2024-08-08 16:02:00
1532802,이거 진짜인가요?? 설마요,부산ll조택시,2024-08-08 16:28:00
1532802,영업을 잘하네요.욕 먹어도 처자식 먹고는 살아야죠,구랭이l아5l광주,2024-08-08 18:11:00
1532802,진짜 미친거 같아요.청라 길에 그으른 차들 천지인대 ㅠ,카기,2024-08-09 07:30:00
1532802,벤츠 수준이 이렇게 처참하다니요. ㅜㅜㅜㅜ,편하게Iev6I경기,2024-08-09 08:02:00
1532802,낄끼빠빠 모르네...,묵이님I오닉5I강원,2024-08-09 08:53:00
1532800,전기차 이미지는 우리 전기차동호회에서 만들어갑시다...당신이 망치는중임..,로버l오닉5l인천,2024-08-08 14:43:00
1532800,ㅇㅈㅋㅋ본인이 눈치보이면 내연기관으로 바꾸면되는것을...,강쥐Iid4I경기,2024-08-08 15:07:00
1532800,지상주차장이 엄서요,송이글lev6l동탄,2024-08-08 14:44:00
1532800,없으면 외부월주차하세요... 저도 회사사옥 지하밖에없어서 외부월주차 계약했습니다,콜렉터l타이칸l판교,2024-08-08 14:45:00
1532800,싫은데여. 집에서 가장 가까운 주차장이 3km 시청주차장인데요.,송이글lev6l동탄,2024-08-08 14:47:00
1532800,미국 같이 땅이 넓으면 되겠지만 그게 아닌 상황에서 외부 주차 강요는 그냥 타지말라는 거나 마찬가지지요 지킬 수 있는 일을 가지고 얘기를 하셔야지,테리lQ4l서울,2024-08-08 15:09:00
1532800,최대한 이웃들 불편하지 않게 해야겠지만 글타고 집 놔두고 외부월주차까지 해야하나요?전기차 배터리 개판으로 만든 넘들이 잘못인데 소비자가 무슨 죄를 지었다고 이렇게까지 해야하나요.아파트 주차장 놔두고 월주차까진 오바 같아요. 월주차장에는 다른 차 없습니까..,올더타임lgv60ev9서울,2024-08-08 15:11:00
1532800,인정. 지상 주차장이라곤 세 자리 정도 있는데 다 장애인 주차구역이네요. 뭐~ 전 지상에 주차하라면 하려고요. 지상에는 애들 때문에 위험하다고 오토바이도 못 다니게 하는데 얼씨구나 주차하죠. 뭐,국남ㅣ모델3ㅣ경기,2024-08-08 16:15:00
1532800,어그로 표시,소멸은신I모델YI인천,2024-08-08 14:44:00
1532800,인증점..,대전ll흐구,2024-08-08 14:44:00
1532800,자. 이제 타이칸 투리스모부터 인증해보자.인증부터 박고 글쓰지않으면 영원한 구라쟁이가 될뿐이다~,미니Iix3I파주,2024-08-08 14:44:00
1532800,지상에 주차장 없어요..,영우I ID4 I인천,2024-08-08 14:44:00
1532800,님 모델X든 타이칸이든 인증좀요??????????????인증없이 똥글은 그만쓰시고.....,아잉훗Ii4I성북,2024-08-08 14:44:00
1532800,차 인증이라도 해야 카페분들이 글이라도 읽으실 듯ㅋㅋ 의견이 될 지 허언증 환자가 될 지,레쓰비I코나I대구,2024-08-08 14:45:00
1532800,인증했나요?아닌거 같은데 말이죠 판교어디 사나요?메인배터리 얼마짜리 쓰는지 아세요?,다다익선IEv6I의왕,2024-08-08 14:45:00
1532800,이사람 아직도 차단 안하신분 없죠??,빠떼리I모XI세종,2024-08-08 14:45:00
1532800,이분 영자님이 활동정지 했습니다 ㅎㅎ,혜성처럼I모델3YI경기,2024-08-08 14:48:00
1532800,마트/영화관/백화점 이런 지하주차장도 이제 못 가시겠네요 ㄷㄷ,아리랑I모델YI대구,2024-08-08 14:45:00
1532800,타이칸은 누가 안전하다고하나요 ㅋㅋㅋ,애진이네IEV6I안산,2024-08-08 14:46:00
1532800,내글로 돌아와 임마 어디가,진급누락아6I세종,2024-08-08 14:46:00
1532800,보통 핸들손잡이 + 아이디적은 종이 정도로 인증해주시면 약간의 믿음이..,와우l아이오닉5l광주,2024-08-08 14:47:00
1532800,자기 생각을 남에게 강요하지마요 알아서 잘하시면됩니다 스프링클러도 없이 밖에 주차해서 아파트 외벽부터 홀라당 태우시면 안되니 차 폐차하시는게 답이아닐까요? 차량 인증 좀 해주세요,엘앰오십I아5I파주,2024-08-08 14:48:00
1532800,문제는 이런사람이 네이버댓글만봐도 차고넘친다는거죠,양양희I타이칸I대전,2024-08-08 14:48:00
1532800,1. 타이칸 인증 해주세요2. 지붕 있는 지상 주차장 만들어주세요,삐뚤IEV6I아산,2024-08-08 14:48:00
1532800,이분 영자님이 활동정지 했습니다 ㅎㅎ,혜성처럼I모델3YI경기,2024-08-08 14:48:00
1532800,"고소먹고 벌금, 민사걸려 손해배상 할려면 타이칸 팔아도 모자랄 듯 ㅋㅋㅋㅋ",금빛동전I오닉5I대구,2024-08-08 14:49:00
1532800,ㅋㅋㅋㅋ 어그로는,청주IEQBI청시,2024-08-08 14:50:00
1532800,몇댸 않팔리는 차량이라서 불이 않나지 않았나요 비싸서요 글케 따짐 제네시스 전기차들도 화재 이슈 없던데요 이런글 올리실 필요가 있나요 분탕질인가요,쭈쭈ev6충남,2024-08-08 14:51:00
1532800,더위많이먹은듯 ㅋㅋㅋ,하임Igv60퍼포I대전,2024-08-08 14:51:00
1532800,구조적 결함이네요,아얼I볼트오닉5I서울,2024-08-08 14:52:00
1532800,어그로 오지네요,꼼질꼼질lGV60l고양,2024-08-08 14:52:00
1532800,ㅋㅋㅋㄱ아니 어이가없네왜 아예 밖에 나가지도 마시지그래요교통사고 날지도모르는데,전준태l충남l아오5,2024-08-08 14:54:00
1532800,타이칸 지상주차 하는것만 올리셔도 믿을텐데 멋진 타이칸 인증좀 해주세요,컴초I아이오닉5NI김포,2024-08-08 14:55:00
1532800,호구인증,소년lGV60l충남,2024-08-08 14:58:00
1532800,혹시 내연차도 가지고 계신지 궁금하네요. 가지고 계시면 일단 전기차는 지하주차장 넣으시고 내연차부터 지상주차하시는게 이웃을 위해 도움되실거같습니다. 내연차 화재가 훨씬 많이납니다. 차량대당 발생비율도 많구요.. 제가볼땐 지금 하시는게 합리적이라 생각은 들지 않지만 그 마음은 진정성이 있다고 믿고 더 주변에대한 배려를 할수 있는 도움을 드리고자합니다. 내연차의 주차중 화재비율도 많습니다. 내연차 주차중 화재는 연간 1000대가량 발생합니다. 이웃주민을 위해 이런 부분도 신경써서 내연차부터 지상주차하는게 우선이라 봅니다. 일단 우리나라 정부기관중 가장 신뢰할만하고 일반인도 신뢰하는 소방청 보도자료입니다.그리고 소방관분들도 전기차 화재가 특별히 진압이 어렵지 않다고 이야기 하십니다. 어디서 들은 귀동냥이나 일부 보도만 보고 객관적인 시각을 잃지 않길 바랍니다. 선한마음은 진심이라 믿고 꼭 내연차부터 외부주차및 지상주차 해주세요.. 없으시면 까페에 열심히 설명하듯이 주변에도 소방청 통계자로 보시고 널리 알려주세요.. 소방청 보도자료 링크걸게요.. 다 있습니다.. https://www.nfa.go.kr/nfa/news/pressrelease/press/?boardId=bbs_0000000000000010&mode=view&cntId=2177&category=&pageIdx=,누눈i ev6 i 전북,2024-08-08 15:03:00
1532800,월주차하라는소릴 당당하게해서 내가잘못했나 1분간생각함 ㅎㅎ,터프히어로Iev9I대전,2024-08-08 15:04:00
1532800,차단합시다!,어린왕자lev6모yl양산,2024-08-08 15:05:00
1532800,댓글 여론 조작단인감 ㅎㅎㅎ,시티즌l대전,2024-08-08 15:10:00
1532800,"웃긴게 ㅋㅋㅋㅋ 지하주차장에 주차하면 화재 시, 스프링클러가 초동대처라도 하고 번지지 않게 관리라도 해주지.. 지상주차장에 주차했다가 불나면 옆차에 그대로 옮겨붙는거 아니에요? 양 옆에 내연차라도 주차돼있으면 어우 끔찍 내연차 연쇄폭발 해버리면 답도 없어요",테리lQ4l서울,2024-08-08 15:11:00
1532800,월주차하래ㅋㅋㅋㅋㅋ신박ㅋㅋㅋ,연군ㅣ볼트ㅣ경기,2024-08-08 15:15:00
1532800,글 몇개를 올리냐,그랜져없음I충북,2024-08-08 15:16:00
1532800,주접을 싸고 앉었네 ㅋㅋ 전기차를 구매한 차주가 무슨죄를 졌다고 ㅋㅋ,빅버드I타이칸I동탄2,2024-08-08 15:26:00
1532800,이 사람 관종이네요. 전기차 할인으로 사고 싶어 어그로 끄는듯..방문 10에 작성글 9회..ㅎㅎ,콩이파파IEV9I김포,2024-08-08 15:37:00
1532800,요즘 날씨가 참 덥죠....?,우와앙IEQAI경기,2024-08-08 15:36:00
1532800,개관종 백수,망지I모델YI천안,2024-08-08 15:39:00
1532800,개웃기네 활동 하나도 없다 사고 터지니 타이칸 달고 전기차보고 외부주차하라네 ㅋㅋㅋ 차부터 인증해라 심심하냐? 아무 근거도 없이 눈치보이니까 외부주차하라는거 보면 지능도 부족해보임,아크로비I모델yl서울,2024-08-08 15:42:00
1532800,,포르티시모IEV9I경기,2024-08-08 15:48:00
1532800,"지하 주차장에서 내연차 화재나면 뭐 주차장은 자전거만 주차해야해요?ㅋㅋㅋ 단, 전기자전거는 안됨.",순두부I타이칸I수원,2024-08-08 15:49:00
1532800,인증이나 좀..,뿌물liX3레이l경기,2024-08-08 15:55:00
1532800,이거 댓글 많이 달리니까 신나서 적는거 같은데 여기 댓글 하나 올려줄게 고생이 많다,가드lEQSl서울,2024-08-08 16:04:00
1532800,말왜래많노,구매 대구,2024-08-08 16:11:00
1532800,혼자 열심히 하세요.,펜트lEV9l충주,2024-08-08 16:18:00
1532800,ㅋㅋㅋㅋ 덕분에 웃고 갑니다.,구로구마ev3부천,2024-08-08 16:37:00
1532800,타이칸인증부터 해주시죠 ㅎㅎ,준서아빠l아오5l경기,2024-08-08 16:40:00
1532800,이집 장사 잘되네요,에스I아이오닉5I경기,2024-08-08 17:16:00
1532800,먹이를 주지 마시옷!,차는풀옵l아6AWDl인천,2024-08-08 17:17:00
1532800,이 사람 차 없어요 ;;,어스IQ4l양산,2024-08-08 17:39:00
1532800,타이칸~~~~~~~ 인증 없으면 뭐다?,미뭐리ㅣev3ㅣ서울,2024-08-08 17:44:00
1532800,,미뭐리ㅣev3ㅣ서울,2024-08-08 17:45:00
1532800,이사람 전재산 들이거나 캐피탈로 차 산지 얼마안된거 같은데. . . 준중형정도. . . my all,연쓰I이트론SBI경기,2024-08-08 18:50:00
1532800,혼자 그러세요ㅎ,테란l아이오닉5l강원,2024-08-08 19:05:00
1532800,"오늘 하룻에만 글을 7개나 남기면서 분란을 일으키는 이유가 무엇인가요?(심지어 어떤분이 민원넣으셨다는 글은 삭제도 하셨네요?)님의 말이 맞든 아니든 개인이 판단할 일입니다. 하루에 글을 7개나 작성하면서 분란을 만들면 님의 의견이 정말 맞다고 해도 사람들은 인정해주고 싶지 않습니다. 먼저 사람과 대화하는 법을 잘 파악하시고 글을 작성하셔야 할듯합니다. 모든게 님이 옳다는 식의 게시글과 정신차려라! 너네~ 이런식의 대화법은 모두를 무시하는 형태의 발언입니다.전기차 이미지를 전기차 동호회에서 만들어갑시다. 라고 하시는데 어떤 이미지를 원하시나요? 전기차에 대한 좋은 이미지를 만들고 싶었으면 이번 화재가 발생하기 전부터 가입하셔서 활동을 열심히 하셨어야지, 이제와서 하신다는것도 솔직히 잘 이해가 가진 않네요.",아오뉙I아5I경기,2024-08-08 20:15:00
1532800,아니 나이키나 타고 다니던 양반이 무슨 타이칸이에요? 나이키 신제품 이름이 타이칸인가보네요.,오리배I모델3I부산,2024-08-08 21:08:00
1532800,바이바이 ㅋㅋㅋㅋ,아르마I모Y볼트I인천,2024-08-08 22:53:00
1532800,인간아 왜 이러구 사냐…좀 사람답게 살아봐라…,깍지Iix50I대구,2024-08-09 10:07:00
1532800,인증 샷 부탁드립니다.,EVO6GTI아산,2024-08-09 10:33:00
1532800,자기 권리도 누리지 못하는 호구이신가요?,송파lActiveRide,2024-08-09 11:19:00
1532800,깨시민인척 역하네 진심,흠냐lix3l경기,2024-08-10 07:39:00
1532800,동물에게 먹이를 주지맙시다,성남lev9l봄이파더,2024-08-10 10:38:00
1532800,외부 주차 인증 하고 이야기하시죠~말로는 뭘 못할까..,우야빠IeqaI김포,2024-08-10 11:36:00
1532800,ㄷㄷ,346햄,2024-08-10 18:09:00
1532800,작성자가 어리석인가본데 이 카페 조심해야함 잘못하다가 신상 털립니다 ㅋㅋ,이엘서울,2024-08-11 20:46:00
1532756,그러게요 무책임 하네요 퇴출각이네요,포스코IIX3I화성,2024-08-08 14:20:00
1532756,터지기야 국산 중국산 다 터지죠 얹그제 터진 EV6 중국제베터리 아니지않나요?,콜렉터l타이칸l판교,2024-08-08 14:21:00
1532756,짱깨산 배터리 리콜전력도 있잖습니까? 그걸 알고도 방치했으니 이꼴난거죠,국참재판lID4l전북,2024-08-08 14:23:00
1532756,엊그제 화재 사건은 배터리 원인이라고 명확히 규명이 안됐고 오히려 화재 지연 잘 작동돼서 열폭주 없이 진화한 사건인데 국산 배터리팩이 화재지연 설계가 안전하다는 반증 아닌가요?,테리lQ4l서울,2024-08-08 14:23:00
1532756,"둘다 어째뜬 화재가 나지 말아야 할 상황에서 난건 맞죠? ㅇㅌㄱㅇ 처럼 eqe는 나쁜화재고, ev6는 좋은화재라고 말하고 싶은건지요? 걍 화재가 나지 말아야죠.",김로드l예정l수원,2024-08-08 14:26:00
1532756,Ev6는 충전중 화재라 충전기 문제도 배제할 수 없다는 의미였네요. 맞습니다. 불나는 모든 차들이 전부 문제는 문제죠.,테리lQ4l서울,2024-08-08 14:26:00
1532756,보고싶은 거만 보시지 마시고 열폭주 동일합니다 위치가 입구쪽이랑 가까워서 상황이 달랐을뿐 화재는 동일함 충전기 문제니 안전하다는 반증이니 교주님 말 그대로 하시는 거 보니 신도시군요https://news.sbs.co.kr/news/endPage.do?news_id=N1007752965&plink=ORI&cooper=NAVER,깨굴I니로I인천,2024-08-08 14:51:00
1532756,교주니 신도니 그런 발언은 왜 하세요? 제가 신도면 이 차 샀겠어요?,테리lQ4l서울,2024-08-08 14:55:00
1532756,논리가 교수님과 동일하셔서요 제가 오해한거면 사과드립니다,깨굴I니로I인천,2024-08-08 14:56:00
1532756,리콜 전력이야 다 있죠.... 그걸로 얘기할 문제는 아닌 것 같아요.,디오니ㅣ모3ㅣ서울,2024-08-08 18:38:00
1532756,그러게 말입니다.,이비나이니,2024-08-08 14:21:00
1532756,지난 디젤게이트 때도 그랬습니다. 기업이 버티면 정부도 도움 안되구요.. 결국 소비자만 피해를 보는 현실의 반복입니다.,먼셀I대전,2024-08-08 14:24:00
1532756,피해는 일반 전기차주만 보고 있는 현실이 진짜 안타깝습니다.. 당장 해결책이 나올 수 있는 것도 아니구요,이븽Iev6I서울,2024-08-08 14:25:00
1532756,벤츠전기차가 다 그런것 아닌데ㅠ요,EQB300 전남 산수유,2024-08-08 14:26:00
