post_id,cmt_content,cmt_author,cmt_created_at
1532756,에고… 그냥 벤츠 산 우리가 잘못한건가봐요…. 시승해보고 본인들이 마음에 든 차 산건데 같은 전기차주로써 참… 안타깝네요… 다음에 어떤차가 마녀사냥될지 아무도 모르죠… 다들 본인차는 괜찮다하니 벤츠만 이번일 잘 처리해주면. 전기차들 이제 불안나죠~~~~ 그쵸??? ㅋ,행복매일IeqaI전남,2024-08-08 14:42:00
1532756,무턱대고 사주니 호구 취급합니다,아얼I볼트오닉5I서울,2024-08-08 14:45:00
1532756,배터리만 짱깨산이 아니고 벤츠 자체가 중국회사에요. 중국이 최대 지분이고 20% 넘어요~그러니 자국산 듣보 베터리 썩어 넣는건 어찌보면 당연~,올더타임lgv60ev9서울,2024-08-08 14:56:00
1532756,벤츠 전기차는 접을듯..이미지가..,연군ㅣ볼트ㅣ경기,2024-08-08 15:30:00
1532724,그냥 인간의 심리인데그동안 익숙하게 사용하던건 불나도 그려려니새로운건 불 더 적게 나도 왜 불나고 난리야대가리가 나쁜거죠,이니셜TIMYPI하남,2024-08-08 13:58:00
1532724,내연차는 그나마 불 뿌리면 빨리 진화할 수 있지만 전기차는 열 폭주로 화재 진압 자체가 쉽지 않아서 더 그렇겠죠. 열 폭주로 폭발해서 화재 진행 속도도 더 빨라서?,니즈군l볼트l대구,2024-08-08 13:59:00
1532724,"내생각은 이렇습니다1. 엔진 미션 하청 업체 줄도산2. 기사화로 전기차 판매 줄일려고 함3. 전기차 시장 개발 망 한국 제조 자동차 망4. 테슬라 중국 전기차가 국내 시장 뺏겨 먹기 5. 전기차 세금이 저렴해서 기름차 및 하브 2.5 맹글어서 세금 뽑아먹기 (팰리, 카니발)이런거 말고도 많을겁니다한국은 제조업 망하면 그냥 망입니다 이유 불문하고 그냥 망임",아이폰ㅣ아5ㅣ안산,2024-08-08 14:03:00
1532724,갤럭x x트7 터질 때도 잘 들고다니던 사람들이 갑자기 걱정이 많이지심.,영우I ID4 I인천,2024-08-08 14:05:00
1532724,매연차 카르텔...,뽕알밑쉰내ID4l서울,2024-08-08 14:08:00
1532724,"내연기관 관련 산업이 우리나라 전체 경제에 엄청난 비중을 차지하지요. 제조, 부품하청, 연구, 정유업체, 운송 선박, 주유소, 이 회사들 부근의 마트, 식당, 부근의 부동산 시세까지 근데 내연기관 죽으면 이 수 많은 사람들의 경제활동이 무너집니다. 그래도 키워드를 ""중국산 배터리, 벤츠, 전기차, 화재"". 정도로 좁혀서 그래도 한국산 배터리, 현기는 좀 낫겠지 하는 여론 형성 정도로, 국내기업들은 보호하려 한 것 같습니다. 이런 여론몰이가 옳다고 생각되지는 않는데, 누군가에겐 생계가 걸린 문제일 수도 있다고 생각하면 이해는 되더군요. 물론 제 뇌피셜입니다.",디오니ㅣ모3ㅣ서울,2024-08-08 14:26:00
1532724,한해에 내연차가 5000여대가 불이난다고합니다. 물론 전기차 60만대 내연차 2500만대 월등히 많치만... 하루 15정도 불나고있습니다. 전기차가 화재나면 불이 잘안꺼져서 문제긴하지만 스프링쿨러만 터진다면 대부분 번지지 않고 진화되는게 대부분이더라구요,향기l코나l옥천,2024-08-08 14:36:00
1532699,여러번 말해도 어차피 이번글도 뒤로 밀려서 또 어그로 끌림,빠떼리I모XI세종,2024-08-08 13:35:00
1532699,,빠떼리I모XI세종,2024-08-08 13:36:00
1532699,역시 판례가 중요하죠,하이l모Y폴2l경기,2024-08-08 13:38:00
1532699,"차주, 제조사의 책임을 물을수 없어서 해당 보험사도 배상할 책임이 없다는 확정판결이라면그럼 최종적으로 누가 배상하는건가요?",리허설l양산,2024-08-08 13:39:00
1532699,각자 자차처리건물피해 화재보험처리최초 발화차량만 대부분 제조사에서 책임지는 분위기 같습니다,하이l모Y폴2l경기,2024-08-08 13:41:00
1532699,유보금으로 손실처리 끝,소멸은신I모델YI인천,2024-08-08 13:41:00
1532699,공도에 돌아다니는 해당 차가 저것만이 아닐테니벤츠가 더이상 전기차 파는거 포기할거면 관망할 것이고아니면 자체 조사 후 결함 파악후 리콜+배상 하겠죠,빠떼리I모XI세종,2024-08-08 13:44:00
1532699,화재보험에서 보험사항아니라고 이미 청라주민들이 답변받았습니다,콜렉터l타이칸l판교,2024-08-08 13:45:00
1532699,여러분 어그로 말은 무시하세요,소멸은신I모델YI인천,2024-08-08 13:45:00
1532699,뭐가 되었든 차주는 책임 없습니다https://youtu.be/3WJODQy_3y0?si=RJ6MW2VumQ_PhSHq,저항이Iix3I경기,2024-08-08 13:46:00
1532699,그럼 자차 가입되지 않은 차는 누구한테 보상받아야 하나요? 이런 글은 많이 봤는데 전 이게 궁금하더라구요. 그냥 자기손해? 이것도 아닌거 같고.. 혹시 아시는지 궁금하네요,코스모스ㅣev6ㅣ서울,2024-08-08 14:37:00
1532699,자차안들었으면 본인돈으로 돈쓰고 구상권 청구해야죠. 보험들었으면 보험사가 알아서 구상권 청구하겟죠?,새빛l코나l경기,2024-08-08 14:52:00
1532699,"그냥 일종의 자연재해처럼 되는거같습니다. 차주과실이 없어 원인이 불명확하니 손배책임이 없고, 그냥 자차를 안들었는데 아파트지하주차장에서 나오자마자 우박이 맞아서 유리가 깨져버렸는데 아무한테 책임물을사람이 없는것하고 같은이치인것같습니다. 차량소유주는 있지만 과실책임은없음(불이 알아서 스스로 일어남) 제조사가 책임져야할것같으나 원인이밝혀지지않았다고 잡아떼만 방법이 없는것같습니다. 마치 차주가있으니 이유불문 책임져야할것처럼 보이나 차주가 리콜등을 잘받았고 신차급에 자연발화라면 차주가 차를 구매했다는거외엔 어떠한 과실도없으니까요.(아 물론 차 구매자체가 과실은 아닙니다)",전주II타이오닉5,2024-08-08 15:43:00
1532699,자차 들어야죠화재사건 말고도 단독사고나 가해차량이 배째할때 자차 써서 고쳐야해요,소멸은신I모델YI인천,2024-08-09 08:05:00
1532658,이미 어제 끝난 철지난 쉰떡밥,빠떼리I모XI세종,2024-08-08 12:59:00
1532658,가짜뉴스라고 백번 올라온글,소멸은신I모델YI인천,2024-08-08 12:59:00
1532658,그럼 벤츠에서 우리잘못할까요?,아이오닉6사곱,2024-08-08 13:00:00
1532658,역시 어그로는 계속 티를 냄,소멸은신I모델YI인천,2024-08-08 13:03:00
1532658,각차량 자차처리건물피해 화재보험 (스프링클러 안터져서 관련자 처벌 가능성)벤츠 차주 과실여부 따진 후 벤츠만 벤츠에서 보상뭐 이런 수순이 될거라는데요,하이l모Y폴2l경기,2024-08-08 13:02:00
1532658,이게맞아요,콜렉터l타이칸l판교,2024-08-08 13:02:00
1532658,어그로끼리 신났네,소멸은신I모델YI인천,2024-08-08 13:04:00
1532658,어그로는맞는데지금생각해면 저럴가망도있을수도있어요,아이오닉6사곱,2024-08-08 13:07:00
1532658,어그로 티키타카,깨굴I니로I인천,2024-08-08 13:08:00
1532658,비싼밥 먹고 쉰소리좀 그만해쇼,목재IEV9I인천,2024-08-08 22:10:00
1532658,국내 연매출 8조원인데 이미지손실 데미지가 100억 훨씬 이상이니 모두 보상해주고 이미지회복해야겠지요그리고 배터리사에 소송걸겠지요소비자에 과실떠넘기면 국내벤츠 전기차사업은 접을 각오로 소비자에게 책임전가를 해야겠지요과연 벤츠코리아가 그럴만한 배포가 있을까요? 전 아니라고 봅니다,제우스I오닉5I화성,2024-08-08 13:17:00
1532658,이게 맞는듯,복댕님I강원,2024-08-08 13:23:00
1532658,새싹들은 다 왜 이럴까,소멸은신I모델YI인천,2024-08-08 13:25:00
1532658,이 말도 맞는듯 ㅎㅎ,복댕님I강원,2024-08-08 13:30:00
1532658,근데 걱정인건 사제블박 달고 보조배터리까지 달았을때 차주 책임으로 갈 수도 있지 않나요? 예전에 테슬라 불났을때 통풍시트 였나 보조배터리 였나 시공한것 때문이라고 한거같은데,안양li4m50l할배,2024-08-08 13:35:00
1532658,모3통풍시트 사제로 불난거여서 테슬라책임안지고 차주자차로 처리하고 종료됫죠 여기회원분인데 그이후에 안보이시니 내연차로가신듯..,연군ㅣ볼트ㅣ경기,2024-08-08 14:16:00
1532658,아 여기 회원분이셧군요...ㅜ이번에도 전장류 튜닝하고 그쪽으로 몰고가면 차주분 힘들어지겠네요...,안양li4m50l할배,2024-08-08 14:18:00
1532658,네 그때그래서 그차주분이 전기차 전기쪽은 안건드는게 맞다고 한거같아요 저도 그러고있고요 시비안걸리는차원 ㅡㅡㅋ 식빵등도안합니다ㅜㅜ못해요ㅜㅜ 근데 벤츠는 이번엔다타서 증거나있을까몰겠네요 모3전소는 글검색하면 있을지모르겠네요 2ㅡ3년전인거같은데..,연군ㅣ볼트ㅣ경기,2024-08-08 15:03:00
1532658,보배드림 원래 대표적인 가짜뉴스의 온상지 아닌가요.,멍멍이I모델3I수원,2024-08-08 13:34:00
1532658,네에??,삼공이I아6l원주,2024-08-08 22:57:00
1532658,보배랑 일배는 믿고 거르면됨 동급,밤비l코나l한남,2024-08-08 14:37:00
1532658,일단 배상하는게 어딨어 ㅋㅋㅋ 초딩수준이네,테라스le트론I서울,2024-08-08 14:40:00
1532658,과장삼아 한 100번 본거 같네요 한번씩 검색해보고 올리시는게 좋을거 같아여,전기렛츠고lQ4l서울,2024-08-08 15:01:00
1532658,와 개인이 어케감당하나요,준성아빠,2024-08-08 15:21:00
1532658,전기차 게시판에 왜이렇게 구라큘라들이 많은지..,쭈니lev6l서울,2024-08-08 15:27:00
1532658,누가봐도 카더라네요,목포l아5레이evl꼬북,2024-08-08 17:36:00
1532658,한문철 tv에서 아니라고 했어요 개인책임 없습니다,목곰Igv6OI트론I광명,2024-08-08 17:42:00
1532658,왜 이글에서 벤츠 자주가 다 뒤집어 썼으면 좋겠다는 심뽀가 느껴지지?다른 벤츠 전기차 오너들도 불안해 했으면 하는 것 같고,산책ㅣix3ㅣ경기,2024-08-08 20:28:00
1532658,제발좀요,발I모3I경기,2024-08-08 21:24:00
1532658,"이거 아니라고 여러기사에서 나왔어요! 한문철티비도, 여러 판례도요",춘식이ㅣe208ㅣ경기,2024-08-08 22:35:00
1532658,진심으로 진짜라고 믿으시는건 아니시죠?,공바I모YI경기,2024-08-08 23:49:00
1532647,"그러다 막상 화재사고 터지면 경제적 피해, 사회적 명예에 대한 피해는 본인이 받으시는겁니다.누구나 그럴싸한 계획은 있죠. 타이슨이말했든 쳐맞기 전까지만 그렇겠지만요.",콜렉터l타이칸l판교,2024-08-08 12:49:00
1532647,글 안읽어요? 내연차 화재로 이미 피해 입었다잖아요...그럼 내연차도 빼야죠...,시기상조I넥쏘i3I서울,2024-08-08 12:51:00
1532647,ㅋㅋㅋㅋ분탕질 전문가에요 신경끄세요,들머리I아5I경북,2024-08-08 12:52:00
1532647,비유를 해도참 ㅎㅎ,백무구I김포,2024-08-08 12:53:00
1532647,저 인간 무시하세요,소멸은신I모델YI인천,2024-08-08 13:01:00
1532647,글좀 읽고 댓글 다세요. 대체 어디서 지령 받고 선동하는거에요??,멍멍이I모델3I수원,2024-08-08 13:36:00
1532647,맞을래?,두찌IEV6I수원,2024-08-08 15:46:00
1532647,타이칸 타고 이런소리를 ㅋㅋㅋ 짝퉁타이칸인가 ㅋㅋ,죽기전까진청춘I울산I,2024-08-08 16:19:00
1532647,이분 대단하네 ㅋㅋ,국묜I아5l화성,2024-08-08 17:14:00
1532647,차단,차단판독기I울산,2024-08-08 17:30:00
1532647,당신 지켜보고있어요,목재IEV9I인천,2024-08-08 23:17:00
1532647,타이칸타는 전기차주인척 위장하여 ' 난 전기차오너지만 전기차는 위험해' 를 전파하는 아주 질나쁜 분으로 추측됩니다,율트롱I이트론55I부산,2024-08-09 00:21:00
1532647,원래 모르는 사람들한테는 팩트로 날리면 암말 못합니다.,시기상조I넥쏘i3I서울,2024-08-08 12:50:00
1532647,내연차 겁나 불나는데 전기차랑 분리해주세요~내연차 지상으로 보내주세요~,빠떼리I모XI세종,2024-08-08 12:50:00
1532647,저희 아파트도 전기차 화재사고 관련해서 투표도 있고 뭐도 있고 하면서....주말저녁에 하자네요...이때다 싶어 전기차 혐오하는 분들 다 나오실듯..벤츠 중국산때문에 짜증나네요,존킴99,2024-08-08 12:51:00
1532647,내연차는 불나면 피해없나요?ㅋㅋㅋㅋㅋ윗분 계속 카페에 분탕질하시네,들머리I아5I경북,2024-08-08 12:52:00
1532647,와 정말 정상적이군요.서로 의견 공유.,정보정보I아5I서울,2024-08-08 12:53:00
1532647,이렇게 목소리 내시는분! 굳!,코리IID4I인천,2024-08-08 12:55:00
1532647,"요즘 분위기가 그렇다보니 눈치가 보이긴 하는데, 맞는 말씀입니다. 내연기관차는 불 안나나요?ㅠ 이때다싶어 전기차만 뚜까패고.. 대책없이 전기차니 주차하지마라는 너무한거죠..",햄빵Iix3고양,2024-08-08 12:56:00
1532647,소방 설비 확충이 상식적인 대응인겁니다 내연차도 당연히 불날 확율있는거구요 전기차 주차공간을 옳긴다면 상가 입점업체와 저층세대가 화재위험에 더 노출 되는겁니다 - 그들의 논리에 따른다면 말이죠... 위험과 불편을 타인에게 전가 하는것을 떳떳하게 말하는 사람과는 이웃 하고 싶지 않을꺼 같네요,날개I아이오닉5I경기,2024-08-08 12:57:00
1532647,자기목소리 못내는건 호구라 생각합니다 그들이원하는데로 말한번 못하고 지상으로 댄다 호구인증,소년lGV60l충남,2024-08-08 12:58:00
1532647,차량 화재는 이미 스프링쿨러만 정상작동해도 불이안꺼진다 하더라도 옆차로 옮겨붙지 않는건 건설사에서 시뮬레이션결과로 나온건데도 ㅋㅋㅋ 사회생활에 불만이 많은 것들이 풀곳은 없고 그냥 비난하고 싶은겁니다. ㅋㅋㅋㅋ예전 출장세차화재도 관리직원이 형량을 더 많이 받은 이유가 화재가 났는데 스프링쿨러를 꺼버렸죠. 이번 사고도 스프링쿨러 작동전까지만 영상이 있을뿐 스프링쿨러 작동영상이 없습니다. 그런건 ㅋㅋㅋ 다들 괜찮다고 생각하는건가요? ㅋㅋㅋ,옥수수I쏘부EVI안양,2024-08-08 13:00:00
1532647,"지당한 말씀입니다! 소방시설이 충분히 갖춰줬음에도 관리의 편의를 위해시설이 적절하게 사용되지 않게 방치한 관리자의 큰 잘 못이지죠..화재는 전기차, 내연차,.. 내집.. 니집 어디든 언제 발생할지모르는 사고입니다.사고대비, 대처를 어떻게 할지를 토론하고 집중관리하는게 지금 시대에 가장 필요한 일입니다!",죽기전까진청춘I울산I,2024-08-08 16:23:00
1532647,글쓰고난 다음날 9일(금요일)에 기사 나오더라고요 스프링쿨러를 껐다구요. ㅋㅋㅋㅋㅋㅋ 진짜 예상한 그대로 아닙니까대형화재로 번지는 경우 최소한의 안전장치도 가동하지 않은 시설 관리자 책임이 더 크다고 봅니다.,옥수수I쏘부EVI안양,2024-08-12 10:25:00
1532647,방학이라 그런지 잼민이들이 글을 많이 싸지르네요.,니킥파울러liX3l경기,2024-08-08 13:31:00
1532647,"역시 배운사람은 달라요. 제가 다 시원합니다 ""응원합니다""",두찌IEV6I수원,2024-08-08 15:48:00
1532643,얼마 안갑니다,아이폰ㅣ아5ㅣ안산,2024-08-08 13:54:00
1532619,팔린다는게 신기해요 ;) 이정도면 안살꺼 같은데,멍멍이I모델3I수원,2024-08-08 12:26:00
1532619,"애초에, 여유있어서 샀다면, 여유있을때, 우선 매각하는게 맞다고 봅니다.",근육호빵I대전,2024-08-08 12:27:00
1532619,이때다 하고 사는 사람들도 있죠ㅎㅎ,EV6l안산,2024-08-08 12:29:00
1532619,중고차 마니 남겨먹네,평화동주민II전주,2024-08-08 12:29:00
1532619,이게 사고나 충전도 아니고 가만히 있다가 발화한거라 너무 리스크가 큰것 같은데 말이죠..,남현이I서울,2024-08-08 12:30:00
1532619,리콜해야할듯요 코나가 그랬던것처럼요,웅희윤IEV6니로I화성,2024-08-08 12:31:00
1532619,거래가 안될것 같습니다.,쿠쿠IEQEI부산,2024-08-08 12:32:00
1532619,배터리 바꿔주지않는이상,방구쟁이l아5l충남,2024-08-08 12:33:00
1532619,결국 배터리 교체해줄거 같은데요....,달빛l아이오닉l세종,2024-08-08 12:33:00
1532619,어디서요? 소송 장기화 될것 같아요,안타마I용인,2024-08-08 12:36:00
1532619,제가 오해하게끔 써 놓았네요 개인적인 생각입니다,달빛l아이오닉l세종,2024-08-08 12:38:00
1532619,https://biz.chosun.com/policy/policy_sub/2024/08/08/CXP3KSSWW5HC3JHJYKNCREEE4M/기사 보면 리콜 해야할것같습니다..,리브레lEQAl평택,2024-08-08 16:18:00
1532619,중고차 매장에서 벤츠 전기차는 취급 안한다고 하네요,레이IEQA아이6I경기,2024-08-08 12:37:00
1532619,사태가 정리 될때까지 사주지 말아야죠.. 호구인증도 아니고,경기lEtron모델yl짜,2024-08-08 12:46:00
1532619,벤츠 타보고 싶으면 지금이 기회입니다. 물론 불안감은 있지만 ㅜㅜ,스페샬IEv9I창원,2024-08-08 12:47:00
1532619,원래 주식도 망한다 할때 사는 사람들이 돈 버는거예전 코나도 그랬음한참 불날때 1년 된것도 2천 언더로 팔리고 그랬음그렇게 시간이 흐르고 리콜 하고 나니 나는 4년 된걸 내가 샀던 금액으로 팔았음,시기상조I넥쏘i3I서울,2024-08-08 12:48:00
1532619,222 리스크감수였는데 대박이었죠,연군ㅣ볼트ㅣ경기,2024-08-08 14:37:00
1532619,용자들만 덤비겠군요.,차는풀옵l아6AWDl인천,2024-08-08 12:49:00
1532619,전기차 다들 타시는분 맞나요?? ㅎ 우리 모두가 원래 얼리이자... 용자입니다. 하브도..디젤도 터지는건 마찬가지입니다. 단지 벤츠가 속이고 판부분은... 단죄로... 디젤게이트 이상 단죄해야죠!! ps. 진짜 그 가격이면 2대 사고 싶네요 ㅎㅎ 아마 리스 차액인듯,나무바쿠lbmwi3,2024-08-08 13:36:00
1532619,매입하는 딜러가 있다는게 신기하네요,비스트ㅣ서울,2024-08-08 12:56:00
1532619,EQE타는 차주인데 댓글 내용이 좋지는 않네요..벤츠를 까는거긴한데 왜 제 마음이 안좋은지....다른 카페에서 그랬다면 좀 덜내상을 입을텐데 같은 전기차 오너카페에서 까이니 좀 더 속상하네요...ㅜㅜ,하율lEQEl인천,2024-08-08 13:06:00
1532619,힘내세요~ 제 생각엔 벤츠 차주분들이 제일 마인드 좋아 보입니다.다른차 이랬으면 완전 싸움판 되고 난리 났을거에요~,데민IEV6I오산,2024-08-08 16:52:00
1532619,벤츠가 리콜 해 줄까요 ?대한민국 우습게 보는거 같은데요글구 터진배터리 회사도 영세 하다고 하던데요,김승현7 ev6 세종,2024-08-08 13:07:00
1532619,하이리스크 하이리턴..,까까롱I청주,2024-08-08 13:12:00
1532619,EQ시리즈 초기에 사신분은 현시점 차값 거의 날린셈이네요,JCARlid4l서울,2024-08-08 13:32:00
1532619,화재 1회로 반값되면 화재 100회 이상난 국산차는?? 소설도 좀 그럴싸하게 써야지,깨굴I니로I인천,2024-08-08 13:55:00
1532619,완속충전중 발화는 과충전이라는 원인이 있고 차주가 조심함으로써 어느정도 예방이 가능하지만 이번 화재는 3일 방치된 차량이 스스로 자연발화 한거라 느낌이 달라도 한참 다르져,먹밥lEV6l경북,2024-08-08 15:31:00
1532619,그거랑 별개로 반값은 말이 안되긴 합니다,먹밥lEV6l경북,2024-08-08 15:32:00
1532619,1회 자연발화 140억 한방이면 설명되잖아요…으응??,폴l아이오닉6l용인,2024-08-08 16:21:00
1532619,피해가 커진 건 스프링클러 미작동 이 원인 아닌가요? 그 논리면 내연차랑 전기차는 다르니 전기차 주차장 출입 금지 시키자는 거랑 같은 논리 같네요,깨굴I니로I인천,2024-08-08 17:48:00
1532619,엔카 시세 계속보고 있고사고 이후 차이가 거의 없어 보이는데어디 사이트가 가면 볼수 있나요?,케이Ii8I서울,2024-08-08 13:57:00
1532619,뽐뿌 글 주작이라는 말이 있던대,김로드l예정l수원,2024-08-08 13:58:00
1532619,공포에 매수하라. 야수의 심장이네요,레드락스I인천,2024-08-08 14:34:00
1532619,5천 매물조차 본적이 없는데주작같은데요,달려ㅣ코나ㅣ부평,2024-08-08 14:38:00
1532619,3천후반은 매입은 이해되는데 5500에 팔리나요?,연군ㅣ볼트ㅣ경기,2024-08-08 14:40:00
1532619,3천요???? 3천후반에 파시는분 쪽ㅈ주세요 바로 송금함요 진심으로,꿀빵상근IXI충남,2024-08-08 14:47:00
1532619,아무리 그래도 매입가 3천후반은 너무 갔네요. 카더라가 무서운 것 같습니다.,차lgv60egv70ev6l광주,2024-08-08 15:10:00
1532619,eqe는 겁나네요,준성아빠,2024-08-08 15:22:00
1532619,ㅋㅋㅋ 3천만원대요? 연락주세요. 4000에 당일 입금하고 제가 바로 가지러가겠습니다.,레딧Ii4I송도,2024-08-08 15:31:00
1532619,카더라가 너무 심하네요 ㅋㅋㅋ 실제 시세 6000이상입니다,대구 밍뚜,2024-08-08 15:34:00
1532619,리콜 끝나면 원복 될껍니다,아이뽀IEQESUVI송도,2024-08-08 15:38:00
1532619,누가eqe 탈까요?주민들이 차빼라고는 안해도매의눈으로 볼겁니다,용인넥스트,2024-08-08 15:56:00
1532619,eqe포함 한두달전부터 전기차 중고가 계속 체크중인데 무슨 중고가반값타령...우리나라는 참 사기치기 좋아요 이런 어그로글에 속아넘어기른 사람도있고 딜러 매입가 낮아진거까진 확인할수없으니 모르겠고요,이비식ll전북,2024-08-08 17:40:00
1532619,평생타야쥐~~~~~~~~,스태틱IEQEI서울,2024-08-08 17:42:00
1532619,지금팔생각은없지만 혹시나해서 해이딜러올려봣는데 전보단내렷지만 5000이하는없엇네요 5733이최고가이고ㅡㅡ,해장은짜장lEQEl거제,2024-08-08 17:53:00
1532619,4500에 제가 삽니다ㅡㅡㅋ,서울leqb,2024-08-08 18:37:00
1532619,4600에 제가 삽니다 ㅡㅡㅋ,동물원IEV6I진주,2024-08-08 18:39:00
1532619,전 절대관심업읍니다 안삽니다,정상길l오닉Nl해운대,2024-08-08 19:45:00
1532619,한 3천정도면 사볼까 했더니 진짜 그 값으로 파는건가요 ㄷㄷ 전 모델 파라시스라는 기사 있던디 더 내려갈까 궁금합니다,엘리사I인천,2024-08-08 22:18:00
1532619,이런 거짓글은 왜옮기는걸까요? 제가 이 글 보고헤이딜러올려봤는데 5천이하 매입없습니다ㅎㅎㅎㅎ,김대리lEQEl창원,2024-08-09 07:09:00
1532619,중고차 딜러들이 화재이야기하며 감가 후두려깔것같긴합니다. 벤츠든 현기든 bmw든 아우디든 뭐든간에요.당분간은 정말 특별한 사유아니면 일단 갖고 계시다가 잠잠해지면 파는게...,코ITycanEtron55I인천,2024-08-09 08:57:00
1532619,중국산배터리든 불이나든 잠깐의 타격만 있을뿐 여전히 잘 팔릴겁니다. 한국사람들의 벤츠 사랑은 전세계 탑입니다. 차가 여전히 본인의 신분인 나라에서 벤츠를 넘어서는 브랜드는 거의 없으니까요. 명품은 제품을 파는것이 아닌 '꿈'을 판다 중산층이 구입가능한 수입차 중 벤츠보다 나은 브랜드는 없거든요.,대세I모델YEV9I남양주,2024-08-09 10:04:00
1532619,이번기회에 벤츠 오나로 넘어가고싶네요,무한I아6l부산,2024-08-09 10:32:00
1532619,4천이면 저도 바로 삽니다 ㅋ.,신신ll대전,2024-08-09 13:17:00
1532604,벤츠에서 전액 변상 안 하려면 어떻게든 아파트 관리소 책임을 잡으려 하겠죠,하늘군I아이오닉I경남,2024-08-08 12:17:00
1532604,벤츠 책임도 같이 붙어야 하는데... 그냥 전기차 악마화만 하니 답답해요,멍멍이I모델3I수원,2024-08-08 12:25:00
1532604,그냥 한두달만 여기 카페 안들어오고 전기차에 관심끊고 살면 다 지나가더라고요.그동안 숱한 화재들이 이카페를 통해~ 돌고 돌고 돌아나오는 모습을 보며 느낍니다.,줍줍 I전기차I일산,2024-08-08 12:18:00
1532604,아 그런가요? 다행이네요 ㅠ,멍멍이I모델3I수원,2024-08-08 12:25:00
1532604,벤츠가 책임이.있는데 시가치고,레이IEQA아이6I경기,2024-08-08 13:13:00
1532597,비슷한 내연차 판례보면 차주는 책임없어요,학냉I볼트I인천,2024-08-08 12:13:00
1532597,차주 책임 없다면 안전하게 지하주차장에 사용해도 되겠네요 ㅠ,자영업스펙,2024-08-08 12:15:00
1532597,아무리 차주 책임이 없다지만 그렇다고 그걸 그렇게 연결짓는거는 쉽게 생각하기 어려울 거 같은데요...,아바카타차I경기,2024-08-08 12:37:00
1532597,대부분 아파트 자체 보험으로 해결되는듯 싶어요. 책임보다는 입주민들 눈치에 이사 안가고 버틸수 있을지가…,랑만고냥이 수원,2024-08-08 12:17:00
1532597,책임은 당연히 없어야할텐데 주민들 난민생활하는걸보면 마음이…,유니77서울,2024-08-08 12:23:00
1532597,개인한테 책임은 없다고 결론난 판례가 여러건 있다합니다. 벤츠vs자동자 보험사 vs아파트 보험사 끼리 구상권 싸움하겠죠. 스프링쿨러 작동안됐다면 100프로 아파트보험사 책임될듯요.,칼리버스I서울,2024-08-08 13:54:00
