id,title,content,likes,url,author,views,created_at,updated_at
1454464,자동차 사고후기,코나전기차를 19년 6월부터 지난 4월까지 약 14만 킬로 운행하다가 4월에 화물차 추돌사고로 폐차하였습니다정체구간에 정지하는순간 대형트럭이 그대로 달려와 덮치는 사고였습니다고속도로 후방추돌로 전방 1톤차량을 추돌하고 옆차선의 쏘울 차량에 박힌뒤에서 박히고 전방 추돌하고 옆에 박힌 3중 추돌당했던 사고였습니다만 다행히 불이나지는 않았고요조수석 뒷자리는 119구급대에 의해 문짝을 절단하고 탑승자를 구해낸 사고였습니다작은 코나전기차임에도고속도로에서 대형트럭 후미추돌에도 인명피해는 없었으며 전기차 화재도 발생하지않는 튼튼한 코나의 안전성에 놀랐습니다하지만 뒷좌석에 고립된 탑승객 구출시도에서 한가지 아쉽던것은 운전석 조수석이 전동좌석이었고 사고로 전원이 끊어진후 좌석이 고정되면서 후미승객 탈출로가 봉쇄되었던게 단점이었었네요수동식이었다면 접고 앞좌석으로 탈출이 가능하지 않았을까 싶습니다회원님들은 고속도로에서 대형트럭 버스 앞에서운전은 피해서 이런사고를 당하지 마시고대형운전하면서( 모든 운전자) 졸음운전 하지 마세요,1,https://cafe.naver.com/ca-fe/ArticleRead.nhn?clubid=21771803&page=1&userDisplay=50&inCafeSearch=true&searchBy=0&query=%EC%BD%94%EB%82%98+%ED%99%94%EC%9E%AC&includeAll=&exclude=&include=&exact=&searchdate=2024-01-312024-06-30&media=0&sortBy=date&articleid=1454464&referrerAllArticles=true,야성으로 코나EV 경기,364,2024-05-08 14:02:00,
1454149,아파트지하 전기차 화재네요. ㅜㅜ,https://youtu.be/MIIgpXUlEAM?si=2sfKY1J8vQDBAUtO아파트 주차장에 전기차 못대게 하는곳이 늘어난다니 걱정이네요. ㅜ,2,https://cafe.naver.com/ca-fe/ArticleRead.nhn?clubid=21771803&page=1&userDisplay=50&inCafeSearch=true&searchBy=0&query=%EC%BD%94%EB%82%98+%ED%99%94%EC%9E%AC&includeAll=&exclude=&include=&exact=&searchdate=2024-01-312024-06-30&media=0&sortBy=date&articleid=1454149&referrerAllArticles=true,웅재맨 l 서울,"1,711",2024-05-07 23:32:00,
1454093,완속충전완료후 꼭 충전케이블 탈거해야겠습니다 페리아이오닉 화재,https://youtu.be/82yXmP__wA8?si=HolRkfl-oS9VdHgc완속충전기는 휴맥스 차져로 보이네요,0,https://cafe.naver.com/ca-fe/ArticleRead.nhn?clubid=21771803&page=1&userDisplay=50&inCafeSearch=true&searchBy=0&query=%EC%BD%94%EB%82%98+%ED%99%94%EC%9E%AC&includeAll=&exclude=&include=&exact=&searchdate=2024-01-312024-06-30&media=0&sortBy=date&articleid=1454093&referrerAllArticles=true,서초구주민l포터l서울,637,2024-05-07 22:01:00,
1453969,"[가입인사]
                                
                                

                                
                                
                                    안녕하세요",1. 자기소개 : 전기차 궁굼해서 가입했습니다2. 지역 : 화성 동탄3. 한글별명의 뜻 : 별명4 관심있는 전기차 : 테슬라5 보유하고 있는 전기차 (보유/계약 여부) : 아직없음6 가입계기 : 테슬라정보7 하고 싶으신 말씀 : 만나서반갑습니다좋은정보 공유하고싶어요,0,https://cafe.naver.com/ca-fe/ArticleRead.nhn?clubid=21771803&page=1&userDisplay=50&inCafeSearch=true&searchBy=0&query=%EC%BD%94%EB%82%98+%ED%99%94%EC%9E%AC&includeAll=&exclude=&include=&exact=&searchdate=2024-01-312024-06-30&media=0&sortBy=date&articleid=1453969&referrerAllArticles=true,동탄짱어,18,2024-05-07 17:47:00,
1453775,"모델Y, Q4 이트론, 아이오닉5 결정장애",전기차 구매관련하여 1달째 고민중이라 의견을 여쭙고자합니다. 현재 모델Y 계약 해놓은 상태인데 원페달 드라이빙으로 인한 뒷자리 멀미가 너무 걱정되어서 자꾸 다른차를 기웃거리게 되네요. 주된 용도는 와이프가 중학생 2명 통학용으로 사용예정입니다.모델Y는 원페달 강제로 인하여 뒷자리 멀미 걱정.Q4는 시승시 승차감 좋았으나 가격대비 편의시양 부족 및 아우디코리아에 대한 걱정.아이오닉5는 위 2모델과 큰 차이없는 가격으로 인하여 같은 가격이면 수입차를 사고 싶은 마음.여러분들이면 어떤 차 선택하실까요??,0,https://cafe.naver.com/ca-fe/ArticleRead.nhn?clubid=21771803&page=1&userDisplay=50&inCafeSearch=true&searchBy=0&query=%EC%BD%94%EB%82%98+%ED%99%94%EC%9E%AC&includeAll=&exclude=&include=&exact=&searchdate=2024-01-312024-06-30&media=0&sortBy=date&articleid=1453775&referrerAllArticles=true,gilho27,"1,468",2024-05-07 12:47:00,
1453687,실시간 구오닉 화재??,소방차 5~6대는 있는것 같네요불난건지 뭔지 모르겠네요인명피해 없으시길...위치는 김포풍무동이에요,0,https://cafe.naver.com/ca-fe/ArticleRead.nhn?clubid=21771803&page=1&userDisplay=50&inCafeSearch=true&searchBy=0&query=%EC%BD%94%EB%82%98+%ED%99%94%EC%9E%AC&includeAll=&exclude=&include=&exact=&searchdate=2024-01-312024-06-30&media=0&sortBy=date&articleid=1453687&referrerAllArticles=true,윤하썬lmyll화성,"1,410",2024-05-07 10:54:00,
1453092,전기차 화재,방금 뉴스에 또 전기차 화재로 큰 사고가 났던데요 다들 안 불안하세요? ㅠㅠ,0,https://cafe.naver.com/ca-fe/ArticleRead.nhn?clubid=21771803&page=1&userDisplay=50&inCafeSearch=true&searchBy=0&query=%EC%BD%94%EB%82%98+%ED%99%94%EC%9E%AC&includeAll=&exclude=&include=&exact=&searchdate=2024-01-312024-06-30&media=0&sortBy=date&articleid=1453092&referrerAllArticles=true,린이I아오5I정읍,"1,056",2024-05-06 10:06:00,
1451680,전기차가 정말 불이 많이 나나요?,지인에게 차바꿨다고 자랑하니 전기차는 불난다면서 싫어하네요..아는 지인은 자기 건물 지하실에는 불날까봐 전기차 충전기 절대 설치하지 않겠다고 말하기도 하고요..최근에도 화재사고가 있었을까요?,0,https://cafe.naver.com/ca-fe/ArticleRead.nhn?clubid=21771803&page=1&userDisplay=50&inCafeSearch=true&searchBy=0&query=%EC%BD%94%EB%82%98+%ED%99%94%EC%9E%AC&includeAll=&exclude=&include=&exact=&searchdate=2024-01-312024-06-30&media=0&sortBy=date&articleid=1451680&referrerAllArticles=true,성화지기Ii4I충북,803,2024-05-03 16:22:00,
1450950,Lfp가 더 안전하다고 누가그래?,"중국기업 아이온에서 본인들의 삼원계 탄창배터리의 송곳 테스트를 공개했습니다.영상의 배터리는 그들의 탄창배터리로, 셀마다 사이에 냉각장치를 탑재한 형태의 팩입니다.실험조건은구멍의 직경은 3-8mm, 원추형으로 침은 20-60도의 각이 세워져 있고, 침이 들어가는 속도는 초당 0.1mm에서 10mm 사이로 느립니다.송곳이 들어가는 위치와 방향은 셀이 열관리 기능을 상실하는 위치와 방향이라고 하는군요.온도가 순간적으로 올라갔지만, 다시 내려왔네요. 전압 역시 쭉 내려왔고실험결과1분간 연기가 나고 최고온도는 686.7도, 내부 구조 좋음, 열이 퍼지지 않고, 폭발하지 않았음껍데기에 손상도 없었음48시간 이후 전압은0이 되었고, 온도 역시 실온으로 내려옴*중국 기준으로 송곳통과 테스트는 5분 내에 불이 안 붙으면 통과.일단 이러하다고 합니다. 실험이 얼마나 믿을만 한지는 알 수 없으나, 일단 아이온은 판매중인 차량이고 그것은 최소5분 테스트는 통과했다는 의미이니 터무니 없다고 볼 수는 없겠지요. K배터리들도 테스트 영상 공개했음 좋겠네요, 좋은 홍보효과가 될텐데요.",0,https://cafe.naver.com/ca-fe/ArticleRead.nhn?clubid=21771803&page=1&userDisplay=50&inCafeSearch=true&searchBy=0&query=%EC%BD%94%EB%82%98+%ED%99%94%EC%9E%AC&includeAll=&exclude=&include=&exact=&searchdate=2024-01-312024-06-30&media=0&sortBy=date&articleid=1450950&referrerAllArticles=true,디오니ㅣ모3ㅣ서울,"1,466",2024-05-02 14:23:00,
1449784,증국산 전기차 찬양하는 자들은 꼭보세요,이게 현실입니다 목숨담보로 모험하지마세요,1,https://cafe.naver.com/ca-fe/ArticleRead.nhn?clubid=21771803&page=1&userDisplay=50&inCafeSearch=true&searchBy=0&query=%EC%BD%94%EB%82%98+%ED%99%94%EC%9E%AC&includeAll=&exclude=&include=&exact=&searchdate=2024-01-312024-06-30&media=0&sortBy=date&articleid=1449784&referrerAllArticles=true,싱글라이더I i40과천,"1,686",2024-04-30 15:44:00,
1448588,EV3 출시가 곧 될것 같은데요,"EV9 처럼 실패작 안되려면 가격이 적정해야 하는데, 배터리 제조비용의 한계가 있어서파격적인 가격으로는 나오지 않겠지요.",0,https://cafe.naver.com/ca-fe/ArticleRead.nhn?clubid=21771803&page=1&userDisplay=50&inCafeSearch=true&searchBy=0&query=%EC%BD%94%EB%82%98+%ED%99%94%EC%9E%AC&includeAll=&exclude=&include=&exact=&searchdate=2024-01-312024-06-30&media=0&sortBy=date&articleid=1448588&referrerAllArticles=true,ywoncho1414,826,2024-04-28 19:41:00,
