post_id,cmt_content,cmt_author,cmt_created_at
498391,비엠 정도 불나야 국가에서 나설라나요? 그정도 될려면 하루에 한두대정도 계속 불나야 하는데...;;; 국가에서 뭐라고 할까요? 해외에서는요? ㅋㅋ 현대차 전기차 확대하겠다고 나서는데 이게 무슨 개망신 일까요? ㅎㅎ,근육이IKEI서울,2020-08-25 17:19:00
498391,제가 살때만 해도 이런 일이 없었는데... 조금 무섭네요ㅠㅡㅠ,이다림I코나I대구,2020-09-02 11:58:00
493138,lg 입니다,땅콩I코나I충주,2020-08-10 14:59:00
493138,코나는 모두 LG 입니다..,미래소년ㅣ코나ㅣ대구,2020-08-10 15:36:00
493138,"배터리에서 화재 난거 맞나요?화재 원인들은 아직도 투명하게 공개되지 않았다. 일부에서는 블랙박스 배선 등이 문제가 될 것이라고 내다봤지만, 차량의 BMS(배터리관리시스템) 문제와도 연관될 수 있다는 지적이 나오고 있다.",따치 I 니로 I 제주시,2020-08-10 16:58:00
493138,블래박스 배선은 언론 플레이겠네요 ㅎ,프리오l코나l용인,2020-08-10 19:27:00
493138,다른 코나 화제 글들은 다 삭제처리 되던데 이글은 좀 살아있네요 ㅎㅎㅎ,터킬l코나l서울,2020-08-10 21:23:00
493138,"배터리가 문제라면 lg배터리 쓰는 볼트도 2017년 미국출시이후, 화재이슈가 진작에 났겠죠.",뽄드I볼트evI용인,2020-08-11 11:11:00
493138,볼트도 미국에서 1건있어요,카트골퍼모델x경기,2020-08-11 13:39:00
493138,"이슈가 될정도면, 단위기간에 어느정도 최소한의 case는 되어야 하지 않나요? 1건이라..최근에 tracy소방서건은 원인분석된 자료가 없으니 차치하고, 말씀하신 사례는 궁금하네요. 링크자료 있다면 공유 부탁드립니다. 감사합니다.",뽄드I볼트evI용인,2020-08-11 13:42:00
493138,https://m.cafe.naver.com/ca-fe/web/cafes/allfm01/articles/491763?useCafeId=false&or=m.search.naver.com&query=%EB%B3%BC%ED%8A%B8%2B%EB%AF%B8%EA%B5%AD%ED%99%94%EC%9E%AC&buid=651253f6-57f1-4a33-b9f5-60094fc78bf9&art=ZXh0ZXJuYWwtc2VydmljZS1uYXZlci1ldGMtZm9yLWNvbW1lbnQ.eyJ0eXAiOiJKV1QiLCJhbGciOiJIUzI1NiJ9.eyJjYWZlVHlwZSI6IkNBRkVfSUQiLCJhcnRpY2xlSWQiOjQ5MTc2MywiaXNzdWVkQXQiOjE1OTcxMjA5OTAwNzIsImNhZmVJZCI6MjE3NzE4MDN9.jioq51f6ZP_xurddIKDWp4WStoDFEL0u7YWwV4TyZmo,카트골퍼모델x경기,2020-08-11 13:43:00
493138,"보내주신 링크는 저도 알고있고 댓글에도 언급한 tracy 화재건이네요. 원인 규명이 안된상태로 알고있습니다. 이게 차량결함건으로 판명난다면 관련 리톨등의조치가 있을거니 그때 확인 되겠네요. 그렇다쳐도, 2017년부터 2020년까지 1건으로 봐도 될까요? 그러면 이슈라하기엔 무리가 있지 않나 싶네요.볼트가 무조껀 좋다는 얘기가 아닙니다. 적어도 코나 화재원인을 규명하고자 함에 있서, 배터리 문제로만 몰아가면, 진짜 원인 규명이 쉽지 않을 우려가 있으니, 같은 제조사의 배터리를 사용하면서도, 화재이슈가 없는상태인 볼트사례를 얘기한겁니다.",뽄드I볼트evI용인,2020-08-11 13:55:00
