"id","title","content","likes","url","author","views","created_at","updated_at"
"708780","벤츠 화재전에 잊어선 안되는 문제[2]"," 이번 벤츠 화재도 어영부영 시간 흐르고 이유를 못밝힐 확률이 큼   엘지 배터리 코나 뿐만 아니라 지엠 볼트도 연이은 화재로 리콜및 실외 주차 권장했었음짬바가 있으니 한국배터리가 더 안전하다고 보긴 하지만 ev6 화재 보면 마냥 안심할수도 없고이번 벤츠화재는 아파트에 사고후 대처가 미흡해서 더 이목을 끈것이지  미국은 목조주택에 창고에 주차해서 불나면 집 하나 통째로 탐 보조금 빼면 엘지도 실상 영익 마이나스라던데 안습","0","https://www.bobaedream.co.kr//view?code=import&No=708780","차빡구","828","2024.08.12 14:36",""
"708777","전기차 공포'에 현대차 배터리 공개‥수입차들은 '못 해[8]"," [뉴스데스크]◀ 앵커 ▶인천 아파트 주차장 전기차 화재로 인해 전기차에 대한 불안감이 번지고 있는데요.화재가 난 벤츠 전기차는 중국산 배터리를 넣은 것으로 알려졌죠.이에 현대차가 배터리 제조사 정보를 공개했습니다.기아도 조만간 정보를 공개하기로 했는데요.수입차 업체들은 공개 불가 입장을 굽히지 않고 있습니다.박진주 기자가 보도합니다.◀ 리포트 ▶주차 중인 전기차에서 갑자기 불이 나는 사고가 잇따르면서 전기차에 대한 불안감은 커지고 있습니다.특히 인천 아파트 지하주차장 전기차 화재로 벤츠가 시장 점유율이 낮은 중국의 파라시스 배터리를 넣은 사실이 알려지면서 더 큰 주목을 받았습니다.[인천 지하주차장 전기차 화재 피해자(음성변조)] ""전기차 자체가 이제 도로에서 맞닥뜨리게 되면 두근두근하는 게 있거든요. 다른 전기차라고 하더라도 같은 배터리가 들어가 있는 차도 있을 테고…""전기차에 대한 이 같은 불안감이 퍼지면서 전기차의 배터리 제조사를 공개해야 한다는 목소리가 커졌습니다.그러자 현대자동차가 선제적으로 자사 전기차들의 배터리 제조사를 공개했습니다.현대차는 13종의 전기차 가운데 12개의 차종에 국내 제조사인 LG에너지솔루션과 SK온의 배터리를 탑재했습니다.코나 일렉트릭에는 세계 시장 점유율 1위 업체인 중국 CATL의 배터리가 장착돼 있습니다.전기차 6종을 판매 중인 기아는 ""일부 중국 배터리를 사용 중인데 내일 홈페이지를 통해 공개하겠다""고 밝혔고 KG모빌리티도 공개 여부를 검토하고 있습니다.[KG모빌리티 관계자(음성변조)] ""미디어 행사에서도 그걸 숨지지 않고…BYD가 중국 기업이긴 하나 글로벌 1위 기업이기도 하잖아요. 숨길 이유가 없어서…""하지만 화재가 난 벤츠를 비롯해 아우디 폭스바겐 등 대부분의 수입차 업체들은 배터리 제조사 비공개 입장을 고수하고 있습니다.[권용주 교수/국민대 자동차운송디자인학과] ""전기자동차에서 배터리에 대한 소비자 선택권을 줌과 동시에 배터리 제조업체 간에 품질 경쟁은 분명히 벌어질 거예요.""정부는 내일 환경부 차관 주관으로 국토교통부와 소방청 등 관계 부처가 참여하는 전기차 화재 관련 회의를 개최한 뒤 다음 달 초 전기차 종합 대책을 발표할 계획입니다.MBC 뉴스 박진주입니다.","33","https://www.bobaedream.co.kr//view?code=import&No=708777","카리스마4097","2,175","2024.08.12 09:49",""
"2320340","19년식 코나ev는 NMC 배터리인가요??[4]","지금 타는 차가 19년식 코나ev인데 화재 뉴스 땜에 후덜덜 하네요  애들 태우고 다니는 차인데 얼른 다른 차를 사야 되는 건가 ㅠㅠ","0","https://www.bobaedream.co.kr//view?code=national&No=2320340","퍼스트리얼리티","193","2024.08.07 15:01",""
"3134457","궁금한게 잇습니다 220v 화재방지 스티커? 그거를...[4]","전기차 베터리 위에 전체도배부착후 출고하면 단가가 비싸지나요??? 멀티탭 이나 돼지코 위에 동그란(모양은 다양한) 스티커 붙이면 작은 불씨를 초기에 잡을수잇게 해주는 스티커 잇잖아요?? 그 재질을 전기차 생산 배터리부착하고 그위에 방음지말고 저 재질로 덮어주고 출고 하면 많이 비싸지는건지 아니면 국내외 기술이  아직 부족한건지... 그리고 그거 부착하고 그부분이 초기진압을 할때 타기 시작하면 배터리랑 차체가 자동으로 떨어지겟끔  해주면 화재시 차량만 견인 하면 배터리만 덩그러니 남아잇어줄테고? 그럼 그 배터리를 출동한 소방관님들은  수조를 만들어 담궈버리거나 덮개를 쒸어버리면 진압속도도 빠르지 않을까요?  그냥 궁금해져서 물어봐요 배터리가 하부에 잇다는건 아는데 그게 화재시 결합부위가 고온에 먼저 녹아서 분리가 된다면 견인차가  우선 차체만 견인하고 배터리만 남겨두고 갈수잇으니....진압도 빠르게 될수잇을거같은데.... 아니면 단가가 못미치는건가요? 진짜 궁금해서 물어봅니다... 조립공정도이나 수리 사진도 보면 배터리만 빼서 교체하는 사진도 봣는데 그 결합부위에 볼트가 고온에서 먼저 맞딱드리면 녹아내려서 분해가 되거나 떨어지겟끔만 해줘도 초기 대응 견인차나? 견인이나 인위적으로 사람이 밀어서  불씨랑 분리가 되기만 한다면? 좋지 않을까 해서 ...올려봅니다 안되는 일이면  어쩔수 없고요 ㅎㅎㅎ 전기차 화재 이슈가 많아서 차채를 수조틀에 담궈도 오래걸리고 하니... 그냥 저의 하찮은 생각을 올려봅니다. 가마솥더위 앞으로 열흘만 고생하면 된답니다 무덥지만 무더위 조금만 더 참고 힘내봐요 감사합니다. ","0","https://www.bobaedream.co.kr//view?code=freeb&No=3134457","현월oO","305","2024.08.05 23:44",""
"2319874","글보면 정말 웃긴게 다들 전기차 화재가지고 기를쓰고 까면서[5]","정작 이번 사태의 원인이 중국 CATL NCM 811 탑재 차량이라는건 거의 이야기 안함.  대체 왜??? 그냥 모 회사가 싫은건가?? 그래서 그회사 전기차로 나름(??) 잘나가니 그냥 싫은건가??  저 CATL 811은 중국에서도 화재때문에 말많았던 타입임. 저게 어느순간 어느정도 안정화가 되어 가는데. 그과정에서 LG엔솔의 기술을 훔쳤다는 혐의가 있어 LG쪽에서  소송을 제기한 상태임. 즉 기존 기술력으로 811 배터리를 안정화할 능력이 없어서 기껏한게 K배터리의 기술을 배껴서 만든것임.   난 이런걸로 까는 거면 모르겠는데 그누구도 이런걸로 까는사람을 보기 힘듬. 대체  왜???  그냥 이해하지 않고 무지성으로 같이 까면 세상 편한건가..  그리고 아주 일부 몇몇사람이 아주 주도적으로 열정적으로 글쓰시던데..  과연..???  그리고 어떤 양반이 현대도 CATL NCM 쓴다고 뭐라 그러는데 쓰긴씀.. 다만 오래되어서 어느정도 검증된 타입인 523 타입을 씀  참고로 523이니 811이니 이것은 삼원계 배터리(크게 세가지의 재료로 만듬)의 재료의 비율로 N 은 니켈 C는 코발트 M은 망간임 여기서 N을 올리면 올릴수록 출력이나 효율은 좋아 지지만 안정성이 떨어져서 이 안정성을 잡는게 기술이고 이 기술이 현재 K배터리의 강력한 무기임. 523은 니켈함량도 적기 때문에 가격도 싸고 오래된 타입이니 검증이 많이 된타입. 그대신 출력을 내거나 그런데선 요새 꺼보단 못함. 그래서 당장 니로 나 코나 EV 신형의 모터의 최대토크가 구형보다도 떨어지고 가속력이 떨어지는 이유가 다 이런이유에 기인함(기존엔 LG SK 622 배터리 씀)   ","68","https://www.bobaedream.co.kr//view?code=national&No=2319874","원조집","1,972","2024.08.05 14:20","2024.08.05 14:20"
"3133892","레이 전기차 화재 ㄷㄷㄷ[13]","충전 중이 아닌 탁송 트럭에 실려 가는 중에 자체 발화.와 진짜 전기차는 쳐다도안봐야겠네요.코나 디젤 팔고 EV3 알아보고 있었는데..  ","8","https://www.bobaedream.co.kr//view?code=freeb&No=3133892","초록의공명","1,512","2024.08.05 07:16",""
"2319389","지하주차장 문제로 시끌시끌한데.[24]","정작 그 차의 배터리는 중국제 CATL NCM 811배터리.  근데 이 배터리에 흑역사가 있는데. 초창기에 화재가 상당히 많이 일어난 배터리임 그래서 포기하네 마네 그런거였는데.  여기서 더웃긴건 저거 조차도 LG의 특허를 침해해서 만든제품이여서 현재 LG와 소송중이라는군요.. 그러니까 과거 화재로도 악명높은 배터리이고 그것조차 우리나라의 기술을 훔쳐서 만든 배터리라는것  우리나라에도 CATL제 배터리가 있긴 합니다. 우선 레이엔 LFP 하고 니로하고 코나 EV에 CATL NCM배터리가 들어가는데 여기에 들어가는건 811이 아니고 523인가. 해서 효율은 떨어지지만 니켈 함량이 떨어져서 상당히 안정적이라는..   참고로 CATL NCM 811은 마칸EV에도 장착됩니다.","212","https://www.bobaedream.co.kr//view?code=national&No=2319389","원조집","16,348","2024.08.02 16:21","2024.08.02 16:21"
"3115676","이게 우연인건가?"," 언젠가 남북의 리더들이 서로 만나서 악수하고 축제분위기 였어서 이러다 곧 서로 왕래하다 통일 되는거 아냐? 하던때!그저 묵묵히 열심히 살아왔더니….우리나라가 선진국으로 승격되었다는 소식으로 가슴 뿌듯하던 때!우리들만 좋아하던 음악과 가수들이 동남아를 넘어 전세계가 열광하고 빌보드 차트 뿐만 아니라 유럽 남미 및 아프리카를 휩쓸고 있게 되었다는 소식을 들었던 때!신속 코로나 키트 선점으로 전 세계가 놀라고 훌륭한 코로나 확산 방지 정책과 국민들 참여에 놀라 G7에 초청되어 우리 대통령이 그 한가운데서 우뚝 서던 모습을 티비로 지켜 보던 때!오징어 게임 사랑의 불시착 기생충등 만드는 족족 세계적인 히트를 치며 백상을 넘어 칸 아카데미 골든글로브 등을 휩쓸던 때! 정말 좋았었는데요 그죠?....그런데....자국민 159명이 죽어도 아무도 책임지지 않는게 되고…세계적 행사 우등국가였던 나라가 한순간 잼버리 행사 개폭망 하게 되고이태원 참사 뿐이 아니라 청주 지하차도 침수사고 화성 배터리 공장 화재사건 엊그제 시청앞 돌진사고도 그렇고 갖은 참사사고들이 빈번해지고바이든 날리며 같은 소모적인 논쟁을 이유로 언론을 족쇄고 탄압하며 어떻게든 언론 망가트리기에만 열중하고뻔하디 뻔한 채상병 외압사건도 어떻게든 무마하려고 뻐대고 있는 모습들이며범야권 192석으로 국민들의 엄중한 심판을 보여줘도 갖고 있는 인식이 부족하다 못해 전무하며국민의 대표인 국회의원들의 입법권마저 지속적인 입법 거부권으로 묵살하고 있고36년간 우리나라 국토를 침략하여 국민을 정신을 도륙하고 빼았았던 일본과 국사적 동맹을 맺고 있는 이런때!!!!...이런게 과연 우연인걸까요?지인이 지도자의 역량 보다는 시스템이 잘 갖춰져 있으면 괜찮다는 개 잡소리를 하길래시스템 같은 소리하고 자빠졌네...지금 이게 안보여??!!!!!  하고 귓사대기를 날릴뻔 했네요.우리 어떻해야 할까요? 답답합니다.    ","1","https://www.bobaedream.co.kr//view?code=freeb&No=3115676","야볼","161","2024.07.03 11:57",""
