"id","title","content","likes","url","author","views","created_at","updated_at"
"2171285","현대차그룹, 불나는 쏘렌토, 변속 불량 싼타페 등 44만대 리콜[5]","현대차그룹이 결함이 발견된 쏘렌토 스포티지 싼타페 투싼 등 총 43만6962대를 리콜한다.우선 2013년 5월~2015년 9월 생산 스포티지 9만7022대와 투싼 8만659대 등 17만7681대는 전자제어 유압장치 결함이 확인됐다. 해당 차량은 ABS 차체 자세 제어장치 등 제어 기능이 통합된 전자제어 유압장치 내부 합선에 의해 화재가 발생할 가능성이 확인됐다.다음으로 2020년 2월~2022년 6월 생산된 쏘렌토 9만3945대 싼타페 6만4703대 아반떼 N 2020대 벨로스터 N 1257대 쏘나타 N라인 582대 코나 N 411대 등 16만2918대에서는 변속기 제어장치 소프트웨어 결함이 드러났다. 이로 인해 변속기 오일펌프 불량 시 변속이 되지 않아 사고가 발생할 가능성이 확인됐다. 듀얼 클러치 변속기(DCT)가 탑재된 이 차들은 앞서 미국에서도 약 12만대가 리콜된 바 있다. 미국 도로교통안전국(NHTSA)의 보고서에 따르면 DCT 내 오일펌프 회로 납땜 불량으로 기판의 부품이 떨어져 나가는 문제가 발생했다. 특히 경고등과 함께 즉시 정차하라는 문구가 표시된 후 단 20~30초 만에 차량이 동력을 완전히 상실하는 것으로 나타났다. 동력 상실의 이유는 변속기 오일펌프 오류가 발생했을 때 피해를 줄여주는 '페일 세이프' 소프트웨어가 부적절하게 설계되었기 때문으로 전해진다.현대차 싼타페 하이브리드다음으로 2020년 6월~2022년 9월 생산 싼타페 6만6133대 싼타페 하이브리드 1만4431대 니로 1만2680대 G80 전동화모델 2893대 니로EV 226대 등 9만6363대는 앞좌석 안전띠 조절 장치 결함으로 리콜한다.해당 차량은 안전띠 조절 장치 내 가스발생기 불량으로 충돌 시 부품이 떨어져나오고 뒷좌석 탑승자에게 상해를 입힐 가능성이 확인됐다.현대차그룹은 변속기 제어장치 및 앞좌석 안전띠 조절 장치 결함 관련 리콜을 27일부터 진행한다고 밝혔다. 전자제어 유압장치 결함 리콜은 31일부터 시작된다.","0","https://www.bobaedream.co.kr//view?code=national&No=2171285","호떡왕","1,429","2022.10.27 18:34",""
"750141","교통사고시 렌트카는 무조건 25일 기간 넘으면 제가 내야하나요?[19]","안녕하세요.. 가끔 눈팅하다가 조금 복잡한 일이 생겨서 게시판에 다른분들 의견을 여쭙고자 글을 씁니다.먼저 상황을 설명드리자면..저랑 남편은 각각 법인을 가지고 있고 차량도 법인차량을 타고 있습니다.남편이 뉴질랜드 교포인데 한국국적이 없고 한국면허가 없이 국제면허증만 가지고 있습니다.남편은 남편 법인앞으로 된 차량을 타고 있고 저는 제 법인앞으로 된 차량을 탑니다.그리고 참고로 남편이 접촉사고를 자주 났습니다. 본인이 박은것도 있고 사고 당한것도 있고요.. 작년에 고속도로에서 남편과 나란히 이동중에.. 고속도로에서 4중추돌사고가 났습니다.1234 차량중에 3번이 남편차량 4번이 제 차량입니다.전방주시 안한걸로 4번차량인 제 차량이 앞차량들을 다 물어주었습니다.엄청 막히는 상황이라 바로 경찰도 와서 사고 접수하였고 보험회사에 사고접수를 하였습니다. 그리고 저와 남편은 각각 차량 수리기간동안 대차를 받아서 차량을 탔습니다. 그때 저만 자차 수리 비용 50인가 얼마를 냈고요.그런데 한 6?7?개월 후에 남편이 또 접촉사고가 나서 접수를 했던걸로 기억이 납니다..삼성화재 담당자(손해사정인)이 전에 난 4종추돌사고를 가지고 재조사를 한다면서저희 집에도 찾아와서 약관을 보여주면서 서로의 법인에 등기임원으로 되어있어 전에 사고 처리한거 보상해준 내용을 렌트카 수리비용부터 다 물어내라고 하는겁니다. 그러면서 아마 남편보고 자차 비용 얼마 내라고 하면서요.. 그래서 우리는 처음 사고났을때부터 경찰이랑 보험회사에 부부이고 법인차량이라고 얘기했고 사고 접수 했는데 지금 와서 어떤내용인지 모르겠다고 했어요.그리고 그 담당자가 저희에게 어떻게 진행할꺼냐고 해서 변호사 알아보고 있다고 했고요.그 손해사정인은 일주일에 몇번씩이고 전화해서 어떻게 처리할거냐 그리고 그 사건관련해서 돈을 물어내라고 했습니다. 그렇게.. 한.. 4개월? 5개월 쫒아다니다가 어느날은 전화와서 본사에서 이 사건을 덮으라고 했답니다. 몇달동안 사람 시달리게 하고요.. 그렇게 몇달이 지나서 접촉사고로 접수를 또 했는데 그 담당자가 남편을 경찰서에 무면허와 보험사기로 신고를 했습니다.알고 보니 남편의 국제면허증이 매번 만료되기 전에 갱신해서 가져왔는데 국제면허증을 국내에서 사용하려면 1년에 한번씩 외국에 나갔다와야 유효하다는 겁니다. 일년에 여러번 해외에 출장을 가기때문에 이런 조항이 있는지 모르고 있었는데코로나 기간으로 약 2년동안 외국에 못나갔다 오면서 한국에서 무면허가 된것입니다.그래서 그 무면허 기간동안 사고난 건에 대한 수리비를 물어내라고 형사고발을 했습니다. 그래서 지금 수천만원 변호사 들여서 조사중이고 지금 검찰송치하라고 내용을 얼마전에 받았어요. 근데.. 이와중에 또 사고가 났습니다. 저는 그때가 애기 낳은지 한달? 정도 된 상황인데.. 3중추돌사고인데 저희가 2번차량.. 3번차량이 저희차량을 받고 저희차량이 밀려서 1번차량을 또 받은거에요.차량이 앞뒤로 찌그러지고 본넷 뒤에 트렁크까지 다 찌그러져서 차량을 맡겼어요..이번에는 제가 다리랑 발목 어깨 등등을 다쳤어요.차량을 센터에 맡기니 대물 대인담당자에게 전화가 왔고.. 삼성에서 렌트카 업체에서 전화가 와서 차량을 렌트했습니다.그리고 처음에 a차량을 며칠 타다가 다른 b차량으로 바꿔서 탔는데..지난주 월요일에 차량센터에서 차량수리가 다 되었다고 전화가 왔어요 그리고 그 다음날이 화요일에 지난번 그 삼성화재 담당자가 자기가 담당자라면서.. 저한테 전화와서는 렌트는 25일까지 밖에 못해준다 25일 지났으니 저보고 돈내라고 자기는 고지했다고 얘기하고 전화를 끊더라고요..중간에 25일 되기 전에 25일 지나면 렌트가 더이상 안된다고 돈을 우리보고 내라고 한것도 아니고 차 수리 다 끝난 시점에서 그렇게 얘기를해요.아마 25일밖에 렌트가 안된다고 처음에 고지를 해주셨을수도 있습니다. 이건 제가 경황이 없어서 잘 생각이 안나요.근데 렌트 마무리 되기전에 그렇게 전화한통 줄수도 있는데 그렇지 않았어요..그리고 렌트카 업체에서는 추가 차량 탄 비용 약 195만원 정도 되는 돈을 저희보고 당장 다음날까지 내라고 하면서 안내면 소송한다 소송하면 우리는 100%이긴다.. 이렇게 얘기하더라고요?제가 사고를 당했는데 렌트 비용을 이렇게 내야하냐고 얘기했더니 130만원정도로 할인을 해줄테니 1주일안으로 입금안하면 소송하겠다.. 또 이렇게 굉장히 불친절하게 얘기를하고 자기얘기만 하고 전화끊습니다.일주일이 지난 시점에 제가 이 렌트카 업체에 대인담당자가 지금 우리한테 고의로 골탕먹이려고 우리가 돈을 물게끔 상황을 하는건지 모르겠다고 했더니 대인담당자한테 얘기들었다고 하더라고 제가 막 물어보니 형사고발한 내용을 들었다고 하고요.여튼 이런상황이라 제가 처음 a차량을 받았던데에 차량 렌트비 등등을 물어보면서 통화를 했고.. 삼성콜센터에 대물담당자를 바꿔달라고 요청을 했어요. 그리고 대물담당자가 바뀌었는데.. 이 사람이 렌트카 업체로 최종 네고한게 저희가 100만원을 내라고 하네요.오늘까지 안내면 소송하겠다고 난리인데.. 일딴 100만원을 내긴 해야하는데..지금 이 건으로 대인은 합의안한상태이고요..  사고당해서 렌트카 업체를 저희가 부른것도 아니고 삼성렌트카라고 하고 전화와서 저희는 받아서 탔고..수리하는 기간동안 탔는데 25일 지난것에 대해서는 렌트비 저희가 내라고 하고 중간 고지도 안해주고..저희가 최종금액 100만원 내고 터는게 맞나요..? 우선 오늘까지라 100만원 입금은 했어요..교통사고 렌트카 25일이상되는거 저희가 내야하나요?그리고 그 전 손해사정인에 대해서는 그 사람은 사람 괴롭히다가.. 아니면 말고 이런식으로 일하는것 같은데 정말 너무 스트레스입니다ㅠㅠ 사고를 많이 낸 남편의 책임이 크다고 생각하지만.. 사고가 났을때 보장하기 위해 보험을 드는것인데..ㅠㅠ 현재 소송중인건은 변호사가 국제면허증일때 일년마다 외국나갔다와야하는거 몰랐으니 그 내용을 어필해서 열심히 해보고 있어요. 이부분도 아시는 분 있으면 의견 부탁드립니다.ㅠㅠ저랑 남편은 스트레스 엄청 심하고.. 저는 스트레스로 수시로 얼굴한쪽이 올라갔다가 내려오고 있습니다.. 얼굴한쪽이 수시로 떨리고 사고로 다친것때문에 무릎발목 등등이 계속 시큰시큰하고 아프고요ㅠㅠ.. 잘 아시는 분들의 의견 여쭙습니다..하도 답답해서 주저리주저리 글 썼는데.. 긴글 읽어주셔서 감사합니다.      ","0","https://www.bobaedream.co.kr//view?code=accident&No=750141","차때문에스트레스","3,861","2022.10.27 17:12",""
"2713705","카카오?","김범수가 다음의 새 주인 의장으로 들어오면서 급격한 상승세를 타게 됩니다. 심지어는 정권수혜주라는 얘기도 나왔었져.정권 수혜주는 나쁜건 아닙니다. 어느 기업이든 시대적 이벤트가 있을때 기회로 잘 타면 성장하는거고 그 기회는 다시 오지 않는 경쟁사가 절대 카피 못하는 기회이자 경쟁력이니까..어느 정권과 잘 맞았다는건 문제될건 아닙니다. 다음의 경우 정권과 잘 맞게 됐던 대표적 이유가 있지요.타다 사태 기억하실겁니다.택시 vs 플랫폼 간의 밥그릇 싸움이었고 정부는 여객운수법 위반이라하여 강직하게 버티던 타다에 철퇴를 내립니다   그런데 카카오는 강성으로 버티지 않고 우회전략을 썼지여.택시 법인을 인수하여 그들의 밥그릇을 보전해주고 카카오는 확장하는 누이좋고 매부좋고 전략.타다와 너무 대조적인 이런 모범답안을 정부가 반겨하지 않을 수가 없겠죠. 그래서..93건 기업인수 중에 공정위 검사 4건이라던지..독점적 점유율을 가짐에도 다른 규제가 없었던.정부는 정책을 수행하려면 정부 요구에 맞춰 따라주는 친위대 같은 기업이 필요하니 서로 잘 맞은거라 볼 수 있습니다.  그러다가.. 정부와 카카오간 이상한 기류가 생겨납니다.   수익에만 너무 밝아서 골목상권을 자꾸 건드리니 정부도 더 이상 간과하기 어려웠던 것.규제에 시동이 걸리고 카카오가 팽당했던 얘기가 나오게 되져.   와중에 기업가 윤리에 금가는 소식들이 속속.정부 입장에서는 점점 눈엣 가시로 비춰지게 되는거죠.     직장내 괴롬힘 인사평가 문제등..고용부 관할에서도 평탄하진 않았습니다.    이번엔 카카오 만의 문제가 아닌 idc들의 문제.아현동 화재로 통신난을 겪었음에도 업계 vs 정부 구도로 무산되버린 idc 감독권.양 측 논리가 일리는 있는지 몰라도 무산됨으로 인해 이번 카카오 사태가 인재의 재발이라는 평가죠.    게다가...외국 자본을 가져다 쓰는것 자체는 일정 수준에서 문제 될건 아닌거 같습니다만.현재 돌아가는 중국 상태를 보면 우리와 경제적 거래는 많아도 우리와 막역한 죽마고우라기 보단.. 언제라도 먹고 싶어 안달하는 경쟁상대일 뿐이니까.금융 자본이면 더 신경이 쓰입니다.   현재는 여야가 힘을 합쳐 철퇴중인 카카오.카카오는 어쩌면 it 업계에 보여지는 여야의 표본케이스일지도.idc는 물론 독과점 규제 까지. 사실 그래요.코로나 온라인 수업이나 백신 예약 국민비서등을 수행하는 sns라면 국가 기간통신망의 성격이 없지 않죠.항공 통신 반도체 물류 금융 기간산업 등은 어느 나라나 국가 차원에서 자율경쟁으로만 둘 수가 없는 노릇입니다..안보쪽에서도 그렇습니다.극단적인 가정으로 만약 통신망을 마피아에 점령 당했다 생각해 보세요 끔직!!!   다음이 어렵던 시절 경영진이 물러나고 주인 없는 회사 처럼 떠돌다가김범수가 의장으로 들어오며 새 주인이 되었고.. 그런데 김범수가 창업주와 같은 애정을 가지고 튼튼하고 오래지속될 회사를 만들려는 주인일까?있는 동안 아무 자본이나 끌어다 외형 키우고 득보고 갈 나그네 주인일까?판단은 각자의 몫으로 남겨드립니다.","1","https://www.bobaedream.co.kr//view?code=freeb&No=2713705","7번창구2시","175","2022.10.18 11:29",""
"5447010","진짜 비트코인등 가짜화폐 코인 망할듯[5]","루나 10만원대에서 100원으로 -99.9% 폭락해서 싸다고 산 코인이 10원 5원 1원도 안하고 0.3원 나중엔 휴지 0원 되는거 보면 진짜 알트 코인이 사기구나 생각했는데 카카오톡이 건물화재 났다고 무용지물이 되는거 보니 비트코인은 전쟁나면 쓰레기구나 그냥 싶습니다 보배에서도 코인투자 하시는분들 있을텐데 정말 조심하십시요.몇만원 하던 코인이 수천만원하는데 정말 거품이고 나중엔 예전에 영화나 음악할때 쓰던 CD (콘돔 아닙니다) 컴팩트 디스크 약자 처럼 사라질수 있습니다. ","15","https://www.bobaedream.co.kr//view?code=strange&No=5447010","미소하루아빠","2,569","2022.10.16 00:41",""
"2166008","아이오닉6 오너 개황당사건[25]","코로나 사태로 하던 사업이 잘안되서 얼마전에 개인 택시를 시작한 30대입니다. 그랜져신형으로 몇일운행하다 미리예약한 아이오닉6가 바로 어제 출고되서 썬팅도 하고 할것도많은데 어제 시간이 늦어서 핸드폰충전기설치랑 비늘뜯으려고 지하주차장에 내려가서 차에서 시동을 거는데 갑자기 전기시스템 점검하라는 경고등이 켜지는겁니다.  이렇게요. 그래서 대수롭지않게 생각하고 시동끄고 다시켜니 없어지더라구요. 그래서 오류인가 생각했는데 다시 한 3분뒤 똑같이 뜨고 이걸 5번 반복하고 이건 아니다 싶어서 딜러에게 사진전송하고 연락하니 블루핸즈 출동 시스템점검하더니 하는말 본인도 아이오닉6은 처음본답니다. 그러면서 무슨 부동액펌프가 안돌아서 화재가 될수도있고 운행하면 위험할수있다고 오늘 아침에 고양일산센터에 입고시켜야된다고 하네요;; 렉카로 떠서요    아니 인수받고 운행이랄것도 안했는데 문제가 생기면 애초에 시흥에서 고장난차를 보낸건데 20키로운행한차를 센터에서도 지금 오니 난감한것같고 이게 진짜 믿고타도 되는건지 상당히 불안하네요...몇일이라도 탔으면 내탓도 조금있을수도있다 생각할수도있는데 인수받자마자 고장차를 준게 말이되는건지 애초 차값이 6000만원짜리 차인데요... 일반차량도 문제지맘 영업용은 대차도 안되고 영업손실이 있는데 참 마음이 안좋아서 보배에 처음 글올려보네요 ㅠ 일단 센터에서 대기중인데 처리결과는 나오면 한번더 글쓰든 해보겠습니다","71","https://www.bobaedream.co.kr//view?code=national&No=2166008","슈퍼덴버","8,033","2022.10.05 08:50",""
"2164829","불-앰 따브류[7]"," 불앰은 결함 인정하고 개선품 교체해서 20년도 부터 휸기차 보다 화재율이 내려감 휸기는 코나 EV 그냥 단종 때려서 오너들 ㅈ됨 크..... 그래도 사주실거죠? ","0","https://www.bobaedream.co.kr//view?code=national&No=2164829","530i320d차주","788","2022.09.30 07:59",""
"2164635","듀얼 스크린 디스플레이 딱 찍혔다..차세대 코나EV[1]","판매 부진에 화재 사태까지 겹치며 단종된 현대 코나EV가 절치부심하는 모습이 해외에서 포착됐다.해외 자동차 전문매체 ‘모터1’은 29일(현지시간) 코나 EV 차세대 모델이 주행 테스트 중인 모습을 촬영했다.모터1의 사진을 보면 현대차는 각종 논란에도 불구하고 새로운 코나EV를 여전히 개발 중인 것으로 보인다. 매체는 “코나EV는 철저히 위장막으로 가렸지만 여전히 현대차가 차세대 코나EV를 개발하고 있음을 보여준다”라고 전했다. 이번 스파이샷에서 새롭게 파악할 수 있는 부분은 코나EV의 충전 포트 위치다. 케이블을 코나EV 그릴의 포트에 꽂은 채로 이 전기 자동차를 충전하는 모습이 처음으로 포착된 것이다.비록 검은색 덮개와 클래딩이 실외 디자인의 세부 사항을 다소 가리고 있지만 코나EV는 현대차의 준중형 스포츠유틸리티차(SUV) 투싼의 일부 스타일을 채택한 것으로 추정된다.매체는 “최근에 공개한 다른 현대차 모델은 대담한 디자인 세부 사항을 포함하고 있었다”면서 “코나EV의 경우에는 분할 헤드램프와 테일램프 디자인이 바로 그 대담한 디자인적 특징”이라고 보도했다.아직 코나EV 파워트레인에 대한 세부 정보는 공개되지 않고 있다. 다만 기아가 공개한 차세대 니로 EV의 제원이 코나EV의 기준이 될 것으로 보인다. 두 모델이 같은 파워트레인을 공유하는 ‘사촌’이기 때문이다. 이를 근거로 모터1은 “코나EV가 니로EV와 동일한 68.4kW 배터리와 201마력(150kW) 전기 모터를 탑재할 것”이라고 예상했다.매체가 추정한 코나EV의 신규 배터리는 1세대 코나EV에 적용된 68.0kWh 배터리보다 약간 더 크다. 188파운드-피트(255뉴턴-미터)의 토크를 생성한다.한편 모터1은 최초로 코나EV의 실내 모습도 촬영했다. 다소 먼 거리에서 망원렌즈로 당겨서 촬영한 이 사진을 보면 대시보드에 그래픽을 표시하고 있는 듀얼 스크린 디스플레이가 엿보인다. 듀얼 스크린 디스플레이는 현대차 아이오닉5와 같은 위치에 같은 크기로 장착될 가능성이 크다. 다만 인테리어 스타일링은 다소 다른 방식을 채택할 가능성이 높다는 것이 매체의 예상이다.현대차는 코나 하이브리드와 동시에 출시할 것으로 예상되는 코나EV의 정확한 출시 시점을 아직 공개하지 않고 있다. 다만 코나EV와 코나 하이브리드를 출시한 이후 코나N도 출시할 가능성이 있다.","0","https://www.bobaedream.co.kr//view?code=national&No=2164635","투카티1199S","824","2022.09.29 13:57",""
"5391976","자가격리3일짼데 지금보니 약이 별거 없네요[4]","가래때문에 자다가  깨는 중상땜에 짜증나서 약성분 보니까코로나 치료재는 하나도 없네???? 그냥  가래제거재 랑 소화재 ㄷㄷㄷㄷㄷ시벌거. .  갠히 확진받았네.  그냥 약이나 타먹을걸","2","https://www.bobaedream.co.kr//view?code=strange&No=5391976","황금의성","1,302","2022.09.10 02:55",""
