id,title,content,likes,url,author,views,created_at,updated_at
760728,"'배터리 교체' 코나EV 주행중 화재…""리콜 실효성 의문"" 사고원인 다시 조사해야","'배터리 교체' 코나EV 주행중 화재…""리콜 실효성 의문""11일 충남 태안 달리던 코나EV 전소""리콜 뒤 화재 발생, 사고원인 다시 조사해야""리콜에 따른 배터리를 교체한 현대자동차 전기차 모델 '코나EV'에 또 화재사고가 발생했다. 소방당국은 화재원인 조사에 나섰으며 관련 업계의 이목도 집중되고 있다.특히 리콜을 실시한 이후 네 번째 사고로 현대차가 국토교통부에 제출한 리콜 조치가 근본 해결책이 아닐 수 있다는 분석도 있다.12일 독자 제보와 소방당국 등에 따르면 지난 11일 오후 6시 46분경 충남 태안 도로를 달리던 코나EV에 화재사고가 발생했다. 사고 차량은 2020년형 모델로 지난해 9월 리콜에 따른 배터리 교체가 완료된 상태였다.운전자는 ""100% 충전한 상태에서 출근한 뒤 퇴근길에 화재가 발생했다""며 ""사고 당시 충전 상태는 97%였다""고 밝혔다. 그러면서 ""리콜 조치에 따라 배터리를 교체했는데 불이 났다. 원인을 다시 찾아야 한다”고 강조했다.화재 차량은 전소됐으며, 약 2800만원의 재산 피해를 입은 것으로 알려졌다. 다행히 인명피해는 발생하지 않았으며 소방당국은 화재원인 등에 대해서 조사하고 있다.특히 배터리 교체 등 리콜을 받은 차량에서도 잇딴 화재사고가 발생, 리콜 실효성 논란으로 이어질 것으로 보인다. 앞서 지난해 1월과 7월 리콜을 받은 차량에서도 화재사고가 발생했으나 당시에는 주차장에 주차중인 상태였다.배터리 업계에서는 주행중 화재가 발생했다는 점에서 기존 리콜 배경인 배터리 문제가 아닐 수 있다는 반응이다.이와 관련, 현대차 관계자는 ""사고 원인을 조사할 방침""이라며 신중한 입장을 보였다.한편 현대차는 코나EV에서 배터리 화재 사고가 잇따르자 지난해 3월 LG에너지솔루션과 1조4000억원을 투입해 국내외에서 판매된 7만5680대를 대상으로 대규모 리콜을 단행한 바 있다.https://www.theguru.co.kr/news/article.html?no=30184",0,https://cafe.naver.com/ca-fe/ArticleRead.nhn?clubid=21771803&page=1&userDisplay=50&inCafeSearch=true&searchBy=0&query=%EC%BD%94%EB%82%98+%ED%99%94%EC%9E%AC&includeAll=&exclude=&include=&exact=&searchdate=2021-07-312022-01-31&media=0&sortBy=date&articleid=760728&referrerAllArticles=true,키I아이오닉5모3,"2,141",2022-01-12 09:51:00,
760699,코나 또 불났군요... 피해자분 글에 달린 댓글들 보니...,"우선 피해자분 다치지 않고 무사하신 것에 참 다행으로 생각하고, 심심한 위로의 말씀 드립니다.어차피 현대차와 정부는 근본적 문제해결에 관심이 없기 때문에 큰 기대는 안 하고 있는 일인으로서, 그저 피해자분께서 실망하지 않으실 만큼은 피해보상 꼭 잘 받으시길 바랍니다.그나저나 피해자분이 쓰신 글에 달린 몇몇 댓글들을 보니, 현대차의 문제가 아니다, 엘지의 문제가 아니다, 중국 업체의 문제다...로 자꾸 여론을 호도하려는 분들이 계시던데... 그러다가 나중에는 100% 완충하는 개인 차주들의 문제다라는 방향으로 흘러가겠네요?적어도, 대부분의 코나 차주님들은 다 아실 겁니다. 이 사태의 제1책임자는 현대차이고, 사태를 방기하고 어마어마한 소비자들의 피해를 개개인이 감당하게 만든 게 정부라는 것을요. 지난 수년 동안 현대차는 코나 출시를 미루거나 중단하는 것에서부터 출시후 1년차, 2년차, 3년차... 문제를 해결할 수 있는 시간이 충분했습니다. 하지만 그렇게 하지 않았습니다. 정부는 옆에서 손 놓고 봐주며 보고만 있었다가, 아이오닉5 출시를 앞두고 결국 사태를 부랴부랴 해결하는 제스쳐만 취했을 뿐입니다. 그런 상황에서... 우리가 고작 하고 싶은 말이 현대차의 문제가 아니다, 엘지의 문제가 아니다, 중국 모업체의 문제다... 여야 하는 건가요? 참 안타깝네요.",3,https://cafe.naver.com/ca-fe/ArticleRead.nhn?clubid=21771803&page=1&userDisplay=50&inCafeSearch=true&searchBy=0&query=%EC%BD%94%EB%82%98+%ED%99%94%EC%9E%AC&includeAll=&exclude=&include=&exact=&searchdate=2021-07-312022-01-31&media=0&sortBy=date&articleid=760699&referrerAllArticles=true,밤송lM3L코나l천안,"1,603",2022-01-12 09:03:00,
760657,충남 태안서 달리던 코나 전기차 화재…차량 전소,"[코나] 2021년에 배터리 교체 했는데 화재 일어났습니다 오늘충남 태안서 달리던 코나 전기차 화재…차량 전소11일 오후 6시49분께 충남 태안군 태안읍 한 도로에서 이모(26) 씨가 몰던 현대 코나 일렉트릭(EV)에서 불이 났다.이 불로 2020년식 이 전기차가 전소돼 2천800만원(소방서 추산)의 피해를 내고 30분 만에 꺼졌다.이씨는 ""운전 중 차에서 불이 나는 것 같아 세우고 살펴봤더니 좌석 밑에서 연기와 불꽃이 보였다""며 119에 신고했다.경찰과 소방당국은 자세한 화재 원인을 조사하고 있다.http://www.newsfreezone.co.kr/news/articleView.html?idxno=356591",6,https://cafe.naver.com/ca-fe/ArticleRead.nhn?clubid=21771803&page=1&userDisplay=50&inCafeSearch=true&searchBy=0&query=%EC%BD%94%EB%82%98+%ED%99%94%EC%9E%AC&includeAll=&exclude=&include=&exact=&searchdate=2021-07-312022-01-31&media=0&sortBy=date&articleid=760657&referrerAllArticles=true,키I아이오닉5모3,"3,673",2022-01-12 07:44:00,
760523,코나차주인데...내차 안전한거 맞아요?,베터리 교체하신 차주분이전소가 되었는데.과연 내차는 안전한가..그안전은 보장해줄수있는가..의문점이생기네요,1,https://cafe.naver.com/ca-fe/ArticleRead.nhn?clubid=21771803&page=1&userDisplay=50&inCafeSearch=true&searchBy=0&query=%EC%BD%94%EB%82%98+%ED%99%94%EC%9E%AC&includeAll=&exclude=&include=&exact=&searchdate=2021-07-312022-01-31&media=0&sortBy=date&articleid=760523&referrerAllArticles=true,라케르I코나I익산,825,2022-01-11 22:25:00,
758961,중고 전기차 구매??,"* 관련된 주제에 대해 미리 카페내 검색해 보셨습니까? : (네/아니오)* 전기차 종류, 지역 : 여주* 질문 내용 :코나 니로 코나는 단종인걸로 아는데 코나 괜찮을까요?? 중고도 괜찮나요?",0,https://cafe.naver.com/ca-fe/ArticleRead.nhn?clubid=21771803&page=1&userDisplay=50&inCafeSearch=true&searchBy=0&query=%EC%BD%94%EB%82%98+%ED%99%94%EC%9E%AC&includeAll=&exclude=&include=&exact=&searchdate=2021-07-312022-01-31&media=0&sortBy=date&articleid=758961&referrerAllArticles=true,배쏘l경기,262,2022-01-09 11:12:00,
757996,전기차 관련 유투브 컨텐츠들 믿을 만 한건지요???,"전기차를 늦게나마 알아보고 구매할려고 공부 중인 다둥이 아빠입니다.아들이 전기차 멋지다며, 전기차를 사자고 해서 EV6와 아이오닉5에서 고민 중에 있습니다.그래서 여러 유투브 전기차 관련 컨텐츠들을 보면서 공부 중인데, 극과 극으로 갈리내요.어떤건 최고의 전기차다, 어떤건 최악이다. 소비자를 우롱하는 현기차다. 등등....선택은 제가 하는 거지만, 고민스럽긴 합니다.유투브 보다는 동호회 카페 정보가 더 정확하겠죠?답답해서 적어 봅니다. ㅜㅜ",0,https://cafe.naver.com/ca-fe/ArticleRead.nhn?clubid=21771803&page=1&userDisplay=50&inCafeSearch=true&searchBy=0&query=%EC%BD%94%EB%82%98+%ED%99%94%EC%9E%AC&includeAll=&exclude=&include=&exact=&searchdate=2021-07-312022-01-31&media=0&sortBy=date&articleid=757996&referrerAllArticles=true,계족산폭격기I세종,502,2022-01-07 10:57:00,
756675,니로 중고차 주행가능거리 어떤가요?,,0,https://cafe.naver.com/ca-fe/ArticleRead.nhn?clubid=21771803&page=1&userDisplay=50&inCafeSearch=true&searchBy=0&query=%EC%BD%94%EB%82%98+%ED%99%94%EC%9E%AC&includeAll=&exclude=&include=&exact=&searchdate=2021-07-312022-01-31&media=0&sortBy=date&articleid=756675&referrerAllArticles=true,손쿠자,451,2022-01-05 13:03:00,
755590,노사장영상,충전기관련영상을 봤는데 잘못된정보로 이야기하네요언제부터 이트론과 타이칸이 어댑터를사용했나요..그냥 현까노사장인건 알겠는데 코나화재가 충전기랑관련있다하고(볼트화재도 비슷한데요) 수입차는 어댑터사용한줄알고있고 수입전기차는 인증보다멀리간다고 이야기하고 g80전기차는 인증보다못가나요? 모르는분들이 보면 그냥 믿겠지요...,1,https://cafe.naver.com/ca-fe/ArticleRead.nhn?clubid=21771803&page=1&userDisplay=50&inCafeSearch=true&searchBy=0&query=%EC%BD%94%EB%82%98+%ED%99%94%EC%9E%AC&includeAll=&exclude=&include=&exact=&searchdate=2021-07-312022-01-31&media=0&sortBy=date&articleid=755590&referrerAllArticles=true,나다우기l모3l광주,782,2022-01-03 18:07:00,
754933,중고전기차 구입하기 좋은 1월 왔네용~!!,"안녕하세요 22년 범띠해가 되어 5년째 전기만 먹고달리는 순수전기차 오너 전기만 입니다^^늦 가을쯤에 얘기드렸듯이 중고 전기차 구입하기 좋은 1월이 왔습니다단 출고 1년이 안된차들은 중고 전기차라고 보기 힘듭니다^^ㅋㅋ(시세를 가늠하김 힘듬)그때 얘기드린데로 천정부지로 오를줄 알았던 중고전기차 값이 요즘 확실히 하락새를 보이고 있죠^^이제는 선택해야 할때가 왔죠^^신차보다 중고전기차에 더 매략을 느끼신다면 지금이 가장구입하기 좋은 시기입니다^^3월이 되어 전기차 연비가 다시 좋아지면 기존 오너는 팔고싶은 마음이 사라지고 전기차를 유지하려는 마음이 강합니다이건 매년 그래왔습니다^^전기차는 1월에사서 1차 신차 지자체 보조금이 끝나는 8~9월에 팔면 감가가 없거나 아니면 오히려 돈을 벌고 팔수 있습니다참고로 올해보조금은 5~6월이면 1차분이 끝날만큼 보조금 대기자가 많습니다^^ ㅎㅎ다실 말해 6~7월쯤에 팔면 제갑받거나 오히려 웃돈을 받고 파실수도 있지만 사실 그냥 타는게 더 돈버는겁니다^^ㅎㅎ올해도 여전히 마찬가지입니다 ^^ㅎㅎ이 강추위를 를 못이기고 전기차 처음 구입하셨던분들은 내차가 고장난건 아닌가?? 내가차 배터리 수명이 거의 다된건 아닌가하는 두려움으로 판매를 많이하는 시기입니다이럴때 그냥 어떤 중고차든(왠만하면 사고없고 키로수 낮고 보증 남은차량이 좋습니다^^)시세 보고 중간가격에 사시면 절대 손해 안봅니다^^신차 계약해두신분들도 중간에 잠시 탈 생각이 있으시면 지금 구입해서 타다가 신차 나오먼 다시팔고 심차로 갈아타시면 됩니다^^전기 중고차 구매하는거 어렵지 않아요^^1.일단 중고매매상 가서 차량을 몇대 직접보세요^^타보기도 하고 당일보험 가입해서(2만원정도) 실 주행해보기도하고 차에대해 중고매매판매자에게 이것저것 물어보기도 하고요^^단, 중고매매상에 너무 싼 매물을 보러가시면 어디 끌려갈지도 모르니 시세의 중간값이나 그보다 좀더 비싼 가격대의 차를 보러 가셔야합니다^^사러가는게 아니라 보러 가는거니깐(그러다 뭐 영업사원 친절하고 차상태 좋으면 사도 무방합니다^^ㅎㅎ)이렇게 전기차에 대해 직접 보고 배웁니다2.그럼 이제 2단계는 카페에서 중고직거래를 봅니다중고 직거래라고 결코 싸지 않습니다 ^^여기서도 잘 판단해서 너무싼건 일단 패스합니다 그리고 중간가격이나 그이상의 가격대 차를 약속을 잡고 보러갑니다자 여기서 보기도전에 가격 까는얘기하면 손해입니다차보면서 질문도 하고 연비는 잘나오는지 충전은 어떻게 했는지 등등을 물어보면 또 정보를 알아냅니다그리고 이미 조금 비싼 차를 봤기때문에 그차가 바로 팔리 가능성은 없죠^^본 차가 괜찮다고 생각한다면그럼 시간을 가지고 조금(최대일주일) 기다리다가 네고를 조금 하고( 예, 3천 정도나온거면 50만원 정도는 네고가능합니다2천이면 한 30만원 정도 ^^ 차값의 1~2% 내외로 네고 질문하는건 큰 실례는 아닙니다^^)단 네고문의 사정 이라고 써놓은 게시물에는 조심해서 물어보시는게 좋습니다^^이렇게해서 구입하면 뭐 무조건 혜자입니다^^중고전기차는 대부분 배터리 보증이 8년 16만이나 10년 20만키로 정도 입니다이정도 가드만 알고 키로수가 10만키로 안넘고 출고 5년이내 차량이면 나름 탈만한 차라고 보시고 구매하시면됩니다^^이렇게 중고 전기차를 구매하시더라도꼭 신차 1대는 계약을 해놓으세요^^올해 신차보조금이 정말 마지막이라고 할만큼 많이 주는 해입니다^^카페에 들어오셔서 제 글을 보시고 신차든 중고든 구매해서 타신분들은 다 돈버시는겁니다^^저도 이카페 다른 회원분덕에 17년여름에 처음 중고 전기차 레이로 입문해서 지금껏 중고 몇대 샀다 팔았고 신차 3대 정도 사서 타고 있네요^^매년 전기차를 잘 모르시는분들이 전기차는 시기상조다 나중 배터리 생명다하면 기름값으로 번것 다 날린다고 했지만 저는 중고전기차 사서 전부다 감가가 적거나 조금 남기고 팔았었네용이유는 단 하나입니다 수요는 늘어나는데 공급이 정해져 있기때문이죠^^중고 전기차로 재테크를 하시는분이들이 있을정도 이니깐요^^ㅎㅎ제가 이렇게 글을 쓰면 예전이나 그렇지 이젠 아니다라고 하실분들있습니다^^18년에도 19년에도 20년에도 작년에도 그랬습니다그치만 중고거래 몇번 하보신 회원님들은 압니다중고전기차 샀다가 다시 팔아도 거의 손해 안본다는 것을요^^지금이 전기중고차 사기 참 좋은시기입니다^^중고 전기차 구매 생각 있으시면 이번달을 놓치지 마세요^^판매하고싶은 생각이 많아서 왠만한 네고도 받아주는 시기입니다^^ㅎㅎ2월 3월이 되면 각지자체별 보조금 계획이 나오면서 중고 전기차 값이 다시 오릅니다^^아! 되도록 DC콤보 전기차로 사시길 바랍니다^^전기차는 늘 말씀드리지만 언능사서 많이 타는게 돈버는겁니다이글을 보는 몇안되는 회원분들이 전기차 사서 기름값도 아끼고 카테크도해서 돈 많이 버셨으면 좋겠습니다^^참고로 고속도로 톨비는 22년말까지만 50% 할인입니다^^이건 참 아쉽습니다 ㅜㅜ사진은 오닉5 공조기 히터 전기 소비량입니다 ㅜㅜ무려 2kw 가 넘습니다 ㅜㅜ이로니 오닉5 겨울 전비가 떡락하는것 같습니다 ㅜㅜ고난의 겨울입니다 ㅜㅜ",8,https://cafe.naver.com/ca-fe/ArticleRead.nhn?clubid=21771803&page=1&userDisplay=50&inCafeSearch=true&searchBy=0&query=%EC%BD%94%EB%82%98+%ED%99%94%EC%9E%AC&includeAll=&exclude=&include=&exact=&searchdate=2021-07-312022-01-31&media=0&sortBy=date&articleid=754933&referrerAllArticles=true,전기만I레코아5I서울,"1,058",2022-01-02 18:24:00,
753235,"현대자동차 전기차, 수소차 2배 증가 견인한 ‘국내전동화실’ 1년 만에 폐지","현대자동차 전기차, 수소차 2배 증가 견인한 ‘국내전동화실’ 1년 만에 폐지신형 아이오닉5가 2만1478대로 전체의 절반 가까이 차지했고, 1톤 포터EV가 70.8% 늘어난 1만4,661대, 제네시스 브랜드의 e G80가 1,123대, 제네시스 전용 전기차 GV60가 453대가 각각 판매됐다. 다만 코나 EV는 화재 이슈로 올해 판매가 전년 동기에 비해 82%가 줄어든 1,428대에 그쳤다.수소전기차 넥쏘도 올 초 부분경 모델 출시에 힘입어 전년 같은 기간에 비해 50.5% 늘어난 8,206대를 기록 중이다.올해 내 놓은 신형 아이오닉5와 제네시스 G80의 전기차 버전인 eG80, 제네시스 전용 전기 SUV GV60, 넥쏘 부분 변경모델들이 모두 기대 이상의 성과를 거뒀다는 평가다.국내전동화전략팀과 전동화판촉팀 등으로 구성된 전동화실은 전기차와 수소전기차 판매, 마케팅업무 외에 전동화 전략 수립과 고속충전 충전시설 지원 및 수소충전소 확대 지원 등의 업무를 담당해 왔다.하지만 국내 전동화실은 연말 조직개편에서 해체되면서 국내사업부로 귀속됐다.http://www.autodaily.co.kr/news/articleView.html?idxno=431128",0,https://cafe.naver.com/ca-fe/ArticleRead.nhn?clubid=21771803&page=1&userDisplay=50&inCafeSearch=true&searchBy=0&query=%EC%BD%94%EB%82%98+%ED%99%94%EC%9E%AC&includeAll=&exclude=&include=&exact=&searchdate=2021-07-312022-01-31&media=0&sortBy=date&articleid=753235&referrerAllArticles=true,키I아이오닉5모3,"1,228",2021-12-30 13:49:00,
751727,전기차 장거리 장단점 부탁드립니다,제가 전기차 구입 예정으로하루200km 운행하려는데전기차 사용시 장단점 좀 알려주십시요,0,https://cafe.naver.com/ca-fe/ArticleRead.nhn?clubid=21771803&page=1&userDisplay=50&inCafeSearch=true&searchBy=0&query=%EC%BD%94%EB%82%98+%ED%99%94%EC%9E%AC&includeAll=&exclude=&include=&exact=&searchdate=2021-07-312022-01-31&media=0&sortBy=date&articleid=751727&referrerAllArticles=true,m온달,"1,142",2021-12-28 09:20:00,
747751,내 사랑 코나 (차박 사진 유),"답답할때면 포항을 다녀옵니다.집에 올해 들여온 테슬라들이 있지만서도아직도 함께 하고 있는 코나...이런저런 답답함에 바람이 쐬고싶어...포항으로 출바알~~~!!!도착~~~!!차박지 도착 후 출출하니 라면 끓입니다.술은 산사춘 입니다. ㅎㅎ전기장판에 베개, 트럭용 가림막까지~~~창문은 측 후면 전체 커텐 작업이 되어 있습니다.제 나름 풀옵션입니다. ㅎㅎ굳이 비싼 돈 들여 매트사고 그렇게 꾸밀 필요가 없습니다.2열 엉덩이 시트 빼낸 다음 수평화 만들고집에 굴러다니는 요가매트 하나 올리면평탄화는 끝입니다.뭐 베개나 이불은 집에 남는거 많으니까....저 앞 검은 전경은 바다입니다.저때가 너무 좋아요.바다소리 찰랑찰랑....좀 춥지만 머리가 개이는 바닷바람.히터 22도에 전기장판 켜고서바닷소리 들으며 몇 시간 잠든 후아침에 해뜨면....짜잔.....트렁크 열면 바로 이 모습입니다.일출 시간이네요.코나를 솔로 캠핑 용도로 워낙에 이것저것 꾸며놔서차마 떠나보낼 수가 없네요.뭣보다 니로에 들어간 sk 배터리가 탑재된 코나라서리콜 대상도 아니고 화재 위험도 없습니다. ㅎㅎ코나야 앞으로도 무사고 안전운전하며나와 쭈욱 함께 하자~~~아이언맨 데이라이트 작업프렁크 작업천장 엠보싱, 물방울 등 작업 + 측 후면 커텐 작업요가매트로 초간단 2열 평탄화 작업대구 에코랠리 행사 참가(18년도)포항 화진 해수욕장 차박플렉스 체험~~~차는 작아도 의외로 많이 실립니다~~~영광의 전비 레이서 트로피좋게 봐주셔서 감사합니다.",4,https://cafe.naver.com/ca-fe/ArticleRead.nhn?clubid=21771803&page=1&userDisplay=50&inCafeSearch=true&searchBy=0&query=%EC%BD%94%EB%82%98+%ED%99%94%EC%9E%AC&includeAll=&exclude=&include=&exact=&searchdate=2021-07-312022-01-31&media=0&sortBy=date&articleid=747751&referrerAllArticles=true,셀리드I모3Y코나I대구,"1,066",2021-12-21 21:54:00,
746721,전기차 급발진 얘기들이 좀 들리던데 어떨지...,내연기관 자동차도 급발진이 있는데전기차는 더 많지 않을까요??전기차로 갈려고 하는데 이런게 걱정이네요.... ㅠㅠ,0,https://cafe.naver.com/ca-fe/ArticleRead.nhn?clubid=21771803&page=1&userDisplay=50&inCafeSearch=true&searchBy=0&query=%EC%BD%94%EB%82%98+%ED%99%94%EC%9E%AC&includeAll=&exclude=&include=&exact=&searchdate=2021-07-312022-01-31&media=0&sortBy=date&articleid=746721&referrerAllArticles=true,꿈같은시간I경기,"1,237",2021-12-20 13:17:00,
742785,전기차 플랫폼이 중요한가요?,"* 관련된 주제에 대해 미리 카페내 검색해 보셨습니까? : (네/아니오)* 전기차 종류, 지역 : ix3 서울* 질문 내용 : ix3 구입 예정입니다.전기차 전용 플랫폼이 아니라 단점이라는 말을 들었는데 문제 되는 게 있나요?실내 공간 활용은 크게 불편하지 않을 듯 한데 그 이외에 무슨 단점이 있을까요?",0,https://cafe.naver.com/ca-fe/ArticleRead.nhn?clubid=21771803&page=1&userDisplay=50&inCafeSearch=true&searchBy=0&query=%EC%BD%94%EB%82%98+%ED%99%94%EC%9E%AC&includeAll=&exclude=&include=&exact=&searchdate=2021-07-312022-01-31&media=0&sortBy=date&articleid=742785&referrerAllArticles=true,호피다l서울,"1,305",2021-12-14 10:16:00,
742606,코나 단점 뭐가있을까요?,"* 관련된 주제에 대해 미리 카페내 검색해 보셨습니까? : (네/아니오)* 전기차 종류, 지역 :* 질문 내용 :중고차구매예정이고 코나 or 니로신데코나디자인에 코나쪽으로 기울었는데단점 뭐가있을까요?",0,https://cafe.naver.com/ca-fe/ArticleRead.nhn?clubid=21771803&page=1&userDisplay=50&inCafeSearch=true&searchBy=0&query=%EC%BD%94%EB%82%98+%ED%99%94%EC%9E%AC&includeAll=&exclude=&include=&exact=&searchdate=2021-07-312022-01-31&media=0&sortBy=date&articleid=742606&referrerAllArticles=true,명품필구l인천,"2,052",2021-12-14 00:20:00,
742417,라이프 스타일에 맞는 차량추천 부탁드립니다,"제목 그대로 입니다4인가족(7살, 1살)전원주택 거주e클래스 세단 1대 보유사업자라 장거리 많이감(1년 3만키로)추천 부탁드려요!! 국산, 외제 상관없습니다금액은 6천 언더(보조금 깠을때)",0,https://cafe.naver.com/ca-fe/ArticleRead.nhn?clubid=21771803&page=1&userDisplay=50&inCafeSearch=true&searchBy=0&query=%EC%BD%94%EB%82%98+%ED%99%94%EC%9E%AC&includeAll=&exclude=&include=&exact=&searchdate=2021-07-312022-01-31&media=0&sortBy=date&articleid=742417&referrerAllArticles=true,vv일렉트로닉vv,193,2021-12-13 19:47:00,
737579,코나ev 메인구동배터리 교체 리콜,"홈투홈 서비스로 리콜 다녀왔네요ㅋㅋ18년 7월 출고 92000키로 주행솔직히 계속타다가 뻑나면 그때 교체할려고했었네요 ,,ㅋ지금까지 거의 전부 급속충전만해왔습니다ㅋ 그래서 충전 다 끝나면 바로바로 빼고 했습니다ㅋ 그러다 이사를 가게되고 이사한 아파트단지에 완속충전기가있습니다ㅋ 단지에 전기차도 몇대없고 관리소장님도 그냥 충전 끝나도 계속 꼽아둬도 상관없다 그대신 충전때문에 차좀 빼달라하면 그때 빼줘라~ 그런데ㅠㅠ,,,,이게참 맘놓고 계속 꼽아두기가 거슬리는거에요ㅠ대부분 충전기 꼽아둔상태에 화재가 난 것 같아서요ㅠ혹여나 화재가나면 정말 골때릴 것 같기도하고요ㅠ현대측에선 수시로 계속 전화해가며 교체해라 교체해라 홈투홈서비스도있다 이러고ㅠ화재나면 이걸로 분명 트집잡아 보상도 제대로 안해줄려할 것 같고,,,아무튼 충전환경이 달라지니 생각도 달라지더군요ㅋㅋ지금은 맘편히 100퍼센트로 충전 하고있습니다ㅋㅋ충전다되도 바로안빼도되고ㅋㅋ심리적으로 안정되더군요ㅋㅋ혹시나 저처럼 생각하고계신분 계실까봐 글 남겨봅니다ㅋㅋ",1,https://cafe.naver.com/ca-fe/ArticleRead.nhn?clubid=21771803&page=1&userDisplay=50&inCafeSearch=true&searchBy=0&query=%EC%BD%94%EB%82%98+%ED%99%94%EC%9E%AC&includeAll=&exclude=&include=&exact=&searchdate=2021-07-312022-01-31&media=0&sortBy=date&articleid=737579&referrerAllArticles=true,듬삭티비I코나I제주,321,2021-12-07 09:48:00,
