id,title,content,likes,url,author,views,created_at,updated_at
736461,한국 전기차 년도별 전성시대,"한국 년도별 전성시대~19: 구오닉/볼트첫 전기차 플랫폼 볼트 줄서서 사던시기, 대기1년-> 전기차를 잘 몰랐고상대적으로 저렴했던 sm3, 레이 매입시기 (700대). 오 신기하네 차에서 소리가 안나 신기해하던시기~20: 코나/니로실주행거리 400키로대 코나 니로 전성시대대기 1년씩 걸리던 시기-> 시장성 뒤처져 가격 눌렸던 볼트, 오닉 매입시기볼트풀옵 (3차대란 탑승: 체감가 2300)구오닉 ( q 중옵 800 할인받고 구매),뉴오닉 400할인 구매*참고로 뉴오닉은 겨울철 충전속도 병맛인데실내는 여전히 세련됨..완소 뉴오닉~21: 테슬라 / gv60OTA , 자율주행으로 시장선도 대기 1년 걸림-> 코나 화재로 가치 하락, 니로 동반하락-> 니로 중고 매입 (체감가 2100)-> 태슬라 대란때 랜터카 매입(보조금 받고 출고하는것보다 싸게)22~: Q4 이트론 전성시대(예상) 및잔정한 춘추전국시대누가 싸게 좋은차 내놓느냐가 관건본인은 초피 투자 또는 줍줍 투자 선호자라위와 같이 sm3 , 레이, 구오닉, 뉴오닉, 볼트,테슬라 등 저렴하거나 가격이 눌릴때 (신차종 출시)매입하고 운행하였고사실 전부 수익구간에 매도..(매도예정)이나..최근 p는 너무 과도함.기 구모델 보유자는 매도 후 신차 갈아타기 준비특히 테슬라는 가격이 끝없이 올라가지만p주고 추격매수 절대 금지. (주식도 절대 신규 매수금지. 다른 수익률 높은 종목 발굴필요)대체제 많으니 느긋하게 기다릴것(자율주행이 다른차는 안된다고 하지말고 ㅋㅋ테슬라도 자율주행차 아님 ㅋㅋ)테슬라는 항상 깜짝 선물을 주는 경향이 있음.올해 계약자 중 내년에 몇백 더주고 사는건괜찮음. 뭐라도 더 얹혀주겠죠. 핸들 열선,오토프렁크 등..*테슬라주식으로 많이 번 사람들은 p주고 사도됨 ㅎ내년은 포트론 초p주고라고 진입테슬라는 올해 예약분으로 갈아타기 예정어제는 코인판 부처의 난 이후대량학살구간에줍줍 수익투자는 모멘텀투자가 유효할때가 많으나(전 눌림목 투자 선호)자동차를 p주고 사는건 기본적으로 자본주의와경제주체들을 무시하는 것임필요할때 택시타는 비용이 더 저렴함참고로 전기차를 계속 탔던것은가격이 떨어져도 존버만 (운행만) 한다면유류비 절감으로 충분히 헷징이 가능했기 때문근데 가격이 떨어졌다가 다시오름; 매도타이밍",1,https://cafe.naver.com/ca-fe/ArticleRead.nhn?clubid=21771803&page=1&userDisplay=50&inCafeSearch=true&searchBy=0&query=%EC%BD%94%EB%82%98+%ED%99%94%EC%9E%AC&includeAll=&exclude=&include=&exact=&searchdate=2021-07-312022-01-31&media=0&sortBy=date&articleid=736461&referrerAllArticles=true,겸둥이I아이오닉I인천,641,2021-12-05 16:34:00,
734370,슴삼이 화재난거 공지에 올려야 하지 않나요,https://cafe.naver.com/allfm01/733899보니까 차주님이 올리신거 같은데.예전 코나 화재때도 차주분이 올려서 공지로 올라갓는데. 물론 나중에 합의하고 지우시긴 햇지만.슴삼이는 르노에서 보상도 안해준대요.어찌보면 전기차 1세대인데.시간이 지나서 화재가 난다면.나중에 2-3세대도 언제 화재가 날지 모를듯.전기차 기술은 아직도 시기상조인가….,1,https://cafe.naver.com/ca-fe/ArticleRead.nhn?clubid=21771803&page=1&userDisplay=50&inCafeSearch=true&searchBy=0&query=%EC%BD%94%EB%82%98+%ED%99%94%EC%9E%AC&includeAll=&exclude=&include=&exact=&searchdate=2021-07-312022-01-31&media=0&sortBy=date&articleid=734370&referrerAllArticles=true,션볼로I코나I성남,327,2021-12-02 09:50:00,
733803,2017년부터 전기차 역사,"*2017년최고 인기차는 볼트개인 충전기 무료 설치한국전력 충전기 무료아이오닉 q트림 풀옵 2,300만원*2018년코나, 니로 출시로 볼트 인기 급하락최고 인기차는 니로시범 충전기로 인해 무료충전소 많음코나 풀옵션 3,300만원*2019년큰 사건 없이 코나, 니로의 시대*2020년모델3의 보조금 싹쓸이무료충전소도 없어지고 보조금도 줄어서전기차는 가성비라는 말에 의문이 생기기 시작*2021년전기차의 춘추전국시대테슬라의 5990 대란으로 현대기아 신차 출고 연기아이오닉5, ev6 나옴eqa, gv60, i4 6000만원 이하 출시(보조금이 없어서 못삼)전기차 보조금 받아도 5000만원 시대.......*2022년5500 보조금어떤 사건이 일어날지 궁금함",0,https://cafe.naver.com/ca-fe/ArticleRead.nhn?clubid=21771803&page=1&userDisplay=50&inCafeSearch=true&searchBy=0&query=%EC%BD%94%EB%82%98+%ED%99%94%EC%9E%AC&includeAll=&exclude=&include=&exact=&searchdate=2021-07-312022-01-31&media=0&sortBy=date&articleid=733803&referrerAllArticles=true,산I니로l수원,388,2021-12-01 13:07:00,
730708,테슬라 모델 3 미국 펜실베니아에서 11월 23일 충전 중 전기차 화재 발생,"테슬라 모델 3 미국 펜실베니아에서 11월 23일 충전 중 전기차 화재 사고 발생2021년 11월 25일전기차 옹호자들이 화재가 발생할 때마다 가장 먼저 이야기하는 것은 화재가 ICE 차량과 관련된 것보다 더 드문 사건이라는 것입니다. 전기차도 소수이기 때문에 데이터를 꼼꼼히 확인해야 한다. 그런 의미에서 펜실베니아의 화재와 같 은 모든 화재는 주의를 기울일 가치가 있습니다.Tesla Model 3, Maple Gren에서 충전 중 화재 발생,펜실베니아화재는 11월 23일 밤에 발생했습니다. 6ABC가 보도한 바와 같이 Tesla Model 3는 메이플 글렌의 템플 드라이브 1500블록에 있는 주택 진입로에서 충전 중이었습니다. 소방관이 현장에 도착했을 때 화재는 이미 차고를 파괴시킨 상태였습니다. 다행히 집으로 퍼지는 것을 막을 수 있었습니다. 아무도 다치지 않았습니다.6ABC는 화재가 차량 뒤쪽에서 발생했다고 전했습니다. 비디오는 적어도 하나의 폭발을 보여줍니다. 즉, 배터리 팩이 영향을 받았습니다.이 화재는 얼마 전 쉐보레 볼트 EV와 현대 코나 일렉트릭에 영향을 미쳤던 화재를 떠올리게 합니다. 그들 사이에는 두 가지 주요 유사점이 있었습니다. 동일한 배터리 공급업체(LG 에너지 솔루션)의 전기자동차가 충전 중일 때 많은 화재 사건이 시작되었다는 사실이었습니다.이 두 자동차 제조업체는 결함이 있는 배터리 팩을 교체하기 위해 대규모 리콜을 명령했습니다. Tesla에는 다른 공급업체(Panasonic)가 있지만 회사가 유사한 이벤트를 경험하는 것을 막지는 못했습니다. Tesla는 최근 Model S 및 Model X 배터리 팩 문제를 숨기기 위해 OTA 업데이트를 배포한 혐의를 받았습니다. 회사는 그렇게 했다고 고발한 고객들과 합의를 시도하고 있어 조사가 이루어지지 않을 것입니다.비슷한 상황에도 불구하고 충전 중 이러한 화재가 발생한 원인을 설명하기 위해 Tesla에서 조사한 내용은 들어본 적이 없습니다. 테슬라 회사측에 문의해보지만 더 이상 미국에 테슬라 홍보 부서가 없습니다. 중국, 노르웨이 홍보부서는 답변을 하지 않습니다.구글 번역 +Tesla Model 3 Catches Fire While Charging in Pennsylvania - autoevolution",0,https://cafe.naver.com/ca-fe/ArticleRead.nhn?clubid=21771803&page=1&userDisplay=50&inCafeSearch=true&searchBy=0&query=%EC%BD%94%EB%82%98+%ED%99%94%EC%9E%AC&includeAll=&exclude=&include=&exact=&searchdate=2021-07-312022-01-31&media=0&sortBy=date&articleid=730708&referrerAllArticles=true,뭉치I오5모3EV6I설,567,2021-11-26 13:29:00,
729525,코나 배터리교체 했습니다,아예 좀 늦게할까…고민의 고민을 하다가…겨울되기전에 바꿨는데별다르게 체감되는건 없지만덜불안해서 좋은점도 있네요,0,https://cafe.naver.com/ca-fe/ArticleRead.nhn?clubid=21771803&page=1&userDisplay=50&inCafeSearch=true&searchBy=0&query=%EC%BD%94%EB%82%98+%ED%99%94%EC%9E%AC&includeAll=&exclude=&include=&exact=&searchdate=2021-07-312022-01-31&media=0&sortBy=date&articleid=729525&referrerAllArticles=true,코코코I코나I인천,233,2021-11-24 17:26:00,
729364,코나 기변 후 36일차...,총 들어간 충전비용 517원올 10월 기존 1.6 휘발유 코나 처분 하고 전기코나로 넘어왓습니다.살고있는 집에 케빅 완속도 있지만제가 살고 있는 울산은 아직 무충이 존재해서 아직 무충에 맛들려 있습니다 내년 7월쯤 유료전환 예정이라 아직 무충 좀 즐겨타려고 합니다.본가에서 부모님 모시고 주말에 드라이브 다녀오고 톨비할인 및 대구 외가 다녀오는데 왕복 경비 4250(고속도로톨비)밖에 안들어서 기존 부모님 차량으로 갔다오시면 35000원정도 듬얼마안드신다고 좋아하시네요... 휴무일때 제차 빌려가시고 하는거 보니 조만간 차 뺏길듯 싶습니다.ㅜㅜ저는 장점을 꼽는다면기존 휘발유 코나 2륜에 1.6터보 뒤가 토션빔이라 요철구간 넘어갈때 차가 튑니다. 그리고 코너 쎄게 돌경우 언더스티어가 발생 뒷쪽이 가볍다는 느낌이 있엇는데 전기 코나로 바꾸면서 멀티링크에 배터리 무게로 인한 체중 증가의 영향으로 요철구간에도 스무스 합니다 코너 돌때도 언더스티어가 적습니다. 차체 밸런스가 최적인듯 싶습니다.실내공간도 센터패시아 디자인이 넥소 삘이 좀 나고요. 외관 디자인도 코나 전기차가 저는 더 이쁘네용...ㅡ단점을 꼽자면 순정 넥센타야가 그립감 이 별로인 거랑 2열 레그룸 공간이 좁은거 빼곤 괜찮습니다.니로랑 비교시 실내220v꼽는곳이 없음.이건 추후 2000w급 중고인버터 장착하면 될듯.브레이크 라이닝 소음 으로 파란손가서 개선품교체 받음.제차도 아직 메인배터리 리콜 전이라 리콜받고 타야쿠폰도 살아 있어서 중고로 가성비로 코나 괜찮다고 생각합니다.,0,https://cafe.naver.com/ca-fe/ArticleRead.nhn?clubid=21771803&page=1&userDisplay=50&inCafeSearch=true&searchBy=0&query=%EC%BD%94%EB%82%98+%ED%99%94%EC%9E%AC&includeAll=&exclude=&include=&exact=&searchdate=2021-07-312022-01-31&media=0&sortBy=date&articleid=729364&referrerAllArticles=true,야끼아빠l코나l울산,795,2021-11-24 13:50:00,
727231,"GM은 쉐보레 볼트 EV를 80%로 충전 제한하는 새로운 소프트웨어 리콜 업데이트를 실시하고, 실내 주차 제한은 하지 않는다.","GM은 쉐보레 볼트 EV를 80%로 충전 제한하는 새로운 소프트웨어 리콜 업데이트를 실시하고, 실내 주차 제한은 하지 않는다.GM rolls out software update limiting Chevy Bolt EV charge to 80%, but removes parking restrictions- 2021년 11월 19일GM은 배터리 화재 위험으로 인한 리콜의 일환으로 Chevy Bolt EV에 대한 새로운 소프트웨어 업데이트를 출시하기 시작했다고 발표했습니다.전기차 충전 상태를 80%로 제한하지만. 차고 내부에 주차할 수 없는 것과 같은 다른 제한 사항은 제거됩니다.몇 달 동안 충전하는 동안 여러 대가 화재가 난 후 GM이 Bolt EV를 리콜하도록 압력을 가하고 있다고 보고했습니다.모든 것이 현대가 코나 EV에서 LG 배터리로 경험한 것과 유사한 배터리 결함을 지적했습니다. 그러나 한국 자동차 회사가 배터리 교체를 위해 차량을 리콜하는 동안 GM은 몇 달 동안 배터리 교체를 거부했습니다.8월에 GM은 마침내 2017년에서 2022년까지 모든 볼트 EV에 배터리를 교체하겠다고 발표했습니다.당시 보도한 바와 같이 GM은 처음으로 LG에 책임을 묻고 생산 중인 가장 최근의 Bolt EV까지 리콜을 연장했습니다.차량을 리콜하고 배터리 모듈을 교체하는 것 외에도 GM은 차량이 90%를 초과하거나 70마일 미만이 되지 않도록 충전 상태를 제한하기 위해 차량에 새로운 소프트웨어 업데이트를 푸시하기 시작했습니다.또한 소유자에게 밤새 충전하지 말거나 충전 후 내부에 주차하지 말 것을 요구하는 것과 같은 제한이 있었습니다.자동차 제조업체는 물리적 리콜을 통해 작동하는 동안 위험을 제한하기 위해 이러한 제한을 추가했으며, 이는 LG로부터 새 배터리를 받기 때문에 여전히 몇 달이 걸릴 것입니다.오늘 GM은 이러한 제한을 제거하는 새로운 소프트웨어 업데이트를 발표했지만 배터리 팩의 충전 상태를 80%로 제한합니다.자동차 제조업체는 Electrek에 성명을 통해 다음과 같이 말했습니다.“이전에 발표된 리콜에 따라 배터리 모듈 교체가 계속됨에 따라 쉐보레는 교체 배터리 모듈을 아직 받지 못한 2019 Chevrolet Bolt EV 소유자에게 차량의 주차 및 충전 제한을 제거하는 소프트웨어 업데이트 설치를 시작할 것이라고 알렸습니다. 교체 배터리 모듈을 구축하는 동안 이 소프트웨어는 향후 30일 이내에 리콜 대상의 나머지 Bolt EV 및 EUV 소유자가 사용할 수 있을 것으로 예상합니다.""볼트 EV 오너는 새로운 소프트웨어 업데이트를 받기 위해 딜러에게 차를 가져가야 하며, GM은 배터리 팩의 문제를 감지하는 더 나은 진단 도구도 함께 제공된다고 말합니다.https://electrek.co/2021/11/19/gm-software-update-limiting-chevy-bolt-ev-fire-charge-removes-parking-restrictions/?fbclid=IwAR1_ngkpxehy-AaBVgC0uW6XQUKuwX2NCaH4WmjtDw4GxS_2iSjQ6E-dJHw",1,https://cafe.naver.com/ca-fe/ArticleRead.nhn?clubid=21771803&page=1&userDisplay=50&inCafeSearch=true&searchBy=0&query=%EC%BD%94%EB%82%98+%ED%99%94%EC%9E%AC&includeAll=&exclude=&include=&exact=&searchdate=2021-07-312022-01-31&media=0&sortBy=date&articleid=727231&referrerAllArticles=true,뭉치I오5모3EV6I설,821,2021-11-20 21:53:00,
727014,[쌩초보 연습용 중고] 니로/코나 vs 볼트,"* 관련된 주제에 대해 미리 카페내 검색해 보셨습니까? : (네/아니오)* 전기차 종류, 지역 : 미정/경기오산* 질문 내용 :쌩초보 전기차 새거 사기전 연습용으로 중고차 사려고 합니다.니로랑 코나 추천 많이 해주셨는데요,니로는 매물이 없고코나는 화재때문에 불안합니다ㅠ혹시 볼트는 어떤 가요?? 의견 부탁드립니다",0,https://cafe.naver.com/ca-fe/ArticleRead.nhn?clubid=21771803&page=1&userDisplay=50&inCafeSearch=true&searchBy=0&query=%EC%BD%94%EB%82%98+%ED%99%94%EC%9E%AC&includeAll=&exclude=&include=&exact=&searchdate=2021-07-312022-01-31&media=0&sortBy=date&articleid=727014&referrerAllArticles=true,파파팝,887,2021-11-20 12:56:00,
726749,GV70e 가격. 장점?,"곧 GV70e 가격도 알려질텐데요..10월초부터 BEV차량 열공(?) 하면서 여럿 차량을 계약했는데요. 하다보니 전기차 플랫폼기반 4대, 내연플랫폼기반 BEV(i4) 1대 계약 하게 되었네요.당연히 전기차는 전용플랫폼의 장점이 많겠죠.내연플랫폼기반 전기차는 장점이 없을까요?가격을 논외로 하면 내연플랫폼기반 차량의 실내 소재수준이 대체로 높을수 밖에 없습니다.가격대가 비슷한 아5, EV6, 모3를 타보면 가속감은 만족하나 성능외에 인테리어 소재 수준이 높지 않습니다.대체로 3천만원대 중후반 내연차 수준과 동등한것 같은데요.이들 차량을 두번씩 시승하면서 가속감은 만족하지만 시승회수가 늘수록 내장 소재가 자꾸 눈에 들어오네요.내연기반플랫폼 전기차의 가격이 비싸니 당연하다 할수도 있겠습니다.과연 GV70e의 시작 가격은 어느정도 될까요?감으로..7천만원대 초반부터 아닐까요?",0,https://cafe.naver.com/ca-fe/ArticleRead.nhn?clubid=21771803&page=1&userDisplay=50&inCafeSearch=true&searchBy=0&query=%EC%BD%94%EB%82%98+%ED%99%94%EC%9E%AC&includeAll=&exclude=&include=&exact=&searchdate=2021-07-312022-01-31&media=0&sortBy=date&articleid=726749&referrerAllArticles=true,델마I부천,"3,084",2021-11-19 23:24:00,
