id,title,content,likes,url,author,views,created_at,updated_at
665775,신형 쉐보레 볼트EV 판매 무기한 중단,"GM, 배터리 문제로 신형 쉐보레 볼트EV 판매 무기한 중단7만3000여대 리콜에 10억달러 추가 투입미국 최대 자동차 업체인 제너럴모터스(GM)가 화재 위험을 해결하기 위해 10억달러(약 1조1830억원)를 들여 약 7만3000여대의 쉐보레 볼트 EV를 리콜한다고 밝혔다. 볼트 EV는 최근 충전 중 화재가 발생했다.보도에 따르면 GM은 이날 성명을 내고 이번 리콜 대상 차량은 이전에 리콜되지 않은 나머지 차량이 될 것이며, 결함이 있는 배터리 모듈을 새 모듈로 교체할 것이라고 밝혔다.GM 대변인은 또 배터리 문제로 신형 볼트 EV의 판매를 무기한 중단하기로 했다고 덧붙였다.https://n.news.naver.com/article/421/0005553909",2,https://cafe.naver.com/ca-fe/ArticleRead.nhn?clubid=21771803&page=4&userDisplay=50&inCafeSearch=true&searchBy=0&query=%EC%BD%94%EB%82%98+%ED%99%94%EC%9E%AC&includeAll=&exclude=&include=&exact=&searchdate=2021-07-312022-01-31&media=0&sortBy=date&articleid=665775&referrerAllArticles=true,뭉치I오5모3EV6I설,"2,626",2021-08-21 09:30:00,
665688,전기차 계약하신분들 보험료 대략 얼마나 책정되시나요?,"EV6계약전인데아이오닉이랑 비슷하지 않을까하여,,,,테슬라는 수입이라 많이 나오시죠?",0,https://cafe.naver.com/ca-fe/ArticleRead.nhn?clubid=21771803&page=4&userDisplay=50&inCafeSearch=true&searchBy=0&query=%EC%BD%94%EB%82%98+%ED%99%94%EC%9E%AC&includeAll=&exclude=&include=&exact=&searchdate=2021-07-312022-01-31&media=0&sortBy=date&articleid=665688&referrerAllArticles=true,상상미학,"1,166",2021-08-21 04:05:00,
665406,(청와대 신문고 접수 내용)코나 ev 리콜로 인한 밧데리 교체(4)회 후 이에 대한 무책임한 현대차 대응,"아래 청원에 동의하여 주시기 바랍니다.국내 소비자를 물로 취급하는현대차 정신 차려야 합니다.https://www1.president.go.kr/petitions/Temp/Ead6yS코나 ev 전기차 차량 소유자입니다.코나 ev 화재 건으로 리콜을 진행하여 밧데리를 교체하였습니다.그러나 문제는 밧데리를 교체하여도 동일한 결함으로 여러번 밧데리를 교체해야 합니다.네이버 전기차 동호회에 보면 코나 ev 밧데리를 5번 교체한 소유자도 보았습니다.저의 경우 4번째입니다.어제 바로 차량을 정비(밧데리 교체)하여 수령했는데오늘 동일하게 BMS(밧데리 관리시스템) 이상으로 밧데리를 또 교체하라고 합니다.코나ev 차량 자체를 운행할 수 없으며 또한 스트레스도 이만 저만이 아닙니다.현대차 고객서비스 센터측에서는 수리 정비를 해주겠다는 원론적인 말만합니다.그런데 제가 코나 ev밧데리 교체를 앞으로 도대체 몇번을 해야 하나요저뿐만이 아니라 코나 ev 차주들 모두 이런 불편함을 감수 하고 있습니다.차량은 운행이 주 목적이 아닙니까? 그런데 밧데리를 교체하면 얼마 되지 않아 심지어 바로 받자 마자 또 밧데리를 교체하라고 하는데 이러한 무의미한 행위를 언제까지 반복해야 하나요?중요한 것은 밧데리 교체가 수리 완료가 아니라는데 있습니다.밧데리 교체가 아니라 근본적인 문제를 찾아서 소비자들의 불편을 없애야 하는데현대차는 그의 대한 논의도 없습니다.현대차 고객서비스측은 ""죄송합니다. 밧데리 교체해 드리겠습니다. 그것 말고는 저희도 방법이 없네요""라는 말만 반복하고 있습니다.현대차에 책임있는 분이 나서서 이에 대한 적절한 대책을 강구하여야 되는 것 아닌가요?책임없고 힘없는 현대 직원이 무슨 잘못이 있나요?그리고 소비자는 끝도 없이 코나 ev 밧데리를 교체하고 또 교체해야 하나요?이에 대한 적절한 조치를 원합니다.",0,https://cafe.naver.com/ca-fe/ArticleRead.nhn?clubid=21771803&page=4&userDisplay=50&inCafeSearch=true&searchBy=0&query=%EC%BD%94%EB%82%98+%ED%99%94%EC%9E%AC&includeAll=&exclude=&include=&exact=&searchdate=2021-07-312022-01-31&media=0&sortBy=date&articleid=665406&referrerAllArticles=true,영광맨,250,2021-08-20 16:21:00,
662706,차량 화재시 책임은 누가?,"* 관련된 주제에 대해 미리 카페내 검색해 보셨습니까? : (네/아니오)* 전기차 종류, 지역 :* 질문 내용 : 전기차 차량 화재관련 게시물보고 든 생각이 이런 경우 누가 책임지는지요?차량을 소유하며 운전중 발생한 화재이니 보험사가 책임지는 것이 기본일텐데..이런 전기차 화재 같은 경우는 누가봐도 자연발생이거나, 소유주 및 타인의 과실이 아닌걸로 보입니다.물론 제조사도 와서 조사하겠지만, 원인 못찾겠죠...그럼 도대체 누가 책임지나요?현재 책임을 지는 제조사는 있는건지?보상은 화재로 인한 모든 피해에 대해 책임 져 주는지 궁금해 졌습니다...저도 곧 전기차를 구매할려는데..뭐 기름차도 화재 발생하지만..눈에 더 띄는건 전기차 화재네요..",1,https://cafe.naver.com/ca-fe/ArticleRead.nhn?clubid=21771803&page=4&userDisplay=50&inCafeSearch=true&searchBy=0&query=%EC%BD%94%EB%82%98+%ED%99%94%EC%9E%AC&includeAll=&exclude=&include=&exact=&searchdate=2021-07-312022-01-31&media=0&sortBy=date&articleid=662706&referrerAllArticles=true,멀까나I경기,906,2021-08-17 08:42:00,
661814,이번엔 전기버스 화재네요 ㅠㅠ,https://news.v.daum.net/v/20210815060502982,0,https://cafe.naver.com/ca-fe/ArticleRead.nhn?clubid=21771803&page=4&userDisplay=50&inCafeSearch=true&searchBy=0&query=%EC%BD%94%EB%82%98+%ED%99%94%EC%9E%AC&includeAll=&exclude=&include=&exact=&searchdate=2021-07-312022-01-31&media=0&sortBy=date&articleid=661814&referrerAllArticles=true,오티짱l볼트l 남양주,774,2021-08-15 16:25:00,
661531,코나 130km 항속테스트,https://www.youtube.com/watch?v=p81ue47ZMds시속 130km 항속으로 344km 정도 뽑았네요.전기차타시는분들을 아시겠지만 저 속도로 항속하면서 300km 중반대 이상 주행하는건 상당히 어려운데3년전에 나온 내연기관 개조차임에도 세팅은 잘했나봅니다.(최근 나온 차들도 해외리뷰보면 모델3 리프레쉬가 거의 유일하게 달성했습니다)물론 불이나서 다 말짱꽝이지만요 ^^;,1,https://cafe.naver.com/ca-fe/ArticleRead.nhn?clubid=21771803&page=4&userDisplay=50&inCafeSearch=true&searchBy=0&query=%EC%BD%94%EB%82%98+%ED%99%94%EC%9E%AC&includeAll=&exclude=&include=&exact=&searchdate=2021-07-312022-01-31&media=0&sortBy=date&articleid=661531&referrerAllArticles=true,서울I코나I서울,649,2021-08-15 01:25:00,
661528,급속 완속 질문이요,"* 관련된 주제에 대해 미리 카페내 검색해 보셨습니까? : (네)* 전기차 종류, 지역 : 아이오닉5 경기* 질문 내용 : 급속 완속 중에 어떤걸로 많이들 하시나요100%충전하면 배터리에 무리가 간다는 소리가 있어서 급속으로 80%만 충전 하는게 나은지 궁금해세요~~~",0,https://cafe.naver.com/ca-fe/ArticleRead.nhn?clubid=21771803&page=4&userDisplay=50&inCafeSearch=true&searchBy=0&query=%EC%BD%94%EB%82%98+%ED%99%94%EC%9E%AC&includeAll=&exclude=&include=&exact=&searchdate=2021-07-312022-01-31&media=0&sortBy=date&articleid=661528&referrerAllArticles=true,경기l다원빠,113,2021-08-15 01:02:00,
660954,볼트 EV/EUV 55kw 속도?,이번 볼트 두종 모두 가격이 너무 잘나와서 관심있게 보고 있습니다.두개 모두 급속이 55kw까지만 된다고 하는데 그럼 100kw넘는 초고속충전말고 다른 전기차의 일반적인 급속충전과 비슷한 속도인지 헷갈리네요..찾아보니 니로ev와 비슷한 속도 같는데 맞나요?,0,https://cafe.naver.com/ca-fe/ArticleRead.nhn?clubid=21771803&page=4&userDisplay=50&inCafeSearch=true&searchBy=0&query=%EC%BD%94%EB%82%98+%ED%99%94%EC%9E%AC&includeAll=&exclude=&include=&exact=&searchdate=2021-07-312022-01-31&media=0&sortBy=date&articleid=660954&referrerAllArticles=true,곰돌이I서울,981,2021-08-13 21:34:00,
658679,코나 메인배터리교체전후 무게측정해보신분 있을려나요?,이번리콜로 고전압배터리 교체받으신분들중에교체전 공차중량과교체후 공차중량 측정해보신분있을지요?용량을 조금더넣고 만충전압 살짝내려서 다시화재안나게 처리했을수있겠다는 생각에 궁금해져서요,0,https://cafe.naver.com/ca-fe/ArticleRead.nhn?clubid=21771803&page=4&userDisplay=50&inCafeSearch=true&searchBy=0&query=%EC%BD%94%EB%82%98+%ED%99%94%EC%9E%AC&includeAll=&exclude=&include=&exact=&searchdate=2021-07-312022-01-31&media=0&sortBy=date&articleid=658679&referrerAllArticles=true,시지l오닉 코나l대구,164,2021-08-10 16:23:00,
