"post_id","cmt_author","cmt_content","cmt_created_at"
"6827185354","나미에5","제차 모닝 타면. 무슨 생각하실지 궁금하네요.","2024.03.17 15:01"
"6827185354","마카로","나미에5 모닝은 경차인거 감안하긴 할테니...ㅋㅋㅋ코나는 근데 코나일렉이랑 오닉5랑 가격대가 겹치잖아","2024.03.17 15:04"
"6827185354","디올뉴코나","코나 스포츠 모드로만 고속도로 주로 타고 고급유 넣어서 ECU 학습 시켜주면터보렉 미션꿀렁임 다 잡음 제 차 한번 타시믄 답답한거 해소될거임전 연비 포기하고 잘 나가는거에만 신경썼음 ㅋㅋ","2024.03.17 15:06"
"6827185354","마카로","디올뉴코나 쏘카 하루 빌린거라 학습까지 고려하긴 좀 힘들었음 ㅋㅋㅋㅋ그래도 이 크기에 이 연비는 괜찮더라","2024.03.17 15:12"
"6827185354","방투부","이것또한 취향 영역이긴 하죠차가 엔진소리 안나는게 이상하다는 사람들도 많구요","2024.03.17 15:06"
"6827185354","퇴장","4륜전기타다가 k5 k8타도 ㅈㄴ안나감 이게 원래이런가 생각 들던데","2024.03.17 15:06"
"6827185354","디올뉴코나","퇴장 내연기관 T-GDI는 고급유 넣고 학습좀 시켜주면 노말에도 ㅈㄴ 잘나감대신 연비를 포기해야함","2024.03.17 15:07"
"6827185354","퇴장","디올뉴코나 k8은 그래도 뭐 괜찮았는데 k5는 가스차라그런가 좀 심하더라ㅋㅋ","2024.03.17 15:09"
"6827185354","디올뉴코나","퇴장 가스는 터보가 없어서 그럴걸요","2024.03.17 15:09"
"6827185354","Younha","쩜육텁이 아무리 잘 만들었어도 모터는 못 따라감 ㅋㅋㅋ","2024.03.17 15:07"
"6827185354","디올뉴코나","Younha 전기단","2024.03.17 15:38"
"6827185354","Orz#1234","전기차를 탈 환경이 못되지만제주도가서 타본 아이오닉은 참 신기하긴했어요.","2024.03.17 15:39"
"6827185354","갈매기와곰","0-60은 내연기관차가 전기차 못비빔","2024.03.17 16:14"
"6827185354","존귀한님","그랑죠 ㅊㅊ","2024.03.17 19:57"
"6827185354","상당히빠른놈","아니 근데 크기로는 아이오닉5가 준중형이고 그 중에서도 큰편. 게다가 전기차라서 내부 공간도 더 잘뽑음.코나는 크기가 큰 소형이라 어쩔슈 없죠내연기관 소형중에서는 그래도 큰편입니다","2024.03.20 16:06"
"6818933036","토코야미토와","이게 소프트웨어로 고칠수가 있나….","2024.03.14 23:48"
"6818933036","알았","토코야미토와 내가 소프트웨어 무상수리 받고 2주만에 터짐","2024.03.14 23:54"
"6818933036","빡쓰","토코야미토와 소프트웨어가 할 수 있는건 충전 관련 시간이나 기타 다른 수치들만 바꿀 수 있어서","2024.03.15 12:33"
"6818933036","갈비닭","위추..대차는 뭘로 주나요","2024.03.14 23:48"
"6818933036","maero","갈비닭 전기치없어서 그랑죠받음 !","2024.03.14 23:49"
"6818933036","6기통","오우 근데 1년반만에 5만키로타신거?","2024.03.14 23:49"
"6818933036","디올뉴코나","위추","2024.03.14 23:49"
"6818933036","퇴장","ㅠ현기망해라 ㅠ","2024.03.14 23:56"
"6818933036","뭐임뫄","지금 23년식 재고차 사도 똑같나요?","2024.03.14 23:57"
"6818933036","에티오피아게샤","뭐임뫄 판매/미판매차량 전부 출하 중지대상으로 전산등록/관리iccu 소프트웨어 업데이트하고 출하된다네요 업뎃으로 잡힐진 미지수","2024.03.15 00:19"
"6818933036","뭐임뫄","에티오피아게샤 따잇","2024.03.15 10:54"
"6818933036","춤추는어피치","지금까지 흐르는 꼬라지보면 얘네 국토부 빔 맞고 전량 리콜 (하드웨어) 할 각임.","2024.03.15 00:22"
"6818933036","4기통","춤추는어피치 그랬으몀 좋겎다 ㅎㅂ","2024.03.15 02:57"
"6818933036","안전운전제타","아이고..","2024.03.15 00:38"
"6818933036","짱슬라","위추..","2024.03.15 01:01"
"6818933036","민희미니미","신형도 이거 못고친거잖아 ㅋㅋㅋ ㅈ망","2024.03.15 01:18"
"6818933036","뉴슈퍼에어로시티","위추 ㅠㅠ","2024.03.15 07:40"
"6818933036","금일봉2","이런거보면 이번 iccu 소프트웨어 리콜도 다해결할 수 있을지가 의문만약 이번 소프트웨어 리콜로 해결안되면 천문학적인 비용발생할듯","2024.03.15 10:19"
"6816705048","호넷","근데 조치내용이 단순 업데이트던데 잡을수있을지 궁금하네","2024.03.14 11:17"
"6816705048","서정원달린다","호넷 잡을 수 잇겟죠. 아니 꼭 잡아야하죠 ㅋㅋEv6gt때도 iccu업그레이드를 통해서 아5n 퍼포먼스 낼 수 있다고 자신만만 햇자나여","2024.03.14 11:18"
"6816705048","자동세차","이제야 다 잡았나","2024.03.14 11:30"
"6816362595","BlBl","정보추","2024.03.14 08:15"
"6816362595","kFoMr","보정추","2024.03.14 08:16"
"6816362595","김차인검사","저게 소프트웨어 오류였나;;;","2024.03.14 08:21"
"6816362595","바둑눈이","iccu 터지는걸 sw로 막을수있나..","2024.03.14 08:24"
"6816362595","ALEX","싸게 막으려고 안간힘을 쓰네..","2024.03.14 08:35"
"6816362595","al3c9d32","삼각떼 바이펑션 고장 많았는데 무상수리 굿","2024.03.14 08:47"
"6816362595","파월의동전던지기","삼각떼도 저거 해주네 ㅋㅋㅋ","2024.03.14 09:12"
"6816362595","이아오닉5","하이테크나 1급 블핸이냐... 어디로 예약하지","2024.03.14 09:27"
"6816362595","자동세차","애초에 소프트웨어 문제인데 소프트웨어로 해결가능하냐는 뭐냐","2024.03.14 11:58"
"6807462826","KIA-EV4","ㅋㅋ미리 고쳐줘서 좋다고 해야할지, 출고 늦어져서 안좋다고 해야할지 ㅋㅋ","2024.03.11 14:24"
"6807462826","지잡젖문대생","갖고와서 아픈손 가는거보다 낫긴함ㅋㅋㅋ","2024.03.11 14:27"
"6804429713","당근아5죠","금시초문이네요소프트웨어 업데이트하고 출고한다는걸 리콜로 오해한게 아닐지","2024.03.10 18:07"
"6802295064","#송하영","전 걍 무지성 타고 터지면 어쩔 수 없고...차만 안터지면 되지 않을까 싶습니다잉","2024.03.09 23:33"
"6802295064","fab4","3.4만 탔는데 현재까진 ㄱㅊ오히려 주행엔 문제없는 자잘한 문제들땜에 센터 자주가서 빡침","2024.03.09 23:39"
"6802295064","몇일아니구며칠","fab4 헐..? 어떤 자잘한 문제가 있을까요..?!?","2024.03.09 23:40"
"6802295064","fab4","몇일아니구며칠 Tpms 오류잡소리IFS 오류누수(내껀 거의 문제 없는데 일단 조치는 받아놓음)시트 불량등","2024.03.10 00:54"
"6802295064","몇일아니구며칠","fab4 거의 차량 전체문제네요.....ㅠㅠ일단 그래도 장점이 더 많아서.. 타고 계신거죠..!?3.4 타시는동안 혹시 소모품 교환은 많이 하신거 없으시죠!?","2024.03.10 01:55"
"6802295064","fab4","몇일아니구며칠 소모품 교환은 없습니다","2024.03.10 02:29"
"6802295064","보이루다요","아5처럼 많이 바뀌는게 확실해서 최소 페리되면 사는거 추천","2024.03.09 23:54"
"6802295064","손이시려워꽁","개선품 26년에 나올거라는 카더라통신","2024.03.09 23:55"
"6802295064","어깨넓은아조띠","아이오닉6 타뉸중","2024.03.10 00:46"
"6802295064","어깨넓은아조띠","어깨넓은아조띠 날씨 좀 추워지면 전방센서 습기차서 작동안되는거 개화남 진심","2024.03.10 00:46"
"6802295064","몇일아니구며칠","어깨넓은아조띠 비나 눈이 와서 그런게 아니라 춥기만 해도.. 전방센서가 안되나여..?그럼 크루즈 컨트롤도 안되겠네요...?","2024.03.10 01:56"
"6802295064","어깨넓은아조띠","몇일아니구며칠 네 야외주차 하면 아침에 출근할때 센서에러뜸히터틀고 10~15분 운전해야 센서쪽 습기 날아가서 정상작동 되어요오히려 눈이나 비 오는날에는 습기가 센서에 습기가 안차서 작동 잘 됨ㅇㅇ","2024.03.10 02:35"
"6802295064","fab4","어깨넓은아조띠 내껀 안그러는데 그것도 뽑기인듯","2024.03.10 09:01"
"6802295064","어깨넓은아조띠","fab4 하 뽑기실패인가봐요ㅋㅋㅡㅡ","2024.03.10 09:46"
"6802295064","fab4","어깨넓은아조띠 Tpms Ifs 뽑기실패 ㅠIfs는 건들라면 차 안에 다 뜯어야 한다네요담주 예약해놓음","2024.03.10 10:36"
"6802295064","랄티르탈솔","fab4 나도 야외주차 습기 차서 겨울에 히터좀 틀어야하는거 존나빡치더라Tpms ← 없음잡소리 ← 없음IFS 오류 ← 없음누수 ← 센터가볼예정 새는지는 모름시트 불량 ← 모르겠음굿.오닉6 한대 더뽑을까도 고민했었음","2024.03.10 14:50"
"6786189984","이러면멋있어","우리 석박사들이 그럴리가 없쪄!!ㅜㅜ","2024.03.04 21:02"
"6786189984","민희미니미","iccu > 아몰라 시전","2024.03.04 21:06"
"6786189984","지잡젖문대생","주행거리 iccu뺴고 다맞춘ㄷ ㄷ","2024.03.04 21:09"
"6785507767","지잡젖문대생","페리전 차주들 불편한점 다 뽑아다 다 개선한듯ㅋㅋㅋㅋ","2024.03.04 16:50"
"6785507767","디올뉴코나","지잡젖문대생 페리전 오너들 싹다 마루타","2024.03.04 16:51"
"6785507767","지잡젖문대생","디올뉴코나 아아 그말싫..","2024.03.04 16:51"
"6785507767","디올뉴코나","지잡젖문대생 안타까워서 하는말임..게다가 가격도 같아서 2차 고로시...","2024.03.04 16:52"
"6785507767","지잡젖문대생","디올뉴코나 사실 가격은 보조금 줄어들고 없어질거 예상해서동결한거 같긴함 또올리면 내연차랑 차이 또벌어져서 전기차 보급률증가는빠빠이..","2024.03.04 16:53"
"6785507767","그돈씨일렉트릭","몇몇 포인트는 좋아질 줄 알았는데, 좋아 질 수 있는 모든 걸 다 넣어줄지 몰랐고 ㅋㅋ가격 동결할줄은 예상못했음 ㄷㄷ그만큼 iccu가 큰 구멍이라고 보는듯","2024.03.04 16:53"
"6785507767","지잡젖문대생","그돈씨일렉트릭 나만 동결할줄 알았는가 ㄷ 보조금 없어져도 내연차랑 경쟁할려면 지금부터는 동결 타이밍으로 봤는데..","2024.03.04 16:54"
"6785507767","Sitaglip","생각도안하고있었는데 사고싶어짐","2024.03.04 16:56"
"6785507767","무시닝","배터리값 내려간거 생각하면 비싼거아님? 배터리값 내려간거 페리하면서 퉁쳐버리고 가격 안내린듯..","2024.03.04 17:15"
"6785507767","그랜저HG","무시닝 더 내려야 하는거 아닌가 싶은데... 리튬이나 니켈 선물보면 전고점보다 많이 내렸는데;;","2024.03.04 18:24"
"6785507767","지잡젖문대생","무시닝 나도 이생각임 21년도 배터리 가격이랑 지금 가격이랑 차이가;;","2024.03.04 19:38"
"6784438365","그돈씨일렉트릭","iccu 떠도 차 바로 서는거아님 하지만 개선 안됏으면 아쉬울듯","2024.03.04 09:30"
"6784438365","가슴속의폭풍","그돈씨일렉트릭 저거 고속도로 한창 달리고 있는데 뜬다 생각하면 ㄹㅇ 개소름","2024.03.04 09:30"
"6784438365","빨팅어","불안하면 걸러야지","2024.03.04 09:30"
"6784438365","낙타의분노","걍 ccu 구동장치 뜨면 걍 서버리는 bmw맛 보쉴?","2024.03.04 09:31"
"6784438365","세델","낙타의분노 안녕히 가십시오...","2024.03.04 09:34"
"6784438365","순순돌이","베타테스트","2024.03.04 09:46"
