post_id,cmt_content,cmt_author,cmt_created_at
1405900,차박용은 토레스evx가 가성비 킹왕짱인데 토레스evx도 어떤 고질병이 있을지 모르니 쉽게 추천이 어렵더라구요,거북l아이오닉5l시흥,2024-03-01 12:51:00
1405900,낳;;;;,에스I아이오닉5I경기,2024-03-01 13:23:00
1405900,차박은 가성비 좋은 토레스 입니다. 후회 안하실겁니다^^,달려라우주맨,2024-03-01 15:55:00
1405900,아5 비교해보고 저는 토레스 확고 합니다.~ 비교가 안되어서...,시라소니I3송도,2024-03-01 19:21:00
1405900,혹시 어느부분 때문인지요,char ev9 울산,2024-03-01 22:06:00
1405900,아. 안녕하세요? 여기 아이오닉 세일 엄청 한다해서 경기권은 알아보니 롱레인지 프레스티지 전자사이드미러 뺀 풀옵션 했을경우 여전히 토레스보다 600 가까이 비싸게 나옵니다. 전시차 재고차 할인 다 포함해서요. 일단 가격에서 아이오닉 탈락. 곧 페리 아이오닉이라 5100-5200 주고 사면 두고두고 후회할거 뻔해 가격에서 탈락. 차 사이즈에서도 아이오닉은 투싼 크기느낌이고 토레스는 소렌토느낌입니다. 크기에서도 탈락. 승차감도 아이오닉 딱딱 거칠고 토레스 편안한 승차감으로 승차감에서도 탈락. 캠핑용으로 쓸려니 아이오닉 실내에서 앉는거도 불가. 토레스 여유. 공간애서도 탈락. 디자인도 개취로 토레스가 승. 뭐 등등 이유가 너무 많아요. 충격나면 불나는거 겁나고. 급발진 겁나 안전에서도 그렇고. 최근 iccu? 가다 정지하는거도 전 감당 자신없내요. 이유가 많습니다 ㅜ도움 되시길요.,시라소니I3송도,2024-03-01 22:11:00
1405900,토레스 배터리는 괜찮을까요. 중국산 인산철인데….겨울도 걱정돼고 가격은 거의 비슷하게 맞출수 있을거 같아요. 고민입니다,char ev9 울산,2024-03-01 22:32:00
1405900,네. 후기 좋습니다. 그리고 10년 100만키로 보증이라 뭐. 저는 잘 타고 다닐거 같아요.,시라소니I3송도,2024-03-01 22:41:00
1405804,네네 그만사주세요 이제 제발~~~,시리우스lEV9l충북,2024-03-01 08:41:00
1405804,ㅋㅋㅋㅋ역시네요,멀더I볼트EVI경기안양,2024-03-01 10:34:00
1405804,아이오닉 차주신가요?,비플l레이evl경기,2024-03-01 08:43:00
1405804,ICCU몇번 당첨되신건가요? 제조사도 원인을 모르니 고장나는차와 고장안나는 차의 차이도 궁금하내요 중고로 파시는것도 방법입니다 가격 더 떨어지기전에 얼렁 파세요,엘앰오십I아5I파주,2024-03-01 08:44:00
1405804,중고로팔지마세요~살인무기를왜다른사람에게넘깁니까?,특수임무작전l부산,2024-03-01 08:47:00
1405804,너무 표현이 극단적이시내요 남에차 흉보면 기분나쁩니다 팔면 불법인가요? 저렴하게 사서 수리해서 탈사람 있지않을까요? 남의재산을 하라 마라 할일도 아닐듯합니다 같은내용글 연속으로 계속올리시고 너무 불안해하셔서 제안을 드리는겁니다,엘앰오십I아5I파주,2024-03-01 08:56:00
1405804,수리해서탈수있는문젭니까?저게..아무것도모르고사서타다결함때문에사망사고나면책임질겁니까?,특수임무작전l부산,2024-03-01 08:57:00
1405804,예 님말이 다맞습니다,엘앰오십I아5I파주,2024-03-01 09:10:00
1405804,냅둬유 말을 왜섞어요ㅋㅋ 무시가 답입니다,피카츄I아5I부산,2024-03-01 10:52:00
1405804,댁 말대로면 벌써 여러명 사상자가 나왔을텐데... 아직 iccu때문에 사고났다는 말을 들어보질 못했는데..혹시 아시는 사고있으면 알려주시죠,바다창고EV9충남,2024-03-01 10:58:00
1405804,더 싸워야합니다,낭만닥터스IEV69I충남,2024-03-01 08:46:00
1405804,귓등으로도 안 들는거 같아서 답답합니다...,키키I아이오닉6I전남,2024-03-01 08:48:00
1405804,네네 제발 전기차 자체를 사지말아주세요. 아직 시기상조예요.,레드악마l폴스타l부산,2024-03-01 08:52:00
1405804,오죽 답답하셨길래....,김로드l예정l수원,2024-03-01 08:56:00
1405804,자신의 충전 환경과 발생시 상황 현대의 대응 등 내용을 같이 적어주시면 다른 발생하지 않았던 분이라던지 발생했던 분이라던지 도움 될것 같습니다,엘앰오십I아5I파주,2024-03-01 09:16:00
1405804,헌대도 지속 발생하는 트러블에 대해서는 숨길수는 없을것 같습니다 뉴스도 나고 있고요 현대 대응은 미적지근 하지만 많이 발생하는 만큼 발생하는 데이터도 유저 입장에서는 누적 기록할 필요가 있을듯 합니다 그냥 불안합니다 말하면서 기사화 해주세요 하는것과 자료제시하여 이슈화 하는것이 같을까요? 유저입장에서 가장 좋은것은 경험담이라도 모으는 것입니다,엘앰오십I아5I파주,2024-03-01 09:34:00
1405804,"이제 15,000Km 다되어가는데 타고 나갈 때마다 터질까 불안합니다. 한두건도 아니고 거의 매일 터진글이 올라오는데 빈정거리는 댓글들보면 우리나라가 왜 망해가는지 알 수 있죠. 불의는 참아도 나의 불이익은 못참는 사람들.",까망IEV6I김해,2024-03-01 09:40:00
1405804,터질때 어떤상황이었는지 즉시 멈추는지 느려지는지 전조증상 어땠는지 다같이 공유해서 알고 최악의상황을 피할수있는 내용이 더 유익해 보입니다,엘앰오십I아5I파주,2024-03-01 09:52:00
1405804,ㅋㅋㅋ제가 여기서 제목으로 Iccu알면서도 현기차 사는 당신은? 게시물 올렸는제 욕 뒤지게 먹었습니다. 여기 카페에서 현기차 욕하면 큰일나여 ㅋㅋ 특히 iccu로,재현l모델3l경기,2024-03-01 18:25:00
1405804,그래도 더 큰 문제가 생기기전에 현대가 방안을 만들어야하는데 그리고 계속 문제는 제기해야합니다 다들 동참해 주세요,라온l아5쏘부evl서울,2024-03-01 08:59:00
1405804,문제 있는걸 누가 나서서 공론화시키는것에 몇몇댓글들 왜그래요?,삼하Iev6I울산,2024-03-01 09:04:00
1405804,차값 방어 ㅋㅋ,한기훈대구,2024-03-01 09:06:00
1405804,미국에서도 이리하나...,한기훈대구,2024-03-01 09:06:00
1405804,알아서 살살 기어주죠. 벌금이 워낙 쎄니.,까망IEV6I김해,2024-03-01 09:45:00
1405804,차가 가다가 서는 심각한 문제를 별거 아닌것 처럼 얘기하는 사람이 더 웃김.고속도로에서 덤프차량한테 한번 밀려봐야~ ㅡㅡ;,감루비leGV70l경기,2024-03-01 09:19:00
1405804,목숨보다 중고차 가격방어가 중요함. 아니면 그쪽회사 댓글 대응팀이겠죠.,까망IEV6I김해,2024-03-01 09:32:00
1405804,"ev6 7만: iccu 바꾼적 없음 (22년 출고) ev6 gt 4만: iccu 바꾼적 없음 (23년 출고) 아오엔5n 1.5만: iccu 교환 (7,000키로쯤: 11kv 완총 다회 충전 횟수 이력 있고 증상: 완속충전만 안되는 현상 그외 주행은 정상. 경고등x 블루핸즈 스캐너 찍어야 코드 나오는정도)",에그IEV6GTI화성,2024-03-01 09:28:00
1405804,마치 예전에 뉴스까지도 나왔던 아파트 집값 떨어진다고 문제 쉬쉬하던 부류의 사람들이 몇 보이네요 ㅎㅎ 문제는 들추고 알려서 해결할 생각들을 하셔야지 ㅉㅉㅉ,깍지Iix50I대구,2024-03-01 09:37:00
1405804,이게 맞죠. 빨리 해결하고 차값 안정화 시켜야지..,한기훈대구,2024-03-01 09:39:00
1405804,이런 이슈가 쉬쉬 한다는것 자체가 이해 불가능......,김장군ㅣEV6 I 경남,2024-03-01 09:41:00
1405804,gdi 때도 그렇고... 매번 어물쩡 넘어가는 식이니.. 피해는 소비자만...,무나무나뮤I울산,2024-03-01 09:47:00
1405804,Iccu가 큰문제인가요? 사면안되나..,제노비오I서울,2024-03-01 09:52:00
1405804,ICCU터지면 거북이등 뜨다가 더가면 완전 정지 합니다 발생 빈도는 현대에서 미공개 하고 있어 불안감이 큰 상황이내요 현기차 아이오닉5 이후 출시된 차는 모두 대상입니다,엘앰오십I아5I파주,2024-03-01 09:55:00
1405804,"현대 V2L 되는 차들은 ICCU가 고전압배터리,12V배터리 충방전을 제어하다보니 이상 생기면 운행 불가합니다.",출근l아이오닉evl경기,2024-03-01 10:05:00
1405804,뻔히 드러난 사실을 아니라고 하는 사람들도 있네요. 신기하네 ...,느린토끼I예정I울산,2024-03-01 10:00:00
1405804,네 제발 전기차 사지마세요. 시기상조입니다. 사람 죽어나는 수만 늘어날뿐이예요.,흥구민I용인,2024-03-01 10:05:00
1405804,이미 여기 카페에 현기 인터넷대응부서 있어서 보고 들어갑니다. 반나절이면 왠만한 이슈다 본사로 들어갑니다.하청이라 현대랑 직접 상관도 없고요.,테디베어l경기,2024-03-01 10:13:00
1405804,일단 iccu에 대해 현기의 대처는 욕나옵니다 원인을 몰라 리콜을 못하고 있으면 우선조치로 평생보증이나 소비자들을 안심 시킬 수 있는 어떠한 소통이라도 있어야 하는데 없죠다만 iccu 가지고 태클 거는 분들 대부분 고속도로에서 그러면 어쩔거냐 하는게 시속 100키로 아니 그 이상 달리고 있어도 속도가 뭐 1초만에 바로 0으로 떨어지지도 않습니다 그리고 출력이 아예 꺼지는 것도 아닙니다 타력주행으로도 충분히 갓길로 댈 시간적 여유가 있습니다 이거 못하면 운전면허 반납해야죠 고속도로에서 그러면 어쩔거냐를 극단적인 상황이라 상젙을 하는데 애초에 전혀 아닙니다,어l아6l경기,2024-03-01 10:32:00
1405804,진짜 가다가 중간에 서버리니 미칩니다. 중요한 자리 가는 도중에 터져서 길 한복판에서 시간을 얼마나 날렸는지 하,빠샤l아이오닉5l경기,2024-03-01 10:37:00
1405804,제일 화나는거는 외국은 평생보증인데 우리나라에서는 보증기간이 있는게 젤 빡침 ㅋㅋㅋ 요즘 언플은 발생률 1%도 안되고 고장나면 고치면 되니까 별문제 아니다로 댓글 엄청 달고 다님,두두둥실I경기수원,2024-03-01 10:51:00
1405804,여기만이 아니고 각종 차량 카페에 댓글러들 출몰합니다.,산야초I인천,2024-03-01 21:28:00
1405804,헐 외국은 ICCU 평생 보증인가요? 어딘가요 북미? 우리나라도 리콜 못하겠음 평생 무승 보증 해줘야죠 쩝..,진I아5I인천,2024-03-02 13:45:00
1405804,"리콜건인데, 현토부가 쉬쉬~~",샤인농장이사장II경북,2024-03-01 11:01:00
1405804,아으 이번에 계약했는데 이런걸 보니 겁나네요,라따I대구,2024-03-01 11:20:00
1405804,리콜될때까지 이슈 크게 만들어야 소비자들에게 이득이에요,거북l아이오닉5l시흥,2024-03-01 11:41:00
1405804,쉬쉬할 문제가 아니라 크게 만들어서 리콜 받아야죠,곰셋lK9l수원,2024-03-01 14:17:00
1405804,저번에 어떤 회원이 그러더라고요 아이오닉은 동력상실해도 타력주행이 가능한 거라 무상수리고 ix3는 브레이크 밟듯이 서는 거라 리콜이라고ㅋㅋㅋㅋㅋㅋㅋ답답한 사람들입니다 내 차가 문제 있는 차라면 그걸 문제 없는 차로 만들 노력을 해야지 문제 있는 차라고 놀리지마! 라며 문제 삼는 사람들을 공격하는 꼴이라니..,강원IQ4I뚜식,2024-03-01 15:32:00
1405804,iccu문제는 차값 방어. 내차는 안그런데? 무상수리해주잖아? 하루이틀이면 고치는데? 별거아니라는 정신승리 위에분들때문에 문제입니다. 더욱이 이런문제를 알고도 차사라고 부추기죠 현기 알바와 차값방어의 극한이기주의의 콜라보임. 무상수리해주면 뭐함 불안하게 차 타고다녀야하고 사고나면 누가 책임지나요? 시간.돈. 스트레스 현기대응에 대해 죽어라 까도 모자랄 차주들이 오히려 감싸주니 아직 현기가 저모양이지. 국내 현기차 오너들만 호구인증하는거죠. iccu. 그래서 니들이 뭘 어쩔건데? 할인하니 개처럼 또사주네 븅신들 ㅋㅋ 현기차는 이러고 있을듯 대안이 없는것도 아닌데 카페보면 참 답답함,리노IIX1I경남,2024-03-01 20:20:00
1405804,",ㅋㅋㅋㅋㅋㅋ팩트 꽂으시네 ㅋㅋㅋ",재현l모델3l경기,2024-03-01 18:29:00
1405804,동감합니다.,산야초I인천,2024-03-01 21:28:00
1405804,근데 보면 감싸주는 차주들은 없던데요.. 재 주변만 봐도.. 다들 열내고 있습니다. 저도 ICCU로 리콜 못하면 최소한 보증기간이라도 무제한으로 변경하라고 건의 중 입니다. 월요일에 고객센터에 전화 한번 해봐야겠네요.,진I아5I인천,2024-03-02 13:48:00
1405804,정신건강상 차라리 토레스를 사는게 낫다고봄..,애플I모델YI전주,2024-03-01 16:01:00
1405804,이분은 전부터 전기차 끝났다 사지마라 하시더니 되게 극단적이시네,카탈리나ll서울,2024-03-01 16:49:00
1405804,여기 카페에서 현기차 욕하면 진짜 큰일나여 있는욕 없는욕 다들음,재현l모델3l경기,2024-03-01 18:30:00
1405804,"고속도로에서 살살 갓길에 갖다 대면 괜찮다고,그거못하면 면허증 반납하라는둥ㅎㅎ 갓길에 안대봤음 말을마세요 그냥..견인차 올때까지 옆으로 트레일러,덤프트럭들 한뼘차이로 쌩쌩 지나가는데 서있어보세요 어디.. 한겨울에 트렁크열고 가드레일 밖 풀숲에서 애기안고 벌벌 떠는 사람들 보셨으면 적어도 그런소리 못하쥬",국산시민 l 남양주,2024-03-01 18:38:00
1405804,222,깜시lid4l인천,2024-03-02 01:05:00
1405804,대단한 사람들 많네요 ㅎㅎ 온동네 소문이 나야 빨리 처리하고 고치고 정신차리죠,ev6수선화ㅣ경주 울산,2024-03-01 19:49:00
1405804,시기상조. 왜 전기차를 사서고생합니까! 나만 타기도 바쁜데...,코흘리는I강원,2024-03-01 22:18:00
1405804,내 차가 원인도 모르고 언제가 될지도 모르는 동력상실 일어나는 차면 개같이 깔 것 같은데 희안하네... 알아서 무한 보증을 거부하는 행위와 뭐가 다르지... 이건 평생보증 해줘도 모자란 결함인데요...,정신줄I모델YI인천,2024-03-02 02:16:00
1405804,ICCU 불량 이건 팩트 내 차는 아니겠지 안심하지 마시길…,IS김IID4I천안,2024-03-07 23:09:00
1405796,암만 iccu 터져도 바퀴가 빠지는차하고 비교하는거 자체가... 넌센스네요,브루져I경기,2024-03-01 08:57:00
1405796,도요타가 하이브리드에 여전히 집착하는 것은 이유가 다 있겠지요.,여기저기I볼트I대구,2024-03-01 09:35:00
1405796,ICCU는 어쩌자고.........ㅠㅠ,김장군ㅣEV6 I 경남,2024-03-01 09:43:00
1405784,좋은선택일겁니다 안운!,환희I봉고3I대구,2024-03-01 07:35:00
1405784,감사합니다 항상안전운전하세요,동그링IEVXI울산,2024-03-01 07:39:00
1405784,소프트웨어문제보다 iccu결함이 무섭죠 ㅜ~,미제I트론아6ev9I문막,2024-03-01 07:59:00
1405784,ㅠㅠ iccu만이나면 아이오닉이였어는뎁 ㅠㅠ 아쉽네요 ㅠ,동그링IEVXI울산,2024-03-01 13:34:00
1405784,축하드려요 캬캬캬캬캬,산업l토레스evxl청주,2024-03-01 08:07:00
1405784,감사합니다,동그링IEVXI울산,2024-03-01 13:35:00
1405784,트렁크 매트 밑에 공간 본인 취향에 맞게 개조하시던 분들 계시던데 추천드려요! 괜찮아 보이더라구요,망고IEV3l시흥,2024-03-01 08:26:00
1405784,아 감사합니다 참고하겠습니다 ^^,동그링IEVXI울산,2024-03-01 13:35:00
1405784,축하드립니다. 양품 받으시길~~,달려라우주맨,2024-03-01 09:19:00
1405784,감사합니다 양품꼭받고싶습니다.^^,동그링IEVXI울산,2024-03-01 13:36:00
1405784,4-5천되는 차량을 사면서 뽑기운이 좋기를 기도해야 한다는 웃픈현실이네요.,산야초I인천,2024-03-01 21:30:00
1405784,ㅠㅠ 그러니깐요 큰돈이면 큰돈인데.... ㅠㅠ,동그링IEVXI울산,2024-03-01 23:20:00
1405784,품질 좋은 차로 받으시길 ..,라따I대구,2024-03-01 11:22:00
1405784,감사합니다 꼭 양품받고싶습니다 ^^,동그링IEVXI울산,2024-03-01 13:36:00
1405784,,제이제이마밍,2024-03-01 12:24:00
1405784,,동그링IEVXI울산,2024-03-01 13:37:00
1405784,좋은차 구입 축하합니다,진주I토레스EVXl진주,2024-03-01 19:52:00
1405784,감사합니다,동그링IEVXI울산,2024-03-01 23:20:00
1405784,축하드립니다,zenlsm,2024-03-03 22:36:00
1405784,감사합니다 ^^,동그링IEVXI울산,2024-03-04 19:04:00
1405784,축하드려요~!!,이건재밌을지도몰라,2024-04-13 03:04:00
1405768,할인이 120만원이 끝이라면 다른 딜러분 알아보세요,음ㅋII강원,2024-03-01 06:43:00
1405768,혹시라도 다른 딜러분 연락올까 싶어 올려봐요 ㅎㅎ,도쿄상잡이I아산,2024-03-01 06:45:00
1405768,토레스도 견적 받아보세요,경북 온세상,2024-03-01 06:44:00
1405768,토레스는 받았어요 ㅎㅎ 디자인은 토레스가 더 맘에 드는데 왠지 쌍용이미지가 ㅜㅜ,도쿄상잡이I아산,2024-03-01 06:46:00
1405768,그쵸ㅎ,경북 온세상,2024-03-01 06:47:00
1405768,지금 아이오닉5 없어서 못사는건가요? 그래서 대란인가요?,민트레이l충북,2024-03-01 06:47:00
1405768,안팔려서 400~600씩 할인해서 팔아서 그래요,음ㅋII강원,2024-03-01 06:50:00
1405768,감사합니다~~ 지금이 쌀때네요 ㅎㅎ,민트레이l충북,2024-03-01 06:52:00
1405768,잡소리 트렁크 고질병 개선 된게 하나도 없어서 저라면 아이오닉5 안사고 테슬라 갑니다. 샀으니 타고 다니는데 좀 거시기해요,고무님I오닉5I구리,2024-03-01 07:15:00
1405768,모델y 최애지만 실구매가격차이많이 나고 주행거리때문에ㅜㅜ 21년식중고 알아보다가 가격때매 포기했어요 ㅎㅎ,도쿄상잡이I아산,2024-03-01 07:16:00
1405768,아…. ㅠㅠ 가격 테슬라 출고가 안되어서 빠른 오닉5 샀는데 졸라 후회대고 얼마 안 있다 EV9 할인 엄춍 하니까 이건 뭐 ㅋㅋ 좋은 선택하시길 바랍니당 ^^,고무님I오닉5I구리,2024-03-01 07:18:00
1405768,중고는 3천 새차는 4천 정도 예산을 잡았어요. 흉기차는 피하고 싶은데 이상하게 흉기차로 알아보고있네요 ㅋㅋㅋ,도쿄상잡이I아산,2024-03-01 07:26:00
1405768,222저도 테슬라 추천... ICCU 사태랑 아5 회사차도 있는데 실내 내장재 갬성 및 잡소리 생각하면 테슬라가 훨씬 낫더라구요. 그 가격차 나중에 중고가 감가되는거 보면 큰 차 안날거에요.,아돌I미정I거제,2024-03-01 07:58:00
1405768,맞아요. 솔직히 내장재는 테슬라나 현대 오닉시리즈나 별반 차이 없은데 잡소리 특히 트렁크 개짜증납니당. 오닉5도 풀옵 가면 그나마 내장재 쪼끔은 괜찮아 지는데 엔트리급 사면 쫌 그래요.,고무님I오닉5I구리,2024-03-01 08:52:00
1405768,담주에 페리 모델 나온다고 하는데 급한거 아니시면 페리모델도 할인 하지 않을까 싶은데요 불경기라,EV5사고파I미니I분당,2024-03-01 07:19:00
1405768,아 그런가요?ㅎㅎ 아이오닉 페리되도 안이쁠꺼 같긴한데 ㅎㅎ 일단 지켜봐야겠네요,도쿄상잡이I아산,2024-03-01 07:22:00
1405768,네 전기차는 갈수록 좋아지고 저렴해 지지않을끼 생각합니다,EV5사고파I미니I분당,2024-03-01 07:23:00
1405768,그것도 그런데 몇년을 기다릴정도고 느긋한상황은 아니라서요 ㅎㅎ 날씨풀리고 전기차 수요 몰리면 또 비싸게 사야하는 상황올까봐 가능한 빨리사려고요,도쿄상잡이I아산,2024-03-01 07:34:00
1405768,보조금 포함 가격인가요?,여봉선I천안,2024-03-01 07:41:00
1405768,보조금 아산은 1300정돈가봐요 천안도 비슷하지 않을까요,도쿄상잡이I아산,2024-03-01 07:43:00
1405768,할인 보조금다 받고 4000정도요,도쿄상잡이I아산,2024-03-01 07:44:00
1405768,오닉5는 안봤는데 오닉6는 720까지 되더군요,인천아5엉차엉챠,2024-03-01 08:08:00
1405768,아이오닉6 할인 장난아니네요,도쿄상잡이I아산,2024-03-01 09:02:00
1405768,600짜리있는데...,마롱이lG80evl서울,2024-03-01 08:38:00
1405768,할인 600되서 3천중반에 살수있으면 좋겠네요 ㅎㅎ,도쿄상잡이I아산,2024-03-01 08:39:00
1405768,쪽지 보세요 ~,아임첼로lGV60l인천,2024-03-01 08:50:00
1405768,쪽지가 안왓는데 다시ㅜ보내주실수 있을까요,도쿄상잡이I아산,2024-03-01 09:03:00
1405768,저도 쪽지좀 주세요,송도SSGI인천,2024-03-01 09:14:00
1405768,저도 쪽지 부탁드립니다,가을I울산,2024-03-01 10:31:00
1405768,시트 블랙으로 바꿔보시고 외장도 바꿔보면 있을겁니다,희하호호I대구,2024-03-01 09:01:00
1405768,시트는 제가 선택안했어요 그냥 알아서 준 견적이에요 ㅎㅎ,도쿄상잡이I아산,2024-03-01 09:03:00
1405768,좋은정보감사요,홀인원l모델3l의정부,2024-03-01 09:34:00
1405768,정보 감사드립니다. 지역마다 차이가 크네요,용쓰I오닉5I당진,2024-03-01 10:08:00
1405768,지역보조금이 크니 마진더ㅜ남기겠다는 속셈같아요 ㅋㅋ,도쿄상잡이I아산,2024-03-01 10:44:00
1405768,기다리다보면 토레스evx도 할인하지 않을까요??,거북l아이오닉5l시흥,2024-03-01 11:49:00
1405768,그럴까요ㅎㅎ 고민하다 지쳐서 바로 사고싶네요 ㅜㅜ,도쿄상잡이I아산,2024-03-01 11:50:00
1405768,기다리는게 제일 힘들더라구요하지만 언제 프로모션 할인을 할지 모르니....,거북l아이오닉5l시흥,2024-03-01 12:41:00
1405768,감가 많이 된 중고가 젤땡기는데 다들 비싸게 팔아서 제 레이다에는 안들어오네요 ㅜㅜ,도쿄상잡이I아산,2024-03-01 12:41:00
1405768,"저는 이렇게 생각합니다. 할인 한다고 마음에 안드는차를 덥썩? 사기엔, 그 몇천만원도 아깝다는 생각을 해요~그래서 자기의 용도, 쓰임새, 활용성, 디자인에 마음에 드는 차를 선택하는게 최선의 선택이라 생각해요~~",시라소니I3송도,2024-03-01 19:20:00
1405768,그럼 모델y 롱 사야해요 ㅜㅜ너무 멀어지네요 ㅋㅋ,도쿄상잡이I아산,2024-03-01 19:28:00
1405768,그러기엔 너무 몇천만원도 아깝지 않나요? 별로 생각없던차 할인한다고 덥썩?!,시라소니I3송도,2024-03-01 20:54:00
1405768,그것도 그런데 제가 너무 비싼차는 필요없어서여ㅎ,도쿄상잡이I아산,2024-03-01 20:57:00
1405768,재고할인이 안들어간거같네요 딜러가 성의없네요,당근이에요I전주,2024-03-02 03:07:00
1405768,네 새로생긴지 얼마안된 지점이라 많이 땡기고 싶은가보네요 ㅎㅎ,도쿄상잡이I아산,2024-03-02 09:20:00
1405768,아오 중고차가 4300 정도 하던데... 새차 사야되겠네요... 아오~~,인천애,2024-03-02 09:17:00
1405768,그러게요 팔생각이 있는건지 ㅎㅎ,도쿄상잡이I아산,2024-03-02 09:20:00
1405768,"저도 찾는데 할인많이된건 거진 나간거 같더라구요 ;; 아이오닉 5,6 둘중하나 하고싶은데 ㅎㅎ",코나베이I부산,2024-03-03 13:03:00
1405768,정보 감사합니다,홀인원l모델3l의정부,2024-03-23 13:26:00
1405768,안 팔리니 재고 떨이중,miggang2,2024-03-24 12:16:00
1405768,재고 옵션 많은 차량은 있습니다. 잘 찾아주시던데요... 다른 대리점을 한번 가보심이.. 좋을 듯 싶습니다~,타요I니로evI여순광,2024-04-25 12:04:00
1405768,이것저것 잘 찾아보면 재고보단 페리오닉으로 꼭 필요한 옵션만 하다보면 별로 차이가 안나는 경우가 생기기도 합니다~,타요I니로evI여순광,2024-04-25 12:05:00
1405582,별차이 안날듯요 너무차이나면 재고차 줄줄이취소... 페리 연식변경할때 더해줄듯... 월요일이 기다려지네요,넌센스난세스I시흥,2024-02-29 20:34:00
1405582,저도 기다려지는 월요일이네요ㅋㅋ,명탐정l코나I경기,2024-02-29 20:45:00
1405582,어떻게 나올지 궁금하네요 ㅎ,우주아빠IEgv70I서울,2024-02-29 20:35:00
1405582,저도 귱금하네요 재밌는 월요일이 될 것 같슴다,명탐정l코나I경기,2024-02-29 20:45:00
1405582,전 솔직히 딴거보다 iccu 해결한건지 궁금해요 그대로면 진짜 레전드일듯,초가집까마귀,2024-02-29 20:36:00
1405582,그대로일거같아요 ㅠㅠ,명탐정l코나I경기,2024-02-29 20:45:00
1405582,유튜브보다 빠른 소식이군요.,진여I아이오닉5I대구,2024-02-29 20:37:00
1405582,현행 모델 할인받고 살까 했다가...안사길 잘했네요,명탐정l코나I경기,2024-02-29 20:45:00
1405582,오~~~!!!! 이렇게 빨리 페리가 공개되나요? 재고차 사려고 하는데 고민되네요,말시아노ㅣxㅣ경기,2024-02-29 20:44:00
1405582,고민하지말고 바로 페리가셔야죠!!,명탐정l코나I경기,2024-02-29 20:46:00
1405582,이제는 뒤에 와이퍼달고 나올거같은!?,EV5사고파I미니I분당,2024-02-29 20:47:00
1405582,저도 궁금해서 물어보니 달고나온대요!!,명탐정l코나I경기,2024-02-29 20:48:00
1405582,디자인이 예쁘게 바뀌면 좋겠네요,레드악마l폴스타l부산,2024-02-29 20:51:00
1405582,그냥 깔끔하대요ㅋㅋㅋ,명탐정l코나I경기,2024-02-29 22:51:00
1405582,외관에 별차이가 없으면 아무래도 신차보단 재고차 수요가 많을듯요,전남levxl안녕,2024-02-29 20:51:00
1405582,생각보다 변화가 없다고 합니당 ㅋㅋ,명탐정l코나I경기,2024-02-29 22:51:00
1405582,재고차 싸다고 지금 사면 페리후 더 멋진경우 후회할듯요.,시라소니I3송도,2024-02-29 21:06:00
