post_id,cmt_content,cmt_author,cmt_created_at
1463105,ICCU 아5 잘못걸림 열받아 반죽어요.모Y추천해요. 현대차 함 고생해서 가능함 안사요.,임금님I포항,2024-05-22 07:52:00
1463105,테슬라 가세요 ui 엄청 쉬워요,다또I테슬라I서초,2024-05-22 14:12:00
1463087,"잇섭이 올린 유튜브 영상함 보세요, 잇섭이 소비자들이 궁금할 질문 많이 해놨습니다,",시카마루I뉴아오5I설,2024-05-21 17:29:00
1463087,터졌어요 얼마전에 기존아5랑 같은거나고 합니디,다다익선IEv6I의왕,2024-05-21 17:32:00
1463087,터졌다는글 본적없는데 어디셔 보셨을까요?,하하I천안I,2024-05-21 17:40:00
1463087,제지인이 있는데 타이칸 타시는 분인데 형수님 차구요 카페 가입안하신분 입니다,다다익선IEv6I의왕,2024-05-21 17:53:00
1463087,페리아5가 터졌다는말씀이신거죠?이런ㄷㄷㄷ,코코아I아5I포천,2024-05-21 18:09:00
1463087,네,다다익선IEv6I의왕,2024-05-21 18:22:00
1463087,펑 소리와 함께 12v 충전 불가. 얼마 안가서 운행 불가. << 이게 발생 한거에요?,각샘Ii4I동탄,2024-05-21 18:43:00
1463087,허러러럴~~,누미던I부산,2024-05-21 18:53:00
1463087,외제랑 고민하다 ev6로 맘을 잡았는데...,누미던I부산,2024-05-21 18:57:00
1463087,페리관계없구요 완전 다른차가나온다는데 내년 3분기예정이라고 합니다,다다익선IEv6I의왕,2024-05-21 20:31:00
1463087,ㅠ 올해 하반기 보는데... 아쉽네요 너무... 아 iccu.... 벤츠 타기 좀 그래서 기능도 더 좋은 ev6하자 했는데...ㅠ,누미던I부산,2024-05-21 20:48:00
1463087,아니요 그거아니구요 완속충전했다 중간에 뺏었구 다시꼽으니까 클러스터에 자동차모양 느낌표 붉은색떠서 바로 아는 블루가가 진단하니 iccu이상같다해서 주문넣고 했다고 합니다,다다익선IEv6I의왕,2024-05-22 05:46:00
1463087,아 그럼 좀 다른거긴 한가봐요.,각샘Ii4I동탄,2024-05-22 06:01:00
1463087,제품은 21년식 아이오닉5거랑 같은거라고 하던데요,다다익선IEv6I의왕,2024-05-22 06:21:00
1463087,수리한 테크니션이 페리도 이전과 동일한 ICCU를 사용한다고 한거군요.,타이드I서울,2024-05-22 09:27:00
1463087,페리가 터졌다는 말이 어디있나요??추측성 글이던데....,족구IN라인l울산,2024-05-22 09:49:00
1463087,https://m.cafe.naver.com/allfm01/1451597https://m.cafe.naver.com/allfm01/1456059ICCU 문제가 생겨 교체받으신 분이 전에도 계시더라고요.,타이드I서울,2024-05-22 09:54:00
1463087,이 분은 현재 이슈가 되는 현상이랑은 다른 분이시군요,누미던I부산,2024-05-22 11:31:00
1463087,2021년 아5 초기 올라오던 ICCU 증상이 이 증상이었습니다.당시에 이에 대한 별도의 리콜 업데이트가 따로 있었죠.초기 증상의 재현만으로 그칠까 싶었는데 위의 댓글 분을 보니 그 다음 증상도 나온 것 같네요. ㅠㅠ,타이드I서울,2024-05-22 12:07:00
1463073,자세한건 나와봐야겠지만 코나가 EGMP 플랫폼 기반을 이길 수 있을까 싶네요.,디올뉴I코나I성남,2024-05-21 17:15:00
1463073,ev3 롱레인지가 최소 77kwh 될 가능성이 높으니 코나보다는 주행거리가 100km가까이 더 많을 듯 합니다. 지금 항간에 소식이 나온 ev3는 코나 기본형과 비교대상일 듯 합니다. 사용가능배터리 58kwh 정도로요.,떠돌이늑대I니플l경기,2024-05-21 17:38:00
1463073,레이가 편하긴 한데...주행거리 압박이 있어서....가격까지 합리적으로 나와버리면...성급한 레이 출고 피눈물 나겠는데요...ㅠㅠ,지리산타I진주,2024-05-21 17:20:00
1463073,가격이 합리적이지 않을겁니다.레이는 레이고 ev3는 ev3 급이 다르죠!레이는 그에맞는 수요층이 사실 충분함,GV60 레이ev 토리,2024-05-21 18:23:00
1463073,합리적일리가요ㅋㅋ 기아 무시합니까ㅋㅋ,하롱아빠I모델Yl고양,2024-05-21 18:57:00
1463073,레이 에어 트림 스마트 옵션 총 금액 2150에 며칠전 출고했는데...충분히 만족하고 있습니다만... 훨씬 더 좋은 놈이 가격 차이가 크지않게 출고된다면 괜히 짜증이 빡 날 거 같아서..ㅎㅎㅎ,지리산타I레이l진주,2024-05-21 19:11:00
1463073,ㅋㅋㅋㅋㅋㅋㅋㅋ,지리산타I레이l진주,2024-05-21 19:12:00
1463073,"ev3 가격이 저렴하게 나오면 레이ev도 안팔리고 ev6도 안팔리고 ev3만 팔리기 때문에 그돈씩 법칙 적용해서 가격나올꺼에요얼마전 아이오닉5, 6 재고할인받아 3900만원에 구입한 사람이 승자 같아요",거북l아이오닉5l시흥,2024-05-21 21:33:00
1463073,중국에서 하반기에 전기차 들어온다고 하니 들어오기전에 선점 하려고 하는것 같군요...,칠천l아이오닉l용인,2024-05-21 17:27:00
1463073,"ev3, ev4는 400v지원이라고 알고 있습니다.",떠돌이늑대I니플l경기,2024-05-21 17:32:00
1463073,ICCU 문제때문에라도 당분간 400V 많이 채용하지 않을까 싶네요니로만큼은 확실히 고질병이 별로 없어서거의 그대로 플랫폼과 디자인만 바뀌고 이름 바꿔서 내는 느낌이라가격은 니로 수준에서 결정될듯 합니다.,시저I모Y니로EVI광주,2024-05-21 17:53:00
1463073,400v지원에 저건스탠이고 롱레도 있다는 얘기가 있더라고요,띠쁘I아7I군산,2024-05-21 18:16:00
1463073,Ccnc 들어간 니로 정도. 현대 신형코나 정도 생각하는게 딱 일꺼 같습니다. 일단 23일 차가 나와봐야 확실하겠죠.,포르쉐lEv6l부천,2024-05-21 20:23:00
1463073,왜 쏘울 부스터보다 거리가 -30일까요....? 배터리는 비슷한데..,쏘울I쏘부evI서울,2024-05-22 00:55:00
1463073,23일 정확하게 알수있으니~~두고봐야죠,무사신니로evl부산,2024-05-22 05:02:00
1463073,현기차가 급나누기는 잘합니다.싸게 내놓으면 팀킬당하기 때문에 절대로 싸게 안나오죠.아마 니로와 비슷한 가격대로 나올듯 합니다.니로후속이라고 봐도 무방하구요,하이I레이evI경기,2024-05-22 12:05:00
1463073,니로ev 단종 되나요,다그래I니로EVI경북,2024-05-22 18:52:00
1462997,아직 제보사례가 없지않나요?,발리I아이오닉6I서울,2024-05-21 15:21:00
1462997,"국토교통부는 14일 현대차, 기아, 제네시스가 제작·판매한 전기차 16만 9932대를 리콜한다고 밝혔다. 구체적인 대상은 아이오닉 5 7만1517대(생산일 기준 2020년 9월~), 아이오닉 6 2만 1676대(2022년 1월~) , GV60 1만 305대(2021년 3월~), GV70 EV 5296대(2022년 2월~), GV80 EV 5122대(2021년 6월~), EV6 5만 6016대(2021년 7월~) 등이다. 판매된 모델은 물론 판매 전 물량까지 모두 리콜 대상에 이름을 올렸다.레이는 아직 없는 듯 합니다..,",칠천l아이오닉l용인,2024-05-21 15:23:00
1462997,레이는 다른 ICCU가 들어갔나 신기하네요코나 신형도 ICCU 이슈 없는걸로 알아요,마슈마론lEV6l고양,2024-05-21 15:24:00
1462997,이번 리콜 대상에 기아 EV9과 레이EV는 포함되지 않았다. EV9의 경우 앞서 기아가 'V2G 등 신기술에 대응할 수 있도록 신규 개발한 것'이라고 밝힌 만큼 문제 대상이 아닐 수 있다. 그러나 레이EV는 동일한 ICCU 과전류 문제로 2월 무상수리를 발표했음에도 이번 리콜에서 제외됐다. 추후 리콜 여부는 지켜봐야 하겠다.,칠천l아이오닉l용인,2024-05-21 15:24:00
1462997,레이는 iccu 없는거 아닌가요?,날날I니로I김천,2024-05-21 15:29:00
1462997,레이는 외부업체에서 사온 아예 다른 시스템이라 그런거 없습니다.,킹스턴l아이오닉l김해,2024-05-21 15:35:00
1462997,댓글 보니 레이는 그런거 없다니 왠지 안심이네요 ㅎㅎㅎ,예가파,2024-05-21 15:36:00
1462997,레이는 LFP배터리라 ICCU가 아닌 다른장치 아닌가요?,족구IN라인l울산,2024-05-21 15:37:00
1462997,레이도 iccu문제로 무상수리 했었어요 마니안팔려서 눈에 안뛰는것일뿐 근데 왜 리콜제외시킴?,브이엠2I모3gv60l대구,2024-05-21 15:50:00
1462997,실제 하고 소문하고는 많이 달라요,부천아저씨IQ4I경기,2024-05-21 15:51:00
1462997,레이에도 iccu가 있긴한데이슈와는 거리가먼 다른시스템이라고 하더군요,하이I레이evI경기,2024-05-21 15:54:00
1462997,레이 iccu 리콜도 7kw초과 9인가 12kw 완속시 문제 생길 수 있다라서 리콜이였는데 아직 문제된 차를 못 봤습니다,히어로즈I레이evI서울,2024-05-21 15:55:00
1462997,근데 레이 많이 안팔렸나요?,구파랑liX3l인천,2024-05-21 17:07:00
1462997,레이ev인데 다행인건지...,칠구칠구비I레이I경기,2024-05-21 17:20:00
1462997,"레이는 iccu가 없어요.....iccu는 obc, ldc 통합모듈의 명칭이고,보그워너에서 플랫폼 만든 레이는 iccu자체가 없이 따로 obc와 ldc가 있습니다.이전 무상수리는 obc(on board charger) 11kw 완속 충전시 이상 발생가능성에 대한 강제 7kw 다운 소프트웨어 무상수리고, 이상차량에 대한 정보는 거의 없습니다.",키루l모3레이I부산,2024-05-21 19:03:00
1462997,https://cafe.naver.com/allfm01/1463298,타이드I서울,2024-05-22 00:42:00
1462997,"전기차를 사려고하는데 요즘 iccu때문에 현대,기아 전기차는 좀 고민되네요..",자비llgv70e,2024-05-24 11:52:00
1462886,문제 없다고 합니다~~~,정케찹I볼트EVI수원,2024-05-21 13:00:00
1462886,저는 매일 매일 자주 조금씩 합니다 사무실 완속 15a,라온l아5쏘부evl서울,2024-05-21 21:42:00
1462805,EV9 출시하고 2023년까지 HDA3 도입한다고 했었죠...이번에도 말짱 도루묵 예상합니다,마슈마론lEV6l고양,2024-05-21 11:24:00
1462805,아직 그수준이 안될듯,시리우스lEV9l충북,2024-05-21 11:40:00
1462805,뭔 개소리인지. 지금까지 마케팅 용으로 거짓말 계속 남발한걸로도 부족한건가.,보물오름IIX3I서울,2024-05-21 11:50:00
1462805,또 약팔고 있네 ㅋㅋㅋㅋ,맥스큐lEV6l경남,2024-05-21 11:51:00
1462805,얼른 성공해서 다른 차에서 유사기능을 사용할 수 있게 되기를 바래봅니다.,블루제이Model3서울,2024-05-21 12:05:00
1462805,꿈에서 봤을때 라이더 공간 2개 자리에 위장막커버 덮고 돌아다니고 있습니다. 제네90도 열고 다녔는데 ㅠㅠ그말은 즉 올해나 내년까지 안한다는 말입니다. ㅠㅠ EV9 하고 비슷한 자리에 2개 있습니다.,테디베어l경기,2024-05-21 12:51:00
1462805,고속도로 한정이라 가능 하겠지요외제차를 선호하는 사람들이 보기엔 감히 현기가 겠지만....,바다창고EV9충남,2024-05-21 12:55:00
1462805,사고시 책임소재 때문에 지금 기술로는 불가능 합니다. 현기가 사고시 무조건 보상해 준다고 하면 가능할지도요.....,여행IM3L니로I경기,2024-05-21 15:14:00
1462805,오 그렇게 되면 전세계사람 다 현기살듯,우아III캐나다,2024-05-23 11:50:00
1462805,현다이 자율주행 기술 없어요 ㅋㅋ안드로이드처럼 기술 사와야 될꺼에요 그렇게 됩니다,오통오통소통ㅣ오산,2024-05-21 13:09:00
1462805,어그로..,월통lEV9레이EVl대구,2024-05-21 14:30:00
1462805,iccu 도 해결 못햇는데 자율주행을?,브래스l모3l경기,2024-05-21 15:49:00
1462805,ㅋㅋㅋ 어차피 자율주행도 사다가 붙일 계획인데.. 아직 살 곳이 없는데?,초보상어,2024-05-21 16:15:00
1462805,믿지도 않았어여ㅋㅋㅋ,호밀빵I레이evI경기,2024-05-21 17:29:00
1462805,저놈의 3단계는 매번 나온다면서 나오지를 않네요..,아이포 I i4 I 서울,2024-05-21 18:39:00
1462805,,댕댕이1,2024-05-21 20:00:00
1462805,그릇부터가 안 되는데 3단계를 도입할 수 있을지요? ㅋㅋㅋ 벤츠도 힘들어하더만~~,코나EV차주l경기,2024-05-21 22:04:00
1462805,아이오닉9 홍보수단도 좀 새로운걸해야지 차출시할때마다 저런 홍보기사로 어그로만 끌고있네; 그전에 iccu부터 안정화시켜서 많은 국민들이 운행중인 차량부터 안심시키고 지금리 논란을 안정되게하는게 우선아닐까? 팔아먹을 생각만하고있네 ㅠ,율트롱I이트론55I부산,2024-05-21 23:28:00
1462276,아 그렇군요 ㅠㅠ 이것도 뽑기운일까요? 아님 전체적문제일까요?,맨날초보I인천,2024-05-20 16:58:00
1462276,전체적인문제긴한데... 발생확률이 5%정도라고 하더라구요. 뭐 이렇게 말하면 뽑기인가...?,둥둥이ㅣ서울,2024-05-20 17:01:00
1462276,답변감사합니다 ^♡,맨날초보I인천,2024-05-20 17:03:00
1462276,페리오닉5가 리콜이 걸려있다고요??? 24년 2월 생산분까지가 리콜 대상인데요? 페리오닉은 3월에 공개했고요,달려라타요l아5Nl서울,2024-05-20 17:36:00
1462276,nhtsa 보고서 기준 0.62%인데 발생확률 5프로는 또 어디서 나온 이야긴가요,김영웅I오닉5I성남,2024-05-20 17:52:00
1462276,카페에서주워들었...어요....ㅎㅎㅎ,둥둥이ㅣ서울,2024-05-20 17:56:00
1462276,페리 아이오닉5은 리콜 대상 아닙니다.,곰곰Ie208아5I경남,2024-05-20 17:58:00
1462276,아5페도 리콜? 무슨 근거로?,무추I아닉5l경남,2024-05-20 18:11:00
1462276,더뉴아이오닉5는 리콜대상 아닙니다. 허위정보 유포하지 마세요.,이드l530e아5l전주,2024-05-20 18:21:00
1462276,??? 터진 사례 아직 본적도 없고 리콜 대상 차종도 아닙니다. 심지어 2륜 제외 아직 출고조차 안된 차량인데 리콜이 대상이라는 것은…;허위 사실 유포 하시면 곤란합니다.,솔야I경북,2024-05-20 19:03:00
1462276,아~ 아직 4륜 출고가 없나보군요? 딜러가 보조금을 정확히 말하지 못한게 그래선가보네요,맨날초보I인천,2024-05-20 19:09:00
1462276,네 4륜 기다리는 분들 많습니다. 오늘 막 20인치 국고 등록된 참이라 지자체 넘어가고 그러면 더 걸릴거 같습니다.,솔야I경북,2024-05-20 19:10:00
1462276,ㅋㅋㅋ 어이없네,뇌근II울산,2024-05-20 20:36:00
1462276,카드 할인 받는게 카드 만들고 선 할인 받고월 얼마 몇 년 동안 사용해야 하는 구조이니 찬찬히 알아 보셔요.개인적으로 카드 만들지 않는거 추천 드려요.,차크닉IGV60I일산,2024-05-20 17:01:00
1462276,넵 신중히 생각해보겠습니다,맨날초보I인천,2024-05-20 17:05:00
1462276,현카 사용하고 있으면 m포인트 가능합니다.,대박lEV9l화성,2024-05-20 17:01:00
1462276,지금차가 기아 m카드 만들어 m포인트는 조금 있네요. 기아포인트를 활용못해서 아쉽습니다 ㅎㅎ,맨날초보I인천,2024-05-20 17:06:00
1462276,현금으로구입하시면 카드사에서 2%정도 캐시백 해주는게 있어요(카드사마다 매달 조금씩 다름),둥둥이ㅣ서울,2024-05-20 17:02:00
1462276,크윽 현금 완납 능력은 어렵습니다 ㅠㅠ,맨날초보I인천,2024-05-20 17:06:00
1462276,윗분 더뉴아이오닉5가 리콜이라고요? 금시초문인데요. 그리고 아직까진 페리모델이 터진다고 할정도 문제도 없었던걸로 아는데요.,더원l대전,2024-05-20 17:29:00
1462276,저도 더뉴아이오닉5 iccu 리콜이라는건 본게 없는데... 그래서 글도 찾아보니 안나오네요,빈이오닉I니로EVI부산,2024-05-20 17:33:00
1462276,더뉴는 아직 없나보군요. 감사힙니다~,맨날초보I인천,2024-05-20 17:42:00
1462165,"장담할수는 없지만, 화재와는 일단 연관성이 없어 보입니다.",웤옹II수원,2024-05-20 14:35:00
1462097,"리콜로 차량결함을 인정했지만 아직까지 불량충전기 때문이라는 ""그들""",김멜론I모YI서울,2024-05-20 12:34:00
1462097,"과학적이라는 ""ㅇㅌㄱㅇ""",고래밥I경남,2024-05-20 16:09:00
1462097,현기가 흉기로 불리는 이유입니다. 중국산은 값이라 싸지 ㅡㅡ유럽에 엄청 수출하는 것을 보면 현기보다 낫을려나?,카카궁디l인천,2024-05-20 12:40:00
1462097,이번리콜보다 다음리콜이 주용함,아이폰ㅣ아5ㅣ안산,2024-05-20 12:48:00
1462097,누가봐도 하드웨어문제인데 말이죠,jieI아이오닉6I서울,2024-05-20 13:04:00
1462097,누가봐도 하드웨어 문제다 라고 말하기엔 멀정한 차량은 너무나 멀쩡합니다.,PolorBearI아5I춘천,2024-05-20 13:42:00
1462097,누가봐도 하드웨어 문제가 맞습니다 이동식 파큐 2.4kw만 충전하던 제 2년차 아5도 가족들과 이동중 돌맞는것같은 퍽 소리와 함께 고속화도로에서 각종경고등 뜨고 속도 줄어드는 현상 체험하심 정말 시껍합니다 iccu교체했지만 또다시 재발할까 불안불안해하며 탑니다 이미 재발하신분들도 있구요,멋진넘I아5니로I동탄,2024-05-20 14:11:00
1462097,그니깐요. 하드웨어라면 모든 사람이 다 동일하게 터져야 하는데 그게 아니라는거죠. 안터지는 사람은 한번도 안터지는 사람도 있습니다. 같은 하드웨어 인데 누군 터지고 누군 안터지고 하나요..?,PolorBearI아5I춘천,2024-05-20 16:10:00
1462097,갤럭시 노트 터졌을때도 배터리(하드웨어) 문제였지만 실제 터진 건 몇프로 안되요,롤링스톤II아5I수원,2024-05-20 16:33:00
1462097,도요타 급발진 리콜도 하드웨어 이슈였지만 판매된 수백만대의 차량이 모두 급발진을 일으킨게 아니잖아요😅,베멤l모델3l부산,2024-05-20 17:46:00
1462097,하드웨어 결함도 무조건 터지는건 아님니다 데미지가 축적되야하고 부속에따라 미세한 스펙차이로 견디기도 하고 터지기도 하는데 미리확인이 불가하다는게 문제 입니다 그리고 터지면 운행 불가가 될수있어 치명적인 사고를 야기할수 있다는거죠 고속주행중 갑자기 경고등과 함께 속도가 떨어지는데 정말 아찔해요 전 iccu에 대해 인지하고 있었기에 대처했지 그렇지 못하고 사고날수있겠구나 생각되더군요 그리고 길 한복판에서 차퍼져서 렉카올때까지 기다리며 가족들 콜택시 불러 보내고 참 매우 불쾌한 경험 입니다. 이건 무조건 개선된 하드웨어로 전면 교체해야 마땅합니다만..지금 나오는 iccu도 현대 정식답변으로 하드웨어는 개선되지않았다네요 과거와 동일한 하드웨어라네요,멋진넘I아5니로I동탄,2024-05-20 17:52:00
1462097,뭐하는분입니까? 출고차대부분이 터져야 하드웨어리콜이 맞다는 현기소비자입니까?,가람뫼iev6i대구,2024-05-20 18:30:00
1462097,베어님 같은 분이 많으면 현기가 발전할 수 없습니다;;;,제미니I모델Yl광교,2024-05-20 22:35:00
1462097,다른분들이 잘설명하셨지만 iccu 부품이 문제라면 다 터져야한다는 1차원적인 생각을 하실수가있을까요; 제 생각엔 설계미스+소프트웨어 오류가 만난 환상의콜라보라 생각됩니다만 시간이 지나면 밝혀지겠죠~,율트롱I이트론55I부산,2024-05-21 00:10:00
1462097,ev6 모든 차량이 터져야 하드웨어결함임. 암튼 그러함!!!!!!!!!!!!!! 오늘 터진 제 차는 하드웨어 결함이 아니라 뭔가요? ㅋㅋㅋㅋㅋㅋㅋㅋㅋㅋㅋㅋㅋㅋㅋ 개콘이 망한 이유가 여기 있군요. 그럼 왜 현기는 무상으로 렌터카를 줄까요? 하드웨어 결함이 아닌데 왜 하드웨어인 부품을 갈아줄까요? 부품은 하드웨어인데요? ㅋㅋㅋㅋㅋㅋㅋㅋㅋㅋㅋㅋㅋㅋㅋㅋㅋㅋㅋㅋㅋㅋㅋㅋㅋㅋㅋㅋㅋㅋㅋ,바위Iev6I시흥,2024-06-29 22:45:00
1462097,"""신형 EV6 등에는 최신 소프트웨어가 탑재된 ICCU가 장착됐다""고 말했다. 하드웨어는 변함 없다는 말이네요",여행IM3L니로I경기,2024-05-20 13:56:00
1462097,현대 공식 답변으로도 하드웨어는 동일하고 소프트웨어만 개선되었담니다 저도 교체했지만 품번이 동일했고 센터장도 개선판 아니라더군요,멋진넘I아5니로I동탄,2024-05-20 17:53:00
1462097,그럼 이번에 교체를.해도 또 고장이 날씨 있다는 얘기네요 또 고장나면 그땐 정말 가만있지 않을겁니다,파란아이IeGV70I화성,2024-05-21 18:00:00
1462097,게시판 보시면 이미 교체받고 또 터진 회원님들 계셔요 ..ㅜㅜ,멋진넘I아5니로I동탄,2024-05-21 18:07:00
1462097,,테디베어l경기,2024-05-20 15:19:00
1462097,별 탈없이 살 수 있게 만들고 나서 팝시다 제발!,에이스li5l인천,2024-05-20 15:32:00
1462097,맞나요,드라군ㅣ부산,2024-05-20 16:35:00
1462097,내차는 잘타자 입니다 고장없이 잘타자!!,잘타자I아오6I경남,2024-05-20 17:51:00
1462097,전 시스템 멈춤후 한달이 걸려서 오늘 출고를 하네요그런데 또 문제 발생 이번엔 오랫동안 새워두었더니 트렁크 밑에 있는 밧데리 아웃참 함드네요,파란아이IeGV70I화성,2024-05-21 17:59:00
1462097,현기차 현기증나는 대응만 하네요소비자의 불안은 무시하고 21년부터 어떻게 안해주려고 버티다 소비자가 원인 규명하고 하다 문제되니까 뉴스에선 머?? 자발적 리콜?? 그래 그렇다치고.. 또 소프트웨어 무상수리에 이어 또 소프트웨어 리콜?? 리콜 이후에도 제가 본 것만해도 10차례는 넘게 iccu터져 나가는데 아직도 입장 표명이 소프트웨어 문제다?? 기술이 안되면 차라리 급속 충전 없애고 완속으로만 하게 하던지 아니면 iccu 2개로 나눠서 급속 완속을 나누던지 확실한 대책을 줘야 할거 아닌가요??아직도 저 포함 iccu가 언제 터질지 몰라서 주말 여행 갈 때나 출근할 때 딸 친구 태우고 갈 때 터지면 어쩌지라는 불안감과 꿈에서도 터지는 꿈 꾸고 있는데 현기증나는 현대차 대응 참 볼만 합니다리콜도 미국에서 문제 되니까 뒤늦게 리콜한거 아닌가요?? 한국 소비자를 호구로 보는 짓거리는 하지 마시길 바랍니다미국에서 리콜 후 보고서를 1년에 5번 써야하는 걸로 아는데 제대로 써 주시고 미국보다 한국에서 조치를 먼저 할 수 있게 해주십시오,Genesis I EV6 I 구미,2024-05-22 10:39:00
1462035,저렇게 비슷하게 나온다면 저는 개인적으로 디자인 나쁘진 않은 것 같네요 !,피카츄I경남,2024-05-20 11:23:00
1462035,9로 변경한다고는 발표났고 테스트차량이라서 7로 되어 있는거 일수 있겟네요,거북l아이오닉5l시흥,2024-05-20 11:26:00
1462035,아이오닉7으로 이름 최종 확정되었습니다.,천고마비I강원,2024-05-21 13:29:00
1462035,신형 싼타페 몰고 있지만 현대 후면 디자인은.;;;,가우스원l전남,2024-05-20 11:28:00
1462035,전기 suv 는 대형말고 중형이랑 소형 트림이 저렴하게 나왔으면 좋겠는데요. 대형은 너무 비싸서 지원금도 반이고..ㅠ 아이오닉5는 좋은데 먼가 아쉬움이....흠,에스디I안양,2024-05-20 11:31:00
1462035,타호급 대형 suv나 카니발 스타리아급 rv를 염두에 둔듯,울산llID4l서울,2024-05-20 11:32:00
1462035,기아 ev 시리즈는 6를 마지막으로 그 뒤 차량들은 전부 패밀리룩(세로눈)으로 가던데 아이오닉시리즈는 패밀리룩(로보캅)으로 안가고 별도 디자인으로 가려나봐요,둥둥이ㅣ서울,2024-05-20 11:34:00
1462035,3년후 페리 사야지 기다려라,지운l포터오닉5l무안,2024-05-20 11:36:00
1462035,형님들~~ 현대는 뭐다???? 페리임다 페리,은행I아5I제주,2024-05-20 11:41:00
1462035,요즘 현기차 디자인이 구매 욕구를 제거시켜줘서 다행이라고 생각하네요.페리된 아이오닉5에 ICCU 문제 해결된 것 적용되면 그때 검토...,리유즈I예정I경기,2024-05-20 11:55:00
1462035,고급감 화려한옵션 다필요없고 adas와 안전사양 기본이상 적용 크기는 아이오닉9 정도 주행거리는 400정도해서 아이오닉5 가격에 만드는건 불가능한거겠죠? ㅜㅜ 아이오닉9이나 EV9 너무 사고싶은데 가격보면 도저히 못사겠더라고요 ㅜㅜ,서훈I볼트euvI당진,2024-05-20 11:50:00
1462035,앞모습도 별론데 뒷모습은 정말 오잉? 이네요. EV9이 훨씬 나아보입니다.,베카I아6I서울,2024-05-20 17:14:00
1461975,22년부터 누적해도 2500대가 안될겁니다,스카이I ID4 I화성,2024-05-20 10:12:00
1461975,아.. 그정도로... 몇대 안되는군요..,매일맑음,2024-05-20 10:13:00
1461975,"ID4는 디자인 취향이 맞으면 사는 거긴 하죠. 장단점이 확실한.전기차로 보면 말씀하신대로 약점이 있는데, 대신 할인을 좀 많이 해줘서 맞춰진 느낌이네요.ID4 관련 여러 영상을 검색해보시면 대략 어떤 차인지 나오긴합니다.",수IeGV70I경기,2024-05-20 10:25:00
1461975,"전 아니고 남편이 영상을 많이 검색해보고 구입하긴 했는데요.. 폭스바겐 자체가 우리나라에서는 호불호가 있는거 같아요. 전 티구안 오너이기도 하고 워낙 폭스바겐이 주는 운전감을 좋아해서.. 그냥.. 샀어요. 비교는 안하고.. 현명한건지는 모르겠는데... 아이오닉은 디자인 자체가 별로 맘에 안들어서요., 사고 난뒤 안건에 아이오닉도 할인을 엄청 많이 해서 오히려 제 차보다 싸게도 구입가능하더군요.. 현란한 옵션때문에.. 미리.. 알았음 생각이라도 해볼껄 하는 생각은 들어요~",매일맑음ID4천안,2024-05-20 10:30:00
