id,title,content,likes,url,author,views,created_at,updated_at
1527596,스프링클러에 대한 기사가 나오기 시작하네요,"https://n.news.naver.com/article/293/0000057037?sid=101전북 군산시 아파트단지에 거주하는 A씨는 지난 5월 8일 자신이 거주하는 아파트 지하주차장에서 쉐보레 볼트 EV 화재 사고가 났다는 사실을 알게 됐다. A씨는 ""볼트 EV 화재 사고 당시 스프링클러가 초기에 작동돼 차량 앞부문만 탔었다""며 ""다른 차량들은 화재로 인해 타지 않고 연기와 그을음만 유입돼 세차장에 맡기는 걸로 대부분 해결됐다""고 말했다.군산소방서에 따르면 이날 화재 사고는 오후 7시 25분에 발생됐으며 45분만에 진압된 것으로 나타났다. 당시 볼트 EV는 충전중인 상태가 아니었고 화재 사고의 원인이 배터리였던 것으로알려졌다. 아직까지 이 사고에 대한 근본적인 원인은 밝혀지지 않았다.A씨는 ""추후 아파트 입대위 관련 지인에게 들어보니 소방서쪽에서 우리 아파트에 설치된 소방설비를 칭찬했다는 이야기를 들었다""며 아파트 내 화재 사고 확산을 방지할 수 있는 스프링클러의 중요성을 강조했다.이번 청라 전기차 화재로 한국토지주택공사와 한국건설생활환경시험연구원 등이 공동작성한 '지하주차장 내 전기차 화재의 소방시설 적응성 분석을 위한 실규모 소화 시험' 논문이 주목받고 있다. 지난 4월 한국화재소방학회논문지 웹사이트에 게재된 이 논문에서는 ""상부에 설치된 스프링클러의 경우 전기차 배터리 팩의 열폭주 지연 방지는 어려우나 인접 차량간 화재 전이가 이뤄지지 않았다""는 연구 결과가 소개됐다. 만약 주차장 내 하부에 스프링클러가 설치돼 작동될 경우 전기차 배터리팩 열폭주가 50%만 이뤄졌다는 사실도 이 논문을 통해 증명됐다.인천소방본부 관계자는 사고 당시 스프링클러가 제대로 작동됐는지에 대한 물음에 ""확인해보겠다""고 답변했지만 4일 현재까지 스프링클러 작동 여부 등을 파악하지 못한 것으로 나타났다. 국립과학수사연구원(국과수)은 오는 8일 해당 차량에 대한 합동감식을 진행할 예정이다.",6,https://cafe.naver.com/ca-fe/ArticleRead.nhn?clubid=21771803&page=3&userDisplay=50&inCafeSearch=true&searchBy=0&query=%EC%BD%94%EB%82%98+%ED%99%94%EC%9E%AC&includeAll=&exclude=&include=&exact=&searchdate=2024-07-312024-08-30&media=0&sortBy=date&articleid=1527596&referrerAllArticles=true,소멸은신I모델YI인천,"1,699",2024-08-04 17:15:00,
1527376,Catl은 배터리검사절차 어느정도 되나요?,"이번 화재로 배터리qc하는과정 궁금해서 보니 엘지나 삼성 sk 는 배터리 검사를 이중삼중으로 3D ct까지 동원해서 불량품 걸러내더라구요.아마 코나때 한번 경험해보고 특정나라에서 생산된 배터리 분리막이 겹치는현상을그대로 생산, 큰일치른 전적이 있으니 ct까지 찍어서 보관한다고 하네요.제조사가 원하는 검수가 제대로 이뤄지지 않은 배터리가 시중에 돌아다니다 화재로 이어진건 아닌지도 의심스럽더라구요.catl배터리전체가 나쁜게 아니라 불량을 걸러낼 검수시스템이 좀 빡빡하지 않은건 아닌가 싶어요.불량품 하나가 이러한 사태로까지 벌어질지는 아무도 생각 못했을건데 생산도 중요하지만 불량품을 제대로 걸러낼 제조사의 의지가 아무래도 국내산 배터리가 좋지 않을까 생각드네요.catl사의 배터리 검수는 자료를 찾기가 힘들다보니 영 믿음이..",0,https://cafe.naver.com/ca-fe/ArticleRead.nhn?clubid=21771803&page=3&userDisplay=50&inCafeSearch=true&searchBy=0&query=%EC%BD%94%EB%82%98+%ED%99%94%EC%9E%AC&includeAll=&exclude=&include=&exact=&searchdate=2024-07-312024-08-30&media=0&sortBy=date&articleid=1527376&referrerAllArticles=true,피오IId4I당진,465,2024-08-04 12:46:00,
1527319,전기차 화재에 대한 나만의 대응 전략,,48,https://cafe.naver.com/ca-fe/ArticleRead.nhn?clubid=21771803&page=3&userDisplay=50&inCafeSearch=true&searchBy=0&query=%EC%BD%94%EB%82%98+%ED%99%94%EC%9E%AC&includeAll=&exclude=&include=&exact=&searchdate=2024-07-312024-08-30&media=0&sortBy=date&articleid=1527319&referrerAllArticles=true,라온74I미보유I용인,"3,642",2024-08-04 11:50:00,
1527289,"경북도 ""전기차 충전·주차 시설 지상으로""…화재 대응","경북도 ""전기차 충전·주차 시설 지상으로""…화재 대응경찰과 소방 등 유관기관 관계자들이 2일 오전 인천 서구 청라동 아파트 지하주차장에서 불이 난 차량을 감식 하고 있다. 전날 오전 6시15분께 해당 아파트 지하 1층에서 벤츠 전기차에 불이 나 8시간 20분 만에 진화됐다. 이 화재로 지하주차장에 있던 차량 140여대로 피해를 입었다. 소방당국은 40여대는 불에 탔고 100여대는 그을림 피해 등을 입은 것으로 보고 있다. (공동취재) 2024.08.02.photo@newsis.com경북도가 전국적으로 지하 주차장에서 전기차 관련 화재가 잇따르자 전기차 충전·주차 시설을 지상으로 유도하기로 했다.4일 경북도에 따르면 현행법은 전기차 화재 대응을 위한 소방시설 설치와 주차장 안전 기준에 관한 규정이 없어 전기차 관련 화재 사고 위험성이 높아지고 있다.이에 경북도는 지난 5월 '경북도 환경친화적 자동차 보급 촉진 및 이용 활성화에 관한 조례' 개정과 '경북도 환경친화적 자동차 전용주차구역의 화재예방 및 안전시설 지원에 관한 조례'를 제정해 전기차 충전시설과 전용 주차구역 화재로부터 도민의 피해를 예방하고 안전성 강화를 위한 제도적 근거를 마련했다.지난주 발생한 인천 아파트 지하 주차장 전기차 화재처럼 지하 주차장 내 전기차 화재는 대응에 어려움이 크다.경북도의 조례에서는 충전시설과 전용 주차구역의 지상화와 화재 감지시설 등의 설치를 유도해 화재와 2차 피해를 예방하기 위한 권고안을 마련했다.또 전용 주차구역 내 방화벽, 물막이판 등의 안전시설 설치기준과 화재 대응매뉴얼 마련 근거도 규정하고 있다.경북도는 이와 함께 전기자동차 구매자 가운데 도내 거주지 또는 직장에 충전기 설치를 위한 부지를 확보한 도민에게는 완속 충전기 보조금을 지원하되 지상 설치자를 우선하기로 했다.양금희 경북도 경제부지사는 ""전기차 관련 현행법이 정비될 때까지 조례에 근거해 도민 피해 예방에 최선을 다하겠다""고 말했다．https://n.news.naver.com/article/003/0012708031?sid=102",2,https://cafe.naver.com/ca-fe/ArticleRead.nhn?clubid=21771803&page=3&userDisplay=50&inCafeSearch=true&searchBy=0&query=%EC%BD%94%EB%82%98+%ED%99%94%EC%9E%AC&includeAll=&exclude=&include=&exact=&searchdate=2024-07-312024-08-30&media=0&sortBy=date&articleid=1527289&referrerAllArticles=true,톰I서울,"2,748",2024-08-04 11:14:00,
1527284,다들 충전량 설정 얼마나 하시나요?,이번에 구매해서 예상키로수 많이 찍고싶은 마음에 완충 100퍼 하고있었는데요즘 화재문제때문에 90퍼이하로 낮추는게 좋다해서요....다들 몇퍼 충전하시나요?,1,https://cafe.naver.com/ca-fe/ArticleRead.nhn?clubid=21771803&page=3&userDisplay=50&inCafeSearch=true&searchBy=0&query=%EC%BD%94%EB%82%98+%ED%99%94%EC%9E%AC&includeAll=&exclude=&include=&exact=&searchdate=2024-07-312024-08-30&media=0&sortBy=date&articleid=1527284&referrerAllArticles=true,오공I아이오닉5I경기,623,2024-08-04 11:06:00,
1527203,전기차 화재 원인은?,배터리 자체적인 문제라기 보다는 그 배터리를 관리하는 차량의 iccu나 bdu같은 시스템의 문제가 아닌가 싶네요.중국산 배터리라고 욕할게 아니라고 생각들어요.과전류로 불날 배터리라도 bdu만 정상적으로 작동했어도 불 안나지않나요?,0,https://cafe.naver.com/ca-fe/ArticleRead.nhn?clubid=21771803&page=3&userDisplay=50&inCafeSearch=true&searchBy=0&query=%EC%BD%94%EB%82%98+%ED%99%94%EC%9E%AC&includeAll=&exclude=&include=&exact=&searchdate=2024-07-312024-08-30&media=0&sortBy=date&articleid=1527203&referrerAllArticles=true,천안Ii4I랄라,340,2024-08-04 09:20:00,
1527127,전기차 야외주차로 옮길거면,단지내 등록된 전기차 숫자만큼 야외에 지정주차장 확보화재 감시가 필요하므로 경비실 앞쪽 or cctv 쪽 지정실내와 동일하게 주차장에 캐노피 설치배터리 전용 소화기 배치끝,3,https://cafe.naver.com/ca-fe/ArticleRead.nhn?clubid=21771803&page=3&userDisplay=50&inCafeSearch=true&searchBy=0&query=%EC%BD%94%EB%82%98+%ED%99%94%EC%9E%AC&includeAll=&exclude=&include=&exact=&searchdate=2024-07-312024-08-30&media=0&sortBy=date&articleid=1527127&referrerAllArticles=true,막시II군포,781,2024-08-04 07:35:00,
1527121,전기차 드뎌 좋은시절오나요,물론 점점 배터리 안전성은 담보되어야겠지만아직 무서워서 차팔고 계약취소하고 내연차로 가시는분이 많아지길 바래봅니다.더더욱 전기차는 안팔리고 매물 쌓이면 회사도 더욱더 빨리 안정성있는 배터리 내어놓을테고그때까지 매니아층은 조금더 편한 환경에서 전기차 라이프 즐기고.예전 세월호 터졌을때 사람들 배를 안타서 승선요금90프로 덤핑할때 마니 이용했었고.저가항공 도입시기에 이륙시 오작동문제로 할인 무지할때도 이득을 좀 본듯 하고불가 얼마전 코나와bmw한참 불날때도 코나전기차 싸게 매입해서 6개월타고 600만원 웃돈받고 팔았네요.전기차 아직은 때가 아닙니다.안전을 위해 많은 사람이 보조금 전쟁하며 사기에는 시기상조이니 기술이 발전한후 안정화될때 전기차 진입해주세요.실험정신을 가지고 계속 타볼께요.너무 극성으로 민감하게 반응하면순살아파트는 무너질까 잠도 못자고비행기는 추락할까싶어 타지도 못하고자동차는 급발진 때문에 시동도 못걸고여자는 바람필까 싶어 사귀지 못하고우리 그라지맙시다,5,https://cafe.naver.com/ca-fe/ArticleRead.nhn?clubid=21771803&page=3&userDisplay=50&inCafeSearch=true&searchBy=0&query=%EC%BD%94%EB%82%98+%ED%99%94%EC%9E%AC&includeAll=&exclude=&include=&exact=&searchdate=2024-07-312024-08-30&media=0&sortBy=date&articleid=1527121&referrerAllArticles=true,레드I96xI경상도,"5,334",2024-08-04 07:09:00,
1527117,지하주차장 출입금지...,"지하주차장 출입금지 시키면 아파트 공화국인 우리나라에서 전기차 타지 말라는거와 다름 없는거 아닌가요?이번 화재로 여론의 지하 주차금지 공감대가 형성되고 있고, 실재로도 출입금지 시키는 단지가 속속 나오는 상황입니다.충전 및 주차구역을 지상으로 옮기는 조치가 가능한 아파트는 그나마 다행이지만 이마저도 어려운 아파트에 거주하는 전기 차주들은 앞으로 죄인아닌 죄인으로 따가운 눈총을 받는 시기가 오게 되었습니다.화재 예방을 위해 입주민 규약으로 지하 주차금지를 시키는것이 한편으로 이해는 되지만 전기차주의 입장에서 본다면 개인의 이익을 제한하는 무리한 조처라고도 생각됩니다.정부는 친환경 전기차 보급을 독려한 만큼 차주들이 피해보지 않도록 제도적 장치를 마련해줘야 합니다. 제조사들도 차량 결함을 인정하고 화재사고를 보증하는 등의 전향적인 입장을 취해야 합니다.그러지 않는한 전기차 성장은 더 이상 어려울듯 싶습니다.한달 전 전기차 사망사고의 충격이 좀 잊혀질즈음 대형화재라는 악재가 또 터지는군요.",2,https://cafe.naver.com/ca-fe/ArticleRead.nhn?clubid=21771803&page=3&userDisplay=50&inCafeSearch=true&searchBy=0&query=%EC%BD%94%EB%82%98+%ED%99%94%EC%9E%AC&includeAll=&exclude=&include=&exact=&searchdate=2024-07-312024-08-30&media=0&sortBy=date&articleid=1527117&referrerAllArticles=true,우뢰차II광주,"1,301",2024-08-04 07:00:00,
1527103,현대 기아 전기차 배터리,현대 기아 전기차 어느나라 어느기업 배터리인가요?,0,https://cafe.naver.com/ca-fe/ArticleRead.nhn?clubid=21771803&page=3&userDisplay=50&inCafeSearch=true&searchBy=0&query=%EC%BD%94%EB%82%98+%ED%99%94%EC%9E%AC&includeAll=&exclude=&include=&exact=&searchdate=2024-07-312024-08-30&media=0&sortBy=date&articleid=1527103&referrerAllArticles=true,전기IEV6I광명,"1,138",2024-08-04 04:13:00,
1527056,지하 주차장 화재를 떠오른대안,안녕하세요서초구주민 주민 입니다이번 화재는 피해도 커서 뉴스로 계속 보도가 될것 같습니다 과거 화재때도 문뜩 생각이 난게완속 충전기 수동 타이머 있었으면 좋겠어요일부 완속 충전기에서 100프로 충전이 되어도차량과 통신문 제로 계속 충전되는 이슈가 있습니다비록 그 충전 량이 미미하고 일정 속도이지만 0.5kw 계 속 밀어 넣는다면 우리 BMS 친구가 잘 판단하겠지만만약 오류로 차단을 못시킨다면 배터리 화재로 이어질 수 있는 가능성이 있어 보입니다단순히 지하 충전소를 지상으로 올려도 동일하게 화재는 발생될 수 있고 단지 피해 크기만 작아질 뿐이고 꼭 완속 충전기 타이머 수동 온 오프 장치가 있어 전력 100프로 차단이 되는 보안책이 필요해 보이네요전기차화재가 나기전 전력차단중요차량급발진은 동력차단 기어시프트 중립중요급속만 충전하는 사람으로써 주저리주저리 써봤습니다,2,https://cafe.naver.com/ca-fe/ArticleRead.nhn?clubid=21771803&page=3&userDisplay=50&inCafeSearch=true&searchBy=0&query=%EC%BD%94%EB%82%98+%ED%99%94%EC%9E%AC&includeAll=&exclude=&include=&exact=&searchdate=2024-07-312024-08-30&media=0&sortBy=date&articleid=1527056&referrerAllArticles=true,서초구주민l포터l서울,"1,623",2024-08-04 00:38:00,
1527019,여러분이 걱정하시는 것과 별개로 대부분의 사람들은 이번 전기차 화재에 별 관심이 없습니다.,"제가 이틀전부터 회사에서 동료들에게 청라 전기차 화재사건에 대해 얘기해봤는데요,다들 반응이 시큰둥합니다.""그런게 왜 뉴스에 안나왔어?""""그게 사실이면 아파트 입주민들 회의에서 얘기 나오겠는데?""저 천안 살아요. 3년 전에 출장 세차 화재로 핫 했었죠.이유가 뭘까 검색해보니..뉴스에서 전기차 화재 사건은 전면에 나오지 않습니다. 위메프, 티몬 사건과 올림픽 소식이 더 핫 합니다.검색어도 청라 전기차, 혹은 인천 청라 전기차 까지 쳐야 나옵니다.자동차 커뮤니티에서나 이번 사건이 이슈지,여러분이 염려하시는 것 처럼 이번 사안이 그렇게 크지 않습니다.",0,https://cafe.naver.com/ca-fe/ArticleRead.nhn?clubid=21771803&page=3&userDisplay=50&inCafeSearch=true&searchBy=0&query=%EC%BD%94%EB%82%98+%ED%99%94%EC%9E%AC&includeAll=&exclude=&include=&exact=&searchdate=2024-07-312024-08-30&media=0&sortBy=date&articleid=1527019&referrerAllArticles=true,애개I천안,"1,879",2024-08-03 23:29:00,
1526975,[질문] 코나ev 또는 니로ev 중고로 괜찮을까요?,"* 관련된 주제에 대해 미리 카페내 검색해 보셨습니까? : (네/아니오)* 전기차 종류, 지역 :* 질문 내용 :코나ev 또는 니로ev 중고로 고려 중에 있습니다.전기차 완전 초보인 저에게 코나 옛 모델은 화재로 이슈가 되었던 기억 뿐인데 중고 가격을 보니 생각보다 좋더라구요. 니로 하이브리드 모델은 제 아버지가 탔던지라 좋았던 기억이 많은데 ev모델은 어떤지 모르겠습니다.중고로 구입한다면 어떤 모델이 더 좋을까요? 구입시 고려해야할 점도 알려주시면 감사하겠습니다.",0,https://cafe.naver.com/ca-fe/ArticleRead.nhn?clubid=21771803&page=3&userDisplay=50&inCafeSearch=true&searchBy=0&query=%EC%BD%94%EB%82%98+%ED%99%94%EC%9E%AC&includeAll=&exclude=&include=&exact=&searchdate=2024-07-312024-08-30&media=0&sortBy=date&articleid=1526975&referrerAllArticles=true,앵뮷떼I울산,363,2024-08-03 22:54:00,
1526895,고민이 깊네요...,아... 출퇴근 차량 필요해서 코나 가솔린 풀옵3200에 샀는데..아이디4 대란에 나도모르게 예약해서 고민중입니다코나도 하브나 전기차 사고 싶었지만4-500만원이 막상 더 쓰려면 넘 비싸게 느껴져서포기했는데 ID.4는 좀처럼 포기가 안되네요ev3보다 싼데 내부도 더 크고 차 하체가 좋은것 같네요경기라 3880만원인데 ... 코나 팔면 3천 정도 받을텐데취득록세까지하면거의 천만원 더 들여서 바꾸는건데돈생각하니 안하는게맞는것 같네요.근데 차자체는 코나가솔린과 비교 불가 같아요,0,https://cafe.naver.com/ca-fe/ArticleRead.nhn?clubid=21771803&page=3&userDisplay=50&inCafeSearch=true&searchBy=0&query=%EC%BD%94%EB%82%98+%ED%99%94%EC%9E%AC&includeAll=&exclude=&include=&exact=&searchdate=2024-07-312024-08-30&media=0&sortBy=date&articleid=1526895&referrerAllArticles=true,캐퍼나I경기,966,2024-08-03 21:35:00,
1526885,K배터리 2020이후 주차중 화재 없다,https://n.news.naver.com/article/008/0005072455?lfrom=cafe중국껀 걸러내자 중국꺼 쓰고 싶나,2,https://cafe.naver.com/ca-fe/ArticleRead.nhn?clubid=21771803&page=3&userDisplay=50&inCafeSearch=true&searchBy=0&query=%EC%BD%94%EB%82%98+%ED%99%94%EC%9E%AC&includeAll=&exclude=&include=&exact=&searchdate=2024-07-312024-08-30&media=0&sortBy=date&articleid=1526885&referrerAllArticles=true,조문객임,914,2024-08-03 21:25:00,
1526845,지금 ㅇㅌㄱㅇ에서 화재관련 라이브하네요,"오토기어의 호불호를 떠나서, 자동차 유튜버 가운데 공학자랄 분이 미생님이나 이분들 등 몆 분 안되니 잘 들어보고 참고하려 합니다",1,https://cafe.naver.com/ca-fe/ArticleRead.nhn?clubid=21771803&page=3&userDisplay=50&inCafeSearch=true&searchBy=0&query=%EC%BD%94%EB%82%98+%ED%99%94%EC%9E%AC&includeAll=&exclude=&include=&exact=&searchdate=2024-07-312024-08-30&media=0&sortBy=date&articleid=1526845&referrerAllArticles=true,셀레lGV60l김포,"2,964",2024-08-03 20:21:00,
1526817,NCM 열폭주? LFP도 불납니다,"근데 LFP는 NCM보다 열폭주 온도가 1000도 이상 낮고 열폭주 확률도 NCM 대비 훨씬 낮죠.이건 배터리의 재료로 들어가는 니켈의 함유량에 따른 어쩔 수 없는 팩트에 기반한 기정사실입니다.특히 니켈의 함유량이 올라갈수록 배터리의 열폭주 위험성은 더더욱 올라갑니다.NCM 배터리 중 811배터리, 9반반 배터리가 있다면 여기 세자리 숫자 중 첫째자리가 니켈의 함유 비율(80%, 90%)근데 NCM 신봉론자들은 팔랑귀라 주식이 2차전지주에 물렸는지 자기 차가 NCM이라 처절한 변호를 해야 하는지""LFP도 불난다! 국내 NCM은 열폭주가 없다!"" 는 식으로 마치 국내 기업의 NCM 배터리는 열폭주가 없다는 식으로 보이게 선동 중ㅋㅋㅋ연금술사가 아닌 이상 원재료의 특성을 거스를 수는 없습니다 하이니켈 NCM은 그냥 위험성도 HIGH 한거임.수류탄도 터지고 핵폭탄도 터지니까 모든 폭탄이 비슷한 급의 폭탄이라고 생각하는 사람이 이 세상에 있나요?내연차가 수류탄이라면 LFP가 원자(핵분열폭탄)폭탄 정도고 NCM은 수소폭탄(핵융합폭탄)인 겁니다.",3,https://cafe.naver.com/ca-fe/ArticleRead.nhn?clubid=21771803&page=3&userDisplay=50&inCafeSearch=true&searchBy=0&query=%EC%BD%94%EB%82%98+%ED%99%94%EC%9E%AC&includeAll=&exclude=&include=&exact=&searchdate=2024-07-312024-08-30&media=0&sortBy=date&articleid=1526817&referrerAllArticles=true,플러스안양,"2,474",2024-08-03 19:45:00,
1526784,진짜 지하주차장 출입금지 시킨 아파트가있나요??,타카페보면 이런글이있는데저는 전기차 안타는데도 상식적으로 이해가 안가는데;;,0,https://cafe.naver.com/ca-fe/ArticleRead.nhn?clubid=21771803&page=3&userDisplay=50&inCafeSearch=true&searchBy=0&query=%EC%BD%94%EB%82%98+%ED%99%94%EC%9E%AC&includeAll=&exclude=&include=&exact=&searchdate=2024-07-312024-08-30&media=0&sortBy=date&articleid=1526784&referrerAllArticles=true,잽이 I 파주운정,"1,429",2024-08-03 19:06:00,
1526774,배터리 제조사 차이?,"완성차업체는 부품사에서 제공하는대로 그냥쓰나요?소비자가 완성차업체도 아니고 부품사에 대해 이야기하는게 신기하네요.보통 제품 프로젝트가 시작되면,완성업체에서 설계 방향과 스펙을 부품사에 전달하고,성능과 신뢰성, 안정성 등의 테스트 결과를 통해서 DV, PV, MP 순으로 검증하고 양산에 들어갑니다.그래서 부품사는 완성업체에서 요구하는 설계에 맞취서 스펙과 안정성만 확보시켜서 개발하여 납품하는 구조입니다.그러면 납품후 완성업체의 제품에서 문제가 발생했다면, 완성업체에서 설계 누락이나 부품에 대한 검증이 부족했던것이라 1차로 완성업체에 책임이 있습니다.완성업체도 개발당시 스펙이나 관리 항목이 아니었던 것들에 대해서는 문제가 생겨도 부품사에 강하게 이슈제기하지는 못합니다.자동차업계는 이런 화재가 생기면, 설계결함이나 부품사 관리 못 했던걸 두고 부품사 탓을 하나요?전기차를 타면서, 유독 부품사 탓을 하는 소비자들이 계셔서 이유가 궁금하네요.삼성/엘지 냉장고 쓰다가 고장났다고, 컴프레셔 업체 탓하지는 않자나요. 삼성/엘지 탓을하지어떤부품을 갖다 쓰던 그 결정도완성업체인데말이죠그리고 중국에서 만든다고 다 같은게 아니고제조사가 어디고, QC기준을 어떻게 하느냐에 따라 천지차이입니다.경험상 한국에서 만들어도 제조사 QC기준이 불명확하거나 기준이 낮으면 품질이 떨어지죠.중국에서 만들었으니 품질이 떨어질거다 리는 일률적이인 생각은 안하시는게, 애플이 가장 좋은 예시죠이상한 방향으로몰아가는글들이 가끔 보이는데요. 항상 다른 사람이 하는 말에 대해서, 비판적으로 접근하세요.유튜버를 볼때도 말하는 근거가 충분한지, 저 사람이 이전에 어떤 일을 했었는지, 학력은 어떤지도 한번 같이 보시구요.",2,https://cafe.naver.com/ca-fe/ArticleRead.nhn?clubid=21771803&page=3&userDisplay=50&inCafeSearch=true&searchBy=0&query=%EC%BD%94%EB%82%98+%ED%99%94%EC%9E%AC&includeAll=&exclude=&include=&exact=&searchdate=2024-07-312024-08-30&media=0&sortBy=date&articleid=1526774&referrerAllArticles=true,테테I모3YI인천,408,2024-08-03 18:52:00,
1526723,이번 벤츠 화재는,충전소가 아닌 일반 주차구역에서 일어난 건 가요? (충전기에 물려놓고 충전이 끝난 상태가 아니라)둘 다 무섭지만 그냥 주차중에 스물스물 화재가 일어날 수 있다는 게 믿어지지가 않네요. 이번 사고는 원인 규명 정말 정확하게 해야 할 듯요.연비 전비 이런 거 별 관심 없고7년차 주행거리 아직 5만 후반대인데몇 년 전부터 구형코나 흰색이 느무 지겨워서신형 전기차들 눈여겨 보고 있던 차에이번 사고 접하니생각치도 못하게 가솔린차 쳐다보게 됩니다 😱,2,https://cafe.naver.com/ca-fe/ArticleRead.nhn?clubid=21771803&page=3&userDisplay=50&inCafeSearch=true&searchBy=0&query=%EC%BD%94%EB%82%98+%ED%99%94%EC%9E%AC&includeAll=&exclude=&include=&exact=&searchdate=2024-07-312024-08-30&media=0&sortBy=date&articleid=1526723&referrerAllArticles=true,이안I코나l양주,"1,164",2024-08-03 17:59:00,
1526658,지하주차장 화재가 100억 보상보다 더 큰 문제,"전기차 화재로1000도 넘는 발열로 인해기둥골조, 천장골조 전부 녹아내려서아파트 붕괴 위험이 있다고 합니다.벤츠가 원가절감 하려고 중국산 배터리 썼다가나락가네요 ㅎㄷㄷ",12,https://cafe.naver.com/ca-fe/ArticleRead.nhn?clubid=21771803&page=3&userDisplay=50&inCafeSearch=true&searchBy=0&query=%EC%BD%94%EB%82%98+%ED%99%94%EC%9E%AC&includeAll=&exclude=&include=&exact=&searchdate=2024-07-312024-08-30&media=0&sortBy=date&articleid=1526658&referrerAllArticles=true,땅부I모3I충남,3.2만,2024-08-03 16:59:00,
1526657,[질문] 코나 일렉트릭(중고)와 캐스퍼 일렉트릭 중 고민입니다...,코나랑 캐스퍼 가격대가 겹쳐서 알아보다가 고민입니다..캐스퍼가 주행거리 400정도만 되면 고민없겠는데 315km라 좀 짧은거 같습니다...주행거리 400넘는 코나 vs 그래도 신차에 첨단기능 탑재한 캐스퍼둘중뭐가 나을까요..?,0,https://cafe.naver.com/ca-fe/ArticleRead.nhn?clubid=21771803&page=3&userDisplay=50&inCafeSearch=true&searchBy=0&query=%EC%BD%94%EB%82%98+%ED%99%94%EC%9E%AC&includeAll=&exclude=&include=&exact=&searchdate=2024-07-312024-08-30&media=0&sortBy=date&articleid=1526657&referrerAllArticles=true,프로통학러I미정I구미,382,2024-08-03 16:59:00,
