id,title,content,likes,url,author,views,created_at,updated_at
1529112,파라시스는 중국기업일까?,"갑자기 파라시스 이슈가 나오는 바람에 게시판이 또 핫해져서 파라시스에 대해 아는 대로 좀 얘기를 해보려 합니다.파라시스는 예전으로 거슬러 올라가 2002년도에 재료공학 박사인 dr. keith kepler와 dr. yu wang이 캘리포니아 실리콘밸리에서 공동으로 창업하여 탄생한 기업입니다.그들은 회사 이름을 farasis energy라고 지었고, 주요업무는 배터리 개발입니다.그 당시 서양에서는 전고체 개발이 주류였고, 일본에서는 리튬이온 배터리 개발이 주류였는데, 파라시스는 일본 타입의 삼원계에 주력했습니다.일반 중국회사들은 각형이 주력했지만, 파라시스는 파우치형 삼원계에 주력했고, 현재는 파우치형 삼원계와, 나트륨 이온 배터리, 반고체로 포트폴리오를 확장했습니다.파라시스의 오너 dr.keith kepler오른쪽이 공동 오너 yu wang, 왼쪽은 벤츠의 마르쿠스 셰퍼입니다. 2019년에 공동개발 협약을 맺지요.어쨋든 그들은 2009년에 중국시장 공략과 양산을 위해 중국에 자회사인 푸넝커지 (farasis energy asia pacific limited) 를 설립합니다.R&D센터는 미국 실리콘 밸리, 중국 깐저우, 독일 슈튜트가르트에 위치하며, 생산은 중국 광저우에서 하고 있습니다.중국 깐저우 지사의 자본 지배구조를 보면미국본사인 farasis energy가 최대주주고li shufu는 지리 회장, 그리고 벤츠 나머지는 거의 증권사, 사모펀드 이런것들 입니다. 펀드사 지분이 최대주주를 넘네요.요걸 중국회사라 봐야할지, 미국회사로 봐야할지는 애매합니다. 쿠팡 같은 느낌이 드네요. 쿠팡 본사도 미국이고, 최대주주도 미국자본이지만 한국에서 가장 왕성하게 사업하고 있는 것처럼 말입니다. 물론 그럼에도 쿠팡은 미국회사이긴 합니다.",4,https://cafe.naver.com/ca-fe/ArticleRead.nhn?clubid=21771803&page=3&userDisplay=50&inCafeSearch=true&searchBy=0&query=%EC%BD%94%EB%82%98+%ED%99%94%EC%9E%AC&includeAll=&exclude=&include=&exact=&searchdate=2024-07-312024-08-30&media=0&sortBy=date&articleid=1529112&referrerAllArticles=true,디오니ㅣ모3ㅣ서울,"1,586",2024-08-05 22:45:00,
1529049,전기차 화재,보통 국내에서 많이 화재 발생하는 차량은 어떤종류가 있을까요,0,https://cafe.naver.com/ca-fe/ArticleRead.nhn?clubid=21771803&page=3&userDisplay=50&inCafeSearch=true&searchBy=0&query=%EC%BD%94%EB%82%98+%ED%99%94%EC%9E%AC&includeAll=&exclude=&include=&exact=&searchdate=2024-07-312024-08-30&media=0&sortBy=date&articleid=1529049&referrerAllArticles=true,I3I대전I뿌,321,2024-08-05 21:58:00,
1529044,벤츠 전기차화재 벤츠코리아사에 대응?벤츠움직이는폭탄!,무대응? ? 미친거아닌가? 초대형사고낫는데 바로 리콜하던지 ? 아님 긴급 공지라도 내던지? 고객이 무슨 통구이 마루타인가?? 그져 자기들 이득생각해서 발뺌할 궁리 중인듯 ㅜㅜ지하주차장 화재동영상보면진짜 충격적이네요 무슨 대피할?시간자체를 안주고 바로 대 폭발 !!! 벤츠eqe가 아니라 ᆢ 움직이는 폭팔물!!? 입니다https://youtu.be/agkN-J0aKH0?si=SRM6_RdzHVRzeO71,0,https://cafe.naver.com/ca-fe/ArticleRead.nhn?clubid=21771803&page=3&userDisplay=50&inCafeSearch=true&searchBy=0&query=%EC%BD%94%EB%82%98+%ED%99%94%EC%9E%AC&includeAll=&exclude=&include=&exact=&searchdate=2024-07-312024-08-30&media=0&sortBy=date&articleid=1529044&referrerAllArticles=true,ev6아빠 전북,"1,454",2024-08-05 21:56:00,
1528973,지금까지 화재가 났던 전기차 종류를 알 수 있을까요?,"지금까지 화재가 났던 전기차 종류를 알 수 있을까요?DS3-E텐스 차량을 소유중인데, 제 차는 어떤 배터리를 사용하고 있는건가요?<화재가 났던 배터리인지? 궁금해서요>",1,https://cafe.naver.com/ca-fe/ArticleRead.nhn?clubid=21771803&page=3&userDisplay=50&inCafeSearch=true&searchBy=0&query=%EC%BD%94%EB%82%98+%ED%99%94%EC%9E%AC&includeAll=&exclude=&include=&exact=&searchdate=2024-07-312024-08-30&media=0&sortBy=date&articleid=1528973&referrerAllArticles=true,철수IDS3e텐스I남양주,714,2024-08-05 21:08:00,
1528934,전기차 벤츠는 이미 신뢰 잃은듯 합니다.,이번건으로 국내소비자 신뢰잃어버렸네요.한번잃은 신뢰는 회복하기 힘든데재고떨이 이후로 당분간 물량 안가져올거 같습니다.,1,https://cafe.naver.com/ca-fe/ArticleRead.nhn?clubid=21771803&page=3&userDisplay=50&inCafeSearch=true&searchBy=0&query=%EC%BD%94%EB%82%98+%ED%99%94%EC%9E%AC&includeAll=&exclude=&include=&exact=&searchdate=2024-07-312024-08-30&media=0&sortBy=date&articleid=1528934&referrerAllArticles=true,상한가l니로l전국,"3,596",2024-08-05 20:28:00,
1528621,모든 문제에대해서 벤츠가 보증하기로 했어요,모든 문제에 대해서 벤츠가 보증하기로 했습니다 이미 뉴스에 박제되어있었네요https://n.news.naver.com/mnews/article/020/0003423375?sid=103,1,https://cafe.naver.com/ca-fe/ArticleRead.nhn?clubid=21771803&page=3&userDisplay=50&inCafeSearch=true&searchBy=0&query=%EC%BD%94%EB%82%98+%ED%99%94%EC%9E%AC&includeAll=&exclude=&include=&exact=&searchdate=2024-07-312024-08-30&media=0&sortBy=date&articleid=1528621&referrerAllArticles=true,샤인IEV6I인천,"1,489",2024-08-05 15:35:00,
1528454,[신형코나EV출고] 209호 코나 출고,지난달에 받은 제 코나입니다!!약 2주 되었는데요..내연기관차와는 또다른 운전의 즐거움이 있네요-모쪼록 화재만 없었으면 하는 바램입니다!!,0,https://cafe.naver.com/ca-fe/ArticleRead.nhn?clubid=21771803&page=3&userDisplay=50&inCafeSearch=true&searchBy=0&query=%EC%BD%94%EB%82%98+%ED%99%94%EC%9E%AC&includeAll=&exclude=&include=&exact=&searchdate=2024-07-312024-08-30&media=0&sortBy=date&articleid=1528454&referrerAllArticles=true,부름이I코나evI경북,172,2024-08-05 13:28:00,
1528361,벤츠는 적어도 현기차보다 화재 보상을 더하겠죠,과거 코나에 탑재된 ncm622 배터리 화재로리콜 결정약 1.4조 현대차 3 엔솔 7 비율로각회사 충당금으로 보상및 리콜진행했죠덕분에 분기 적자 반기적자??하여우리나라 수입차 점유율1위전세계 e클 수출국 1위인벤츠 와 catl프리미엄 브랜드답게적어도 현기차 엔솔보다훨씬 나은 고객응대를 보여줘야할겁니다지켜보시죠,0,https://cafe.naver.com/ca-fe/ArticleRead.nhn?clubid=21771803&page=3&userDisplay=50&inCafeSearch=true&searchBy=0&query=%EC%BD%94%EB%82%98+%ED%99%94%EC%9E%AC&includeAll=&exclude=&include=&exact=&searchdate=2024-07-312024-08-30&media=0&sortBy=date&articleid=1528361&referrerAllArticles=true,순천사랑I닉5모Yl순천,"3,869",2024-08-05 12:11:00,
1528226,와이프 설득하기...,전기차를 사고 싶다고하니 지금은 시기상조라고 합니다큰차인 ev9을 원하지만 전기차라면 egv70도 괜찮을거같다고 설득하는 중입니다와이프 설득하게 전기차가 좋다고 해주세요~~~~,0,https://cafe.naver.com/ca-fe/ArticleRead.nhn?clubid=21771803&page=3&userDisplay=50&inCafeSearch=true&searchBy=0&query=%EC%BD%94%EB%82%98+%ED%99%94%EC%9E%AC&includeAll=&exclude=&include=&exact=&searchdate=2024-07-312024-08-30&media=0&sortBy=date&articleid=1528226&referrerAllArticles=true,서울ll펭찌,340,2024-08-05 10:49:00,
1528148,Ev9 배터리는 국내산 쓰는건가요???,뉴스보니까 중국산 배터리가 터져서 불 났다눈데지하주차장 주차하는것듀 눈치보이네요 ㅠㅠev9은 sk온 에서 납품하는 배터리 쓰는데 괜찮을까요 ??,0,https://cafe.naver.com/ca-fe/ArticleRead.nhn?clubid=21771803&page=3&userDisplay=50&inCafeSearch=true&searchBy=0&query=%EC%BD%94%EB%82%98+%ED%99%94%EC%9E%AC&includeAll=&exclude=&include=&exact=&searchdate=2024-07-312024-08-30&media=0&sortBy=date&articleid=1528148&referrerAllArticles=true,우덩lEV9l서울,"1,169",2024-08-05 09:53:00,
1528083,전기차 계약 직전에 화재뉴스로 머리 아파서 눈팅하러 왔습니다.,결국 사긴할것같은데 여론 잠잠해지면 살까 합니다.제 주변에서 잔소리가 심해서ㅜ다들 주변에서 잔소리(?) 없으신지 궁금하네요.이리저리 재다가 결국 전기차로 마음을 먹자마자 뉴스가 나서 또 결정을 연기를..ㅎㅎ와이프 설득도 쉽지않았는데 주변 분들까지 설득해야하다니..ㅎㅎ다들 화이팅하세요!,0,https://cafe.naver.com/ca-fe/ArticleRead.nhn?clubid=21771803&page=3&userDisplay=50&inCafeSearch=true&searchBy=0&query=%EC%BD%94%EB%82%98+%ED%99%94%EC%9E%AC&includeAll=&exclude=&include=&exact=&searchdate=2024-07-312024-08-30&media=0&sortBy=date&articleid=1528083&referrerAllArticles=true,리페이어I대전,285,2024-08-05 08:56:00,
1528026,BMS 결함과 셀 불량 (feat : Swelling),"충전을 100% 해도 전혀 문제 없다 라고말씀하시는분들의 이야기는 제조사 안전 마진과 BMS에서 차단시켜주기때문이라 말씀하십니다.맞는 이야기입니다하지만 이건 100% 제조사가 완벽하게 만들었을때 이야기입니다ICCU 결함과 동일한 맥락입니다[단독] 현대차, 미국엔 “코나 화재, 소프트웨어 결함 가능성” 인정 (hani.co.kr)예전 코나 화자 건과 볼트 EV 리콜건을 예로 들자면위의 내용만 보더라도 BMS의 여전히 ICCU 결함처럼 잠재적인 문제의 원인이 될수있습니다.[SEBB 리포트] 국내 4만5000대 전기차… ‘배터리 진단 못해’ (dnews.co.kr)수입 제조사들은 BMS 자료를 공개 하지 않고 있습니다.BMS는 아주 중요한 장치입니다. 하지만 어떤 제조사도자신들의 BMS결함으로 화재 났다고 하지 않을겁니다.하지만 BMS도 분명 결함이 발생할수있습니다 수백만대의 차중 오류는 반드시 존재하닌깐요.두번째로셀의 불량을 들수 있습니다.아래는 예전에 흔히 쓰던 배터리의 스웰링 현상으로 부분 배터리입니다.이건 거의 과충전에 의해서 발생합니다.그렇다면과충전은 어떻게 발생할까요첫번째로 이야기 드린 BMS의 오류에 의해서가 전기차에서는 가장 큰 원인이겠죠[단독] 한국지엠, 쉐보레 볼트 EV 고전압 배터리 리콜…""화재 발생 위험"" < 산업일반 < 산업 < 기사본문 - 월요신문 (wolyo.co.kr)볼트는 BMS 보다는 셀 불량이 가장 큰 원인인듯합니다.그로인해 볼트 EV는 중고차 시장에 리콜하지 않은 차량이 더 이득인것처럼판매하는 분들도 생기게 되었죠이렇게 수입사들도 판매 중인 차량에 리콜을 지속적으로 하고있습니다.우리 전기차에는 수십개의 셀이 배터리에는 존재합니다.그중 한개의 셀이 위의 스웰링 현상이 생기고 BMS의 오류로 인해 지속적인 과충전이 생긴다면과열되어 열폭주로 이어지게 되어있습니다.하지만 정말 저 두가지의 경우가 복합적으로 발생했을때이번 벤츠 차량처럼 아주 극히 드문 화재가 발생할꺼라 생각합니다.ICCU결함 역시 아주 치명적인데 리콜이후에도 지속적으로 나오듯이셀결함과 BMS 결함도 우리는 배제할수없습니다.국산제품,중국제품 이런 문제가 아닙니다.모든 전자제품에는 결함이 존재합니다.이제는 없으면 안되는 스마트폰의 관리 요령입니다.대부분 알고도 안지킵니다.다이소 충전케이블을 쓰거나 밤새도록 충전하거나일체형 배터리 스마트폰 나온지도 이제 시간이 꽤나 흘렀네요그래도 여전이 우리는 스마트폰 배터리 폭파한다는 기사를 종종 듣게 됩니다.근데 저렇게 관리 해야 한다는걸 우리는 잘압니다.알고도 귀찮아서 안할뿐이죠전기차도 다를게 없습니다.하지만전기차의 오류에 대한 기술 누적 데이터는 훨씬 적을겁니다.그래서 우리는 제조사의 베타테스터일수도 있습니다.그렇다면정말 배터리의 특성을 잘 알고 타야겠죠마지막으로전기차 화재로 항상 고생하시는소방소에서 배포자료로 마무리 하겠습니다.",3,https://cafe.naver.com/ca-fe/ArticleRead.nhn?clubid=21771803&page=3&userDisplay=50&inCafeSearch=true&searchBy=0&query=%EC%BD%94%EB%82%98+%ED%99%94%EC%9E%AC&includeAll=&exclude=&include=&exact=&searchdate=2024-07-312024-08-30&media=0&sortBy=date&articleid=1528026&referrerAllArticles=true,리허설l양산,514,2024-08-05 08:07:00,
1527989,결국 이또한 지나갈겁니다.,"몇년전 BMW 연속 화재 발생당시에도, 아파트나 빌딩 지하주차장에 BMW주차금지 장난 아니었었어요.근데 지금은? 다들 그런일이 있었나? 하면서 아무렇지 않게 살아갑니다.우리나라 특성상 뭐하나 터지면 비이성적으로 휩쓸리면서 난리가 나는데 또 금방 까먹어요.암튼 회원님들 거주하는 아파트나 직장건물에서 부디 합리적인 결정을 내려서, 전기차 차주분들이 억울한 피해를 보는 일이 없기를 바랍니다...추가) 가만 생각해보니 정말 억울하네요지금까지 지하주차장에서 충전중 화재 난 케이스가... SM3전기차, 구)오닉, 구)코나EV 요정도 였고,가만히 멀쩡히 주차된 차가 스물스물 자연발화한 케이스는 이번 EQE가 최초 입니다. (아니라면 댓글로 지적해주세요)그리고 모두 진화에 성공하였고 이렇게 큰 피해가 발생한 경우는 처음입니다.즉, 전기차 화재 하나만의 문제가 아니라, 주차장 내부에서 화염이 대규모로 한쪽방향으로만 번지게된 원인 규명이 필요합니다.",2,https://cafe.naver.com/ca-fe/ArticleRead.nhn?clubid=21771803&page=3&userDisplay=50&inCafeSearch=true&searchBy=0&query=%EC%BD%94%EB%82%98+%ED%99%94%EC%9E%AC&includeAll=&exclude=&include=&exact=&searchdate=2024-07-312024-08-30&media=0&sortBy=date&articleid=1527989&referrerAllArticles=true,이타도리I아5AWDI서울,370,2024-08-05 07:06:00,
1527933,요즘은 코나 화재 없죠?,배터리 교환 및 sw로 화재를 잡을 수 있는듯,0,https://cafe.naver.com/ca-fe/ArticleRead.nhn?clubid=21771803&page=3&userDisplay=50&inCafeSearch=true&searchBy=0&query=%EC%BD%94%EB%82%98+%ED%99%94%EC%9E%AC&includeAll=&exclude=&include=&exact=&searchdate=2024-07-312024-08-30&media=0&sortBy=date&articleid=1527933&referrerAllArticles=true,겸둥이I아이오닉I인천,376,2024-08-05 01:17:00,
1527912,틀딱 미꾸라지 정지좀 시켜라 ㅋㅋㅋ,그가 미꾸라지가 된 이유-------전기차 사려고 가입 후 청약 당첨되서 풀대출국산 전기차 니로 보다 코나봤는데 수중에 돈 없음대출이나 할부 알아봤으나 빚쟁이라 거절당함.와이프한테 니 명의로 대출이나 할부라도 하자고 조르다 빚이나 먼저 갚으라고 바가지 긁힘이미 가입한 전기차카페 들락날락하다보니 많은 사람들이 전기차 구입하는걸 보니 배아픔한동안 글 안쓰다 벤츠 화재나니 이때다 싶어 분탕질쓴 댓글들 보면 뇌를 거치지않고 작성한거라 말이 다 다름꼴랑 빚더미인 청약 하나 당첨된 거 가지고 나보고 집없는 카푸어라고 조롱함 ㅋㅋㅋㅋㅋ재산세 내고 차량도 일시불로 구매한 1년째 백수라고 하니어버바하며 뇌정지옴분탕글로 게시글 블락 당하자 반박 못한게 분해서 얼굴 시빨개지며 씩씩대며 와이프가 버리고 오라한 쓰레기 버리러 가는중다들 누군지 아시죠?ㅋㅋㅋㅋ,1,https://cafe.naver.com/ca-fe/ArticleRead.nhn?clubid=21771803&page=3&userDisplay=50&inCafeSearch=true&searchBy=0&query=%EC%BD%94%EB%82%98+%ED%99%94%EC%9E%AC&includeAll=&exclude=&include=&exact=&searchdate=2024-07-312024-08-30&media=0&sortBy=date&articleid=1527912&referrerAllArticles=true,막시II군포,592,2024-08-05 00:46:00,
1527833,화재의 이유가 궁금합니다..,"전기차들 사고 사례보면 과충전이니 뭐니 하면서 화재가 났는데화재가 나는 기준이 과충전만 있는건가요?제가 잘 못찾은거일수도 있지만 하브에는 화재가 적고?(거의 없는), 순수 전기차에만 일어나는거같아서요..아니면 뭐 전압이 더 강하게 들어갔다던지 열이 갑자기 나서 폭발했다던지...웃기지만 여름이라 뜨거워져서 그런건지...명확히 밝혀진게 있는건가요?",1,https://cafe.naver.com/ca-fe/ArticleRead.nhn?clubid=21771803&page=3&userDisplay=50&inCafeSearch=true&searchBy=0&query=%EC%BD%94%EB%82%98+%ED%99%94%EC%9E%AC&includeAll=&exclude=&include=&exact=&searchdate=2024-07-312024-08-30&media=0&sortBy=date&articleid=1527833&referrerAllArticles=true,후루IEQEI서울,"1,236",2024-08-04 22:37:00,
1527811,수입산 전기차는 테슬라가 답인거 같습니다.,"내차에 뭔가 이상이 있는거 같다…뭔가 오류가 생겼다…테슬라 서비스센터 전화연결1분이내에 가능합니다.독삼사 하루종일 연결이 어려울때도 많습니다.전화받는 어드바이저도소프트웨어에 빠삭합니다.차대번호만 불러주면원격으로 실시간 상태 점검 하고조치합니다.또한 내차의 모든 기록은테슬라 서버에 남겨집니다.오류등 리콜건도타사 같으면 보름 길면 몇달뒤 예약하고센터들어가야 해결할수 있는 조치를바로바로 ota로 리콜수정을 쏴서 조치합니다.물론 차량의 하드웨어만 본다면좋은차라 말하긴 어렵지만소프트웨어는 정말 다른세계입니다.테슬라가 전기차만 20년 했습니다.초기에는 이번 eqe처럼 자연발화도 있었지만2020년도 이후엔 단 한건도 없습니다.특히나 누적판매량 400만대가량의모델3,모델y는 자연발화가 1건도발생하지 않았습니다.국산차라면 지천에 블루핸즈가 있어서어느정도 대비가 된다지만센터 예약조차도 힘든 수입차라면테슬라가 가장 나은 선택일거 같습니다.",6,https://cafe.naver.com/ca-fe/ArticleRead.nhn?clubid=21771803&page=3&userDisplay=50&inCafeSearch=true&searchBy=0&query=%EC%BD%94%EB%82%98+%ED%99%94%EC%9E%AC&includeAll=&exclude=&include=&exact=&searchdate=2024-07-312024-08-30&media=0&sortBy=date&articleid=1527811&referrerAllArticles=true,경기lEtron모델yl짜,"1,678",2024-08-04 22:17:00,
1527687,"난리난 청라 아파트 벤츠 eqe 전기차 화재… 1500도, 다 타버린 증거들","난리난 청라 아파트 벤츠 eqe 전기차 화재… 1500도, 다 타버린 증거들터졌다 하면 큰 피해로 이어지는 전기차 화재가 불안을 높이고 있다. 전기차의 화재 발생률은 내연기관차보다 낮지만 진화가 어려워 피해를 확산시키는 게 문제다. 차량이 모두 타버리면서 원인 규명마저 어렵다. 피해 사실은 선명한데 책임자는 불분명하다. 피해 배상과 사고 복구에 오랜 시간이 걸릴 수밖에 없다.4일 인천소방본부 등에 따르면 지난 1일 인천 청라국제도시의 한 아파트 지하주차장에서 발생한 벤츠 전기차 화재 사고는 약 8시간20분만에야 진화됐다. 102세대 307명의 이재민이 불편한 생활을 하고 있다.아파트 단지 14개 동 가운데 5개동 480세대의 전기가 끊겼다. 정전 복구에는 3~5일 더 걸릴 것으로 예상된다. 이재민 수도 늘어날 전망이다. 인명피해는 없었지만 재산피해가 상당할 것으로 관측된다.전기차 화재 사고는 최근 몇 년 새 급증했다. 소방청에 따르면 지난해 기준 72건의 전기차 화재 사고가 발생했다. 화재발생률은 0.013%로 내연기관차(0.016%)와 비슷한 수준이다. 전기차 보급이 증가하면서 화재도 덩달아 많아진 것으로 풀이된다. 완성차업계는 “화재 발생률이 낮다”는 점을 내세우지만 피해가 진화가 어려워 피해를 키우는 게 문제로 지적된다.전기차의 대형 화재는 대개 배터리에서 발생한다. 전기차 배터리팩에는 수백개 이상의 배터리셀이 들어가는데, 그 중 하나의 배터리에 불이나면 연쇄적으로 옮겨 붙으며 열폭주를 일으킨다. 1000도 안팎으로 빠르게 치솟는다.전기차 배터리는 차체 내부에 매립돼 있어서 보통의 화재처럼 외부에서 물을 공급하는 것으로는 진화 효과가 미미하다는 것도 문제다. 소방청에 따르면 화재가 난 배터리에 직접 물을 공급하는 게 연쇄 폭발을 막는 데 가장 효과적이다. ‘조립식 수조’를 도입한 이유다.하지만 이번 화재 사고에서는 조립식 수조를 활용하지 못했다. 지하주차장에 소방 장비가 진입하지 못하면서다. 지하주차장에서 화재 발생 시 대응하기 어려운 것도 피해를 키운다. 진화도 쉽지 않은데 화재 진압까지 과정도 복잡하다.이번 벤츠 화재 사고와 마찬가지로 사실상 전부 탄 뒤에야 꺼지는 경우가 적잖다. 전소되기 때문에 화재 원인을 명확하게 규명하기도 쉽지 않다. 원인 규명이 불명확하면 책임소재를 선명하게 가르기 어려워지는 게 문제다.완성차 업체인 벤츠와 화재를 일으킨 차량에 배터리셀을 공급한 제조사 간 책임공방을 벌일 가능성도 있다. 2019년 이후 잇달아 발생한 현대자동차 코나 EV 화재 사고에 대해 국토교통부가 ‘배터리 셀 불량’으로 잠정 결론을 내리면서 약 1조1000억원의 리콜 비용이 발생했다.이에 대해 현대차와 배터리셀 제조사인 LG에너지솔루션은 소송전을 벌이기도 했다. 하지만 2021년 현대차 4255억원, LG엔솔 약 7000억원으로 분담을 합의한 뒤 리콜 비용을 해소한 전례가 있다.일각에서는 배터리 안전성을 충분히 담보하지 않은 상황에서 전기차 보급에 급급했던 것 아니냐는 지적도 나온다. 배터리업계와 완성차업계는 전기차 화재가 곳곳에서 문제되면서 화재 예방과 대응을 위한 기술 개발에 나섰다. 화재 발생 시 배터리 내부를 냉각해 소화하는 장치, 고체전해질 배터리, 난연성 전해질, 배터리 관리 시스템(BMS) 고도화 등이 추진 중이다.이번 사고 차량은 벤츠 EQE 350모델로 알려졌고, 탑재된 배터리셀의 제조사는 아직 공개되지 않았다. 글로벌 1위 배터리업체인 중국 CALT라는 추측이 나오고 있으나 확인되지 않았다. 국토교통부에 따르면 벤츠 EQE 차량에 대해 지난해 12월, 지난달 총 두 차례 고전압 BMS 리콜 통지문을 보냈다. 화재 차량의 리콜 여부 또한 확인되지 않았다.벤츠코리아는 “아파트와 피해 지역 주민 등에게 깊은 유감을 표한다”며 “매우 심각하게 받아들이며 당국에 협조해 차량을 철저히 조사하고 근본 원인을 파악할 수 있도록 최선을 다할 것”이라는 공식 입장을 내놨다.https://n.news.naver.com/article/005/0001715543?sid=102",2,https://cafe.naver.com/ca-fe/ArticleRead.nhn?clubid=21771803&page=3&userDisplay=50&inCafeSearch=true&searchBy=0&query=%EC%BD%94%EB%82%98+%ED%99%94%EC%9E%AC&includeAll=&exclude=&include=&exact=&searchdate=2024-07-312024-08-30&media=0&sortBy=date&articleid=1527687&referrerAllArticles=true,톰I서울,"4,318",2024-08-04 19:15:00,
