id,title,content,likes,url,author,views,created_at,updated_at
513163,[코나화재] 불안하고...현대가 만든 전기차 믿음이 점점 사라집니다.,전 코나 전기차 초반에 구매를 했습니다. 2018년 10월쯤인가 인도 받았는데 ...진짜 얼마전까지 전국 여기저기 타고 다니며 현대 전기차 좋구나! 생각하며 뿌듯한 마음으로 타고나녔었죠. 그러다 코나전기차 화재가 유달리 많아지는게 꺼림찍 하기 시작했어요....12번째 전기차 화재 나는걸 보면서 이제 슬....현대가 글로벌로 나가는건 무리인가보다 생각이 드네요...지금 코나일렉 차주들에게 어떤 조치도 안해줄경우...현대를 버리기로 맘먹었습니다. 2021년부터 곧 전기차 각축전이 벌어집니다. 조금 더 지나면 가격대도 맞는 전기차가 나올겁니다. 앞으로 전기차가 잘팔리는 요건은 퀄리티입니다. 거기엔 안전성이 기본으로 들어가죠 물론 전고체배터리가 등장하면 안전성은 더 크게 올라갑니다. 그런데...이런 문제 대처하지 못하는점....삼성의 노트7 발화사건 대처하는 모습을 봤을때 현대는...어떤 대처같은걸 해낼수있을까 지켜보고 있습니다. 삼성은 보란듯이 다시 성공했고 현대는 이걸 빌미로 바닥으로 급속도로 곤두박질 치는걸 보게될지...지켜봐야할듯하네요.급충 80퍼..완충 100퍼인데...완충 90퍼 줄이는 설정하러 나가봅니다..,1,https://cafe.naver.com/ca-fe/ArticleRead.nhn?clubid=21771803&page=26&userDisplay=50&inCafeSearch=true&searchBy=0&query=%EC%BD%94%EB%82%98+%ED%99%94%EC%9E%AC&includeAll=&exclude=&include=&exact=&searchdate=2020-07-312021-01-31&media=0&sortBy=date&articleid=513163&referrerAllArticles=true,신의광기l코나l대구,"2,102",2020-10-04 15:11:00,
513159,코나 EV화재,친환경차 이자 이제 곧 대세가 될 전기차가 코나ev 화재 때문에 사람들이 색안경을 끼고 볼 까봐 걱정이 되네요. 화재 비율이 1/2000 정도라고 하는데 현대차나 국토부에서 공식 입장이 뭔지 궁금하네요.참 여러 모로 아쉽네요,0,https://cafe.naver.com/ca-fe/ArticleRead.nhn?clubid=21771803&page=26&userDisplay=50&inCafeSearch=true&searchBy=0&query=%EC%BD%94%EB%82%98+%ED%99%94%EC%9E%AC&includeAll=&exclude=&include=&exact=&searchdate=2020-07-312021-01-31&media=0&sortBy=date&articleid=513159&referrerAllArticles=true,미리경주,892,2020-10-04 15:03:00,
513150,"[공유] 대구 아파트 주차장서 전기차 불…코나, 잇단 화재 논란",,1,https://cafe.naver.com/ca-fe/ArticleRead.nhn?clubid=21771803&page=26&userDisplay=50&inCafeSearch=true&searchBy=0&query=%EC%BD%94%EB%82%98+%ED%99%94%EC%9E%AC&includeAll=&exclude=&include=&exact=&searchdate=2020-07-312021-01-31&media=0&sortBy=date&articleid=513150&referrerAllArticles=true,꽃짱l코나EVㅣ대구,555,2020-10-04 14:40:00,
513144,"[공유] 대구 아파트 주차장서 전기차 불…코나, 잇단 화재 논란",,0,https://cafe.naver.com/ca-fe/ArticleRead.nhn?clubid=21771803&page=26&userDisplay=50&inCafeSearch=true&searchBy=0&query=%EC%BD%94%EB%82%98+%ED%99%94%EC%9E%AC&includeAll=&exclude=&include=&exact=&searchdate=2020-07-312021-01-31&media=0&sortBy=date&articleid=513144&referrerAllArticles=true,근육이IKEI서울,667,2020-10-04 14:08:00,
513139,차량 결함 관련해서 문의드립니다.,"* 관련된 주제에 대해 미리 카페내 검색해 보셨습니까? : (네/아니오)* 전기차 종류, 지역 :* 질문 내용 :http://www.kdfnews.com/news/articleView.html?idxno=57266코나 차주입니다.코나 2년동안 12번째 화재라는데이 정도면 원래 나올 수 있는 숫자인가요아니면 특이한 수치인가요?..사고로 인한 화재가 아니라면 12회라는건 일반적인 수치가 아니지 않나요??",0,https://cafe.naver.com/ca-fe/ArticleRead.nhn?clubid=21771803&page=26&userDisplay=50&inCafeSearch=true&searchBy=0&query=%EC%BD%94%EB%82%98+%ED%99%94%EC%9E%AC&includeAll=&exclude=&include=&exact=&searchdate=2020-07-312021-01-31&media=0&sortBy=date&articleid=513139&referrerAllArticles=true,너구리달메,139,2020-10-04 13:52:00,
