id,title,content,likes,url,author,views,created_at,updated_at
1251029,차 바꿀때가 된건지 기변병이 오네요,구형 아이오닉 몇년동안 몰고다니니 벌써 14만키로 되어가는데 슬슬 차 바꿔도 되려나 싶네요 ㅋㅋ원래는 다음 차도 니로나 아이오닉으로 갈까 싶었는데 돈 좀 더 보태서 모델3 중고는 어떨까 싶더라구요테슬라 사려면 돈좀 열심히 모아야겠군요..,0,https://cafe.naver.com/ca-fe/ArticleRead.nhn?clubid=21771803&page=1&userDisplay=50&inCafeSearch=true&searchBy=0&query=%EC%95%84%EC%9D%B4%EC%98%A4%EB%8B%89+%EB%88%84%EC%88%98&includeAll=&exclude=&include=&exact=&searchdate=2023-01-312023-07-31&media=0&sortBy=date&articleid=1251029&referrerAllArticles=true,플찬I아이오닉I광주,207,2023-07-26 17:22:00,
1246212,[질문] 신차 출고 .. 후 이런경우,"* 관련된 주제에 대해 미리 카페내 검색해 보셨습니까? : 아니오* 전기차 종류, 지역 : 아이오닉6 // 충남* 질문 내용 : 신차 출고를 7월 10일날 받아서 차운행 4~5번 짧게하고 비가 엄청와서 주차장에 차를세워두고비 그치고 트렁크 매트 작업할려고보는데 누수가있어서 19일에 입고를하고 원인결과 차체 용접 및 구멍으로 누수 발견 매트 눅눅하고 다 젖어서 교체 하고 부품 조달로 21일 ~24일 차량 출고가능하다는데 이런거 보상이나 뭐 받을수있나요 ? 그냥 넘어가야하나요 ?",0,https://cafe.naver.com/ca-fe/ArticleRead.nhn?clubid=21771803&page=1&userDisplay=50&inCafeSearch=true&searchBy=0&query=%EC%95%84%EC%9D%B4%EC%98%A4%EB%8B%89+%EB%88%84%EC%88%98&includeAll=&exclude=&include=&exact=&searchdate=2023-01-312023-07-31&media=0&sortBy=date&articleid=1246212&referrerAllArticles=true,해포l아이오닉6l아산,241,2023-07-21 09:57:00,
1228882,아이오닉5 디지털사이드 미러 습기로 화면이 보이지 않습니다.,"* 관련된 주제에 대해 미리 카페내 검색해 보셨습니까? : (네/아니오)* 전기차 종류, 지역 : 청주* 질문 내용 :",0,https://cafe.naver.com/ca-fe/ArticleRead.nhn?clubid=21771803&page=1&userDisplay=50&inCafeSearch=true&searchBy=0&query=%EC%95%84%EC%9D%B4%EC%98%A4%EB%8B%89+%EB%88%84%EC%88%98&includeAll=&exclude=&include=&exact=&searchdate=2023-01-312023-07-31&media=0&sortBy=date&articleid=1228882&referrerAllArticles=true,찰리정1,535,2023-06-30 01:52:00,
1228042,디싸미 장점과 단점,안녕하세요~계약시 디지털사이드미러 신청했어요~직접 이용하고 계신 차주님들께 디사미 장단점을 듣고 싶네요~단점들 글을 보게되어 걱정이 되기도 합니다.답변 부탁드립니다!,0,https://cafe.naver.com/ca-fe/ArticleRead.nhn?clubid=21771803&page=1&userDisplay=50&inCafeSearch=true&searchBy=0&query=%EC%95%84%EC%9D%B4%EC%98%A4%EB%8B%89+%EB%88%84%EC%88%98&includeAll=&exclude=&include=&exact=&searchdate=2023-01-312023-07-31&media=0&sortBy=date&articleid=1228042&referrerAllArticles=true,샐리I부천,321,2023-06-28 21:11:00,
1207257,주행거리가 얼마되면 전기차를 사면 좋을까요??,"현재는 시기상조인것 같고 그래도 전기차가 주행거리가 얼마나 되면* 관련된 주제에 대해 미리 카페내 검색해 보셨습니까? : (네/아니오)* 전기차 종류, 지역 : 부산* 질문 내용 : 전기차 EV9 보고있습니다.현재는 500키로라고 하는데 실제거리는 400정도 될거라고 생각합니다.일반 승용차는 그래도 600정도는 부산 서울기준으로 편하게 편도로 가는것 같습니다.아직까지 거리는 많이 부족한거인가요??좀 더 있다가 차를 구매하는게 좋을까요??",0,https://cafe.naver.com/ca-fe/ArticleRead.nhn?clubid=21771803&page=1&userDisplay=50&inCafeSearch=true&searchBy=0&query=%EC%95%84%EC%9D%B4%EC%98%A4%EB%8B%89+%EB%88%84%EC%88%98&includeAll=&exclude=&include=&exact=&searchdate=2023-01-312023-07-31&media=0&sortBy=date&articleid=1207257&referrerAllArticles=true,스누피l부산,490,2023-05-25 13:57:00,
1191258,[질문] 전기차 내구성은 어느정도인가요?,"* 관련된 주제에 대해 미리 카페내 검색해 보셨습니까? : (네/아니오)* 전기차 종류, 지역 : 아이오닉 일렉트릭* 질문 내용 :왕복 70키로의 거리를 시속 100정속주행하는 출퇴근러입니다그러면 굉장히 많은 키로수를 타게될텐데요흔히 내연기관차는 10몇만키로 타면 보내줄 준비를 한다고 알고있는데 전기차는 어느정오 버텨줄 수 있는지 여러분들의 의견들을 듣고싶습니다",1,https://cafe.naver.com/ca-fe/ArticleRead.nhn?clubid=21771803&page=1&userDisplay=50&inCafeSearch=true&searchBy=0&query=%EC%95%84%EC%9D%B4%EC%98%A4%EB%8B%89+%EB%88%84%EC%88%98&includeAll=&exclude=&include=&exact=&searchdate=2023-01-312023-07-31&media=0&sortBy=date&articleid=1191258&referrerAllArticles=true,Pusan,"1,127",2023-04-30 20:58:00,
1177014,[결함] 아이오닉5 디지털사이드미러 결함에 대하여...,"최근 디지털사이드미러 습기문제로 개선품이 나와 많은분들이 교체하고 있는중입니다만...불행하게도 저처럼 개선품 교체후에도 지속적으로, 혹은 더 심하게 습기가 차는 문제가 발생하고 있습니다.이것은 결함이라고 생각합니다.열선틀면 최장 2~3분이내는 없어져야하는데 제경우 10분틀어도 없어지지 않았습니다.V2L이 되니까 드라이기로 말려볼까도 했는데 ㅋ주행중 저렇게 렌즈습기로 화면이 뿌옇게되면 안전운전에 방해가 됩니다. 진짜 화딱지가 납니다 ㅠ. 130만원 더 추가해서 스트레스덩어리 구입한결과가 되었어요.현대자동차에서 리콜해주시길 요청합니다 ㅠㅠ",1,https://cafe.naver.com/ca-fe/ArticleRead.nhn?clubid=21771803&page=1&userDisplay=50&inCafeSearch=true&searchBy=0&query=%EC%95%84%EC%9D%B4%EC%98%A4%EB%8B%89+%EB%88%84%EC%88%98&includeAll=&exclude=&include=&exact=&searchdate=2023-01-312023-07-31&media=0&sortBy=date&articleid=1177014&referrerAllArticles=true,블루I오닉5I청주,970,2023-04-08 10:55:00,
1175197,[질문] 아이오닉5 비전루프 어떤가요??,"* 관련된 주제에 대해 미리 카페내 검색해 보셨습니까? : (네/아니오)* 전기차 종류, 지역 : 아이오닉5, 세종* 질문 내용 : 아5 비전루프 효용성오늘 아이오닉 5 비전루프제외 풀옵으로 계약했습니다.지금 소유중인 차 두대다 썬룹이 있지만 사용횟수가 손에꼽아서 제외했습니다.그런데,여기 글을 살펴보니 비전루프를 추천허시는 분들이 많으신 것 같아서요.차 설명하는 분이 비전루프때매 오히려 소음이 발생하고 , 혹시모를 전복사고를 얘기하시더라구요.비전루프제외면 6개월 포함하면 그이상이라 올해 보조금이 간당간당할 것 같아 빼긴했습니다.정말 추천할만 옵션인가요??",0,https://cafe.naver.com/ca-fe/ArticleRead.nhn?clubid=21771803&page=1&userDisplay=50&inCafeSearch=true&searchBy=0&query=%EC%95%84%EC%9D%B4%EC%98%A4%EB%8B%89+%EB%88%84%EC%88%98&includeAll=&exclude=&include=&exact=&searchdate=2023-01-312023-07-31&media=0&sortBy=date&articleid=1175197&referrerAllArticles=true,벨엔I세종,"1,228",2023-04-05 20:33:00,
