post_id,cmt_content,cmt_author,cmt_created_at
515693,정확한건 코나차주들이 LG배터리를 구입한게아니고 현대차를 구매했다는거죠~ 배터리와 차체를 따로사서 조립했다면 모르지만 난 차를 산거지 배터리를 산건 아니라는...,동글이74I코나EVI대전,2020-10-09 09:08:00
515693,,오뚜기l코나l포항,2020-10-09 09:11:00
515693,네. 근데 말이죠. 만약에 LG문제로 결론이 나더라도 새로 교체해야 하는 배터리는 LG제품 배터리 아닐까요?그리고배터리 설계는 현대에서 하는게 아니라는게 문제죠.,구구I코나EVI오산I,2020-10-09 09:14:00
515693,배터리 자체가 불량이면잡스가 무덤에서 살아 돌아와도해결못할것 같네요.,구구I코나EVI오산I,2020-10-09 09:15:00
515693,결론이 배터리문제라고 판별되었을때 코나 차주가 어디로 갈까요? LG화학? 아닙니다 현대차로 갑니다 저는 계약을 현대랑 한거지요 중요한건 법적인 책임입니다. 소비자는 판매자와 구매계약을 한거지요. 부속품 업체와 하나씩 계약을 하는건 아니니까요. 그래서 완성차 업체라고 하는거아닐까여?,동글이74I코나EVI대전,2020-10-09 09:17:00
515693,현대든 LG든 원일을 찾아서 코나차주들이 목숨을 담보로 운행하지 않도록 하는것이 중요한가 같구요 솔직한 답변과 투명한 진행이 필요한 시점입니다,동글이74I코나EVI대전,2020-10-09 09:19:00
515693,그럼 현대에서 다른 업체랑 계약을 해서 리콜용으로 SK나 삼성셀로 코나 배터리팩을 별도로 만들어서 공급하겠다는 그런걸 확신하시나요? 그게 아니면 현대에서 책임을 진다고 하더라고 그게 책임을 질 수 있는건가요?,구구I코나EVI오산I,2020-10-09 09:22:00
515693,"제가 이해력이 딸리는건지 모르지만 배터리제조사가 어디든 상관없이 문제없이 안전하게, 원래의 스팩대로 운행이 가능하도록 하면된다는 이야기입니다. 그게 현대의 책임있는 판매자의 역할아닐까합니다.",동글이74I코나EVI대전,2020-10-09 09:25:00
515693,그럼 다카타에어백 사태에 대해서는 어떻게 생각하시나요?,구구I코나EVI오산I,2020-10-09 09:27:00
515693,죄송합니다. 전문가가 아니라서 다카타에어백이 뭔지 잘 모르겠습니다.,동글이74I코나EVI대전,2020-10-09 09:28:00
515693,그냥 검색만 해도 나옵니다.,구구I코나EVI오산I,2020-10-09 09:28:00
515693,네 시간될때 검색해보고 찾아보겠습니다.,동글이74I코나EVI대전,2020-10-09 09:29:00
515693,동글이 님 표현이 아주 탁월하십니다. 전적으로 동의합니다,동막골I전북,2020-10-09 09:49:00
515693,그것을 차주가 생각해야 하나요? 제조사인 현기에서 조치해야죠.,지휘크리l쏘부I서울,2020-10-09 13:08:00
515693,현대에서는 국토부가 말한 배터리 불량 원인 발표를 근거로 말을 한거에요.. 물론 현대도 자체 조사를 했겠지만요.,왕게임짱ㅣ코나ㅣ서울,2020-10-09 09:30:00
515693,네 맞습니다. 국토부에서 아직 조사중이지만 사태가 엄중해서 가능성을 염두해둔 리콜 시정명령을 내린건데... 왜이리 바득바득 우기시는지 모르겠네요.,구구I코나EVI오산I,2020-10-09 09:35:00
515693,현대도 힘들겠어요... 배터리 전문이 아니다보니 LG화학 반박하기가 힘들것 같네요... LG에서 감추고 있는 그 무언가가 있는것 같은데 완성차 회사에서는 그걸 알아내기가 어려울 수 있겠네요... SK를 들들 볶아 하자 찾아내라고 하면 될텐데..ㅋㅋ,근육이IKEI서울,2020-10-09 09:56:00
515693,현대가 잘못한걸 왜 LG로 넘기죠?그 말대로면 동일한 LG배터리 사용하는 볼트는 화재 10대 이상은 났었어야 하는데요??,팅팅탱탱탱l경기,2020-10-09 10:10:00
515693,현대가 볼트EV 3시간만에 5천대 완판된거 보고 급조한 차량이 코나EV인데.급조하느라 대충 설계한데에서 나온 문제를 왜 LG로 책임전가 하는지?그럼 같은 LG배터리 쓰는 볼트EV는 벌써 화재 10대 이상은 나야죠.,팅팅탱탱탱l경기,2020-10-09 10:13:00
515693,맞는의견이라생각합니다,보라개미I쏘울I용인,2020-10-09 10:33:00
515693,그쵸거기다 배터리 어셈블리 받는게 아니고현대가 욕심부려서 어셈블리 조립에 관여한게 크죠.모양은 협력사 제조지만....,ㅇㅋㅋㅋI볼트EVI경기,2020-10-09 11:01:00
515693,현대애들 엘지로 물타기하네요 그래봐야 소비자에겐 현대책임,연군ㅣ볼트ㅣ경기,2020-10-09 13:01:00
515693,"코나ev에 들어가는 ncm622 배터리는 볼트ev, 르노의 조에에도 사용되고있는데요. 특히 조에에 경우는 유럽 전기차 점유율 1위일 정도로 판매량이 많은 차예요. 신기한건 이 차량들은 화재 신고가 단 1건도 없다는 거예요. 결국 터진건 코나ev뿐... 그렇다면 이건 배터리 셀(lg화학)의 잘못일까요? 현대차의 잘못일까요? lg화학의 물적분할로 인한 여론이 안좋은 시기와 sk이노베이션과의 소송전이라는 틈을 타 섣부른 국토부의 발표였던거 같습니다. 뭐 아시다시피 국토부는 현대차 산하기관이란 말이 있을정도로 현대편이니깐요.",동익효과II3I서울,2020-10-09 20:24:00
515693,가장 타당성 있어 보이네요.,불량감자l볼트l대구,2020-10-09 21:16:00
515693,볼트 화재 났었습니다.,구구I코나EVI오산I,2020-10-10 14:27:00
515693,https://n.news.naver.com/mnews/article/056/0010908028?sid=102배터리가 원인이 아닙니다. 과전류 (bms) 혹은 외부적 요인 추정입니다.,동익효과II3I서울,2020-10-10 18:08:00
515680,한몫보려는게 무엇인가요? 설마 완충해서 불내보자가 한몫인가요?아니요 그건 저들의 면피식 대응에 대한 분노의 표현입니다.,늑늑늑l서울,2020-10-09 08:18:00
515680,그뜻이 아닙니다 완충은 한달에 1~2회 하라고 메뉴얼에도 있습니다 분노의 표현도 있을수 있다고 본문에 썼습니다,문짝뜯어ㅣ코나ㅣ광주,2020-10-09 08:20:00
515680,네. 저도 강조의 댓글이었어요 ^^;;;;;;,늑늑늑l서울,2020-10-09 08:23:00
515680,넹 잘알겠습니당 ㅋㅋㅋ,문짝뜯어ㅣ코나ㅣ광주,2020-10-09 08:25:00
515680,하찮은 차때문에 분노하시면 정신건강에 안좋읍니다.,코나윤,2020-10-09 08:19:00
515680,차량 불량시 나와 내가족 그리고 이웃들의 생명을 위협하기 때문에 분노하게되지요,문짝뜯어ㅣ코나ㅣ광주,2020-10-09 08:23:00
515680,정신건강에 문제 있으신 분 아니신지.... 하찮은 '차 문제'로 느껴지시다니 !!!,나무처럼코나부산I,2020-10-09 08:26:00
515680,정신건강에 이상없구요.말 조심하시죠.제가 쓴글에 의미나 파악하시죠.,코나윤,2020-10-09 08:50:00
515680,네 코나윤님 의도 이해합니다 다들 예민해 있어서 그런듯 합니다,문짝뜯어ㅣ코나ㅣ광주,2020-10-09 08:52:00
515680,규정에 맞게 닉네임 변경 부탁드립니다 코나윤님,빠빠빠옹I불나I부산,2020-10-09 09:04:00
515680,순전히 회원들 위로하는 표현이셨다면 제가 실례한 듯합니다... 저는 작전세력이 아무말 투척한 걸로 오해했습니다....,나무처럼코나부산I,2020-10-11 09:27:00
515680,서서히 크랙이 발생되어 진행이 느리다면야 몰라도 급격한 크랙 발생으로 bms에 보고 되는 동안 불이 날수도 있습니다 근본적인 원인을 제거해야지....,수녕군IM3I서울,2020-10-09 08:25:00
515680,크랙문제와 냉각수 문제는 따로 리콜 해야하고 배터리 교체시에 문제삼지 않아야 된다는 뜻으로 글올렸습니다,문짝뜯어ㅣ코나ㅣ광주,2020-10-09 08:28:00
515680,전기차에 대해 많이 아시는 분이 있어서 안심이 됩니다. 이 사태 추이를 보시면서 적절한 행동 가이드라인을 주시길 바랍니다,나무처럼코나부산I,2020-10-09 08:29:00
515680,공감합니다.,연오랑l코나l서울,2020-10-09 08:32:00
515680,지금 점검해서 문제 없다 판정하면 내년봄부터 또 불이 나겠죠. 이런 건 미봉책이라고 하는거고. 이거 잘 못하면 현대차 세계 차시장에서 퇴출될수도 있어요. 저는 이것으로 국산차는 끝냅니다. 레간자 샀다가 뒷좌석 녹 슬어서 내려앉을 뻔하고 현대만 탔는데 코나 화재대응에 이건 아닌것 같습니다.,대구마음I코나I대구,2020-10-09 09:00:00
515680,리콜은 보증기한 상관없이 평생 되지 않나요? 올해 기아 오토큐에서 10년 23만키로 내연차 수리했는데 커플링인가? 무료 교체받았습니다 해당부품이 리콜대상이라더군요 설마 현대도 같은 시스템이겠죠?,문짝뜯어ㅣ코나ㅣ광주,2020-10-09 09:04:00
515663,인전교육받을때마다 나오는 하인리히법칙!,코나윤,2020-10-09 07:48:00
515663,이미 포털댓글엔 현대가 일잘했네 라는 글들이 올라옵니다. 관계없는 사람들에겐 언플이 먹힌거죠,스마일I코나I전북남원,2020-10-09 08:12:00
515643,"이 글 보니, 감정도 조금은 사그라드네요. 애쓰셨네요. ^^",태후니I코나I천안,2020-10-09 01:39:00
515643,소송은 미쿡에서~~~~,난다난다,2020-10-09 02:04:00
515643,한쿡은 소비자가 봉이죠,빠빠빠옹I불나I부산,2020-10-09 08:52:00
515643,격하게 공감하는 바입니다,사자왕I볼트I일산,2020-10-09 03:02:00
515643,긴글 읽어주셔서 감사합니다,빠빠빠옹I불나I부산,2020-10-09 08:52:00
515643,기업활동은 이익을 내기 위해서 입니다. 이익이 안나면 기업은 움직이지 않습니다. 개인도 마찬가지이죠. 2년동안 현기차에서 조사하면서 원인을 모를일이 없고 결국 바꿀려면 돈이 드는데 뭉개고 있다가 보통 페리때 다시 인증받으니 그때 수정했을겁니다. 어떤 분들이 2020년식 코나EV는 불이 안 날거라고 말씀하시는거랑 일맥상통 합니다. 기아로고 보기 싫다고 왜 안 바꾸냐는 소비자들이 있어 개인적으로 바꾸시는 분들도 있는데 알고보니 회사입장에서는 수백억원이 들어가는 일이더군요. 인증단계부터 다시 시작해야되니까 큰맘먹고 하지 않으면 바꿀 수가 없죠. 이게 차체나 엔진 전장등 한번 설계가 끝나서 생산에 들어가면 나중에 조금만 바꿔도 다른 공정에 영향이 가니까 원인을 알면서도 고치지 못하고 일이 생겨도 개별보상해 주는게 더 싸게 먹히는거죠. 항상 고객센터에 문제가 생겨서 문의하면 고객님이 처음 문의하시는건데요 라고 하는것도 마찬가지 입니다. 그러나 이제는 정보가 실시간으로 전파되니까 정보의 왜곡을 시도해서 소비자 과실로 계속 몰고 갑니다. 시나리오를 써 보자면 우선 돈이 적게 드는 소프트웨어 업데이트로 자발적리콜이라고 무마하고 여기서 한사람과 안한 사람 가리고 서로 비난하게 만들어서 세력을 약화시킬겁니다. 한 사람이 불나면 개별접촉을 해서 무마할것이고 안한 사람이 나면 대대적인 언론공세와 함께 다른 쪽으로 원인을 슬쩍 방향을 돌립니다. 결국 소프트웨어로 차량 운행에 제한을 걸것이고 이제 겨울이 되면 주행거리가 줄어드니 소프트웨어에 어떤 장난을 쳤는지 소비자는 모를겁니다. 그러면 제대로 된 주행거리를 알 수 있는 내년 여름이면 거의 1년인데 여론이 어떻게 형성되어 있을까요? 그때의 현기차 답변은 뻔하죠. 주행거리 정상입니다. 고객님. 우리(현기차)가 수작부렸다는것을 증명해 보십시요. 우선 여기까지 시나리오를 써 봤습니다. 이후는 각 개인사정 때문에 통일된 목소리를 내기 어려울 수도 있습니다. 기사로는 현기와 LG가 서로 네탓이네 공급선과 납품선을 바꾸네 하지만 실제 계약서 찍고 이행하기전까지는 기사는 기사일뿐입니다. 기업은 이익을 최우선으로 한다는 것만 생각하시면 현기차가 앞으로 어떻게 할지 쉽게 유추하실 수 있을겁니다.,초심으로I오닉I서울,2020-10-09 05:06:00
515643,"음 저는 이 부분에서 BMW 사건이 생각났었는데, 초심으로 님 말씀처럼 기구적(물리적) 문제와 회로적 문제의 차이가 있을 수 있습니다만 비엠 사건때는 아주 구체적인 원인과 리콜 방안이 언론에도 나왔었죠 뭐 내연차 역사가 오래되어서 아주 많은 사람들이 관련 지식을 갖고 있고 전기차는 그렇지 못해 다른 얘기일 수도 있지만요 아무튼 돈이 적게드는 SW 업글 -> 문제 있을때 HW 일부 교환 비용절감 측면에서도 기업이 선택할 수 밖에 없는 선택지입니다 현 상황에선.... 다만, 업그레이드가 배터리 이상 감지 수준이라면 저는 원인을 모른다에 한표 던지고 싶다는거고 소프트웨어 변경에 따른 주행거리 감소에 대해서는 아마 카페 내 많은 능력자분들이 계시니 같이 검증해 나갈 수 있지 않을까 합니다 ㅎㅎㅎㅎ",빠빠빠옹I불나I부산,2020-10-09 08:50:00
515643,"윗분이 남기신 댓글처럼 현대가 이 상황에 대해 인정하는 순간 어마어마한 손해가 발생하기 때문에 ""무조건 막아""로만 대응해 왔다가 이제 와서 리콜을 한다는건 그 손해에 대해 누군가는 감당한다는 것으로 보입니다. 그 누군가가 현대 자체인지, LG인지, 보험사(영업배상보험 등)인지, 다른 제3자인지는 모르겠으나 현대 자체적으로 손해를 감수할 가능성은 적어 보이고 누군가에게 책임을 전가했을 가능성이 더 있을 것이라고 추정해 봅니다. 어쨌거나 이번 리콜에 대한 비용은 누군가는 감당해야 할 것이고 이 부분이 해소됐기 때문에 현대가 리콜을 진행하는 것이 아닌가 합니다. 배터리팩 자체적인 결함이 조금이라도 있었고 현대도 본 건에 대해 대비를 하고 있었다면 이번 리콜에서 교체되는 배터리팩은 이러한 결함이 모두 해결된 부속품들로 새롭게 구성된 제품이라고 기대해 봅니다.",웜커들I아이오닉I제주,2020-10-09 05:42:00
515643,"이 건에 대해서는 아직 결정된 바 없다고 들었습니다 원인을 몰라서 책임 분담을 못한다 봅니다 ㅎㅎㅎㅎ 갑자기 막 뚜드려 맞으니 임시방편으로 조치하는거고, 실제 배터리교환 건수가 적으면 그만큼 부담도 줄겠지요 그러는동안 과실비율따지고 들겠죠?? 엘지vs현대",빠빠빠옹I불나I부산,2020-10-09 08:52:00
515643,궁금한게 있는데 원인을 주는 요소들에서 lg와 sk 라는 셀 제외하고 니로와 코나가 시스템 및 제조에 있어서 동일한 부분에 대해서는 어케 생각하시나요??,아구바구l니로l화성,2020-10-09 06:35:00
515643,저는 차의 태생에서 문제가 있다 봅니다 내연플랫폼 & 친환경 플랫폼 플랫폼도 무시 못하지유 그리고 냉각방식도 다릅니다,빠빠빠옹I불나I부산,2020-10-09 08:36:00
515643,플랫폼은 다르네요 음냉각방식이 어떻게 다른가요??둘다 수냉식 입니다,아구바구l니로l화성,2020-10-09 08:40:00
515643,아 잠깐 헷갈렸네요 아이오닉이 공냉식이죠^^ 현재 판매되는 전기차 중에 내연 플랫폼에 전기차용 부품을 구겨넣은 차는 코나밖에 없지 않나요??? 저는 그것도 클거라 보는데요,빠빠빠옹I불나I부산,2020-10-09 08:43:00
515643,저도 이게 궁금한데요.. 니로도 내연플랫폼인거 같아요,기리사메I미정I경기,2020-10-09 23:20:00
515643,이번 리콜은 근본적인 문제 해결은아닌것 같습니다 원인파악을 위한 로그 심는정도일지 아니면 현대가 추측하는 화재 원인 발생을 차단하는 우회조치일지 모르지만 화재 문제는 어느정도 해결되어 코나 차주분들의 불안감이 해소되었으면합니다 그리고 어찌보면 차후에 혹시모를 인명피해 발생 시 손해배상을 피하기 위한 빠른 리콜인것 같기도 합니다 중대한 인명피해가 발생하면 최대 3배의 보상을 해야하는데 우선 리콜을하니깐 자기들은 조치를 취했다가되서 이걸 피할수있죠 현대 법무팀우수하네요 제조물 책임법 제3조(제조물 책임) ② 제1항에도 불구하고 제조업자가 제조물의 결함을 알면서도 그 결함에 대하여 필요한 조치를 취하지 아니한 결과로 생명 또는 신체에 중대한 손해를 입은 자가 있는 경우에는 그 자에게 발생한 손해의 3배를 넘지 아니하는 범위에서 배상책임을 진다. 이 경우 법원은 배상액을 정할 때 다음 각 호의 사항을 고려하여야 한다. 1. 고의성의 정도 2. 해당 제조물의 결함으로 인하여 발생한 손해의 정도 3. 해당 제조물의 공급으로 인하여 제조업자가 취득한 경제적 이익 4. 해당 제조물의 결함으로 인하여 제조업자가 형사처벌 또는 행정처분을 받은 경우 그 형사처벌 또는 행정처분의 정도 5. 해당 제조물의 공급이 지속된 기간 및 공급 규모 6. 제조업자의 재산상태 7. 제조업자가 피해구제를 위하여 노력한 정도,아르마I볼트I인천,2020-10-09 08:20:00
515643,네 저도 사실 완성소비재 업체에서 일하고있어서 언급해주신 PL법을 얘기했던겁니다,빠빠빠옹I불나I부산,2020-10-09 08:32:00
515643,넵 얼른 원인파악해서 근본적인 해결이 이루어졌으면합니다,아르마I볼트I인천,2020-10-09 08:46:00
515632,식약청에 신고해야죠,흔한사람코나경기,2020-10-09 00:16:00
515632,아이고 ㅠ 그냥 약국한번 가보라네요ㅠ,네온I니로I서산,2020-10-09 00:39:00
515632,맞아요 ^^ 휘발유 차에서 불났는데 정유회사에서 불량 휘발유 주었다고 하는 거랑 같은 거죠,제대로I볼트I경주,2020-10-09 00:17:00
515632,좀있으면 충전기 업체도 물고늘어지려나요 ㅎㅎ 너네문제다! 하면서요,NalwaI모델3I서울,2020-10-09 00:22:00
515632,이번 코나화재원인이 배터리 이기때문에 현대차는 잘못 없다? 이런 놈들 다 때려 잡아야합니다,후회I니로EVI대전,2020-10-09 00:54:00
515632,거기가 어디죠?,가리짱I볼트I충남,2020-10-09 01:40:00
515632,아마 횬다이레스토랑 인거같아요,수녕군IM3I서울,2020-10-09 06:33:00
515632,횬다이레스토랑 ㅋㅋㅋ,연군ㅣ볼트ㅣ경기,2020-10-09 12:22:00
515632,적절한 표현이네요^^,미르I코나I경기,2020-10-09 06:59:00
515632,,미제I볼트I화성,2020-10-09 07:18:00
515632,저도 서산사는데 ㅠ 쪽지로 알려주실수 있으신지요,유나I아이오닉I서산,2020-10-09 07:32:00
515632,ㅋㅋㅋㅋㅋ,땅콩I볼트evI서울,2020-10-09 07:36:00
515632,거기 맛집인듯 판매량 1위인거보니 ㅡㅡ,추수수ㅣ코나ㅣ대전,2020-10-09 08:26:00
515625,이제 코나전기차 값 똥값되겠네 현대에서 책임져라,코나일렉트로닉인천,2020-10-08 23:59:00
515625,현대자똥차를 사랑해주신 고갱님께 ... 보답 .. 항상 사랑해주시고 ... 저희 현대자똥차 재구매를 해주시면 ..더불어 현대카드를 사용하시면 .. 되도 않는 말장난치면서 뭐.. 이딴 멘트 칠거같네요..,망나니l더뉴오닉l충남,2020-10-09 04:43:00
515625,"내연기관 플랫폼이기에 배터리 보호에 취약하다고 생각하지는 않습니다. 지금은 전용 플랫폼보다 내연기관 플랫폼이 월등히 더 많습니다. 잘 돌아다니구요 하부 보호가 부족한 것은 설계시에 여러 이유(원가절감이든 연비든 지상고든..)로 중점을 배터리 보호보다 다른 측면에 기울인 거고, 우려할 수 있을지는 모르나 화재와 크게 연결점을 찾을 수 없다 느껴집니다. 당장 니로 등의 내연기관 플랫폼의 다양한 차량의 문제가 코나와 같은 패턴으로 발생한 사례는 없지 않나요? 최근 코나 이슈 중 배터리 하부 크랙과 화재건을 분리시켜봐야 할것 같습니다. 크랙에 의한 수분 침투와 화재가 연결될 수 있다 하더라도 니로는 아직 없잖아요. 배터리 하부 보호의 문제는 별도로 논의해야할 부분으로 느낍니다.",벽소령l볼트EVl전북,2020-10-09 06:08:00
515625,"잘 몰라서 그러는데요, 니로는 배터리 하부 보호가 코나와 다르지 않나요?? 그리고 하부 크랙으로 배터리를 갈아야 한다고 하는 것만 봐도 하부 크랙이 배터리에 영향을 주는게 확실한데화재의 원인이 차량 설계의 구조적 결함과 연결 될 수 있지 않을까요. 낮은 차체에 의한 잦은 충격 등으로 배터리 하부 보호 미흡이 배터리 등에 주는 영향이 어떻게든 있지 않을까요. 배터리에 어떤 식으로든 충격이 지속된다면 화재로 연결 될 수도 있지 않을까 생각합니다.",오렌지라떼 코나 서울,2020-10-10 14:45:00
515625,"유럽의 탄소배출 문제로 급하게 출시 한거 같습니다... 내연차를 팔기위해서 탄소배출 수치를 맞춰야하나 그랜져급은 기준치 두배거든요~~ 그럼 벌금 과징금이 또 어마어마하게 나옵니다 그래서 탄소배출 0인 전기차를 팔아야 내연차를 팔수있기에 부랴부랴 내놓은 걸로 보입니다 하브는 탄소배출 생각보다 많이 나옵니다... 전기0이라면 하브는 60-70, 그랜저급 200정도이고 유럽기준 대당 100정도 탄소배출입니다 이것도 내년엔 점점 더 낮아지니 내연차 팔려면 전기차는 필수죠 그래서 전기차 없는 자동차회사들이 테슬라에게 탄소배출권을 사가는 겁니다.. 과징금 맞느니 탄소배출권 구입으로 과징금 피하겠다는 거지요",수녕군IM3I서울,2020-10-09 06:38:00
515625,18년 코나출시 당시에 화재2건 발생해 노조에서 출시 연기또는 반대했었다는 사내신문내용을 언뜻 기억나네요~,미제I볼트I화성,2020-10-09 07:35:00
515621,지방에도 바디샵 계속 생기고 있어요....자잘한 문제는 업데이트로 왠만한건 다 해결되서...센터 갈일이 별로 없긴 합니다..부품수급이 좀 문제기느한데 나아지겠죠,수녕군IM3I서울,2020-10-08 23:45:00
515621,원래 물리적 파손 아니면 내연차도 센터 갈일 별로 없습니다 소모품 갈 일 없는 전기차야 당연 한거구요,편집광I오닉I경기,2020-10-09 09:26:00
515621,저도 똑같은 ......오토파일럿 하나로...단차고 나발이고 감수하고 타고 싶지만...지방중에....지방인 ..제주도라.....정비도 문제고~~더군다나..국내 전기충전기에 비해..제주도내에 롯데호텔이나 롯데시티호텔 말고는..슈퍼차져를 본적이 없고......(못본거일수도 있지만..)가장....그게 큰 문제여서 ㅠ,돈치I니로evI제주,2020-10-08 23:46:00
515621,어뎁터 있으면 완속이랑 차데모는 됩니다 ㅎㅎ,카위시II3모델SI충주,2020-10-08 23:50:00
515621,그생각을 못해서 ㅋ ㅋ ㅌ ㅋ ㅌ ㅌ,돈치I니로evI제주,2020-10-08 23:54:00
515621,편하게 타시려면 국내 전기차 구매가 정답 인 듯 해여 시간의 여유가 많으시면 테슬라도 고려 해보셔도 좋은데 한번 힘들어지면 대책이 업쥬 ㅜㅜ 그거 말고는 재미는 있는데... 오토파일럿 하니민 따져서 구매라 글쎄요?,잔디EV일산박성균,2020-10-08 23:49:00
515621,흉기의 불나 같은거용?,볼륨l코나l충남,2020-10-08 23:50:00
515621,테슬라도 불 났어요 모두 부속들이 중국산이다 보니 문제가 많은 듯합니다,잔디EV일산박성균,2020-10-08 23:51:00
515621,판매비율 대 불난거로 치면 비교가안되지않을까요,볼륨l코나l충남,2020-10-08 23:51:00
515621,테슬라 불난 거 200대? 코나 불난 거 12대?,잔디EV일산박성균,2020-10-09 07:29:00
515621,테슬라가 서있다가 불난게 200대라구여??,카위시II3모델SI충주,2020-10-09 00:05:00
515621,코나는 국내만 12대 아닌가여?,카위시II3모델SI충주,2020-10-09 00:05:00
515621,테슬라 부속이 모두 중국산아닙니다^^ 국내 만도에서도 납품하구요 가짜뉴스는 양산하지맙시다,NalwaI모델3I서울,2020-10-09 00:06:00
515621,네 만도 맞아요 ㅎㅎㅎ 중국산도 있구여 참 삼성도 있구 엘지도 있구 우리산업도 있어요,잔디EV일산박성균,2020-10-09 00:09:00
515621,코나 전세계 판매량 통털어서 12대 불났습니다캐나다 오스트리아 불난거 다 포함테슬라도 불났고 비엠i3도 불났고...,모야 l 코나ev l 인천,2020-10-09 00:32:00
515621,테슬라가 많이 팔았죠 200대? 불난 거 보니까,잔디EV일산박성균,2020-10-09 07:10:00
515621,테슬라가 200대나 불이났던가요,NalwaI모델3I서울,2020-10-08 23:56:00
515621,글게요,볼륨l코나l충남,2020-10-08 23:58:00
515621,가짜뉴스 양산하네요 불난건맞는데 200대여ㅛ으면 국내 난리났죠 ㅋㅋ,NalwaI모델3I서울,2020-10-09 00:05:00
515621,테슬라 불난적 없습니다,머신러닝I모델3I안양,2020-10-09 00:00:00
