post_id,cmt_content,cmt_author,cmt_created_at
515621,불났어요 국내는 말고.. 오토파일럿 믿다가 목숨 버린 사람들도 많구요 전기차의 지존은 테슬라 맞는데 다들 맹신하는 건지 참 그냥 편리한 교통수단일뿐 왜 들 그렇게 큰 의미를 부여하는지.. ㅎㅎ,잔디EV일산박성균,2020-10-09 00:03:00
515621,불난거 얘기하는데 굳이 왜 논점을 흐리는건지,볼륨l코나l충남,2020-10-09 00:22:00
515621,200대 불난 증거 뉴스 자료만 들고오시면 되지않을까요,볼륨l코나l충남,2020-10-09 00:22:00
515621,전 화재라는 언급이 없었는데 다른분이 국내전기차를 깍아 내리려고 한건지 화재건을 꺼내 한마디 한건디.. ㅋㅋ 자동차의 전장비 기술은 유럽보다 앞서 있다고 하니 좋네요,잔디EV일산박성균,2020-10-09 00:27:00
515621,ㅎㅎ 그런 쓸때 없는 일에 시간 낭비는 .....,잔디EV일산박성균,2020-10-09 00:28:00
515621,편하게 타는 국내전기차 라는거 부터가 잘못됬네요 그러면 편하게 타다 죽을 수 있는,볼륨l코나l충남,2020-10-09 00:29:00
515621,테슬라가 그랬죠 너무 맹신하다가 미국에서... 국내에는 아직 그정도는 안됩니다 도로 사정이 그렇지 못하구요 오토파일럿에 적합 하지 못하거든요,잔디EV일산박성균,2020-10-09 00:32:00
515621,편하게 타는거에 화재 요건은 들어갈텐데요 카페 코나 차주만봐도 아실텐데 뭐 여튼,볼륨l코나l충남,2020-10-09 00:32:00
515621,테슬라 불난거 많아요 기사 찾아보셈,모야 l 코나ev l 인천,2020-10-09 00:33:00
515621,편하게 타는 거라 ??? 코나 차주 ????,잔디EV일산박성균,2020-10-09 00:35:00
515621,똑같이 불이 났다고해도 문제가 있다고 해도 그렇게 논점을 흐리면 안되고 오파 맹신 이슈를 끌어와서 대강 호도해서도 안되는 겁니다. 님 화법이 좀 문제 있네요.,플라이어l테슬라l경기,2020-10-09 07:59:00
515621,,잔디EV일산박성균,2020-10-09 08:00:00
515621,오파 쓰다 죽은거는 개인 책임이죠 다른차 타다가 오파처럼 해보라하면 아무도 안하자나요 그정도로 오파가 잘만든거에요 물론 지속적인 교육으로 오파랑 치터를 못쓰게 해야겠지만 그건 별개라 봅니다 참 댓글에 문제가 많네요,카위시II3모델SI충주,2020-10-09 08:30:00
515621,저도 지방에서 as문제로 고민하다 출고후 오파한 후 (그동안 현대 스마트센스사용자임에도 불구하고) 테슬라 오파는 너무 믿음직 스럽고 안정되네요 한순간의 고민이 사라졌습니다,가제트l모델3l 구미,2020-10-09 00:29:00
515621,테슬라 불난건...교통사고(추돌 등)로 인한 화재까지 건수에 넣는거네요 ㅋㅋㅋㅋㅋ,아련다솜I테슬라l경북,2020-10-09 00:49:00
515621,테슬라 가만있는 충전 중 화재가 200건이라구요?????,PY,2020-10-09 01:08:00
515621,원인은 모르죠?,잔디EV일산박성균,2020-10-09 07:09:00
515621,https://cmobile.g-enews.com/view.php?ud=201906200828489678cef45333db_1&md=20190620111808_R한해 10건 이내인거 같은데...평소 말할때도 그냥 뇌속에 떠오른 망상을 확인없이 막 떠벌리고 다니시나요?,디오스 아이오닉 경남,2020-10-09 07:59:00
515621,네,잔디EV일산박성균,2020-10-09 07:59:00
515621,200대는 무슨 초딩이 아무말이나 하듯이하네요 테슬라에 허위사실로인한 영업방해건으로 법적조치 할수있게 해당댓글 테슬라쪽으로 보내겠습니다,파맨l모델3l경기,2020-10-09 02:07:00
515621,ㅎㅎㅎ 한글 아시면 좀 읽고 댓글 주시면 좋을거 같네요,잔디EV일산박성균,2020-10-09 07:12:00
515621,테슬라가 많이 팔았죠 200대? 불난 거 보니까 <- 본인이 이렇게 써놓고 뭘 한글타령하십니까 지금 테슬라200대 불탔다고해서 위쪽에 증거가져오라는거 안보이시나요,파맨l모델3l경기,2020-10-09 10:54:00
515621,요즘 여기에 알바 냥반들 마이 보입니다 암 열심히 살아야죠,통닭I모델SI서울,2020-10-09 05:10:00
515621,테슬라 구입하면 꼭 봐야 할 영상 입니다 우리 전기차는 소음 ㅜㅜ 칠 ㅜㅜ 이건 아닌거 같음 https://youtu.be/giqLuXSRgr4,잔디EV일산박성균,2020-10-09 07:08:00
515621,저유튜버 S타다가 3 또 샀습니다.... 왜일까요?,수녕군IM3I서울,2020-10-09 07:21:00
515621,"차가 좋아서가 아니라 재미가 쏠쏠 있고 테슬라를 국내에 기여한 바가 큽니다 저는 처음 할때부터 계속 봐 왔기 때문에 잘 알고 있습니다. 저분 첫 마디가 ""맹신 하지 마세요""",잔디EV일산박성균,2020-10-09 07:29:00
515621,"뭔 기여를 해요~ 대부분 유튜버는 그냥 유튜버로 보세요 협찬,광고, 돈벌이 등의 수단 중 하나입니다",수녕군IM3I서울,2020-10-09 07:30:00
515621,테슬라 유투버인데 코나를 살까요? ㅎㅎ,잔디EV일산박성균,2020-10-09 07:30:00
515621,차가 테슬라니 테슬라를 찍은거지 그전 B사 오너였고 차 바꾸면 그 차 위주로 찍는 분입니다 코나 유튜브 영상도 있고요,수녕군IM3I서울,2020-10-09 07:31:00
515621,예전 유투버는 재미로 하다가 유저들이 모여서 돈벌이로 변경 된거예요 지금 작정하고 유투버를 하지요,잔디EV일산박성균,2020-10-09 07:31:00
515621,우리가 그냥 저분을 통해 재미와 정보를 많이 알면 좋지 않을까요? 왜? 모두 색안경만 쓸까요?,잔디EV일산박성균,2020-10-09 07:33:00
515621,유튜버들이 왜 자극적으로 까는줄 아세요? 그게 조회수 겁나 잘나옵니다... 방음 겁나 까고 방음업체 협찬 포함되어있는게 대부분입니다,수녕군IM3I서울,2020-10-09 07:34:00
515621,그게 사업입니다,잔디EV일산박성균,2020-10-09 07:35:00
515621,재미로 보면 되는데 박성균님부터 재미로 안보시자나요ㅋ 테슬라 까면서...,수녕군IM3I서울,2020-10-09 07:35:00
515621,제가 테슬라를 절대 깍아 내리는게 아니라 다들 과잉 반응을 보이시는 거 같아요 ㅜㅜ 거참 논의와 댓글을 달 수가 없어요 싸움부터 하지고 덤비니... ㅜㅜ,잔디EV일산박성균,2020-10-09 07:38:00
515621,참고로 모델3 방음 안하면 못탈 차처럼 영상 뿌리고 방음 홍보하고.... 근데 정작 실 차량들 방음 테스트해보면 코나 니로 모델3 벤츠등 크게 처이 안납니다 이것도 하나하나 측정 한 유튜브 보시면 됩니다,수녕군IM3I서울,2020-10-09 07:38:00
515621,방음은 벤츠에 비교하면 안되죠 방음 승차감은 벤츠에 말히면 안될것 같구요,잔디EV일산박성균,2020-10-09 07:41:00
515621,유튜브에 방음 수치 비교해놓은거 보세요....테슬라 뿐만이 아니고 니로코나 포함 벤츠 대비 그리 나쁜 방음 아닙니다...,수녕군IM3I서울,2020-10-09 08:18:00
515621,테슬라는 그래도 방음 좋던데..코나는 방음 ㅜㅜ 기동성과 비즈니스로 타고 다니지만 소음 너무 올라와서 타이어교체 풍절음 차단 했죠 주말에 투아렉 타면 ㅎㅎㅎ 리무진 타는 기분입니다 엔진차지만 디젤이라 진동은 있어요,잔디EV일산박성균,2020-10-09 08:22:00
515621,미국에서는 지금 현제 테슬라 대앙마가 없어요 짧은 전기차 시장을 선도하고 있고 국내 업체 부품도 30%정도 납품도 하고 있어요,잔디EV일산박성균,2020-10-09 07:39:00
515621,님이 그 대항마를 만들려고 애매모호한 스탠스로 희안하고 이상한 말하고 다니나요? 언행이 참 신기하신 분이네요. 댓글 찬찬히 보니 왜 그러는지 납득이 잘안되는 언행을 일삼으시네요. 말하고자 하는게 뭡니까? 회사에서 일할 때 직원이 그런 식으로 말하는 사람이 있으면 개소리 말고 제대로 얘기하라고 갈굽니다.,플라이어l테슬라l경기,2020-10-09 08:08:00
515621,랜드로버 재규어 보세요. 차 타보면 좋은데 부품수급 그지같구 그래서 4개월걸린적도 있네요. 테슬라도. 랜드로버 as비슷한듯,나눔I볼트I인천,2020-10-09 11:08:00
515621,소프트웨어 업데이트가 신개념이죠.,대구I휘파람,2020-10-09 11:42:00
515621,코나도 수리 받는데 2~3주 걸리던데요?,모삼I모델3I대전,2020-10-10 14:21:00
515621,바꾸고 싶네요,오늘I코나evI대전,2020-10-15 01:38:00
515614,대기업과 단체소송 몇번했지만 이겨본적이 없네요,레몬I코나I경기,2020-10-08 23:41:00
515614,저분 현대차 급발진 소송도 몇건 맡은 유명한 변호사라고 들었는데 의외네요....,너밖에없다I코나I광양,2020-10-08 23:41:00
515614,동의합니다. 믿을만한 법인에 맡겨서 진행해야 할 것 같습니다.,지쓱I불나I경기도,2020-10-08 23:53:00
515614,승산이 있는걸까요?,하루l꼬나l평택,2020-10-09 00:06:00
515614,정말 소송의 소자도 모르는데 이런글이 너무나 힘이 되네요 👍,베비로션l코나l서울,2020-10-09 00:15:00
515608,그렇죠 이런답변이 나와야 하는데.. 다들 다시 현기로 돌아오니..ㅜㅜ,병욱I아이오닉I서울,2020-10-08 23:21:00
515608,전기차 산사람이 레알로 유료 베타테스터 였고 레알로 전기차는 시기상조 였네요ㅜ,마션l니로I서울,2020-10-08 23:23:00
515608,국내 고객은 개호구죠징벌적인 천문학적 손해배상이 없으니까요,행복한부자I코나I세종,2020-10-08 23:24:00
515608,양아치 같은 기업... 화납니다.,전기맨l코나l대구,2020-10-08 23:26:00
515608,저에게는 현기는 없습니다,추자l볼트evl경기,2020-10-08 23:30:00
515608,GDI 그 난리나도9월 판매순위 보시면...,수녕군IM3I서울,2020-10-08 23:33:00
515608,시기상조였죠ㅠㅠ gdi도 그 문제 후 안정화 되고ㅠㅠ 아직 품질 분석 능력이 많이 떨어지네요,펀투펀I리프I경남,2020-10-08 23:37:00
515608,앞으론 쳐다도 안봅니다,부평l코나l크린토피아,2020-10-08 23:46:00
515608,내연기관차도 이제 안삽니다. 아들차도요,빗물 코나전북,2020-10-09 00:12:00
515608,여러번경험해보니 괘씸해서 현기는거르게되더라고요ㅠ,니니I모델3I원주,2020-10-09 00:37:00
515608,다음 번 전기차는 테슬라 갑니자,예비ㅣ오닉ㅣ대전,2020-10-09 00:39:00
515608,정뚝떨입니다.,경로당회장I코나I인천,2020-10-09 00:43:00
515608,NE나오면 언제그랬나 금방수그러들것같습니다.,가츠lD2l완주,2020-10-09 00:56:00
515608,현기 차는 레알 아닌 듯,슈가맨,2020-10-09 04:44:00
515608,계속사주니 저러는거죠 나같아도 대충대충할듯 그래도 사주니까,통닭I모델SI서울,2020-10-09 05:12:00
515608,그래도 또 사니깐 ㅋㅋㅋ,멜론s,2020-10-09 07:33:00
515608,독과점체제라 ㅜ 이모든 악습에 단초는 현대에 기아차인수에~~,미제I볼트I화성,2020-10-09 07:39:00
515608,테슬라 ㄱㄱ,연군ㅣ볼트ㅣ경기,2020-10-09 12:28:00
515578,정확한 원인후 조치 및 보상안이 있어야 겠지요,쿠쿠짱I모델3I경기,2020-10-08 22:35:00
515553,리콜? 아니죠~,키덜트여ㅣ코나ㅣ광주,2020-10-08 21:04:00
515553,배터리 교체인가요? ㅠ,대박맘I코나I강원,2020-10-08 21:06:00
515553,교체 아녀요~ 불나는지 감시업데이트요,킴스봉I코나I대구,2020-10-08 21:08:00
515553,손 놓고 있지는 않으니 기다려 봄 어찌 하려는지 알겠죠. 좋게 결론났음 좋겠네요. 불안해 살수가 없네요,대박맘I코나I강원,2020-10-08 21:16:00
515553,이게비단 코나문제만이 아니고 현기차량들 최근출시차량 화재건 많은데 판매대수 대비 코나가 비율이 높죠 그리고 코나가 이슈인건 차 컨텐츠 유툽분들 입김이 쌔서?ㅋ인거 같습니다,킴스봉I코나I대구,2020-10-08 21:28:00
515553,진짜 이번에 제대로 처리 안해줌 단체 행동 개시해야 할거 같습니다~~ 해주리라 믿고 싶네요~~ 해줘야 하는데 말입죠,대박맘I코나I강원,2020-10-08 21:37:00
515553,,대박맘I코나I강원,2020-10-08 21:07:00
515553,발견 못함 배터리 교체 안해주는건가요?,대박맘I코나I강원,2020-10-08 21:08:00
515553,네 안해준다네요,키덜트여ㅣ코나ㅣ광주,2020-10-08 21:08:00
515553,그래도 뉴스까지 나왔는데 뭔가 움직이려니 어찌라나 기다려 봐야겠네요,대박맘I코나I강원,2020-10-08 21:15:00
515553,저러고 또 불나봐야 정신 차리죠. 내 이제부터 현대차 사면 사람새끼가 아닙니다,꿀주먹ㅣ코나ㅣ위례,2020-10-08 21:15:00
515553,큰일 치루기 전에 좋게 해결해야 할텐데요. 회사 이미지도 있는데 그냥은 안넘어가지 않을까요?,대박맘I코나I강원,2020-10-08 21:17:00
515553,이미지가 이런 양아치 이미지 아닌가요? 혹시 했는데 역시인것 같네요,근육이IKEI서울,2020-10-08 22:20:00
515553,https://n.news.naver.com/article/028/0002515640?cds=news_edit 양아치 맞나봐요 ㅠ,대박맘I코나I강원,2020-10-08 22:28:00
515553,어짜피 이렇게한다고 해서 불이안나진 않을탠데 걱정이네요,하늘I코나EVI인천,2020-10-08 21:20:00
515553,걱정이네요. 불난 기사보고 차안에 보관하던 귀중품 빼두고ㅠㅠ 뭐하는 짓인지요ㅠ,대박맘I코나I강원,2020-10-08 21:22:00
515553,그러게요~~ 운행정지 떨어질까 무지 걱정됩니다.,근육이IKEI서울,2020-10-08 22:21:00
515553,이에 무슨 리콜인지 모르겠네요위험성이 있으면 교체을.해야지 국내에서는 맨날 리콜이라고 고장 난 차만 수리해 주는 식이지요.,파우워I포터I경남,2020-10-08 21:23:00
515553,가기전 고장을 내고 가야하나 싶네요. 자세히 읽어보니 말장난 했네요. 현대의 앞으로의 조치를 믿고 싶네요,대박맘I코나I강원,2020-10-08 21:25:00
515553,현대코나외에 다른차종은 괜찮은가요?,현이박,2020-10-08 21:31:00
515553,글쎄요...,대박맘I코나I강원,2020-10-08 22:46:00
515553,불이날 상황인지 알려주는 업데이트네요 ㅋ,동동l모델3l서울,2020-10-08 21:38:00
515553,ㅋㅋ 기술력이죠,연군ㅣ볼트ㅣ경기,2020-10-08 22:18:00
515553,정떨어지네요.,황소박ㅣ코나ㅣ구미,2020-10-08 22:04:00
515553,팔고 싶네요ㅠ,대박맘I코나I강원,2020-10-08 22:35:00
515553,역시 테슬라가 가장 안정적인듯,M3 I 모델3 I 서울,2020-10-08 22:37:00
515553,인정요,대박맘I코나I강원,2020-10-08 22:40:00
515553,지들이 잘못해놓고 오라가라에요.,경로당회장I코나I인천,2020-10-09 00:45:00
515553,차가 아니라 상전입니다ㅠ,대박맘I코나I강원,2020-10-09 07:06:00
515553,안타깝네요. 오닉인 그나마 이상이 없는게 현대측에선 최후방어선? 다행이 아닌가 싶습니다.,미래I아이오닉I서울,2020-10-09 06:18:00
515543,좋은방법이네요~현대는 최소금액으로 무마할려고 하는데..,코나주인l 세종,2020-10-08 20:54:00
515543,ㅋㅋㅋ,흔한사람코나경기,2020-10-09 00:29:00
515543,"혹시 sk 배터리로 교체 했는데 코나에서 또 화재가 발생하면 상황이 어떻게 정리가 될지? 비록 배터리 회사가 다른 전기차 운행자지만, 전기차 화재 관련 뉴스가 나오면 아는 지인들한테서 넌 살아 있나?라고 연락 받습니다. 백퍼센트 완벽한 차는 없겠지만, 현대의 대응을 보면 다음 전기차는 글쎄요.",봉장군니로부산,2020-10-09 02:02:00
515539,sm3 삼성에서 만들었는데 폭망이고 르노에서 유럽시장 휩쓴 조에는 삼성이름 배제하고 들어와서 걍 르노 조에지요,바람사자I볼트EVl부경,2020-10-08 20:41:00
515539,그 삼성 말고 핸드폰 만드는 삼성전자 아닌가요?ㅋ,코나l코나I성남,2020-10-08 20:56:00
515539,삼성자동차가 르노삼성에 넘어간건 2000년이고 sm3는 르노삼성이 2003년 만든차입니다. 삼성이 관여한차가 아니죠 초기에는 닛산차 그 이후에는 르노차 플랫폼 가져와서 팔았습니다,스마일I코나I전북남원,2020-10-08 20:58:00
515539,르노삼성의 한국지분 많은 부분을 삼성전자와 이건희가 가지고 있고 삼성차는 이병철유지로 삼성그룹전체에서 사활을 걸고 진행했던 사업입니다.,바람사자I볼트EVl부경,2020-10-08 20:59:00
515539,sm3 ze 삼성전자가 많은 부분 참여하고 부산시에서 밀어줘서 만든차로 알고 있습니다.,바람사자I볼트EVl부경,2020-10-08 21:01:00
515539,lg쪽에서만들면좋겟습니다..ㅎㅎ,빵빵 I i3 l부산,2020-10-08 20:50:00
515539,삼성 무노조 정책이 좋으신가요?,이샘SM3코나포터제주,2020-10-08 21:01:00
515539,"갤럭시 노트7 사건을 잘 기억 못하시나요? 마침 말나온 김에 당시 사태를 보자하니, 지금 코나 화재랑 아주 비슷한 흐름이네요",빛틀I니로I대전,2020-10-08 21:12:00
515539,낳다?가 뭡니까?삼성도 불나서 난리였는데 대처가 빨랐고현대는 미적거리다 뒤지네요,쏭윤이ㅣ코나ㅣ전북,2020-10-08 21:18:00
515539,삼성이라면 현대처럼 방관하지 않고 적극 해결하였을듯~삼성이 전기차를 디자인도 이쁘게 잘만들면 담차는 삼성~~,코나주인l 세종,2020-10-08 21:18:00
515539,삼성이 만들면 다를거다라는 믿음을 가진 충성고객층을 믿고 삼성자동차사업을 출범했는데 폭망했지요.부산사람이라 삼성차 역사를 좀 아는데 삼성차가 현대만 아니었슴 10년정도 일찍 출범하고 한국차 빅4 체제로 갔을꺼에요.현대가 시장을 거의 독점하다싶이 하게 만들어 주는것도 굉장히 않좋은 일입니다.,바람사자I볼트EVl부경,2020-10-08 21:32:00
515539,"음...사실 삼성차는 부산에 공장 만들어서 경쟁력이 떨어졌죠. 공장부지도 4배이상 비싸게 샀고 제철소 옆에 지은것도 아니어서 원가 경쟁력이 별로였어요. 원래는 다른곳으로 해서 공장 설립 허가 안났는데 YS의 고향인 부산에 짓겠다고 해서, 허가가 났죠.",아조씨I볼트I전북,2020-10-08 22:11:00
515539,현대 기아 대우의 반대로 허가를 못해주고 있는데 삼성측에서 부산에 공장을 만들어 주겠다는 카드로 YS를 꼬셔서 허가를 받아낸것입니다. 삼성이 부산에 공장 만든 덕분에 망하기 직전에도 여러번 회생했습니다. 삼성차공장에서 부산항 자동차부두까지 5분거리라 수출도 용이하구요. 현 삼성차 공장이 문을 닫지않는게 위치상 유리한점도 작용합니다.,바람사자I볼트EVl부경,2020-10-08 22:48:00
515539,삼성에서는 절대 전기차 팔지 않을껍니다~~ 단순히 핸드폰하고 반도체로만해도 먹고살거든요~~~,가리짱I볼트I충남,2020-10-09 01:46:00
515527,뒷북 기사네요. LG에서는 아니라고 합니다.,땅콩I볼트evI서울,2020-10-08 20:13:00
515527,결국은 냉각수는 교체 안해주네요,현대코나 대구,2020-10-08 20:16:00
515527,돈 들잖아요 23만원....,소마l코나l서울,2020-10-08 21:48:00
515527,그러게요 ㅠㅠ,현대코나 대구,2020-10-08 21:49:00
515527,코나 판매한 현대 제조사 책임이쥬~~,오뚜기l코나l포항,2020-10-08 20:17:00
515527,현대야 꼭 조치 바랍니다,비와바람I코나I대구,2020-10-08 20:28:00
515527,해결이 잘돼야 할텐데요,망망이4,2020-10-09 11:09:00
515512,걍 다 바꿔주지......소비자 입장과 업체 입장이 이렇게 다른가? ㅠㅠㅠㅠ,왕게임짱ㅣ코나ㅣ서울,2020-10-08 19:34:00
515512,기아전기차보다 못한 기술력입니다.,코나주인l 세종,2020-10-08 20:14:00
515506,중국차는 더해요ㅋㅋㅋㅋㅋ 엔진오일 떡지고 난리도 아닙니다ㅠㅠ 다음은 독일차로......,너밖에없다I코나I광양,2020-10-08 19:17:00
515506,동지 잘가요.. 멀리는못가요...,초보l니로l옥천,2020-10-08 19:19:00
515506,"저도 공감합니다. 아무리 테슬라 단차에, 루프 날아가도 배터리 화재나, 배터리 용접 크랙은 없잖아요, 전기차에서 제일 중요한게 배터리인데 배터리 커버는 달려 있잖아요. 그리고 현기가 as 좋다는데 이번에 리콜사건과 배터리 크랙으로 인한 국내 소비자 기만 행위를 보면 그런것도 아닌것 같습니다. 배터리 용접 크랙 소비자에게 책임을 전가하고 2000만원이 넘는 수리비용을 청구하는 제조사를 어떻게 믿을 수 있을까요?",도브맨I니로I경기,2020-10-08 19:21:00
515506,BMW i3 로 오세요~ 주행거리는 좀 짧지만~전 지금 출퇴근 거리가 줄어들어 i3 를 팔아야 될 상황인데차가 너무 맘에 들어 팔기싫어서 계속 몰고 있습니다.,서펜하우어Ii3I인천,2020-10-08 19:24:00
515506,부럽습니다 니로.... 코나는 중고차 감가 현대한테 다 후드려 맞아서 팔지도 못하네요..,지쓱I불나I경기도,2020-10-08 19:34:00
515506,아 짜증 불자동차버리고 경운기나 타야하나 털털털,추수수ㅣ코나ㅣ대전,2020-10-08 21:58:00
515506,볼트도 단차 있죠... 미국감성인가 하고 그냥 탑니다..ㅠㅠ,땅콩I볼트evI서울,2020-10-08 22:11:00
515506,미국 수입차들에게 단차는 친구와 같은 존재입니다^^주차장 다니면서 미국차 있으면 자세히 보세요^___^전 생각없이 국산차 타다가 테슬라 단차에 대해 알았고 그냥 탔는데 주변 수입차들 보니 뭐....단차는 친구같은 존재 더라구요ㅋ,수녕군IM3I서울,2020-10-08 23:27:00
515506,테슬라는 휴대폰으로충전 모니터링 됩니다,머신러닝I모델3I안양,2020-10-09 00:04:00
515506,테슬이는 그냥 마음 비우고 탑니다..,팝콘I테슬라I김해,2020-10-09 09:23:00
515501,불난후에 끄는 방법이 없죠 밧데리는 불붙으면 잘안꺼집니다,칼라인l니로EVl경기,2020-10-08 19:16:00
515501,"글쵸.. 전기차 화재는 전기 끊어내는것 부터 시작해서 , 탈 부분이 다 탈때까지 어찌하질 못하죠.",동글이ㅣ성남분당,2020-10-08 19:17:00
515501,그냥 연기나면 냅두세요... 불나면 현대에서 업그레이드 적용된 차로 다 바꿔주고..주변 피해 본거 다 변상해 주고....막말로 오너는 금전적 피해 볼 일 업없죠 뭐.......그나저나....... 걍 다 바꿔주지...실망.`~~,왕게임짱ㅣ코나ㅣ서울,2020-10-08 19:40:00
515501,이렇게 수고롭게까지 해야하나 싶습니다 너무 화가나네요,코코넛 코나 대전,2020-10-08 19:54:00
515501,앗! 죄송한데요 제가 잘 몰라서요 2020년6월 출고차량인데요 (코나ev ) 이 차량은 해당없는건가요? ;;;;;;;,아리쩡I코나I경기,2020-10-08 20:13:00
515501,20년3월 차량까지만 이라고하네요,대장I코나I대구,2020-10-08 22:33:00
515495,모든 전기차는 잠재적..,병욱I아이오닉I서울,2020-10-08 18:58:00
515495,살얼음판,장풍이I무I부산,2020-10-08 19:00:00
515495,그렇군요ㅜㅜ,키덜트여ㅣ코나ㅣ광주,2020-10-08 19:01:00
515495,아이오닉은 판매대수가 적습니다알수없지요,핑크코나울산,2020-10-08 19:02:00
515495,흉기는 피하는게,볼륨l코나l충남,2020-10-08 19:05:00
515495,"볼트,조에..수입차 좋죠^^",병욱I아이오닉I서울,2020-10-08 19:11:00
515495,상대적(?)으로 안전한 차입니다,상판I아이오닉I대전,2020-10-08 20:16:00
515495,아이오닉은 잘 만들어진 차라고 생각해요 젤 첫 전기차이기도하고 이미 2세대라서 .. 배터리도 아시겠지만 밑에 풀로 커버장착되어있습니다..,빅토린I아이오닉I시흥,2020-10-09 09:01:00
515492,적극적으로 대응안하게 되면 적어 놓으신 글대로 될듯합니다.--;,초심으로I오닉I서울,2020-10-08 19:51:00
