post_id,cmt_content,cmt_author,cmt_created_at
513026,차량의 무게가 달라서 그런거에요~~ 현대나 기아나 어차피 남양연구소에서 나오는 머리로 만드는 차 이니깐요...,근육이IKEI서울,2020-10-04 13:55:00
513026,개씨x 진짜 차를 어떻게 만드는건지,닐닐I코나I대구,2020-10-04 10:42:00
513026,"제 경험으로 봤을때 80%나 90%충전 설정해놔도 이를 무시하고 설정목표치를 넘어서 계속 충전되는 경우가 있더라구요, 중간에 확인하고 직접 중단시켜서 충전끝냈어요. 차의 문제인지 충전기의 문제인지 오버차징되는 현상이 몇번있었던건 제 경험이고 사실입니다이를 비추어 봤을때, 100%설정해났더라면 그 이상으로 한계점 이상으로 오버차징될 수 도 있겠지요 그래서 아마 불나고 터지고 하는게 아닐까 생각해봅니다.",캐롤I코나I인천,2020-10-04 11:05:00
513026,그게 원인이라면 많은돈 드는게 아니니.. 현대에서 쉽게 해결을 했을것 같아요... BMS 업데이트 이후에도 화재가 나는것 보면 현대에서도 쉽게 해결하지 못하는 문제이거나 원인을 못 찾고 있는것 같다는 생각이 드네요,근육이IKEI서울,2020-10-04 13:57:00
513026,배터리 문제라면 아이오닉에도 화재가 발생해야 하는데 코나만 발생하는 것을 보니 배터리를 어거지로 꾸겨넣었기 때문 아닐까요?,상판ㅣ대전,2020-10-04 11:35:00
513026,90%만 충전하면 소비자의 권리 10%를 포기하는 것입니다.저는 100% 충전하구 만약 화재 난다면 200% 보상 요구 하렵니다.,이티I코나I남양주,2020-10-04 11:56:00
513026,BmS 업데이트 하면서 물건너 갔어요~~ 제차 업그레이드 하기전에 81프로 였는데 업그레이드 하고 나선 85프로로 늘어나 있더라구요...,근육이IKEI서울,2020-10-04 14:00:00
513026,아무래도 100% 충전보다는 90%충전이 나을듯 싶어요 ...,히또미l코나l성남,2020-10-04 14:37:00
513026,제2의 불차,푸로I서울,2020-10-04 18:34:00
513025,대체자들이 잘나오면 진짜 고민해봐야겠어요....,푸별I예정I제주,2020-10-04 10:18:00
513025,그러게요 니로도 엄청많이 팔렸는데...,푸별I예정I제주,2020-10-04 10:17:00
513025,"명장님이 말씀한데로 끝까지 원인을 찾아 추긍을 하여 현기에서 대응을 해줘야합니다.이상태로 유지하면 아이오닉5, CV 다망할겁니다.(똑같은 베터리 실정일 것임.. 전기차플렛폼이 중요하다는게 느껴지며 이게 테슬러가 잘나가는 원인이죠)",헤븐온즈I서울,2020-10-04 10:04:00
513025,아이오닉5에 기대가 많은데...y로 가야하나 ㅠ 연말까지 현기에서 답변잘나왔으면좋겠네요 묻고 넘어가면 심히고민해봐야겠어요,푸별I예정I제주,2020-10-04 10:17:00
513025,이렇게 넘어가면 다음차도 모르는거죠이럴수도 우리는 베터리카바없이도 튼튼하다고 근데 데미지나면 고객과실이라고 처음부터 안전하게 만들고 고객과실이라고 해야지 뭐만문제면 고객과실이렇게 생각하면 차안사고 대중교통이 좋아요.,헤븐온즈I서울,2020-10-04 10:22:00
513025,저도 현재 조용차를 원하고 있는데 외제차는 자금력때문에 넥쏘살까 생각중에요.,헤븐온즈I서울,2020-10-04 10:25:00
513025,음.. 뽑기 실패라고 하기엔 너무 잦은 화재로군요,송호영I니로,2020-10-04 10:08:00
513025,하루가 다르게나오니... 뽑기는 아닌거 같아요... 핸드폰 화재보다 잦은거같은데...,푸별I예정I제주,2020-10-04 10:19:00
513025,배터리하부 긁힘문제도 그렇고 솔직히 현대차는 아직인듯 싶습니다,코일I경기,2020-10-04 10:13:00
513025,현대에서 잘대응해서 국내도 신경써줬으면 좋겠네요...,푸별I예정I제주,2020-10-04 10:19:00
513025,"오닉., 코나 다음은 오닉5 아님 gv80 ev가려는데.. y로... 고민됩니다... 코나 크랙 당첨자 입니다. 은박 테입 발랐어요. ㅎㅎ",슈나이더I오닉COI부산,2020-10-04 10:24:00
513025,현대도 문제지만 그걸 손놓고 있는 국토부도 정말 문젭니다,던힐I코나I경남,2020-10-04 10:26:00
513025,불타는 전기차라는 오명이 없길 바래봅니다.주차하면서 옆차 신경많이 쓸듯..한심한 현대자동차 대응..전기차유저가 봉인가..,코나주인l 세종,2020-10-04 10:29:00
513025,전기차 구입하고 나서 집사람한테 야단만 듣고 있어요,어쩌다어른 코나 천안,2020-10-04 17:18:00
513024,이번에도 코나 였나요?,꿀꿀이l코나l경북,2020-10-04 09:54:00
513024,코나에요ㅜㅜ,창세기I미정I인천,2020-10-04 09:55:00
513024,ㅜㅜ,꿀꿀이l코나l경북,2020-10-04 09:55:00
513024,"아니 어떻게 맨날 코나만 불나죠? 니로, 쏘울, 아이오닉, 레이 모두 같은 현대차연구소에서 개발한 건데요...",볶음밥I니로I오산,2020-10-04 09:58:00
513024,학자로써 오너로써 함께 풀어보고 싶은데 접근이 쉽지 않네요,차칸인I코나I대구,2020-10-04 09:59:00
513024,이미 지나간 사건인 삼성 갤럭시노트7 화재사건 원인을 찾아보세요. 공통점이 있는듯 보입니다.,shrikeI볼트I서울,2020-10-04 10:21:00
513024,주로 운행 중인 코나EV와 최근 연구용으로 여기 동호회 좋은분과의 거래로 레이EV 추가해 운행 중이고 연구용으로 니로EV와 레이EV를 가지고 연구 중입니다만 다양한 조건으로 연구 중이지만 현재 제가 가진 차량들에서는 특이점이 발견되지 않고 있습니다.화재 발생과 관련해 차량 충전상태에서 배터리 모듈과 버스바 등의 온도를 측정하고 있는데 이상 증상을 가지거나 점검 등을 하고 싶어하는 분들과 어떻게 만나고 어떤 점검등을 드릴수 있을지 고민 중입니다.더구나 제 학교가 대구이고 저도 대구에 살다보니 멀리 가는것에는 부담이 있기도 하구요...,차칸인I코나I대구,2020-10-04 10:29:00
513024,전 드론배터리를 직접 제작하기에 배터리공부를 많이하는데 BMS 의 대다수가 그리 신뢰성이 좋지못합니다. 전압측정값에 오차가 크거나 제때 못끊어주거나 온도영향을 많이받거나 전자기파의 영향을 받거나 아니면 부품불량으로 인한 문제등.... 숟하죠.때문에 전동킥보드나 전기자전거의 화재도 대개 거기에서 비롯되죠.코나 역시도 원인이 대개 비슷한걸볼때 유사한 원인이 아닐까 싶습니다. 저라면 배터리셀과 BMS 인아웃 사이에 전압전류체커를 여러개 박아놓고 온도변화 시간변화 상황변화에 따른 BMS의 동작신뢰성 데이터를 확보해보겠습니다. 시트를 장시간 쭈욱 빼놓고 다른 전기차의 그것과 비교해보면 답이 나올것같거든요.제가 몰고다니는 볼트는 여러모로 BMS가 보수적입니다. BMS 라는놈이 애초에 믿기힘든놈이라는걸 전제로 설계할때부터 충전속도와 성능을 쭈욱 떨궈버렸죠. 배터리 온도조절장치도 코나만큼 빠듯하게 움직이질 않고 여유폭이 큽니다.,shrikeI볼트I서울,2020-10-04 14:25:00
513024,네 좋은 말씀 감사합니다 참고하겠습니다,차칸인I코나I대구,2020-10-04 14:28:00
513024,국과수 들어가도 결론은 이미 정해져 있을겁니다. 1. 블박 2. 충전기 결함,아돌I구입예정I부산,2020-10-04 10:00:00
513024,대응 매뉴얼이군요~,창세기I미정I인천,2020-10-04 10:29:00
513024,"단정짓는것도, 정확한 원인발표도, 오너들이 수긍할 수 있어야 겠지요",차칸인I코나I대구,2020-10-04 10:30:00
513024,그렇죠. 국과수는 당연히 화재로 인해 손상이 심해 ‘원인 불명’ 딱 현기가 원하는 레파토리겠죠. 대한민국 1-2년 산거 아니잖아요?,아돌I구입예정I부산,2020-10-04 10:35:00
513024,그것이 우리가 상식이라고 말하는 것들이죠. 누군가는 그 상식대로 행동하지 않는것이구요,아돌I구입예정I부산,2020-10-04 10:37:00
513024,실제로 블박배선문제가 꽤 있을겁니다. 제차 출고해서 블박배선 해놓은거보고 기겁했거든요.불나는게 정상인 수준입니다. 업자들한테 맏겨놓을일이 아니더군요.,shrikeI볼트I서울,2020-10-04 14:30:00
513024,"정말 블박배선 문제가 꽤 있다면, 타 차종 불문하고 화재가 다발적으로 나야 되지 않을까요? 게다가 코나는 영상에서도 뒷바퀴 하부? 쪽에서 검은연기가 뿜다가 화재로 시작된게 명확하게 나왔죠. 코나의 경우 대부분 뒷바퀴 하부쪽에서 시작된 영상이 확보되었죠. 자동차 블박 결선 품질문제야 빌트인캠이 거의 나오지 않는 이상 블박 차량 전반적으로 발생해야 하는데 코나만큼은 아니겠죠",아돌I구입예정I부산,2020-10-04 15:01:00
513024,실제로 온갖 차들에서 블박배선문제로 화재가 발생합니다. 블박뿐만아니라 업자들이 유사한 배선작업 개x 쳐놔서 그런일들 많이 터지죠.때문에 자동차회사들로서는 편리한 변명인 셈입니다. 여기에서도 몇건 봤습니다.화재시작지점은 CCTV 로 명확하게 찍히기전에는 분명하게 알기 힘듭니다.,shrikeI볼트I서울,2020-10-04 15:48:00
513024,블박이 문제가 없을리는 만무하겠지만 실제 배선합선등의 문제는 블박외 기타 여러 장치들을 튜닝하면서 많이 생기죠. 블박배선으로 추정할려면 cctv에 명확하게 나와야 되는데 배선자체가 핸들밑 퓨즈박스가 다라서 판단하기가 어렵겠지요. 코나 같은경우는 명확하게 나왔죠. 참고 사진 화재 위치를 보면 블박이라고 보기 매우 어려운 상황인데 그냥 블박이라고 밀어붙이니 말이 안되는거죠,아돌I구입예정I부산,2020-10-04 16:02:00
513024,코나는 명백히 차량의 결함문제가 맞습니다.https://en.wikipedia.org/wiki/Plug-in_electric_vehicle_fire_incidents전기차화재는 중국에서 많이 발생중인데 패턴이 코나와 비슷합니다.,shrikeI볼트I서울,2020-10-04 16:14:00
513024,아직 인도 안하셨으면 코나는 해지할거 같습니다. 중고차 가격 하락도 심할겁니다.,미키lVOLTTM3l서울,2020-10-04 10:14:00
513024,계약 해지 해야겠어요ㅜㅜ,창세기I미정I인천,2020-10-04 10:28:00
513024,저는 괜찮을거 같아서 샀지만 한달사이에 갑자기 이렇게 발생하는거 보니 절대 추천하고 싶지 않네요.,윈드로머I코나I경기,2020-10-04 10:28:00
513024,숙고하겠습니다.,창세기I미정I인천,2020-10-04 10:34:00
513024,코나 안사시면되죠. 45ev사세요. 아님볼트 사시던가요. 불날까봐 불안에 떨면서 충전하는거보다 다른차 사는게 좋죠. 볼트 신형 사세요,모히또l볼트l창원,2020-10-04 10:31:00
513024,45는 가격이 비쌀 듯해서요.,창세기I미정I인천,2020-10-04 10:31:00
513024,앞으로 구입시 신중해야겠죠..현대가 좋을것 같다는 생각이 떠나고 있습니다,코나주인l 세종,2020-10-04 10:31:00
513024,볼트 타는데 옵션빼고 좋습니다. 태생이 전기차 베이스로 만든 차랑 내연기관베이스랑은 차이가 납니다.,모히또l볼트l창원,2020-10-04 10:33:00
513024,현대차 절대 인정 안합니다..,코나주인l 세종,2020-10-04 10:30:00
513024,에고~ 전기차 접어야 겠네요,창세기I미정I인천,2020-10-04 10:33:00
513024,현기 전기차 미래보고ㅡ 주식 투자했는데.. 이따구면..손절해야겠어요. 제차량도 불안..불만인데..뭔 기대를..,슈나이더I오닉COI부산,2020-10-04 10:32:00
513024,손절이 더 급하네요~~,창세기I미정I인천,2020-10-04 10:33:00
513024,현대차는 시기상조 입니다... ㅡㅡ,모3ll단점만말한다,2020-10-04 12:23:00
513024,ㅠ.ㅠ..걱정이 앞서네요..,히또미l코나l성남,2020-10-04 14:31:00
512995,또 코나면 진짜 설계결함이거나 그런것일듯,송호영I니로,2020-10-04 07:12:00
512995,현대가 인정하려나요....,효율I남원,2020-10-04 09:17:00
512995,절대 안하죠. 제일 먼저 블박이 달려있나 안달려 있나 보러 올겁니다. 블박이 없으면 전기차 충전시설 문제니 아파트에서 알아서 해결하라라고 해야되거든요.,아돌I구입예정I부산,2020-10-04 09:31:00
512987,전기차 인식이 점점 안좋아지겠네요.,버스메트로워크,2020-10-04 03:29:00
512987,안그래도 주변에서 들리는 말이 많이 안좋네요.... 전기차주라서 죄인이 된 느낌입니다....,쏘밍파I아이오닉I대구,2020-10-04 03:33:00
512987,현대 코나만 그래요,마징가마징가마징가,2020-10-04 17:34:00
512987,코나가 왜이런대요???하부 밧테리 보호판도 빨리 리콜조치해야는데말입니다,헐레벌떡I코나I서울,2020-10-05 19:12:00
512987,화재는 진압 되었다합니다. 아직은 매연으로 인한 질식 우려로 지하주차장 출입 제한되고 있습니다.,쏘밍파I아이오닉I대구,2020-10-04 03:35:00
512987,자다가 날벼락이군요ㅠ,파랑찍찍l구오닉l청주,2020-10-04 03:37:00
512987,헐.. 별일없으시길.,추워요1SM31대전,2020-10-04 03:37:00
512987,전기차에서 화재가 발생한건가요?충전중 그런건지.....;이게 무슨일이래유,아산꼬꼬l니로l아산,2020-10-04 03:44:00
512987,완속충전 중 화재발생으로 파악되네요. 차종은 아직 모르겠고요.,쏘밍파I아이오닉I대구,2020-10-04 03:56:00
512987,헐...이게 무슨일인가요 ㅠㅠ 혹시 또..코...??? 아직 차종은 모르시는거죠? ㅠㅠ,럽이다I코나EVI평택,2020-10-04 03:44:00
512987,또 코나랍니다 이번이 20번째ᆢ,전기차서울,2020-10-04 22:35:00
512987,12번째 입니다,쉬드I코나I대구,2020-10-04 22:41:00
512987,뉴스에서 20번째라고 발표했어요,전기차서울,2020-10-04 23:59:00
512987,민중의 소리만 20번째라고 발표 했고요 나머지 전부다 12번째로 발표중입니다,쉬드I코나I대구,2020-10-05 00:01:00
512987,코나 문제가 크군요,불룩벨리I쏘울EVI강남,2020-10-05 09:07:00
512987,아이고 날벼락!!!,은우빠빠I모델3I인천,2020-10-04 03:45:00
512987,아직 차종은 파악이 안되네요. 관리사무소에서도 알려주지 않고요. 확인되면 내용 공유 드리겠습니다.,쏘밍파I아이오닉I대구,2020-10-04 03:48:00
512987,아이고 이런..,가을나그네오닉밀먕,2020-10-04 08:51:00
512987,전기차 인식이 안좋아지겟네여..코나라고 하면.. 진짜 문제 잇는것 같은데...,달심I코나I광주,2020-10-04 03:50:00
512987,코나네요...,쏘밍파I아이오닉I대구,2020-10-04 08:49:00
512987,또 코나라면 심각하네요 이제는 지하주차장 주차 해서 충전하기도 신경이 쓰이네요 집밥도 지하주차장 밖에 없어 지하주차장에서만 가능한데.,꿀동이I코나l대구,2020-10-04 05:46:00
512987,차량은 코나 맞습니다. 저는 한동안 집밥 불가능 확정이네요,쏘밍파I아이오닉I대구,2020-10-04 08:50:00
512987,현대기아의 미래를위해 리콜 하기 바랍니다!,니로 유홍초 고령,2020-10-04 05:49:00
512987,지금도 차종을 알수가 없어요 진짜 코나면 ! !,놀던병아리 코나 서울,2020-10-04 05:58:00
512987,오너는 잠 자기전 차 충전기 꼽아놓은게 전부인데 이런경우 불이나서 화재 또는 연기로 인한 주변차량 피해 아파트 지하주차장 피해는 누가 어떻게 보상하나요?,꿀동이I코나l대구,2020-10-04 06:09:00
512987,차주 책임 입니다. 그다음 차주는 원인을 규명해서... 충전기 문제인지 차량 문제인지에 따라 구상권 청구 합니다.,금강이l니로l경기,2020-10-04 06:46:00
512987,이시간이면 완충후 화재가능성이 높네요 제발 배터리좀 완충하지 마세요 배터리 용량을 많이 채우시면 고전압 상태라안좋아요...,금강이l니로l경기,2020-10-04 06:42:00
512987,기본 설계상으로 문제없이 제품이 출시되었을텐데 완충하면 안된다 라는 말은 아닌거 같아요 제조사에서 해결해야지 소비자가 완충안하고 사용하는거는 말이 안맞는거 같아요ㅠ,날라I쏘울부스터I아산,2020-10-04 06:47:00
512987,그말이 아니라 개선방법이 나오기전까지는 안전선을 준수하는게 서로 윈윈 같네요뻔히 화재 스토리가 매번 같은데 굳이 위험하게 완충을 고집한다면 다음 화재 뉴스에 내차가 나올지도요...,금강이l니로l경기,2020-10-04 06:50:00
512987,그리고 배터리 충전 충전한도 설정이 가능한게 뭔가 이유가 있는것같아요100% 일시 제조사에서도 위험성을 인지하고 그런 옵션이 있는게 아닐까요?80% 선택 이런게 왜있는건지!!,금강이l니로l경기,2020-10-04 06:52:00
512987,맞는말 인거 같아요그러면 광고자체가 잘못된거죠.. 허위광고베터리 용량이 잇는데 그대로 사용을 못하면주행거리 보고 선택 한건데핸드폰에서 이런일이 생겻으면 난리 낫겟죠..노트7 리콜 때처럼.. 전량회수 환불처리,달심I코나I광주,2020-10-04 07:12:00
512987,서로 윈윈이라니..어이가없네요.스톡홀름증후군이신가요??,아임I니로I매트릭스,2020-10-04 08:39:00
512987,위험할수도있는걸 알고 쓰면 바보죠 그나마 조심할수있는 방법은 배터리를 완충하지 않는방법개선책이 나올때까지 그렇게 하는게 좋다는 뜻 입니다.이에 소비자가 협력할수있는 최고의방법이고 판매자가 정신차려서 개선해줘야죠 안해주면차 불매하라고 게속 홍보해야죠,금강이l니로l경기,2020-10-04 08:44:00
512987,니로는 아직 화재가 없지만 배터리 기술이 어차피 도토리 키재기라 시기상조라 생각합니다.모든전기차는 조심해야 합니다.^^,금강이l니로l경기,2020-10-04 08:45:00
512987,완충하게끔 만든차량을 완충하지말라니요 스마트폰 완충하지말라는것과 같네요,시지l오닉 코나l대구,2020-10-04 08:52:00
512987,이슈가 되니 주의하란 말이에요 저게 내차가 되면 되겠어요 소송해서이길수도없을텐데 조금 갭을 남겨두고 충전 하는게좋다고 봅니다.알고도 그냥쓰는건좀 저라면 못 쓰겟네요 파산각인데 ;;,금강이l니로l경기,2020-10-04 08:55:00
512987,핸드폰 기술이야말로 도토리 키재기죠. 모든 핸드폰 사용금지해야 할겁니다.전기차 화재로 죽거나 다친사람은 아직 없지만 갤노트7 은 구글링하면...... 주머니에서 터진거 정말 참흑합니다.,shrikeI볼트I서울,2020-10-04 09:07:00
512987,갤노트7 사태때 삼성전자는 스마트폰 완충하지 말라고 고지했습니다.,shrikeI볼트I서울,2020-10-04 09:08:00
512987,네 그래야겠어요! 안그래도 이번 명절연휴 장거리직전은 100% 급속충전하고 다녀와서 주차하기전에는 급속충전으로 지켜보며 배터리 과열될까싶어 80%만했네요.,아너 l e트론 l 대전,2020-10-04 09:46:00
512987,아니뭐이런 논리가 다있대 ㅋㅋㅋㅋㅋㅋㅋㅋㅋㅋㅋㅋ,티샤츠일산,2020-10-04 22:10:00
512987,동감입니다.,별I아이오닉I순천,2020-10-06 13:54:00
512987,으헉,이샘SM3코나포터제주,2020-10-04 06:45:00
512987,BMW 화재 이슈되었을때 주차장 출입금지하는 아파트들도 있었는데..해당 아파트는 이제 입대위에서 충전기 철거 방침이라도 내려버리면 답 안나오겠네요.,아립I볼트I전남,2020-10-04 07:12:00
512987,현대는 무책임한 메이커 입니다 .https://youtu.be/e3DuiuVu1g8저는 이런일도 당했어요.https://youtu.be/Sl1zaq2h78g,입큰배스I코나I춘천,2020-10-04 07:28:00
512987,현대차 아닐 수도 있잖아요 무책임한 메이커라... 지금까지 20년 넘게 a/s 잘 받고 큰 불편없이 탔습니다만...,플로리쉬,2020-10-04 07:36:00
512987,코나랍니다,소리l니로l수원,2020-10-04 07:42:00
512987,헉 ㅠㅠㅠㅠ,터킬l코나l서울,2020-10-04 08:07:00
512987,진짜요??ㅠㅠ 대박,달심I코나I광주,2020-10-04 08:09:00
512987,,소리l니로l수원,2020-10-04 08:10:00
512987,맞죠...완충...시 고전압 상태 에서 화재.......처음에 모든 비용을차주가 부담해야 하기때문에 진짜 위험합니다. 다들 조심하세요,금강이l니로l경기,2020-10-04 08:16:00
512987,뻐대만 남았다니 피해받은 차량이 많겠는데요... 사고 처리가 이찌될런지. 차주님은 연휴에 날벼락 맞았네요,터킬l코나l서울,2020-10-04 08:27:00
512987,헐.. 영상 공유할게요. 어이없네요. 베터리 그냥 드러나게 만들어놓고 보증을 안해준다니.,땅콩I볼트evI서울,2020-10-04 23:20:00
512987,에휴 설마 또 그차 인가요? 앞으로 충전할 때는 그 차 옆에서 충전하기도 꺼려지네요.,서펜하우어Ii3I인천,2020-10-04 07:47:00
512987,"차주님도, 근처에 있던 차들도 전부 날벼락이네요 ㅠㅠ",트롱이I파주,2020-10-04 07:51:00
512987,점점 화제사건이 많아 지네요 ㅠ,추자l볼트evl경기,2020-10-04 07:52:00
512987,전기차.. 어떻게하죵,쮸니I니로evI충남,2020-10-04 08:29:00
512987,현기메이커는 이런 사고가 않은데도 인정을 안해요. 저도 코나 전기차를 타지만 저는 개인 주택이라 완속 충전기를 정원 한 쪽어 설치 했지만 불안해요. 옆에는 바로 산이고 . 저는 코나를 처분할까 해요.. 매매를 하게되면 보조금 받은것은 어찌 되나요.,입큰배스I코나I춘천,2020-10-04 08:33:00
512987,보조금 받은 지역에 사는 사람이 구매자면 매매 가능합니다.,사미나랑,2020-10-04 21:52:00
512987,코나 살려다 i3왔는데 ㅜㅜㅜ 이정도면 현대에서 시스템업뎃을 좀 해야겠네요 ㅜ,땡글li3l안산,2020-10-04 08:40:00
512987,아예 현대차를 사지 마세요.,입큰배스I코나I춘천,2020-10-04 08:41:00
512987,아이오닉은 불났다는 이야기 없습니다.아마 코나보다는 아이오닉이 더 많이 팔렸을겁니다.,shrikeI볼트I서울,2020-10-04 09:12:00
512987,아이오닉도 있습니다.,ㅇㅋㅋㅋI볼트EVI경기,2020-10-04 11:48:00
512987,차종은 코나 맞네요...,쏘밍파I아이오닉I대구,2020-10-04 08:47:00
512987,차주님 많이 속상하시죠. 힘 내시고요 . 현대랑 대응해서 환불 받으세요,입큰배스I코나I춘천,2020-10-04 08:50:00
512987,에구 제차는 아닙니다. 자다가 놀래서 내려왔을뿐..... 문제는 입주민 회의에서 전기차 관련 말이 나올 것 같아요...,쏘밍파I아이오닉I대구,2020-10-04 08:52:00
512987,"지하주차장 금지 될것 같네요. 저희 아파트 카페도 말 나오네요. 소방차들이 지하주차장 지하3층, 4층 들어올수 있는지부터 해서 초기 허가 받을때 소방법 관련 서류까지 모두 공개열람해서 올 검토할것 같네요. 전기차 시설이 소방법, 소방설계용량에 충분하게 검토되었는지도 소방서, 구청, 전기차충전시설업자 모두 다 의견조회 할것 같구요. 의견조회 공문 수신열람 하는 순간 담당공무원은 인지를 하게 되니 어떻게든 조치를 해야 하고 민원처리법률에 따라 답변도 해야하니까.. 현기에서 명확한 원인 및 조치결과가 나오지 않으면 영구 주차금지일수도., 코나 빨리 팔면 팔았을수록 위너네요. 코나 중고 감가가 문제가 아니라 매매자체가 안될듯....",아돌I구입예정I부산,2020-10-04 09:05:00
512987,예 저도 충전소 이용금지 내지는 지하주차장 금지 될 것 같습니다... 전기차는 아직은 시기상조였을까요.... 좀 더 검증이 필요했던 모양입니다.,쏘밍파I아이오닉I대구,2020-10-04 09:18:00
512987,"코나만 유독 심각하네요. 그보다 현기가 더 심각하지만... 전기차를 좀 알면 충전소 이용금지로 되겠는데 잘 모르는 주민들은 그냥 진입 자체를 싫어하니.. 설득과 소통이 필요한 부분이겠네요. 아이구.. 천정 도색, 열화된 전선 및 통신선 교체 주변 차들 대물처리, 본인 자차 처리, 건물 구조 안전진단, 소방시설 점검 및 복구에 소방차가 진입 못했다는 과실 내용으로 소방시설 개선명령까지 오면.. 저 코나 차주 멘붕이겠네요.. 그나마 물피만 있고 인피가 없어서 다행이지 인피면 경찰조사까지 받을수도 있으니.. 진짜 답 안나옵니다..",아돌I구입예정I부산,2020-10-04 09:16:00
512987,일단... 한동안 집밥은 불가능하겠습니다.,쏘밍파I아이오닉I대구,2020-10-04 08:56:00
512987,완속충전기가 아닌 이동형충전기로 90%만 충전해야겠군요,동안I코나I마산,2020-10-04 09:24:00
512987,헉..,케니장,2020-10-04 09:26:00
512987,와 근데 여기는 주차장 천정이 엄청 높군요,그롬IModel3I서울,2020-10-04 09:33:00
512987,아.. 심각하네요.. 저 코나의 충전 상태가 어땠는지 궁금하네요.. 베터리 잔량이 많은데도 계속충전을 한건지 어쩐건지.. 흠.. 남일 같지 않아 걱정입니다.. ㅜㅜ,봄이아빠I코나I대구,2020-10-04 09:35:00
512987,100% 완충 문자 직후 화재 발생했다하네요.,쏘밍파I아이오닉I대구,2020-10-04 09:36:00
512987,"허허.. 정보 감사합니다 ㅜㅜ 제가 타던 코나를 부모님께 드리고, 저는 모델3로 바꾼 상태라 더 신경쓰이네요.. 부모님께 알려 드려야 겠네요",봄이아빠I모델3I대구,2020-10-04 09:38:00
