post_id,cmt_content,cmt_author,cmt_created_at
512987,역시 그 문제군요.,shrikeI볼트I서울,2020-10-04 15:41:00
512987,"안그래도 전기차 인식이 안좋은데, 농담이 아닌 진짜 시기상조가 되어버렸네요. 현대가 빨리 해결했으면 좋겠네요.",미키lVOLTTM3l서울,2020-10-04 09:36:00
512987,예 같은 의견입니다. 저는 아이오닉 타지만 현대차 대응보면 차 살때 무리해서 모델3 갔어야하나 하는 생각만 드네요.,쏘밍파I아이오닉I대구,2020-10-04 09:37:00
512987,하루가 멀다하고 불나네... 리콜 해야합니다,팔플I코나evI경남,2020-10-04 09:46:00
512987,하...우리 아파트에 내차랑 같은데..ㅠ 속상하네요,해파l코나EVl대구,2020-10-04 10:01:00
512987,에고 많이 놀라셨지요? 괜찮으신지요? 모쪼록 잘 해결 되셨으면 좋겠습니다. 에고 사고차주분은 아니셨군요. 다행입니다.,쏘밍파I아이오닉I대구,2020-10-04 10:31:00
512987,해파님 차가 아니라 그아파트에 또다른 코나차주님 이신거 같은데요,준우맘I볼트I대전,2020-10-04 10:07:00
512987,이런.. 정말 얼마 안된거면. 많이 속상하시겠습니다.,미키lVOLTTM3l서울,2020-10-04 10:11:00
512987,코나만 주구장창 불나는거 보면 몬가 문제가 있는건 확실한데 현차에서는 언론무마만 시켜대고...,카이제l쏘부l부천,2020-10-04 10:04:00
512987,현대자동차에서 대대적인 리콜을 하던지 확실한 개선책을 내놔야 할 것 같습니다.그래도 인명피해는 없는 것 같아서 다행입니다.,누군감I코나I서울,2020-10-04 10:25:00
512987,왜 우리나라에서만 불이나는지 원. 미국 코나는 화재사건이 없는거같은데,네모l레이l경기,2020-10-04 10:36:00
512987,헛 코나. ㅠㅠ,닥침I볼트M3I경기,2020-10-04 10:43:00
512987,진짜 씨x새x들 차를 씨x x같이 만들었으면..하 진짜 열받네,닐닐I코나I대구,2020-10-04 10:47:00
512987,동감입니다.,별I아이오닉I순천,2020-10-06 14:11:00
512987,코나 문제가 있는것같습니다,오창불패l오닉I대구미,2020-10-04 11:01:00
512987,저도 놀라서 애들 둘 데리고 대피했습니다.단지내 입주민 모두들 같은 마음이었을 것 같습니다.아직 지하주차장은 냄새가 심하네요. 얼른 복구되는게 우선일 것 같습니다.,쏘밍파I아이오닉I대구,2020-10-04 11:51:00
512987,현대가 최종 리콜 해주지 않는 이상 차주들은 어쩔 수 없이 80~90%만 충전 하시면서 사용해야할것 같아요... 저도 아이오닉 완속 완충하게되면 0.3~04kw씩. 충전되면서 충전종료가 안되는 현상이 있습니다 지차저 충전기 연결할 때 그렇씁니다 저는 충전할 때 항상 차 안에서 있었거든요 충전하면서 자리 비우는건. 모든 전기차에서도 안될듯합니다 특히 100%는 제 아이오닉에서도 충전종료가 안되요,예비ㅣ오닉ㅣ대전,2020-10-04 11:53:00
512987,아 이글을보니 저도그랬던경험있어요 충전하다가 충전종료를눌렀는데 충전완료가뜨지않더군요 이상하다하고 그냥충전기를뽑았던적이몇번있네요,우기부기I코나evI용인,2020-10-04 12:42:00
512987,시동 끈 상태였는데도 그런건가요?,shrikeI볼트I서울,2020-10-04 15:43:00
512987,충전 종료가 안됩니다 자동으로는 근데 또 회사 주차장에서 220v 연결해서 완충했을 때는 자동종료 되더라구요 이게 그래서. 충전기랑 통신이 잘 안되나봐요 저도 가끔 100퍼 충전 할 때 마다 이러네요.,예비ㅣ오닉ㅣ대전,2020-10-04 15:45:00
512987,절대로 100% 완충하지 마세요. 매우 위험한 상태입니다.이번 불도 완속충전기에 물린 상태에서 발생했는데 뭔가 완속충전과 연관성이 있어보이는군요.,shrikeI볼트I서울,2020-10-04 16:23:00
512987,헐.... 이거 진짜 심각한건데..전기 차단이 안된다는 얘기인데.,땅콩I볼트evI서울,2020-10-04 17:12:00
512987,80설정은 차 원격어플에서 충전설정하면 되는건가요?,에스디I니로I서울l,2020-10-05 10:59:00
512884,기름차 보다 불날일 적습니다,사루비스l모델3I광주,2020-10-03 18:19:00
512884,확률은 적지만 내연차는 주차중 화재가 난적이 없습니다. 운전자가 화재를 인지할수 없는 주차중 화재는 대형화재 유발할수 있어요.,뚱이아빠 l볼트l인천,2020-10-03 20:43:00
512884,bmw도 한동안 주차중에도 화재가 있었죠 지금도 코나에 한정된 얘기지요 전기차라서 위험한게 아니라 잘못만들어진 차가 위험한겁니다,사루비스l모델3I광주,2020-10-04 12:26:00
512884,코나만 피하시면 됩니다.,jieI니로I서울,2020-10-03 18:48:00
512884,불안한 마음이 있으시면 다른선택을 추천드립니다. 차는 편하게 타야죠.,바담I니로EVI강원,2020-10-03 19:26:00
512884,코나 화재 문제는 내차만 타고 끝나면 좋은데 남의 생명과 타인의 재산을 몽땅 태워버릴 위험이 있습니다.,해피메롱I코나I수원,2020-10-03 20:32:00
512884,위험해요. 걱정하시지말고 내연기관차 사세요...,3424l봉고EV l 양주,2020-10-03 20:41:00
512549,지금 코나 매물많이 올라오는 이유가 있습니다.,사자왕I볼트I일산,2020-10-02 12:40:00
512549,저는 2900주고 샀는데 ㅅㅂ것들 할인 좃나 해주네요. 아이오닉입니다 ㅜㅜ 장단점이 있습니다!! 저 어제 와인딩하다가 돌 튀어서 퍽 하는 소리 들려가지고 차량 멈춰 하부 확인해 봤는데 플라스틱 비슷한 걸로 덮혀 있더라구요 맨끝에쪽 배터리부분만 플라스틱으로 되어 있고 가운데는 플라스틱 비슷한 재질로 되어 있어서 일단은 안심을 했습니다 차량진단도 몇번 했는데. 큰 문제없는것같구요 코나같은 문제가 아이오닉에서도 발생될수 있지만. 보호커버가 있으니까 1차 방어가 될수 있으니. 오픈된것보다는 괜찮아보요요. 너무 신경쓰이면 볼트나 테슬라 타세요,예비ㅣ오닉ㅣ대전,2020-10-02 13:21:00
512549,저는대신 깡통으로 견적 본겁니다 풀옵은 그정도하더라구요,낙타와l미정l대전,2020-10-02 13:31:00
512549,주생거리떄문에 코나 고려중입니다,풋볼러,2020-10-02 13:55:00
512549,코나 프리미엄 선루프 뺀 풀옵션 차주인데 운전은 기능이 많아 안전하고 재미있기는 합니다 만 낮은 차체 때문에 항상 긴장 안할수가 없어요 전 7월말 출시 코나 일렉 8월 초에 할인 1 % 로도없이 구매했는데 이제 프로모션으로 혹 하게 만드네 ㅠ 리콜이나 해라 ㅠ,코나일렉트로닉인천,2020-10-02 14:11:00
512549,하부 불안과 주행거리짧은부담 뭐가 나을까요 ㅜ,낙타와l미정l대전,2020-10-02 14:12:00
512549,내년에 새로운 시리즈 나오는거 같던데요...중고가 방어가 괜찮을까요? 기다렸다가 새로운 시리즈들로 넘어가시지...,아련다솜I테슬라l경북,2020-10-02 14:13:00
512549,주행거리 히터 안키고 에어컨 약하게 틀고 가도 순식간에 훅 떨어지는 것을 느끼실겁다 시동 처음 걸었을때 주행거리 믿지 마세요 그냥 참고만 하세요,코나일렉트로닉인천,2020-10-02 14:14:00
512549,코나 추천하시는거죠?,낙타와l미정l대전,2020-10-02 15:29:00
512549,저는 구오닉에서 볼트로 왔습니다.지금 정말 만족하면서 타고 있어요~주행이 탄탄하고 잘 잡아줍니다.볼트 하부는 튼튼해요~,블루I볼트I창원,2020-10-02 15:23:00
512549,모든걸 가질순 없겟찌만 인테리어가 볼트는 아쉬워서 패스했습니다...,낙타와l미정l대전,2020-10-02 15:29:00
512549,가격대비 코나는 비추 입니다 개인적 의견 입니다 프로모션 할인 10 % 면 혹 할수 있겠지만 도로달리다 높은맨홀 이나 방지턱 넘을때 마다 긴장 합니다 또한 현대차 베터리 평생 보증 물론 긁힘이나 없으면 평생 이라 하지만 골재 깔린 주차장 꺼려 할수 밖에 없고 아무튼 리콜 전까진 절대 비추 입니다,코나일렉트로닉인천,2020-10-02 15:35:00
512549,아이오닉은 추천하시나요?,낙타와l미정l대전,2020-10-02 15:40:00
512549,불나는차를 왜 사시려는지..,카메라맨l코나l대전,2020-10-02 15:36:00
512549,차박때문에 전기차랑 투싼보다가 재고할인덕에 투싼보다 훨씬저렴하게 구매가능해서요... 코나 이슈땜에 아이오닉하려다 또 주행거리가 여행때 불편할거같고 그러네요ㅜ,낙타와l미정l대전,2020-10-02 15:40:00
512549,현대 차 는 이제 절대 안 삽니다 21년 에 전기차 플랫폼으로 아무리 차를 잘 만들었다고 할지라도 베터리 평생 보증이라고 하여 구매 했는데 차체가 낮아 주행하면서 안 긁힐 자신이 없고 베터리 긁히면 운전자 과실로 잡혀 보증기간 있어도 무의미 한것,코나일렉트로닉인천,2020-10-02 16:01:00
512549,베터리 평생 보증이란 말에 현혹 되지 마세요 문제있어 블루핸즈 가보면 운전자 과실로 무상 수리 못받음 유튜브 명장님 것 보고 너무 놀라고 열받아 그 이야기가 남일 같지 않더라고요,코나일렉트로닉인천,2020-10-02 16:05:00
512549,배터리 하부 알루미늄을 용접한다는 자체가 아이러니입니다.원래 건축쪽에서도 알루미늄은 크랙등등 내구성 때문에 알미늄 용접 작업이란게 사라진지 오래입니다.,해피메롱I코나I수원,2020-10-02 23:54:00
512549,"저도 비슷한 고민하다가 아이오닉ev 풀옵으로 구입했어요. 주행거리 생각만큼 그렇게 압박 받지 않아요. 요즘 날씨가 좋아서 평균 전비 10km/kw 나와요. 완충시 가능 거리 380Km. 주중 출퇴근 왕복 36km 10일에 한번 정도 충전합니다. 장거리는 판교-강릉 갔다 왔는데, 중간에 한번 정도 충전이 필요해요. 하지만 화장실 갔다오고, 식사 간식 먹고 20~30분정도. 고속도로 전비는 8-9km/kw. 스마트센스는 옵션으로 넣는게 좋을거 같아요.",제임스l더뉴오닉l성남,2020-10-03 20:58:00
512549,할인이라니 좋은기회인데 걱정되긴 하네요,버스타야,2020-10-04 13:34:00
512454,기아 니로는 아실까요?지난달 추석 출고 200만원생산웖별 최대 200할인 있었거든이,정보선생I니로I경남,2020-10-02 00:06:00
512454,포터전시차가 있나요?,하느리l포터봉고l경기,2020-10-02 00:13:00
512454,포터 ㅜㅜ 인천은 영영 출고 못하나요 신청은 해놨는데 도대체가 연락이 없네요,기술자l모델3l아산,2020-10-02 01:25:00
512454,코나의 화재부분과 하부 배터리커버의 문제는 혹시나 해결되었을까용? 그 부분이 걱정되어 코나는 고민대상에서 제외 했는뎁ᆢ,소르름 I 김해,2020-10-02 02:15:00
512454,그렇군요ᆢ큰문제인데ᆢ현대측에서 해결할 의지가 없나보군여ㅠㅠ,소르름 I 김해,2020-10-02 10:05:00
512454,오 포터 전기차...,시밀레l모3l평택,2020-10-02 06:45:00
512454,보조금도 없는데 저게 무슨 의미가 있을지,아이조아I서울,2020-10-02 08:29:00
512454,아이오닉 코나 고민되는군요 흡흡,낙타와l미정l대전,2020-10-02 11:01:00
512236,하이,깜뎅포스,2020-10-01 11:18:00
512236,ㅎ2ㅎ2,연비왕자n제주,2020-10-01 12:07:00
512111,교환할때마다 헷갈려서 그러는데.. 필터 화살표가 아래로 향하는건가요 위로 향하는건가요..??,망나니l더뉴오닉l충남,2020-09-30 18:41:00
512111,바람이 위에서 아래로 들어옵니다화살표는 아래로 향하는게 맞습니다~(차량에 따라 다를 수 있음~),베비로션l코나l서울,2020-09-30 19:15:00
512111,출고 필터는 이렇게 설치되어 나왔어요,근육이IKEI서울,2020-09-30 18:46:00
512111,해깔릴거 없어요 블로워모터방향으로 꼽는거라 화살표가 아래여야합니다,루다빠I니로포터I천안,2020-09-30 18:50:00
512111,오호 감사합니다,망나니l더뉴오닉l충남,2020-09-30 18:56:00
512111,저두 하나 시켜서 달까하는데 엄두가 안나네요,제영I코나EVI경주,2020-09-30 18:47:00
512111,다는게 아니구요 참고용 입니다 정확한건 아닙니다,루다빠I니로포터I천안,2020-09-30 18:51:00
512111,네~ 윗님처럼 필요할 때 꼽아서 확인하고 빼놓을 수 있어요스캐너 구매하고 토크어플 설치 후 PID 복사하고 대시보드 파일 복사해서 보기만 하시면 됩니다어렵지 않아요~,베비로션l코나l서울,2020-09-30 19:09:00
512111,저도 님처럼 설치해 봐야겠습니다. OBD 스캐너 링크 좀 쪽지 부탁해요.^^,태후니I코나I천안,2020-09-30 20:13:00
512111,네~ 쪽지 보내드렸습니다ㅎ,베비로션l코나l서울,2020-09-30 20:18:00
512111,이미 쓰고 계시잖아요ㅎㅎ 도움 많이 받고 있습니다^^,베비로션l코나l서울,2020-09-30 23:15:00
512111,좋은정보감사합니다,늑늑늑l서울,2020-09-30 21:46:00
512111,도움되셨다니 다행이네요ㅎ,베비로션l코나l서울,2020-09-30 23:15:00
512111,"저도 가끔 꼽아서 충전할때 들여다 보고 있는데...셀 전압 차이는 최소, 최대를 뽑아서 보여주는 디스플레이도 있고, 차이만 뽑아서 보여주는 게이지도 있습니다.SOH 는 저도 100% 인데.. 이거 뻥인것 같습니다.. 주행거리 많으신 분들도 전부 100% 라고 합니다..",놀보I코나EVI원주,2020-09-30 22:38:00
512111,아하~ csv 파일 까보니 엑셀처럼 수식이 있군요ㅎㅎ 요걸 잘 주물럭하면 여러가지 디스플레이 만들 수 있겠네요~ 저도 SOH 못 믿겠어요.. 2년된 차인데 100%.. 어느 순간 확줄어들려나..ㅠ,베비로션l코나l서울,2020-09-30 23:18:00
512111,코나 여름철에먀 불나니 일단 올해는 위기 넘긴듯하네요,크리스l오닉x2l경기,2020-10-01 10:15:00
512111,네;; 불 발생확률이 줄어들어 다행입니다만 리콜이슈가 묻힐까봐 걱정이네요..,베비로션l코나l서울,2020-10-10 17:46:00
512111,대구 13번째 화재가 여름 아닌데 나긴했네요 ㅜㅠ,크리스l오닉x2l경기,2020-10-10 18:34:00
512111,감사하긴하나 뭔놈의 차량구매해서 소비자가 이런 막말로 개지랄까지하면서끌고다녀야하는지 아무리 생각해도 현대놈들은 뭔생각으로 이따구로 출고하는지.....................,헐레벌떡I코나I서울,2020-10-01 17:11:00
512111,그러게요ㅠㅠ 이게 뭐하는 짓인지.. 완성차가 아닌 조립차 타는 느낌이네요ㅡㅡ,베비로션l코나l서울,2020-10-10 17:47:00
512111,좋은정보 감사합니다. 저도 OBD스캐너 정보 쪽지부탁드릴수 있을까요?,닥님l코나l안양,2020-10-10 17:15:00
512111,"네, 쪽지 보내드렸습니다",베비로션l코나l서울,2020-10-10 17:48:00
512111,안드로이드 내부폴더는 직접 생성해야 하나요? 폰 내부에는 토크프로라는 폴더가 없네요 ㅠㅠ 깔긴깔았는데요,스마일I코나I전북남원,2020-10-13 15:54:00
512111,"안드로이드죠? 아마 .으로 시작하는 시스템폴더기에 파일앱에 옵션을 보면 ""숨김파일보기"" 메뉴가 있을거에요. 그거 누르시면 보일겁니다~ 한번 토크앱을 실행해야 보일 수 있어요",베비로션l코나l서울,2020-10-13 15:59:00
512111,아하 피시에서만 찾고 있었습니다 ㅠㅠ 감사합니다..근데 대쉬보드 폴더는 있는데 extendedpids폴더는 없는데 그냥 생성하고 넣으면 될까요? csv파일들만 넣어야 할까요? 아니면 폴더 통채로 넣어야 할까요?,스마일I코나I전북남원,2020-10-13 16:12:00
512111,"네, 저도 없어서 만들었던가 싶은데.. 그 대시보드폴더랑 같은곳에 .extendedpids 만드시고 거기에 차량에 맞는 (아 같은 코나시군요ㅎ) csv 파일들 (코나는 6개네요) 넣으시고 다시 토크앱 실행하시고 설정하시면 될거에요",베비로션l코나l서울,2020-10-13 16:16:00
512111,감사합니다..하나만 더 여쭤볼께요..폴더에 다 넣고 설정에 확장 pid관리 들어가서 메뉴에서 기존셋팅관리에서 폴더에 저장한 파일들 다 눌러주는게 맞을까요? 대쉬보드는 따로 뭐 건드려줘야 할게 있을까요? 자꾸 문의드려 죄송해요 ㅠㅠ,스마일I코나I전북남원,2020-10-13 16:21:00
512111,"네~ 대시보드에 추가해야하는데 아마 목록에 안뜰거라 설정-확장pid- 기존셋팅추가 에서 하나씩 다 눌러서 추가한걸로 기억해요. 그 다음 대시보드 복사하셨다면 리얼타임인포 들어가신다음 레이아웃셋팅에서 import 하시면 되고, 아님 새로 한땀한땀 추가하시면 됩니다~ㅎ",베비로션l코나l서울,2020-10-13 16:25:00
512111,넵!! 감사합니다!! 해보겠습니다,스마일I코나I전북남원,2020-10-13 16:29:00
512111,안녕하세요. 저도 불안해서 OBD를 통해서 모니터링 해보려고 하는데 구매정보좀 쪽지로 부탁드립니다.똥손이지만 해보려구요.,동글이74I코나EVI대전,2020-10-21 09:24:00
512111,네~ 쪽지드렸어요~,베비로션l코나l서울,2020-10-21 10:00:00
512111,감사합니다. 바로 진행합니다.,동글이74I코나EVI대전,2020-10-21 10:02:00
512111,OBD 스캐너 링크 좀 쪽지 부탁드려요,랩터l코나l원주,2020-10-26 21:29:00
512111,네~ 쪽지드렸습니다,베비로션l코나l서울,2020-10-26 22:15:00
512111,구매정보 쪽지 부탁드려요!,코츄l코나l익산,2020-10-28 19:05:00
512111,네~ 쪽지드렸습니다,베비로션l코나l서울,2020-10-28 20:08:00
512111,저도 구매정보 요청드려요.,푸른어름I코나I화성,2020-11-08 17:19:00
512111,네~ 쪽지드렸습니다,베비로션l코나l서울,2020-11-08 17:32:00
512111,OBD설치 해서 보고있는데 꽂은상태에서 퓨즈커버 닫히시나요? 열어놓을 수도 없고 슬림 연장케이블에 연결하면되는건지도 휴즈커버를 구멍을 뚫을지 고민되네요 ㅋㅋ,동글이74I코나EVI대전,2020-12-06 18:25:00
512111,"저도 안닫혀요ㅎ 계속 꼽아놓고 모니터링하시는거면 커버 컷팅하시거나 연장케이블로 해야할듯요; 연장케이블도 간섭없는놈으로 사야하구요. 저는 충전 전후로 잠깐 사용하는지라ㅋ 모터RPM, 실내온도, 기타 다른 정보 표시도 되고 뽀대도 있어서 상시표시도 고민하고 있습니다ㅎ",베비로션l코나l서울,2020-12-06 18:28:00
512111,네 빠른답변 감사~ 전 연장케이블로 해보고 후기 올릴께요 덕분에 잘 모니터링 하고 있습니다,동글이74I코나EVI대전,2020-12-06 18:30:00
512111,감사합니다^^,베비로션l코나l서울,2020-12-06 18:32:00
512111,,라라떼l쏘울l제주,2021-11-20 21:20:00
512111,감사합니다!,연차휴가l쏘울l용인,2021-12-05 14:07:00
512111,잘보고 갑니다,하이라이IeqcI시흥,2023-07-20 00:18:00
512061,보조금 적용해서 오닉5는 5천~6천 언저리일테고 70은 7천 정도 봐야되지 않을까요?? 현재 현기 차종이랑은 엄연히 다른 등급이니깐요,카이제l쏘부l부천,2020-09-30 15:18:00
512061,아무래도 그렇겠죠?,황뽀리I코나I울산,2020-09-30 15:23:00
512061,보조금 적용해서 이정도면 모델3로 가야할것같아요,우엉엉I광주,2020-09-30 19:13:00
512061,저도 오닉5 기다리고 있긴한데 코나 배터리 이슈 처리하는 꼬라지보면 어우... 왠지 제 미래일거같아 걱정됨 ㅠ,버스메트로워크,2020-09-30 15:47:00
512061,오닉5는 그래도 전용 플랫폼이라고 하니 코나보단 낫지 않을까요,황뽀리I코나I울산,2020-09-30 16:16:00
512061,오닉5 보조금후 4천대중반,뱌담퐁I쏘울1I경기,2020-09-30 16:16:00
512061,gv가 이쁘긴 한데..,짱구l니로l인천,2020-09-30 16:58:00
512061,아... GV70 너무 기다려지네요,깡패l용인,2020-09-30 17:22:00
512061,"ID.4 가 공격적으로 가격을 내세우고 있어서 예상보다 가격이 높지 않을 수도 있을 것 같습니다.현대전기차의 문제점은 감속기 고질적 문제, 스티어링 휠 소리, 아직 원인을 모르는 화재 이슈 등입니다.또한 현대/기아 초기차는 1년은 지켜봐야 한다는 점이 있구요. 제네시스 전기차는 전용 플랫폼이 아니라면 거르는 것이 나을 겁니다.",션I코나I인천,2020-09-30 17:22:00
512061,"폭스바겐 ID4는 전기차 전용 플랫폼으로전장은 소형차급 4,580㎜에 불과한데휠베이스는 2,770㎜으로 중형급이네요.현기도 중형차가 많이 나와서 선택의 폭이 넓어지면 좋겠네요.",아미쿠스l쏘울l인천,2020-09-30 17:36:00
512061,기대반 우려반 이네요,엘도라도앙마ll경기,2020-10-01 07:21:00
512061,eGV80도 너무 기대됩니다,아임낫노르말 서울,2020-10-02 11:10:00
511920,동감입니다,아랑졸놈 불차 제주,2020-09-30 02:04:00
511920,아... 코나 ㅠㅠ,전기차어떤걸로,2020-09-30 02:17:00
511920,그렇게까지 걱정 하실 필요가 있을까요?암걸릴까봐 요리된 음식..구운 생선 및 고기..이런건 걱정되서 어케 드세요?불은 내연기관 차량이 더 많이 나구요..배터리는 조금만 신경쓰시면서 운전 하시면 비드 터질일 없습니다.실수로 비드 터뜨려도..자차 보험처리 하시면 됩니다.구더기 무서워서 장 못담그고 암걸릴까봐 음식도 생식만 하고...폐썩을까봐 도시에서 못사는 그런 과민성 신경증 갖고 살 필요 없어요,왕게임짱ㅣ코나ㅣ서울,2020-09-30 03:04:00
511920,이건 좀 전혀 상황에 맞지 않는 비유인듯 싶네요ㅎ,허니I모델SI남양,2020-10-04 09:19:00
511920,올해 8월 구매한 코나 차주입니다..코나 프리미엄 풀옵...가격만큼 걱정도 크내요.. 걱정은 사실 제가 할께 아니라 현대 이놈들이 해야 하는데.... 돈주고 맘고생이내요..그래도 그냥 편하게 생각할라구요.. 코나 차주님들 화이팅입니다....,전기차ㅣ코나ㅣ김포,2020-09-30 03:11:00
511920,같은심정입니다. 공감합니다.,철도원I코나evl경기,2020-09-30 03:45:00
511920,그냥 타셔도 괜찮을것같아요..보험이 있잖아요,니나잘해e화성코나ev,2020-09-30 04:29:00
511920,와 생각외로 크게 생각안하시는 분들이 많네요 ㅎㅎ 저는 2년 지나면 팔고 현대차는 거들떠 보고 안하려구요 ㅋ 5만 탔는데 모터 감속기 소리는 더럽게 많이나고 교체 예약 해놨습니다. 진짜 고쳐 타는게 맞는가봐요 ㅋ,몽실이I코나I김해,2020-09-30 05:35:00
511920,"자차로 2,400만원 부담해서 수리하면 다음 갱신 때 깜짝 놀랄텐데.. 아무렇지도 않게 생각하시는 분 들이 있네요.",션I코나I인천,2020-09-30 06:08:00
511920,교체 2천4백 아닙니다어느분이 문제제기해서현대에서 조치개선한 내용 얼마전매니저님이 올려두었는데부분정비비 인정 8%정비비로결정되었습니다160만원정도로...,상르I코나I경남,2020-09-30 06:58:00
511920,"하부 용접 부위 크랙만 있을 경우 그렇겠지요. 하지만, 하부 케이스 교체하면 보증 없어진다고 들었어요. 게다가 크랙이 있을지 없을지 늘 보는 것은 아니잖아요. 그리고, 현대자동차가 과연 군말 없이 그렇게 해줄지 확신이 없어요. 어떻게든지 소비자 과실로 몰고 갈 것 같거든요.마지막으로, 제품 설계 문제인데 왜 소비자가 자차로 문제를 해결해야 하는지 잘 이해되지 않아요.",션I코나I인천,2020-09-30 07:33:00
511920,아직 전기차 자리잡기 까지 조율해야 할 문제가 많네요,코스톨란,2020-09-30 08:30:00
511920,아 이런 걱정도 있네요 ㅠ,아이언매이든 경북,2020-09-30 09:36:00
511920,"신경이 안쓰인다는건 거짓말이고, 비포장길 되도록이면 안가고. 90프로만 충전하고 그냥 다닙니다.",엑시아I코나I아산,2020-09-30 09:53:00
511920,전기차 아직아닌거같내여 ㅜㅜ,고7890,2020-09-30 10:55:00
511920,코나가 안좋은 일이 생긴건 사실이지만 걱정하면서 타진 않아요. 그럴꺼면 처분하는게 좋지않을까요. 스트레스 받으면 몸에 안좋습니다.,포스I코나I서울,2020-10-01 16:54:00
511920,처분하고 싶습니다. 보조금 때문에 발목잡혀 그렇죠....보조금 받아서 테슬라나 볼트로 갈아타고 싶네요...,근육이IKEI서울,2020-10-01 19:05:00
511920,에구 ㅠㅠㅠ,시밀레l모3l평택,2020-10-02 06:52:00
511920,월요일에 중고 코나 업어오기로 했는데 생각을 해봐야겠네요. 이것만봐도 영향이 없다할 수는 없을듯 싶네요.,허니I모델SI남양,2020-10-04 10:09:00
511800,95% 설정이 잇나요❓ 보통 10% 단위로 설정되어 잇던데. 글고 화재나도 현대에서 보상 잘 해주는거 같은데요. 예전에 공지로 올렷던 글도 삭제되고 이슈 안되는걸 보면 그런 조항이 들어간듯. 아마도 차값은 물론 추후 보상까지 해줄꺼 같은데 그 정도면 차라리 화재나도 지장은 없을듯. 어차피 충전할때는 사람 안타잖아요. 물론 다른 사람까지 피해 입히면 안되지만 어차피 불가항력이라 맘편히 충전하세요. 코나 엄청 팔렷어요. 울나라서 젤 많은게 코나일듯. 볼트 대란때 풀린거 외에는 코나가 좀더 많지 않을까요,션볼로I코나I성남,2020-09-29 19:25:00
