post_id,cmt_content,cmt_author,cmt_created_at
505585,,별I아이오닉I순천,2020-09-18 17:19:00
505585,수고하셨습니다.1.큰 이슈가 5가지라고했는데 4번까지만 나오네요누락된건가요?2. 냉각수관련해서도 문의가 되야할꺼같습니다.감사합니다!,돈데크만l코나l인천,2020-09-11 22:01:00
505585,역시 현대네요. 속 시원하게 이야기 하는것이 없네요. 여러분 이런 게시글에 속지 마시고 지속적으로 청원 동의 및 리콜신청 부탁드립니다.,마션l니로I서울,2020-09-11 22:05:00
505585,제대로 대응할때까지 지속 항의 해야합니다,물고기왕I코나I구미,2020-09-11 22:14:00
505585,역시 아몰랑 현대스러운 대응과 답변. 내수 소비자는 늘 호구 취급.,던힐I코나I경남,2020-09-11 22:16:00
505585,감사합니다!,임뱅I코나I경북,2020-09-11 22:18:00
505585,좋은 정보 감사합니다 좋은밤 보내세요,별리,2020-09-11 22:21:00
505585,실은 배터리 하단 뿐만이 아니에요하단에 기본적으로 덮게(언더커버)를 미리 제조할때 넣었더라면 이렇게 불만이 커지지만은 않았을 것입니다.냉각수도 그래요녹색냉각수는 현재 40~50년전에 만든 그거 그대로 전기차에 사용했습니다.약간의 업그레이드는 되었더라도19년도 전기차에 전기차전용(파란색)으로 급히 변경한 이유가 있으니까요.녹색도 파란색으로 리콜을 해줘야 할 것입니다.(대부분 녹색냉각수 차량이 화재대상)당연히 화재의 주 원인인데이건 정말 리콜건입니다.모쪼록 많이 고생하시는데더 강한 요구? (소비자의 권리지만)를 해야만하고..부탁드립니다.,전기차붕붕I니로I전주,2020-09-11 22:29:00
505585,절연냉각수로 교체해줬으면 좋겠네요..,로젠l코나l세종,2020-09-11 23:18:00
505585,아직 진행형이긴 하지만 개선의 여지가 있음을 확인하는 것만으로도 다행이라 여겨지네요. 정리해서 올려주셔서 감사합니다.,거푸I코나I대구,2020-09-11 22:48:00
505585,고생많습니다. 잘 해결되면 좋겠네요~^^,닥침I볼트M3I경기,2020-09-11 23:00:00
505585,매우 적절한 비유네요같은생각입니다.물건은 다시 만들면 되지만신뢰는 무너지면 끝입니다.,타오I니로I광주,2020-09-12 08:53:00
505585,,별I아이오닉I순천,2020-09-18 17:20:00
505585,근데 현대와 기아 수리체계나 협력점 방침은 각 다른걸로 아는데 동일한 정책일지 궁금합니다. 여기서 부분수리도 반가운 일이지만 근본 문제는 어디서든 발생돨수 있는 하체 데미지를 줄일 방법이 있는지 현대기아차에서 대책을 내놓아야 할것 같습니다. 그 일례가 2차 언더커버를 달아주거나 용접부위 부근을 강화하고 볼트 구멍 마게라도달아 안쪽 크랙을 막도록 보강하는거겠네요.,굿파I니로I서경,2020-09-11 23:25:00
505585,그렇게 한다고 알루미늄 용접부 취성이 개선되지는 않을것 같습니다.,근육이IKEI서울,2020-09-12 07:01:00
505585,어쨌거나 부실한 하체를 소비자가 떠안아야 된다는거네요ㅎㅎㅎㅎㅎㅎㅎㅎㅎㅎㅎㅎㅎㅎㅎㅎㅎㅎㅎㅎㅎㅎㅎㅎㅎㅎㅎㅎㅎㅎㅎㅎㅎㅎ 그래도 카페장으로서 피드백 올려주셔서 감사합니다!,하늘 l코나n볼트l경기,2020-09-11 23:35:00
505585,고생 많으십니다,희아빠I아이오닉l서울,2020-09-11 23:50:00
505585,지상고 비고 어이가없네;; 지상고가 158이든 130이든 ㅋㅋㅋㅋㅋㅋ뭐 얼마나 차이난다고 돌튀어오르면 거기서 거기지1차 충격을 막아주는게 없는데 그게 문제지 참 어이가없네;; 1차충격에 바로 크랙나면 교첸데;;,즌기I아이오닉I포항,2020-09-11 23:57:00
505585,수고하셨습니다.,나나ㅣ서울,2020-09-12 00:17:00
505585,감사합니다~,곰돌아빠I니로I대전,2020-09-12 00:22:00
505585,보증수리 관련 협력업체 직원들 전기차 리프트 사용시 어디에 떠서 작업하는지도 모르는 분들도있습니다 이런 교육조차 안 되어서 제차 쏘부 브레이크 점검한다고 차 뜨는데 배터리에 고무 고여서 차뜨다가 제가 이야기드리니 내려서 차체에 고무 고여서 뜨더군요 안본다면 어떤 상황일지 암담합니다,유니크 쏘부코나대구,2020-09-12 00:40:00
505585,늘 수고 많으싶니다. 유용한 글 잘 읽고 있습니다. 감사합니다.,버스파일럿 코나 부천,2020-09-12 00:49:00
505585,당연한 리콜감인데 이렇게 유야무야 하는것 같네요. 제가 비록 코나를 타지만 현기차는 아직도 갈길이 머네요. 운영자님 수고가 많으십니다.,멍뭉 I 코나EV I 경기,2020-09-12 01:11:00
505585,동감입니다.,별I아이오닉I순천,2020-09-18 17:22:00
505585,고생 많으셨습니다.,소울푸드I코나I광명,2020-09-12 01:37:00
505585,현기가 앞으로 대응을 잘 해서 점점 성장 할 블루오션을 놓치는 실수를 범하지 않았으면 합니다 ..,아카이l니로l천안,2020-09-12 05:52:00
505585,수고 많으십니다~,유이파파I코나I용인,2020-09-12 06:05:00
505585,하부커버 설치가 안되면 안됩니다8프로도 거의 200만원 가까이되는 큰돈입니다확실한 보호장치를 꼭 해줘라이 현기늠들아,시라빠ㅣ니로ㅣ서울,2020-09-12 07:23:00
505585,차고 높이가 낮지 않다고 하는데 태 매이커는 좀 낮아도 배타리가 제일 낮지 않고 차량 프레임이 도 낮거나 아님면 동일한 높이라도 보호 커버로 배터리을 2중으로 보호하고 있어서 문제가 적은데 현기는 배터리가 제일 아래에 노출에다가 보호 커버등 조치가 없어서 문제인 것 같은데...,파우어,2020-09-12 07:35:00
505585,노고 많으십니다 감사합니다^^,루믹l코나EVl경기,2020-09-12 08:01:00
505585,감사합니다:),아이리스I코나I서울,2020-09-12 08:02:00
505585,"수고 많으 셨습니다.최소한 AS(사용자 과실로 인한 수리시 비용 이전대비 8% 가능??)에 대한 부분은 한걸음 나간거 같다고 생각 듭니다.뎃글로 이미 맣은 추가 질문을 주셔서 다시 언급은 필요 없겠지만기존 차량(니로,코나,쏘울,봉고 등)들의 냉각수 및 베터리 커버 문제에 대한 구체적인 대책안을 현대기아에서공문(서류)로 공지(리콜,무상수리 배포등)해 주었으면 합니다.그전까지는 계속 신고등을 통한 이슈화는 필요하다 생각 되네요.",중반I니로I화성,2020-09-12 08:31:00
505585,레이 obc도 콘덴서 하나 고장나도 다 고쳐야 했고..몇천짜리를 8프로고치면 될걸 전부교체..이놈들이 알면서 왜 그러는걸까요???,가성비l쏘B슴3I세종,2020-09-12 09:11:00
505585,전고가 낮지 않은게 문제가 아니라 프레임 밖으로 툭 튀어나와있으며 거기에 취약부위를 노출하는게 문제인데현대 생각이없네요,둥둥이l코나l구미,2020-09-12 09:11:00
505585,80프로 충전이라니 ㅋㅋㅋㅋㅋ 성능저하 아닌가요?!,산골소년I코나EVI양산,2020-09-12 09:26:00
505585,모터와 감속기 개선형 빨리 나왔으면 좋겠습니다.,깔때기l니로evI대구,2020-09-12 10:46:00
505585,늘 기아는 서자가 아닐까요?? 이번 일 잘 해결되서 기아도 챙겨줬으면,만두 l 니로EV l 성남,2020-09-12 11:17:00
505585,아직 정신 못차렸네요,꿀주먹ㅣ코나ㅣ위례,2020-09-12 11:47:00
505585,문제가 많네요.,기매프리I모델3I포항,2020-09-12 12:04:00
505585,이렇게 정보를 알수있게 되어서 감사합니다.^^,초록잎I코나I경북,2020-09-12 12:07:00
505585,코나 초기모델 혼합 냉각수는요..ㅠ_ㅠ 언제 불날지 불안합니다...ㅠㅠ,코나l코나I성남,2020-09-12 12:10:00
505585,부분 수리 가능한데 안해 준거네요.ㅠㅠ.. 현대는 아직도 국내소비자를 봉으로 보고있네요..난리를 피워야 쬐끔 반응하네요..전기차도 수입차로 사야 하나요??,빅토르I와이I부산,2020-09-12 13:06:00
505585,"매니저님 고생 많으셨습니다.개인적으로 전달 필요하다 생각되는 사항 추가 하겠습니다. 대부분 대멀총각님이 지적해주셨지만, 현차 답변은 배터리 팩은 내구성 검증을 거쳤고 배터리 커버의 용접에 대해서는 문제 없다는 취지의 답변을 했는데요,그럼 배터리 팩이 탑재된 상태로 배터리 커버의 피로 시험을 진행 한건지 궁금합니다어찌됬든 배터리 커버의 볼팅부위에 크랙이 가는 현상이 발견되고 있는 상황인데, 피로 시험을 했다면 이런 상황을 미리 인지 했을거라고 생각합니다 만약, 이런 경우라면 단순 추가 보호 커버로 해결할수 있는 문제가 아닌 내부에서 피로 파괴로 진행되는 크랙은 기존의 배터리 커버를 통으로 개선해 줘야 의미가 있습니다전기차에 유효한 검증이 이뤄진지 이제 겨우 3년 좀 더 지나가는 상황입니다, 그전에는 표본 부족으로 의미있는 숫자가 아니었구요 특히 코나 니로처럼 하부 배터리 장착 방식의 차량은 본격적으로 운행된지 길지 않은데, 벌써 몇몇 차량에 미세크랙이 발생되고 있는데, 이걸 돌빵에 의한 흔적이라고 우기는건 말이 안됩니다. 만약 돌빵에 의한 크랙이라면 돌빵 맞은 흔적이 남아 있어야 하는데 주변이 깨끗한 사진들이 더 많더군요, 배터리 커버의 자체 설계결함으로 보입니다.",우다코I쏠부I동탄,2020-09-12 15:04:00
505585,역시 동호회의 힘 입니다. 개인이 현기와 싸운다면 시작도 해보지 못하고 소비자 판정패일것입니다.,오리발 코나ev의왕,2020-09-12 15:13:00
505585,감사합니다. 고생이 많으시네요.,에프킬러I코나I대전,2020-09-12 15:31:00
505585,감사합니다 화이팅 🙌,실버스타l코나l전북,2020-09-12 16:18:00
505585,E208과 코나ev의 하부 사진을 보면 코나가 어떤 부분을 개선해야할지가 나오네요현차도 알고있을겁니다용접공정도 뺄거고 보강플레이트도 설치 할겁니다다음 모델부터는...이번모델은 조심히 타는 수밖에는아 스트래스야,자안I코나I충남,2020-09-12 16:40:00
505585,정말 대단하십니다 저도 공부를 많이 하고 참여 하겠습니다,초보저언기,2020-09-12 18:08:00
505585,띨빵하니 기술유출이나 당하죠.. 다른회사들은 현기가 만든거보고 저렇게 하지말아야지 하면서 경쟁력 갖춰서 내놓고 있네요,만두 l 니로EV l 성남,2020-09-12 18:51:00
505585,전기차에 대한 위험성이 아직은 존재하는 것 같아 구입 입장에서 많이 망설여지네요.,경북ll잔발,2020-09-12 18:33:00
505585,ㅋㅋ 이건모 원인에 대한 답변보다는 내가 고장나면 싸게 수리해줄테니 고장나도돼 넌 8프로만 지불하면 된단다~~ 배터리 이천만원인데 백육십만원에 퉁쳐줄께 수리비160밖에 안해 싸지? 그러니까 입다무세요~~ 이말이네요.,말용이 I 볼트 I일산,2020-09-12 18:36:00
505585,네 정확하게 해석하셨네요.안타깝습니다.테슬라가 웃고 있습니다.,타오I니로I광주,2020-09-13 09:02:00
505585,현기 더 욕먹어야 되겠다 8프로로 딜치네 ㅋㅋㅋ 현기새차는 베타테스터인증 테슬라가 사고말지,연군ㅣ볼트ㅣ경기,2020-09-12 18:49:00
505585,내년 나오는 차는 아마 커버 씌워서 나올듯... 지금 차는 버리는 카드... 마루타 다른 전기차에 개 발려봐야 함,만두 l 니로EV l 성남,2020-09-12 18:50:00
505585,"고생 하십니다. 운영자 님 너무 고생 많으시고, 현대차 측의 신속한 답이 왔음 하네요.",연오랑l코나l서울,2020-09-12 22:10:00
505585,저도 같은 생각입니다 ?더이상 이런 뉴스가 안나오게 사측에서 무상장착을 해주겠죠,사천 코나 빵돌이,2020-09-13 07:37:00
505585,ㅠㅠ,곰팅I서울,2020-09-13 09:36:00
505585,운영자님 감사합니다 이번 화재 사고 이후 비오는 날 물웅덩이 지나기도 꺼름직하더군요. 이번에 현대 하는 거 봐서 다음차 브랜드를 결정할 계획입니다. 호구는 되기 싫네요.,이안I코나l양주,2020-09-13 09:56:00
505585,지금 동일증상으로 많은 차주들이 피해를 보고있고관련 리콜조치를 취해줄수있기를 요구부탁드립니다.빠른 피드백 및 조치해주시는 운영진분들께 감사드립니다.지속적인 피드백해주시기를 바랍니다,PresidentKI코나I서울,2020-09-13 13:33:00
505585,아이오닉5도 그럴거 같아 보이네요. 현대차는 쉽게 안 변하니까요,그렉I니로I수원,2020-09-13 16:00:00
505585,"회사가 추잡스럽네요... 다음차는 아마 현, 기아는 걸러야.. 아이오익이고 나발이고.. 기아도 마찬가지임.",만두 l 니로EV l 성남,2020-09-13 18:46:00
505585,볼보 나 이런 차들이 현 기 차 값정도 한다면 볼보 타겠죠 현 기 차는 문제를 알면서도 안받아 들이는 어의 없는 진실 ... 전기 차 아니신분들 도 청원 홍보 합시다,코나일렉트로닉인천,2020-09-13 21:30:00
505585,"그나마 다행입니다만이렇게 된것도 회원분들의 요구로 인한것이지 자발적인것은 아니었죠?세종, 부천, 대구(전자관) 차주분들은 사건이 종료되어 잘 마무리는 어떻게 마무리가 되었다는 건가요?",좋은전기차I니로I경기,2020-09-13 22:21:00
505585,이미 자기돈 주고 수리하신분은 진짜 억울하겠네요 보험료 할증 어마무시 하겠네요,애론 안산,2020-09-13 22:43:00
505585,애써주셔서 감사합니다,힘내라88l코나l평택,2020-09-14 07:02:00
505585,고생 많으십니다! 그래도 동호회가 있어 마음의 든든합니다. 기여는 못하지만 열심히 응원하겠습니다! 감사합니다.,남구I코나I경기,2020-09-14 10:37:00
505585,고생 많으셨습니다.,방모l코나l인천,2020-09-14 17:34:00
505585,수고하셨습니다 ㅠㅠ,듬삭티비I코나I제주,2020-09-14 18:20:00
505585,지상고가 제일 높다고하니 커버 추가로 덮어줘도 아무문제 없겠네요? 그럼 커버 덮어주는 리콜이라도하지..,뿡빵I전남,2020-09-14 20:25:00
505585,피드백 진심으로 감사드립니다.배터리 부분수리가능 하다는 답변만으로도 우선 큰 소득이 있는것 같습니다.전기차유저를 위해 애써주셔서 진심으로 감사드립니다.,쎄븐업7I코나evI수원,2020-09-14 22:37:00
505585,오늘 계약했는데 이런 글 볼때마다 겁이 나네요ㄷㄷㄷㄷㄷ 잘 산 건지 좀 후회되기도 하고,론울프ㅣ코나evㅣ일산,2020-09-14 23:15:00
505585,화재가 나도 현대는 참 뻔뻔하구나..,돌고래l모델3l강원,2020-09-15 09:22:00
505585,장거리 운행의 범위가 궁금하네요. 매일 왕복 70km 이상 타고있는데..,뾰로롱I구입예정I세종,2020-09-15 11:36:00
505585,차는 안정성이 제일인데. 목숨걸고 차 사게 만드네요. 글 감사해요~,조이I니로I울산,2020-09-15 11:40:00
505585,적극적인 여러분에게 정말로 감사합니다^^,하이곡I코나I대구,2020-09-15 13:20:00
505585,감사합니다.코나ev타는데 얼마전 차량에 소음이나서 기어드라이브 유니트어셈블리 교체했는데 요근래 또 후면쪽에서 나사가 굴러가는 듯한 소리가 나네요.화재도 겁이나고...좀 무섭네요,나는야,2020-09-15 13:35:00
505585,"정말 애쓰고 계십니다.화재소식 듣고 불안 불안 했는데요, 회원분들과 함께 노력해주신 덕분에 그나마 조금 안도가 되네요.안전차량이 입증되서 현대차에 대한 이미지도 업되고 많이 팔리면 서로가 좋을텐데...우리 차량은 우리가 지킬 수 밖에 없는 현실이 안타깝습니다.고생하시는데 정말 감사드립니다.",마틴l코나l제주,2020-09-15 18:26:00
505585,공지글에서 내려왔네요. 청원기간이라도 해야 되지 않나요?,중반I니로I화성,2020-09-15 23:45:00
505585,"화재의 경우 잘 해결되었다는것은, 현대차와 차주간의 합의가 잘 되었다는 뜻인가요? 대략 새차주고 정신적 물적 피해보상? 뭐 그런게 갈끔하게 되었단 얘기인가요?",대박이견주l니로l충남,2020-09-17 15:36:00
505459,미국 다운 존재의 이유입니다. 이모든것이 무료라니??그것도 직원이 직접 픽업해서 달아서 같다주는것이 놀랍군요~~,뽀로로I니로EVI대구,2020-09-11 15:27:00
505459,2014년 모델S 초창기 사례네요. 현재 나오는 차량들은 이미 다 개선된 하부구조로 출시가 되고 있죠.,블루I모델SI서울,2020-09-12 07:40:00
505323,저는 코나 출고직전에서 취소했는데.. 너무 다행이라는 생각이 듭니다. 볼트나 모델3 구매예정이예요,무상ISM3I서울,2020-09-11 10:04:00
505323,그러게요.. 저는 너무 안알아보고 신청하고 1주일만에 차를 받아서요ㅠ,헬리I코나EVI세종,2020-09-11 10:26:00
505323,어제 왕이프에게 혼났습니다. 왜 이런 차를 샀냐고..,션I코나I인천,2020-09-11 10:04:00
505323,저는 와이프한테 말 못합니다ㅠ,헬리I코나EVI세종,2020-09-11 10:27:00
505323,오닉이 4년 넘었고 코나 곧2년 되는데.. 와이프랑 25만 키로 운행 중입니다. 나름 엄청 험하게 다녔는데 오닉인 보증 이후 잔고장 없고 코난.... 잔고장도 없이 일반보증 곧 끝나서 걱정입니다. 요즘 현기들 고객대응 보면 앞날이 걱정입니다.,슈나이더I오닉COI부산,2020-09-11 10:40:00
505323,사고 없이 잘 타셨군요. 어차피 배터리팩 크랙은 보증이 안되니 보증기간 이래도 의미없는 것 같습니다ㅠ,헬리I코나EVI세종,2020-09-11 11:17:00
505323,코나가 가장 많이 팔렸습니다.,원장i코나i경북예천,2020-09-11 11:00:00
505323,판매 대수 대비 결함 수는 적을 수 있습니다. 화재는 그렇게 위안 삼아는데요. 부품수리비는 통으로 교체 한다는게 너무 말이 안되는 것 같습니다. 그리고 내가 당첨이 될 수 있는거라서요...,헬리I코나EVI세종,2020-09-11 11:16:00
505323,베터리 뽑기라고 해야 할까요? 어머님 사드렸는데..이걸 어찌해야하나 스트레스받네요,궁뎅이l코나l순천,2020-09-11 11:25:00
505323,몰랐으면 괜찮은데 알고 타기는 너무 스트레스입니다ㅜ,헬리I코나EVI세종,2020-09-11 11:50:00
505323,중고처분도 어려워졌죠.. 대폭 감가가 아니고서는.. 전기차 중고판매시에는 ‘띄워서 보여드립니다’가 조건부가 되겠네요.,아돌I구입예정I부산,2020-09-11 11:46:00
505323,ㅎㅎ그러게요. 중고차 2천에 구입 후 배터리 교체하느라 2천 들어가면...ㄷㄷ,헬리I코나EVI세종,2020-09-11 11:49:00
505323,주행하면서 방지턱 높다 싶으면 정~말 천천히 넘습니다... 자갈길은 돌아가야 할판이에요...걱정이 많아요,니은l코나l청주,2020-09-11 14:15:00
505323,ㅎㅎ,슈나이더I오닉COI부산,2020-09-11 15:02:00
505323,그러게요... 저도 막 달렸는데 요즘은 정말 조심하게됩니다ㅠ 제조사에서 시켜주는 강제 안전운전,헬리I코나EVI세종,2020-09-11 21:14:00
505202,대물 5억으로 바꿨습니다.,차칸소년I코나I대전,2020-09-10 23:00:00
505202,화재보단 하부 밧데리 긁히면 2400만원. 이게 확율상 훨씬 클것같습니다.,유진I볼트I서울,2020-09-10 23:39:00
505202,,와니79ㅣi3ㅣ인천,2020-09-11 05:22:00
505202,하늘이 두쪽나도 안해줌,푸로I서울,2020-09-11 15:15:00
