post_id,cmt_content,cmt_author,cmt_created_at
529822,"네 공감합니다<~^^ 문제없는 차 , 문제없는 회사가 어디있겠어요 한국에 현기차 대단한 기업이고 대단하다고 봐요^^ 외국차라고 다좋고 그런것도 아니고 현대차가 해외랑 내수랑 다르다고 많이들 말씀도 하시는데, 기준의 차이도 그 이외에 여러가지 기준이 다르니까 그렇겠죠 그렇다고 수입차들 한국에서 와~~ 할정도로 서비스좋고, 차 고장없이 잘타고 그런건 아니잖아여^^ 실수하고 실패하면서 발전하는거잖아요~",쿠마l아이오닉l경기,2020-11-15 08:11:00
529822,"글쎄요. 대한민국 대표 기업 중 하나이고 외화 벌이에 큰 몫을 한다는 건 인정합니다만 무턱대고 찬양할 필요는 없죠. 깔 건 까야 기업이 발전합니다. 고객이 현기차를 흉기라고 괜히 부르겠습니까? 코나 화재 때 대응, G70 화재는 숨기기에 급급하고 제네시스 라인 결함, 햇볕에 도장이 녹아내리는 말도 안되는 현상. 하브엔진 소음 결함 등등..비싼 차 팔아놓고 이런 결함을 정상이라 하고 고객 과실로 몰고 고객의 안전을 등한시 하는 부분은 지탄 받아야 마땅하죠. 가성비로 탄다고 하지만 그렇다고 목숨까지 내놓고 타야 하는건 아니지 않습니까? 국내 고객에게 하는 행태에도 문제가 많다는 것도 사실이잖아요",바당보름I코나I제주,2020-11-15 08:40:00
529822,보름 님 의견에 전적으로 동의하고 공감합니다. 국내국내 기업이 외화벌이에 큰 몫을 한다는 사실 만으로 사실관계 확인 없이 무조건적인 찬양보다 때로는 비판 받고 지탄 받는 부분을 밑거름 삼아야 앞으로 더욱 성장합니다. 요즘 현대라는 기업을 보면 3류기업보다 못 하는 행태들을 많이 벌이고 있다는 게 팩트지만...,모션I코나I청주,2020-11-15 09:14:00
529822,그렇습니다. 외국에 살면서 현대 기아 차 잘 만들어 많은 사람들이 타고 다니는 모습을 보며 괜히 자부심을 느끼곤 합니다. 정말 빠르게 발전하는 것 같아요. 일본차를 뛰어 넘는 수준으로 올라선 느낌입니다.,인오션I니로I서울,2020-11-16 18:38:00
529822,이쁘긴 했죠 ㄴㅋㅋㅋㅋ,포지구I e208 l경기,2020-11-15 09:06:00
529822,삼성이 흉성이라고 불리나요? 대기업들 가진자들이 그래봤자 거기서 거기지 얼마나 약자입장에서 도덕적인 경영을 하겠냐만은 오뚜기나 유한약품처럼 좋은평가를 받는 기업도 있지요 국내대기업중 현대기아가 이미지 나뿐걸로 몇등안에 들것같다는 생각인데 스스로 반성이 필요해 보입니다만,동막골 I I 전북,2020-11-15 09:54:00
529816,그래도 2021년 1월 1일에 개선안을 제시한다고는 했으니 다르다면 다르다고는 할 수 있겠네요.,존박박I서울,2020-11-15 00:21:00
529816,흠....이 발언이 어떤 의미인지 저도 곰곰이 생각해 봐야겠네요. 저런 날짜까지 확언을 하는 이유를요. 날짜를 확정할수 있다는건 다른 말로는 우리는 이미 어느정도 문제점을 알고 있었다라는 의미로 전 해석이 되는데....,구구I코나EVI오산I,2020-11-15 00:23:00
529816,알고있었다 라고 보긴 어려울 것 같습니다. 리콜 기사는 오늘 나왔지만 조사 들어간지는 이미 좀 됐고 지엠측에서도 이미 자체 조사가 들어간 거라서요. 하지만 지금 시점에서는 어느 정도 문제가 파악되었기 때문에 그렇게 말한 것일 수도 있겠네요.,존박박I서울,2020-11-15 00:25:00
529816,그럼 더 빨리 소비자들에게 고지할수 있지 않았을까요? 당연히 기업입장에서는 못하겠죠. 미리 고지하면 안팔리니까요.,구구I코나EVI오산I,2020-11-15 00:26:00
529816,soc제한으로 화재가능성이 낮아지는게 유의미한건가요? 배터리는 원래 충전량이 100%에 가까울수록 불안정해지는 구조입니다. 유튜브 검색만 해봐도 나오는 기초적인 공학적인 지식입니다. 그리고 비지니스 관계라는게 말처럼 쉬운게 아니라서요. 그 검증시스템 구축하는게 쉬웠으면 진작에 하지 않았을까요? 아쉽고 답답하면 테슬라처럼 내가 만들어서 쓰자라는 마인드가 나오는거죠. 전기차뿐만이 아닙니다. 애플이 이번에 M1칩셋 개발을 대대적으로 홍보한것도 OEM제조방식의 치명적인 문제점을 해결하는 방법은 직접 개발하는 방법 외에는 없다는걸 반증하지 않을까요?,구구I코나EVI오산I,2020-11-15 00:31:00
529816,코나는 소프트웨어 업데이트하는거고요 볼트는 그냥 사용자가 충전을 90까지만 되게 설정하는겁니다. 베타테스트 당하는 것보다 나은 듯 ㅎㅎ,땅콩I볼트evI서울,2020-11-15 00:31:00
529816,아...이게 그렇게 해석이 되나요?,구구I코나EVI오산I,2020-11-15 00:32:00
529816,평생 gm바라기 LG바라기 되시길 바랍니다.,구구I코나EVI오산I,2020-11-15 00:32:00
529816,아...흉기는 절대 눈길도 주지 마세요. XX같은 회사니까요,구구I코나EVI오산I,2020-11-15 00:33:00
529816,"gm바라기가 아니라 흉대 코나랑 동급으로 보이는게 싫은거죠 ㅋㅋㅋㅋㅋㅋ이번 쉐보레 대응이 은폐, 물타기, 고객 상대 베타테스트하는 흉대보단 나은건 맞다고 봅니다.",땅콩I볼트evI서울,2020-11-15 00:36:00
529816,당연히 gm기술력이 앞서죠. gm이 개발한 기술이 얼마나 많은데요. 그걸 다 멍청하게 활용을 못했던게 문제죠.,구구I코나EVI오산I,2020-11-15 00:35:00
529816,제가 알기론 gm이 개발하고 다른 기업에 무료봉사하듯 퍼준 기술이 상당한걸로 알거든요.,구구I코나EVI오산I,2020-11-15 00:36:00
529816,그니까요ㅎㅎ 일단 화재가 미국에서 5건으로 국내는 아직 화재가 많지 않아서 지켜보려고 합니다. 개인적으로 국내는 딱히 화재 위험은 없을거라 봐서...미국은 개인주택에 설치된 충전기가 대부분일거고 우리니리와 충전 환경이 다르고 화재 건수도 국내보다 미국이 더 많은 점으로 볼 때 뭔가 다른 원인이지 않을까 생각합니다.,땅콩I볼트evI서울,2020-11-15 00:51:00
529816,"그게 그거 아닌가요? 애초에 회사에서 충전량 그대로 간 거랑, 충전량 90%제한이랑 비교하면 전자가 나아 보입니다만.",너밖에없다I코나I광양,2020-11-15 01:54:00
529816,그렇긴하네요. 과정은 전혀 다르지만.,땅콩I볼트evI서울,2020-11-15 10:35:00
529816,"우리가 현대에 화내는건, 결과가 아니라 과정이죠. 제조과정에서 화재 나는거 알았을때부터 조치했으면 얼마나 좋았을까요?",너밖에없다I코나I광양,2020-11-15 10:37:00
529816,헐 gm도ㅜ,알요I수원,2020-11-15 01:46:00
529816,"테슬라도 기존에 s,x 화재건으로 강제 소프트웨어 변경해 주행거리 줄어들게 했었죠.",아티모I볼트I부산,2020-11-15 06:11:00
529816,여러 자동차 회사는 다 도진개진이죠....ㅋ,티렉스l볼트l양산,2020-11-15 08:35:00
529816,누가 더 국내소비자를 호구로 보느냐...ㅎㅎ,땅콩I볼트evI서울,2020-11-15 09:03:00
529816,"한국사람들은 항상 화가 나 있다고 하는데, 어느정도 공감이 가네요.",유지니l볼트l용인,2020-11-15 11:56:00
529816,다들 같다고 하지만... 천지 차이로 보이네요...불나기 전에 리콜과 불나고 나서 리콜... 이게 같나요????물론 불난다는 뜻은 대량 화제를 말합니다.,텟스라I모델3I인철,2020-11-15 20:19:00
529723,아직 연락은 받은 게 없는데,썬더I볼트I인천,2020-11-14 18:09:00
529723,어느 시기에 출고된 차량이 대상일까요...?,썬더I볼트I인천,2020-11-14 18:09:00
529723,"""한국 오창에서 생산된 LG화학 고압 배터리가 장착된 2017~2019년형 볼트EV"" 라고 하네요~ 정확한 출고시기는 국내 리콜통지서 받아보시면 될것 같아요~",LU1I레이코나I인천,2020-11-14 18:13:00
529723,아 그렇군요. 감사합니다:-),썬더I볼트I인천,2020-11-14 18:15:00
529723,아이고 두야,레몬I코나I경기,2020-11-14 18:18:00
529723,"사전예방조치 하는건 매우 바람직한 일이지만....근래 코나 화재 발생 원인을 LG배터리쪽에 문제가 있다고 현대기아차에서 걸고 넘어졌었기에, 개인적론 이번 볼트의 LG배터리 리콜부분도 왠지모를 현기의 여론몰이 및 전략인듯 보여지는 측면도 있네요. 끝으로 제조사와 납품한 부품사간 분쟁은 그 기업들끼리 해야할 문제이며,피해를 본 소비자는 제조사를 믿고 차를 구매하였기에 제조사가 소비자에게 결과적으로 적절한 보상을 해야지요.100%가 아닌 90%의 충전거리만 가라는건데...문제가 있지요.",출발I예비l경기,2020-11-14 19:48:00
529723,2017~2018 년식 내리막모드 80% 충전 이거 너무 타격이커요 ..90% 80% 차이 엄청난디.. ㅠㅠ 업뎃될껀데 왜안해줄까요..;;,유봉이I창원,2020-11-14 19:31:00
529717,발전이 거의 안되는걸로 알고 있습니다 차유리에 썬팅에 차단 되어서 발전 거의 안됩니다,l카인lI포터evI구미,2020-11-14 21:17:00
529717,효율이 떨어지는 것이지 발전이 안되는 것은 아니라네요. 블박으로 인한 시동배터리 망가지는걸 막는게 목적이고 이상없어서 만족 ㅇ 선이 애매해서 딱히 붙일만한 자리가 없는 것도 있고요ㅇ 참고로 이전 차에는 태양광 달고 5년 지나도록 배터리 문제가 발생하는 경우가 없었네요. 썬팅한지 5년 된 점도 있지만 7일 이상 방치해도 이상없고요. 태양광 전에는 5일 못 버텼고ㅋ 선택은 자유,쏭윤이I코나I전북,2020-11-15 00:12:00
529717,설치비용이 많이 들지는 않나요??,개리팟I모델3I서울,2020-11-15 01:06:00
529717,인터넷에서 4만원짜리 사다가 달았네요. 내연기관에 비해 직접하기도 그리 어렵지 않데요,쏭윤이I코나I전북,2020-11-15 01:50:00
529717,"리프 1세대 SL트림 지붕에 달려 있습니다. 태양광으로 발전된 전기로 주행 중 전장장치에 사용하고 주차중 발전 전기는 시동 배터리에 저장됩니다. 5년 동안 시동 배터리 방전 이력 없고 야외주차시 폐차할 때까지 출고 당시 배터리를 쓸 수 있지 않을까 생각합니다. 리프가 이 카페에서는 가루가 되도록 까였지만 계기판에 배터리 현재 온도나 SOC가 표시되는 점에서 코나 폭발이 이슈가 되고 있는 지금 보더라도 얼마나 안전에 신경 썼는지 알 수 있네요. 50만대 팔릴 동안, 동일본 대지진 당시 화재 속에서도 불나지 않을 만큼 안전한 차인건 확실하죠.주행거리가 아쉽긴 하지만 적어도 차가 폭발해서 통닭구이 될 일은 없으니~~",경기마스터Ism3l경기,2020-11-15 05:25:00
529717,캠하 2012년식 13만 탄 차 가지고 있는데 한 3~4년 전에 틴팅샵에서 틴팅하면서 acc on 모드로 한번 방전시킨거 말고는 아직 방전 한번도 없네요. 요즘 길게는 2~3주씩도 차량운행 안하는데....배터리 교체한적도 없어요.,일럿Iglc350eI인천,2020-11-15 08:33:00
529679,같은 lg배터리를 쓰는 코나가 활활 불타오르니까..소송 이빠이 걸리기전에 원인 찾으려고 하네요.,팅팅탱탱탱l경기,2020-11-14 14:29:00
529679,불안불안 합니다. 모두들 빠른 리콜 하세요.,불량해병,2020-11-14 14:35:00
529679,아니 십프로 줄이면 제원 사기 아닌가요....,부천 노비 볼팅,2020-11-14 14:37:00
529679,충전용량제한해서 해결하는 건 사기죠... 처음에 차 살때 배터리 보증하고 팔았잖아요... 배터리 교체를 해야 합니다. 화재위험 있는 배터리를 소프트웨어만 손봐서 해결 했다고 차 돌려 줄 것 같으면... 시한폭탄들고 운전하는 기분이 계속 들 것 같지 않습니까?? 중고차로 내놓는다고 한들 팔리기나 하련지... 서비스센터 서비스 엉망진창이더니 볼트 굉장히 실망 스럽네요. 리콜 지켜보겠습니다. “고압충전시스템 정검” 경보가 한달내내 떴던 차를 어머니가 몰고 다니십니다. 내일부터 볼트 타지말고 다른차 타시라고 해야 겠습니다.,여희I볼트I전주,2020-11-14 20:42:00
529679,본문에 2021년 1월 1일 이후 가능한 한 신속하게 90 퍼센트 충전 제한 소프트웨어를 해결하는 최종 방안을 제공할 계획이다. 이렇게 되있으니 기다려보시죠. 미국에서 90퍼센트 제한으로 끝 이렇게 하면 징벌적 손해배상 당해서 모라도 나오긴 하겠죠. 문제는 국내도 동일하게 해줄 것인가 이게 관건일듯 하네요.,호야I볼트I수원,2020-11-14 21:03:00
529679,아항 감사합니다. 정말 서비스센터에서 받은 스트레스까지 해가지규 너무 속상하네요 ㅠㅜ 제대로 처리 해 주길 바래야 겠네요~ 기다려보겠습니다.,여희I볼트I전주,2020-11-14 21:06:00
529679,그쵸 서비스센타 스트레스는 참 ㅋㅋ 이거 빨리 브레이크 부스터도 좀 해결을 해줘야되는데 그것도 아직이고 답답한 부분이 참 많네요.,호야I볼트I수원,2020-11-14 21:08:00
529679,남편도 전기차 트럭까지 이번에 샀는데... 전기차를 너무 일찍 산건가 싶어요... 브레이크 부스터문제 잘 해결 되시길 바랍니다. ㅎㅇㅌ!!,여희I볼트I전주,2020-11-14 21:10:00
529679,충전제한설정 정보 고맙습니다.,만사형통I볼트I서울,2020-11-14 22:41:00
529650,계속은 아니고 당분간만 제한하는걸루 알고있습니다,멀더l코나l안산,2020-11-14 11:19:00
529650,당분간 하는 이유는 뭔가요?,조뽕I용인,2020-11-14 13:10:00
529650,그안에 모가 문제인지 찾아서 해결하겠다는거죠. 미국 국토교통부? 암튼 국가기관이랑 조사 중이라고 하네요. 그게 끝나기전에 원인을 모르니 일단 90퍼해서 불안나게 해라 모 이런거죠.,호야I볼트I수원,2020-11-14 21:21:00
529650,전체 주행거리에 10퍼 깍이죠... 100하시던 분이라면,금강이l니로l경기,2020-11-14 11:25:00
529650,주행거리 좀 더 늘었던 2020년형도 포함일까요??,차데오닉I오닉I울산,2020-11-14 12:36:00
529650,2020년형은 리콜 대상이 아니라고 합니다. 제가 쉐보레에 문의해봤어요,삼지왕I볼트EVI서울,2020-11-14 12:39:00
529650,주행거리 10%제한이 화재사고 해결책이라니... 전 집단소송각이라고 봅니다.,여희I볼트I전주,2020-11-14 20:55:00
529650,2020년식은 100%충전되는데요 2020 년은해당 없다는데요 단80% 에서100%가는데 한시간5분걸리더군요 제경우엔,인천경님,2020-11-14 21:09:00
529618,사전 예방조치인가요. 화재소식은 못들었는데.,빈수레1I스파크I제주,2020-11-14 09:08:00
529618,다른 문건에 주차중 뒷좌석 하부 화재 3건 보고 되어 있는거 같더군요.,할배온l볼트EVl경기,2020-11-14 09:28:00
529618,화재 났습니다,올폴러브I모델3I대전,2020-11-14 10:37:00
529618,국내는 배터리 발화 사례는 없었고 뒷데루등 누전 합선에 의한 화재가 있었던걸로 아네요. 미국에서는 3건 있었다고 합니다.,호야I볼트I수원,2020-11-14 10:52:00
529618,미국에서도 배터리 결함을 의심하고 있나보군요. 중국 생산분 뿐만 아니라 오창공장 제조분도 문제가 있는걸까요? 어쨌든 조사 결과가 발표되면 개선품으로 전체 교체가 필요하겠군요;;; 엘지 타격 크겠는데요..,바당보름I코나I제주,2020-11-14 09:14:00
529618,헐~~~~~,제대로I볼트I경주,2020-11-14 09:15:00
529618,충전90프로 제한? 볼트도 현기나 다를바 없네요,다크나이트l코나l대구,2020-11-14 09:23:00
529618,그래도 얘네는 공식적으로 리콜 안내 영상도 올리고 사전에 양해도 구하네요. 현대는 소비자가 뭐라고 해야 그제서야 글 하나 띡 올리는데..,바당보름I코나I제주,2020-11-14 10:03:00
529618,이렇게 되면 배터리가 문제인가요? 삼성sdi도 포드랑 문제고...지엠까지 엘지화학 문제면...이거 불안해서 100프로 완충은 안한다지만 제대로 시기상조차가 되겠군요...,버건디I볼트I대구,2020-11-14 09:29:00
529618,칼도 주방장이 들면 요리도구가 되지만강도가 들면 흉기가 되듯이 잘~ 써야죠 잘~,은우빠빠I모델3I인천,2020-11-14 09:33:00
529618,https://youtu.be/Jw6pxELcPK8,이클립스ㅣ볼트ㅣ인천,2020-11-14 09:44:00
529618,코나 차주분들은 이번 볼트 리콜 건을 어떻게 바라보실지? 잘 해결되길 바랍니다.,시골얘I오닉니로I충북,2020-11-14 09:45:00
529618,볼트의 리콜은 임시적 조치이며 2021년에 개선된 방안을 마련하겠다고 하였고 현대의 리콜은 그런 이야기가 전혀 없고 배터리의 불량인데 문제가 되는 것만 교체하겠다고 한 것이니 차이가 있네요.,티원I코나EVI경기,2020-11-14 09:56:00
529618,이게 뭔 소린지...믿었던 볼트까지 이러나요...,신기류I코나I경기,2020-11-14 10:03:00
529618,볼트가 안전마진을 충분히 뒀음에도 그런거라면 배터리 문제라고 봐야 할까요..ㅠㅠ 전기차 배터리 대란이네요;;;,바당보름I코나I제주,2020-11-14 10:05:00
529618,한동안 완충말고 내리막 모드로 써야겠네요,만수르I볼트I경기,2020-11-14 10:11:00
529618,"최대 충전 상태를 자동으로 90%로 제한하도록 차량의 배터리 소프트웨어를 업데이트하기 위해 11월 17일부터 딜러점과 서비스 약속을 예약하십시오. 우리 엔지니어들은 상시적인 해결 방법을 찾기 위해 24시간 일하고 있으며, 우리는 2021년 1월 1일 이후 가능한 한 빨리 90% 제한을 제거하는 최종 해결책을 배포할 예정이다.마지막 문장이 제일 중요할거 같습니다. 최종해결책을 어떻게 내놓는지 지켜 보겠습니다. 대충 넘어갈라하면 난리 날겁니다. 현대처럼 국토부나 언론이 쉴드쳐 주지도 않기 때문에 제대로된 해결책을 내놓아야 할겁니다.",바람사자I볼트EVl부경,2020-11-14 10:14:00
529618,헉 ㅠㅜ,허리케인I볼트evI서울,2020-11-14 10:27:00
529618,ㅠㅠ 엘지가 ㅠㅠ,햇살l모델sl경기,2020-11-14 10:30:00
529618,징벌적 보상제가 있는 미국에서 현대처럼 대응하다간 회사 문닫겠죠. 어떻게 대응하는지 지커보겠습니다.,제대로I볼트I경주,2020-11-14 10:49:00
529618,다들 삼성 현대 같은 대기업들이 본사 미국으로 옮기면 더 대박 날 거 라고 떠들지요.자국 호구 잡아 큰 기업인지도 모르고;;; 삼성이나 현대 같이 기업 운영하면 미국에선 순식간에 공중분해 입니다...,어른이l볼트EVl대전,2020-11-16 13:06:00
529618,빨리 bms 업그레이드가 나오길요..... 이제 어딜가든 걱정이네요 ㅠㅠ,옆집백수I볼트I서울,2020-11-14 10:54:00
529618,엘지는 이 책임을 온몸으로 다 받아야겠군요 ㅡ.ㅡ,아쿠아ㅣ니로ㅣ일산,2020-11-14 18:16:00
529618,이번에 내리막 설정 처음 해봤네요. 3년 가까이 항상 완충했는데.. 차량 이상 증상 한번도 없었는데 이렇게까지 진행되는군요. 진짜로 90% 로 제한이 되어버린다면.. 주행거리 많이 줄어들겠네요. 이번 겨울 더욱 힘들 것 같습니다..ㅠ.ㅜ,시은아빠I볼트l인천,2020-11-18 09:40:00
529618,좀 이상한 부분이 있다면 리콜 안내문레 배터리 제조국가나 지명은 왜 얘기하는 걸까요.,예린아빠I볼트evI양주,2020-11-18 10:40:00
529600,코나 판매량과 비교해보면 그렇게 많이 난것도 아닌것 같습니다. 그래도 미국이라 선재적리콜을 하네요. 어디처럼 인심쓰듯이 하지는 않고,크루I볼트예정I서울,2020-11-14 07:18:00
529600,LG 베터리로 범인지 좁혀지는가요? 주식 폭락수순???,가성비l쏘B슴3I세종,2020-11-14 07:36:00
529600,테슬라 LG배터리는 문제 없는걸로 봐서는 자동차 제조사들이 마진율이나 BMS관련 개발에 무심했던것 같습니다...,수녕군IM3I서울,2020-11-14 07:42:00
529600,원문기사 보면 테슬라 화재도 미국 고속도로 교통안전국에서 원인 조사 중 이라고 되어있네여,오갱I볼트l오창,2020-11-14 08:49:00
529600,충전제한이 리콜? ㅠㅠ 근데 국내는 어쩔런지,아조씨I볼트I전북,2020-11-14 07:58:00
529600,충전제한은 임시로 시행하고 21년 초에 충전제한을 해소하는 해결을 하겠다고 하네요. 충준히 설득력 잇는 내용이라 보여집니다.,방전I볼트EVI경북,2020-11-14 11:14:00
529600,헐 주행가능거리 줄어드는데 ㄷㄷ,사막여우bolt ev 군산,2020-11-14 08:05:00
529600,"볼트건 코나건 주행거리 제한 조치가 최선의 방법인가요? 이런 논리라면, 제조사들의 차량판매시 홍보로 사용했던 주행가용거리는 모두 사기네요.",카키I코나EvI남양주,2020-11-14 08:40:00
529600,https://www.detroitnews.com/story/business/autos/general-motors/2020/11/13/gm-recalls-68000-chevy-bolt-evs-potential-battery-fires/6279998002/본문 뉴스를보면 총7만대 중 5대의 화재가 있었고 그 중 3대를 미국 교통안전국과 분석한 결과 배터리가 완전 충전되었거나 충전 되어갈때 발생해서 선제적으로 대응한다....7만대 중 5대 0.007%저는 리콜안하고 탈래요..ㅋㅋㅋ,오갱I볼트l오창,2020-11-14 08:46:00
529600,저도 내리막모드로 쓰려고요,만수르I볼트I경기,2020-11-14 10:14:00
529600,확률로 보니 생각보다 얼마 안되네요ㅎㅎ,범고양이l볼트l포항,2020-11-14 11:01:00
529600,그 0.007%도 미국에서만이죠ㅋㅋㅋ 전 국내는 화재 위험 없다고 봅니다 ㅎㅎㅎㅎ,땅콩I볼트evI서울,2020-11-15 01:03:00
529600,SK 배터리 쓰는 니로는 다행이라 생락해야 하는걸까요...,만두 l 니로EV l 성남,2020-11-14 08:50:00
529600,"니로는...차량 구조상 항상 배터리상태 신경쓰며 조심히 운행해야하는 문제가 있죠. 이건...제조사도 어떻게 손쓸방법이 없어보이더군요. 구조적인 문제라. 볼트는 일단 실제적인 리콜방안이 아직 나온게 아니라 선제적인 리스크예방차원의 가이드를 제시한거고요. 실제 리콜이 어떨지 내년에 지켜봐야겠지만, 제발 소비자를 우롱하는 행태는 절대 없었으면 하네요",뽄드I볼트evI용인,2020-11-14 22:37:00
529600,"니로 SK배터리는 화재위험으로 마진을 많이 남겨둔게 신의 한수 였던듯..자동차 회사들이 LG는 너무 믿었고, SK는 너무 안믿은거져.",가가멜I니로EVI남양주,2020-11-14 08:54:00
529600,ㅋㅋㅋㅋ 안믿은게 오히려 도움이 됐네요,이게모야I볼트I경기,2020-11-14 10:32:00
529600,어디서는 코나나 니로나 안전마진은 동일하다고 하던데요. 아직 화재사고가 한건도 없는 걸 봐서 안심은 되긴 하지만요. 테슬라도 장거리 주행이 아닌 평상시에는 90% 만 충전을 권장하더군요. 그래서 저도 100프로 충전하고 주차장에 방치하는 건 되도록 안합니다.,로바I니로I경기,2020-11-14 11:12:00
529600,동일합니다.,다시왔다,2020-11-14 11:47:00
529600,배터리 마진은..볼트가 8%정도라..여유있을겁니다. 이번건은 리콜이전에 리스크 예방차원의 안내 지침이고요. 내년에 과연 어떤식으로 해결방안 나올지 소비지로서 잘 따져봐야겠네요 ㅠㅜ,뽄드I볼트evI용인,2020-11-14 22:40:00
529600,리콜 안하는게 낫겠네요화재 비율도 낮고,은우빠빠I모델3I인천,2020-11-14 09:12:00
529600,장거리 주행많이하는편이라 완충 자주하는데.. 배터리 로또 당첨되면 66kwh 배터리로 바꿔줄려나 그럼 대박인댕,꼬마l볼트evl서울,2020-11-14 09:17:00
529600,"리콜대상은 17~19년. 그 이후 생산차는 배터리가 바뀐건가여? 흠,,,",갈색I성남,2020-11-14 09:58:00
529600,우리는 2021년 1월 1일 이후 가능한 한 빨리 90% 제한을 제거하는 최종 해결책을 배포할 예정이다. 라고 하는거보니 90프로 제한은 임시 조치로 보입니다.,호야I볼트I수원,2020-11-14 10:59:00
529600,충전 제한은 한시적인 조치이고 애초에 주행거리는 과장광고 입니다. 적절한 보상이 이루여저야 하지 않을까요 니로는 상관없다지만 코나는 업데이트 하고 줄었는데,만두 l 니로EV l 성남,2020-11-14 11:16:00
529600,20년 차는 상관없는건가요? 이미 소프트웨어 업그레이드 셋팅되어서 나오는건가요?,곰돌I볼트I김포,2020-11-16 12:15:00
529554,근처 정비소에서 리콜받으라고 계속 연락 오는데 가야할지 고민이네요.,푸른바우,2020-11-13 21:49:00
529554,10분 검사 별거 아니라 생각했는데 급속충전시 문제가 생기는군요... 정말 화딱지 나시겠네요...,보민아빠I니로I충북,2020-11-13 22:17:00
