post_id,cmt_content,cmt_author,cmt_created_at
529554,집밥 밤새 충전하시는분은괜찮으나 급속하시는분성질 제대로 납니다거기다 50kw급 환경부 충전기에코나 20%쯤에서 완충하려면 거짓말 않고 4번이상 충전 결재해야됩니다이게 뭐 현대 최초코나 광고할때기준하면 완전 사기입니다건교부 현대 한집안 사람들같습니다완전 사기꾼 집단같아요,상르I코나I경남,2020-11-14 07:35:00
529554,전기차에 가장 중요한게 완충 주행거리와 충전속도인데 이걸 개판으로 만들어놨으니현대차는 반드시 책임지고 배상을 하던지 해야할것입니다...,전기밥차I코나I부산,2020-11-14 10:07:00
529554,저는 마 포기하고 90%만 충전 설정하고 다닙니다. 100%는 스트레스도 받고 정신건강에 안좋은듯 해서요.,비해l코나l부산,2020-11-15 10:20:00
529393,헐 그런게 있나요 처음 들었습니다 코나는 아니지만 ㅠ,섭섭하군n연천,2020-11-13 14:09:00
529393,설마요.실제로인가요?,아미쿠스l쏘울l인천,2020-11-13 14:18:00
529393,사고 많이나서 거절당하는건 있는데그건 처음 듣네요,킹스턴l아이오닉l김해,2020-11-13 14:22:00
529393,있다면 검색을 통해 알수 있을거 같아요 저는 못 본거 같네요,아련다솜I테슬라l경북,2020-11-13 14:36:00
529393,어제 갱신했는데요?,미친푸우ㅣ코나ㅣ서울,2020-11-13 14:45:00
529393,보험사에서는 그런이유로 보험거부 못합니다.,오늘간당I코나l서울,2020-11-13 14:53:00
529393,보험료가 올랐습니다. 전체적인 사고발생이 많아서 그렇다고 하더군요.,루피82I코나일렉I울산,2020-11-13 15:12:00
529348,1년 기다리고 새로 나오는 모델로 가시는게...,하틴I니로I서울,2020-11-13 11:19:00
529348,아 내년에 새로 나오나요??정보 감사합니다,수원S김병장,2020-11-13 11:20:00
529348,내년에 아마 전기차 신차가 다양하게 나오는걸로 알아유,하틴I니로I서울,2020-11-13 11:26:00
529348,lg에서 배터리 생산 공정을 바꿔서 개선이 됬다고 하긴 하는데...내년에 새로운 차들이 많이 나오니 조금 기다리시는게 좋을듯합니다,킹스턴l아이오닉l김해,2020-11-13 11:24:00
529348,중고시세 700이상 하락한차량... 신차 할인 1천해주면 고려해봄니다,시지l오닉 코나l대구,2020-11-13 11:27:00
529348,중고차 화재이슈때문에 신차가 보완이 되었음 괜찮지않을까싶어 여쭤봤네요,수원I김병장,2020-11-13 11:29:00
529348,전 괜찮은거 같아요 생각보다 장점이 많더라구요,드방이I코나I충주,2020-11-13 11:38:00
529348,전기차는 외자체가 정답인듯,코닥ㅣ니로ㅣ부산,2020-11-13 11:44:00
529348,"순수하게 궁금해서 그러는데 불나고, 리콜도 제대로안해줘서 벽돌되고 그러고있는차를 왜사려고하시는건가요? 다른전기차들도 있는데 굳이 왜 코나를 사려는건가요?",밴쿠버l모델3l홍길동,2020-11-13 11:45:00
529348,아직 실정이 안좋은가보네요 suv급 찾다보니 답이없어서요 테슬라y는 나올생각도 안하고 해서요 아직그상태면 구매는 어렵겠죠,수원I김병장,2020-11-13 11:47:00
529348,2222 SUV급 찾는 게 중요한지 만의 하나의 확률로 화재는 남의 일이다 라고 생각하는 게 더 중요한지...,상어의꿈I코나evI경기,2020-11-13 11:56:00
529348,y 내년에 나오겠죠,큐리어스l모델Yl서울,2020-11-13 13:17:00
529348,안됩니다. 최소한 페이스리프트 한거 사야해요.. 20년식이라도 미친 중고가하락 피할수없을꺼에요. 내 자식이라고 품에서 죽일꺼면 사셔도됩니다만...,흔한사람코나경기,2020-11-13 11:47:00
529348,넹 다들 뜯어말리시네요 조언들 감사합니당,김병장I수원,2020-11-13 11:56:00
529348,현기차 흉기차 사시면 후회 합니다 ㅠㅠ 그돈으로 저도 테슬라 살껄 그랬어요ㅠ,섭섭하군n연천,2020-11-13 12:05:00
529348,절대 말립니다,쪼꼬미I코나I전주,2020-11-13 12:16:00
529348,니로 사세요 코나 좁아여,존기차I코나I경남,2020-11-13 12:35:00
529348,걍 푸조전기차를.. ㅋ,I찐군I 코나ev I 대구,2020-11-13 12:41:00
529348,코나 사시려고 결정하셨아도 조금만 더 기다리세요.. 지금 페이스리프트모델 위장막테스트중이에요,남대생I코나evI천안,2020-11-14 02:28:00
529332,"19년 4월 출고 6개월 기다렸는데... 저.. 젤 비쌀때 산건가요 풀옵션 5500 할인 1500 4000에 구매.,.",스피드핵I코나I광주,2020-11-13 10:44:00
529332,저도 최고가에 샀죠,행복한부자I코나I세종,2020-11-13 10:49:00
529332,그러네요 기분 나쁘셨다면 죄송합니다 ㅜㅜ19년도가 제일 안좋았던것 같네요 ㅠㅠ,겸둥이I아이오닉I인천,2020-11-13 11:00:00
529332,저도 같은 시기에 구입했네요. 서울은 보조금이..ㅜㅜ,포스I코나I서울,2020-11-14 09:50:00
529332,부러워요 인천 한대 더 추가 가시나요??,가성비l쏘B슴3I세종,2020-11-13 10:48:00
529332,보조금을 더이상 받을 가족이 없습니다 ㅠㅠ,겸둥이I아이오닉I인천,2020-11-13 10:59:00
529332,1400억을 받으시면1339억 5400만원 남으시겠네요ㅋ,행복한부자I코나I세종,2020-11-13 10:50:00
529332,ㅋㅋㅋㅋ 저 1억만...ㅋ,쏭블리I볼트EVI서울,2020-11-13 11:42:00
529332,취등록세 운송료하면 3350,멀더l코나l안산,2020-11-13 10:58:00
529332,네 ㅎㅎ근데 보통 차랑가격 이야기할땐 순수 차랑 가격만 ^^:,겸둥이I아이오닉I인천,2020-11-13 11:01:00
529332,최대 8프로 할인 아닌가요?,로즈I코나evI김해,2020-11-13 11:06:00
529332,오늘 가서 견적 뽑으니까500이상 할인되는것 같던데요견적서는 사진있는데포토샵을 못해서 공유를 못하겠네요,겸둥이I아이오닉I인천,2020-11-13 11:17:00
529332,차량가 5300에 530 할인,겸둥이I아이오닉I인천,2020-11-13 11:20:00
529332,불자동차를 왜 사시는지??? 제대로 안되는 리콜로 질질 소비자를 지치게 하는 회사 차..,까끼I코나I양산,2020-11-13 11:50:00
529332,지금 나오는 코나는 화재와 상관 없다고 하던데요,똥풔어l코트론l서울,2020-11-13 12:23:00
529332,믿을 수가 있어야죠..ㅠㅠ,까끼I코나I양산,2020-11-13 13:12:00
529332,"믿거나 말거나지만, 해당 내용 기준일 이후 생산 차들은 이슈 없는 것 같네요, 현재까지도 그렇고.. 최근 사고 당해서 대대적으로 6주간 수리(노량진 남부사업소) 맡기는 와중에 여러차례 리콜 대상이 아니면 BMS에 손안대는 것이냐는 질문에 늘 그렇다고 답했어요, 혹시라도 해당 건으로 문제(사고 수리 포함)가 생기면 해당 사업소 전기차 파트에서 끝까지 책임지겠다고 하네요. 반신반의지만 그렇다고 합니다.",라마l코나EVl경기,2020-11-13 15:06:00
529332,인천은 아직 보조금이 있나요? 대구는 코로나땜시 예산없는걸로아는뎅,무명I쏘울부스터I대구,2020-11-13 13:40:00
529332,인천은 많이 남았습니다전 가족 전부 3대를 뽑아서 ㅎㅎ이거 여기서 150은 더 싸게살수 있는데ㅜ아쉽,겸둥이I아이오닉I인천,2020-11-13 13:52:00
529332,인천 보조금은 서울 아파트값을 주는군요+.+,단무지I볼트모3I경기,2020-11-13 15:16:00
529332,코나 니로 오닉 3개차를 다 타보니 주행성능은 코나가 최고였네요..다들 장단점이 있는듯 ㅎㅎ니로는 넓직하고~뒤에 사람태우기가 코나보다낫죠. 근데 코나보다 반응이 한박자 느린느낌이었습니다. 오닉은~가성비짱..,즌기I아이오닉I포항,2020-11-14 16:57:00
529332,코나가 가성비 짱이죠 3천초반이몀,겸둥이I아이오닉I인천,2020-11-14 17:00:00
529214,엘란트라가 얼마나 장수명인지 알면 답나옵니다,볼트I부산,2020-11-12 23:25:00
529214,북미에 파는차종은 다음모델이 나와도 같은이름으로 판매해서죠,볼트I부산,2020-11-12 23:48:00
529214,그럼 니로는 단종 되었을까요?,향기l포터2l전남,2020-11-12 23:25:00
529214,페이스리프트 이미 나온다고 정보가 있어서...사람들이 그 문제 때문에 단종 할거라고 예상했는데 우리만 난리지 업계에선 그리 큰 일로 보지 않나봐요 전기차 화재로 인한 리콜이라던가 일들이 예전부터 있어와서 개선되고 있는 단계로 보고 있는듯기아도 니로나 쏘울 중에 하나는 단종 시킬거 같긴한데 뭘 단종시킬지...,킹스턴l아이오닉l김해,2020-11-12 23:42:00
529214,바이든이 한국 전기차 퇴출시키려고 하더라고요 ㅋㅋ,구구I코나EVI오산I,2020-11-13 02:01:00
529125,오다 안오다 하더라고요.,아트라스I니모3I울산,2020-11-12 19:02:00
529125,현대차 참 ~~ 가관입니다,코나봉ㅣ코나ㅣ동탄,2020-11-12 19:46:00
528973,리콜은 어떻게 해서든지 화재를 줄여보자는 것이지 근본적인 조치는 아닌 것 같습니다. 어쩌면 저들도 근본적인 해결책을 모르는 것 같습니다.,황터l코나l경북,2020-11-12 11:08:00
528973,근본적인 해결책은 아는데 비용절감이죠 다~아니깐 저러는 거라고 생각합니다. 이렇게 해놓고 여름되면 여러사고터질듯합니다,킴스봉I코나I대구,2020-11-12 12:17:00
528973,답답할 다름입니다 ㅠㅠ,인새미I코나EvI충남,2020-11-12 11:10:00
528973,많이 불편하시겠네요ㅠㅠ이사태가 빨리 해결되야할텐데..,데이I코나I서울,2020-11-12 11:48:00
528973,지금 잘사용하고있는데 안좋아지는얘기가 있으니 리콜하기 싫어집니다.,진영의신비I코나I김해,2020-11-13 00:32:00
528854,하세요 불나요,멀더l코나l안산,2020-11-11 23:25:00
528854,하지마세요 벌써 두번씩이나 벽돌돼서 스트레스 만땅요,빈나빠I코나I경기도,2020-11-11 23:28:00
528854,"화재 위험성이 있으니 안전을 위해 하는게 좋지 않을까요? 별명I전기차명I지역 한글별명으로 변경 해주세요. ^-^ 한글별명은 ""별명I보유전기차I지역"" 결합으로 구분은 영문대문자 아이(I)입니다.",아트라스I니모3I울산,2020-11-11 23:45:00
528854,일단 리콜을 하시는게 좋을듯 합니다.단 리콜후에 충전하고 나면 벽돌되는 현상이 많은 만큼업데이트 리콜후엔 반드시 가까운 곳에서 시험 완충을 해 봐야 합니다.업데이트 리콜후에 장거리 가시거나 하지 마시고 곧바로 완충해서 이상 없으시면 정상 작동되는 것입니다.,상르I코나I경남,2020-11-12 06:32:00
528768,그래서 지금 집단 소송 진행중입니닷.. 참여의사가 있으시다면 고려해보세요,레베I코나I울산,2020-11-11 17:33:00
528768,제 짧은 사견으로는 리콜을 받는게 소비자의 권리를 주장하는데 유리할거같습니다.물론 현대차의 의도는 명확합니다. 교체비용 절감이지요소프트웨어 업데이트로 차량의 문제점을 수정하는것이아닌 배터리 불량 유무를 판단하는 목적이 클거같다는게 제생각입니다. 그렇게 불편함은 소비자 몫이 되었죠.한데 여기서 저도 그렇고 리콜후 벽돌 입고후 교체 된분들을 보면 교체를 해주긴 해줍니다.교체받고 운행을 해봐야알겠지만 문제가 없을거다라는 전제하에 크게 서비스가 나쁘지는 않다고 생각됩니다.혹여나 문제가 생기더라도 소비자의 권리를 강력히 주장하는데 근거가 되기때문에리콜을 거부하고 문제해결을 촉구하기보다리콜후 배터리 교체후에도 문제가 발생시집단소송 이나 여러측면의 집단행동시 소비자의 권리를 주장하는데 더욱더 힘이 될것이다 라는게 제 생각입니다.하여 지금 당장의 조금의 불편함은 감수하더라도추후에 문제발생시 더큰이득을 위하여 리콜 받기를 잘했다는 생각이 듭니다.지극히 개인적의 생각이니이런사람도 있구나 생각해주시면 감사하겠습니다.,아트I코나I평택,2020-11-11 17:38:00
528768,리콜받아야 나중에 집단행동시 소비자 권리 주장에 힘이 될거라고 생각하시는 이유가 궁금하네요.,주적은현대I코나I인천,2020-11-11 17:40:00
528768,"물론 공감하는 부분도 있습니다만 베터리 전체 교환이 아닌 모듈, 셀 교환이 이뤄지고 있는게 문제라서... 이건 문제 해결이 아닌 원인을 찾기 위한 시간끌기거든요... 정말 이게 뭔짓인지....",레베I코나I울산,2020-11-11 17:50:00
528768,"일단 근본원인은 화재발생이지요.즉 결함입니다.리콜을 거부한다는건 화재발생문제를 알면서도자발적으로 위험부담을 안는쪽을 택했다는겁니다.일시적으로 리콜후 수리된차들이 문제없이 굴러다니는시기가 길어질수록 자발적 리콜거부차들에대한 현대차의 책임의무는 적어지게되어 이를 소비자가 떠안아버리는최악의 경우를 보면 안되겠지요허나 리콜 수리후 또다시 화재가 발생한다면현대차는 결함제작,후속조치 미흡 으로 한가지 악수가 늘어나게 된다고 봅니다.제입장에서는 화재문제로 크게 두가지 1.불안감과 2.중고차 가격 하락 의 피해를 입었다 생각합니다.불안감이 해소되어도 중고차 가격에대한 소송은 동참할 의사가 있습니다.허나 이역시 리콜수리후 이미지회복에 필요한 안정기를 거친 차량의 거래가격에대한 데이타가 필요하다가 보며이를 위해 많은분들의 리콜 수리 내용에대한 정보와시간이 필요하다고 생각합니다.",아트I코나I평택,2020-11-11 18:35:00
528768,"여기서 조금의 불편함이 아닙니다. 엄청난 불편함에 사기판매, 사기리콜 까지 하고 있습니다.",킴스봉I코나I대구,2020-11-11 18:59:00
528768,리콜 거부가 어떻게 화재위험부담을 안는것이 되는거죠? 애초에 리콜내용 발표대로 했다면 그말에 가깝지않을까요? 10분연장도 모자라 충전속도제한도 없다더니 이부분도 건드린거 같네요 이런 사기나 마찬가지 대응에 차주분들은 거부 하는겁니다. 10분정지+충전속도 고지없이 건드린건 사기입니다.,킴스봉I코나I대구,2020-11-11 19:08:00
528768,사기 맞아요..,미래소년ㅣ코나ㅣ대구,2020-11-11 19:18:00
528768,1000% 동감합니다~리콜안하고 불나면 책임질꺼란 사람들 두뇌가 없는듯~~현대가 잘못하고 제대로 고쳐주지도 않는데~~~,jian 코나 충남,2020-11-11 19:37:00
528768,저도 리콜 안하고 있음~~,jian 코나 충남,2020-11-11 19:36:00
528768,"심정 이해갑니다. 저는 리콜전으로 돌려달라고 요청까지 했으니까요,,, 그래도 가족 안전 생각해서 첫날 바로 해버렸네요",쿠루I코나니로I청주,2020-11-11 20:10:00
528768,현대에서 충전90프로 충전으로 인한 주행거리 단축 지연타임에 대한 보상이 있어야하지 않을까요,마스타킴I코나 경기,2020-11-11 20:16:00
528768,심정은 이해하지만그래도 리콜에 응해야 합니다.일단 리콜 업데이트 하시고 반드시 가까운 곳에서 완충하고 다음 상태를 점검해야 합니다.리콜업데이트후 충전후에 벽돌되는 상황이 많은 만큼 일단 장거리 주행마시고완충후에 이상 없음을 확인해야 합니다.벽돌되면 배터리 교체 요구하시고 이상없으면 리콜조치 되었다 생각하시고그냥 마음 편하게 하시는게 속 편합니다.현대 이놈들 개판이지만 현재로선 별 뾰족한 수가 없으니건교부도 마찬가지 이쯤되면 강력하게 리콜로 배터리 교체로 조치해줘야 하는데엉망징창인 교통부입니다.,상르I코나I경남,2020-11-12 06:43:00
528768,현대가 하라는 대로 해놓고 그래도 이런 저런 문제가 있다고 주장을 해야지 현대가 이런 해결책이 있으니 해보자 했은데 그거 말고 다른걸로 해주세요 이럼 주장이 받아 들여지겠어요 우선 나는 책임이 없어져야 현기 책임만 남는거져 어깃장 놓는거에요,앤ㅣ코나ㅣ성남,2020-11-12 08:16:00
528768,그 해결 방법의 조건은 상호 피해가 없다는 전제 아닌가요주행거리가 줄었고 완충을위해 20~30분을 소비자가 더 소비해야해요그럼그만한 보상이 있어야 하지 않나요,마스타킴I코나 경기,2020-11-12 08:18:00
528768,그러니까 소비자는 피해가 있으니 이번 리콜 받았는데 문제다 라고 또 주장을 해야죠,앤ㅣ코나ㅣ성남,2020-11-12 08:20:00
528768,성능다운 조치로 화재가 발생않되고 하면 그냥 피해와 불편함 감수할건가요,마스타킴I코나 경기,2020-11-12 08:21:00
528768,자꾸 따지기만 하는 대화는 불편하니까 제가 피해 불편함을 감수 할거냐 이런 류의 대화는 쓸대가 없어요 ㅋㅋ 그보다는 이런 저런 문제가 해결 안돼니 현대는 해결하라고 현대를 공격해야지 같은 코나 오너를 공격하는 건 좋은 방법이 아니니 대화로 무슨 문제를 해결하거나 이길라고 하지 마세요,앤ㅣ코나ㅣ성남,2020-11-12 08:24:00
528768,저는 그 공격 방법이 리콜거부라 생각해요코나 오너들의 뜻을 전달하는 방법이기도 하구요앤 님은 어떤 공격법이 있는지 의견주시지요,마스타킴I코나 경기,2020-11-12 08:29:00
528768,웃어주세요!! 저는 공격방법이 없어서 한숨만... 푹푹 쉬네요,앤ㅣ코나ㅣ성남,2020-11-12 08:30:00
528768,방안도 없으면서 방안이 있는것 처럼 이야기 하시면서 따진다는 표현을 쓰시는건 무례하신게 아닌듯합니다먼저 따지신게 누군지 다시 첨부터 읽어보심이~,마스타킴I코나 경기,2020-11-12 08:32:00
528768,제가 먼저 따졌군요 헐 죄송합니다 저는 리콜 했고 78프로 까지만 충전해서 나중에 문제 생기면 현대에게 봐라 리콜 했는데 문제가 해결이 안됀다 보상해라 하고 현기 본사 앞에 차 대 놓을려고요 불만 나지 말기를,앤ㅣ코나ㅣ성남,2020-11-12 08:35:00
528768,80프로에서 부터 배터리 검사 로직이 실행 되니까 조질때까지 조져볼려고요 이게 저의 대응 방법입니다,앤ㅣ코나ㅣ성남,2020-11-12 08:36:00
528768,저한테는 연락오더니 지금 리콜 안받은 사람은 저를포함 5명밖에 없다고 하더군요 불이나서 피해가 나든 어쩌든 현대차 책임이죠,무선통신I코나I부산,2020-12-14 18:05:00
528768,저는 못견뎌서 리콜받았어요,마스타킴I코나 경기,2020-12-14 23:37:00
528732,ㅎㅎ,은혜야l사랑해l부천,2020-11-11 15:29:00
528732,ㅋㅋㅋㅋㅋㅋㅋㅋ,운주당I없음I경기,2020-11-11 15:30:00
528732,댓글학원 다니시는건 아니신지 ㅋㅋㅋ,밍규리아빠I코나I대구,2020-11-11 17:31:00
528732,현대차는 사지마세요,산불조심I코나I청주,2020-11-11 15:30:00
528732,넵. 잘 새겨 듣겠습니다.,운주당I없음I경기,2020-11-11 15:31:00
528732,G80도 불자동차ㅇㅇ퐈이어~~,쏭윤이I코나I전북,2020-11-11 15:31:00
528732,현대는 안정화부터 되야할듯.. 코나 불나는 원인도 밝혀져야하고 OTA도 되야하고 전용 플랫폼도 안정화되야하고 아직 갈길이 먼듯,마징가I모델3I서울,2020-11-11 15:39:00
528732,다들 맞는 말씀들 하시네요.... 현대라~~심히 고민을 해보시는게..... ^^,jian 코나 충남,2020-11-11 15:40:00
528732,요즘 여기 이런글 올리면 다 똑같은 댓글 밖에 안달려요 ㅋㅋ 거의 메크로임 ㅋㅋ알아서 판단하세요,킹스턴l아이오닉l김해,2020-11-11 16:30:00
528732,현대 전기차는 화재부분을 해결 하기전까지는 좀 그런듯합니다..,코나주인l 세종,2020-11-11 16:28:00
528732,G80이면 내연차 플랫폼 차량 같은데전기차라면 전기차 전용 플랫폼으로 사시는게 좋구요현대라면 최소 전용플랫폼 2~3세대 정도 사야만 버그나 고질병이 적은차 사지 싶습니다.,파우워I포터I경남,2020-11-11 22:11:00
528732,오히려 벤츠가 결함이 더 많군요 ㅜㅜ,운주당I없음I경기,2020-11-12 12:33:00
528732,제네불나 불나시스 되는건 아닌지 ㄷㄷㄷ,산골소년I코나EVI양산,2020-11-12 12:31:00
528649,테슬라 흉내낸 느낌이군요,블랙쿱I코나l경기,2020-11-11 10:13:00
528649,,머털도사I코나I부천,2020-11-11 10:16:00
528649,불나고 보상도 제대로 앙해준 차를 사는 사람은 호구 인증이지~?,포리I코나evI고양시,2020-11-11 10:19:00
528649,찐호구죠ㅋㅋ,즐거워예I코나I부산,2020-11-11 10:44:00
528649,결국 코나EV 도 페리가 되는군요.,아트라스I니모3I울산,2020-11-11 10:22:00
528649,기술적 변화가 없는 제품인데 가격은 많이 올리겠죠.,우기I코나I부산,2020-11-11 10:23:00
528649,몇년있다고 이차도 코나가 아닌 불나 이렇게 안불렸으면 하네요. 어짜피 현대차 사는일은 없을테니까.,미친푸우ㅣ코나ㅣ서울,2020-11-11 10:23:00
528649,모델3처럼 앞코 무늬를 없앴나 보네요 훨씬 나은듯,알팔I모델3I서울,2020-11-11 10:25:00
528649,코나ev ??? 설마 또???????????????????????????????????????????????,jian 코나 충남,2020-11-11 10:26:00
528649,정신 못 차렸네 현대,던힐I코나I경남,2020-11-11 10:29:00
528649,아 또 나오는구나,은우빠빠I모델3I인천,2020-11-11 10:30:00
528649,깔끔하긴 한데..불차라서,슈나이더I오닉KOI부산,2020-11-11 10:36:00
528649,호불호좀 갈리겠네예~~ 근데 휀더 투톤칼러 없으니 그나마 좀 봐줄만한..... 근데...저건 불 안나나요?,돈치I니로evI제주,2020-11-11 10:41:00
528649,제정신인가?불나는건해결됨?ㅋㅋ,즐거워예I코나I부산,2020-11-11 10:43:00
528649,하부 보호커버해주고 불만 안나믄 괜찮아보이네요,키덜트여ㅣ코나ㅣ광주,2020-11-11 10:43:00
528649,정내미떨어짐 코나,즐거워예I코나I부산,2020-11-11 10:44:00
528649,불나 뉴페이스 등장,쏭윤이I코나I전북,2020-11-11 10:46:00
528649,내실을 다져라,킴준트I아이오닉I별내,2020-11-11 10:47:00
528649,뭐 이런 놈들이 다있나 싶네요...;;;,근육이IKEI서울,2020-11-11 10:50:00
528649,ㅋㅋㅋㅋㅋㅋㅋ,네온I니로I서산,2020-11-11 10:58:00
528649,구린데,즌기I아이오닉I포항,2020-11-11 11:01:00
528649,이차 위장막 벗고 돌아다는거 찍을려다가 뒷쪽 사진보다 더욱 구려서 않찍었네요~~ 참고로 약 3주정도쯤되요~~~,가리짱I볼트I충남,2020-11-11 11:22:00
528649,자동소화장치가 옵션인지..기본인지..진짜 징한쉐큇들이네요..벽돌공장주제에 차까지 넘보다니.,찬이슬l니로l경기,2020-11-11 11:29:00
528649,현대불매~~ 우선 코나화재 원인이나 찾아야지. 불차를 누가사나?,오뚜기l코나l포항,2020-11-11 11:29:00
528649,현대 알바들 보고있냐~~~? ㅋㅋㅋ,jian 코나 충남,2020-11-11 11:34:00
528649,이중접합유리나 정숙성관련 개선은 없는건가요,타이l코나l세종,2020-11-11 11:53:00
528649,사면은 개돼지 ㅇㅈ,재현l코나evl경기,2020-11-11 12:05:00
528649,구형은 가격 또 떨어지겠네요ㅜㅜ,아이오닉n제주,2020-11-11 13:12:00
528649,전기차 전용 플랫폼도 아닌데이제 뭐하러 출시하는지 모르겠네요,별나무I전북,2020-11-11 13:52:00
528649,기존 코나 안그래도 안팔리는데 관짝에 못질하는군요. 페리까지 나오니 중고차도 더 안팔릴듯,동막골 I I 전북,2020-11-11 20:31:00
528649,현대차는 코나에 대한 기대가 큰가 봅니다. 페이스리프트 전기차 모델은 출시하지 않을 줄 알았는데..풀 디지털 클러스터만 맘에 들고 나머지는 그닥...,션I코나I인천,2020-11-11 15:40:00
528649,해외는 이슈가 적어서 어떨지 모르겠지만 국내에서는 판매량 저조할 듯하네요.,로바I니로I경기,2020-11-11 18:58:00
528649,누가 사냐 현대불차 ㅋㅋ,경로당회장I코나I인천,2020-11-11 21:35:00
