"post_id","cmt_content","cmt_author","cmt_created_at"
"2315925","인천30바7600 우리 집 차였는데... 송도동족제비 으르신 보면 아부지 생각난다캅니다.. 안전운전 하세요","박사이장","24.07.15 16:42"
"2304683","유튜브 보니까 님같은 차량이 많다고 하든데아직도 휸다이는 저런 결함도 인정안하고 잘났다고 떠들고 자빠졌으니 ㅋㅋㅋ","다비도프v","24.05.14 08:31"
"2269998","디필요없고 전기차 뒤에 따라가면 회생제동할때 뒷브레이크등 불좀 들어오게해라~~","주접","23.12.01 14:22"
"5969483","뭐 이젠 놀랍지도 않은...ㅋ","청주엉아","23.11.19 00:46"
"2267067","1대만 그러면 불량 비슷한 차대번호 끼리 그러면 결함이쥬. 실험 표본이 너무 적어요. 고객센터에서 불만 차량 차대번호를 수집해야 합니다","안화단결취참","23.11.17 21:12"
"5957172","말장난","공의로움","23.11.07 01:26"
"2263409","회사차 아이오닉6 두대 고압수뿌렸는데 다행히 괜찮네요","비전N74","23.11.01 15:51"
