post_id,cmt_content,cmt_author,cmt_created_at
564389,전 그런사람을 알바라 봅니다..,꿈라Ie트론I서울,2021-02-13 23:50:00
564389,네..맞습니다..그래서 저도^^...,사막여우bolt ev 군산,2021-02-13 23:56:00
564389,222 어느정도 이해는 하지만 코나만잇는것도아이고 잘타고다니고 잇는데 흉기니까로 치부하고 가족의 안전도 생각하지않고 뽑은 이상한놈이나 답없는사람 처럼 보는데 보다보면 짜증나죠 ㅋ 조금만 어긋나면 알바로 치부해 버리는거죠 그러니 댓글달기도 애매해지구요.,헤임 l모델3l서울,2021-02-14 00:09:00
564389,저도 동감 합니다,경환한의I오볼니I서제,2021-02-14 06:51:00
564389,으음 코나 피해자 글에 댓글로 굳이 그러는거 아니고 새 글로 올리는거라면 큰 문제가 있을까 싶네요. 눈치를 보고 글을 못쓰는게 더 문제이지 않을까 싶어요,우리집단비I서울,2021-02-14 00:00:00
564389,물론 순수한 의도로 현대가 좋다라고 글 올리시는거야 뭐라 하면 안되겠죠...왠지 피해자들 앞에 가서 조롱 하는 기분이 들거 같아서리...어쨌든 피해본 사람의 입장을 좀 생각하자는 말씀은 드리고 싶어요예전 싼타페 급발진 사고가 났을때가 잊혀지질 않아서 사실 현대가 좋다라는 말을 들으면 왠지 기분이 우울해지더라고요유족으로 남은 남편분 아직도 싸우고 계시던데 ㅠㅠ,사막여우bolt ev 군산,2021-02-14 00:26:00
564389,사이코패스가 아닌이상 피해자 조롱을 하면서 현대차가 짱이야! 하며 글쓰는 사람은 없을 것 같아요. 브랜드 상관없이 글 쓸 수 있는 유일한 자유로운 카페인데 서로 눈치 주는 행위는 없었으면 합니다 ㅎㅎ,우리집단비I서울,2021-02-14 01:06:00
564389,현대기아 그 하청까지 인구의 상당수가 직간접 연관되어 있다보니 알바아닌 알바가 엄청나겠죠,아쿠아ㅣ니로ㅣ일산,2021-02-14 00:06:00
564389,그런글에 댓글로 난 괜찮네하며 이러는건 아니지만 새차가 나오는 기대치로.. 또는 잘타고 다녀서 또 현기로 바꿀려고 글쓰는사람도 있다고 봅니다. 그리고 저또한 알바가 없다고 생각치는 않지만 무조건적인 알바로 몰아가는 사람들이 더 큰 문제라고 봅니다,나다우기l볼트l광주,2021-02-14 00:14:00
564389,코나 사태때문에 현대가 욕먹는건 자연스러운거죠 모,은신I니로I포터I인천,2021-02-14 00:17:00
564389,여기까페명만전기차동호회에요 테슬라동호회나마찬가지에요 테슬라에대해조금만얘기해도 개깝니다 아이오닉5말만나오면알바냐 왜기다리냐 그런차를왜타냐 불나는차타는둥 아직나오지도않은차를 개깝니다 테슬라옵션이왜이렇게비싸냐고 물어보면아는상식선에대답 하면되는데개까고 현기도정신차려야하지만 외국기업무조건 똥꼬빨아주는짓도 않했음하네요 지금글들보면 장난아니죠,아트I아이오닉7I대전,2021-02-14 00:17:00
564389,1.2년 타보면 왜 역전이 되엇는지 아실텐데. 저만해도 코나잘만들엇다.현대차 많이 발전햇네가 2년전.작년초 테슬라에 왜 보조금 주냐 햇는데. 화재 격어보세요. 원인파악전에 현대차는 보조금을 주면 안되는 회사가 되어 잇을겁니다,요미나리l코나l일산,2021-02-14 00:26:00
564389,"선생님 저도 20년 3월 이후 모델 이였고, 3월 이전 모델만 불난다고 하여 어이구 안타깝구먼 나는 괜찮겠지 이러고 탔습니다. 하지만 업데이트 후 주행거리 감소, 잔여충전시간 오류, 완충뻥카 등 이상 문제로 서비스센터 방문 월요일부터 금요일까지 블루핸즈가 아닌 센터로 입고. 오래 걸린다 하여 지켜 보았으나 정말 제 말이 맞는지 충전만 해 보고 아무런 조치를 취해놓지 않았습니다. 게다가 이상이 있는 차를 일단 타고 나중에 언제 나올지 모르는 업데이트를 기다리랍니다. 이런거 몇번 당해보시면 정말 미치도록 화가 납니다.. 제가 글 쓴 것도 있는데 현대가 똥 싼걸 왜 구매자가 피해를 봐야 하나요. 현대에서 20년 3월 이후 모델은 이상 없다 했는데 3월 이후 모델도 벽돌이 지속적으로 나타나고 있습니다. 왜 거짓말을 하나요 당당하다면 아이오닉이 정말 차가 잘 나올수도 있죠. 저도 아이오닉 정말 기대 하고 있습니다. 평면으로 펴지는 시트라니요 아주 제가 생각 하던 꿈의 차 입니다. 하지만 똥 싸놓고 똥을 치우지도 않고 새로이 다른걸 준비하는 현대의 모습을 보면 정말 치가 떨립니다. 선생님도 격어 보시면 알겁니다. 왜 코나 유저들이 이러는지.",김가입l코나l충남,2021-02-14 02:18:00
564389,이게정답이네요~정부가...코나사태 완벽해결전에는 보조금을 현기에 지급하지말아야~,미제I볼트I원주,2021-02-14 08:23:00
564389,,밤송l코나l천안,2021-02-14 09:29:00
564389,동감합니다. 자신의 과오를 모른채 나아가는 기업은.미래가 없습니다,루피I 모델3I증평,2021-02-14 10:55:00
564389,1년안된 신차 사업소 몇번이나들어가고 as 블루핸즈. 포함8번에 교환한것도 6가지나 되는데 이미 실뢰가. 안갑니다,서초구주민포터ev서울,2021-02-14 01:18:00
564389,여론이 말해주조 팬을 만들기보다는 안티를 만드는 운영방식과 생산 당연한건데,호야I모델3코나I경기,2021-02-14 02:01:00
564389,차량가격이 집값 다음인 재산성격을 가지고 있고본인 및 가족 생명과 재산에 위험을 줄 확률이높아진 상황을 겪게되었을 때비슷한 반응을 보이는건 지극하게 상식적인 것 같네요,봘트lBOLTSOULl제주,2021-02-14 02:34:00
564389,당해보면 욕나옵니다 죽을뻔하면 욕이 튀어나오는게 당연한거 아닙니까?ㅋㅋ그리고 코나불나기전엔 현기 찬양카패였습니다,통닭I모S타이칸I서울,2021-02-14 04:32:00
564389,,밤송l코나l천안,2021-02-14 09:30:00
564389,당해보면 압니다,시라빠ㅣ니로ㅣ서울,2021-02-14 06:33:00
564389,ㅎㄱ아웃,상어의꿈I코나evI경기,2021-02-14 08:12:00
564389,자승자박이죠~독과점횡포 만끽중인 현기 ㅜ,미제I볼트I원주,2021-02-14 08:21:00
564389,현대기아 잘되라고 생각했는데 이번 코나 화재를 보고나니 안티로 돌아설수 밖에 없네요,멋진넘I니로evI동탄,2021-02-14 10:51:00
564389,서로 다른생각을 전달하지 않았으면 합니다. 그냥 그대로 인정하면 좋겠어요.,불길훈I쏘울evI부산,2021-02-14 11:41:00
564306,코나부터 정리해라 더러운 현대 ㅡㅡ,하릿치I코나I충북,2021-02-13 21:30:00
564306,이번에도 불 날것 같죠?,영채가족l코나l대구,2021-02-13 21:35:00
564306,스크 배터리 써서 불은 안 날 것 같아요. 이번엔 제발 정신 차리길..,전고체 I 쏘울 I 서울,2021-02-13 22:05:00
564306,사람 잡겠죠,코피나 코나 서울,2021-02-13 21:38:00
564306,ㅎㅎ 빵 터졌습니다,영채가족l코나l대구,2021-02-13 21:48:00
564306,출고일정은 매번 바뀌네요 첨엔 5월 이야기 하더니 4월에서 3월이네요,아이조아I서울,2021-02-13 21:38:00
564306,대체 언제 나오려나요,지니I포터I대전,2021-02-13 22:10:00
564306,왜 현대차는 그렇게 아오5가 그룹의 미래가 걸린 모델이면서 쿨한 맛이 없을까요쿨하게 공개할거면 하고 가격도 정할거면 정하고 코나에 대해서도 쿨하게 공개할거하고 인정할거 하면 되는데..,바당당I없음I경기,2021-02-13 22:33:00
564306,너무 질질 끄네. 기다리다 질려 그냥 모델Y 예약했습니다,스스I니로l순천,2021-02-13 22:38:00
564306,전기차부분에서는 폭스바겐그룹과 현기가 선두로 나갈 겁니다 테슬라도 그걸 알고 있고 지금 시간이 별로 없다는 설 알고 있어 배터리에 올인 하는 거죠 전기차는 그냥 비싼 가전제품이라 생각하세요 앞으로 25년까지 어마무시하게 나옵니다 주행 많으신분들만 전기차 사세요 주행거리 작으신분들은 2029년에 구입 추천드려요 테슬라 자율주행은 선두에 리드를 하고 있지만 시간 지나면 같아 질건 뻔한 내용 머스크도 알고 있죠 전기차의 미래 배터리 전쟁 현기 전장비는 선두에 있어요,잔디EV일산,2021-02-14 09:25:00
564306,???,쓰리고l모델3l부천,2021-02-14 04:41:00
564306,본문에 써있는데 코나 리콜문제로 공개 늦췄다고... 그럼 대충 출시행사 전에 리콜 대응 하고 하겠다는 말 아닌가요?무튼 빨리 문제해결하고 공개나했음 좋겠네요 현대 테슬라 싸우는거 팝콘각좀 잡게 ㅋㅋ,쉐뱅l볼트l평택,2021-02-14 00:19:00
564306,실구매 3800정도에 맞출수있겠군요...이것도 비싸지만..니로랑 큰차이 없는 가격이라면 잘팔릴것같네요,동백꽃I쏘울EVl서울,2021-02-14 03:08:00
564306,가격으론 잡을수 있을껍니다ㅋㅋㅋ 현기차 5990,도르마무I봉고evI화성,2021-02-14 10:29:00
564264,저는 모델3 롱레인지가 저가격으로 나온이상 빠른 손절이 답이라고 생각합니다.아이오닉5 가격봐서 중고보장이랑 중고정리 시세 알아보고 유리한쪽으로 빨리 갈아탈라고요저도 2번 3번 고려중입니다.,으오아앙I코나I전남,2021-02-13 19:31:00
564264,저랑 비슷하시군요~^^,물빛바다I코나evI대전,2021-02-13 20:26:00
564264,1. 통 교환해준다면 교환 순번을 최대한 뒤로 미룬다음 교체할때까지 막 타다가 새배터리 끼워서 판매한다 2. 교환 안해주고 지금과 같다면 어차피 똥값이니 다른 전기차 메인으로 쓰고 서브로 사용한다 입니다 ㅋ 저는 년 주행거리가 5만이라 두대타도 될듯,똥글빵글ㅣ코나ㅣ일산,2021-02-13 19:32:00
564264,"저도 코나는 무척이나 아쉬운데, 화재가 아쉽네요. 아녔음 끝까지 탈텐데..",물빛바다I코나evI대전,2021-02-13 20:27:00
564264,전기차는 아무리 날고 기어도 세컨카입니다. 코나를 테슬라로 바꾸는게 맞는거 같습니다.,선릉J넥스,2021-02-13 19:33:00
564264,"음, 코나, 싼타페 타보니 제 라이프스타일에선 전기차를 메인으로 타도 되겠더라구요. 장거리래봐야 1년에 몇번 안되구, 코나로도 다녀봤는데 큰 아쉬움은 없었어요. 뭐, 항상 충전이 관건이겠지만요.",물빛바다I코나evI대전,2021-02-13 20:30:00
564264,구매가의 75%보상인가요그럼 무조건 팔아야죠,코닥ㅣ니로ㅣ부산,2021-02-13 19:36:00
564264,"아쉬지만, 보조금 제외한 구매가의 75%라서 2000만원 초반대더라구요. 게다가 추가 감가(주행거리, 외장 상태 등)가 적용되구요. 만약 판매가의 75% 였다면, 고민 없이 보상받았을 꺼예요.",물빛바다I코나evI대전,2021-02-13 20:33:00
564264,저는 솔직히 경제적으로 생각하면1. 배터리 교체해주면 그냥 폐차때 까지 타구요.2. 하이브리드...차량도 괜찮을것 같음. 아무리 생각해도 기름값대비 시간생각하면요.,빠방이I쏘울EVI광주,2021-02-13 19:38:00
564264,"저도 배터리 교환되면 끝까지 타려구요. 글구 전기차로 너무 멀리 와버려서, 하이브리드조차 고려하지는 않고 있어요~ ^^;;;",물빛바다I코나evI대전,2021-02-13 20:34:00
564264,애초에 6천 이하로 내준 이상 비교할 가치가 없다고 생각합니다,쪼꼬미I코나I전주,2021-02-13 19:47:00
564264,진심으로 동의합니다.,물빛바다I코나evI대전,2021-02-13 20:34:00
564264,저는 꼴도 보기시러서 그냥 중고로 처분하고 모델y 갑니다. 모3 은 이미 있어서요,도도롱I코나I경기,2021-02-13 20:24:00
564264,"도둑심보지만, 모델y 롱레가 5999만원였으면 저도 거기로 갔을꺼예요. 그래서 아쉽지만 모3 롱 맆으로...ㅎ",물빛바다I코나evI대전,2021-02-13 20:36:00
564264,"감사합니다. 테슬라는 꼭 가려구요. 코나는 너무 아쉬워요. 좋은 찬데, 배터리 화재만 빼면...ㅜㅠ",물빛I코나 모델3I세종,2021-02-13 21:56:00
564264,완전 같은 생각입니다.,밤송l코나l천안,2021-02-13 22:55:00
564172,롱레인지는 나오겠죠 스탠은 안되겠죠? 400근처 플러스마이너스 30정도 예상합니다,시선I미정I서울,2021-02-13 16:26:00
564172,팝콘각이네요 ㅋㅋㅋ,루피I 모델3I증평,2021-02-13 16:43:00
564172,불 안나게 쫄아서 마진도 많이잡느라 거리가 아쉽겠죠....,터킬l코나l서울,2021-02-13 16:55:00
564172,440롱은 500배터리 성능향상으로 된다네요,사과I아이오닉I경북,2021-02-13 19:19:00
563964,,크리스l오닉x2l경기,2021-02-13 11:28:00
563964,당해본 사람만이 압니다.,로젠l코나l전북,2021-02-13 11:31:00
563964,,모히또l볼트l창원,2021-02-13 11:49:00
563964,코나로 당하신분들은 아오5 싸게 나온다해도 안사실듯해여 이미 현대 정떨어졌는데,살구l울산,2021-02-13 13:44:00
563964,벽돌 당하신분들은 아5 줘도 안탈듯..,루피I 모델3I증평,2021-02-13 17:06:00
563964,황당한 코나.,가을나그네I오닉I밀양,2021-02-14 11:36:00
563888,공감합니다. 소비자의 자나친 팬덤은 자칫 소비자의 권리를 포기하는 우매한 짓이 될수 있다 생각합니다. 차를 사는건데 마치 주식을 산다 착각하시는 신자분들이 보이셔서요 간혹^^,광우I모델3I서울,2021-02-13 09:46:00
563888,"그냥 잘하면 칭찬, 못하면 욕하면 됩니다.가격인하했으니 테슬라 칭찬화재대처 개판이니 현대 욕그러는거죠.아이오닉5가 보조금포함 4천이하로 나오면 갓현대 되는거죠.",은신I니로I포터I인천,2021-02-13 09:54:00
563888,테슬라는 조립품질개선이 시급하죠..이것만 조정잘되도 한층더 좋은 만족감을 줄텐데 말이죠..,헤임 l모델3l서울,2021-02-13 10:03:00
563888,현대는 코나해결이 먼저인듯 오닉5어쩌구 하지만 소비자를 기만하는 행위는 하지 말기를,발바닥l코나l수원,2021-02-13 10:09:00
563888,,밤송l코나l천안,2021-02-13 10:09:00
563861,또 연기했삼? 쯧... 왜자꾸 500km 라고 언플하는겨?,봄베랑l코나evl서울,2021-02-13 09:11:00
563861,또 연기한 것 같은데요. 그냥 출시와 동시에 단종시키는게 나을 듯,경로당회장I코나I인천,2021-02-13 09:13:00
563861,ㅋㅋㅋㅋㅌㅌㅌ영원히연깈ㅋㅋ,루피I 모델3I증평,2021-02-13 17:33:00
563861,no 현대!! 코나해결못하고 저러면 테슬라한테 한국 먹힘 분명히...!!!!,발바닥l코나l수원,2021-02-13 09:16:00
563861,코나화재를 잘 정리하고 나와야 할텐데 걱정이네요,크리스l오닉x2l경기,2021-02-13 09:18:00
563861,정말 궁금해서 그런데 코나화재정리하는거와 아이오닉5 신차 출시하는거와 무슨상관이 있나요?,알아I아이오닉I울산,2021-02-13 09:23:00
563861,상관이 없다고 생각하시는 이유를 먼저 말씀해주시면 답변이 쉬울 거 같습니다 워낙 복잡한 문제라서요,밤송l코나l천안,2021-02-13 09:24:00
563861,코나화재 정리하기전엔 신차출시는 못하는건가요?코나와 아무런 상관없는 신차출시하는데 도대체 어떤 상관이 있는지 모르겠네요.,알아I아이오닉I울산,2021-02-13 09:26:00
563861,코나와 상관 없는 차라고 생각하시는 이유는 뭔가요?,밤송l코나l천안,2021-02-13 09:27:00
563861,전혀 연관성이 전혀없으니 상관없다고 생각하죠. 도대체 어떤점이 관련있다고 생각하는지가 정말 궁금합니다,알아I아이오닉I울산,2021-02-13 09:29:00
563861,그러니까 왜 연관성이 없다고 생각하시는지 좀 더 구체적으로 말씀을 해주셔야 답변을 드릴 수가 있어요,밤송l코나l천안,2021-02-13 09:30:00
563861,코나화재는 코나화재대로 정리하는거지 왜 아이오닉5와 연관시키는거죠?,알아I아이오닉I울산,2021-02-13 09:30:00
563861,저도 큰 상관없다고봐요. 코나가 전기차 프레임도 아니고.. 단지 대응하는 자세?ㅎ,애플8I미정I전주,2021-02-13 09:31:00
563861,관련된게 없는데 무슨 설명을 해요?그럼 아반떼와 소나타는 관련성이 없다고 어떻게 설명하나요?아반떼와 소나타가 관련없는거와 같이 코나와 아이오닉5는 관련없는거와 같아요아반떼가 불량이라고 소나타 출시를 미루나요?,알아I아이오닉I울산,2021-02-13 09:33:00
563861,똑같은상황이 반복안된다는 보장이없어서 그런거아닐까요?코나 화재 벽돌문제도 해결못한상태인데 아오5는 다르다고하면 그게 더 의심스러울듯합니다.코나타고 있는 제입장에선 아주싸게 아오5로 바꿀수있다면 바꾸겠지만(쫌이라도개선됐을거라 믿고)5천만원주고 살거냐고하면... 글쎄요?,액션치킨I코나I순천,2021-02-13 09:34:00
563861,,미제I볼트I원주,2021-02-13 09:36:00
563861,아반때와 소나타가 다르듯 코나와 아이오닉5는 근본부터가 달라요그래서 연관성이 없다고 쓴거고요프레임도 다르고 쓰이는 배터리도 다르고 히트펌프도 다르고 관련된게 전혀 없어요.니로에 주로 쓰인 SK배터리가 장착되는데 니로는 지금까지 화재가 1건도 없거든요.,알아I아이오닉I울산,2021-02-13 09:37:00
563861,"회원님 같은 생각을 하는 분들이 아마 코나 차주분들 중에는 거의 없을 것 같고, 다른 전기차를 운용 중이신 분들 중에도 많이 계실 것 같진 않습니다. 아마 대부분 전기차에 처음 관심을 가지시거나 특히 현대 아오5만 오매불망 기다리시는 분들 중에 많이 계실 것 같고요. 게중에는 현대차 관계자, 직원, 알바, 주주들도 물론 계시겠죠. 그래도 제가 오늘 중에 시간을 내서 별도의 게시글로 성실하게 논리적으로 답변을 드리겠습니다.",밤송l코나l천안,2021-02-13 09:38:00
563861,아이구야 릴렉스 하시죠. 이미지의 문제인것 같습니다. 결함 있으면 제대로 오픈하고 해결해준다라는 인식이 있어야 더 잘 팔리겠죠.,크리스l오닉x2l경기,2021-02-13 09:38:00
563861,기대하고 있겠습니다. 카더라말고 팩트만 들고오시길 바랍니다,알아I아이오닉I울산,2021-02-13 09:39:00
563861,알고있습니다. 결함 제대로 오픈하고 해결해주는거와 신차발표가 무슨 상관이 있는지가 이해가 안가는거지요코나화재를 분명히 집고 넘어가야하는게 맞습니다. 코나화재때문에 다른일도(신차발표) 하지 말라는게 이해가 안되는거지요,알아I아이오닉I울산,2021-02-13 09:43:00
563861,"글쎄요 저는 전문지식도없고 언플이 너무많아 뉴스도안찾아봅니다만,겪은바가 있다보니 다르다 어쩌다는 팩트(라고 치죠) 보다 같은회사 차라는데서 이미 반쯤 신뢰를 잃고가는 감이 있긴하네요.다른선택지가 없다면 뽑기운좋길바라면서 타겠지만.. (코나도 사건터지기전엔 서민인 제게 슈퍼카나 마찬가지였으니까요ㅎㅎ)같은값에 다른선택지가 있는데 굳이?이건 전문성1도없는 제 주관적인생각입니다. 그 비싸고 좋다는 제네시스gv80도 출고2주만에 고속도로에서 바퀴가빠져서 사업소들어온차를 봤던터라.. 현대는 믿기힘드네요",액션치킨I코나I순천,2021-02-13 09:46:00
563861,해도 됩니다. 다만 기업 이미지가 지금 같이 매우 안좋은 상태에서 하게되면 신차 효과를 극대화 할수가 없겠지요.,크리스l오닉x2l경기,2021-02-13 09:46:00
563861,"오 저랑 같은 생각. 이런 맥락에서 글을 정리해서 써드릴건데 혹시 질문하신 분은 이런 것도 “카더라”라고 생각하시거나, 그럼에도 불구하고 코나랑 오닉5는 다른 차인데 왜 까냐고 생각하시면 아마 제 글을 읽으시더라도 생각은 안 바뀌실 겁니다. 그럼 회원님은 자유롭게 회원님 의견 펼치시고 저같은 사람들도 자유롭게 의견 펼치면 그만이죠. 나중에 회원님이 아오5 구매하시고 혹여 곤혹을 겪게 되어 카페 오시면 저는 함께 싸워드릴 겁니다 그게 전기차 동호회 아니겠습니까 껄껄껄",밤송l코나l천안,2021-02-13 09:53:00
563861,적어주신글은 맞는 말입니다. 대처가 미흡해서 신뢰를 잃은건 맞아요.그럼 대처를 제대로 해달라고 해야지 대처를 해주고 신차출시를 하라는게 이해가 안가는 겁니다.미흡한 대처를 제대로 해달라는거와 신차출시와 무슨 연관이 있냐는거죠,알아I아이오닉I울산,2021-02-13 09:56:00
563861,이미지 이런거 말고 기술적인부분으로 써주세요,애플8I미정I전주,2021-02-13 09:57:00
563861,이렇게 생각도 할수 있군요. 한수 배워갑니다,크리스l오닉x2l경기,2021-02-13 10:05:00
563861,네 이상한가요 ㅎ 이미지 신뢰 그런거 말고 기술적으로 같다라는건 아닌거같아요,애플8I미정I전주,2021-02-13 10:06:00
563861,"대처를 어떻게했느냐가 일반 소비자입장에선 80%는 먹고들어간다고생각합니다.적당한예시일진 모르겠지만 한개 들어볼게요.중소기업에 입사를하려고합니다. 그회사에 정리안된 체불임금노동자들이 있는걸 알게됐습니다. 그부분에 대해 질문하니깐 노동자가 일을못해서 적자가났었다, 그때는 이런상황이 안좋았다 등등 사장은 말은 많습니다. 구직활동 지겹기도하고 그냥 믿고 입사합니다. 일년뒤에 천만원 체불당했습니다. 제 경험담입니다. 제가 다시 그런상황이라면 다른회사 찾아보든지 아니면 최소한 체불임금들을 정리했는지 정도는 고려할것같네요.지금 아오5는 뭐가다르다 이번엔 다르다 입으로만 떠들지 행동으로 보여주는건 없다고생각하구요, 믿고 갈지 좀더 지켜볼지는 개개인 소비자의 문제겠죠. 진짜로 다를수도 있고, 아닐 수도 있고.2~3천 차에다 쓰면서 손이 벌벌떨리는 저같은 서민에겐 큰고민이긴 합니다ㅎㅎ",액션치킨I코나I순천,2021-02-13 10:18:00
563861,회사 다녀보면 아시겠지만 기술문제가 아닌 이미지 문제때문에 신제품 출시를 미룬다는건 말도 안된다는걸 아실꺼라 생각합니다.,알아I아이오닉I울산,2021-02-13 10:12:00
563861,아하 소비자가 아닌 기업의 입장에서 생각하신다고 스스로 말씀하셨네요. 제 답변 준비하면서 참고할게요.,밤송l코나l천안,2021-02-13 10:14:00
563861,적당한 예시가 아닌거 같습니다. 의도한 부분은 이미지 때문인걸로 보이긴 하네요,알아I아이오닉I울산,2021-02-13 10:18:00
563861,또 무슨 오해를 하시나요?그런거 말고 기술적으로 코나와 아이오닉5가 무슨 연관성이 있는지만 논리적으로 설명 부탁드립니다.입장 이런거 말고요. 답변이 삼천포로 빠질듯해보이네요,알아I아이오닉I울산,2021-02-13 10:20:00
563861,오해라뇨 ㅎ,밤송l코나l천안,2021-02-13 10:25:00
563861,논리적으로 답변한다고 하더니 또 감성에 기댄듯한 답변나오겠네요.... 기대한 제가 바보네요,알아I아이오닉I울산,2021-02-13 10:28:00
563861,어거지 그만 씁시다,아쿠아ㅣ니로ㅣ일산,2021-02-13 22:21:00
563861,기술적으론 한명도 설명안하고 그냥 때만 쓰는군요...,알아I아이오닉I울산,2021-02-13 23:58:00
563861,기존 코나 차주분은 화재 등으로 피해를 많은 피해를 입으셨고 이번에 신차가 출시 되면 중고차값은 더 떨어지고 코나의 가치는 더 떨어질듯 합니다. 그러니 현대에서는 빠른시일내에 이에 대한 대책을 세워서 당연히 차주에게 보상해줘야 한다고 생각합니다.,행복I니로I제주,2021-02-14 00:14:00
563861,중고차 가격떨어지는건 화재때문에 떨어지는걸 보상해달라고 해야지 신차출시로 떨어지는 중고차 가격까지 보상해달라고 하는건 아니라고 봅니다.니로를 예로 들어볼깨요. 니로는 화재가 안났습니다. 화재가 안났지만 신차출시로 니로 중고차 가격이 떨어지면 이것도 보상해줘야 하나요?,알아I아이오닉I울산,2021-02-14 00:46:00
563861,니로와 코나는 다르죠? 코나와 같은 회사에서 코나문제를 제대로 마무리 못한 상태이고 그리고 코나 화재뿐만아니라 바닥 기스났을때 소비자가 2000만원 넘는 돈을 내야 한다고했다가 결국 유튜브에 소개되고 박명장님에게 판명받는 등 화재만 문제가 아니라 as에 있어서 도를 넘는 몰상식한 행동으로 국민과 코나차주들의 공분을 삿죠. 저는 이에대한 충분한 설명과 보상이 있지않은 상태에서 신차를 출고 한다는 것이 반성에 태도가 보이지 않아서 그렀습니다. 저두 현기차 지금까지타고 있지만 지금까지 큰사고 두번 있었는데 에어백 터져야하는데 한번도 안터지고 사람만 터지는 그리고 자국민을 호갱으로아는 흉기차는 이제 타기 싫네요,행복I니로I제주,2021-02-14 00:55:00
