post_id,cmt_content,cmt_author,cmt_created_at
563668,2천이상싸야 현대...고민쪼금,좋아요요I경기,2021-02-12 23:47:00
563668,23일 공개전 까진 일단 숨 참아 보려합니다. 다행? 인지 어쩐지 몰라도 11월까지 보조금이 남던지역이라..,할배온l볼트EVl경기,2021-02-12 23:54:00
563668,전 이제 아무리 싸다고 해도 현대는 믿거하렵니다.,다연파파I코나I예천,2021-02-12 23:58:00
563668,저도 니로불만없이쓰는데 아내 니로주고 모y스텐 질렀습니다 cv나오는거보면서 확정할라구요,팔라l니로l제주,2021-02-13 00:00:00
563668,,크리스l오닉x2l경기,2021-02-13 00:03:00
563668,,대안ㅣ코나ㅣ부산,2021-02-13 06:27:00
563668,공감합니다,임월천l니로l전남,2021-02-13 12:52:00
563609,전차종 배터리 교체 2년 후 또 화재 날까봐 걱정입니다.,티원I코나EVI경기,2021-02-12 22:03:00
563609,"썰은 오피셜이 아니니 , 썰로 부정기류 잠재우고 신차 출시 후 엔 썰이 묻힐 수도 있는 ㅎ썰은 썰일 뿐 오피셜 후에 판단해야 할 듯요근데 통교환 후에도 벽돌된 글도 보였는데완전해결엔 갈 길이 멀어보이네요 단체 소송건도 있고제조사 오피셜이 궁금해지네요",봘트lBOLTSOULl제주,2021-02-12 22:09:00
563609,완전 새로운 배터리로 교체 가야죠,코나l코나l문경,2021-02-12 22:10:00
563609,교체 가야죠 부품 수급후 한 1년뒤 부터 교체들어가 2년쯤 걸릴듯요,라기I볼트I울산,2021-02-12 22:21:00
563609,리콜걸리면 2년후에도 상관없죠^^,코나l코나l문경,2021-02-12 22:23:00
563609,예전에 제가 아반떼하브 탔어요 겨울에 일주일마다 미션이 나감 동호회 ㅎㅎ 아마 판매대수 비교하면 코나 불난거보다 더 심했지 싶네요 현대 자체 보험에서 가입도 안받아아줬어요 ㅋㅋㅋㅋ 팔고 난후 미션1회 교체 나왔더라고요 한참뒤,라기I볼트I울산,2021-02-12 22:55:00
563609,엘지가 베터리를 전량 교체해주면 휘청하지 않을 까요?,멍멍이전북,2021-02-14 13:33:00
563609,2조원들어간다고LG현대가알아서하겠죠,코나l코나l문경,2021-02-14 13:41:00
563471,코나는 재고할인으로 500에서 800만원 할인하면 되서 큰 상관없을겁니다,답답한시츄l오닉l대구,2021-02-12 19:33:00
563471,가뜩이나 여론 안좋은 기존 오너들이 문제죠,초록두부I미정I청주,2021-02-12 19:36:00
563471,그건 현기가 스스로 자폭한거라서 ㅎㅎㅎ 코나오너 특별할인 이런거 쌈빡하게 하지 않는 이상 이미지 개선은 쉽지 않을거에요,답답한시츄l오닉l대구,2021-02-12 19:36:00
563471,저도 그렇게 생각하네요 한방에두마리 토끼 잡을지 신규고객과코나 기존고객을,근육참새I코나I부산,2021-02-12 19:42:00
563471,두마리를 잡을껀지 둘다 못잡을찌는 지금 코나를 어떻게 해결하나 따라 다를듯 한데요? 진작 코나 ev부터 해결을 잘봤더라면 쯔쯔 ~~~~,리마틴ll레이EVll김해,2021-02-12 19:45:00
563471,팝콘이나 묵으면서 기다리면 될듯어차피 배터리 찌라시고 잇고Sk 도 졌고 명절 끝나고 잼나겠네여,근육참새I코나I부산,2021-02-12 19:54:00
563471,코나는 단종이라 상관없어요,크리스l오닉x2l경기,2021-02-12 19:46:00
563471,단종 한다 해놓고 분위기 보고 보류 시켰죠 ㅋ,근육참새I코나I부산,2021-02-12 19:53:00
563471,오닉 코나 넘어갈때도...,크리스l오닉x2l경기,2021-02-12 19:47:00
563471,요즘 코나모던 기준 스마트센스 2700만입니다추가 씁스도 있고 타고 다니면서 불나라고 저녁마다 기도하면 대박,코나l코나l문경,2021-02-12 20:01:00
563311,,크리스l오닉x2l경기,2021-02-12 16:55:00
563311,현대는 코나 깔끔히 해결해야할것 같은데 세타에진도 그렇고 걱정되네요.,크리스l오닉x2l경기,2021-02-12 16:56:00
563311,현실적인 글이네요.현기차가 빨리 정신차리고 모든 하자를 감당하기를 바래봅니다..,김창희I수원I볼트,2021-02-12 16:56:00
563311,정말공감 200% 합니다. 2년전으로 돌아가고 싶네요.,로로l코나l하남미사,2021-02-12 16:58:00
563311,옳은 말씀~,뉼륩I코나EVI경기시흥,2021-02-12 17:03:00
563311,코나 오너 분들 고생 많으십니다 ㅠㅠ 기아차도 비슷한가요?,땅벌수산l포항,2021-02-12 17:10:00
563311,완전 동의합니다,evI코나I충남,2021-02-12 17:16:00
563311,,evI코나I충남,2021-02-12 17:16:00
563311,-블루핸즈-대리 : 부장님 고객이 침수의심 된다고 입고 시켰습니다부장 : 스캐너 물려서 확인해 봤어?대리 : 네부장 : 고객과실로 몰아,암모니아l예정l서울,2021-02-12 17:25:00
563311,-실제사례- 현대랑 같은 그룹사(차량 엔진 계통 소음 문제로 입고시킨 차를 직접 시운전하며 들어보려는 두 기사의 대화)A: 진짜 소음이 들리는 거 같은데요?B: 타이어 쪽 소음이라 하고 잘 말씀드려서 잘 돌아가게 해드립시다~,밤송l코나l천안,2021-02-12 17:29:00
563311,ㅋㅋㅋ헐,암모니아l예정l서울,2021-02-12 17:34:00
563311,코나고민했었는데ᆢ감사합니다~,얌모ㅣ남양주,2021-02-12 18:37:00
563311,2년정도 코나 잘타고 다닌 차주로써 말씀 드립니다.현대차 a/s좋아질때가 언제가 될지 모르지만 그 전까지는 참아 주시는것이 정신건강에 좋다고 봅니다.코나 문제있을때 불날까봐 충전할때마다 불안한 마음 주행중 언제 벽돌될까 불안한 마음 브래이크 듣지않아 박으면 어쩌지하는 불안한 마음 이런차를 팔았으면 빨리 리콜해서 문제해결은 제되로 못하고 아직까지 네탓만 하고있는 이런회사 제품을 뭘 믿고 또 구입할까요?,대안ㅣ코나ㅣ부산,2021-02-12 18:49:00
563311,허허.. 오늘 20년식 코나 구매예정인데 걱정 되네요..,검둥이I코나EVI강원,2021-02-13 08:19:00
563311,솔직히 중고가 새차값에사느니 테슬라가는게 좋을거같아요,수정잉어킹,2021-02-13 13:02:00
563150,이제 또 애국 마케팅도 시작해야죠 ㅋ,좋은세상l모델3l경기,2021-02-12 14:11:00
563150,옵니아2 입니다,evI코나I충남,2021-02-12 14:14:00
563150,옴니아2 ㅎㅎㅎㅎㅎㅎㅎㅎㅎㅎ 인정합니디,어커I페리오닉I부산,2021-02-12 14:13:00
563150,,evI코나I충남,2021-02-12 14:14:00
563150,이거 만든사람 대단하네요,어커I페리오닉I부산,2021-02-12 14:15:00
563021,홍보? 알기쉽게 설명 좀~,창준아빠I오닉I서울,2021-02-12 12:36:00
563021,알바? 가입글도 없이..,창준아빠I오닉I서울,2021-02-12 12:38:00
563021,뭐지? 빨아주는 건가?,제냐l아이오닉I대구,2021-02-12 12:38:00
563021,"오닉이 오너분들 발끈하시네요 근데 사실입니다 ㅎㅎ ""테슬라미만잡"" 이 한 문장으로 다 표현이 될듯",음보마I모델3I울산,2021-02-12 12:55:00
563021,"테슬라 타시는 분들은 아시겠지만,출발하기까지의 과정이 스마트폰처럼 간결한게 테슬라말고는 없습니다.죄다 기존 차량과 동일하게 시동버튼 누르는 과정을 다 집어넣어놨더군요.",팅팅탱탱탱l경기,2021-02-12 14:53:00
563021,중고 감가 가격만 봐도 과거에도 테슬라가 답이었죠. 거기다 벽돌 + 화재까지.. 제가 보기엔 미래에도 테슬라가 답입니다.,아돌I구입예정I부산,2021-02-12 22:16:00
563015,제대로된 상품으로 경쟁할 생각은 없고 또다른 로비말곤 업을듯 합니다 ㅎㅎㅎ,던힐I코나I경남,2021-02-12 12:24:00
563015,검증된 테슬라와 검증이 필요한 아5는 시작부터 경쟁관계가 될 수 없다고 봅니다! 1년이상 소비자 피드백이 있어야 어깨라도 살짝 들이밀수 있을것같습니다현상황에 아5에서 모3으로 가신분들 엄청많을듯 합니다. 저는 미워도 다시한번인데 고민을 안할 수 없습니다,장수기전l 코나 l안산,2021-02-12 12:30:00
563015,코나 단종이라했다가 페리 판매한다 했죠.. 아5가격 내리면 하브와 전기차 전체적인 팀킬이 됩니다. 과연 어떤정책을 펼칠지 ..,할배온l볼트EVl경기,2021-02-12 12:30:00
563015,깡통값 내리고(아이오닉5 4천만~ 이렇게 광고하려고)옵션으로 다 돌리는거 말곤 없어보이는데 ㅋㅋ 이것도 오히려 민심을 더 건들거같습니다 ㅋㅋ,충북혁신l진천,2021-02-12 12:33:00
563015,코나화재건 조차도 간보기나하면서 해결을 미루면서 오닉5를 팔아먹겠다는거 자체가 모순이죠 ㅜ,미제I볼트I원주,2021-02-12 12:35:00
563015,가격인하한 만큼 단가 줄일려고 노력하겠죠.,창준아빠I오닉I서울,2021-02-12 12:39:00
563015,E-GMP등 플랫폼 개발등에 들어간 비용이 어마어마할텐데 그비용 뽑아먹을라면 내릴 여지가 있을지 의문이네요.상대는 현대인데요.....,오토메이션,2021-02-12 13:06:00
563015,일단 국토부한테 보조금 6천으로 하자고 한 팀은 박살 나겠네요. 테슬라 기준으로 가격 맞추는 거 말고 방법이 없겠지요. 아니면 안방에서도 안 팔릴 텐데.,철리l미정l서울,2021-02-12 13:10:00
563015,"퇴사각 잡고 있을듯 ㅋㅋㅋ그래도 플랜 2,3,4,5까진 준비해놨겠져구멍가게도 아니고...아닌가???ㅋㅋㅋ",팅팅탱탱탱l경기,2021-02-12 14:55:00
562874,자국민소비자를 졸로여긴지 꽤되었죠~기아인수후 독과점횡포...,미제I볼트I원주,2021-02-12 07:59:00
562690,평소의 현대입니다지금도 현대차를 타고있지만 그이상의 기대는 갖고있지않네요,우엉엉I광주,2021-02-11 11:20:00
562690,현대라기보다는 응대한 사람이 문제네요...물론 전체적으로 현대가 CS교육을 소흘히 한다는 것이기도...,노래하는님l오닉l인천,2021-02-11 11:27:00
562690,답답하시겠네요... 진짜 친절하고 고생하는 기사분들이 있는 반면 그렇게 꼭 하나 둘씩 빌런이 있는게 신기합니다...,구민I코나evI화성,2021-02-11 11:44:00
562690,현대가 현대했네요,호야I모델3코나I경기,2021-02-11 12:03:00
562690,ㅋㅋㅋㅋㅋ 저는 룸미러 빠졌는데 직접끼우세요 블핸즈 잡것들 내가 정비를 배우지 차라리 못끼워서 찾아간사람 한테 직접하라고 말이야 ㅡㅡ 경주 외동점 ㅅㅂ 돈안다고 구찮아서 직접하라고 열받아서 개판,영원파파 포터ev 대구,2021-02-11 12:13:00
562690,New Thinking New Possibilities. It is hyundai,쏭블리I볼트EVI서울,2021-02-11 12:44:00
562690,현대만의 올바른 응대법이지요...귀찮으니 그런겁니다..,제이슨l프라임I대구,2021-02-11 12:53:00
562690,현대 서비스직원들의 의식 속에는 고객이 있어 자기의 일이 있다는 생각이 없는 게 아닐까요 이러한 불성실한 태도는 전사적으로 크게 반성하는 계기가 있어야 할 듯합니다. 이제 외형은 세계적인회사인데 직원들 의식은 그 수준이 크게 미달하니 말이에요~,우재,2021-02-11 12:53:00
562690,현대의 전형적인 수법... 돌리고~~돌리고~~ 그러다 지쳐 포기하게 만든다는...,미래소년ㅣ코나ㅣ대구,2021-02-11 13:10:00
562690,현대만의 문제가 아닙니다 자동차제조사말고 통신사나 다른 모든기업이 마찬가지라고 봅니다 일단 담당자도 잘 만나야하는것도 중요한것 같습니다 어찌되었든 대기업이라면 cs에 비중을 높여야 하는데 이런저런 부분들이 많이 아쉬운건 사실이네요,나다우기l볼트l광주,2021-02-11 13:11:00
562690,현대가 테슬라나 다른 곳 보다 서비스가 괜찮은건 정말 인정 할 부분 이지만... 그것도 케바케에다가 ㅋㅋㅋㅋㅋㅋㅋㅋ 센터도 똑같습니다. 센터도요.,김가입l코나l충남,2021-02-11 16:41:00
562690,흉기차를 안사면 고통도 없지요...,팅팅탱탱탱l경기,2021-02-11 22:22:00
562690,시원하게 테슬라로 가시죠^^;,병욱I아이오닉I서울,2021-02-12 00:59:00
562683,"도움이 되는 기사였습니다. 현 상황은 크게 개선된 바 없군요 . 원인 규명은 확실히, 대책은 발빠르게 이루어지길 기대합니다.",왕시원ㅣ코나ㅣ서울,2021-02-11 10:57:00
562683,볼트도 화재가 났었나보네요. 코나 문제가 워낙 크게 부각되서 잘 몰랐었는데.,위민l아이오닉5l전북,2021-02-11 10:58:00
562683,"새로운 정보는, 리콜 업데이트 안 받아도 보증에 영향이 없다는 정도입니다. 나머지 내용은 처음 리콜 공지 나왔을 때 다 언급되었습니다.",웨슬리I볼트EVI나주,2021-02-11 11:34:00
562683,새로운 내용은 아니네요 아직 업데이트 안받고 그냥 90% 셀프업데이트로 버티는중입니다,심심이I볼트I서울,2021-02-11 11:37:00
562683,현대가낫네요그래도,완주I코나l빈,2021-02-11 12:13:00
562683,전 무슨방법이 나온줄 알았네요...,나다우기l볼트l광주,2021-02-11 17:03:00
562683,코나처럼 볼트도 배터리 바꿔주면 조컷다 신형66kw로~~,머구리ㅣ볼트ㅣ부산,2021-02-11 20:25:00
562683,저도 이거 바라보는 중입니다.. ;;,반딧불이군I볼트I무주,2021-02-17 23:34:00
562683,볼트도 배터리교체해 달라,또라,2021-03-30 07:12:00
562531,저도 블라인드에는 저희 회사 욕합니다. 그냥 그런 곳이에요.,일렉트로닉카I서울,2021-02-10 22:46:00
562531,현대 sw 기술력 진짜,크리스l오닉x2l경기,2021-02-10 23:45:00
562531,블라는 원래 자기 다니는 회사 욕하는 맛으로 쓰는거죠,나사로I없음I전주,2021-02-10 23:58:00
562531,항상 남의 떡이 좋아 보이긴 하죠..,하롱보이I볼트I대전,2021-02-11 01:08:00
562531,현대는 성과급에 실망해서 직원들(생산식들 말고 사무 연구직들)이 회사 까내리고 있다죠.,미키빠덜ㅣ코나ㅣ부산,2021-02-11 08:09:00
562525,예뻐요. 예뻐서 저도 갖고싶어요미니 사는 것과 같은 이유죠,어륀쥐I테슬라3I서울,2021-02-10 21:54:00
562525,정말이쁘죠 ㅠ 저는 모델Y랑 둘중에 너무 고민됩니다 가격이 어떻게 나오느냐에따라 선택할거같아요,서울Y엠비언트,2021-02-10 21:55:00
562525,실물을 보고 싶네요...,뚜비뚜벅I광명,2021-02-10 21:56:00
562525,부럽습니다~~ㅋ,미나노l없음l서울,2021-02-10 22:02:00
562525,일단 예약은 취소하면 계약금 돌려주니가격 제원 보시고 다른모델이랑 비교하고사전예약 특전같은거 있는지 보고코나 화재 원인 및 보상 보고마음에 안드는거 하나라도 있으면 취소하심 됩니다,솔나I경기,2021-02-10 22:09:00
562525,"네. 감사합니다.이미 다른 모델과의 비교는 끝났습니다. (디자인 가산점이 너무 커서...)초기 하자가 얼마나 있을까가 고민인데, 코나 화재는 lg 문제인듯 하니 걱정이 덜 되네요.일단 예약 걸겠습니다.^^",집정리I대전,2021-02-10 22:20:00
562525,지금 차 한대를 산다면 저라면 무조건 아이오닉5로 갑니다 전 모델3 산지 1년도 안되서 그냥 봉고 EV나 영입했습니다,MI모델3봉고EVI남양주,2021-02-11 00:38:00
562525,디자인에서 우선 그냥 홀림ㅜㅜ,초원대디I예정I동탄,2021-02-11 01:07:00
562525,저도 심각하게 고민중... 안전하게만 나오년 좋겠네요 아 그리고 롱레인지 6000 이하로 ㅎㅎ,샤오따민I충남,2021-02-11 06:28:00
562525,디자인만보면 cv가 나아보이던데... 저는 보조금도 그렇고 차를 빨리 받아야해서 아이오닉 대기중입니다~,푸별I예정I제주,2021-02-11 21:46:00
562481,개선된 배터리로 교체해주는게 아니었나요? 또 벽돌되면 어쩐대요. .,덧니빼꼼I코나I대전,2021-02-10 19:31:00
562481,용접이 문제가 아니죠 제정신 챙기면 용접없이 안에서만 만들어와야한다 생각합니다,라기I볼트I울산,2021-02-10 20:10:00
562481,생각이 있다면 그렇게 해주겠죠... 그런데 겪어보니 생각이 없는것 같더라구요...,근육이IKEI서울,2021-02-10 20:10:00
562481,교체 받은 결과 케이스는 똑 같아요 !!!,콩콩I코나I서울,2021-02-10 21:47:00
562481,유투브 보니까 보강 제품을 팔긴 하던데 안타깝네요.,아이조아I서울,2021-02-10 21:52:00
562481,"오랜만에 전기차까페들어왔습니다 대게 들어오더라도 잠깐 들어왔다가 바로 나가서. . . 그래도 대멀총각님은 꾸준시 글을 게시하시네요 아 안부차댓글 남기다가 갑자기 여쭙고싶은게 하나있네요 감속이오일을 교체하고 싶은데 가장저렴하게 교체하는방법좀알려주세요 감속기오일을 구매해서 오토큐가는게 가장저렴한거같은데 쏘울은어떤거 구매해야하고 어디서구매해야하는지등등 설명해놓은게 있으면 링크걸어주셔도되고요 개인적인일로 요즘 TV도끊고 뉴스공장도안보고,어쩌다 다음 뉴스검색하고 그게다네요 개인적인것 이루기전까진 목사님의견을 충실히따르려고요 ㅜㅜ",희망I쏘울I광명,2021-02-20 21:11:00
562481,쏘울도 똑같아요 현대기아 DCT 미션오일 구입해서 교체하심됩니다 네이버에서 검색하면 쫙~ 나와요 https://youtu.be/2KIVWVt6ryI,대머리총각I니로l충남,2021-03-07 20:41:00
562481,쪽지보세요~^^,희망I쏘울I광명,2021-03-07 20:16:00
562412,솔직한것은 돈이드니까요. 그것이 현대니까요. 천만안티가 코나 때문에 생긴게 아니죠..,크리스l오닉x2l경기,2021-02-10 15:26:00
562412,그렇죠 정말 징글징글 현대스러운 대응으로 나올 것으로 충분히 예상은 됩니다,밤송l코나l천안,2021-02-10 15:27:00
562412,아이오닉도 lg거일텐데 궁금하네요 진짜,안나l아이오닉l경주,2021-02-10 15:37:00
562412,솔직히 벽돌 2번이상 되면 전액 무상환불 해줘야하는거 아닌가 싶내요 그리고 배터리교체 한다고 해줘도 배터리하부 용접부위 문제점 브레이크 문제 안전상 문제있는 점들이 너무많아서 불안하네요,호야I모델3코나I경기,2021-02-10 17:09:00
562412,아이오닉5 론칭을 위한 전략일수도...,쌤씨l코나EVl제주,2021-02-10 17:32:00
562412,저도 이생각 ㅎ 부정적인 기류를 잠시 잠재우고 아오 런칭 팔기바쁘고 어느새 코나 배터리 전량교체썰은 썰로 종료 되는 시나리오 ???ㅎ,봘트lBOLTSOULl제주,2021-02-10 20:55:00
562412,교체 후에도 불나면 레전드...모델Y보면서 정말 치열한 전기차 시장 경쟁은 이미 시작 되었다고 생각합니다.현대 똑바로 정신안차리고 총력을 기울이지않으면 금새 도태됩니다.부디 이전의 쓰레기 마인드는 빨리 털어내야될겁니다.,잇힝I코나I경기,2021-02-10 18:30:00
562412,아이오닉5 도 불나면 알겠죠.,파랑비l코나I창원,2021-02-10 18:32:00
562412,코 불나자가즈아,코나l코나l문경,2021-02-11 23:45:00
562349,아쫌,크리스l오닉x2l경기,2021-02-10 12:47:00
562349,쫌!!!!,빠빠빠옹I코나l부산,2021-02-10 12:47:00
562349,대여섯번정도는 더 올라올듯하네요ㅋ,듀스틴Ii3I대구,2021-02-10 12:52:00
562349,한시간에 한번은 올라올듯,크리스l오닉x2l경기,2021-02-10 13:01:00
562349,배터리전부 다 무상교체해주면 ‥ 보상금액이 천문학적일거같네요 결함 잇다는데 교체안해줄수도없고 ㅠ,니로 전북,2021-02-10 12:49:00
562349,9만대 x2000만원 =1.8조 크긴 큽니다,오로라블랙l니로l서울,2021-02-10 18:57:00
562349,난리났네 난리났어,레청85INE45I인천,2021-02-10 12:49:00
562349,엘지가 배터리 전수 교체하면 어마어마한 금액이긴 하겠네요,슬램I예정I경기,2021-02-10 12:55:00
562349,배터리 리콜한다해도 배터리 다른 사업에 재사용가능하니까 천문학적 손해는 아닐거에요. 기사만 저렇게 자극적이게 쓴것뿐이에요,리얼l코나l김포,2021-02-10 12:55:00
562349,엘지서 중국업체에서 분리막 납품받는다는데 분리막품질때문에 사용중에 분리막이 손상되서 폭발?화재? 배터리수거해도 다시다뜯어서 조립해야하기에 그냥 배터리통채로 교체하는방법밖에없네요,니로 전북,2021-02-10 12:58:00
562349,찌라시 내용 그대로인데...걍 찌라시 받아적은거같은 느낌이네요,둥둥이l코나l구미,2021-02-10 13:19:00
562349,기사 수정됐어요,현기싫어Ix3I청주,2021-02-10 13:28:00
562349,불안한데 빨리 교체되었으면합니다.,그린하우스코나EV부산,2021-02-10 18:40:00
562349,기사에서는 찌라시라고 하는데요,쓰리고l모델3l부천,2021-02-10 19:03:00
562349,아무 내용없는데요.현대가 엘지보고 반까이 왜치는것으로 보임.그러고선 언론플레이중인듯 현대가!,난다난다ㅣ코나ㅣ경기,2021-02-10 19:50:00
562349,"엘지배터리 쓰는 다른 차들은 이상이 없고, 코나 차 중에서는 대부분 엘지 배터리 차가 문제였고....ㅜㅜ",철리l미정l서울,2021-02-10 20:38:00
562349,현대는 엘지 핑계 엘지는 중국 핑계,승패밀리I모델3l서울,2021-02-10 21:08:00
562349,"현대는 배상하고, 엘지한테 배상받길...",집정리I대전,2021-02-10 21:36:00
562349,엘지에서 납품가는 1000만뤈 안되는 걸로 알아요,똘망파파I코나I대전,2021-02-10 22:37:00
562349,빨리 원인나오면 좋겠네요,그린비I용인,2021-02-11 00:38:00
562349,차를 현대마당에 다들 주차시켜야겠네요,아로아빠 코나EV 김해,2021-02-11 17:26:00
562349,교체는 현대에서. 현대는 엘지에 소송으로.,샤울라l코나l서울,2021-02-13 10:37:00
562321,저런 언론사의 기사는 찌라시도 기사화하고 또 기사 내리고 그러더라고요. 좀 더 정확한 소스나 정부 공식 발표 등이 빨리 이루어지면 좋겠습니다. 그래야 코나 차주분들도 그 다음 스텝을 생각하죠,밤송l코나l천안,2021-02-10 11:43:00
562321,책임지고 잘 처리되야 할텐데,라온l쏘울evl서울,2021-02-10 11:44:00
562321,확실하지 않은 기사들이 많아서...,동화21I모델3I경기,2021-02-10 11:45:00
562321,http://www.greened.kr/news/articleView.html?idxno=286879이런 기사도 있어요,밤송l코나l천안,2021-02-10 11:47:00
562321,흠 뉴스까지 떳으면 찌라시가 점점 사실화되는걸가요,크리스l오닉x2l경기,2021-02-10 12:00:00
562321,현대 애플건이후로 현대차관련 뉴스는 무조건 팩트체크 해야됩니다,와야I모델3I용인,2021-02-10 12:13:00
562321,,미제I볼트I원주,2021-02-10 16:01:00
562321,,모삼l모델3l경기,2021-02-10 12:15:00
562321,,크리스l오닉x2l경기,2021-02-10 12:19:00
562321,뉴 데일리. . . 갠적으로 인지도 언론사 기사 안믿음. . . 주가도 보면 기사났다고. 주가 오르고 언론사가 문슨 벨르 뭔일보. . . ㅋ ㅋ ㅋ등등 그들만의 머 등등 아무튼 뉴스도 판단하고 보시기를~~,푸른바다I코나I경기,2021-02-10 12:22:00
562321,단독은 모다? ㅎㅎㅎ 그렇게 당하고도,로타소주I코쏘I인천,2021-02-10 12:43:00
562321,어차피 차판 현대가 모든책임을 줘야죠 베터리 탓만하는 현다이.,서초구주민포터ev서울,2021-02-10 14:57:00
562321,아욱....만들려면 좀 제대로 만들고 팔던가... 되팔지도 못하고..아욱. 이 것땜시 홧병 생가겠슈,수박이I코나EVI서울,2021-02-10 22:39:00
562298,정말 지극히 개인적인 생각입니다만..니로ev를 17개월째 타고 있는 사람으로 말씀 드리자면..차라리 하이브리드 사세요..ㅠ,균sI니로I춘천,2021-02-10 10:26:00
562298,ㅋㅋㅋ글쿤요...역시 밥주는시간을 무시할수없으니,갖고싶다l없음l청주,2021-02-10 19:00:00
562298,만약 코나 배터리 교체해준다고 발표 나면 배터리 교체 안된 키로수 많은 코나 구매하시는거도 좋을거 같네요.,치일라I코나I구리,2021-02-10 10:27:00
562298,일단 한번 렌트해서라고 타보세요. 코나 소울 니로 저는 전기차 카쉐어링족인데요. 별이슈없는 니로가 좋거나 화재이슈가 있어 중고가격이 떨어지고 있는 코나가 가격면에선 좋을거고요. 소울 1세대 2세대 주행거리는 좀 떨어지지만 이것도 저렴할테고요.,사골I서울,2021-02-10 10:28:00
562298,엔카같은곳봐도 아직2500선인데 이게 떨어진가격 맞ㄴㅏ요?,갖고싶다l없음l청주,2021-02-10 19:00:00
562298,"첫차면, 하이브리드 사시고,그건 별게로 들어 간다면, 돈 많으면 모3 // 돈 별로 없음. sm3 이렇게 하시는게.",레게머리I i3I수원,2021-02-10 10:33:00
562298,"충전이 용이한지, 생활반경이 넓지 않은지 잘 고려해보고 결정하세요..저는 아파트에 살고 생활반경도 크지않아 만족하면서 타고 있습니다.",찬이아빠ㅣ니로ㅣ대구,2021-02-10 10:35:00
562298,"안전과 가성비는 볼트죠, 충전속도가 떨어진다는 것과 외산차라 사고 수리비가 비싸다는게 흠이긴하지만요",갈색구두l볼트evl평촌,2021-02-10 10:34:00
562298,예산 따라 달라요 예산이 어느정도신지,크리스l오닉x2l경기,2021-02-10 10:35:00
562298,코나가 오히려 더 중고로는 좋지 않을까 합니다 얼마전까지 제주렌트 1800 코나 고민했었어요 싼가격에 배터리 교체까지 받게된다면..,우엉엉I광주,2021-02-10 10:38:00
562298,1800...?이요? 엔카같은곳 2500선이던데 ㅠㅠ 머죠,갖고싶다l없음l청주,2021-02-10 19:01:00
