"id","title","content","likes","url","author","views","created_at","updated_at"
"6277775569","LG밧데리 기술력이 떨어지는 이유","1. 현차는 고성능 모델에는 SK만 고집함 2. 코나 EV에서 화재가 발생한 배터리는 LG배터리였음 이 두 가지 사실은 팩트고 이미 나와있는 기정사실이다. 왜 LG가 SK에 거품물고 소송전을 벌였나? 사실 마음먹고 앙심을 갖고 소송 걸자면 SDI한테도 걸 수도 있다. 근데 유독 SK에 과민반응한 것은 그만큼 고급인력을 빼간것에 대한 앙심이 깊었단 뜻이지 그리고 타격이 기업측에서도 굉장했던 것이고 걔다가 소송으로 성장을 지연하지 않으면 안 될 만큼 SK의 잠재력이 높다는 뜻이기도 하다. SK와 LG의 배터리 점유율 차이를 보면 LG가 견제할 이유가 하등없음에도 LG는 SK를 누르기 위해 최선을 다했다. 이게 LG가 안되는 이유다. 그들은 2등의 DNA가 너무 강하다. LG가 산업군의 1등이 되려면 CATL만 바라봐도 바쁜데 점유율이 10% 20%차이나는 SK를 견제하느라 귀한 시간을 너무 허비했다. LG의 주가가 떨어진다는게 아니라 그들의 잠재력이 너무 낮다는 것이다. LG가 10%오른다면 SK는 50% 100%오를 기업이라고 생각한다.","-18","https://www.fmkorea.com/6277775569","언수외중심","1626","2023.10.13 09:37",""
"6277736625","현차의 유일한 동맹=sk","국내 3사 배터리 업체중 현차와 강력하게 링크된 것은 이노베이션이다 엘지는 코나 ev화재건으로 신뢰를 잃었고 구광모와 정의선이 합이 맞지 않는 느낌이 있다. 하지만 정의선과 최태원은 따로 만나 논의를 나누기도 하고 협업이 공식화되어 기사화 되기 까지 했다. 결국 현차가 가장 믿는 배터리는 이노베이션이라는 뜻이지 장기간 보유하며 큰 수익을 내기 원한다? 이노베이션일 수 밖에 없다. 거기다 불안정한 세계정세로 인해 정유사업을 하는 이노베이션의 락바텀이 가장 강력할것으로 생각한다.","-7","https://www.fmkorea.com/6277736625","언수외중심","990","2023.10.13 09:14",""
"6260781649","스압) 25/26 이세계 맨유 결산","생애 처음 써보는 에펨 시즌 결산입니다! 최대한 노력해봤지만 퀄리티는 장담 못할 거 같습니다 ㅋㅋ //image.fmkorea.com/files/attach/new3/20231007/5129496389/1938494152/6260279236/6ae3838e657bd1b020f29a6f153c6a1a.jpg //image.fmkorea.com/files/attach/new3/20231007/5129496389/1938494152/6260279236/422574d654e1ad05bc59d1a7490e1185.jpg //image.fmkorea.com/files/attach/new3/20231007/5129496389/1938494152/6260279236/612cda35d4be5f79ed5a6a06095604fb.jpg 시즌 중반 부상으로 인해 2-3개월을 출전하지 못했음에도 해리 케인이 27경기 35골로 득점왕에 오릅니다. 득점 2위는 38살의 메시로,에디터로 능력치 하향을 막은 덕에세월이 무색한 활약을 뽐내줍니다 에디터로 능력치 하향을 막은 덕에 //image.fmkorea.com/classes/lazy/img/transparent.gif 리그 최다 어시스트는 득점 2위에 오른 리오넬 메시! 최초로 한 시즌 리그 30-30을 달성합니다! //image.fmkorea.com/classes/lazy/img/transparent.gif PL 골든 글러브는 브라이튼의 수문장 로베르트 산체스가 거머쥡니다. 38경기 중 20경기에서 클린시트를 기록합니다 //image.fmkorea.com/classes/lazy/img/transparent.gif 25/26 PFA 올해의 팀입니다. 3명 빼면 모든 선수가 맨유 선수입니다 ㄷㄷㄷ //image.fmkorea.com/classes/lazy/img/transparent.gif PFA 올해의 선수는 31골 32도움을 기록한 리오넬 메시! 최고의 데뷔 시즌을 기록합니다 PFA 올해의 유망주는 레인 프로스트(생성)! 전 시즌에 이어 2 시즌 연속 수상에 성공합니다 //image.fmkorea.com/classes/lazy/img/transparent.gif 챔피언스 리그 최다 득점자는 해리 케인! 그 뒤를 모라타와 비티냐가 따라갑니다. //image.fmkorea.com/classes/lazy/img/transparent.gif 최다 도움 선수는 바이언의 요슈아 키미히! 팀의 8강 탈락에도 빛나는 활약을 보여줍니다! //image.fmkorea.com/classes/lazy/img/transparent.gif 25/26시즌 챔피언스리그 올해의 팀입니다! 6명의 맨유 선수와 메냥, 코나테, 발베르데, 호드리구, 블라호비치가 명단에 이름을 올립니다 //image.fmkorea.com/classes/lazy/img/transparent.gif 챔피언스리그 올해의 선수는 최다 득점자인 해리 케인! 올해의 유망주는 주드 벨링엄이 가져갑니다! //image.fmkorea.com/classes/lazy/img/transparent.gif 25/26시즌 시작 전 6명의 주요 선수들이 팀을 떠났습니다. 라파엘 바란과 크리스티안 에릭센은 24/25시즌 종료 후 팀을 떠나겠다고 한 후 각각 인테르와 레스터 시티로 FA 신분으로 이적했습니다. 지난 시즌부터 테오 에르난데스에게 밀려 출전 시간을 확보하지 못한 루크 쇼와 타이럴 말라시아가 각각 레알 마드리드와 나폴리로 이적했고, 리산드로 마르티네스와 이강인 선수는 각각 토트넘과 유벤투스로 이적했습니다. //image.fmkorea.com/classes/lazy/img/transparent.gif 많은 선수를 방출한 맨유는 빠르게 리빌딩에 들어갔습니다. 센터백 백업으로는 지오르죠 스칼비니를, 좌측 풀백 백업으로는 세르히오 레길론을, 만능 땜빵으로 마르코스 요렌테를 여름 이적시장에 영입했고 FA신분으로 풀린 GOAT 리오넬 메시를 영입했습니다. 겨울 이적 시장에는 팀의 주장 브루노 페르난데스의 부상과 이적생 요렌테의 부진으로 레알로부터 주드 벨링엄을 영입했으며 제주 유나이티드로부터 한국의 유망주 김태운을 영입했습니다. //image.fmkorea.com/classes/lazy/img/transparent.gif 25/26시즌 맨유의 베스트 11입니다. 붉은 유니폼을 입은 손-케 듀오가 눈에 띄는군요 //image.fmkorea.com/classes/lazy/img/transparent.gif 각 포지션 별 시즌 최고의 선수입니다. 공격수는 40골 46어시를 기록한 메시가 최고의 선수로 뽑혔습니다. 38살임에도 유력한 발롱도르 후보로 거론되고 있습니다. 미드필더는 60경기에 출전 3골 20어시를 기록한 팀의 프랜차이즈 스타, 차기 주장 레인 프로스트입니다. 평균 활동량 14.8km를 기록하며 개처럼 뛰어다녔습니다. 수비수는 무려 14골을 기록한 안토니오 실바가 최고의 선수로 뽑혔습니다. //image.fmkorea.com/classes/lazy/img/transparent.gif 각 포지션 별 시즌 최악의 선수입니다. 불미스럽게도 이적생 두 명이 최악으로 뽑혔습니다 공격수는 마커스 래시포드입니다. 스텟만 보면 준수하지만, 팀의 부주장이면서 맨날 주급 올려달라고 찡찡거려서 최악으로 뽑았습니다. 미드필더는 마르코스 요렌테입니다. 개처럼 뛰기만 했습니다. 우풀백, 중미, 수미 어따 세워도 많이 뛰기만 할 뿐 별다른 활약을 못보여줬습니다. 저 한 골도 PK입니다. 수비수는 세르히오 레길론입니다. 부상 때문에 경기를 못나왔고, 그 틈을 타 팀의 좌풀백 유망주인 루카스 엔리케가 준수한 활약과 성장을 보여주며 부상 복귀 이후 출전하지 못하고 있습니다. 그냥 강화 재료라고 생각합니다. 시즌 최고의 경기를 뽑아봤습니다. 바로... //image.fmkorea.com/classes/lazy/img/transparent.gif 챔피언스 리그 결승전 챔피언스 리그 결승전 챔피언스 리그 결승전 vs 레알 마드리드 vs 레알 마드리드 vs 레알 마드리드 vs 레알 마드리드 경기장 산티아고 베르나베우 경기장 산티아고 베르나베우 경기장 산티아고 베르나베우 Video PlayerVideo 태그를 지원하지 않는 브라우저입니다.00:00Use Up/Down Arrow keys to increase or decrease volume.00:00/00:111.00x2.00x1.75x1.50x1.25x1.00x0.75x0.50x0.25x절묘한 라인브레이킹으로 선취골을 뽑아내는 해리케인Video PlayerVideo 태그를 지원하지 않는 브라우저입니다.00:00Use Up/Down Arrow keys to increase or decrease volume.00:00/00:111.00x2.00x1.75x1.50x1.25x1.00x0.75x0.50x0.25x Video PlayerVideo 태그를 지원하지 않는 브라우저입니다.00:00Use Up/Down Arrow keys to increase or decrease volume.00:00/00:111.00x2.00x1.75x1.50x1.25x1.00x0.75x0.50x0.25x Video PlayerVideo 태그를 지원하지 않는 브라우저입니다.00:00Use Up/Down Arrow keys to increase or decrease volume.00:00/00:111.00x2.00x1.75x1.50x1.25x1.00x0.75x0.50x0.25x Video PlayerVideo 태그를 지원하지 않는 브라우저입니다.00:00Use Up/Down Arrow keys to increase or decrease volume.00:00/00:111.00x2.00x1.75x1.50x1.25x1.00x0.75x0.50x0.25x Video PlayerVideo 태그를 지원하지 않는 브라우저입니다.00:00Use Up/Down Arrow keys to increase or decrease volume.00:00/00:111.00x2.00x1.75x1.50x1.25x1.00x0.75x0.50x0.25x Video Player Video 태그를 지원하지 않는 브라우저입니다.00:00Use Up/Down Arrow keys to increase or decrease volume.00:00/00:111.00x2.00x1.75x1.50x1.25x1.00x0.75x0.50x0.25x Video 태그를 지원하지 않는 브라우저입니다.00:00Use Up/Down Arrow keys to increase or decrease volume.00:00/00:111.00x2.00x1.75x1.50x1.25x1.00x0.75x0.50x0.25x Video 태그를 지원하지 않는 브라우저입니다. Video 태그를 지원하지 않는 브라우저입니다. https://mediak5jvqbd.fmkorea.com/files/attach/new3/20231008/5129496389/1938494152/6260781649/0ce6e2cf5d794c6232bde7b368fa7b06.mp4 //image.fmkorea.com/files/attach/new3/20231008/5129496389/1938494152/6260781649/0ce6e2cf5d794c6232bde7b368fa7b06.mp4.thumb.jpg?e 00:00Use Up/Down Arrow keys to increase or decrease volume.00:00/00:111.00x2.00x1.75x1.50x1.25x1.00x0.75x0.50x0.25x 00:00 00:00 00:00 00:00 Use Up/Down Arrow keys to increase or decrease volume. Use Up/Down Arrow keys to increase or decrease volume. 00:00/00:11 00:00 / 00:11 1.00x2.00x1.75x1.50x1.25x1.00x0.75x0.50x0.25x 1.00x 2.00x1.75x1.50x1.25x1.00x0.75x0.50x0.25x 2.00x1.75x1.50x1.25x1.00x0.75x0.50x0.25x 2.00x 2.00x 1.75x 1.75x 1.50x 1.50x 1.25x 1.25x 1.00x 1.00x 0.75x 0.75x 0.50x 0.50x 0.25x 0.25x Video PlayerVideo 태그를 지원하지 않는 브라우저입니다.00:00Use Up/Down Arrow keys to increase or decrease volume.00:00/00:111.00x2.00x1.75x1.50x1.25x1.00x0.75x0.50x0.25x Video PlayerVideo 태그를 지원하지 않는 브라우저입니다.00:00Use Up/Down Arrow keys to increase or decrease volume.00:00/00:111.00x2.00x1.75x1.50x1.25x1.00x0.75x0.50x0.25x Video PlayerVideo 태그를 지원하지 않는 브라우저입니다.00:00Use Up/Down Arrow keys to increase or decrease volume.00:00/00:111.00x2.00x1.75x1.50x1.25x1.00x0.75x0.50x0.25x Video PlayerVideo 태그를 지원하지 않는 브라우저입니다.00:00Use Up/Down Arrow keys to increase or decrease volume.00:00/00:111.00x2.00x1.75x1.50x1.25x1.00x0.75x0.50x0.25x Video Player Video 태그를 지원하지 않는 브라우저입니다.00:00Use Up/Down Arrow keys to increase or decrease volume.00:00/00:111.00x2.00x1.75x1.50x1.25x1.00x0.75x0.50x0.25x Video 태그를 지원하지 않는 브라우저입니다.00:00Use Up/Down Arrow keys to increase or decrease volume.00:00/00:111.00x2.00x1.75x1.50x1.25x1.00x0.75x0.50x0.25x Video 태그를 지원하지 않는 브라우저입니다. Video 태그를 지원하지 않는 브라우저입니다. https://mediak5jvqbd.fmkorea.com/files/attach/new3/20231008/5129496389/1938494152/6260781649/49a341e80d7f9b5ec28be4d164e600b6.mp4 //image.fmkorea.com/files/attach/new3/20231008/5129496389/1938494152/6260781649/49a341e80d7f9b5ec28be4d164e600b6.mp4.thumb.jpg?e 00:00Use Up/Down Arrow keys to increase or decrease volume.00:00/00:111.00x2.00x1.75x1.50x1.25x1.00x0.75x0.50x0.25x 00:00 00:00 00:00 00:00 Use Up/Down Arrow keys to increase or decrease volume. Use Up/Down Arrow keys to increase or decrease volume. 00:00/00:11 00:00 / 00:11 1.00x2.00x1.75x1.50x1.25x1.00x0.75x0.50x0.25x 1.00x 2.00x1.75x1.50x1.25x1.00x0.75x0.50x0.25x 2.00x1.75x1.50x1.25x1.00x0.75x0.50x0.25x 2.00x 2.00x 1.75x 1.75x 1.50x 1.50x 1.25x 1.25x 1.00x 1.00x 0.75x 0.75x 0.50x 0.50x 0.25x 0.25x 테오의 맨마킹 실수로 인해 터져나온 호드리구의 환상적인 동점골Video PlayerVideo 태그를 지원하지 않는 브라우저입니다.00:00Use Up/Down Arrow keys to increase or decrease volume.00:00/00:111.00x2.00x1.75x1.50x1.25x1.00x0.75x0.50x0.25x Video PlayerVideo 태그를 지원하지 않는 브라우저입니다.00:00Use Up/Down Arrow keys to increase or decrease volume.00:00/00:111.00x2.00x1.75x1.50x1.25x1.00x0.75x0.50x0.25x Video PlayerVideo 태그를 지원하지 않는 브라우저입니다.00:00Use Up/Down Arrow keys to increase or decrease volume.00:00/00:111.00x2.00x1.75x1.50x1.25x1.00x0.75x0.50x0.25x Video PlayerVideo 태그를 지원하지 않는 브라우저입니다.00:00Use Up/Down Arrow keys to increase or decrease volume.00:00/00:111.00x2.00x1.75x1.50x1.25x1.00x0.75x0.50x0.25x Video PlayerVideo 태그를 지원하지 않는 브라우저입니다.00:00Use Up/Down Arrow keys to increase or decrease volume.00:00/00:111.00x2.00x1.75x1.50x1.25x1.00x0.75x0.50x0.25x Video Player Video 태그를 지원하지 않는 브라우저입니다.00:00Use Up/Down Arrow keys to increase or decrease volume.00:00/00:111.00x2.00x1.75x1.50x1.25x1.00x0.75x0.50x0.25x Video 태그를 지원하지 않는 브라우저입니다.00:00Use Up/Down Arrow keys to increase or decrease volume.00:00/00:111.00x2.00x1.75x1.50x1.25x1.00x0.75x0.50x0.25x Video 태그를 지원하지 않는 브라우저입니다. Video 태그를 지원하지 않는 브라우저입니다. https://mediak5jvqbd.fmkorea.com/files/attach/new3/20231008/5129496389/1938494152/6260781649/53fd351b6d81ae38b3f151b918513bd3.mp4 //image.fmkorea.com/files/attach/new3/20231008/5129496389/1938494152/6260781649/53fd351b6d81ae38b3f151b918513bd3.mp4.thumb.jpg?e 00:00Use Up/Down Arrow keys to increase or decrease volume.00:00/00:111.00x2.00x1.75x1.50x1.25x1.00x0.75x0.50x0.25x 00:00 00:00 00:00 00:00 Use Up/Down Arrow keys to increase or decrease volume. Use Up/Down Arrow keys to increase or decrease volume. 00:00/00:11 00:00 / 00:11 1.00x2.00x1.75x1.50x1.25x1.00x0.75x0.50x0.25x 1.00x 2.00x1.75x1.50x1.25x1.00x0.75x0.50x0.25x 2.00x1.75x1.50x1.25x1.00x0.75x0.50x0.25x 2.00x 2.00x 1.75x 1.75x 1.50x 1.50x 1.25x 1.25x 1.00x 1.00x 0.75x 0.75x 0.50x 0.50x 0.25x 0.25x 후반 시작 3분만에 산티아고 베르나베우를 조용하게 만든 GOAT 메시의 골 Video PlayerVideo 태그를 지원하지 않는 브라우저입니다.00:00Use Up/Down Arrow keys to increase or decrease volume.00:00/00:131.00x2.00x1.75x1.50x1.25x1.00x0.75x0.50x0.25x산티아고 베르나베우를 다시 불타오르게 만드는 레알의 NO.7 다비드 알라바의 환상적인 마무리그리고...Video PlayerVideo 태그를 지원하지 않는 브라우저입니다.00:00Use Up/Down Arrow keys to increase or decrease volume.00:00/00:121.00x2.00x1.75x1.50x1.25x1.00x0.75x0.50x0.25x경기 종료 10분 전, 교체로 들어간 18살 김태운과 주장 브루노 페르난데스의 환상적인 합작골 Video PlayerVideo 태그를 지원하지 않는 브라우저입니다.00:00Use Up/Down Arrow keys to increase or decrease volume.00:00/00:131.00x2.00x1.75x1.50x1.25x1.00x0.75x0.50x0.25x Video PlayerVideo 태그를 지원하지 않는 브라우저입니다.00:00Use Up/Down Arrow keys to increase or decrease volume.00:00/00:131.00x2.00x1.75x1.50x1.25x1.00x0.75x0.50x0.25x Video PlayerVideo 태그를 지원하지 않는 브라우저입니다.00:00Use Up/Down Arrow keys to increase or decrease volume.00:00/00:131.00x2.00x1.75x1.50x1.25x1.00x0.75x0.50x0.25x Video PlayerVideo 태그를 지원하지 않는 브라우저입니다.00:00Use Up/Down Arrow keys to increase or decrease volume.00:00/00:131.00x2.00x1.75x1.50x1.25x1.00x0.75x0.50x0.25x Video Player Video 태그를 지원하지 않는 브라우저입니다.00:00Use Up/Down Arrow keys to increase or decrease volume.00:00/00:131.00x2.00x1.75x1.50x1.25x1.00x0.75x0.50x0.25x Video 태그를 지원하지 않는 브라우저입니다.00:00Use Up/Down Arrow keys to increase or decrease volume.00:00/00:131.00x2.00x1.75x1.50x1.25x1.00x0.75x0.50x0.25x Video 태그를 지원하지 않는 브라우저입니다. Video 태그를 지원하지 않는 브라우저입니다. https://mediak5jvqbd.fmkorea.com/files/attach/new3/20231008/5129496389/1938494152/6260781649/4ca58a1c3e3c378803ba089ce6a89f56.mp4 //image.fmkorea.com/files/attach/new3/20231008/5129496389/1938494152/6260781649/4ca58a1c3e3c378803ba089ce6a89f56.mp4.thumb.jpg?e 00:00Use Up/Down Arrow keys to increase or decrease volume.00:00/00:131.00x2.00x1.75x1.50x1.25x1.00x0.75x0.50x0.25x 00:00 00:00 00:00 00:00 Use Up/Down Arrow keys to increase or decrease volume. Use Up/Down Arrow keys to increase or decrease volume. 00:00/00:13 00:00 / 00:13 1.00x2.00x1.75x1.50x1.25x1.00x0.75x0.50x0.25x 1.00x 2.00x1.75x1.50x1.25x1.00x0.75x0.50x0.25x 2.00x1.75x1.50x1.25x1.00x0.75x0.50x0.25x 2.00x 2.00x 1.75x 1.75x 1.50x 1.50x 1.25x 1.25x 1.00x 1.00x 0.75x 0.75x 0.50x 0.50x 0.25x 0.25x 산티아고 베르나베우를 다시 불타오르게 만드는 레알의 NO.7 다비드 알라바의 환상적인 마무리 그리고... Video PlayerVideo 태그를 지원하지 않는 브라우저입니다.00:00Use Up/Down Arrow keys to increase or decrease volume.00:00/00:121.00x2.00x1.75x1.50x1.25x1.00x0.75x0.50x0.25x Video PlayerVideo 태그를 지원하지 않는 브라우저입니다.00:00Use Up/Down Arrow keys to increase or decrease volume.00:00/00:121.00x2.00x1.75x1.50x1.25x1.00x0.75x0.50x0.25x Video PlayerVideo 태그를 지원하지 않는 브라우저입니다.00:00Use Up/Down Arrow keys to increase or decrease volume.00:00/00:121.00x2.00x1.75x1.50x1.25x1.00x0.75x0.50x0.25x Video PlayerVideo 태그를 지원하지 않는 브라우저입니다.00:00Use Up/Down Arrow keys to increase or decrease volume.00:00/00:121.00x2.00x1.75x1.50x1.25x1.00x0.75x0.50x0.25x Video Player Video 태그를 지원하지 않는 브라우저입니다.00:00Use Up/Down Arrow keys to increase or decrease volume.00:00/00:121.00x2.00x1.75x1.50x1.25x1.00x0.75x0.50x0.25x Video 태그를 지원하지 않는 브라우저입니다.00:00Use Up/Down Arrow keys to increase or decrease volume.00:00/00:121.00x2.00x1.75x1.50x1.25x1.00x0.75x0.50x0.25x Video 태그를 지원하지 않는 브라우저입니다. Video 태그를 지원하지 않는 브라우저입니다. https://mediak5jvqbd.fmkorea.com/files/attach/new3/20231008/5129496389/1938494152/6260781649/0c602510c587d15e2642a9f65ce0ac41.mp4 //image.fmkorea.com/files/attach/new3/20231008/5129496389/1938494152/6260781649/0c602510c587d15e2642a9f65ce0ac41.mp4.thumb.jpg?e 00:00Use Up/Down Arrow keys to increase or decrease volume.00:00/00:121.00x2.00x1.75x1.50x1.25x1.00x0.75x0.50x0.25x 00:00 00:00 00:00 00:00 Use Up/Down Arrow keys to increase or decrease volume. Use Up/Down Arrow keys to increase or decrease volume. 00:00/00:12 00:00 / 00:12 1.00x2.00x1.75x1.50x1.25x1.00x0.75x0.50x0.25x 1.00x 2.00x1.75x1.50x1.25x1.00x0.75x0.50x0.25x 2.00x1.75x1.50x1.25x1.00x0.75x0.50x0.25x 2.00x 2.00x 1.75x 1.75x 1.50x 1.50x 1.25x 1.25x 1.00x 1.00x 0.75x 0.75x 0.50x 0.50x 0.25x 0.25x //image.fmkorea.com/classes/lazy/img/transparent.gif 상대 팀의 홈 구장에서 펼쳐지는 완벽한 열세의 경기에서 승리를 차지한 최고의 경기였습니다. 25/26시즌, 들 수 있는 모든 우승컵을 들어올린 최고의 시즌이었습니다 //image.fmkorea.com/classes/lazy/img/transparent.gif","16","https://www.fmkorea.com/6260781649","AESIR","4862","2023.10.08 00:32",""
"6204013600","9/21 곡물뉴스","https://www.farmprogress.com/markets-and-quotes/afternoon-market-recap https://www.farmprogress.com/markets-and-quotes/afternoon-market-recap -옥수수 +1%, 대두 +0.25~0.5%, 밀-0.5~+0.75% 옥수수 +1%, 대두 +0.25~0.5%, 밀-0.5~+0.75% -0.5 -달러 소폭 약세. 에너지 약세. 원유 -1.25%, 디젤 -1.75%, 가솔린 -1.5% 달러 소폭 약세. 에너지 약세. 원유 -1.25%, 디젤 -1.75%, 가솔린 -1.5% - 옥수수는 저가매수세 이어지며 상승 - 브라질 23/24 옥수수 생산량은 재배면적 감소하며 생산량 전년대비 -9.1% 전망 - 대두는 기술적 매수세에 소폭 상승. 대두박 +1.5%, 대두유 -1% - 브라질 23/24 대두 생산량은 전년대비 +5% 증가 전망. 대두 재배면적 +2.7% - 밀은 혼조세 속 상승. 시카고 연질밀 +0.75%, 캔자스 경질밀 -0.5%, 미니애폴리스 봄밀 +0.75% https://www.admisi.com/global-ag-news-for-sept-20-23/ https://www.admisi.com/global-ag-news-for-sept-20-23/ - 미국은 중서부 연질 겨울밀 수확 증가로 밀 생산과 공급 전망 개선되면서 재고 상황 개선되는 중. 다만 값싼 러시아 산 밀의 공급이 감소하면 밀 가격 급격히 상승할 경우에 대한 우려. 현재 러시아는 통화가치가 올해 -30% 하락한 가운데 기록적 수확량과 충분한 이월재고로 저렴하게 밀 판매중. 중국은 수확철 습한 날씨에 밀 피해입으며 밀 수입 증가. 가뭄으로 아르헨티나, 캐나다, 호주 밀 공급 크게 감소하며 러시아와 중국 제외한 글로벌 공급 대비 소비는 타이트. 북아프리카 밀 수확량 부진으로 수입 수요 증가. 동남아시아와 아프리카는 쌀가격 상승에 밀 수요로 이동 - 러시아가 밀 가격 하한 설정하자 이집트는 프랑스와 불가리아에서 저 저렴한 밀로 대체 - 유럽 누적 연질밀 수출 (7/1~)은 전년대비 -27% 감소. 주요 수출대상은 모로코, 나이지리아, 알제리 등. 보리 수출 -11%, 옥수수 수입 -44% - 브라질 23/24 곡물 생산량은 전년대비 -1% 감소 전망. 옥수수 -9.1%, 대두 +5.1%, 면화 -5.6% 전망 - 브라질 24년 유지종자 분쇄용량 +9% 증가할 전망. 23년에는 +5.6% 증가. 브라질 유지종자 분쇄 용량의 대부분(98%)은 대두 분쇄에 집중 - 중국는 미국 대두 수화철에도 브라질 대두 계약 지속. 다만 중국의 대두 분쇄 마진 하락으로 수요 우려 - 호주는 봄 폭염에 남동부 전역에 수십건의 산불. 뉴사우스웨일스 주에서 68건 이상의 화재. 시드니 근방에도 화재 위험 경고. 시드니는 5회 연속으로 주간 최고기온이 30도 넘어서고 있지만 목요일 한파로 20도까지 떨어질 전망. Video PlayerVideo 태그를 지원하지 않는 브라우저입니다.00:0000:00/00:071.00x2.00x1.75x1.50x1.25x1.00x0.75x0.50x0.25x Video PlayerVideo 태그를 지원하지 않는 브라우저입니다.00:0000:00/00:071.00x2.00x1.75x1.50x1.25x1.00x0.75x0.50x0.25x Video PlayerVideo 태그를 지원하지 않는 브라우저입니다.00:0000:00/00:071.00x2.00x1.75x1.50x1.25x1.00x0.75x0.50x0.25x Video PlayerVideo 태그를 지원하지 않는 브라우저입니다.00:0000:00/00:071.00x2.00x1.75x1.50x1.25x1.00x0.75x0.50x0.25x Video Player Video 태그를 지원하지 않는 브라우저입니다.00:0000:00/00:071.00x2.00x1.75x1.50x1.25x1.00x0.75x0.50x0.25x Video 태그를 지원하지 않는 브라우저입니다.00:0000:00/00:071.00x2.00x1.75x1.50x1.25x1.00x0.75x0.50x0.25x Video 태그를 지원하지 않는 브라우저입니다. Video 태그를 지원하지 않는 브라우저입니다. https://media.fmkorea.com/files/attach/new3/20230921/192159903/1150192867/6204013600/99b983892094b5c6d2fc3736e15da7d1.mp4?d //image.fmkorea.com/files/attach/new3/20230921/192159903/1150192867/6204013600/99b983892094b5c6d2fc3736e15da7d1.mp4.thumb.jpg 00:0000:00/00:071.00x2.00x1.75x1.50x1.25x1.00x0.75x0.50x0.25x 00:00 00:00 00:00 00:00 00:00/00:07 00:00 / 00:07 1.00x2.00x1.75x1.50x1.25x1.00x0.75x0.50x0.25x 1.00x 2.00x1.75x1.50x1.25x1.00x0.75x0.50x0.25x 2.00x1.75x1.50x1.25x1.00x0.75x0.50x0.25x 2.00x 2.00x 1.75x 1.75x 1.50x 1.50x 1.25x 1.25x 1.00x 1.00x 0.75x 0.75x 0.50x 0.50x 0.25x 0.25x","5","https://www.fmkorea.com/6204013600","스트레인저댄픽션","148","2023.09.21 07:01",""
