"id","title","content","likes","url","author","views","created_at","updated_at"
"6868894684","구형 니로 ev 중고 사는거 어떤가요?","올해부터 회사에서 전기차를 사면 15% 지원금을 준다고 하네요, 구형 니로 ev 중고로 사는거 어떤가여? 원래 한 2000 초반 정도에서 소나타 DN8 적당한 급으로 살까 하고 있었는데 회사에서 15% 현금 지원 + 세금 + 유지비 봤을때 구형 니로 ev도 19년식 정도에 10만 이하 탄게 2300정도 하는 것 같아서요 만약 니로로 사게되면 충전기는 아파트는 아닌데 회사랑 집 주변에 충전기 있는 월주차장 8만원 정도 해서 월주차 끊으려고 합니다 혹시 고질병이나 사면 안될 이유같은거 있을까요? 원래 구형 코나 ev도 생각하다가 코나는 화재이슈가 있더라구요","1","https://www.fmkorea.com/6868894684","도랑물","2653","2024.03.30 17:20",""
"6807197733","코나 일렉트릭 화재 한장 요약","1세대 코나라서 배터리 화재인가 싶었는데,차는 멀쩡한거 보니까 배터리에서 불난거 아니고 충전구에서 불난듯.왜 났는지는 몰?루?만약 디올뉴코나도 주차 중 불난다면 .. 보상 얼마나 해줄라나?블박 = 순정하이패스 = 순정애프터블로우 = 순정 //image.fmkorea.com/files/attach/new3/20240311/6761627/5768733335/6807197733/2cfbf7714ce9435b3ef7886446d7a7db.jpg 1세대 코나라서 배터리 화재인가 싶었는데, 차는 멀쩡한거 보니까 배터리에서 불난거 아니고 충전구에서 불난듯.왜 났는지는 몰?루?만약 디올뉴코나도 주차 중 불난다면 .. 보상 얼마나 해줄라나?블박 = 순정하이패스 = 순정애프터블로우 = 순정 HUD = 순정제조사 vs 충전기업체 진놈 돈내놔 HUD = 순정 제조사 vs 충전기업체 진놈 돈내놔 //image.fmkorea.com/files/attach/new3/20240311/6761627/5768733335/6807197733/4fe6fd8fc0d97b509f6e4f922bf68af6.jpg","5","https://www.fmkorea.com/6807197733","그돈씨일렉트릭","2216","2024.03.11 13:29",""
"6807153578","코나 일렉트릭 화재...","또 전기차 화재냐... //image.fmkorea.com/files/attach/new3/20240311/6761627/4422551161/6807153578/f6af6d79ee64e4a1ea76f3c90713672a.jpg https://n.news.naver.com/article/014/0005153882?sid=102 https://n.news.naver.com/article/014/0005153882?sid=102","10","https://www.fmkorea.com/6807153578","예비역육군소령","2868","2024.03.11 12:14",""
"6788308560","아 이게 강화 보호권이 아니라 강화 재시도권이었구나","나 여태까지 코나테 7카 강화하고 터지면 다시 팔생각했는데 그게 아니라 그냥 빼박 재시도하는거였네? ㅈ될뻔","3","https://www.fmkorea.com/6788308560","J_Klopp","2471","2024.03.05 15:55",""
"6763345031","2021년) 코나아이 수조원대 특혜 논란 경기도 지역화폐 평가위…""이재명 관계자 2명 있었다""","평가위원 A씨, 이재명 이사장 맡았던 성남시상권활성화재단 본부장 출신평가위원 B씨, 이재명 경기지사 당선 뒤 경기도시장상권진흥원 본부장으로국민의힘 최춘식 ""매번 특혜 의혹에 제도개선 시급…행안부 특별감찰 해야"" 평가위원 A씨, 이재명 이사장 맡았던 성남시상권활성화재단 본부장 출신 평가위원 B씨, 이재명 경기지사 당선 뒤 경기도시장상권진흥원 본부장으로 국민의힘 최춘식 ""매번 특혜 의혹에 제도개선 시급…행안부 특별감찰 해야"" https://www.newdaily.co.kr/site/data/html/2021/10/18/2021101800069.html이것도 매우수상 다시한번파보면 주렁주렁나올듯 https://www.newdaily.co.kr/site/data/html/2021/10/18/2021101800069.html https://www.newdaily.co.kr/site/data/html/2021/10/18/2021101800069.html https://www.newdaily.co.kr/site/data/html/2021/10/18/2021101800069.html https://www.newdaily.co.kr/site/data/html/2021/10/18/2021101800069.html https://www.newdaily.co.kr/site/data/html/2021/10/18/2021101800069.html 이것도 매우수상 다시한번파보면 주렁주렁나올듯 이것도 매우수상 다시한번파보면 주렁주렁나올듯 이것도 매우수상 다시한번파보면 주렁주렁나올듯 이것도 매우수상 다시한번파보면 주렁주렁나올듯","8","https://www.fmkorea.com/6763345031","메가시티","201","2024.02.26 20:44",""
