"id","title","content","likes","url","author","views","created_at","updated_at"
"6149752969","일본 미스터리 리뷰 - 미카미 코시로 <창천의 새>","서적 상세 //image.fmkorea.com/files/attach/new3/20230904/486263/3613946900/6149752969/7d2eec16a6546a4cd4b97ac6fdc1b701.jpeg 작가: 미카미 코시로(三上幸四郎) 제목: 창천의 새(蒼天の鳥) 출판정보 코단샤 2023년 8월 23일 출간 단행본 완전 신작 줄거리: 1924년, 도쿄 상경을 앞둔 다나카 코요코는 딸인 치도리와 함께 톳토리시에서 상영되는 <흉적 지고마>를 관람하러 방문한다. 그러나 상영중 갑작스러운 화재가 발생하고, 코요코 모녀는 지고마 분장을 한 사내가 다른 사내를 살해하는 모습을 목격하고 간신히 도망친다. 하마무라의 집으로 도망치고 안도한 코요코였지만, 지고마 분장을 한 사내와 그 일당이 코요코 모녀를 쫓아오고, 그 과정에서 또다른 사건이 발생하자, 코요코의 남편 와쿠시마는 이 사건의 배경에 과격한 사회주의 아나키스트 집단이 있음을 짐작하는데… 리뷰: 실존했던 여류 작가인 다나카 코요코를 주인공으로 한 추리소설로, 올해 69회 에도가와 란포상을 수상하며 데뷔한 작품이다. 다나카 코요코는 돗토리현 출신으로 당시 페미니즘적인 주제의 문학을 발표하였으나 삼십대의 젊은 나이에 요절한 작가라고 한다. 그 이외에 사회운동가 출신인 기자이자 코요코의 남편인 와쿠시마 요시히로, 코요코의 동향 친구이자 후대에 재평가를 받으며 유명해진 여류작가 오사키 미도리 등 실존 인물이 등장한다. 시대적인 배경도 그렇고 실존 인물이 나오는 것도 그렇고, 미스터리즈 신인상인 <삼인서방>과 비슷하다. 유행인가? 돗토리현의 하마무라라는 한적한 시골을 배경으로, 당대의 사회주의 운동과 소위 “신여성”이라 불리던 여성 해방 운동 등을 소재로 삼아, 일련의 살인사건과 이에 코요코 모녀가 엮이게 되는 미스터리를 풀어나가는 구성으로 되어있다. 생동감 있는 인물 묘사와 당대 돗토리현이나 영화, 복식 등에 대한 생생한 배경 묘사, 경력자다운 유려한 문체와 템포 좋은 전개로 하나의 대중 소설로서 나쁘지 않은 작품이다. 다만 심사위원들 역시 지적하고 있듯이, 미스터리 소설로서 가져야 할 “미스터리”에 대한 소양이 매우 부족한 소설이다. 최근 몇년 간 란포상의 흐름을 되짚어 봤을 때, 지금까지의 흐름에 역행하는 아쉬운 수상결과라 하겠다. 이 부분에 대해서는 심사위원 중 교고코 나츠히코의 선평을 빌려 갈음하겠다. 미스터리 소설 애독자라면 일고해볼만한 선평이라 생각한다.(다만 교고쿠 선생은 이런 관점에서 이 소설을 좋게 평가했다. 평가한 관점 자체는 이해할 수 있지만, 미스터리로서의 평가 기준은 공감하기 어려웠다.) “예를 들어, ‘미스터리로서는 뛰어나지만 소설로서는 미숙하다’는 평가는 자주 듣는다. 이것 고칠 수 있다. 문장이건 표현이건 플롯이건간에 다듬어가는 것은 가능하고, 그에 따라 미스터리로서의 핵이 변질되지만 않는다면, 얼마나 개고를 해도 작품의 동일성은 유지된다. “예를 들어, ‘미스터리로서는 뛰어나지만 소설로서는 미숙하다’는 평가는 자주 듣는다. 이것 고칠 수 있다. 문장이건 표현이건 플롯이건간에 다듬어가는 것은 가능하고, 그에 따라 미스터리로서의 핵이 변질되지만 않는다면, 얼마나 개고를 해도 작품의 동일성은 유지된다. 그러나 ‘소설로서는 매우 재미있지만 미스터리로서는 범용’한 경우는 어떨까. 소위 말하는 트릭에 해당하는 부분이 파탄나있다면, 수정할 수 도 있을 것이다. 그러나 실수는 없음에도 ’미스터리로서는 약하다‘고 평가받는 작품의 경우, 그것은 ’그런 작품‘으로 완성되어 있는 것이다. 그러나 ‘소설로서는 매우 재미있지만 미스터리로서는 범용’한 경우는 어떨까. 소위 말하는 트릭에 해당하는 부분이 파탄나있다면, 수정할 수 도 있을 것이다. 그러나 실수는 없음에도 ’미스터리로서는 약하다‘고 평가받는 작품의 경우, 그것은 ’그런 작품‘으로 완성되어 있는 것이다. 본래, 미스터리와 소설은 불가분이고, 괴리되어 있는게 아니다. 미스터리 ’그 자체‘가 소설을 구성하는 형태가 바람직하다고 생각한다“ 본래, 미스터리와 소설은 불가분이고, 괴리되어 있는게 아니다. 미스터리 ’그 자체‘가 소설을 구성하는 형태가 바람직하다고 생각한다“","4","https://www.fmkorea.com/6149752969","arisu","891","2023.09.04 23:56",""
"6036884097","현대차·기아, '스톱앤고 과열로 화재위험'에 美서 9만여대 리콜","(서울·워싱턴=연합뉴스) 권수현 기자 강병철 특파원 = 현대차와 기아가 미국에서 화재위험으로 차량 9만1천여대를 리콜한다고 밝혔다고 3일(현지시간) AP통신, 로이터통신 등이 보도했다.리콜 대상은 현대차의 팰리세이드 2023∼2024년형과 투싼·쏘나타·엘란트라·코나 2023년형, 기아의 셀토스 2023∼2024년형, 쏘울과 스포티지 2023년형이다.현대차와 기아는 이들 차량의 ISG(Idle Stop & Go·차가 멈추면 엔진을 자동 정지하는 시스템) 오일펌프의 전동식 제어기에 손상된 전자 부품이 포함됐을 가능성이 있어 과열을 유발할 수 있다며 리콜 사유를 설명했다.이와 관련, 기아에는 6건, 현대차에는 4건 잠재적으로 열과 관련돼 있는 상황 보고가 있었으나 실제 사고나 부상이 발생한 것은 없다고 로이터통신은 보도했다. //image.fmkorea.com/files/attach/new3/20230804/6761627/38294670/6036884097/ac69abe9037c4869979387539887c3e6.jpg https://n.news.naver.com/mnews/article/001/0014111268?rc=N&ntype=RANKING https://n.news.naver.com/mnews/article/001/0014111268?rc=N&ntype=RANKING","8","https://www.fmkorea.com/6036884097","미니쿠퍼JCW","1132","2023.08.04 17:02",""
"6034175295","[긴급] 미국에서 현대,기아차 화재위험으로 91,000대 리콜","//image.fmkorea.com/files/attach/new3/20230803/6761627/5673969896/6034175295/a007a15f248a2f15272bbe8cf411859a.png https://www.reuters.com/business/autos-transportation/hyundai-kia-recall-91000-us-vehicles-over-fire-risks-urge-owners-park-outside-2023-08-03/ https://www.reuters.com/business/autos-transportation/hyundai-kia-recall-91000-us-vehicles-over-fire-risks-urge-owners-park-outside-2023-08-03/ 워싱턴, 8 월 3 일 (로이터) - 현대자동차 (005380.KS)와 기아 (000270.KS)는 목요일 화재 위험으로 인해 미국에서 91,000 대 이상의 최신 차량을 리콜하고 있으며 소유주들에게 수리가 진행되는 동안구조물에서 멀리 떨어진 곳에 주차 할 것을 촉구한다고 밝혔다. 구조물에서 멀리 떨어진 곳에 주차 할 것을 촉구한다고 밝혔다. 리콜 대상은 현대 2023-2024 팰리세이드, 2023 투싼, 쏘나타,엘란트라(아반떼), 코나 차량과 2023-2024 셀토스, 2023 기아 쏘울, 스포티지 차량입니다.한국 자동차 제조업체는 ISG 오일 펌프 어셈블리 용 전자 컨트롤러에 손상된 전기 부품이 포함되어 펌프가 과열 될 수 있다고 말했습니다. 딜러는 필요에 따라 전기 오일 펌프 컨트롤러를 검사하고 교체 할 것입니다. 엘란트라(아반떼) ( 로이터 원문, Deel L 번역 ) 요약 요약 요약 - ISG 오일펌프 문제로 91,000대 리콜 조치 - 현대기아자동차그룹은 다음의 차 소유에게 최대한 구조물에서 멀리 떨어진곳에 주차할것을 촉구 (urged) 현대 자동차 - 2023-2024 펠리세이드 - 2023 투싼 - 2023 소나타 - 2023 엘란트라 ( 아반떼 ) - 2023 코나 기아 자동차 - 2023-2024 셀토스 - 2023 쏘울 - 2023 스포티지","14","https://www.fmkorea.com/6034175295","소프트콘","3633","2023.08.03 21:17",""
"5707001164","경주 코나ev 충전중 화재","//image.fmkorea.com/files/attach/new3/20230424/6761627/3577658215/5707001164/c6779d583c46181235825452eeb33f53.png //image.fmkorea.com/files/attach/new3/20230424/6761627/3577658215/5707001164/434725c61ea6442ee2a58cbd875a5c2d.png 2019년식 코나면 리콜대상인데 리콜을 안받았나? 받았는데 충전중 화재가 난건가? 크흠.. //image.fmkorea.com/files/attach/new3/20230424/6761627/3577658215/5707001164/7c37f4ab70d777baa93d982e4343f50b.png","9","https://www.fmkorea.com/5707001164","88pal","3332","2023.04.24 10:39",""
"5698110267","자동차안전연구원, 코나EV 화재 구체적원인은 불명","https://www.asiae.co.kr/article/2023042109323699136 https://www.asiae.co.kr/article/2023042109323699136 2019년부터 발생 1세대 코나 EV 화재 'LG에너지솔루션 책임↑' 해석 여지 음극탭리드 접힘으로 리튬 부산물 생성 리튬 부산물이 성장해 양극탭리드에서 합선 발생 화재 재현 시험 통해 원인 ‘추정’ 연구원 “구체적인 원인 특정 어려워” //image.fmkorea.com/files/attach/new3/20230421/6761627/3579074713/5698110267/331cd1797947a1cd72f5df5acb04ab7f.png //image.fmkorea.com/files/attach/new3/20230421/6761627/3579074713/5698110267/2240a95b60e3ba062721b3cf2ebb3e85.png //image.fmkorea.com/files/attach/new3/20230421/6761627/3579074713/5698110267/a0ea047721b3b3dd70ba6f641f841cef.png https://www.asiae.co.kr/article/2023042109331605895 https://www.asiae.co.kr/article/2023042109331605895 보고서 곳곳에 '발생 가능성 확인'·'추정' 전문가 ""원인 잘못 짚었으며 결론도 이상해"" 탭리드 접힘 아니더라도 리튬 부산물 생기거나 가혹 조건이면 정상 배터리서도 나와 ""주행거리 늘리기 위해 배터리 운용↑ 원인"" 화재가 발생한 코나 EV의 배터리 운용 범위는 97~98%인 것으로 과거 국립과학수사연구원 보고서에서 밝혀졌다. 즉, 주행 거리를 늘리기 위해 가혹한 조건으로 배터리가 운용돼 셀에 손상이 가고 합선 및 불이 났을 가능성이 크다는 것이다. 박 교수는 “배터리 팩은 배터리 셀을 수 백개 이상 직병렬로 연결해서 만들기 때문에 안전성 확보가 중요하다”고 말했다.","5","https://www.fmkorea.com/5698110267","al3c9d32","1284","2023.04.21 11:14",""
