id,title,content,likes,url,author,views,created_at,updated_at
1534120,전기차 충전율 90% 넘으면 서울 아파트 지하주차장 출입금지,"전기차 충전율 90% 넘으면 서울 아파트 지하주차장 출입금지전기차 소유자, 배터리 충전율 자율 설정 가능최근 아파트 지하주차장에서 전기차 화재가 잇따르는 가운데 서울시가 “전기차의 배터리 잔량이 90%를 넘어서면 공동주택 지하주차장 출입을 막겠다”라는 대책을 9일 내놓았다.완충에 가깝도록 충전된 차량의 출입을 막아 혹시 모를 화재를 예방하자는 취지다.전기차 화재는 외부 충격, 배터리 결함 등 다양한 원인으로 발생하는데, 과도한 충전도 주요 원인으로 지적되고 있다.업계에서는 전기차 배터리 성능 유지와 화재 예방을 위해 충전율을 제한하는 것이 바람직하다는 의견이 많다.우선 다음 달 말까지 ‘공동주택 관리규약 준칙’ 개정을 통해 공동주택 지하주차장에 90% 이하로 충전을 제한한 전기차만 출입할 수 있도록 권고하기로 했다.시는 90% 충전제한 정책의 즉각적인 시행을 위해 개정 이전에도 공동주택에 관련 내용을 먼저 안내해 입주자대표회의 의결을 통해 자체적으로 지하주차장 내 90% 충전제한 차량만 출입을 허용하도록 지원할 계획이다.전기차 충전율 제한 방법은 제조사에서 설정을 하거나 전기차 소유주가 설정을 하는 방법 등 2가지이다.제조사에서 내구성능·안전 마진을 10%로 설정하면 실제로는 배터리 용량의 90%만 사용할 수 있으나 차량 계기판에는 100% 용량으로 표시된다.아니면 전기차 소유주가 직접 차량 내부의 배터리 설정 메뉴에서 90%·80% 등 최대 충전율을 자율적으로 선택하면 된다.예컨대 제조사에서 내구성능·안전 마진을 10%로 설정한 전기차에 소유자가 목표 충전율을 80%로 설정하면 실질적으로는 배터리의 72%를 사용하게 된다.이에 시는 전기차 소유주가 요청할 경우 제조사에서 90% 충전 제한을 설정할 수 있도록 하고, 해당 차량에는 충전 제한 인증서를 발급한다는 계획이다.전기차 제조사들과 주차 중인 차량의 배터리 상태정보를 실시간으로 모니터링하고, 이상징후가 발생할 경우 즉각 대응하는 시스템을 구축하는 방안도 검토 중이다.공동주택에 설치된 전기차 충전시설에 대한 선제적 화재안전관리 강화를 위해 화재안전조사 등 점검도 강화한다.서울시 소방재난본부는 전기차 충전시설이 설치된 서울시내 공동주택 약 400곳에 대해 스프링클러설비 등 소방시설 유지관리 상태와 개선사항 등을 다음 달 말까지 긴급 전검한다.아울러 10월까지 서울시 건축물 심의기준을 개정해 전기차로 인한 대형화재 위험성을 고려한 안전시설 기준도 마련하기로 했다.또 전기자동차 전용주차구역은 3대 이하로 격리 방화벽을 구획하고, 주차구역마다 차수판을 설치할 계획이다.원본보기여장권 서울시 기후환경본부장이 9일 서울 중구 서울시청에서 공동주택 전기차 화재 예방대책을 발표하고 있다. 연합뉴스여장권 서울시 기후환경본부장은 “전기차 충전 제한을 통해 전기차 화재를 상당 부분 예방할 수 있을 것으로 기대한다”며 “시민 불안을 최소화할 수 있도록 안전성이 우수한 전기차 보급하고 충전 인프라를 구축하겠다”고 말했다.지난 1일 인천 청라국제도시의 한 아파트 지하주차장에서 벤츠 전기차에서 화재가 발생했다. 천만다행으로 사망자는 없었으나 입주민 수백명이 화재로 인해 피해를 입었고 이재민이 다수 발생했다.폭염의 날씨속에 단전·단수가 이어지면서 이들은 여전히 대피소에서 지내는 불편을 겪고 있다https://n.news.naver.com/article/022/0003958639?sid=102",2,https://cafe.naver.com/ca-fe/ArticleRead.nhn?clubid=21771803&page=4&userDisplay=50&inCafeSearch=true&searchBy=0&query=%EB%B2%A4%EC%B8%A0+%ED%99%94%EC%9E%AC&includeAll=&exclude=&include=&exact=&searchdate=2024-08-012024-08-30&media=0&sortBy=date&articleid=1534120&referrerAllArticles=true,톰I서울,775,2024-08-09 15:12:00,
1534104,중국산과 같은기술이 아닌 k배터리,https://youtu.be/1OYTjL9ZZZM?si=t1FUs0gkThtp3ngr,1,https://cafe.naver.com/ca-fe/ArticleRead.nhn?clubid=21771803&page=4&userDisplay=50&inCafeSearch=true&searchBy=0&query=%EB%B2%A4%EC%B8%A0+%ED%99%94%EC%9E%AC&includeAll=&exclude=&include=&exact=&searchdate=2024-08-012024-08-30&media=0&sortBy=date&articleid=1534104&referrerAllArticles=true,디옵터68ㅣ부산,328,2024-08-09 15:04:00,
1534064,인재 ?? 테러?스프링클러 정지버튼 누군가 눌렀다,,0,https://cafe.naver.com/ca-fe/ArticleRead.nhn?clubid=21771803&page=4&userDisplay=50&inCafeSearch=true&searchBy=0&query=%EB%B2%A4%EC%B8%A0+%ED%99%94%EC%9E%AC&includeAll=&exclude=&include=&exact=&searchdate=2024-08-012024-08-30&media=0&sortBy=date&articleid=1534064&referrerAllArticles=true,테슬라서울,201,2024-08-09 14:34:00,
1534058,카페 가입 한달됬는데 많은 사건 사고가 일어나고 전기차 공부할수록 첫픽과 다르게 되네요,"처음엔 출퇴근+페밀리카로 eqa ix1에 강하게 꽂혀있었습니다.그러던 중 에이 전기차는 테슬라지..재고떨이도 하는데 모Y가자..테슬라 사는방법 너무나 피곤함..뒷자리 안좋다고함(귀가 펄렁귀애요)와이프될 사람이랑 살림 합치면서 차 사는거라 둘다 아이가질생각이라 페밀리카를 원해서 eqb로 강하게 끌림, 마음 굳힘(곧바로) 벤츠게이트 터짐벤츠배터리 화재 및 거짓말농단 일어남..정내미 떨어짐..마음에도 없었던 q4의 배터리 알루미늄 동봉에 매우 긍정적으로 마음이 끌림(옵션이 없으니 고장이 덜남 장점이자 단점)ix1, 3 q4 모Y 중 고민하게됨.이왕 출퇴근용으로 오래탈 거 생각하니 bmw는 다 좋은데 모터 문제와 보증문제가 좀 있는 듯함.연말 내에 구매할 계획인데 전기차를 알면알수록 고민이 깊어지네요..다들 이러셨나요??ㅠㅠ 연말까지 계속 고민해보려구요. 벤츠사건만 잘 해결되면 eqb가고싶어요.",0,https://cafe.naver.com/ca-fe/ArticleRead.nhn?clubid=21771803&page=4&userDisplay=50&inCafeSearch=true&searchBy=0&query=%EB%B2%A4%EC%B8%A0+%ED%99%94%EC%9E%AC&includeAll=&exclude=&include=&exact=&searchdate=2024-08-012024-08-30&media=0&sortBy=date&articleid=1534058&referrerAllArticles=true,전기차구매I대전,244,2024-08-09 14:31:00,
1534030,어떤 새대가리에서 나온 정책인지 모르겠지만 탁상행정 끝판왕이네요 ㅋㅋ,90%이하일때만 아파트 지하주차장 진입이요? ㅋㅋㅋㅋㅋㅋㅋㅋㅋ그걸 누가 하나하나 다 확인하고 있을건데요? 아파트 경비원이 다 확인해야하나요? 아님 주차장관리요원을 따로 배치하라고 할건가요? ㅋㅋ,1,https://cafe.naver.com/ca-fe/ArticleRead.nhn?clubid=21771803&page=4&userDisplay=50&inCafeSearch=true&searchBy=0&query=%EB%B2%A4%EC%B8%A0+%ED%99%94%EC%9E%AC&includeAll=&exclude=&include=&exact=&searchdate=2024-08-012024-08-30&media=0&sortBy=date&articleid=1534030&referrerAllArticles=true,뿡빵I전남,733,2024-08-09 14:14:00,
1533938,[가입인사] 반갑습니다.,1. 자기소개 : 안녕하세요. 타이칸 페리 계약했습니다. 잘 부탁드립니다2. 지역 : 화성동탅3. 한글별명의 뜻 : 뽀민파파4 관심있는 전기차 : 타이칸5 보유하고 있는 전기차 (보유/계약 여부) : 출고예정6 가입계기 : 전기차에 관심있어서 가입했습니다7 하고 싶으신 말씀 : 잘 부탁드립니다.요즘 벤츠 화재로 뒤숭숭하지만 잘 이겨내리라 봅니다.,0,https://cafe.naver.com/ca-fe/ArticleRead.nhn?clubid=21771803&page=4&userDisplay=50&inCafeSearch=true&searchBy=0&query=%EB%B2%A4%EC%B8%A0+%ED%99%94%EC%9E%AC&includeAll=&exclude=&include=&exact=&searchdate=2024-08-012024-08-30&media=0&sortBy=date&articleid=1533938&referrerAllArticles=true,뽀민파파I타이칸I화성,12,2024-08-09 13:18:00,
1533906,배터리 현직자 글(펌글),배터리 현직자 벤츠사태 이모저모 (블라인드)벤츠가 중국 돈이 묻어버리니 검증안된 배터리 가져다 쓰다가 하필이면 영업이익 1위찍는 호구민국에서 대형 화재를 냈넹우선 차주변상책임 없음 👉제조물책임법에 제조사가 과실입증하도록 법으로 소비자를 보호함그럼 보험사는일단 다 물어주고 구상권을 벤츠에게 청구하게될것으로 보임그럼 벤츠는피해보상 피할길이 없고 아파트측 지하주차장 관리부실로 과실비율에 대한 전략 논의중일거같음앞으로는벤츠 자체가 차의 퀄리티가 낮은편이었는데 이번사태를 계기로 아우디화 될 가능성 있음 👉벤츠 생각 잘해야하는데 우리나라만큼 저 구린내나는 차를 향기롭게 받아주고 초고가에 사줄나라 없다고봥 120% 물어주고 석고대죄가 가장좋은 방법이될수 있음배터리는한국제조사들은 시행착오를 미리겪었고 2022년이후 나오는 배터리 안정성은 세계 탑급이라 할수 있을듯LG엔솔 : 코나 볼트 태워먹고 수조원짜리 lesson 있음 이제 엔솔 배터리가 대형리콜급 화재생기지는 않을거같음SK온 / 삼성SDI : 품질관리에 신경많이쓰고 있고 특히 반도체공정 해본사람들 갈아넣고 해서 벤츠 태우는정도 화재는 안날거같음한국시장에서 삼원계 중국배터리 탑재된차는 이제 기피대상이 될거같은데 중국산 LFP 배터리는 좋으니 혹시 오해가 없길 바라며,9,https://cafe.naver.com/ca-fe/ArticleRead.nhn?clubid=21771803&page=4&userDisplay=50&inCafeSearch=true&searchBy=0&query=%EB%B2%A4%EC%B8%A0+%ED%99%94%EC%9E%AC&includeAll=&exclude=&include=&exact=&searchdate=2024-08-012024-08-30&media=0&sortBy=date&articleid=1533906&referrerAllArticles=true,여리혀기IEV6I동탄,"4,139",2024-08-09 12:50:00,
1533858,청라 벤츠 사건보다 더 위험한 EV6 발화,"청라 벤츠 사건은 3일간 그냥 서있다가 발화한 사건이죠.벤츠의 경우 차체 바닥에 큰 충격이 들어갔고,냉각수 등이 서서히 흘러나오면서 온도를 유지하지 못한게 화재의 이유가 아닐까생각합니다.차를 운행하다가 생기는 일상적인 부분인데, 이정도에 발화한건 벤츠의 전적인 책임인거죠.벤츠사에서는 차량 배터리의 이상여부를 확인하지 못했기 때문에 벤츠가 온전히 책임을 져야한다고 생각합니다.금산 EV6 발화의 경우는 충전 중 발화입니다.https://www.yna.co.kr/view/AKR20240806034352063정확히는 완충 후 발화입니다.100% 완충시 발화는 기존 코나로 우리가 자주 접하던 전기차 사건이였죠.https://www.carguy.kr/news/articleView.html?idxno=40188코나는 그 이후 불이 나지 않는 것 같습니다. BMS업데이트 및 배터리팩 교체로 해결된 것으로 '생각'되는데 실상은 좀 안타깝습니다.완충이 어렵도록 만들었고 최대 충전 한계를 강제적으로 줄여버리기 까지 했습니다.불은 안나는데 코나 차주들의 재산권을 침해한 결과라고 생각합니다.코나가 불이 났던 이유는 엘지 엔솔의 배터리 제작에 문제가 있었다는 방향으로 발표가 났었죠.이번 EV6 발화의 시작으로 또다시 불이 계속된다면, 제조사의 BMS관리 능력에 의구심이 커질 수 밖에 없습니다.코나 때 처럼 최대 충전한도를 줄이는 일이 또 다시 생길 수 있습니다.500km 간다고 구매한 차량인데 자꾸 불이 나서 80%충전만 가능하게 되어버리면 차값의 20%가 날아가는겁니다.아니, 그보다 더 큰 손해가 난다고 생각됩니다.온라인 게임 혹시 해보신 분들 아실껍니다.같은 아이템에 추가로 붙은 능력치가 10% 차이나면 가격차이는 10%가 아닌걸요.80% 충전만 하자는 시민들의 인식이 시작되는데 이건 굉장히 잘못된 부분입니다.제조사가 100% 충전이 '위험'하게 만들었는데, 시민들이 조심하자는건 굉장히 잘못된 방향이죠.100% 충전을 해도 안전한 자동차를 만드는게 제조사의 일이고, 그 제조사가 잘못한다면 나라(환경부 등)에서 나서서과징금이나 처벌을 해야 합니다.개인적인 생각으로, BMS에서 열화로 인한 배터리 셀들을 관리하지 못하는게 아닐까 싶습니다.열화되어 그만큼의 에너지를 가지고 있을 수 없는데, 그냥 때려 박아버리는 바람에 폭주가 나는게 아닐까 하고요.열화관리 부실이 맞고, 열화의 관리를 못한걸 그대로 둔다면, 열화가 진행된 차량들은 앞으로도 발화할껍니다.이번 EV6 완충 후 발화도 그렇고, 기존 코나 차량들의 발화들의 양상을 보면 완충이라는 연결고리가 있습니다.결과가 나와봐야 알겠지만 시민들에게 80% 충전을 강제하지 말고 제조사에서 100% 충전에도 안전한 차량을 만드는 것이 가장 중요함을 알았으면 좋겠습니다.",0,https://cafe.naver.com/ca-fe/ArticleRead.nhn?clubid=21771803&page=4&userDisplay=50&inCafeSearch=true&searchBy=0&query=%EB%B2%A4%EC%B8%A0+%ED%99%94%EC%9E%AC&includeAll=&exclude=&include=&exact=&searchdate=2024-08-012024-08-30&media=0&sortBy=date&articleid=1533858&referrerAllArticles=true,라호대장I테모YI서울,"4,751",2024-08-09 12:14:00,
1533827,스프링클러 끈 사람 있었다?!,"인천 전기차 화재, 스프링클러 끈 사람 있었다 (hani.co.kr)",0,https://cafe.naver.com/ca-fe/ArticleRead.nhn?clubid=21771803&page=4&userDisplay=50&inCafeSearch=true&searchBy=0&query=%EB%B2%A4%EC%B8%A0+%ED%99%94%EC%9E%AC&includeAll=&exclude=&include=&exact=&searchdate=2024-08-012024-08-30&media=0&sortBy=date&articleid=1533827&referrerAllArticles=true,깜lgv60l서울,645,2024-08-09 11:46:00,
1533817,스프링클러를 껐네요… 청라..,이러면 관리사무소 파산하면 전체입주민 엔빵인건가요?벤츠 과실분 빼고는..벤츠는 자기차와 근처 몇대만 보상하고 나머진 아파트에서 엔빵해야겠네요..,1,https://cafe.naver.com/ca-fe/ArticleRead.nhn?clubid=21771803&page=4&userDisplay=50&inCafeSearch=true&searchBy=0&query=%EB%B2%A4%EC%B8%A0+%ED%99%94%EC%9E%AC&includeAll=&exclude=&include=&exact=&searchdate=2024-08-012024-08-30&media=0&sortBy=date&articleid=1533817&referrerAllArticles=true,산나무ll울산,"2,249",2024-08-09 11:35:00,
1533803,저희 아파트 밴츠 전기차 는 지하 주차 못하게 하네여…,같은 전기차 오너로써에휴….,0,https://cafe.naver.com/ca-fe/ArticleRead.nhn?clubid=21771803&page=4&userDisplay=50&inCafeSearch=true&searchBy=0&query=%EB%B2%A4%EC%B8%A0+%ED%99%94%EC%9E%AC&includeAll=&exclude=&include=&exact=&searchdate=2024-08-012024-08-30&media=0&sortBy=date&articleid=1533803&referrerAllArticles=true,서울ll아우디e트론,"2,094",2024-08-09 11:28:00,
1533798,EQE차주입니다. 벤츠는 각성하라!!!,스프링클러 문제로 인해 화재를 더 키운건 알겠는데언제까지 벤츠의 수수방관 태도를 참아줘야 되나요?EQ시리즈 차들 주차장 주차금지 되는 곳도 생기고오너들 괜히 눈치보고 불안해하고 이게 무슨 상황인지...정말 사고는 벤츠가 치고 피해는 차주들이 보고 진짜반성좀하세요!!! 어차피 개인의 불만 목소리는 기업의 가치와부합되지 않겠지만 답답한 현상황에 적어봤습니다.전기차 오너분들 EQ오너분들 힘내십쇼!!,0,https://cafe.naver.com/ca-fe/ArticleRead.nhn?clubid=21771803&page=4&userDisplay=50&inCafeSearch=true&searchBy=0&query=%EB%B2%A4%EC%B8%A0+%ED%99%94%EC%9E%AC&includeAll=&exclude=&include=&exact=&searchdate=2024-08-012024-08-30&media=0&sortBy=date&articleid=1533798&referrerAllArticles=true,하율lEQEl인천,702,2024-08-09 11:26:00,
1533763,전기차포비아의 긍정적인 면도 있다고 봅니다.,"전기차는 시기상조라는 말이,전기차 구매전에는 몰랐는데,구매하고 나면 한번씩 처다보게 됩니다.운행하시는분들은 공감하시겠지만, 현재 전기차는 시기상조야라는 말에는여러가지 의미가 있으시죠?전기차주들 입장에서는 전기차 보급이 어려워지고, 캐즘이 길어질수록, 여러가지 혜택이 유지될 수 있고,도로위의 차량이 늘어나는 속도와 충전기 보급속도가 비슷해야, 실 운행에서 큰 스트레스가 없으니까요.이번 전기차 화재에서 언론은 소비자와 소비자가 싸우는 갈리치기를 의도하고,차량시장의 다수를 차지하는 내연기관 소비자들에게 혐오감을 심어주는 묘한 방향으로 흘렀습니다만,결국 이번 화재로 인해 안전에 대한 기준강화와 화재에 대한 다양한 대비가 이루어진다고 생각합니다.벤츠의 경우 천만다행으로 인명피해가 없었으니, 이를 발판삼아 기존 지하주차장에, 최소한 전기차전용소화기와질식소화포 정도는 구비하고, 더 나아가서 전기차전용관창까지 가지고 있는등의 강화가 이루어 졌으면 좋겠습니다.간혹 타 커뮤니티에서 전기차 타는 사람들은 대부분 이기적이고, 본인들이 얼리어답터인줄 안다.전기차는 절대 친환경이 아니다 등등 여러 말이 있지만, (물론 전기차 자체가 무공해 라는 말은 안어울린다는것에 동의는 합니다.)탄소발자국을 관리할 수 있다는 측면, 신재생에너지가 늘어가는 측면, 전기효율이 더 좋은 측면등, 전기차는 결국 미래 먹거리임에는 변함이 없다고 봅니다. 앞으로 전기차가 자리잡는 시기가 더 늦어질거라고는 생각이 들지만, 대세에는 변함이 없죠.소비자가 소비자를 비난하는 행태는, 소비자의 권리를 포기하는 방향과 같습니다. 비난받아야 하는건 제조사와 이를 허가한 정부이지, 이를 소비하는 소비자에게까지 비난의 화살이 날라오는건 결코 정상적인 모습이 아니니까요.",0,https://cafe.naver.com/ca-fe/ArticleRead.nhn?clubid=21771803&page=4&userDisplay=50&inCafeSearch=true&searchBy=0&query=%EB%B2%A4%EC%B8%A0+%ED%99%94%EC%9E%AC&includeAll=&exclude=&include=&exact=&searchdate=2024-08-012024-08-30&media=0&sortBy=date&articleid=1533763&referrerAllArticles=true,와우l아이오닉5l광주,"1,772",2024-08-09 11:00:00,
1533744,인천 화재 관련하여 벤츠의 입장 나온거 있나요??,공식이든 비공식이든 나온 부분 있나요??책임 질려고 하진 않을 것 같긴 한데...어떻게 될지....,0,https://cafe.naver.com/ca-fe/ArticleRead.nhn?clubid=21771803&page=4&userDisplay=50&inCafeSearch=true&searchBy=0&query=%EB%B2%A4%EC%B8%A0+%ED%99%94%EC%9E%AC&includeAll=&exclude=&include=&exact=&searchdate=2024-08-012024-08-30&media=0&sortBy=date&articleid=1533744&referrerAllArticles=true,부산ev6낭만,809,2024-08-09 10:43:00,
1533739,청라화재 결과가 예상되네요,"< 차주가 전장류 건드린것 없다고 가정합니다 >1. 벤츠 공식사과문 발표 및 피해보상안 발표- 본 차량 및 바로 옆 차량에 대해서만 보상- 피해 확산의 원인은 스프링클러 미작동이니 보상불가- 본 카페 의견 종합하면 벤츠가 책임을 져야 한다고 주장하나 정작 스프링클러 미작동으로 피해확산이 된것이라는 의견이 다수인것으로 보아 벤츠의 책임은 일부에 국한될것으로 보임- 벤츠에 모든 책임을 전가하려면 스프링클러 무용론을 주장해야 하는데 이경우 전기차는 모두 지하주차장에서 퇴출될 수 있어 전기차주 이익에 반하는 주장이 됨.- 책임회피론에 벤츠 이미지는 좀 나빠지겠지만 과거 bmw사태로 미루어보면 '이 또한 지나가리라' 라는 마인드로 대응할것으로 보임.- 할인율 좀 높여서 팔면 없어서 못팔것임. 아우디 디젤게이트때도 2년간 평택항에 주차된 차량을 40%에 할인하겠다는 루머가 돌자마자 각종 커뮤에 어떻게 하면 살 수 있겠냐라는 글들이 올라온거 보면 결국 돈에 장사 없다가 무엇인지 볼 수 있게 될 것임(참고로 아우디 차량은 전량 본사에 반품되었음)2. 아파트 입대의- 스프링클러 무용론을 주장하겠으나 여러 연구조사에 의하면 스프링클러가 피해 지연에 효과가 있다고 확인되어 아파트입대의 주장은 힘을 잃을 것을 보임- 스프링클러를 관리소 직원이 껐다하면 해당 직원 및 관리업체에게 구상권을 행사할 것이고, 관리 부실로 인해 고장 및 오작동이였다면 아파트입대의 책임으로 아파트가 구상권을 받아야 함- 실례로 천안 세차차량 화재때에도 스프링클러 작동금지를 조작한 관리소직원에게 피해확산 책임을 물어 실형을 선고하였음- 문제는 아파트입대의=입주민단체 이기 때문에 아파트입대의가 구상권을 받을 경우 결국 입주민들이 돈을 내야하는 상황이 생기게 됨. 이 경우 구상권이 유효한지는 잘 모르겠음. 법에 대해 잘 아시는 분이 답변 부탁드립니다3. 주차장 피해 차량- 자차처리 후 보험회사는 아파트 입대의에 구상청구- 자차없는 차주는 본인이 수리비 지출 후 별도 구상권청구 소송을 제기해야 하나 매우 어려운 가시밭길이 될 확률 높음. 왠만한 자차비용만큼 소송비가 나올 수 있을 상황이라 소송 포기하고 자비로 해결하게 될 것으로 보임4. 보험회사- 100억이 넘는 보상 주체를 찾아야 손실을 최소화 할 수 있는데 벤츠가 가장 적격인 대상이라 기를 쓰고 벤츠의 잘못으로 몰아갈 확률 높음. 서로가 최고의 법무법인을 선임할테니 세기의 소송전이 될 수 있음. 다만, 스프링클러의 문제로 여론이 형성되고 있어 현재로서는 벤츠가 좀 더 유리한 상황?5. 법무법인- 어느쪽 의뢰를 받더라도 돈벼락 확정이기에 사실상 본 사고의 최고 수혜자*추가확인된 사항- 스프링클러 밸브를 관리소에서 잠근것으로 확인되어 대부분의 구상금액을 관리소가 책임져야 할 것으로 보입니다. 다만, 관리업체가 영세하다면 사실상 구상 받을 길은 없다고 봐야 합니다",0,https://cafe.naver.com/ca-fe/ArticleRead.nhn?clubid=21771803&page=4&userDisplay=50&inCafeSearch=true&searchBy=0&query=%EB%B2%A4%EC%B8%A0+%ED%99%94%EC%9E%AC&includeAll=&exclude=&include=&exact=&searchdate=2024-08-012024-08-30&media=0&sortBy=date&articleid=1533739&referrerAllArticles=true,대세I모델YEV9I남양주,"2,459",2024-08-09 10:37:00,
1533699,역시나 적시나 존시나~~~,청라 화재와 관련해서누군가는 벌벌 떨고 있을거라고 댓글 남긴적 있는데역시나 적시나 존시나~~~https://n.news.naver.com/article/001/0014865414,0,https://cafe.naver.com/ca-fe/ArticleRead.nhn?clubid=21771803&page=4&userDisplay=50&inCafeSearch=true&searchBy=0&query=%EB%B2%A4%EC%B8%A0+%ED%99%94%EC%9E%AC&includeAll=&exclude=&include=&exact=&searchdate=2024-08-012024-08-30&media=0&sortBy=date&articleid=1533699&referrerAllArticles=true,슈퍼맨li오닉5l광주,522,2024-08-09 10:14:00,
1533683,전기차 주차장 차별대우에 대해 어떻게 생각하시나요?,"최근에 전기차 화재 뉴스가 많기에 안좋은 시선과 여론 또한 많아지는 분위기네요.사실은 화재 위험성 자체를 배제하진 않겠으나, 청라쪽은 스프링쿨러가 작동되지 않았기에손해방지가 전혀 안되어 피해가 더 막심하다는 사실은 언론에서도 부각되지 않더라구요아파트 외부주차장이 있는 경우 갑자기 전기차의 지하주차장 진입을 금지하는 경우도발생하고 있는데, 이러한 경우 법적으로 강제화는 아니기에 서로간의 감정싸움만 되는 느낌입니다.이러는 와중에 현재 지어지고 있는 아파트들이나 추후의 신축아파트 들에서전기차에 대해 지상 주차장으로 만드는 강제 법안이 나올까봐 염려됩니다.헌데 최근에는 지상에 자동차 진입을 못하게하는 추세라 상충되기에아예 아파트 외부 변두리에 수용소 같이 만들어 버리면 최악의 상황이 될 거같네요..사실상 화재방지의 의미라면 아파트 내부 실외기실 설치 의무화도 폐지해야하는거 아닌가 싶습니다.오히려 실외기가 내부에 들어오면서 실외기 화재뉴스가 빈번해진걸 보면요..혹시 전기차 차주분들께서는 이러한 전기자 주차구역 차별에 대해서 어떻게 보시는지요?",0,https://cafe.naver.com/ca-fe/ArticleRead.nhn?clubid=21771803&page=4&userDisplay=50&inCafeSearch=true&searchBy=0&query=%EB%B2%A4%EC%B8%A0+%ED%99%94%EC%9E%AC&includeAll=&exclude=&include=&exact=&searchdate=2024-08-012024-08-30&media=0&sortBy=date&articleid=1533683&referrerAllArticles=true,너드레이크l아6l서울,424,2024-08-09 10:04:00,
