id,title,content,likes,url,author,views,created_at,updated_at
1535463,"현대차·제네시스, 전기차 13종 배터리 제조사 홈페이지서 공개. 코나 일렉트릭 외 모두 국산…기아도 조만간 공개할 듯","현대차·제네시스, 전기차 13종 배터리 제조사 홈페이지서 공개코나 일렉트릭 외 모두 국산…기아도 조만간 공개할 듯현대차 전기차 배터리 공개인천 전기차 화재로 소비자의 전기차 배터리에 대한 알 권리가 부각되는 가운데 현대차가 국내 자동차업체 중 처음으로 전기차 배터리 제조사를 공개했다.10일 자동차업계에 따르면 현대차는 전날 홈페이지를 통해 현대차 10종과 제네시스 3종 등 총 13종의 전기차에 탑재된 배터리의 제조사를 밝혔다.공개 대상인 현대차 모델은 현재 단종된 아이오닉을 포함해 아이오닉5·6, 코나 일렉트릭, ST1, 캐스퍼 일렉트릭, 포터 EV 등이다.코나 일렉트릭에는 세계 1위 배터리업체인 중국 CATL의 배터리가 탑재됐으며, 나머지 9종에는 국내 업체인 LG에너지솔루션 또는 SK온의 제품이 장착됐다.제네시스 전기차인 GV60, GV70·G80 전동화 모델의 배터리 제조사도 공개됐다. 이들 차종에는 모두 SK온 배터리가 탑재됐다.현대차 측은 최근 메르세데스-벤츠 전기차 화재 이후 배터리 제조사 관련 문의가 쇄도하자 선제적으로 정보를 공개했다고 설명했다.기아 역시 조만간 전기차 배터리 정보를 홈페이지 등을 통해 공개할 것으로 알려졌다.현대차그룹의 전기차 배터리 제조사 정보 공개를 계기로 다른 국산차 및 수입차 업체들도 공개에 나설지 주목된다.국토교통부는 오는 13일 국내 주요 완성차 제조·수입차 업체와 함께 전기차 안전 점검 회의를 열어 배터리 정보 공개에 대한 입장을 들을 예정이다.https://n.news.naver.com/article/001/0014867701?sid=101",0,https://cafe.naver.com/ca-fe/ArticleRead.nhn?clubid=21771803&page=2&userDisplay=50&inCafeSearch=true&searchBy=0&query=%EB%B2%A4%EC%B8%A0+%ED%99%94%EC%9E%AC&includeAll=&exclude=&include=&exact=&searchdate=2024-08-012024-08-30&media=0&sortBy=date&articleid=1535463&referrerAllArticles=true,톰I서울,"1,432",2024-08-10 21:26:00,
1535405,청라 벤츠차 충전이 90프로 이상된상태로 주차중이었나요?,갑자기 90프로 충전 제한나온건청라벤츠화재 영향같은데벤츠차 충전이 90프로 이상이었는지 궁금합니다,0,https://cafe.naver.com/ca-fe/ArticleRead.nhn?clubid=21771803&page=2&userDisplay=50&inCafeSearch=true&searchBy=0&query=%EB%B2%A4%EC%B8%A0+%ED%99%94%EC%9E%AC&includeAll=&exclude=&include=&exact=&searchdate=2024-08-012024-08-30&media=0&sortBy=date&articleid=1535405&referrerAllArticles=true,라이도이 볼트 대구,"2,110",2024-08-10 20:03:00,
1535353,툭하면 ‘펑’ 하는데 보상 애매한 전기차…“보험 보상 길 넓혀야”,"툭하면 ‘펑’ 하는데 보상 애매한 전기차…“보험 보상 길 넓혀야”책임소재 불명확해 보상 사각지대“새로운 리스크 대비한 보험 필요”인천 청라 전기차 화재로 지하주차장에 있던 다른 차들 손해를 비롯해 막대한 피해가 발생했지만, 책임 보상 길은 요원한 것으로 나타났다. 전기차는 시스템이 복잡하고, 제조상의 새로운 위험요인이 존재하는 만큼 보험 적용 범위에 대한 논의가 필요하다는 주장이 나온다.10일 업계에 따르면 최근 인천 서구 청라동의 한 아파트 지하주차장에서 전기차가 폭발하며 차량 140대가 불에 탄 데 이어 충남 금산에서도 전기차 화재 사고가 연달아 발생하면서 전기차 사고 보상에 대한 관심이 커지고 있지만, 보상은 쉽지 않은 현실이다.우선 이번 인천 사고에서는 아파트 단지에서 별도로 가입한 화재보험의 경우, 차량 피해는 보상 대상에서 제외된다는 한계점이 있다.피해 차주는 급한대로 자신이 가입한 자차(자기차량손해)보험으로 보상을 청구하고 있다. 명확한 보상이 어려운 건 책임소재가 불명확하다는 이유 때문이다. 폭발한 벤츠 전기차 차주와 전기차 제조사인 벤츠, 배터리 제조사인 ‘파라시스 에너지’의 공방은 여전히 이어지고 있다.일단 불이 난 차량 주인의 과실이 인정될 경우 해당 차주의 보험사에 보상 책임이 있고, 배터리사 과실로 드러날 경우 피해 차주들의 보험사는 해당 사에 구상권을 청구할 전망이다.전기차 관련 배상책임보험 가입을 의무화해야 한다는 목소리도 나오지만 이는 충전소에 국한돼 있어 이번 사고의 해결책이 되기엔 한계점이 있다.제조물 책임법에 따라 제조물배상책임보험을 의무화하는 방안도 거론되지만, 현실적으로는 어려운 상황이다. 현재는 임의배상책임보험으로 의무보험이 아닌데, 이를 위해 모든 생산물에 대해 의무조항을 붙이기엔 한계가 있기 때문이다.한편, 보험연구원에 따르면 오는 2050년까지 전 세계적으로 전기차 보급이 확대될 것으로 예상되는 가운데 내연기관차에서는 고려하지 않았던 배터리 폭발·화재 위험성, 소프트웨어 오류, 사이버 보안 문제 등의 리스크 요인도 부각되고 있다.전기차는 핵심 부품인 배터리의 불안전성으로 내연기관차보다 폭발·화재 위험이 높고 고가의 전자제품 사용으로 인해 사고 발생 시 피해 규모가 큰 편이다. 전기차의 경우 배터리가 차량 하부에 장착돼 있고 노면으로부터 차량 하부까지의 높이가 높지 않아 과속 방지턱, 비포장 도로 등 주행 환경에 따라 배터리에 치명적인 손상이 가해질 수 있다.김유미 보험연구원 선임연구위원은 “보험회사는 기존 자동차보험에서 보장하고 있지 않는 전기차만의 추가적 리스크에 대한 평가가 필요하며, 새로운 리스크에 대한 클레임 처리 능력과 프로세스를 검토할 필요가 있다”고 말했다.https://n.news.naver.com/article/016/0002348021?sid=101",0,https://cafe.naver.com/ca-fe/ArticleRead.nhn?clubid=21771803&page=2&userDisplay=50&inCafeSearch=true&searchBy=0&query=%EB%B2%A4%EC%B8%A0+%ED%99%94%EC%9E%AC&includeAll=&exclude=&include=&exact=&searchdate=2024-08-012024-08-30&media=0&sortBy=date&articleid=1535353&referrerAllArticles=true,톰I서울,401,2024-08-10 18:33:00,
1535351,지금 전기차 사면 바보??? 연말...재고차 어쩌나...,장터나 중고차사이트 보면 아직 크게 다운되지 않지만 급매는 이래도 될까 할정도로 가격이 다운되고 그나마 구매를 하네요.지금 벤츠는 전기차면 학을 띨테고... 기아 현대도 재고차량때문에 올해말까지 날릴테고...지금 중고차 터무니 없이 싼차 아니면 사면 바보되는 것 같고... 저도 새로나온 ev3나 여러가지 봐도 테슬라 중고 가격이 떨어지니 다시 생각하게 되고 당분간 니로 부담없이타고 수출 알아보려고 합니다.회원님들 생각은 어떤가요?하반기 전기차 기업들의 전망을..???,1,https://cafe.naver.com/ca-fe/ArticleRead.nhn?clubid=21771803&page=2&userDisplay=50&inCafeSearch=true&searchBy=0&query=%EB%B2%A4%EC%B8%A0+%ED%99%94%EC%9E%AC&includeAll=&exclude=&include=&exact=&searchdate=2024-08-012024-08-30&media=0&sortBy=date&articleid=1535351&referrerAllArticles=true,레고니로서울,"2,382",2024-08-10 18:28:00,
1535350,"""미국이었으면 45억이 아니라 45억달러 감""…인천 주차장 전기차 화재 보상은 누가?","""미국이었으면 45억이 아니라 45억달러 감""…인천 주차장 전기차 화재 보상은 누가?보험사들 간의 구상권 문제로 넘어갈 듯평소 차주의 차량 관리 여부가 관건인천 아파트 주차장에서 발생한 전기차 화재로 피해를 입은 차량에 대한 배상이 어떻게 이뤄질 것인가에 관심이 쏠리고 있다.앞서 지난 1일 오전 인천 서구 청라동 한 아파트 지하 1층 주차장 내 벤츠 전기차에서 불이 났다. 이 화재로 차량 140여대가 불에 타거나 그을리는 피해를 입었다.이 경우 우선 피해 차량은 각각 가입한 보험사에서 보험금을 지급받는다. 이어 보험사들은 추후 발화 차량 측 보험사 혹은 제조사에 구상권 청구 소송을 제기하게 된다. 자동차보험으로 보상되지 않는 아파트 주민 생활의 손해 등에 대해서도 제조사를 상대로 손해배상 청구를 할 수 있다.민법 제758조는 “공작물의 설치 또는 보존의 하자로 인하여 타인에게 손해를 가한 때에는 공작물점유자가 손해를 배상할 책임이 있다”고 규정하고 있다. 이 때문에 보험사들끼리 법적 다툼이 일어나면 최초 화재가 발생한 메르세데스-벤츠 차주의 차량 관리 여부가 쟁점이 된다.즉, 차주가 차를 제대로 정비했는지, 정상적으로 주차했는지, 용도에 맞게 사용했는지 등이 관건이다. 특별한 하자가 없다면 보험금은 그대로 피해 차량 측 보험사가 부담한다.인천경찰청은 지난 8일 화재가 일어난 벤츠 전기차를 상대로 2차 합동 감식을 실시할 것이라고 밝혔다. 배터리팩이 든 차체 하부를 집중 조사하고, 배터리 관리 장치를 확보해 국과수에 정밀 감정을 의뢰할 예정이다. 제조사인 메르세데스-벤츠 독일 본사와 벤츠코리아도 배터리 담당 전문가 등 6명을 감식 현장에 투입했다.만일 운전자의 차량 관리에 문제가 없다는 것이 증명되면 책임의 주체는 제조사로 넘어가고, 결국 보험사와 제조사 간의 구상권 문제로 종결된다. 소비자의 특별한 과실이 발견되지 않는 한 제조물책임법에 따라 차량 자체 결함을 원인으로 보게 되는 것이다.또한 이번 화재에서는 소방안전관리책임자가 책임 당사자로 등장할 가능성도 있다. 주차장 스프링클러가 제대로 작동하지 않은 것으로 드러났기 때문이다.한편 메르세데스-벤츠 코리아는 최고재무책임자(CFO)인 오노레 츄크노 부사장과 제품·마케팅 및 디지털 비즈니스 부문 총괄인 킬리안 텔렌 부사장 등 임원들은 지난 9일 오후 7시께 인천 청라 아파트 사고 현장을 찾아 피해 주민 대표를 만났다.이들은 이 자리에서 사고에 따른 피해 복구와 주민 생활 정상화를 위해 45억원을 긴급 지원하겠다는 의사를 전했다. 사고 원인이 규명되지 않았지만, 인도적 차원에서의 지원이라는 입장이다.벤츠 측의 이런 결정에 반응은 엇갈리고 있다. 피해자들에게 적절한 성의 표시였다는 의견이 있는가 하면, “미국이었으면 45억원이 아니라 45억달러의 소송에 걸렸을 것”이라는 목소리도 나온다.https://n.news.naver.com/article/277/0005457510?sid=102",0,https://cafe.naver.com/ca-fe/ArticleRead.nhn?clubid=21771803&page=2&userDisplay=50&inCafeSearch=true&searchBy=0&query=%EB%B2%A4%EC%B8%A0+%ED%99%94%EC%9E%AC&includeAll=&exclude=&include=&exact=&searchdate=2024-08-012024-08-30&media=0&sortBy=date&articleid=1535350&referrerAllArticles=true,톰I서울,379,2024-08-10 18:28:00,
1524968,전기차화재 피해 보신 분이 쓴 글입니다,"솔직히 전기차 지하주차장 진입 막아도 할 말 없음.뭔 민폐냐 진짜,,ㅠ",6,https://cafe.naver.com/ca-fe/ArticleRead.nhn?clubid=21771803&page=16&userDisplay=50&inCafeSearch=true&searchBy=0&query=%EB%B2%A4%EC%B8%A0+%ED%99%94%EC%9E%AC&includeAll=&exclude=&include=&exact=&searchdate=2024-08-012024-08-30&media=0&sortBy=date&articleid=1524968&referrerAllArticles=true,KEIDOlEQBl분당,"3,286",2024-08-02 10:30:00,
1524967,근데 벤츠 차주를 까는분들이있네,리콜나왔다고 바로 수리안들어갔다고?물론 뽕빠는분들도 있지만직장인이 게다가 수입차는 대기기간이 길어서 바로 리콜처리도안되는건데그리고 센터에서 언제오라고해도 나의스케쥴도맞춰야하고적어도 차주분은 까지말아야지 왜까는건지,1,https://cafe.naver.com/ca-fe/ArticleRead.nhn?clubid=21771803&page=16&userDisplay=50&inCafeSearch=true&searchBy=0&query=%EB%B2%A4%EC%B8%A0+%ED%99%94%EC%9E%AC&includeAll=&exclude=&include=&exact=&searchdate=2024-08-012024-08-30&media=0&sortBy=date&articleid=1524967&referrerAllArticles=true,아랑I아이오닉5I안양,720,2024-08-02 10:29:00,
1524927,벤츠EQB는 국산 SK베터리 아닌가요?,벤츠 전기차에 대해서 언론에서 계속 중국산 베터리라고 나와서 걱정되네요..,0,https://cafe.naver.com/ca-fe/ArticleRead.nhn?clubid=21771803&page=16&userDisplay=50&inCafeSearch=true&searchBy=0&query=%EB%B2%A4%EC%B8%A0+%ED%99%94%EC%9E%AC&includeAll=&exclude=&include=&exact=&searchdate=2024-08-012024-08-30&media=0&sortBy=date&articleid=1524927&referrerAllArticles=true,서울eqb알랙산더,885,2024-08-02 10:04:00,
1524917,이번 화재난건 조금 찝찝하긴 하네요.,"여태까지 전기차 불 많이 난다고 해봤자어차피 사고나서 충격받았을때 얘기가 대부분이고,충전중에 일어났던 화재같은 경우는 배터리불량 때문에 난 거라서 이제 많이 안정화됬다고 생각하고 있었거든요.그냥 전기차에서 불만나면 언론사에서 유난히 설레발치고,실제 화재비율 같은거보면 가솔린이나 하이브리드가 더나면 더 났지 덜나는것도 아니였고요.근데 충돌테스트 공개하면서 안전하다고 홍보해대던 벤츠에서 뜬금없이 걍 주차장에 주차해논게 갑자기 불나버리니......그나마 다행인건 이번에 불난 베터리가 중국에서 2020년부터 화재위험 크다고 지적받아온 중국산 배터리라고 하니 최근 차량들에서 발생할 문제는 아닐거 같긴 한데요.내 차가 멀쩡해도 다른사람 차량이 아파트 지하주차장 같은데서 갑자기 불나서 화재나고 할거 생각하면 무섭더라고요.....",2,https://cafe.naver.com/ca-fe/ArticleRead.nhn?clubid=21771803&page=16&userDisplay=50&inCafeSearch=true&searchBy=0&query=%EB%B2%A4%EC%B8%A0+%ED%99%94%EC%9E%AC&includeAll=&exclude=&include=&exact=&searchdate=2024-08-012024-08-30&media=0&sortBy=date&articleid=1524917&referrerAllArticles=true,이군IEV3I시흥,680,2024-08-02 10:00:00,
1524898,어제 청라 화재로 차량 72대 전소 등 파손됐다네요.,차량 보험으로는 택도 없을 것 같은데피해보상은 어떻게???,3,https://cafe.naver.com/ca-fe/ArticleRead.nhn?clubid=21771803&page=16&userDisplay=50&inCafeSearch=true&searchBy=0&query=%EB%B2%A4%EC%B8%A0+%ED%99%94%EC%9E%AC&includeAll=&exclude=&include=&exact=&searchdate=2024-08-012024-08-30&media=0&sortBy=date&articleid=1524898&referrerAllArticles=true,제네Iegv70I경기,"2,167",2024-08-02 09:43:00,
1524868,화재로 지하주차장 제한되면 정부가 전기차 판매 중단 시켜야 하는 거 아닌가요?,"만약 전기차 화재 우려로지하주차장 단순주차 까지 제한하면 도대체 전기차를 왜 보급하고 판매하는 건가요?국민의 세금 까지 보조금으로 주면서 까지, 왜 이런 푸대접을 받아야 하는지?자동차 회사는 화재 위험 없게 잘 좀 만들지? 전기차 제가 선택한거긴 해도 여러가지 아쉽네요전 지하주차장 누려보려고 비싼돈주고 입주 했는데 만약 지하주차장 제한하면분양가에 포함된 지하주차장 공사비용, 제 점유공간비용, 그간 공동관리비 부과금 등제 재산권리 다 주장할 생각입니다. 지하주차장 공사비용이 지상에 비해 최소 3배에 달합니다.전기차라는 이유로 권리를 누리지 못한다면 앞으로 누가 전기차를 살거며그리고 만약 전기차 보급율이 20프로만 되어도 이 차들이 다 지상으로 내몰려야 합니까?답답한 마음에 글 올렸습니다. 안좋은 댓글 많이 달릴 것 같은데 그래도 할말 하고 싶었습니다.",1,https://cafe.naver.com/ca-fe/ArticleRead.nhn?clubid=21771803&page=16&userDisplay=50&inCafeSearch=true&searchBy=0&query=%EB%B2%A4%EC%B8%A0+%ED%99%94%EC%9E%AC&includeAll=&exclude=&include=&exact=&searchdate=2024-08-012024-08-30&media=0&sortBy=date&articleid=1524868&referrerAllArticles=true,떡갈나무I오닉5I충북,"2,580",2024-08-02 09:09:00,
1524855,최근 화재 2건 팩트만 정리 + 의문?,1. 기아 ev6상황 : 빗길에 미끄러지면서 몇바퀴 회전 후 좀 높은 연석에 부딪힘cctv 확인 내역 : 범퍼 탈거 및 본넷 부분부터 열폭주 추정 수초내로 불꽃 점화 및 4시간 후 소화결과 : 운전자 사망2. 벤츠 eqe 350+?상황 : 지하주차장 주차중으로 탑승 xcctv 확인 내역 : 검은 연기 하부에 대량 발생 후 약 10초 이상 후 열폭주 추정 불꽃 생성 및 8시간 후 소화결과 : 연기로 인한 피해자 속출 및 지하주차장 화재 진압 어려움으로 8시간 걸림기아ev6 사고 정리벤츠 eqe 350+? 사고- 피해 보상은 누가 하나? 아파트 화재보험 or 피해차량 차주?- 현기라고 까더니 결국 아님- 모든 전기차가 위험- 중국산 CATL NCM 811가 문제- 벤츠 사장 자신하더니- CCTV 확인 가능- 테슬라가 볼보가 폴스타가 닛산 리프가 화재 0건이라 가장 안전하다- 옆에 검은 차에서 불난거 아니냐- 에어컨 실외기에서 불난거 아니냐- 내연기관 화재율이 전기차보다 훨씬 높은거 아니다ev6나 eqe처럼 거의 전체가 다 타버렸는데화재 원인 확인이 가능할까요?미제사건으로 원인 추정 불가로 남을꺼같은데ev6야 인과관계가 명확해보이는데eqe는 사전에 아무것도 없이 갑자기 발화가 나고 ev6에 비해 화재 범위가 영향력이 물리적으로 커서 인과관계가 밝혀질지..,1,https://cafe.naver.com/ca-fe/ArticleRead.nhn?clubid=21771803&page=16&userDisplay=50&inCafeSearch=true&searchBy=0&query=%EB%B2%A4%EC%B8%A0+%ED%99%94%EC%9E%AC&includeAll=&exclude=&include=&exact=&searchdate=2024-08-012024-08-30&media=0&sortBy=date&articleid=1524855&referrerAllArticles=true,비바람lev6l경기,"2,136",2024-08-02 08:56:00,
1524835,"벤츠 eqe 전기차1대 불났는데… 부상 21명, 차량 70여대 피해","벤츠 eqe 전기차1대 불났는데… 부상 21명, 차량 70여대 피해인천 청라 아파트 지하주차장 8시간만에 진화, 200여명 대피https://n.news.naver.com/article/005/0001715157?sid=102아파트 지하주차장에서 전기차 화재로 21명이 인명피해를 입고 8시간여 만에 진화됐다.1일 인천소방본부에 따르면 이날 오전 6시15분쯤 인천시 서구 청라동에 있는 1581세대 아파트 지하 1층 주차장에서 전기차 화재로 추정되는 불이 났다.현장 CCTV 영상에는 주차장에 주차된 흰색 벤츠 전기차에서 연기가 피어오르던 중 폭발과 함께 불길이 치솟는 모습이 담겼다.소방당국은 소방관 177명과 펌프차, 배연차량 등 장비 80대를 투입해 5시간39분 만인 오전 11시54분쯤 큰 불길을 잡았다. 이어 화재 발생으로부터 8시간20분이 지난 오후 2시35분쯤 잔불을 정리하고 완전히 진화했다.이 불로 A씨(49) 등 주민 20명이 연기를 흡입해 병원으로 옮겨져 치료를 받고 있다. 이 중에는 영유아와 어린이 등 10세 이하 주민 7명도 포함됐다. 또 어지러움과 구토 등 온열환자 증상을 보인 소방관 1명도 병원으로 이송됐다. 이들 모두 생명에는 지장이 없는 상태로 알려졌다.화재 직후 검은 연기가 아파트 단지를 뒤덮으면서 주민 103명이 대피하고 106명이 계단과 발코니 등을 통해 구조됐다. 아울러 불이 번지면서 주차장에 있던 차량 70여대가 피해를 본 것으로 추정됐다. 현장 조사 과정에서 피해 차량의 수는 늘어날 가능성이 있다.해당 아파트는 총 14개 동으로 이뤄진 대단지 아파트다. 주차장의 주차 가능 대수는 2270대, 전기차 충전기 수는 116대에 이르는 것으로 파악됐다.경찰과 소방당국은 CCTV 분석 등을 토대로 정확한 화재 원인과 피해 규모 등을 조사할 방침이다https://n.news.naver.com/article/005/0001715157?sid=102",1,https://cafe.naver.com/ca-fe/ArticleRead.nhn?clubid=21771803&page=16&userDisplay=50&inCafeSearch=true&searchBy=0&query=%EB%B2%A4%EC%B8%A0+%ED%99%94%EC%9E%AC&includeAll=&exclude=&include=&exact=&searchdate=2024-08-012024-08-30&media=0&sortBy=date&articleid=1524835&referrerAllArticles=true,톰I서울,"1,441",2024-08-02 08:32:00,
1524810,국내 전기차 누적 60만대 돌파…충전기 보급도 36만대 넘어,"국내 전기차 누적 60만대 돌파…충전기 보급도 36만대 넘어2017년 전기차 등록 대수 2만5108대 보다 24배 성장충전기도 올해 5월까지 누적 기준 36만1163기로 성장전기차 과제 1순위 '안전성'…""결국엔 기술력이 안전성도 해결할 것""국내 전기차 누적 등록 대수가 처음으로 60만대를 돌파했다.1일 한국자동차모빌리티산업협회(KAMA)와 국토교통부, 무공해차 통합누리집에 따르면 올해 상반기까지 국내에 등록된 전기차 누적 대수는 60만6610대로 집계됐다. 첫 집계를 진행한 2017년 전기차 등록 대수는 2만5108대로, 그동안 24배 성장했다.제작사별로 살펴보면 현대차가 39.8%(24만1691대)로 가장 높았고, 기아가 27.4%(16만6274대)로 뒤를 이었다. 테슬라는 13.3%(8만942대), BMW는 3.3%(1만9868대), 메르세데스-벤츠 3.1%(1만8775대), 한국GM 2.6%(1만6030대), 르노코리아 1.7%(1만588대) 순이다.충전기 보급 대수도 꾸준히 늘고 있다. 지난해까지 충전기 누적 보급 기수는 30만5309기로, 올해 5월까지 누적 기준 36만1163기로 집계됐다. 올해 5월까지 충전기 누적 보급 기수는 지난해 5월까지 누적 기수(24만695대)와 비교해 50.1% 증가했다.다만 전기차 확대 과제로 안전성 문제가 1순위로 꼽힌다. 화재에 대한 불안감이 아직 가시지 않아 전기차를 구매하려는 소비자도 주저하는 상황이 이어지고 있어서다.실제 전기차를 구매하는 데 주저하는 이유는 안전성이 1위로 꼽혔다. 작년 한국교통안전공단이 전기차 운전자들을 대상으로 실시한 조사에서 ‘전기차 운용에 있어 가장 걱정스러운 부분’을 묻는 질문에 충돌 후 화재(29.3%)와 충전 중 화재(21.1%)가 약 50%를 차지했다. 최근 화성 1차전지 화재도 불안감을 증폭시켰다.http://www.hansbiz.co.kr/news/articleView.html?idxno=705828",2,https://cafe.naver.com/ca-fe/ArticleRead.nhn?clubid=21771803&page=16&userDisplay=50&inCafeSearch=true&searchBy=0&query=%EB%B2%A4%EC%B8%A0+%ED%99%94%EC%9E%AC&includeAll=&exclude=&include=&exact=&searchdate=2024-08-012024-08-30&media=0&sortBy=date&articleid=1524810&referrerAllArticles=true,톰I서울,198,2024-08-02 08:10:00,
1524798,인천 지하주차장 화재 CATL NCM811 베터리라는 기사,"인천 지하주차장 화재 CATL NCM811 베터리라는 기사입니다. 참고하세요.이 배터리 탑재 모델이 다수 있는 것으로 압니다. 충전 중도 아닌데 화재가 났다고 합니다. 차량은 EQE모델이라 합니다.아래댓글 보시면 EQA, EQB, EQC는 엘지엔솔배터리라 하시네요.https://naver.me/FzSNoW9w",1,https://cafe.naver.com/ca-fe/ArticleRead.nhn?clubid=21771803&page=16&userDisplay=50&inCafeSearch=true&searchBy=0&query=%EB%B2%A4%EC%B8%A0+%ED%99%94%EC%9E%AC&includeAll=&exclude=&include=&exact=&searchdate=2024-08-012024-08-30&media=0&sortBy=date&articleid=1524798&referrerAllArticles=true,다둥이 아빠l서울,"4,292",2024-08-02 07:55:00,
1524755,전기차 타다가 하루아침에 알거지 가능,지하서 주차하다가 터지고 불나면자동차보험대물처리 액수 상한 으로 처리안됩니다결국 개인재산으로 물어줘야함.,1,https://cafe.naver.com/ca-fe/ArticleRead.nhn?clubid=21771803&page=16&userDisplay=50&inCafeSearch=true&searchBy=0&query=%EB%B2%A4%EC%B8%A0+%ED%99%94%EC%9E%AC&includeAll=&exclude=&include=&exact=&searchdate=2024-08-012024-08-30&media=0&sortBy=date&articleid=1524755&referrerAllArticles=true,마이크샌달I강원,"3,151",2024-08-02 05:29:00,
