id,title,content,likes,url,author,views,created_at,updated_at
1527883,멘탈 다잡고 다같이 투명하게 대책을 논의했으면 좋겠어요.,"주변에서 네 차 괜찮냐 카톡 오는데, 아이고~ 맘이 무겁습니다.아직 전기차는 아닌가 보다, 그 말이 제 마음을 찌르네요.이미 사버린 거 어떡합니까. ㅠㅠ 그리고 타고 다니다 보니, 이녀석한테 정도 담뿍 들었단 말이에요.머리로는 전기차만의 문제가 아니다, 스프링클러인지 쿨러인지 그것만 제대로 작동했어도 이렇게 사고가 커지지 않았을 거다 생각은 하는데, 규모가 너무 큰 사고다 보니 좀 두렵기도 해요.이건 뭐 횡액처럼, 내가 피하고 싶다고 피할 수 있는 것도 아니고, 사고나면 개인이 감당할 수 있는 수준이 아니다 싶으니까요.어쨌든 사고는 벌어졌으니, 제조사든 아파트 관리업체든, 소방청이든, 정부든 제대로 조사해서 대책을 마련해 줬으면 좋겠어요.혹시라도 차주가 조심해야 할 것이 있다면 공유도 해주고요.(혹시나 싶어서 저는 평소 충전도 90%까지만 한단 말이에요.ㅠㅠ)다행히 인명피해는 없다고 하니, 돈으로 해결할 수 있는 일은 멘탈 다잡으면서 함께 처리했으면 좋겠습니다.주민들이 들고 일어나서 지하 주차장 들어오지 마라 뭐라 하면서마치 위험분자 보듯이 따갑게 쳐다보는 거 맘이 무겁습니다.제발 선동되지 말고, 사고 처리 끝날 때까지 관심 가지고 지켜봤으면 좋겠습니다.모쪼록 사고 처리 잘 마무리되고, 사고 차주분도 멘탈 다잡고, 피해 보신 아파트 주민분들도 크게 상하지 않고 하루 빨리 집으로 복귀하실 수 있기를 바랍니다.",2,https://cafe.naver.com/ca-fe/ArticleRead.nhn?clubid=21771803&page=11&userDisplay=50&inCafeSearch=true&searchBy=0&query=%EB%B2%A4%EC%B8%A0+%ED%99%94%EC%9E%AC&includeAll=&exclude=&include=&exact=&searchdate=2024-08-012024-08-30&media=0&sortBy=date&articleid=1527883&referrerAllArticles=true,지니주니어lEQAI경기,716,2024-08-04 23:36:00,
1527833,화재의 이유가 궁금합니다..,"전기차들 사고 사례보면 과충전이니 뭐니 하면서 화재가 났는데화재가 나는 기준이 과충전만 있는건가요?제가 잘 못찾은거일수도 있지만 하브에는 화재가 적고?(거의 없는), 순수 전기차에만 일어나는거같아서요..아니면 뭐 전압이 더 강하게 들어갔다던지 열이 갑자기 나서 폭발했다던지...웃기지만 여름이라 뜨거워져서 그런건지...명확히 밝혀진게 있는건가요?",1,https://cafe.naver.com/ca-fe/ArticleRead.nhn?clubid=21771803&page=11&userDisplay=50&inCafeSearch=true&searchBy=0&query=%EB%B2%A4%EC%B8%A0+%ED%99%94%EC%9E%AC&includeAll=&exclude=&include=&exact=&searchdate=2024-08-012024-08-30&media=0&sortBy=date&articleid=1527833&referrerAllArticles=true,후루IEQEI서울,"1,239",2024-08-04 22:37:00,
1527825,청라 cctv. 5초이상 긴 영상없나요?,죄다 똑같이 5초정도 있다가 끊기니 답답하네요cctv만 봐도 뭐 스프링클러 작동한지 안한지 바로 알텐데요.심증은 작동안한것같지만.확실한 증거가 없네요,0,https://cafe.naver.com/ca-fe/ArticleRead.nhn?clubid=21771803&page=11&userDisplay=50&inCafeSearch=true&searchBy=0&query=%EB%B2%A4%EC%B8%A0+%ED%99%94%EC%9E%AC&includeAll=&exclude=&include=&exact=&searchdate=2024-08-012024-08-30&media=0&sortBy=date&articleid=1527825&referrerAllArticles=true,조조I모델3모델yI광주,"1,120",2024-08-04 22:33:00,
1527786,Eqe 화재 뉴스 사진 찾아봄,"먼저 eqe 화재 차주분 힘내시고,정상적인 피해주민분들도 고생이 많으십니다. 이상한 요청하시는분들은 나중에 벌받으실겁니다...!우연히 화재글을 읽다가, 화재 시작 차량 주변의 차량은 멀쩡하고, 오히려 좀 떨어진곳의 차량들이 전소했다는댓글을 봤습니다. 그래서 궁금해서 찾아봤습니다!eqe 화재로 검색하면 나오는 사진은 대부분 동일한 사진(차량 골격만 남은 전소 사진)이고, 위 댓글같은 사진은 못찾았는데 우연히 찾았습니다...! 일단 동영상(cctv)의 차량 화재 시작 사진은 아래와 같습니다.(연합뉴스 사진 캡쳐)화재 시작점(EQE)-모닝-bmw(3?5? 추정) 순서로 주차되어 있습니다.아래는 국민일보 기사 사진 캡쳐입니다.전소(뭔지 모르겠음)-모닝 전소로 보임(추정) - bmw(비교적 멀쩡해 보임)- 기둥뒤에 흰차도 비교적 멀쩡해보임(페인트가 살아있는듯)어느차량들이 줄줄이 전소된건지... 첫사진의 오른쪽은 안보여서 저쪽인가...?ㅜ언론이 보도를 똑바로 해줘야 할거인데...물론 위험은 하지만 너무 공포심만 조장하는게 아닌가 싶네여...이상입니다!+++++저도 전기차 몰고 있고, 벤츠 차주분의 얘기가 남얘기 같지 않아서 사건의 추이를 관심있게 지켜보고 있습니다....그래서 저정도 전소하려면 도대체 얼마나 크게 불이 난건가 궁금도 하고 저럴수가 있는건가 싶어서 사진을 좀더 찾아봤습니다. 그리고 아마... 저는 지하주차장 구조가(저희집 구조 생각하고...ㅂㄷ 역시 사람은 자기 입장에서 생각하게 되나봅니다...) 한쪽씩 양쪽으로 마주보고 있는 구조로 생각했는데(양쪽 차량이 마주보고 그 뒤가 다 벽인 구조), 가만 생각해보니 화재가 시작된 차량(EQE)이 벽쪽이고 뉴스의 사진들은 광장처럼 넓은것 보니, 화재가 앞으로 전이된게 아닌가 싶기도...? 근데 앞으로 번지려면 차량 두대폭은 될 길?을 지나야되는데...? 이게 되나 싶어서 애매하네요??ㄷㄷ어쨋든 그냥 사진만 보고 대충 어느정도의 넓이가 불에 탄 것인가 계산?을 해봤습니다.화재가난 차량이 주차된 라인의 번호가 98번(기둥)이고, 실제 전소된 차량들을 찍은 뉴스의 사진들에서 확인한 기둥의 번호는 109, 111 정도 인데, 102로 추정되는것도 본거같은데(연합뉴스)... 못찾겠네요 사진을 ㅂㄷ일단 아래 출처의 사진으로 추측해보면, 기둥의 번호는 가로로 번호가 메겨진것 같고(사진상 오른쪽부터 세번째 보이는 기둥이 109로 보임), 각 기둥 사이에는 3대의 차량이 주차하는 것 같군여.그럼 사진에 보이는 첫번째 자동차가 전소 시작이여도, 107번 기둥부터 하... 111번 기둥의 차량이 전소인지 반만 탄건지 확실하지 않으니 110번기둥까지의 차량을 전소로 보면, 107-110까지 한줄에 9대가 전소, 한 라인(앞/뒤)로 18대 이렇게 거의 8라인이 정도가 전소해야... 144대네요...ㄷㄷㄷ(지하주차장에 8라인을 주차할 정도의 넓이면 엄청 넓....)98번부터 107번사이의 사진은 못찾았는데, 102로 추정되는 기둥사진을 얼핏 봐서(저장을 했어야했는데 ㅂㄷ...) 102부터 110까지 전소여도, 위와 똑같이 계산해보면 한 라인에(앞/뒤 합쳐서) 48대, 3라인정도 전소해야 144대가 나옵니다...ㄷ(이것도 넓긴 하지만... 위에 비하면 이쪽이 더 가능성 있어 보이네요...ㄷ)기둥 번호 사진 출처:https://www.chosun.com/national/national_general/2024/08/05/VK2LKPJUGNBBVK3VSQM2CXVRI4/결과적으로 지하주차장에서 3라인(추정)정도 전소 한거라면, 진짜 불이 겁나 크게 났고, 전기차에서 시작한 화재가 내연차+다른 전기차로 옮겨붙어가며 불이 커져야 가능하지 않을까 하는데... 전기차 배터리 화재 관련 논문을 봤는데(논문명이랑 저자가 생각이 안나네요...) 내용을 보면 스프링클러가 동작하면 화재 확산 방지에 도움이된다 정도로 기억하는데... 그냥 합리적 의심이 들지만 감식결과 나오고 배상을 어떻게 하게되냐에 따라 전기차 보급에 영향이 있을것 같네요...ㅠ모두 안전운전하시고, 주차해놓으신 것도 안전하게 주차되어 있어 이런사고 다시 일어나지 않길 바랍니다.ps. 사진 출처는 정치색 이런거 아무 연관 없습니다. + 특정차량 비하목적 전혀 없습니다. + 일반적으로 얻게된 정보(뉴스, 카페 등)를 토대로한 정리&의문일 뿐입니다. + 모든 결과는 감식결과가 정확한 팩트인 것이고, 댓글이나 본문에서 나누는 대화는 개인적인 추측, 의견일 뿐입니다.",13,https://cafe.naver.com/ca-fe/ArticleRead.nhn?clubid=21771803&page=11&userDisplay=50&inCafeSearch=true&searchBy=0&query=%EB%B2%A4%EC%B8%A0+%ED%99%94%EC%9E%AC&includeAll=&exclude=&include=&exact=&searchdate=2024-08-012024-08-30&media=0&sortBy=date&articleid=1527786&referrerAllArticles=true,호우우I모델3I경기,"3,606",2024-08-04 21:55:00,
1527778,이번처럼 주차후 불나면 차주가 배상해야된다고하면,진짜 아무도 전기차 안살뜻하네요이번 아파트경우 100억~300억 이야기 나오는데아파트가아닌 대형복합쇼핑몰 ( 타임스퀘어 / 더현대 )같은곳에서 동일하게 화재나면 일단 안전점검전까지 영업못하니 영업손실 상품피해 생각하면 몇천억은 그냥 나올껀데 … 확실한 대책이필요할꺼같네요,2,https://cafe.naver.com/ca-fe/ArticleRead.nhn?clubid=21771803&page=11&userDisplay=50&inCafeSearch=true&searchBy=0&query=%EB%B2%A4%EC%B8%A0+%ED%99%94%EC%9E%AC&includeAll=&exclude=&include=&exact=&searchdate=2024-08-012024-08-30&media=0&sortBy=date&articleid=1527778&referrerAllArticles=true,똥꾸리Ii4I서울,"3,808",2024-08-04 21:41:00,
1527763,이번 벤츠화재 배터리 as기간 남았을텐데ㆍㆍㆍ,그럼 벤츠에서 보상해줘야되는것 아닌가요?,1,https://cafe.naver.com/ca-fe/ArticleRead.nhn?clubid=21771803&page=11&userDisplay=50&inCafeSearch=true&searchBy=0&query=%EB%B2%A4%EC%B8%A0+%ED%99%94%EC%9E%AC&includeAll=&exclude=&include=&exact=&searchdate=2024-08-012024-08-30&media=0&sortBy=date&articleid=1527763&referrerAllArticles=true,이기자I수원,"1,056",2024-08-04 21:32:00,
1527724,배터리화재 보상 문제 차주 잘못이 없더라도 걱정해야겠는데요?,"https://youtu.be/QxI0h3fPp3s?si=TT9AzfU4MhDYA9uq&t=350요약하자면1. 화재에 휩쓸린 피해차주들 각자 자차 처리2. 피해차주들 각 보험사에서 벤츠 차주가 가입한 보험사에 구상권 청구3. 벤츠 차주 보험사에서 대물 한도만큼 보상4. 대물 한도를 넘어서는 부분에 대해서는 벤츠 차주가 우선 보상5. 벤츠 혹은 아파트와 법적 공방6. 대물 한도를 넘어서 보상한 부분 차주가 돌려받기즉, 피해금액이 50억이고 대물 한도가 5억이면 45억은 우선적으로 벤츠 차주가 보상해야되네요. 물론 판결 나고나면 제조사가 최종적으로 보상한다고 쳐도 우선적으로 45억을 보상해야되는 부분에서 인생 끝인데요? 45억을 대출받을 수 있나?",3,https://cafe.naver.com/ca-fe/ArticleRead.nhn?clubid=21771803&page=11&userDisplay=50&inCafeSearch=true&searchBy=0&query=%EB%B2%A4%EC%B8%A0+%ED%99%94%EC%9E%AC&includeAll=&exclude=&include=&exact=&searchdate=2024-08-012024-08-30&media=0&sortBy=date&articleid=1527724&referrerAllArticles=true,폴쉐타I폴스타2I서울,"3,254",2024-08-04 20:34:00,
1527722,"[기사]스프링클러, 아파트 지하주차장 '전기차 화재' 피해 확산 막았다",https://n.news.naver.com/mnews/article/293/0000057037?sid=101,6,https://cafe.naver.com/ca-fe/ArticleRead.nhn?clubid=21771803&page=11&userDisplay=50&inCafeSearch=true&searchBy=0&query=%EB%B2%A4%EC%B8%A0+%ED%99%94%EC%9E%AC&includeAll=&exclude=&include=&exact=&searchdate=2024-08-012024-08-30&media=0&sortBy=date&articleid=1527722&referrerAllArticles=true,이타도리I아5AWDI서울,760,2024-08-04 20:30:00,
1527706,"청라화재 공무원글인데.. 스프링클러가 핵심인가보군요.,",아파트입장에선 주민들이 스프링클러에대한 문제가되면 주민들이 다 손해를 나눠서분담해야하고건설사도 영향받을테니언론에서도 스프링클러는 건들지않는것같은데어떻게해결될지 참 지켜봐야겠네요....모든전기차 유저들이 죄인이되는게 맞는지ㅜㅜ속상하네요ㅜㅜ,13,https://cafe.naver.com/ca-fe/ArticleRead.nhn?clubid=21771803&page=11&userDisplay=50&inCafeSearch=true&searchBy=0&query=%EB%B2%A4%EC%B8%A0+%ED%99%94%EC%9E%AC&includeAll=&exclude=&include=&exact=&searchdate=2024-08-012024-08-30&media=0&sortBy=date&articleid=1527706&referrerAllArticles=true,두공두공Ism3zeI서울,"5,119",2024-08-04 19:57:00,
1527700,전기차 차주 입장으로서 청라apt 벤츠 차주의 신변이 걱정되네요,이번 아파트 화재 사고는 전기차 이용자 누구에게나 일어날 수 있는 일이죠수십억~백억대~ 자산가가 아닌 이상에야 저거 보상 못해줍니다 ㅠㅠ만약 벤츠 차주가 보상하라는 판결이 나온다면 지금 전기차주들 한 순간에 인생이 망할 수 있다는 불안감을 안고 살게되겠죠. 차 하나 잘못 샀다고 전 재산을 잃거나 감옥에 가야하는 상황이라니요 ㅠㅠ 중고 감가도 더 심각해질거고 전기차 판매에도 악영향을 주겠네요. 결과가 어떻게 나올지 궁금합니다.사실 전기차 화재가 내연기관 대비 진압도 어렵고 더 위험한 것은 맞지만 이번 사고는 스프링클러가 동작하지 않아서 화재가 크게 번진 문제이기 때문에 내연차에서 사고가 났어도 결과는 비슷했을 거라고 봅니다. 지금 언론에서는 스프링클러 미작동에 대한 건 아예 다루지 않고 오로지 벤츠 전기차 화재만을 참사의 원인으로 다루고있습니다. 언론이 객관적이지 못하고 전기차 내연가 갈라치기를 유도하고 있는게 안타깝습니다.,2,https://cafe.naver.com/ca-fe/ArticleRead.nhn?clubid=21771803&page=11&userDisplay=50&inCafeSearch=true&searchBy=0&query=%EB%B2%A4%EC%B8%A0+%ED%99%94%EC%9E%AC&includeAll=&exclude=&include=&exact=&searchdate=2024-08-012024-08-30&media=0&sortBy=date&articleid=1527700&referrerAllArticles=true,폴쉐타I폴스타2I서울,"5,463",2024-08-04 19:45:00,
1527691,[가입인사] 가입인사드려요,1. 자기소개 : 40대주부2. 지역 : 인천3. 한글별명의 뜻 : 별의미없어요4 관심있는 전기차 : 벤츠5 보유하고 있는 전기차 (보유/계약 여부) : EQB3006 가입계기 : 전기차화재로뒤적거리다가7 하고 싶으신 말씀 : 많은정보알고싶어요,0,https://cafe.naver.com/ca-fe/ArticleRead.nhn?clubid=21771803&page=11&userDisplay=50&inCafeSearch=true&searchBy=0&query=%EB%B2%A4%EC%B8%A0+%ED%99%94%EC%9E%AC&includeAll=&exclude=&include=&exact=&searchdate=2024-08-012024-08-30&media=0&sortBy=date&articleid=1527691&referrerAllArticles=true,유니epb300,23,2024-08-04 19:26:00,
1527688,뭔가 구린내가 진동하는 청라 풍경채 아파트 주민들 근황,"https://www.clien.net/service/board/park/18777568왜 주민들과 관리사무소측은 스프링클러 작동여부에 대해 쉬쉬하는걸까요?스프링클러가 정상작동했더라면, 이정도까지 피해가 크게 나지 않았을것입니다 (이건 논란의 여지가 없는게, 소방청에서 모의실험을 통해 이미 검증 완료)동파 우려되는 동절기면 몰라도, 그외 계절에는 정상 작동하도록 관리소에서 철저히 점검해야할 의무가 있고, 그 책임은 해당 아파트 주민이 공동으로 지는것이죠 (입대위라는 대표집단을 통해)만약 일부 관리소 책임이라는게 밝혀지면 자신들이 피해보상에서 손해 볼수도 있으니 다들 쉬쉬하는거겠죠.암튼 벤츠 전기차 차주분이 가해자로 둔갑되어 억울한 일 당하지 않기만을 기원합니다...",11,https://cafe.naver.com/ca-fe/ArticleRead.nhn?clubid=21771803&page=11&userDisplay=50&inCafeSearch=true&searchBy=0&query=%EB%B2%A4%EC%B8%A0+%ED%99%94%EC%9E%AC&includeAll=&exclude=&include=&exact=&searchdate=2024-08-012024-08-30&media=0&sortBy=date&articleid=1527688&referrerAllArticles=true,이타도리I아5AWDI서울,"4,884",2024-08-04 19:15:00,
1527687,"난리난 청라 아파트 벤츠 eqe 전기차 화재… 1500도, 다 타버린 증거들","난리난 청라 아파트 벤츠 eqe 전기차 화재… 1500도, 다 타버린 증거들터졌다 하면 큰 피해로 이어지는 전기차 화재가 불안을 높이고 있다. 전기차의 화재 발생률은 내연기관차보다 낮지만 진화가 어려워 피해를 확산시키는 게 문제다. 차량이 모두 타버리면서 원인 규명마저 어렵다. 피해 사실은 선명한데 책임자는 불분명하다. 피해 배상과 사고 복구에 오랜 시간이 걸릴 수밖에 없다.4일 인천소방본부 등에 따르면 지난 1일 인천 청라국제도시의 한 아파트 지하주차장에서 발생한 벤츠 전기차 화재 사고는 약 8시간20분만에야 진화됐다. 102세대 307명의 이재민이 불편한 생활을 하고 있다.아파트 단지 14개 동 가운데 5개동 480세대의 전기가 끊겼다. 정전 복구에는 3~5일 더 걸릴 것으로 예상된다. 이재민 수도 늘어날 전망이다. 인명피해는 없었지만 재산피해가 상당할 것으로 관측된다.전기차 화재 사고는 최근 몇 년 새 급증했다. 소방청에 따르면 지난해 기준 72건의 전기차 화재 사고가 발생했다. 화재발생률은 0.013%로 내연기관차(0.016%)와 비슷한 수준이다. 전기차 보급이 증가하면서 화재도 덩달아 많아진 것으로 풀이된다. 완성차업계는 “화재 발생률이 낮다”는 점을 내세우지만 피해가 진화가 어려워 피해를 키우는 게 문제로 지적된다.전기차의 대형 화재는 대개 배터리에서 발생한다. 전기차 배터리팩에는 수백개 이상의 배터리셀이 들어가는데, 그 중 하나의 배터리에 불이나면 연쇄적으로 옮겨 붙으며 열폭주를 일으킨다. 1000도 안팎으로 빠르게 치솟는다.전기차 배터리는 차체 내부에 매립돼 있어서 보통의 화재처럼 외부에서 물을 공급하는 것으로는 진화 효과가 미미하다는 것도 문제다. 소방청에 따르면 화재가 난 배터리에 직접 물을 공급하는 게 연쇄 폭발을 막는 데 가장 효과적이다. ‘조립식 수조’를 도입한 이유다.하지만 이번 화재 사고에서는 조립식 수조를 활용하지 못했다. 지하주차장에 소방 장비가 진입하지 못하면서다. 지하주차장에서 화재 발생 시 대응하기 어려운 것도 피해를 키운다. 진화도 쉽지 않은데 화재 진압까지 과정도 복잡하다.이번 벤츠 화재 사고와 마찬가지로 사실상 전부 탄 뒤에야 꺼지는 경우가 적잖다. 전소되기 때문에 화재 원인을 명확하게 규명하기도 쉽지 않다. 원인 규명이 불명확하면 책임소재를 선명하게 가르기 어려워지는 게 문제다.완성차 업체인 벤츠와 화재를 일으킨 차량에 배터리셀을 공급한 제조사 간 책임공방을 벌일 가능성도 있다. 2019년 이후 잇달아 발생한 현대자동차 코나 EV 화재 사고에 대해 국토교통부가 ‘배터리 셀 불량’으로 잠정 결론을 내리면서 약 1조1000억원의 리콜 비용이 발생했다.이에 대해 현대차와 배터리셀 제조사인 LG에너지솔루션은 소송전을 벌이기도 했다. 하지만 2021년 현대차 4255억원, LG엔솔 약 7000억원으로 분담을 합의한 뒤 리콜 비용을 해소한 전례가 있다.일각에서는 배터리 안전성을 충분히 담보하지 않은 상황에서 전기차 보급에 급급했던 것 아니냐는 지적도 나온다. 배터리업계와 완성차업계는 전기차 화재가 곳곳에서 문제되면서 화재 예방과 대응을 위한 기술 개발에 나섰다. 화재 발생 시 배터리 내부를 냉각해 소화하는 장치, 고체전해질 배터리, 난연성 전해질, 배터리 관리 시스템(BMS) 고도화 등이 추진 중이다.이번 사고 차량은 벤츠 EQE 350모델로 알려졌고, 탑재된 배터리셀의 제조사는 아직 공개되지 않았다. 글로벌 1위 배터리업체인 중국 CALT라는 추측이 나오고 있으나 확인되지 않았다. 국토교통부에 따르면 벤츠 EQE 차량에 대해 지난해 12월, 지난달 총 두 차례 고전압 BMS 리콜 통지문을 보냈다. 화재 차량의 리콜 여부 또한 확인되지 않았다.벤츠코리아는 “아파트와 피해 지역 주민 등에게 깊은 유감을 표한다”며 “매우 심각하게 받아들이며 당국에 협조해 차량을 철저히 조사하고 근본 원인을 파악할 수 있도록 최선을 다할 것”이라는 공식 입장을 내놨다.https://n.news.naver.com/article/005/0001715543?sid=102",2,https://cafe.naver.com/ca-fe/ArticleRead.nhn?clubid=21771803&page=11&userDisplay=50&inCafeSearch=true&searchBy=0&query=%EB%B2%A4%EC%B8%A0+%ED%99%94%EC%9E%AC&includeAll=&exclude=&include=&exact=&searchdate=2024-08-012024-08-30&media=0&sortBy=date&articleid=1527687&referrerAllArticles=true,톰I서울,"4,335",2024-08-04 19:15:00,
1527673,저도 글 한번 올려봅니다 (a.k.a 전기차화재),"20년도 부터 전기차 운용중입니다기존 소렌토 hev 타다 전기차 타면서 탈도 많고 말도 많았지만 이번 화재로 뭔가 주변 생활 곳곳에서 안좋은 시선 , 주차 제약등 다소 인지도가 그리 녹녹치 않습니다 . 그럼에도 불구하고, 전기차 산업은 계속 발전하고 있습니다. 언젠간 내연기관이 없어질 날이 오겠지만 ? 물론 100년 정도는 내연 몰아도 문제는없을거 같지만 , 시시각각 변화에 따른 전기차 문화와 안전도 거듭 날 것 같습니다. 지금 문제는 품질 불량을 외면 하는 제조사도 있을수 있지만 정말 원인이 몰라 그럴수 있다는 개인적인 생각 입니다. 제조 생산 업에 있는 종사자로 부품 qc 및 제조 과정들에서 뭔가 조금이나마 디펙트가 잡혔지만 스팩에 간당간당하게 생산된 제품도 양산품으로 정상 출고 하고 있습니다. 그렇다 하여, 완전 문제 있는 부품들은 출고 하지는 않고 테스트를 거듭하고 문제가 없다 판단하여 양품에 나오지만 결함이 발생한 거지요. 저도 불안한 입장은 맞습니다. 하지만 다음차도 전기차의 편의성과 경제성은 옳다고 보여져 다시 선택 할거 같습니다. 단, 어느 특정 차량만 보고 있지는 않고 여러 회사의 차량으로 확대하여 고를거 같습니다이참에 선택지가 많아진 것이죠... 저도 추후 lfp 차량도 점차 발전되어 나은 모습을 보여질 것으로 보고 lfp로 구매해 보려고 노력중이에요~ 가성비가 좋잖아요~ 반박 폭언 폭설 하시는 분도 있겠지만 현 시점에서는 전기차가 문제 횟수가 늘어나니 모든 관점에서 겸허히 받아 들이겠습니다 ㅠ",0,https://cafe.naver.com/ca-fe/ArticleRead.nhn?clubid=21771803&page=11&userDisplay=50&inCafeSearch=true&searchBy=0&query=%EB%B2%A4%EC%B8%A0+%ED%99%94%EC%9E%AC&includeAll=&exclude=&include=&exact=&searchdate=2024-08-012024-08-30&media=0&sortBy=date&articleid=1527673&referrerAllArticles=true,아우무IIX3I경기,773,2024-08-04 18:59:00,
1527662,청라 아파트 붕괴 위험 있지 않나요??,1500도 6시간이면......,0,https://cafe.naver.com/ca-fe/ArticleRead.nhn?clubid=21771803&page=11&userDisplay=50&inCafeSearch=true&searchBy=0&query=%EB%B2%A4%EC%B8%A0+%ED%99%94%EC%9E%AC&includeAll=&exclude=&include=&exact=&searchdate=2024-08-012024-08-30&media=0&sortBy=date&articleid=1527662&referrerAllArticles=true,기루미12,"1,303",2024-08-04 18:44:00,
