post_id,cmt_content,cmt_author,cmt_created_at
1232301,무상점건으로 퉁치려는 것 같아서 기분나쁘네요..저거 한다구 ICCU 결함 안생긴다는 보장도 없고 ㅠ,방이IEV6I춘천,2023-07-05 19:49:00
1232301,ㅋㅋㅋㅋㅋㅋ 타는 사람은 목숨걸어야하는데 아 ㅈㅅ 일단 꽁짜로 점검해줄게요 ㅋㅋㅋㅋㅋㅋㅋㅋㅋㅋㅋㅋㅋㅋ,새빛l코나l경기,2023-07-05 23:39:00
1232157,iccu로 검색해보시면 여러 케이스가 나올거에요.,휘상 I gv60 I 경기,2023-07-05 15:19:00
1232157,몇분있을검니다 그전에 증상 없는데 교체한 1인입니다. ㅎㅎ 진단기상에 충전에러 있다고,유강호I아5I일산,2023-07-05 15:26:00
1232157,??? 저도 진단기상에 충전에러 있어서 지금은 삭제하고 타고있는데... 다시뜨진않고있거든요.. 교체해야했었나싶네요 ㅠ,코볼트I경남,2023-07-06 06:54:00
1232157,전 테일힌지 소음 2차입고시 아무증상 없었는데 충전단자까지 다 바뀌주던데요 하이테크 가야합니다 그래서 8월중 공식 리콜 한다고 하닝 기달려 보세요,유강호I아5I일산,2023-07-06 16:39:00
1232157,생각보다 많아요! iccu 교체 등으로 키워드 검색하면 나와요,ev6바라기Iev6I경기,2023-07-05 16:02:00
1231910,중국전용 모델인줄 알았는데 국내도 나오나보네요,김멜론I모YI서울,2023-07-05 09:06:00
1231910,완속을 주로하기에.. 400V 82kwh >> 800V 77.4kwh,델마IEV6 모3l부천,2023-07-05 09:10:00
1231910,아5랑 겹치는데? 같은크기인가요?,달달한쇳물ll서산,2023-07-05 09:14:00
1231910,ev6(아이오닉5)가 준중형인데.. 기사가 잘못된것같아요. 아마 니로ev단종시키고 나오지 않을까요??,둥둥이ㅣ서울,2023-07-05 09:30:00
1231910,ev5 스포티지급 사이즈입니다,수원ll니로ll도르르,2023-07-05 20:20:00
1231910,아5가 기존 비율이랑 달라서비교가 애매하긴한데 ev5가 기존 내연차만큼 트렁크 뽑아주면 좋겠네요 아5는 쓸데없이 실내공간만 늘린차 물론 베터리때문이겠지만 그럴꺼믄 트렁크좀 크게 하던가 그건 쥐꼬리만함 ㅠㅠ,달달한쇳물ll서산,2023-07-05 22:26:00
1231910,휠베이스는 아5가 길꺼같구요 적재공간은 ev5가 클겁니다,수원ll니로ll도르르,2023-07-05 23:10:00
1231910,현기가 대응참 빠르네요. 800볼트 휙버리고 바로 400으로 가네요. 칭찬해줄만 합니다.,소래포구n서울,2023-07-05 09:35:00
1231910,코나 정도 사이즈 되려나요?,말랑I아이오닉6I경북,2023-07-05 09:52:00
1231910,스포티지급이라고 합니다,수원ll니로ll도르르,2023-07-05 10:26:00
1231910,코나보다 더작습니다.,경기l예정l무쏘뿔,2023-07-05 17:10:00
1231910,무슨말씀이신지? 코나 전장 4355 ev5 4600 입니다 셀토스 4390다 크고 4660 스포티지보다 약간 작지만 전기차 휠베이스가 넓기에 스포티지급 전기차라고 이야기하고 있습니다 코나보다 작다니요?,수원ll니로ll도르르,2023-07-06 22:08:00
1231910,제가알기론 롱하고 숏 나눠지는걸로알고있습니다 그리고 실내 실제로보시면 스포티지급아닌거같습니다.,경기l예정l무쏘뿔,2023-07-23 00:47:00
1231910,"400v면 e-gmp 기반이 아니라는 걸까요? 아니면 e-gmp에 코나/니로의 iccu를 붙인건가. 암튼 400v면 충전 속도가 느려질텐데, 가격 때문에 성능을 희생하게 되네요.",덴짱IEV6I성남,2023-07-05 10:05:00
1231910,플랫폼과는 딱히 상관없는 문제입니다. egv70이나 egv80도 내연기관 플랫폼이지만 800V 시스템이죠. 현대에선 800v가 더 고급 사양이라 원가를 낮춰서 대중성을 확보하기 위해 400v로 가는게 아닐까싶네요. 게다가 LFP 배터리에 800V 테스트도 충분하지 않을거구요. 제가 듣기론 ev5도 egmp입니다,폴쉐타I폴스타2I서울,2023-07-05 10:09:00
1231910,이미 저는 예상대로 중국 LFP 국내 NCM 이군요,수원ll니로ll도르르,2023-07-05 10:07:00
1231910,올해 보조금충족 가격이나 올해 나오는건가요?,안나l아이오닉l경주,2023-07-05 10:12:00
1231910,국내에 lfp 배터리를 장착하지 않은 이유는 겨울철 주행거리때문인가???,거북l아이오닉5l시흥,2023-07-05 10:17:00
1231910,히터펌프 장착하고 열관리 잘 하면 큰 차이 없습니다 https://cafe.naver.com/allfm01/1231579?tc=shared_link,타슈I모델3I대전,2023-07-05 11:16:00
1231910,400이면 v2l이런기능도 안들어가려나요? ICCU문제도 없으려나그럼...,정정IM3I전북,2023-07-05 10:26:00
1231910,니로 코나에도 v2l 다 들어갑니다 초고속충전은 안되고 급속충전속도는 80-90 정도 나오겠지만 iccu문제는 지켜봐야될꺼 같습니다(니로 코나보면 없을듯하구요),수원ll니로ll도르르,2023-07-06 22:14:00
1231910,중국에서 최대한 가격 낮춰서 판매할려나보군요,타슈I모델3I대전,2023-07-05 10:29:00
1231910,중국 겨냥은 가격을 아무리 낮춰도 경쟁력이 없늘듯 합니다. 국내도 이 차가 나올 때즘 되면 다양한 중저가 전기차가 많아져 선택지가 좀 넓어질듯 합니다. 전기차 가격이 전반적으로 너무 높다는 생각입니다. 베터리 가격으로 언플하지만 실재 베터리 가격은 이전보다 많이 내렸죠. 전기차 판매수익이 낮다는 현기차 논리는 와닿지가 않네요..,아이콘IEV6I부산,2023-07-05 10:59:00
1231910,400v 라고 충전이 막 느리진 않아요. 문제는 국내 충전기가 200kw라도 전부 1000v 200a라...,토르1l폴스타l구미,2023-07-05 12:11:00
1231910,오보,프로포토l오닉l서울,2023-07-05 14:37:00
1231910,"EV5는 EV6의 다운사이징 SUV 버전으로 보면 되겠네요. 이러면 EV6, 니로가 애매해지겠네요.",노웨이브ㅣ경기,2023-07-05 17:26:00
1231910,사람마다 다르겠지만 전기차 운영해보니 맨날 부산 당일치기 가는것도 아니고.. 여정중 급속 급하게 할일이 별로 없다보니 800v 아쉽지가 않네요.. 어차피 보통 잘때 완속충전 한번하면 일주일동안 500km 정도 충분히 쓰는데 말이죠 급속은 그냥 쉴때 보이면 잠깐씩 보험용으로 하는데.. 너무 많이 충전되도 요금이 아까워요 ㅋㅋ.. 오히려 내연차 유저분들이 주유소랑 비교해서 충전속도/시간을 많이 언급하시는듯 ㅎㅎ 차라리 안정적인 시스템이 더 낫습니다 디자인도 작아지니까 더 알차보이고 좋네요,전타Iix3I경기,2023-07-05 23:51:00
1231910,휠베이스 2800만 나와도 아이오닉6 팔고 갈아타고싶네요,코코I포터오닉6I부산,2023-07-06 07:38:00
1231910,전장 4660인 스포티지가 축거 2755인데 ev5 전장은 4600이라고하네요 전기차특성상 휠베이스가 잘나올듯하니 스포티지 비슷한 2755 정도 나오지않을까요?ㅎㅎ,수원ll니로ll도르르,2023-07-06 22:20:00
1231910,뻥태기tv 보니 2750이라네요ㅎㅎ,수원ll니로ll도르르,2023-07-06 22:21:00
1231910,5700 ㅠㅠ,첵스lSG2니로l울릉,2023-07-08 01:00:00
1231781,좋은정보 감사합니다,키키민 아이오닉6,2023-07-04 22:22:00
1231781,제가 올렸던 글에... 외국에서 업데이트 관련이라고 댓글 있었는데.....그게 그게 아니었군요....,은행I아5I제주,2023-07-04 22:24:00
1231781,현토부라 기대도 안합니다. 무조건 🔥 매가 답인데,바다l아이오닉5I경북,2023-07-04 22:32:00
1231781,222현기출신들이 조사해봐야 ㅜ,미제I이트론아6I원주,2023-07-05 06:34:00
1231781,신차 시청중인데..,핸썸한I청주,2023-07-04 22:41:00
1231781,역시...자동차는 역사를 무시못하네요전기차 시대라고 다들 수평적인 조건에서 출발하는 듯이 말하지만벤츠에선 저런 기본적인 문제가 안터지는걸 봐선..140년이라는 세월데이터값은 무시 못하는 것 같습니다,명탐정l코나I경기,2023-07-04 22:41:00
1231781,ㅋㅋ ㅋ 전기차는 현기 못따라옵니다 알고말씀 하시는건지 왜 유럽에서 내연기관퇴출 연기했는지 알아보심 답 있어요,항해사l전북,2023-07-05 10:12:00
1231781,유럽에서 퇴출한거랑 벤츠가 전기차에서 문제가 안나는거랑 무슨 상관관계가 있는거죠?저는 벤츠가 차를 만든 역사가 많은 만큼 전기차에서도 가장 기본적인 부분에서 문제가 안난다는 것을 언급한건데주행중에 시동꺼지는 저런 증상이 정상이라고 보시나요? 거기다 저런 증상이 나는데 현기가 짱이라고요?저런 기본적인 문제마저 제대로 만들지 못하는데ㅋ일단 현기가 해결하고 오면 다시 생각을 해보더라도 님의 댓글로는 절대 동의못할듯하네요 ㅋ무지성 찬양만큼 본인의 수준을 낮추는 지름길은 없슴다.,명탐정l코나I경기,2023-07-05 14:38:00
1231781,내연기관하고 전기차하고 같다고 생각하시나요?? 제가 뮐 찬양했다고 찬양이라뇨?? 가격은 비싸고 배터리크긴 더크고도 전비 안나오고 판매량 부진하니 유럽서 그러고 있다고 설명한건데 무슨 찬양??,항해사l전북,2023-07-05 14:40:00
1231781,구조적으로는 같지 않죠 근데 차량을 만들던 기본기는 변함없지않나요?ㅋㅋㅋㅋ전기차는 완전 무슨 신세대 문명에서 발굴해온 기술입니까?ㅋㅋㅋㅋ기본적으로 내연기관을 잘 만들던 브랜드가 전기차도 잘 만든다고 말씀드린건데님이 먼저 무슨 유럽이 내연기관 퇴출을 늦췄다느니 상황에 맞지도 않는 소릴 해대셔서 말씀드린거에요ㅋㅋ논점은 벤츠 전기차에선 저런 기본적인 문제도 안나는데 똑같이 내연기관 만들던 현기는 왜 저런 문제가 나는가에 대해 제 생각은 역시 내연기관 만들던 기본기에서부터 차이가 나는건 전기차에서도 똑같다는 것을 의미하는건데뜬금포 전기차는 현기만한 차가 없다느니 유럽 내연기관 퇴출을 늦춘 이유가 있다느니 헛소리로 응수하시는 님이 이상하다는거라고요이해못하시면 걍 아 내가 이해력이 딸리는구나 생각하시면되지 뭔 자꾸 대꾸를 하세요,명탐정l코나I경기,2023-07-05 14:57:00
1231781,140년 데이타값은 내연기관에서만 유용한거지 전기차에서는 크게 의미없습니다 특히 배터리와 동력관련 및 제어기술에서는 모두들 어리버리하고 있는게 맞습니다 그게 맞다면 지금 전기차시장에서 테슬라 압살하고도 남았어야죠…,엠빠ㅣmodel sㅣ대구,2023-07-08 09:58:00
1231781,140년 역사가 내연기관에만 국한된다하면...품질은 왜 테슬라보다 좋을까요?,명탐정l코나I경기,2023-07-08 10:24:00
1231781,그건 내장재 조립품질 하체 프레임 정도로 앞선다고보지 전기차에 도입된 새로운 시스템들과 자율주행부분들이 벤츠가 과연잘하고 있을까요? 소프트웨어는 한참 떨어지고있고요. 반자율도 외주업체에 의존하고있고요…,엠빠ㅣmodel sㅣ대구,2023-07-08 15:19:00
1231781,"내장재가 싼마이에 단차부터 심각하지만 강제 인수 하게 만드는 테슬라가 소프트웨어 빼면 뭐가 나을까요? 회생제동도 사실상 조절 불가이고 오로지 소프트웨어로만 해결하려는 테슬라가 소프트웨어를 빼면 나은게 뭔지...거기다 테슬라모델s 초기모델은 벤츠 부품까지 가져다 쓰지않았나요?과거 하드웨어 부분까지 벤츠껄 가져다 쓴 브랜드가 테슬라인데 그래도 벤츠보다 테슬라가 우위에 있다고 보시는지...어떤 한 부분에서는 서로 장단점이 있고 특화된 부분이 있다고 합니다만..한가지 말씀드리고 싶은건 벤츠는 전기차 역사가...많은 분들 그리고 공부 지지리도 않하고 씨부리는 유튜버들이 최근이라거 씨부려대서 그런거지.실제로는 1900년대부터 전기차 관련 기술 개발을 해왔던거 아시죠? 과거 GM도 당시에 혁신적인 전기차 EV-1을 만들었고 인기도 좋았는데 기름국에서 압박해서 결국 단종됐죠.그럼 글로벌 전기차는 GM이 최고봉이여야하지않을까요?140년 내연기관 만들던 데이터는 전기차를 개발하는데 1도 반영되지않거나, 무쓸모인 기술력이 아닙니다.테슬라의 원통형 배터리 4680은 원통형이라 효율도 각형이나 셀형 대비 딱히 좋지않고 가격이 저렴하여 일반적으로 사용하고 있는데, 그럼에도 차값은 억단위고내장재 품질을 현대기아보다 못한데 그걸 소프트웨어 하나로 퉁쳐버릴라고 하는게 너무 아이러니 한 상황이지 않을까요?자율주행 기술력은 여전히 논란거리이고 특히 라이다를 쓰는 타 브랜드(현기, 벤츠, GM) 대비 테슬라는 카메라의 의존도가 높은데 무조건 앞서있고 좋다고 하기엔 저는 자율주행 부분에선 어떤 브랜드던 아직 시기상조라고 생각합니다.그거 빼면 테슬라는 어떤걸 더 강조할 수 있는지 말씀해주실수있나요?비난하려는게 아니라 소프트파워가 강세인 차량이란 것은 알겠는데 그것 외에 제가 모르는게 있다면 알려주세요참고하겠습니다.",명탐정l코나I경기,2023-07-09 10:16:00
1231781,중국산 충전기 탓이래!!! 너네 홍보팀 유튜버가!!!!,수녕군IMYI서울,2023-07-04 23:02:00
1231781,빨리 해결되었으면 좋겠습니다,아이뻐라lEV6l대구,2023-07-04 23:17:00
1231781,우주최강 현기차가 이럴리가 없습니다. 중국때문입니다. ㅇㅌㄱㅇ,맥스키므I모델3I중국,2023-07-05 01:37:00
1231781,그럼 안돼는데 오토카죠.... 저는 현기보다 중국이 더 나은것 같은데요.,금연I니로EVI하남,2023-07-05 07:00:00
1231781,빨리 리콜 하게 만들어라 !! 나도좀 받게 리콜!! 크응 크응,쭈니lev6l서울,2023-07-05 05:04:00
1231781,"차주분들 마음고생, 스트레스 심하겠네요...빨리 해결되길..",내꿈실현,2023-07-05 08:06:00
1231781,"어짜피 짬짜미여서,,, 노력하는척하고 이상무~~ㅎㅎ",잔디ㅣ530e l 경기,2023-07-05 08:14:00
1231781,직접 만든 현기도 못찾는거 같은데 국토부가??,거북l아이오닉5l시흥,2023-07-05 10:32:00
1231547,먼가 무상 점검이라기 보단 먼가 조사하는 듯 한 느낌이..,서울I피카,2023-07-04 16:43:00
1231547,"무상점검이 아니라 리콜을 해야지... 무상수리,점검은 귀찮거나 당장 별 이상없겠지? 싶은 사람들은 잘 찾아가지도 않는데.. 하물며 1월1일 이후에는 유상점검을 할건가...",아련다솜I모델3l경북,2023-07-04 16:45:00
1231547,리콜이 당연한건데...국토부 진짜 ㅠㅠ,잠실l아이오닉7,2023-07-04 16:50:00
1231547,어디가 결함인지 뻔하고 주행중에 멈출수도 있는데 지금 당장 고장아니면 안고쳐주겠다는건가...아님 개선판으로도 해결이 불가능하니 일단 해결방안이 생길때까지 시간을 끌어보는건지...차주는 아니지만 와......,라이언Iix3I경북,2023-07-04 16:54:00
1231547,"무상점검후 발견된 결함에 대해서만 수리해 주겠다는건데 리콜에비해 비용이 많이 절감됩니다. 고지의무도 없구요 들어올 사람만 들어오라는거죠 국토부=현대,기아",아이니lix3l원주,2023-07-04 17:18:00
1231547,아오 ㅡㅡ 또 가야하네 거주지 하이테크는 예약 아예 막혀있던데,할배온l볼트아5l경기,2023-07-04 17:25:00
1231547,미국도 무상으로 퉁치나요?,크리스l모SYl경기,2023-07-04 17:39:00
1231547,그냥 점검하는걸 동력상실난거 때매 하는거처럼 제목 뽑아놨네 ㅋㅋ,바람물질Iev6I창원,2023-07-04 18:09:00
1231547,결함 발생하신 차주분들이 리콜 센터에 신고해주셔야 이게 누적되면 국토부에서 조사들어가고 리콜 명령 내립니다. 수리 받으셨더라도 신고해주시는게 좋죠 https://www.car.go.kr/ds/dfct/gdnc.do,아르마I볼트I인천,2023-07-04 18:38:00
1231504,그냥 구매하시죵 ㅎㅎ 뽑기만 잘하면되죠뭐,겨울아빠I안양,2023-07-04 15:33:00
1231504,일단 지르시고 현기 특유에 초기 불량에 잘 견디시면 되죠 그냥 서비스 센터 잘 다닐 마음가짐만 가지시면 뭐…근데 전기차 수리 대기 시간도 엄청 오래 걸린다던데요,아브라카leqal평택,2023-07-04 15:33:00
1231504,전 어제 시승했는데 도저히 그돈주고 못사겠네요ㅜㅜ,빈즈파덜I모3아5I대구,2023-07-04 15:33:00
1231504,iccu는 개선품 있지 않을가요?.,크리스l모SYl경기,2023-07-04 15:35:00
1231504,펠리세이드 사고5천 기름넣어도됩니다?,촙IEv6I광주,2023-07-04 15:37:00
1231504,EV9 살려고 할 정도면 돈은 여유가 있는거 같은데 그냥 사시면 될거 같아요.어차피 가성비 생각하고 사려는거 아니잖아요,강남실장I니로I오산,2023-07-04 15:39:00
1231504,창문: 그렇게 열일 사실 별로 없고손잡이 잠금장치: 뽑기 잘되길..앞범퍼: PPF로 안되려나요?ICCU: 역시 뽑기...,어쩌l아이오닉6l수원,2023-07-04 15:42:00
1231504,"닉네임 변경 후 글 작성해 주세요.""별명I보유전기차I지역"" 결합으로 구분은 영문대문자 아이(I)입니다.",전기l니로EVl부산,2023-07-04 15:43:00
1231504,창문 흔들리는건 다 똑같지 않나요? 창문열면 다열거나...방귀빼면 머..그닥 열지를 않는거 같은데..다른건 뽑기를 .....전 1번 망패했으니..이번턴에는 합격할듯~,대참사IEV9I경기,2023-07-04 15:52:00
1231504,흔들림이 유독 많은게 문제,스크IMYI부산,2023-07-04 16:41:00
1231504,"어,....트림띠어서...보강좀 해줘야겠네요....다그렇다면 머...지금차처럼....",대참사IEV9I경기,2023-07-04 16:42:00
1231504,대안이 없는 모델이잖아요.,하루l꼬나l평택,2023-07-04 15:57:00
1231504,참 희한한게 아이오닉6에서는 iccu 문제가 전혀 없지 않았나요?그래서 개선된 줄 알았는데 ev9에서 발생하다니;;,무크박스I충남,2023-07-04 16:06:00
1231504,보통 2년 이후 문제가 된다고 합니다.,김ㅣ아5ㅣ전남,2023-07-04 16:27:00
1231504,아이오닉6 에서도 ICCU 이슈가 있습니다.,터킬l코나l서울,2023-07-04 17:24:00
1231504,"미국에서 대규모 소송준비중이라네요 아이오닉5, 아이오닉6, EV6 ICCU모델 전부",너궁띠I볼보C40I서울,2023-07-04 19:00:00
1231504,사고싶은차를 사시면됩니다~ 부럽네요,스크IMYI부산,2023-07-04 16:41:00
1231504,국산차는 항상 거치는 뽑기 운이죠,서울I피카,2023-07-04 16:48:00
1231504,운전석 창문 흔들림. 결함=>제조사에서 현재 개선대응중손잡이 잠금장치 결함=>현재 두건정도 본것 같은데 전체 문제가능성은 없는듯앞 범퍼 내구성 결함=>ev9카페 3군데 가입되어 매일정독하는데 처음 듣는 말이네요..ㅋㅋICCU 결함=>이건 인정되는바 절대적 뽑기운임..ㅋ본인이 맘에 들면 사면 된다고 보여집니다.,블랙베레l천안,2023-07-04 19:54:00
1231504,가족의 안전을 운에 맡기는건 아닌것 같습니다,ev차주IY롱I수원,2023-07-04 20:30:00
1231504,많은 의견 정말 감사드림니다.,이브이꼬리Iev9I서울,2023-07-05 10:56:00
1231504,결함의 의미를 모르는 사람이 많네요. 그러려니 합니다 ㅎㅎ,드라이브갈까II경남,2023-07-05 11:41:00
1231504,전 시승해보고 포기했습니다 가성비야 대형 전기차로만 따지면 수입차 대비 충만하겠죠 ㅎㅎ 좋은 선택하시길~,갈배I구매예정I서울,2023-07-05 13:01:00
1231300,맘에 드는걸로 하세요,귀연 lev6l 부천,2023-07-04 10:30:00
1231300,폭바 갈바에 기아죠. as 등 고려하면,이편한l코나오5l대구,2023-07-04 10:31:00
1231300,폭바 AS가 별로인가요? 혹시 경험 있으실까요?,파브레가스I쏘울I서울,2023-07-04 10:32:00
1231300,기아 갈바에 폭바죠 안전성 등 고려하면,일월I세종,2023-07-04 12:54:00
1231300,저는 폭바랑 기아랑 안전성 얼마나 파이 있을지 좀 의문이라서요,이편한l코나오5l대구,2023-07-04 13:09:00
1231300,글쎄요.. 기아도 반도체 대란때 차량맡기면 몇주씩 걸렸던거 생각하면.. 마냥 빠르고 좋다 라기에는... 좀 의문이라서요 짜잘한 결함으로 자주 센터방문하는것도 as가 좋다라고하기에는 좀 의문이라서요...,일월I세종,2023-07-04 14:01:00
1231300,4요,부천A강호굥,2023-07-04 10:32:00
1231300,이번에 출고해서 집사람 타고 있습니다.원래는 작년 7월에 예약해서 가성비 조건으로 구매하려 했는데 어찌하다보니작년보다 육칠백 더 주고 구매해서 호구 된건가하는 생각도 했는데요....기대 이상으로 괜찮은거 같습니다. 물론 주행퍼포먼스 그닥이고...원격제어도 안되고...통풍없고..네비없고 뭐 그렇지만 다른부분에 있어서는 괜찮은거 같습니다.안락한 주행...넓은 실내 및 트렁크...뭐...괜찮은거 같습니다. ^^다만...이거 저거 다 따지다보면 현대 기아 차량이 좋습니다. ㅠㅠ,그림통I모델3I대전,2023-07-04 10:39:00
1231300,아 옵션이 ㅠㅠ ...그래도 차 멋집니다,예수리맘코나경기,2023-07-04 11:29:00
1231300,저도 윗분말씀대로 ev6가 여러모로 좋다고 생각하지만.. 결국 마음에 드는게 맞습니다. 마음에 드는 차 사면 단점도 마음에 들거지만 마음에 안드는차를 사면 계속 마음에 들었던차가 생각날겁니다 ㅎ,존람보lM3Ll양산,2023-07-04 10:37:00
1231300,와...진짜 정답입니다.,라독매니아l모3l양산,2023-07-04 11:01:00
1231300,완전공감합니다^^ 저는 완전만족하면서 타고있지만 결국엔 운전은 차주분께서 하시니 차주분에 가슴에 꽂힌 차 사시는게....^^ 남들이 뭐라고해도 본인에게 더 끌리는 차가 있습니다ㅋㅋㅋ,탕탕이IEV6I서울,2023-07-04 11:49:00
1231300,ev6가 스팩상 조금씩 더 좋은 부분이 있긴 한데 어차피 큰 차이도 아니고 일상에서는 체감 될 일이 거의 없기 때문에 그냥 마음에 드는 거 사면 됩니다. 전기차가 한 두푼 하는 것도 아닌데 가슴이 시키는 걸 사야 후회가 없어요. 효율과 합리성만 따질거면 5천만원이 넘는 전기차를 살 이유도 없구요.,폴쉐타I폴스타2I서울,2023-07-04 10:37:00
1231300,"그러면 ID4 가셔야합니다 차가 좋고나쁘고를 떠나서, 마음에 든 차 안가면(형편이 안되는 경우는 제외) 도로 위에서 ID4 볼때마다 후회하실거에요",아련다솜I모델3l경북,2023-07-04 10:37:00
1231300,ID4>>>니로플러스>>>디올뉴코나>>>ev6에어>>>ev6 어스 로 왔습니다.,산이울다I전주,2023-07-04 10:38:00
1231300,"둘다 가지고 있는 입장에서는....성향 차이긴 한데... 좀더 신기술이 들어간 전기차를 느끼고 싶다면... EV6 (어스이상+하이테크 추천, 컨넥티드 등등)난 차 자체만 좋으면 된다면... ID42륜이면 ID4(4륜이 없죠...), 4륜이면 EV6",차니파파IEV6ID4I화성,2023-07-04 10:42:00
1231300,"다른 조건을 말씀드리면, 내차가 택시로 돌아 다니는게 싫다?? ID4",로렌조lEV6l경남,2023-07-04 10:44:00
1231300,아 ㅋㅋㅋㅋㅋㅋ 빵터졌습니다. 안그래도 이 생각이 스믈스믈 들었어요.. 요새 많이 보이더라구요.,피카ll충남,2023-07-04 10:48:00
1231300,많은 답변들 정말 감사드립니다! 뭐든 얼른 출고해서 타보고 싶네요!,피카ll충남,2023-07-04 10:48:00
1231300,윗분 말씀처럼 택시로 돌아다니는게 싫어서 ID4 했습니다ㅋㅋㅋㅋ 기능은 적어도 디자인도 예쁘고 비슷한 가격대면 외제차 타고 싶은 마음도 있었구요,민초IID4I경기,2023-07-04 10:51:00
1231300,,족제비쭈니,2023-07-04 10:55:00
1231300,"작년 9월 ID4 예약 후 한없이 대기 했습니다 결국 올해 5월 아이오닉6로 급선회했습니다 와이프님의 실내 고급감 평가와 저의 통풍은 있어야지로 넘어왔고 물론 딜러분의 약간의 불친절도 포함되구요(다 니가해된다.. 썬팅 및 이거 저거) H사K사가 싫지만 HD > 비스토 > I30 > 맥스크루즈 > 아6 순이네요 ㅎㅎ 결국 내 가족의 평가와 의지가 중요하며, 무조건 시승하세요 시승 결과는 ID4 내연기관과 유사함 반자율 기능 똑똑함 편의 기능 부족 아6 오 현대 많이 발전했네.. 반자율 코너서 풀릴때 있음(안내 없음) 차량 인식이 다 지우개로 인식 편의 기능 대박(주차부터 고속도로 차선까지) 여튼 마음에 드시는 것으로..",님이콜I아6I평택,2023-07-04 11:06:00
1231300,이식이고주파음 해결됬나 모르겠네요 ~?맘에드는걸루 사세요 전기차 거기서 거깁니다 ㅎ,보리I아식이I경남,2023-07-04 11:15:00
1231300,"id4는 드럼브레이크, 트렁크센서, 원격제어, 인포테인먼트 오류등 이슈가 꽤 있어서 여기저기서 언급이 많이 되는데 그게 스트레스일거 같아요",거북l아이오닉5l시흥,2023-07-04 11:29:00
1231300,ev6,핸썸한I청주,2023-07-04 11:36:00
1231300,수입차 경험이 없으시면 ID4는 조금 불편할 수 있습니다. AS 같은 것들이요.,멍멍이I모델3I청주,2023-07-04 12:11:00
1231300,"그냥 딱 개인성향차이같습니다편의장비, 정비성 등이 우선이시다 하면 기아외제차 한번 어떤건지 경험해보고싶다, 시승햇는데 만족한다 하시면폭바",일월I세종,2023-07-04 12:56:00
