post_id,cmt_content,cmt_author,cmt_created_at
1215372,비교 시승해보세요.,델마IEV6 모3l부천,2023-06-08 07:42:00
1215372,네 시승 해보려구요 ㅜ 제 지역에선 ix1이 언제 들어올지 모른데여..,밤노래I서울,2023-06-08 09:34:00
1215372,ix1 요,지원l모델YI청주,2023-06-08 07:46:00
1215372,EQA AMG 진짜 만족스런 차예요!! 저도 iX1이랑 고민하다가 동글동글 귀여운게 더 좋아서 EQA뽑았는데 너무너무 만족스럽고 좋네요!!,벨라IEQAI경기,2023-06-08 07:48:00
1215372,매우 공감합니다..^^,허니iEQAl수지,2023-06-08 07:59:00
1215372,차가 귀엽게 생겨서 좋아보이더라구요,밤노래I서울,2023-06-08 09:34:00
1215372,eqa에 한표 ㅎㅎ곡선 디자인이라 작아보일뿐....구형투싼크기임,울산eqa,2023-07-08 10:31:00
1215372,egv70 고고,힉스lid4pols2l대구,2023-06-08 08:03:00
1215372,오래 탄다면 저라면 모델S 플레드 입니다. 치출은 좀더 하겠지만 오래 탄다면요.,로렌조lEV6l경남,2023-06-08 08:08:00
1215372,지출이 배 이상 차이날텐데요 😅,괜찮은양상추I서울,2023-06-08 09:33:00
1215372,너무 비쌉니다 ㅜㅜㅜ,밤노래I서울,2023-06-08 09:34:00
1215372,저도 전기차 여러개 비교하고 시승하고 고민하다 작년10월 ID.4 계약하고 기다렸는데 지금까지 확답없이 기다렸어요. 차가 빨리 필요하기도 하고 너무 오래 기다림에 지쳐서 다른차 알아보다가 iX1 괜찮아 보이기에 일단 계약부터하고 며칠전 시승하고 마음 굳혔네요. 그리고 iX1어제 배정받았다고 확답 들었습니다. 직접 실물보고 시승하고 결정하시는게 후회없을듯 합니다.,첫차로l서울,2023-06-08 08:57:00
1215372,ID4 하고 IX1 하고 실내 크기 차이가 어느정도 인가요?,아즈매ㅣ성남,2023-06-08 13:54:00
1215372,비슷한것 같았어요^^,첫차로l서울,2023-06-08 14:23:00
1215372,오오 네엡!,아즈매ㅣ성남,2023-06-08 15:30:00
1215372,iX1 2열이 더 작습니다. 실제로 앉아봄,LercyIID4I서울,2023-06-10 17:34:00
1215372,EQ가시려면 차라리 EQB가 전 젤 이쁜 거 같구요. 남들이 그돈씨...그러지만 gv70은 승차감 내장 모든것에서 완벽에 가깝도록 잘 만들어진 차 같습니다. *싸구려차인줄알아요ㅠ,붕붕이IeGV70I경상,2023-06-08 08:57:00
1215372,자동차 좋아하는 기계전공자 입장에서는 iD4에 한표요,재무리i4I서울,2023-06-08 09:39:00
1215372,그중 제일 이쁜차... ㅋㅋ,이글찬스IQ4I경기,2023-06-08 10:06:00
1215372,"승차감 EQA > IX1 > ID4정숙성 EQA > IX1 > ID4파워(속도) IX1 > EQA=ID4주행거리 ID4 > EQA > IX1보조금 : ID4 > IX1 > EQA모두 시승한 입장에서 승차감과 소음에서는 EQA가 최고입니다.그리고 IX1은 EQA보다는 약간 딱딱한 느낌(통통튀는 느낌)이 조금더 있고요 ID4는 EQA,IX1보다는 승차감과 소음에서는 차이가 많은거 같아요특히 고속주행 소음에 풍절음, 타이어소음, 외부차량소음등 많이 들어오는 편입니다. EQA는 시속 60~120키로나 거의 소음이 없이 조용합니다.",레이IEQA아이6I경기,2023-06-08 11:07:00
1215372,앗... 제일 중요하게 여기는게 정숙성인데...전기차는 조용해야지 맞는거같아서요하.. 더 고민되는군요 ㅠ,밤노래I서울,2023-06-08 11:08:00
1215372,쪽지드립니다,거기요거기,2023-06-08 11:53:00
1215372,얼리아답터라면 바로 테슬라로 가시는 게 맞다고 봅니다. hw4 올해 입항 계획도 없고 어차피 테슬라 메인은 소프트웨어니깐요. 22년 이후 모델부터 라이젠으로 바뀌면서 인포테인먼트 쫃 성능은 차고 넘칩니다. 22년 인벤토리 차량 뜰 때 빠르게 잡으셔서 6월 출고 하시면 할인 및 캐시백 할인 받으실 수 있습니다 아니면 중국 생산 모델Y를 하반기에 나올 것 같으니 기다리시는 추천합니다.,에스IMYLI동탄,2023-06-08 16:59:00
1215372,지금은 iX1이죠,커피소년Ii3I인천,2023-06-09 07:29:00
1215372,쪽지드렸습니다 ^^,나이스l서울,2023-06-09 10:10:00
1215372,저도 같은 고민입니다남편은 모델y타고 있는데..같은건 싫고..,뭘 사야하나ㅠ,2023-07-01 10:31:00
1214148,22년식이sk 23년식이lg 배터리 쓴다고 알고있어요,오닉이6I넥쏘아6I울산,2023-06-05 21:41:00
1214148,22년형 배터리 72.6kWh 23년형 배터리 77.4kWh 입니다.,곰곰Ie208아5I경남,2023-06-05 21:43:00
1214148,답변감사드려요 그러면 배터리 제조사와 용량차이 그밖에 다른 차이는 없는건가요? 다른제원은 다동일한가요?,이벤트호라이즌,2023-06-05 21:58:00
1214148,아이오닉5 실제 운전자라 중고 추전은 못할 것 같습니다. iccu 중대 결함 이슈가 있어서 ...,둘리l아5l경북,2023-06-06 06:14:00
1214148,네 찾아보니 21년 6월-8월 생산에 리콜조치되었었네요 이년식은 피해야 겠네요 알려주셔서 감사드려요^^,이벤트I아이오닉I경기,2023-06-06 14:49:00
1213730,오아보단 저라면 모델로 가겟습니다.,붕붕이IeGV70I경상,2023-06-05 09:50:00
1213730,트렁크 꼭 확인하세요 아5트렁크 작아요 고속도로에서는 아5반자율 상당히 만족스럽습니다. 국도에서는 좀 멍청하구요 근데 가격이 문제죠 그리고 승차감은.둘다 안타봐서 ㅎㅎ,달달한쇳물ll서산,2023-06-05 10:09:00
1213730,모델Y rwd 5천중반은 희망사항 같아요 ..;;,일렉트릭l모델Yl서울,2023-06-05 10:15:00
1213730,as좋고 전세계적으로 인기 좋은 모델이기에.. 가격이 추측대로 나온다면 압살인거 같습니다,아련다솜I모델3l경북,2023-06-05 10:19:00
1213730,모델Y가 5천이에요? 우아;;,트리플봉,2023-06-05 10:21:00
1213730,출시 될지 안될지도 모르는 차에 가격도 모르는데 모3 rwd 가 6천인데 모y rwd가 그것보다 싸게 나올리가 ㅋ,브래스l모3l경기,2023-06-05 10:47:00
1213730,OTA를 생각하신다면 모델y,버징가I아5I전주,2023-06-05 11:23:00
1213730,전자제품을 사신다는 마음이시면 모델y rwd 차를 산다면 아이오닉이겠네요,이오나 I ev6 I 화성,2023-06-05 12:57:00
1213649,예방책이라면 완속 충전 말고 급속 충전으로만 충전하고 V2L도 쓰지 말아야겠죠. ICCU가 모든 충전 관련 기능이 다 통합된 거라 최대한 안 건들게,LercyIID4I서울,2023-06-05 07:38:00
1213649,그런거 다 추측이구요. 딱히 없습니다. 급속 위주로 쓰신분들도 나옵니다.,캡틴줴라드IEV6I경기,2023-06-05 20:27:00
1213649,예방법은 현기 전량 리콜이 예방법이죠. 사용자가 할수있는건 없습니다,경기l아이오닉5l부기,2023-06-07 21:58:00
1213275,고쳤으면 다행인데..아직 못고친거 같고 신상품 계속 무상교환 해주는거 같아요..,부시I의정부,2023-06-04 11:03:00
1213275,경우의 수긴한데 최악은 고속도로 멈춤 뒤에서 화물차......,여행IM3L니로I경기,2023-06-04 12:31:00
1213275,전체로 보면 극소수로 보입니다. 전체 전기차 이용자의 2%-3%인 이 카페에서도 극소수이니,morgan8274lgv60l광명,2023-06-04 13:43:00
1213275,극소수인데 현기 서비스 센터에서 ICCU만 생각하면 한숨이 나온다고 하고 한번 터져서 맡기면 언제 교체될지 모를 정도이군요.,LercyIID4I서울,2023-06-04 15:37:00
1213275,https://cafe.naver.com/allfm01/12118043일만에 교체한 분도 있는걸요. 현기가 싸질러 놓은 똥 가지고 사용자들끼리 비아냥대고 싸워봐야 좋을거 있나요.,뮤즈I5닉l서울,2023-06-04 17:11:00
1213275,"여기서 물어봐야 차종별 카페/게시판에서 터졌다고 올라온 글을 통해 간접적으로 접하는게 전부일거라.. 정확히는 고사하고 대충이라도 불량률이나 빈도 파악이 불가능할거긴 합니다. 특정시기에 유달리 글이 많이 올라오면 맨날 터지는거 같이 느껴질 수도 있고, 요즘은 터졌다는 글 별로 안보이던데 그러면 또 괜찮은건가 싶을 수도 있구요.. 터진다고 다 글 올리는 것도 아니라서 애초에 카페 글 가지고 전체 불량률을 판단할 수가 없습니다.그런걸 다 감안하고, 제가 모든 글을 모니터링한 건 아니지만 띄엄띄엄이라도 오랫동안 게시판 둘러보면서 체감하기론... 차라리 비오는 날 레이더3종세트 불량이나, 디사미 습기문제가 훨씬 더 자주 올라오는거 같고 iccu 터졌다는 글은 생각보다는 그렇게는 많지 않은 느낌입니다. e-gmp 기반으로 만든게 20만대 넘게 팔린걸로 알고 있는데, 그 정도 판매량에 비하면 그렇게까지 높은 당첨(?)확률은 아니지 않나 하는 생각은 듭니다. (당연히 개인적인 짐작일 뿐이고 실제 데이터가 어떤지는 알 수가 없죠.) 듣기로는 충전환경/패턴에 따라서 잘 터진다는 얘기도 있던데, 제 충전환경에서는 문제가 없길 바랄 뿐입니다. 대신 iccu라는건 모듈화된 부품이기 때문에 개선품이 나오면 해결될거라는게 그나마 다행인거 같습니다. 현기가 아무리 무능해도 제차 폐차할 때까지 영원히 원인 파악도 문제 해결도 못할거 같진 않구요...터진다고 당장 차가 멈추거나 브레이크가 안드는게 아니고 경고등 뜨고 저속운행이 가능한거라 윗분이 말씀하신 최악의 상황에서도 비상등 켜고 뒤에 오는 트럭한테 미안하다 하고 갓길로 차 빼면 됩니다. 굳이 부정확한 정보로 불필요한 공포를 조장할 필요는 없을거 같습니다. 일단 터지면 불편함이 고스란히 소비자 몫이라는게 당연히 빡치는 지점일 수 있습니다만, 다른 차라고 고장없이 갓벽한 절대존엄이라 절대 고장이 안난다는 보장은 아무도 못하지 않습니까?ㅎㅎ이렇게 써놓으면 현기 알바니 피의 실드라느니 생각할 수도 있을거 같은데, 이런 댓글 쓰고 있는 그 자체가 현타를 부를 정도로 정말 ㅂㅅ같은 오류라고 생각하구요, 언젠간 터질거라면 요즘 안 바쁜데 빨리 터져라 이런 마인드로 운행하고 있습니다. (현대에서 알바 시켜주면 좋을거 같긴 해요. 일단 단가 맞으면......ㅋㅋ)당연히 리콜이건 보증수리건 빨리 대책이 마련되야 한다고 생각하기 때문에 쉬쉬할게 아니라 오히려 오너들이 나서서 더 공론화해야 한다고 생각합니다.결론은.. 불량률이 0.1%인지 10%인지 알 순 없지만 0%는 아니라 여기저기서 터지는게 팩트입니다. 하지만 그거 때문에 구입을 포기한다거나 엄청난 용기가 필요할 만큼 심각하게 체감되는 불량률은 아니라고 생각합니다. 물론 이건 아직 안터진 제 입장이고 모든 사람들이 다 다른 생각을 가지고 있을겁니다.",뮤즈I5닉l서울,2023-06-04 14:24:00
1213275,대우 마티즈 시절에..CVT 문제와 비슷 한가 보네요.. 고속도로에서 갑자기 50이하로 속도가 팍줄 면서 CVT 경고등 들어와서... 젊은 시절에 엄청 화난상태로 고객센터 전화하니.. 당연하다는 듯이.. 1회 한정 무상 교환 가능하십니다.... 라고 안내 받았던... 당시에도 마티즈 동호회에서 맨날 고장 나네.. 뭐네.. 했는데.. 그래도 압도적인 경차 1위..,왕초보I대전,2023-06-07 22:02:00
1213275,비율이 얼마나 되는지는 추측일뿐 아무도 모릅니다 불안하긴 합니다,달마l코나l경기,2023-06-04 17:26:00
1212973,아이오닉5 중고차야 언제든살수있으니 토레스 나온다음 결정 하셔도될듯해요,사함,2023-06-03 17:09:00
1212973,"닉네임 변경 후 글 작성 해주세요 ^^한글 별명은 ""별명I보유전기차I지역"" 결합으로 구분은 영문대문자 아이(I)입니다.보유하고 계신 전기차가 없으시면 ""별명과 지역""만 표기해 주시면 됩니다.",아트라스I모델3I울산,2023-06-03 17:09:00
1212973,굳이 중고 아5 사시겠다면 ICCU 교체 이력 있는 거 사세요. 없는 거 사면 말그대로 시한폭탄인지라..,LercyIID4I서울,2023-06-03 17:18:00
1212973,교체해도 또 터질수있어요 개선품이 아니라서요,ev6gtI경기,2023-06-03 18:22:00
1212973,헐. 그냥 노답이네요,LercyIID4I서울,2023-06-03 19:07:00
1212973,과연 쌍용차가 잘 만들 수 있을까요? 저는 그런 의문이 듭니다,게보린1I볼트evI평택,2023-06-03 18:44:00
1212973,BYD 기술이 들어가서 나쁘지않을듯요,애플I모델YI전주,2023-06-03 18:46:00
1212973,배터리야 그렇지만 호환성과 브레이크 시스템의 안정성 이런게 걱정됩니다 엔진룸 설계가 부실하지만 전기차이니깐 그런게 모두 상쇄되어서 장점입니다만 BYD가 얼마나 초급속의 기술공유를 해줄지도 의문이구요 저도 저렴한 토레스 좋게 봅니다만 첫번째로 사서 베타 테스터는 좀 ㅎㅎ,게보린1I볼트evI평택,2023-06-03 18:51:00
1212973,BYD에 기술이야기를 하는 건 좀..,너른마루I아5I경기,2023-06-13 09:46:00
1212973,말씀을 확실히 해주시면 되는데요 제말을 보시면 비야디 기술을 의심하는게 아니라 그 기술공유를 얼마나 해줄까의 의문입니다,게보린1I볼트evI평택,2023-06-13 10:00:00
1212973,토레스가 나을듯,애플I모델YI전주,2023-06-03 18:45:00
1212973,토레스도 바로 나오고 사기 좀 그렇죠,노작I아6I수원,2023-06-03 22:14:00
1212973,아직도 전기차가 배터리에 모터만 달면 되는줄 아시는분들이 너무많고 인산철 배터리가 고출력을 내려면 씨레이트를 올려야하고 올리면 리튬이온보다 화재발생율이 더 올라가는걸 모르시는 분들이 왜케많은지 비야디 인산철배터리 사용한 전기차와 하이브리드 차량의 화재도 몇십건이 발생해 보수적인 중국 방송에 나오고 있는데 그냥 무지성으로 인산철이 더 안전하다 어질어질 하네요,항해사l전북,2023-06-14 20:30:00
1212751,저는 그래서 현기는 접었습니다.,차기전기차기전I경기,2023-06-03 09:47:00
1212751,얘네가 뭐 새로운건 잘 하는데 qcqa가 개판이라 그런가 한숨만 나오네요 아직은 아닌거 같습니다,전기차I오닉5I대전,2023-06-03 09:50:00
1212751,원가와 서비스 비용 아낄려고 충전방전 관련 부품들을 통합해서 다 때려넣다보니 그렇게 된거 아닌가 싶습니다.,차기전기차기전I경기,2023-06-03 09:51:00
1212751,"""중국차에 들어간 신기능은 안전성을 담보로 하지 않는 거라 위험하다!""""현기차의 ICCU는 또 하나의 도전이므로 이런 문제가 생겼다고 해서 절대 비난하면 안된다!""- 오(현기)어가 실제로 한 말 -",LercyIID4I서울,2023-06-03 10:05:00
1212751,현토기어라고 말이 많더라구요,차기전기차기전I경기,2023-06-03 10:05:00
1212751,요즘 들어선 너무 노골적으로 빨아주더라구요. GV80 똥풍시트 방구쟁이 이슈도 너무 와전된거고 현대차 잘못이 아닌 직원 개인의 문제라고 ㅋㅋ,LercyIID4I서울,2023-06-03 10:08:00
1212751,만일 광고면 광고라고 표시를 해야되지 않을까요. 노골적으로 편을 드는 것은 좀 의심스럽습니다.,차기전기차기전I경기,2023-06-03 10:08:00
1212751,그채널과 구독자 특징 : 이중잣대 현로남불 답정너,니힐IEQSI서울,2023-06-03 10:28:00
1212751,ㅋㅋㅋㅋㅋㅋㅋㅋㅋㅋㅋㅋ,낄길길I전북,2023-06-03 09:54:00
1212751,"오(현기)어 왈 ""현기가 테슬라처럼 충전 사업을 했으면 이런 문제 안 생겼을 겁니다."" > ICCU 문제는 완속 충전기때문이라며? 정작 슈퍼 차저 대부분이 급속인데? 그럼 현기가 완속 충전기 업체 전부 인수해야 한다는 건가? ㅎㅎ",LercyIID4I서울,2023-06-03 10:01:00
1212751,초고속800V충전 홍보할땐 언제고????,전기차I오닉5I대전,2023-06-03 10:00:00
1212751,급속 충전할때는 ICCU 모듈내에 있는 OBD 안 거치고 바로 충전되니 저런 얘기하는 거죠 ㅎㅎ,LercyIID4I서울,2023-06-03 10:02:00
1212751,아이고 머리아프네요...,전기차I오닉5I대전,2023-06-03 10:03:00
1212751,유튜버가 이슈에 대해서 얘기해주면 오너들은 좋은거아닌가요? 그외 유튜버들은 그냥 언급조차도 없던데요,레알l코나l서울,2023-06-03 10:41:00
1212751,와... 안본지 오래된 채널인데 이건 좀 심각하네요 현기차말곤 완속충전 문제 없는데 근거없이 iccu고장 원인이라고 하면 충전기 업체가 고소해도 할말이없고... 완속 안쓰면 전기차메리트 급락하는데 현기차 타지말라는 말이네요,전타Iix3I경기,2023-06-03 14:58:00
1212751,이슈에 대해서 클레임을 해주면 좋은데 저 채널은 쉴드에요….,수녕군IMYI서울,2023-06-03 15:56:00
1212751,이분 실제 현기광고 찍었어요. 무슨 뇌과학자랑 나와서 현기 빨아주는 유튜브광고 찍었는데 논란되니 삭제...ㅋㅋㅋ,더도날I창원,2023-06-04 03:54:00
1212751,현기아 전기차로는 아이오닉ev 아이오닉5 코나ev 현재 ev6타고 있는데 집밥충전 쓰고요. 특이한 충전이슈 전혀 없었는데 지금도 그렇고 어떤 이슈인지,레드Iev6GTLineI안동,2023-06-03 09:57:00
1212751,참고로 그외 외제차전기차로는 bmw i3랑 푸조2008e 실 운전자입니다,레드Iev6GTLineI안동,2023-06-03 09:57:00
1212751,ICCU라고 전기제어쪽 부품이 결함으로 인해 충전불가등 운행을 못하게 되는 증상이에요,전기차I오닉5I대전,2023-06-03 10:01:00
1212751,충전불가 이슈가 특정 제조년월의 문제가 아닌 대부분의 이슈일까 그런 부분이네요 초창기에는 제조사별 w와 호환이슈로 업데이트가 종종 있었는데 최근에 이슈는 잘 인지하지 못하고있네요. 조회좀 해볼께요,레드Iev6GTLineI안동,2023-06-03 10:03:00
1212751,아직까지는 대부분인걸로 추측됩니다,전기차I오닉5I대전,2023-06-03 10:04:00
1212751,아5 두대 운영중입니다. 거이 90프로 완속 아파트 차지비 로만 충전하는데 23년식 멀쩡 22년식은 힌지소음으로 하이테크 재입고시 완속충전 중단 에러 있었다고 충전단자 iccu. 그냥 바꿔주고 이상 없어요 부번도 바뀐듣 하닝 개선되었을거라봄니다,유강호I아5I일산,2023-06-03 12:20:00
1212751,힌지소음이 트렁크쪽 딱딱 소리나는거 말씀하시는거죠?,라다l쏘부아5l대전,2023-06-03 11:14:00
1212751,네 그거 상부 2곳 힌지에서 소음 나는거에여 그거는 블루는 힘들고 하이테크 시트부에서 잡는다고 합니다.(대화하이테크),유강호I아5I일산,2023-06-03 12:22:00
1212751,3번째 부터 무조건 레몬법으로 환불 아닌가요? 아. 또 다른부품이라고 그럴려나?암튼 안전운행 하세요~~,잠실l아이오닉7,2023-06-03 11:42:00
1212751,동일부품 2번이상 발생이라고 그러더라고요,전기차I오닉5I대전,2023-06-03 19:39:00
1212751,아이오닉5 ICCU 이슈는 아직도 보이네요... 해외에선 리콜도 있엇고 레몬법 적용된 사례도 있다는데 왜 국내는 아직도 무상수린지 모르겠네요;;,피버I볼트EVI고양,2023-06-03 15:00:00
1212751,현대가 별거아니라는듯이 처리하는게 가장 개빡칩니다,전기차I오닉5I대전,2023-06-03 19:38:00
1212751,하브 예전꺼 타는데 시동끄라고 배터리 알람떠서가니까 업데이트해주고 끝이네요 동일증상 재발해도 보증끝나면 유상처리라고 .. 전기차도 비슷할거 같아요,메탈카본lev6예l경기,2023-06-03 17:38:00
1212751,몇년 안에 현기에 위기가 생길 겁니다,다재II아이오닉5I수원,2023-06-04 08:43:00
1212751,열받아서 여기저기 글 보다가 남깁니다. 아이오닉5 21년11월식 1년반정도 탔는데 결함떠서 블루핸즈 오늘가니 4만키로 넘어서 무상안된다고 합니다. ㅜㅜ 엇그제 비오는날 고속도로3시간 달리다 나간거 같아요,경기 II 률사마,2023-06-07 18:16:00
1212751,무상이 아니라구요?,전기차I오닉5I대전,2023-06-08 17:11:00
1212621,Qm6에서 아5로 넘어온 유저로서 공감가네요특히 뒷문짝요,기은리,2023-06-02 22:46:00
1212621,핸들도 인체공학 전혀 반영안된듯해요...주차시 핸들돌리면 반자율주행 버턴이나 미디어버턴이 계속 걸려요,i콩이l경남양산,2023-06-02 22:57:00
1212621,"와,, qm 리모컨쓰다 아5 핸들 쓰니 바로 체감되던데 저랑 똑같네요 ㅜ",기은리,2023-06-02 23:01:00
1212621,"안녕하세요 저도 핸들돌릴때 매번 버튼이 눌립니다~뒷문짝 공감합니다~다만 멀미 부분은...휘발유, 경유 발연비 스킬 익숙하시다면 바로 버리셔야합니다..내연기관 타던 스킬로 운전하시면 그 누가 와도 멀미 합니다...회생제동은 오른쪽 패들 끝까지 누르시면 오토모드가 되는데..오토모드 진입 후 왼쪽 패들로 중간까지 올리시면 탈만합니다..",팅팅탱l볼트아5l경기,2023-06-02 23:51:00
1212621,그거 꺼요 불편햐면 끄세요,아5평여수,2023-06-03 20:57:00
1212621,뭘 끄면 되나요? 있는 옵션 활용하다가 주차할때 반자율주행 버튼 터치되서 주차하는데 설정값 재부팅되어 쑥 나가는데???...운행중 설정내용 주차전에 리셋하는사람 몇이나 되겠습니까...,i콩이l경남양산,2023-06-03 21:08:00
1212621,고속도로는 회생제동 0 으로 다니세요 :),하먼l아5l성남,2023-06-02 22:50:00
1212621,네 그래야겠어요,i콩이l경남양산,2023-06-02 22:56:00
1212621,적응하실겁니다. 아5 이전차가 530e msp였는디 그 차도 처음이 브레이크 적응이 필요했고 아5 뒷문..아 소프트클로징 있는차 타다가 더 현타오긴했었는데 이것도 시간 지나면 처음보다 좀 더 잘 닫히긴합니다 ^^ 전 이제 오토 0 혹은 1로 평소 다니고 고속도로에서는 회생제동 0으로 다녀요.,하먼l아5l성남,2023-06-02 22:57:00
1212621,네 알겠습니다 저도 530e 운행중인데 진짜 현타옵니다ㅠ,i콩이l경남양산,2023-06-02 22:58:00
1212621,그래도 실내 공간감 좋잖아요 ㅎ 시간지나면 어느샌가 이질감 없어지실겁니더 ^^ 아 공기압은 전 사계절 내내 권장으로 맞춰다닙니다. 2psi민 높아도 튀는 느낌이여서요.,하먼l아5l성남,2023-06-02 23:00:00
1212621,공기압 얼마로 설정하셨나요?,i콩이l경남양산,2023-06-02 23:01:00
1212621,전 20인치라 권장이 34psi라서 아침 냉간기준 34로 맞춥니다.,하먼l아5l성남,2023-06-02 23:02:00
1212621,그리고 멀미나는게 전기차 토크때문인데 악셀링 살살 가속하시거나 아니면 일단 에코로 다니세요. 회생제동이 쎄서 멀미도 나지만 팍팍 나가서 멀미도 나거든요 ㅎ,하먼l아5l성남,2023-06-02 23:03:00
1212621,네 조언 감사합니다,i콩이l경남양산,2023-06-02 23:04:00
1212621,530e 모터는 작고 약해서 팍팍 나가지 않지만 아5 4륜은 밟자마자 60토크 이상 나와서 저도 처음에 운전하는데 멀미 느꼈어요 ㅎ,하먼l아5l성남,2023-06-02 23:04:00
1212621,근데 아이오닉 문짝 플라스틱인가여?철판 문에 프라스틱 덧댇게 아니고?,차아일체I창원,2023-06-02 22:54:00
1212621,철판문에 플라스틱이죠...닫아보시면 느낌 오실겁니다,i콩이l경남양산,2023-06-02 22:55:00
1212621,궁금한점이 철판에 플라스틱 덧댄게 문제가 되나용?,차아일체I창원,2023-06-02 23:07:00
1212621,거의 모든차가 철판에 내부는 플라스틱 덧대겠죠...근데 철판때기가 문젠지 플라스틱이 문젠지 모르겠지만 2000초반짜리 qm6보다 문짝이 너들거린다는게 문제인거 같아서요,i콩이l경남양산,2023-06-02 23:14:00
1212621,저는 조수석 뒷자석 다 멀미가있어 구매 고민중입니다,빛솔반I세종시,2023-06-02 22:58:00
1212621,저도 멀미 심했는데 회생제동 부드럽게로 선택하고 내비게이션 연동도 선택하고 값은 auto로 뒀더니 멀미 안나더라구요.,오라더스 아닉5 은평,2023-06-02 23:12:00
1212621,네~ 저도 회생제동 0으로 설정해서 다녀볼게요^^,i콩이l경남양산,2023-06-02 23:17:00
1212621,그냥 auto로 해 두시면 알아서 바꾸는 것 닽아요. 0이면 연비 너무 떨어질 것 같구요. auto는 꽉 누르면 생겨요.,오라더스 아닉5 은평,2023-06-02 23:20:00
1212621,지금 오토로 다녔는데 멀미가 좀 심하게 느껴져서 적응할동안 연비는 포기해야할것 같습니다 그래도 도로비 할인받고걸로 만족해야 할것같네요,i콩이l경남양산,2023-06-02 23:32:00
1212621,출퇴근 고속도로가 95% 정도 되는데 회생재동 0 으로 다닙니다. 감속 할땐 오른쪽 패들시프트 당겨서 오토 혹은 회생재동 단계 올려서 감속 합니다 ㅎ 전 520d 탔는데 고스트도어 간절 했었는데 지금은 그러려니 합니다 ㅋ;;,흰듕이l아오5EUVl수원,2023-06-02 23:16:00
1212621,네~~ 조언 감사합니다 잘 적응 되었으면 합니다ㅠ,i콩이l경남양산,2023-06-02 23:19:00
1212621,전 매일 300키로 운행합니다.제가 둔해서인지 첨부터 멀미?못느꼈습니다.회생오토에 시내 4고속시 3까부는 얼라들 있음스포츠모드에 회생0150키로 순삭 에 재미느낌니다.젤 아쉬움을 느끼는것고르지 못한 노면에 온몸으로 느끼는진동ㅠ,붕어I아5I성남,2023-06-03 05:38:00
