post_id,cmt_content,cmt_author,cmt_created_at
1229949,초기제품 불량은...현기 고질병같아요~아5도 초기출고차량 구입했더니 오류만10가지 ㅜ,미제I이트론아6I원주,2023-07-02 08:12:00
1229949,😶🤐,타이드I서울,2023-07-02 11:42:00
1229949,이런 글을 보고도 현기를 옹호하다니... 잘못하면 저세상 갈 수도 있는데,나나l테슬라l과천,2023-07-02 14:28:00
1229949,ICCU문제인가요? 신차마저 그렇다면 개선품은 커녕 그냥 기존부품 계속 들어가는거아닌가요. 까페만봐도 빈도수가많은데…,유니77서울,2023-07-02 19:16:00
1229949,현기가 잘하는 글삭~! 그시간에 고객응대나 할것이지 ㅋ,새빛l코나l경기,2023-07-02 23:46:00
1229949,혹시 해당글 어디 정비소로 입고됬나요??,양재ll뉴펠리,2023-07-03 08:58:00
1229949,"ev6페이스리프트,아이오닉7, ev5정도에서나 개선되겠네요",스타필드l전라광주,2023-07-03 10:49:00
1229921,구 아이오닉 말씀인가요 아이오닉5 말씀인가요^^;,존람보l모델3l양산,2023-07-02 09:19:00
1229921,앗 안녕하세요 아이오닉5를 알아보는중입니다!,김포아이오닉맨,2023-07-02 11:31:00
1229921,아이오닉5라면 주기적인 장거리운행에 전혀 지장이 없습니다. 롱레인지라면 냉난방을 작동시키고 고속도로를 다니는 악조건이라 해도 왕복 300키로는 중간에 충전할필요도 없이 한번에 다녀올수 있습니다. 아이오닉5 1년정도 가지고 있다가 지금은 다른차로 바꿨지만.. 넓고 쾌적한 실내와 편안한 승차감은 아직도 가끔 생각이 납니다. iccu이슈야 고장나면 교체를 해주니 크게 염려하실건 아닌거같고.. HDA2가 지금은 개선이 됐는지는 모르겠지만 22년식은 조금 불안정한 감이 있었습니다. 차에서 음악듣는걸 좋아하시고 귀가 예민한 편이시라면 오디오도 조금 취약하다는걸 참고하시구요~ 비슷한 가격대의 차량마다 장담점이 다 있으니 꼼꼼히 비교해보시고 선택하시는게 좋을듯합니다. 그리고 주기적인 장거리에 취약 하다는건 어떤글을 보셨는지 모르겠지만 전기차는 내연기관에 비해 열 발생도 덜나고 히트펌프가 열을 에너지로 전환하므로 열에 대한 관리가 잘되어 고속이나 장거리 주행에 있어서는 내연기관보다 더 안정적입니다. 연료비도 연료비지만.. 엔진오일 플러그 케이블 각종벨트 가스켓 등등 복잡한 관리와 비용도 추가로 절감할수있으니 전기차는 좋은선택이실겁니다.,존람보l모델3l양산,2023-07-02 12:00:00
1229921,"설명 감사합니다뽐뿌에서 아이오닉5 타시는분이 장거리 운행에 대해 적은 한탄글을 봐서 혹시나하고 여쭤봤어요, iccu랑 hda2에 대해서도 알아봐야겟네요 감사합니다!!",김포아이오닉맨,2023-07-02 12:01:00
1228866,iccu아니고 배터리교체요?,샤리l경남,2023-06-30 00:22:00
1228866,넵 배터리 셀 여러개중 하나가 이상 있어서 배터리 교체 해준다고 하더라구요,범범회사,2023-06-30 00:24:00
1228866,머..생각하기 나름이겠지만 전 개인적으로 교체해준다면 더 좋을것같아요ㅎ전기차는 밧데리가 생명이기에..ㅎ,샤리l경남,2023-06-30 00:25:00
1228866,몇만키로 정도 타셨나요?,헐렝이IEV9I고양,2023-06-30 00:41:00
1228866,3만5천 정도 탔습니다,범범회사,2023-06-30 00:41:00
1228866,아 그정도면 초기불량이군요. 배터리 보증연장해야하나 고민중이라서 여쭤봤습니다. 좋은 꿈 꾸세요,헐렝이IEV9I고양,2023-06-30 00:42:00
1228866,넵,범범회사,2023-06-30 00:43:00
1228866,셀 하나교환 인가요 아니면 배터리 전체 교환 인가요,오렌지용ll대구,2023-06-30 06:02:00
1228866,그건 아직 모르겠네요~,오닉l충북,2023-06-30 08:30:00
1228866,잘 해결되셨으면 좋겠네요,나이스유I아이오닉5I,2023-06-30 07:14:00
1228866,대충 주행중 저런 메세지 뜨면 ICCU 이고충전후 뜨면 배터리 불량이겠군요.근데 첨에 AS 기사님은 뭐가 어떻게 고장난줄 알고 메세지만 지워주고 가셨을까요;;어떻게 보면 참 안전불감증이고 어떻게 보면 이해가 가는 측면이 있고 그렇네요.,로렌조lEV6l경남,2023-06-30 07:56:00
1228866,보증끝나면 배터리 수명이 문제가 아니라 셀불량같은 고장이나면은 수리비 많이 나오겠네요 그래도 배터리 보증기간이 긴편이니깐 다행이네요~,정땡I구쏘울포터I제주,2023-06-30 08:04:00
1228866,배터리교체면 무조껀 신품인가요? 아니믄리퍼제품으로해주나요?,초심자I오닉6EQAI여수,2023-07-01 10:24:00
1228498,스트레스 많이 받으시겠네요. 전기차가 완속 충전이 제대로 안되면...,호크IID4I서울,2023-06-29 13:47:00
1228498,저도 작년 10월 출고인데.. 2주전부터 충전실패 떳네요... 그때는 90%는 잘 됐었는데..엊그제 90% 속도로 퇴근후 30%->90% 충전기 물려놨더니 80% 에서 새벽에 중단 떳네요,곰메리I니로I광양,2023-06-29 14:30:00
1228498,커넥트 문제 아닐까요?,아5평여수,2023-06-29 15:10:00
1228498,가능성 있어보입니다. 손잡이 카넥터 안의 케이블이 열화로 인한 손상으로 내부 온도가 올라감에 따라 온도 컷 예상이요,하니오니댓,2023-06-29 15:12:00
1228498,제네시스 홈 충전기로 9KW 속도로 차량 충전전류 100%로 매일 충전 중인데(하루 210여키로 운행).....간헐적으로 90프로 이상 충전되면 중단됩니다...지금까지 3개월 사용했는데...실패는 3번 정도 뜬것 같습니다...,햇빛IEGV70I세종,2023-06-29 15:21:00
1228498,근데 충전중에 커넥트가 뜨거운게 맞나요? 제 차만 그런줄 알았는데 다른차 충전중일때도 뜨겁워서 오래 못 만지고 있겠던데..,곰메리I니로I광양,2023-06-29 16:03:00
1228498,아파트 충전기(11k)가 새거인데도 11k는 항상 1시간이내로 충전 실패합니다. 최소전력 6k를 해야 실패가 없더라구요 업체측에서도 아이오닉이랑 ev6만 이런 현상이 발생한다고 하니 종특 같습니다,새벽I오닉5I부산,2023-06-29 16:04:00
1228498,저도 잘되다가 갑자기 저번주부터 완속이 자꾸 중단됩니다,혀니l아이오닉5l대구,2023-07-02 23:54:00
1228498,차량 문제 또는 케이블 문제가능성보입니다.,대호리,2023-07-10 09:35:00
1228498,저도 집밥 아파트 지치저 아이오닉5인데 계속 충전 중단되네요ㅜㅜ,백황II대구,2023-07-10 18:25:00
1228498,저는 아파트 g차저는 잘 되는데 옥외 츙전기에서는 실패 ㅠ 짱나네요,레벤트,2023-08-16 10:02:00
1228498,정비소에서도 답이 없네여 충전속도 늦추는 업그레이드 받으라는 소리만 하네요 이게 업그레이드인지 다운그레이든지..,레벤트,2023-08-16 10:03:00
1227515,"전세대 전기차는 화재, 이번세대는 ICCU문제...",jieI아이오닉6I서울,2023-06-28 09:14:00
1227515,내연기관 시절에도 치명적인 문제가 끊이질 않더니전기차시절로가면 해방될줄 알았던 현기차 ㅋㅋ,돌아이킹l부산,2023-06-28 09:16:00
1227515,→ 국내는 해당 사항 없음. 문제 발생 시 교체.,개냐옹I아오5I천안,2023-06-28 09:17:00
1227515,꼭 사람 대여섯명 죽어야 고치나…명확하게 입장이라도 표명하던가…,빼꼼I아이오닉5I대전,2023-06-28 09:19:00
1227515,현대차 측은 기존 ICCU를 개선품으로 교체하는 것 외에는 별다른 해결책이 없다는 입장이다. 부품을 교체해도 재발 우려가 있다는 사실도 알리는 중이다,수녕군IMYI서울,2023-06-28 12:48:00
1227515,"충전이 안되는데, 당연히 심각한 문제가 아닐까요...?",그냥직장인lGV60l서울,2023-06-28 09:20:00
1227515,미국이 나서니 해결되겠네요,소멸은신I모델YI인천,2023-06-28 09:23:00
1227515,국내 리콜기준을 바꿔야 할듯요 ㅡㅡ,공삼이llGV60ll서울,2023-06-28 09:30:00
1227515,너무 많은 충전 관련 기능을 단일 모듈에 통합시켰어... 게다가 위치도 라디에이터팬이 안 닿는 2열 좌석 밑... 그러니 당장 발열 문제부터 발생,호크IID4I서울,2023-06-28 09:46:00
1227515,"""""아이오닉6, 기아 EV6, EV9, 제네시스 GV60도 동일 문제 ""미국 출시도 안한 ev9은 무슨 동일문제인가요???",잠실l아이오닉7,2023-06-28 09:47:00
1227515,아마 같은 부품써서 걸고넘어지는듯 합니다,김멜론I모YI서울,2023-06-28 09:53:00
1227515,아이고 현기 입장에선 그래도 통합모듈 개발한다고 돈도 많이 쓰고 나름 기술력인데 그거 다 오픈해야되는 꼴이네요.,로렌조lEV6l경남,2023-06-28 09:50:00
1227515,그래도 국내는 무시하겠쬬 ㅠㅠ,콩스트lEV6l성남,2023-06-28 09:55:00
1227515,단가 조오오온나게 후려쳐대니 협력사가 정상 제품을 공급하겠냐?ㅋㅋ뺄거 다 빼고 원가 분석해서 내보내지 ㅋㅋ제 값좀 치뤄라 흉기야,팅팅탱l볼트아5l경기,2023-06-28 10:55:00
1227515,어 이거 누가 충전기에서 나온 질 나쁜 전기 문제라고 했는데 ㅋㅋ,낄길길I전북,2023-06-28 16:21:00
1227515,현기 iccu관련해서는 유명 유튜버들이 언급하나 없네요,베즈I대구,2023-06-28 20:21:00
1227515,보증끝나면 유상처리로 대응할지도,메탈카본lev6예l경기,2023-06-28 20:45:00
1227515,,족제비쭈니,2023-07-04 13:23:00
1226586,iccu나 연석 때문이라도 가족과 함께는 피하고 싶네요 둘다 만족할만한 차량이 없어 아쉬워요,여행IM3L니로I경기,2023-06-26 21:11:00
1226586,Iccu 개선까지 존버 합니다 연석 충돌 이슈는 찝찝하긴 하네요 ㅠ,김덕배 I M3L I 광주,2023-06-27 00:20:00
1226586,"아5 1년정도 타다가 모델3로 넘어왔어요~ 디사미 ,공간감, 릴렉싱시트,승차감등은 참 좋긴했는데 hda2는 좀 별로 였어요 직진하는대도 핸들이 좌우로 계속 움직이고 곡선이 조금만 잇어도 바로 풀려버리더라구요 깜빡이로 차선변경하는건 뭐.. 뒷차가 100미터 뒤에잇어도 실패하니..쓸수가 없는지경입니다. 블루핸즈 3군데를 갔는데 모두 원래 그런거고 정상이라 하더군요. 보스8스피커도 최악이었습니다.",존람보l모델3l양산,2023-06-26 22:21:00
1226586,스피커는 저도 동감입니다 하지만 정숙성 승차감은 너무 좋았네요,김덕배 I M3L I 광주,2023-06-26 22:22:00
1226586,예전에 국산차탈때 HDA2 많이 쓰고 다녔는데 도로에서 120크루즈 걸어놓으면 과속카메라 나올때 마다 알아서 속도 줄이고 카메라 지나가면 다시 속도 내고 이런게 재밌었죠.,아르I미니일렉I일산,2023-06-26 23:07:00
1226586,이게 정말 편하더군요 ㅋ,김덕배 I M3L I 광주,2023-06-27 00:20:00
1226586,이번에는 기아차 타고있으니다음차는 테슬라타면서 장단점을느껴보고싶네요^^부지리 벌어야겠어요!,전기차탄곰Iev6I경산,2023-06-27 00:12:00
1226586,느낌이 완전 다른 차종들이라 저는 아5를 기추 하고싶습니다 ㅎㅎ,김덕배 I M3L I 광주,2023-06-27 00:20:00
1224530,밤찌지직I아6I통영 으로 변경 바랍니다.,운영자,2023-06-23 10:49:00
1224530,변경했습니다,빔찌지직I아6I통영,2023-06-23 11:04:00
1224530,7k 100% 구간까지 충전속도 변동 없었어요..,옥토넛l아6l부산,2023-06-23 11:20:00
1224530,저는 외부 과열 발생하면서 속도저하시 7키로는 반토막나면 3키로 내려가는데 11키로짜린 외부과열로 반토막나도 7키로짜리 속도로 유지가 된다는 글입니다,빔찌지직I아6I통영,2023-06-23 11:21:00
1224530,발열 있다면 전선 접합부쪽 터미널로 시공했는지 확인해보시고...케이블이 10sq이상인지 체크해보세요.,달샘l모델yl수원,2023-06-23 11:22:00
1224530,새기계로 교체도 했고 선도 전부 16sq 사용했습니다 회사 들어오는 메인선도 충전기 달기전에 새걸로 더 굵은걸로 교체했습니다,빔찌지직I아6I통영,2023-06-23 11:24:00
1224530,ICCU가 문제 좀 있나보네요.저정도로 세팅하면 발열은 없다고 봐야하는데;;;; ㄷㄷ,달샘l모델yl수원,2023-06-23 11:25:00
1224530,그건도 현대랑 이야기 중입니다 현대서는 아이오닉6는 아직 문제없다 iccu도 개선품이다 라고 하고있죠 ㅎ 내연기관으로 다시갈까도 생각하는데 전기뽕이 무섭네요 ㅎ,빔찌지직I아6I통영,2023-06-23 11:33:00
1224530,저도 7KW 애플망고 비공용 사용 중입니다. 회삿밥이 좋아서 집밥 안먹인지 4달이 넘었지만 11월부터 올1월까지 집밥 잘 먹였습니다.충전속도 7.2KW 나왔습니다. 겨울이어도 충전기 본연의 속도대로 충전됐습니다. 그 후론 안먹여봐서 잘 몰르겠네요.뜨거운 여름휴가때 한번 먹여봐야겠네요. 발열이 있는지도 체크해보고요. 회사밥도 7KW 완속 비공용입니다.전기트럭이 있어서 설치된건데 저도 꼽싸리 껴서 함께 먹고 있습니다. 꽁짜라서요. 4개월넘게 집밥을 안먹으니까 전기세가 기본료에딱 절반만 청구됩니다.,금연I니로EVI하남,2023-06-23 15:05:00
1224530,친구 ev6 21년식 애플망고 자기 회사 설치해서 7키로 먹이는데 아직까지 충전 잘된다하네요 ㅎ,빔찌지직I아6I통영,2023-06-23 15:51:00
1224530,애플망고 제품이 LED등 색깔로 충전상황을 알려줄뿐 다른 정보를 알수가 없어요. 차를 열어서 시간이 얼마 남았는지충전속도는 얼마인지 알수 있어요. 오로지 충전기 본연의 임무만 합니다. 블루투스되는 제품도 있고 화면이 있어서 충전정보를 알려주는 제품도 있어요. 그런데 그런거 다 필요없고 애러없이 충전만 잘되면 됩니다.,금연I니로EVI하남,2023-06-23 17:00:00
1224530,시그넷 사용중입니다 타제품도 led점등 색으로 구분하지 차량에서 알려줍니다 ㅎ 충전만 시켜주는데도 문제가 발생하죠,빔찌지직I아6I통영,2023-06-23 17:02:00
1224530,저도 같은증상으로 ev6 리콜은 받았는데 11k되다가 과열되면 6kw내려가더라고 ... ㅠㅠ 그냥쓰고있습니다,아들I봉고모델3I제주,2023-06-24 15:25:00
1224530,저도 같은 증상입니다 아파트 공용쓰는데 7KW짜린데 1시간정도지나면 외부충전기과열로 충전전류가 낮아진다고 알림뜨면서 3~4KW 나옵니다 차가 문제인지 충전기 문제인지 답답합니다,행온I아이오닉6I울산,2023-07-07 13:51:00
1222335,미국이니까 한국에선 운전자잘못,착한앙마l포터l서울,2023-06-19 21:52:00
1222335,,아이파lEV6l부산,2023-06-19 22:41:00
1222335,전장쪽이 쉽지않은 부분이죠 ㅠ 특정모듈보다는 전체적으로 봐야되는거라,메탈카본lev6예l경기,2023-06-19 22:06:00
1222335,현대차 반성해야해요,폴이l광주,2023-06-19 22:11:00
1222335,아 불안하네요…. 부품값 200만원이라는데…,신상아lev9모3쏠l송도,2023-06-19 22:33:00
1222335,고개님 수출차와 내수차는 동일하치만 미국 리콜을 국내차량은 괜찮습니다.시전한거 기억나네요.,크리스l모SYl경기,2023-06-19 23:07:00
1222335,이럴까봐 거시기하지만 해주겠죠ㅜ,연군ㅣ볼트ㅣ경기,2023-06-20 10:56:00
1222335,미국은 리콜도하고 보증기간 연장서비스 제공 하지만 한국은 무상수리 이럴것 같네요,크리스l모SYl경기,2023-06-20 10:57:00
1222335,무상수리는 지금하는거로보고 리콜로바뀌어야할텐데요ㅎ,연군ㅣ볼트ㅣ경기,2023-06-20 11:30:00
1222335,미국에서 터지니 뉴스도 나오네요 👍,여행IM3L니로I경기,2023-06-19 23:07:00
1222335,과징금 8000억되려나,김멜론I모YI서울,2023-06-20 02:13:00
1222335,이거 국내에서 현기가 미적지근하니까한국 소비자들이 민원으로 미국에 엄청 푸시 넣은걸로 알고 있습니다실제로 미국에서도 문제 생기고 있었고,돌아이킹l부산,2023-06-20 05:09:00
1222335,국토부는뭐함 ?,조나탄I수원,2023-06-20 06:46:00
1222335,222 ㅋㅋㅋ,연군ㅣ볼트ㅣ경기,2023-06-20 10:56:00
1222335,현기 정신차려야지요. 그런데 미국에서는 이렇게 대응하는데 한국에서는 아직도 무대응...현기 니네가 징벌적손해배상 제도로 한국에서 번돈 미국에서 다 까먹어봐야 정신 차릴려나...그래도 여전히 한국에서는 아무 이상없다고 하겠지...정부도 마찬가지로 현대 손 들어줄거고...암튼 엄청 때려맞고 미국에서 A/S로 돈 펑펑 써라. 한국에서는 돈 안써도 좋다.니네가 옛날 GM꼴 나봐야 정신차릴려나?,금연I니로EVI하남,2023-06-20 06:47:00
1222335,헉.. 무서운데요.. ㅠㅠ,안뇽l아6l대구,2023-06-20 09:19:00
1222335,오토기어는 이제 미국하고 싸우겠네,우유Itycan2tronI서울,2023-06-20 09:49:00
1222335,"오늘 출고 했는데, 마음이 불안하네요 ㅠ",이나아빠,2023-06-20 10:10:00
1221768,이건 좀 일이 커져야겠네요 국내도,댕조비l구오아오l부산,2023-06-19 08:58:00
1221768,미국에서도 일단 소프트웨어 업뎃이후 문제 다시 발생시 교체 프로세스로 가나 보네요,morgan8274lgv60l광명,2023-06-19 09:06:00
1221768,지금까지 양발이네 노령이네 등등 급발진 사고가 이 문제로 비롯된 사안이면 큰일좀 날 것 같은데요?,명탐정l코나I경기,2023-06-19 09:08:00
1221768,급발진이랑은 상관 없고 ICCU 이슈 관련된 거죠. 급발진의 반대 주행 불가 증상,LercyIID4I서울,2023-06-19 09:40:00
1221768,급발진이랑은 상관없습니다... 저건 iccu로 12v 배터리 충전불량 문제입니다 ㅠㅠ,경기l아이오닉5l부기,2023-06-19 09:55:00
1221768,12배터리 충전불량문제에요? 이건몰랐네요,연군ㅣ볼트ㅣ경기,2023-06-19 11:40:00
1221768,저도 뉴스에서 봤어요 집단소송가는거겠죠?,토스트 경기,2023-06-19 10:55:00
1221768,미국에서 뭔가해야 뒤늦게 조치 하겠군요 그냥 리콜감인데 국내는 무상수리만하니.. 국내도 미국안팔리는차는 안사는게나을듯,연군ㅣ볼트ㅣ경기,2023-06-19 11:41:00
1221766,미국에서 뭔일이 나야 움직이네요..,너굴군I포터evI계룡,2023-06-19 10:30:00
1221766,우리나라에선 그렇게 얘기해도 먼산만 쳐다보더니 미국에서 30건 접수됐다고 난리치네요.역시 미국에서 뭔 소리가 나와야 움직이는군요. 국민을 개돼지로 알아요. 현대는....미국 아5 몽땅 고장나버렸으면 좋겠습니다. 그래도 미국만 A/S 해줄겁니다.국내 내수용은 아직 팔팔하다고 손도 안댈겁니다.,금연I니로EVI하남,2023-06-19 17:34:00
1221341,심각한 문제는 아닌데 드물게 ID.4 소리 뮤트 증상도 있습니다.(깜빡이 소리도 안남 ㅜㅜ) 시동 껐다 10분 정도 후에 다시 켜면 다시 돌아오긴 하지만요..,LercyIID4I서울,2023-06-18 12:35:00
1221341,모든 전기차들이 다 모이는 카페라서 그런지.. 생각보다 결함들이 많네요 작은결함부터 큰 결함까지,빠뿡I아이오닉5I구리,2023-06-18 17:24:00
1221341,E-GMP 연석 화재가 빠졌네요.,타이드I서울,2023-06-18 13:06:00
1221341,주행중 정차중 위주로 모아봤네요 사고후까지 모으면 너무 많아요 ㅠ,빠뿡I아이오닉5I구리,2023-06-18 13:13:00
1221341,이것도 주차장에서 미속으로 주행중 툭한거라 사고라고 보기도 좀…,타이드I서울,2023-06-18 13:20:00
1221341,그래도 사고는 사고죠 ㅎㅎ 뉴스에서도 다 사고라고 하네요,빠뿡I아이오닉5I구리,2023-06-18 13:25:00
1221341,헐.. 고작 이정도 연석에 배터리 화재로 이어진 거에요? ㅎㄷㄷ,LercyIID4I서울,2023-06-18 13:34:00
1221341,아무 충격없이 주행중 불나는 차도 있는데요 뭐 이정도 가지구요 ㅎㄷㄷ 그런데 의아하긴 하네요 저런 연석 넘어다녔는데 불은커녕 닿지도 않던데 추후 결과나온다는 기사만 있고 후속기사가 없네요 보상받았는지 궁금해서 열심히 찾아봤거든요,빠뿡I아이오닉5I구리,2023-06-18 13:49:00
1221341,저건 그냥 연석을 예를 보여준 거고 실제 화재로 이어진 연석은 좀 높은 거 아닐까 싶네요.,LercyIID4I서울,2023-06-18 13:54:00
1221341,예시가 아니라 저기가 화재가 난 가계앞 현장 연석입니다. 뉴스에서 화재현장으로 보여준곳.,타이드I서울,2023-06-18 14:59:00
1221341,헐. 그럼 진짜네요,LercyIID4I서울,2023-06-18 14:57:00
1221341,로드뷰 보니까 더 이해가 안가네요 엄청 낮아보이는데 저기에 부딪혀 전소가 됐다는게,빠뿡I아이오닉5I구리,2023-06-18 15:06:00
1221341,저도 화재사례를 접했을때 깜짝 놀랐습니다. 보통 배터리팩 앞에는 스키드 플레이트가 막고 있어 최소한의 충격은 넘어타서 보호하는 설계가 들어갈텐데… “소방당국은 차량이 연석에 충돌한 후 조수석 전면 하부의 배터리팩이 파손되며 불이 난 것으로 추정하고 있다.”,타이드I서울,2023-06-18 15:30:00
1221341,전면하부 어딘가에 위크포인트가 있는 것인지…,타이드I서울,2023-06-18 15:36:00
1221341,그러게요 후속 기사가 궁금한데 안나오나보네요 기사마다 말도 조금씩 다르고..합의를해서 말이 안나오는건지 전기차 화재 기사들은 거의 다 이렇더군요 사망사고 아닌이상 후속기사도 안나오네요,빠뿡I아이오닉5I구리,2023-06-18 17:05:00
1221341,이건 뭐지??? 저거 연석은 말도 안되는거 아닌가요? 보상해주기 싫어서 핑계대는거 같은데,흐미35I전남,2023-06-18 17:24:00
1221341,기사도 이상해요 어디서는 3시간만에 꺼졌다하고 어디서는 40분만에 꺼졌다하고 저 연석이 사진 보이는 그대로라면..보상을 해주지 않았을까요 만약에 안해줬으면 난리를 피워야 한다고 봅니다,빠뿡I아이오닉5I구리,2023-06-18 17:31:00
1221341,흉기라서 믿을수 없어서요 출고하자마자 불량 출고 해놓고도 보상안해주려고 하는 회사라,흐미35I전남,2023-06-18 17:34:00
1221341,음 그쪽분이라서 그런가 수준이 너무 낮네요 중국차 잘 타시길 바래요 ~ 차단박을게요,빠뿡I아이오닉5I구리,2023-06-18 17:45:00
1221341,엥?? ㅋㅋㅋㅋㅋ 웃기네요 급발진이라니 ㅋㅋ,흐미35I전남,2023-06-18 17:47:00
1221341,연석이라서 엄청높은 연석인줄..저거라면 헐.. 그냥 오프로드 좀 튀어나온 돌에도 화재날수 있을듯..,승우짱IEQEI수원,2023-06-18 18:10:00
1221341,요즘 시동꺼지기로 유명한 짱츠네요 이런사람들이 타니까 그런 얘기가 나오는거겠죠 이해됨,빠뿡I아이오닉5I구리,2023-06-18 18:02:00
1221341,ㅋ 화이팅 하세요! 흉기빠님^^본인차 하부 배터리 보면 시껍할듯 ㅎㅎ,승우짱IEQEI수원,2023-06-18 18:05:00
1221341,ㅁ 섭네요,제주애플망고,2023-06-21 07:52:00
1221341,모아놓으니 전기차 구매가 더 망설여지네요 ㅡㅡ;;,막초보ㅣ서울,2023-07-03 08:06:00
1221258,미쿸서 이랬으면 빠르게 대응하겠네요.,크리스l모SYl경기,2023-06-18 08:32:00
1221258,우리나라에선 300명이 저래도 기사는 안날듯 한데,레드Iev6GTLineI안동,2023-06-18 08:34:00
1221258,ㅋㅋㅋ 우리나에서 저러면 운전자 과실이죠 ㅋ,독새Ii4I전주,2023-06-18 08:36:00
1221258,ICCU건인가요?,jieI아이오닉6I서울,2023-06-18 08:51:00
1221258,빼박이죠.,LercyIID4I서울,2023-06-18 10:34:00
1221258,난 또 시력을 상실했나 했네요...,차는풀옵l아6l인천,2023-06-18 08:53:00
1221258,"미국에서도 이슈되서 빨리 리콜하길, 현대 안일한 대처때문에 매일 불안해하면서 타고 있네요",비타오백l아5l울산,2023-06-18 09:26:00
1221258,역시 천조국은 30명의 경험?만으로도 가능한 나라인가봅니다.,네Ii5I세종,2023-06-18 10:08:00
1221258,미국의 조사결과로 조치되고 국내도 적용해야 하는데 그렇게 될지 걱정입니다.,델마IEV6 모3l부천,2023-06-18 10:17:00
1221258,좋은소식이네요 빨리 크게 이슈되서 리콜조치 해야합니다,달마l코나l경기,2023-06-18 10:29:00
1221258,???: 완속 충전기 탓이라구욧!!,LercyIID4I서울,2023-06-18 10:50:00
1221258,우리나라는 적용 안됩니다 한 두번 있는 일도 아닌데요ㅎ,뚱뿐l리프l볼트l경기,2023-06-18 11:08:00
1221258,매번 미국엔 리콜+위로금 이고 한국엔 항의해야 무상수리죠 뭐...,멋진넘I아5니로I동탄,2023-06-18 23:20:00
1221258,터질게 터졌네요. 전 올해 1월에 사고 크게나고 전손처리했는데. 사실 아이오닉5타며 크게 불만은 없었습니다. 사고 당시 뒷차가 박은거 생각하면 근육통 외엔 다진것도 없으니 안전한 차라는것도 입증했고. 아무튼 egmp 다음 플랫폼인 em에서 뭔가 개선된게 나오면 그때 다시 전기차로 돌아가야겠습니다.,미키빠덜l코나l부산,2023-06-18 11:19:00
1221258,플렛폼이 바뀌나요? 나온지 얼마안됬는데요?,달달한쇳물ll서산,2023-06-18 11:42:00
1221258,세단에 최적화된 플랫폼이 나오는걸로 알고있습니다. 승차감을 중시하는 성향이라서요.,미키빠덜l코나l부산,2023-06-18 12:08:00
1221258,헛..egmp오래쓸줄알았는데 범용으로 ㅠㅠ 구형되겠네요,달달한쇳물ll서산,2023-06-18 12:22:00
