"id","title","content","likes","url","author","views","created_at","updated_at"
"6259517","""1억차에 듣보잡 배터리, 내 차도?""…보닛 열어본 운전자들울[3]","요즘같은 경우 반드시 알려줘야 할거 같네요https://v.daum.net/v/20240807104224421이동희 기자2024. 8. 7. 10:42타임톡25음성으로 듣기번역 설정글씨크기 조절하기인쇄하기인천 화재 벤츠에 1위 CATL 아닌 中 '파라시스'…초기물량 대부분 탑재車 하부 깔려 육안 확인 불가 딜러도 몰라…""제품 정보 공개"" 목소리(서울=뉴스1) 이동희 기자 = 인천 서구 청라의 한 아파트 지하주차장에서 발생한 메르세데스-벤츠 전기차 화재로 '전기차 포비아'(공포증)가 급속도로 퍼지고 있다. 해당 차량에 세계 10위권 수준의 중국산 배터리가 탑재된 것으로 확인되면서 소비자의 '배터리 제조사 알 권리'가 필요하다는 지적이 나온다.7일 완성차 업계 등에 따르면 지난 1일 발생한 벤츠 준대형 전기 세단 EQE 화재 사고 이후 온라인 커뮤니티를 중심으로 배터리 공개 정보 요구 목소리가 커지고 있다. 벤츠 전기차 소유주를 중심으로 이뤄진 '메르세데스-벤츠 EQ 클럽'에서는 ""벤츠는 차주에게 배터리 브랜드를 알려줘야 한다""는 게시글을 쉽게 볼 수 있다.이는 이번 사고 차량인 벤츠 EQE에 탑재된 배터리 때문이다. 당초 알려진 세계 1위 배터리 업체인 중국 CATL 배터리가 아닌 중국 '파라시스'(Farasis) 제품인 사실이 지난 5일 국토교통부 조사 결과 확인됐다.파라시스는 지난해 세계 10위로 비교적 덜 알려진 업체다. 게다가 탑재된 파라시스의 니켈·코발트·망간(NCM) 배터리는 2021년 중국에서 화재 위험으로 리콜을 실시해 품질 우려를 키웠다. 중국 배터리사들은 주력제품인 리튬인산철(LFP) 배터리에서는 기술력을 갖춘 것으로 평가받지만 뒤늦게 뛰어든 삼원계(NCM·NCA) 배터리의 경우 배터리 품질에 대한 의구심이 지속돼 왔다.삼원계 배터리는 LFP 배터리보다 비싸고 안정성을 잡기 어렵지만 주행거리가 길고 에너지밀도가 높으며 무게도 상대적으로 가볍기 때문에 기술적 난도가 높다. 업계 관계자는 ""중국 LFP 배터리는 시장에서 (품질이) 어느 정도 입증됐지만 NCM·NCA 배터리는 후발주자""라며 ""배터리 수율 개선에만 천문학적 비용을 쏟는 한국과 달리 중국의 (NCM) 기술력이나 안정성은 업계 내에서도 의문이 많다""고 말했다.이에 소비자들은 ""벤츠가 1억 원이 넘는 차량에 품질이 떨어지는 듣도 보도 못한 배터리를 탑재했다""는 실망감을 쏟아내고 있다. 온라인 커뮤니티에서는 파라시스 배터리를 탑재한 전기차 목록까지 돌고 있다.업계에 따르면 벤츠 모회사인 다임러는 2018년 파라시스와 10년간 170GWh(기가와트시) 규모의 배터리 공급 계약을 체결했다. 2020년에는 벤츠가 파라시스 지분 3%를 인수하며 협력 관계는 더 견고해졌다.벤츠 측은 파라시스 배터리 탑재 차량이 얼마나 많은지 공개하지 않고 있다. 배터리뿐 아니라 모든 부품의 납품처 정보는 밝히지 않는다는 입장이다. 업계에서는 화재가 난 전기차 EQE를 비롯해 EQA EQB 등 다수 모델에서 초기 물량에 파라시스 배터리가 탑재된 것으로 알려지고 있다.벤츠의 한 판매사 딜러는 ""전기차 구매 고객들이 자신의 차량 배터리 제조사를 알려달라는 문의가 이어지고 있다""며 ""딜러 역시 정확한 정보를 가지고 있지 않아 명쾌한 답변을 줄 수 없어 답답한 상황""이라고 토로했다.배터리는 전기차의 핵심 부품이다. 주행거리 등 성능은 물론 안전 측면에서도 그 중요성이 절대적이다. 그런데 벤츠뿐 아니라 전기차 제조사들은 대체로 배터리 용량과 주행거리 등 기본적인 제원 외에 배터리 제조사를 공개하는 데에는 적극적이지 않다.자동차 회사가 알려주지 않는 한 고객이 스스로 배터리 제조사 등의 정보를 확인할 방법은 사실상 없다. 전기차 배터리는 차량 하부에 깔리기 때문에 운전석 앞 보닛을 열어도 제품을 육안으로 확인할 길이 없다.....","1","https://www.bobaedream.co.kr//view?code=strange&No=6259517","잠자르","1,649","2024.08.07 20:03",""
"6259482","전기차 화재 관련 뉴스[5]","한동안 잠잠했던 전기차 화재가 다시 소비자들을 불안하게 만들고 있다. 고급 수입차는 물론 국산 전기차에도 화재가 발생했기 때문이다. 소비자들은 내 차에 탑재된 전기차가 어떤 제품인지 찾아보고 있다. 업계에서는 이번 사건을 계기로 전기차 수요가 다시 둔화될지 여부를 지켜보고 있다.국내외 브랜드 구별 없는 전기차 화재국토교통부에 따르면 지난 1일 오전 인천 서구 청라국제도시 아파트 지하 1층 주차장에서 불이 붙은 메르세데스-벤츠 EQE가 사용한 배터리 셀은 중국 파라시스(孚能科技 Farasis) 제품으로 확인됐다. 지난 2021년 베이징자동차 전기차의 배터리 화재 발생 가능성으로 리콜했던 이력이 있어 불안감이 커지고 있다.메르세데스-벤츠 전기차 화재의 구체적 원인은 밝혀지지 않았다. 제조 불량 분리막 손상 등 원인이 지목되고 있지만 배터리 셀 공급업체의 품질 불량이 원인일 수 있다는 주장이 힘을 얻고 있다.인천에 이어 충남 금산에서도 전기차 화재 사고가 발생했다. 이번에도 주차 중이던 차에서 갑자기 불길이 일어났다. 차이점이라면 이번에는 국산차와 국산 배터리를 쓰는 기아 EV6라는 점이다. 경찰과 소방당국은 배터리 문제로 인한 화재로 추정하고 합동 감식을 진행할 예정이라고 밝혔다.전기차 화재 발생 비율은 내연기관과 비슷... 하지만 주차 중 화재와 피해 금액은 더 커국토교통부의 국내 자동차 등록 현황 통계에 따르면 2023년 12월 기준 전국의 내연기관 차량 누적 등록 대수는 2518만 9000대다. 이를 화재 발생 건수에 대입하면 화재 사고 발생 비율은 0.013%다.전기차의 누적 등록 대수는 54만 4000대로 화재 발생 비율 계산시 0.013%로 내연기관과 동일하다.2021년부터 2023년까지 3년간 차량 화재 발생 장소를 비교하면 내연기관 차량은 주차장이나 공터에서 발생한 화재가 전체의 26%였다. 반면 전기차는 주·정차 중이거나 충전 중에 발생한 화재의 비율이 전체의 48%에 달해 주차된 상태에서 배터리 화재 발생 위험은 큰 것으로 나타났다.피해 규모도 전기차가 더 크다. 한번 불이 붙으면 쉽게 꺼지지 않는 전기차 특성이 원인이다. 2017~2023년 내연기관차는 2만 7231건의 화재로 인해 평균 819만 원의 재산 피해를 냈다.반면 같은 기간 전기차 화재로 인한 재산 피해는 평균 2422만 원으로 3배나 더 컸다. 전기차는 피해액이 1000만 원을 넘는 사고(57%)와 원인 미상 사고 비중(29%)에서도 내연차(15% 13%)를 앞질렀다.소비자 불안 고조... 국토부는 대책 마련 중소방당국이 전기차 화재진압에 나서고 있다=소방청전기차의 연이은 화재 사고로 소비자들의 불안감만 커지고 있다. 벌써 차량별 배터리 제공업체가 어디인지 찾는 소비자들이 빠르게 증가하고 있다.문제는 각 제조사가 차량별 배터리 납품업체를 확인할 수 있는 경로가 매우 제한적이라는 점에 있다. 업체들이 전기차의 성능이나 주행거리 충전 속도와 같은 정보는 공개하지만 배터리셀 공급업체를 대대적으로 홍보하는 경우는 사실상 없기 때문이다.경제협력개발기구(OECD)의 'OECD 다국적 기업 가이드라인'에 따르면 ""기업은 소비자가 정보에 기초한 결정을 내릴 수 있도록 검증 가능하고 명확한 정보를 제공해야 한다""며 'ESG 소비자 선택권'을 명시하고 있다.특히 ""배터리 원산지나 제조회사의 출처를 숨기는 것은 소비자를 오도하는 등 불공정한 표시로서 지양해야 한다""며 ""식별력이 낮은 상표 사용으로 화재 폭발 등 사고가 발생한다면 법적 책임이 따를 수 있다""고 규정하고 있다.국토부는 장기적인 대책을 마련 중이다. 먼저 내년 2월 '전기차 배터리 안전성 인증제'를 도입한다. 제작사들이 전기차 배터리가 안전기준에 적합한지 여부를 국토부 장관의 인증을 받고 제작·판매해야 한다. 또 내년 2월부터 자동차 배터리 식별번호를 차량 등록 시 별도로 등록하도록 하고 운행부터 폐차까지 이력을 관리해야 한다.대기업을 중심으로 전기차 이용 관련 매뉴얼을 개편하는 움직임도 나오고 있다. LG디스플레이는 기존 지하 주차장 내 전기차 충전소 대신 지상에 충전소를 신규 설치할 예정이다. 또 전기차 이용 시 지상에 주차할 것을 권고 중이다. SK하이닉스는 사업장 건물 내에 전기차 충전소를 운영하지 않고 있으며 전기차의 지상 주차장 이용을 권고하고 있다.전기차에 불 나면 보상은 어떻게? 보험업계의 고심... 보험료 인상도?전기차 화재 사고가 연이어 발생하면서 보상은 어떻게 받을 수 있는지 보험료에 영향은 미치지 않을지도 관심받고 있다.전기차는 ‘배터리 열폭주’라는 특성상 온도가 1000°C까지 올라 주변 자동차는 물론 건물까지 심각한 피해를 발생시킨다. 먼저 건물 피해는 화재보험을 통해 자동차 피해는 자차보험을 통해 우선 보상이 이뤄진다. 이후 화재보험·자차보험 보험사는 과실 비율에 따라 자동차 업체나 배터리 제조사에 구상권을 청구한다.문제는 책임 소재를 나눈다는 것이 쉽지 않다는 점이다. 전기차 특성상 한번 불이 붙으면 끄기 쉽지 않고 시간이 지날수록 문제의 원인 자체가 완전히 연소돼 원인 규명을 할 수 없어진다. 여기에 과실 비율이 어떻게 산정되느냐에 따라 배상금 차이가 극명하게 달라져 길고 지루한 법정 다툼으로 이어질 수밖에 없어진다.소방청에 따르면 2021년 24건이던 전기차 화재 사고는 2022년 43건 지난해 72건으로 2년 새 3배로 늘었다. 이 시기 발생한 전기차 화재 139건 중 주차 중 화재는 36건이다. 보험업계 관계자는 “보험료 산정에는 보험금 지급 사유가 발생할 가능성과 지급해야 할 보험금 규모 등이 기본적으로 고려된다”며 “이번과 유사한 사고로 인한 대규모 보험금 지급이 고려된다면 보험료도 당연히 인상 압력을 받을 것”이라고 설명했다.·","0","https://www.bobaedream.co.kr//view?code=strange&No=6259482","assdd","627","2024.08.07 19:04","2024.08.07 19:05"
"2320420","커지는 전기차 불안감···내 차 배터리 업체 찾고 보험금 인상 압박까지[2]","한동안 잠잠했던 전기차 화재가 다시 소비자들을 불안하게 만들고 있다. 고급 수입차는 물론 국산 전기차에도 화재가 발생했기 때문이다. 소비자들은 내 차에 탑재된 전기차가 어떤 제품인지 찾아보고 있다. 업계에서는 이번 사건을 계기로 전기차 수요가 다시 둔화될지 여부를 지켜보고 있다.국내외 브랜드 구별 없는 전기차 화재국토교통부에 따르면 지난 1일 오전 인천 서구 청라국제도시 아파트 지하 1층 주차장에서 불이 붙은 메르세데스-벤츠 EQE가 사용한 배터리 셀은 중국 파라시스(孚能科技 Farasis) 제품으로 확인됐다. 지난 2021년 베이징자동차 전기차의 배터리 화재 발생 가능성으로 리콜했던 이력이 있어 불안감이 커지고 있다.메르세데스-벤츠 전기차 화재의 구체적 원인은 밝혀지지 않았다. 제조 불량 분리막 손상 등 원인이 지목되고 있지만 배터리 셀 공급업체의 품질 불량이 원인일 수 있다는 주장이 힘을 얻고 있다.인천에 이어 충남 금산에서도 전기차 화재 사고가 발생했다. 이번에도 주차 중이던 차에서 갑자기 불길이 일어났다. 차이점이라면 이번에는 국산차와 국산 배터리를 쓰는 기아 EV6라는 점이다. 경찰과 소방당국은 배터리 문제로 인한 화재로 추정하고 합동 감식을 진행할 예정이라고 밝혔다.전기차 화재 발생 비율은 내연기관과 비슷... 하지만 주차 중 화재와 피해 금액은 더 커국토교통부의 국내 자동차 등록 현황 통계에 따르면 2023년 12월 기준 전국의 내연기관 차량 누적 등록 대수는 2518만 9000대다. 이를 화재 발생 건수에 대입하면 화재 사고 발생 비율은 0.013%다.전기차의 누적 등록 대수는 54만 4000대로 화재 발생 비율 계산시 0.013%로 내연기관과 동일하다.2021년부터 2023년까지 3년간 차량 화재 발생 장소를 비교하면 내연기관 차량은 주차장이나 공터에서 발생한 화재가 전체의 26%였다. 반면 전기차는 주·정차 중이거나 충전 중에 발생한 화재의 비율이 전체의 48%에 달해 주차된 상태에서 배터리 화재 발생 위험은 큰 것으로 나타났다.피해 규모도 전기차가 더 크다. 한번 불이 붙으면 쉽게 꺼지지 않는 전기차 특성이 원인이다. 2017~2023년 내연기관차는 2만 7231건의 화재로 인해 평균 819만 원의 재산 피해를 냈다.반면 같은 기간 전기차 화재로 인한 재산 피해는 평균 2422만 원으로 3배나 더 컸다. 전기차는 피해액이 1000만 원을 넘는 사고(57%)와 원인 미상 사고 비중(29%)에서도 내연차(15% 13%)를 앞질렀다.소비자 불안 고조... 국토부는 대책 마련 중소방당국이 전기차 화재진압에 나서고 있다=소방청전기차의 연이은 화재 사고로 소비자들의 불안감만 커지고 있다. 벌써 차량별 배터리 제공업체가 어디인지 찾는 소비자들이 빠르게 증가하고 있다.문제는 각 제조사가 차량별 배터리 납품업체를 확인할 수 있는 경로가 매우 제한적이라는 점에 있다. 업체들이 전기차의 성능이나 주행거리 충전 속도와 같은 정보는 공개하지만 배터리셀 공급업체를 대대적으로 홍보하는 경우는 사실상 없기 때문이다.경제협력개발기구(OECD)의 'OECD 다국적 기업 가이드라인'에 따르면 ""기업은 소비자가 정보에 기초한 결정을 내릴 수 있도록 검증 가능하고 명확한 정보를 제공해야 한다""며 'ESG 소비자 선택권'을 명시하고 있다.특히 ""배터리 원산지나 제조회사의 출처를 숨기는 것은 소비자를 오도하는 등 불공정한 표시로서 지양해야 한다""며 ""식별력이 낮은 상표 사용으로 화재 폭발 등 사고가 발생한다면 법적 책임이 따를 수 있다""고 규정하고 있다.국토부는 장기적인 대책을 마련 중이다. 먼저 내년 2월 '전기차 배터리 안전성 인증제'를 도입한다. 제작사들이 전기차 배터리가 안전기준에 적합한지 여부를 국토부 장관의 인증을 받고 제작·판매해야 한다. 또 내년 2월부터 자동차 배터리 식별번호를 차량 등록 시 별도로 등록하도록 하고 운행부터 폐차까지 이력을 관리해야 한다.대기업을 중심으로 전기차 이용 관련 매뉴얼을 개편하는 움직임도 나오고 있다. LG디스플레이는 기존 지하 주차장 내 전기차 충전소 대신 지상에 충전소를 신규 설치할 예정이다. 또 전기차 이용 시 지상에 주차할 것을 권고 중이다. SK하이닉스는 사업장 건물 내에 전기차 충전소를 운영하지 않고 있으며 전기차의 지상 주차장 이용을 권고하고 있다.전기차에 불 나면 보상은 어떻게? 보험업계의 고심... 보험료 인상도?전기차 화재 사고가 연이어 발생하면서 보상은 어떻게 받을 수 있는지 보험료에 영향은 미치지 않을지도 관심받고 있다.전기차는 ‘배터리 열폭주’라는 특성상 온도가 1000°C까지 올라 주변 자동차는 물론 건물까지 심각한 피해를 발생시킨다. 먼저 건물 피해는 화재보험을 통해 자동차 피해는 자차보험을 통해 우선 보상이 이뤄진다. 이후 화재보험·자차보험 보험사는 과실 비율에 따라 자동차 업체나 배터리 제조사에 구상권을 청구한다.문제는 책임 소재를 나눈다는 것이 쉽지 않다는 점이다. 전기차 특성상 한번 불이 붙으면 끄기 쉽지 않고 시간이 지날수록 문제의 원인 자체가 완전히 연소돼 원인 규명을 할 수 없어진다. 여기에 과실 비율이 어떻게 산정되느냐에 따라 배상금 차이가 극명하게 달라져 길고 지루한 법정 다툼으로 이어질 수밖에 없어진다.소방청에 따르면 2021년 24건이던 전기차 화재 사고는 2022년 43건 지난해 72건으로 2년 새 3배로 늘었다. 이 시기 발생한 전기차 화재 139건 중 주차 중 화재는 36건이다. 보험업계 관계자는 “보험료 산정에는 보험금 지급 사유가 발생할 가능성과 지급해야 할 보험금 규모 등이 기본적으로 고려된다”며 “이번과 유사한 사고로 인한 대규모 보험금 지급이 고려된다면 보험료도 당연히 인상 압력을 받을 것”이라고 설명했다.·","2","https://www.bobaedream.co.kr//view?code=national&No=2320420","호떡왕","433","2024.08.07 18:25",""
"6259377","전기차 폭발 때 스프링클러 왜 먹통?…조사 본격화[5]","(인천=연합뉴스) 김상연 기자 = 인천 아파트 전기차 화재와 관련해 소방 당국이 스프링클러 미작동 원인 조사에 주력하고 있다.인천소방본부는 지난 1일 전기차 화재가 발생한 서구 청라동 아파트 방재실에서 화재 수신기를 확보해 디지털포렌식을 실시 중이라고 7일 밝혔다.화재 수신기는 불이 났을 때 화재 감지기로부터 각종 신호를 받아 로그 기록을 저장하기 때문에 수신기를 통해 스프링클러 작동 관련 기록도 분석할 수 있다.이 아파트 지하주차장 스프링클러는 화재 감지 후 소방 배관에 물이 통하도록 설계된 '준비작동식' 설비로 확인됐다.이 설비는 수조부터 특정 밸브가 설치된 구간까지만 물이 채워져 있고 스프링클러 헤드로 이어지는 나머지 배관은 평소에 비어 있는 형태다.불이 났을 때 2개 이상의 화재 감지기가 작동해야 수문이 열려 물이 공급되고 불길에 헤드가 터지면 소화수가 분출되는 방식이다.주요 배관에 물이 채워져 있지 않아 누수나 동파 위험성은 적지만 감지기나 밸브·제어반 등에 하나라도 문제가 생길 경우 물 공급에 차질이 빚어지는 취약점을 안고 있다.소방 당국은 이런 준비작동식 스프링클러의 특성을 고려해 디지털포렌식 결과를 토대로 설비 임의 조작이나 고장 여부 등 미작동 원인을 규명할 방침이다.소방 당국은 현장 폐쇄회로(CC)TV와 목격자 진술 등을 종합적으로 고려할 때 발화 지점을 중심으로 스프링클러가 작동한 사실이 없다고 판단하고 있다.인천소방본부 관계자는 ""준비작동식 스프링클러는 아무래도 감지기가 연동된 설비다 보니 헤드만 터지면 작동하는 습식 설비와 비교해 기능성 측면에서 차이가 있을 수밖에 없다""고 설명했다.그러면서 ""화재 전후로 기록된 로그 기록이 9만건에 달해 분석하기까지 시간이 꽤 소요될 것 같다""며 ""분석 결과를 토대로 소방법 위반 여부도 함께 조사할 것""이라고 덧붙였다.스프링클러는 전기차 화재 발생 시 불을 완전히 꺼뜨리는 역할을 하진 못하더라도 불길이 확산하거나 주변 온도가 상승하는 것을 억제하는 효과가 있다.인천 전기차 화재 당시 폭발과 함께 순식간에 불길이 퍼진 상황에서 스프링클러가 제 역할을 하지 못해 초기 진화에 실패한 점이 피해 규모를 키웠다는 지적이 주민들 사이에서 나왔다.이번 화재는 지난 1일 오전 인천시 서구 청라국제도시 아파트 지하 1층 주차장에 있던 벤츠 전기차에서 발생했다.이 불로 주민 등 23명이 연기를 마셔 병원으로 옮겨졌고 차량 140여대가 불에 타거나 그을렸다. 또 지하 설비와 배관 등이 녹아 대규모 정전과 단수가 이어졌다.아파트 시공사 측은 전날부터 인천시 안전자문단과 함께 장시간 화재에 노출된 지하주차장을 중심으로 긴급 구조안전진단을 실시 중이다.이밖에 경찰과 국립과학수사연구원은 오는 8일 오전 10시께 발화점으로 지목된 벤츠 차량에 대해 2차 합동감식을 진행할 계획이다.합동감식팀은 지난 5일 1차 감식에서 배터리팩 등 주요 부품을 수거하려 했으나 위험성이 제기돼 분리 작업을 중단했다.goodluck@yna.co.kr....만약 꺼 놓았다면....?아니면 스프링쿨러 설비고장이나 설비자체 문제로 작동안했다면?책임 중 일부는 관리사무소나 소방설비 업체로 갈 수도....","0","https://www.bobaedream.co.kr//view?code=strange&No=6259377","남항부두","686","2024.08.07 17:22",""
"2320381","전기차 화재 배상은 누가 하나요?[12]","1. 벤츠 차주가 먼저 개인 재산(보험이든 뭐든 돈 되는 건 다 팔아야 할 듯)으로선배상(보상)하고 후구상권 청구?2. 아니면 벤츠(딜러사 본사 등등)와 법적 분쟁 후재판 결과에 따라 배상(보상)? 어떻게 될까요...그냥 다 떠나서 걱정이 됩니다.1이든 2이든시간이 상당히 오래 걸릴 거고그 과정에서배상을 해야 하는 입장이든 받아야 하는 입장이든특히나 배상 받아야 하는 입장에서도아파트측에 소송을 걸어야 하나 차주 개인한테 걸어야 하나벤츠사에 걸어야 하나.... 막막하네요.그냥 걱정이 됩니다. 댓글 쓰다가 갑자기 생각이 났는데벤츠사는 불 난 벤츠만 보험이든 뭐든 처리해주고 나머지 불 번진 부분에 대해서는스프링클러 미작동으로아파트 관리사무소나 시공사 물고 늘어지지 않을까 싶습니다. 그러면서 여론에 물타기 법정에서 시간끌기 하지 않을까 하는.... 개인들만 죽어나는....","0","https://www.bobaedream.co.kr//view?code=national&No=2320381","바람의파이터79","482","2024.08.07 15:58","2024.08.07 16:04"
"6259240","벤츠 입장에서 최고의 해피엔딩 시나리오[6]","...현재까지 나온 벤츠 입장을 정리해서 보면 상황이 그렇게 나쁘지는 않아보입니다.아파트 지하주차장 스프링쿨러가 작동 안한게 확실해진 상황에서화재로 인한 피해보상 상당액을 아파트 쪽으로 전가 시킬 수 있게 됐죠.다만 화재원인이 차량이나 배터리 결함으로 인한 것으로 판명된다면벤츠 전기차의 이미지 추락은 피할 수가 없게 되는데이런 경우 조사 결과 '차주의 과실'이 조금이라도 인정된다면이마저도 상쇄 시킬 수 있습니다.벤츠 입장에서는 차주의 과실을 밝히기 위해서 총력을 기울일 것으로 예상됩니다.차량 튜닝 등 외부에서 건드린 흔적 발견 등등..또는 차주에게 직접 딜을 걸 수도 있겠네요.딜 성사 후 아마도 이렇게 입장을 밝힐듯 합니다.▼이번 사건의 경우 차주의 과실로 밝혀졌으나저희 측에서는 책임을 묻지않고차주 책임분까지 보상해 주겠습니다....이로써 벤츠 이미지 업 + 깔끔하게 마무리","7","https://www.bobaedream.co.kr//view?code=strange&No=6259240","다섯가지자아","2,328","2024.08.07 14:56","2024.08.07 14:57"
"6259118","인천 벤츠 전기차 화재 차주 찌라시[278]","   ...이게 사실이라면 벤츠는 이제 한국에서 차를 못 판다고 보면 됨","2,074","https://www.bobaedream.co.kr//view?code=strange&No=6259118","다섯가지자아","140,597","2024.08.07 13:21",""
