id,title,content,likes,url,author,views,created_at,updated_at
1528398,"'전기차 포비아' 커지자…환경부, 안전 규제 강화. 화재예방형 충전기 지원 단가 40만원 ↑","'전기차 포비아' 커지자…환경부, 안전 규제 강화한다화재예방형 충전기 지원 단가 40만원 ↑시험성적서 제출받고, 별도 규격도 마련환경부가 전기차 안전관리 규제를 강화하고 나섰다. 전기차 화재가 늘어남에 따라 각종 인명·재산피해가 속출하고 있어서다. 최근 발생한 인천 청라 아파트 전기차 화재 사고 이후 전기차를 기피하는 조짐까지 나타나고 있다. 환경부는 이 같은 현상이 친환경차 보급에 차질을 줄까 우려하고 있다.5일 환경부에 따르면 최근 정부는 ‘전기차 충전시설 보조금 지침’을 바꾸고 ‘화재예방형 완속충전시설’의 지원단가를 최대 40만원 늘리기로 했다. 7kw 충전기를 기준으로 하면 일반형의 보조금은 140만원이지만, 화재예방형은 180만원으로 올라간다. 화재예방형 충전기에 필요한 전력선통신(PLC) 모뎀의 시장가격이 40만원대임을 고려하면 사업자는 비용부담 없이 화재예방형 기기를 설치할 수 있다. 보조금 추가지원에 따른 총예산은 800억원이다.화재예방형 완속충전시설은 배터리 상태정보를 받아 과충전을 막고, 충전기에서 전송된 데이터를 화재예방에 활용하는 장치다. 환경부는 급속충전기보다 완속충전기의 화재 사고 위험이 크다는 지적에 따라 올해부터 화재예방형 완속충전기를 보급하기로 했다. 급속충전기는 보통 80% 선에서 배터리 충전이 중단되지만, 완속충전기는 100%까지 충전돼 과충전의 위험이 있다.관련 규정도 정비했다. 화재예방형 완속충전시설 사업자는 기기가 제대로 작동하는지 확인하기 위해 시험성적서를 제출해야 한다. 제품을 등록할 때는 별도로 규정한 제품·통신·인증 규격도 준수하도록 했다.환경부가 전기차 안전관리 체계구축에 나선 배경에는 ‘전기차 포비아’가 있다. 전기차 화재가 자주 발생할수록 안전을 우려한 소비자들이 전기차 구매를 꺼릴 수 있기 때문이다. 환경부 관계자는 “전기차 화재가 발생할 때마다 소비자의 부정적 인식이 커지는 게 사실”이라면서 “친환경차 보급 전환에 차질이 생길 수 있기 때문에 해결해야 할 문제”라고 설명했다.전기차에 대한 공포감은 인천 청라지역 화재 사고 이후 더욱 커지고 있다. 지난 1일 청라의 한 아파트 지하 1층에서 충전 중이던 벤츠 전기차에 불이 나자 차량 140여대가 손상되고, 아파트 5개 동 480여가구의 전기가 끊겼다. 그러자 다른 아파트에서 입주민 회의를 열고 전기차를 지상에만 주차하도록 강제하거나, 지하층의 전기차 충전구역을 지상으로 옮기는 방안이 거론되기 시작했다.소방청에 따르면 전기차 보급량이 늘면서 화재도 2021년 24건, 2022년 43건, 지난해 72건으로 해마다 늘고 있다. 재산피해도 3년간 32억5543만원에 이른다. 아직 전기차 화재로 인한 사망자는 없지만 3년간 13명이 다친 것으로 집계됐다.https://n.news.naver.com/article/277/0005455075?sid=101인천 서구 청라 아파트 지하주차장에 전소된 차량들이 늘어서있다. [이미지출처=연합뉴스]",0,https://cafe.naver.com/ca-fe/ArticleRead.nhn?clubid=21771803&page=11&userDisplay=50&inCafeSearch=true&searchBy=0&query=%EB%B2%A4%EC%B8%A0+%ED%99%94%EC%9E%AC&includeAll=&exclude=&include=&exact=&searchdate=2024-08-012024-08-30&media=0&sortBy=date&articleid=1528398&referrerAllArticles=true,톰I서울,"1,447",2024-08-05 12:42:00,
1528372,전기차가 지상고가 낮으면 문제가 될까요?,"현재 지상고가 대체로 낮은 전기차 세단들이 있는데대표적으로 아우디 RS 이트론, 포르쉐 타이칸 등 슈퍼카들이 있고 현대에는 아이오닉 6가 있는데정망 최저 지상고가 낮은 전기차들이 배터리쪽 외부 간섭 영향이 클까요? 궁금합니다",1,https://cafe.naver.com/ca-fe/ArticleRead.nhn?clubid=21771803&page=11&userDisplay=50&inCafeSearch=true&searchBy=0&query=%EB%B2%A4%EC%B8%A0+%ED%99%94%EC%9E%AC&includeAll=&exclude=&include=&exact=&searchdate=2024-08-012024-08-30&media=0&sortBy=date&articleid=1528372&referrerAllArticles=true,하이볼lEV6I경기,623,2024-08-05 12:20:00,
1528361,벤츠는 적어도 현기차보다 화재 보상을 더하겠죠,과거 코나에 탑재된 ncm622 배터리 화재로리콜 결정약 1.4조 현대차 3 엔솔 7 비율로각회사 충당금으로 보상및 리콜진행했죠덕분에 분기 적자 반기적자??하여우리나라 수입차 점유율1위전세계 e클 수출국 1위인벤츠 와 catl프리미엄 브랜드답게적어도 현기차 엔솔보다훨씬 나은 고객응대를 보여줘야할겁니다지켜보시죠,0,https://cafe.naver.com/ca-fe/ArticleRead.nhn?clubid=21771803&page=11&userDisplay=50&inCafeSearch=true&searchBy=0&query=%EB%B2%A4%EC%B8%A0+%ED%99%94%EC%9E%AC&includeAll=&exclude=&include=&exact=&searchdate=2024-08-012024-08-30&media=0&sortBy=date&articleid=1528361&referrerAllArticles=true,순천사랑I닉5모Yl순천,"3,925",2024-08-05 12:11:00,
1528322,전기차차주가 집중해야한것은 주차화재 확산방지대책입니다.,"전기차 지하추자금지에 열폭하는것도 일부 이해는가지만,스프링클러 미작동여부도 중요하지만,사고 당사자 이외 전기차주가 집중해야할것은사흘동안 어떠한 미동이 없었는데 화재가 난것에 대책이 필요하다는것에 집중해야합니다.솔직히 지하에 화재시 아궁이 효과날거라는것은 다 예견했던 문제였습니다.예건은 되었는데 엄두가 안났죠.기존 건축시스템,소방시스템,충전시스템,전기차 인프라등등 손봐야할게 한두개가 아니었으니까요몇년에 한번 날까말까한 사고로 인해 저 수많은 인프라를 손보는것은 근거가 부족했습니다.그러나, 벤츠차주에겐 재앙이지만아무 인명사고없이 몇년에 한번 날까말까한 사고가 발생한것에 집중해서전기차 화재확산 방지대책 인프라를 구축할 명분이 생겼습니다.중국산 배터리,국산 배터리 이런게 중요한거 아닙니다.이미 국산배터리도 화재 무수히 타국가에서 화재났었습니다.그렇다면 국내 업체가 또 몇조에 이르는 배터리 리콜을하는것보단국내업체가 같은 이슈가 나기전에 전기차 화재 확산 방지대책을 구축하는게 맞습니다.중국산이니, 국산이니로 편가르기해봐야 국민들은 아무도 공감안해요지금 핸드폰 보조배터리 전부 중국산 배터리이며,심지어 삼성마크 붙여서 나오는 보조배터리도 중국산입니다.",1,https://cafe.naver.com/ca-fe/ArticleRead.nhn?clubid=21771803&page=11&userDisplay=50&inCafeSearch=true&searchBy=0&query=%EB%B2%A4%EC%B8%A0+%ED%99%94%EC%9E%AC&includeAll=&exclude=&include=&exact=&searchdate=2024-08-012024-08-30&media=0&sortBy=date&articleid=1528322&referrerAllArticles=true,유토피아I볼트EVI수원,481,2024-08-05 11:47:00,
1528300,매일신문보도 링크남겨요! 전기차 화재!,https://youtu.be/_Wj2a4ce-MQ?si=OxBxEqz48yjvOUNk요약변호사가 이야기하길...차주는 차에서 내렸다.전기차는 지하주차장 관련법이 바뀔수도 있나?벤츠가 잘못이냐? 배터리가 잘못이냐?서로 싸우고 길게 갈거 같다..벤츠가 잘못했다고 하여도 스프링쿨러 이야기로관리사무소와 다툼으로 더 길어질수도 있다..?전부팩트인가요?아무쪼록 전기차에 대한시선이 .... 말잇못...,0,https://cafe.naver.com/ca-fe/ArticleRead.nhn?clubid=21771803&page=11&userDisplay=50&inCafeSearch=true&searchBy=0&query=%EB%B2%A4%EC%B8%A0+%ED%99%94%EC%9E%AC&includeAll=&exclude=&include=&exact=&searchdate=2024-08-012024-08-30&media=0&sortBy=date&articleid=1528300&referrerAllArticles=true,빠이남I전북,344,2024-08-05 11:34:00,
