post_id,cmt_content,cmt_author,cmt_created_at
906273,돈이 걸린 문제이기에 쉽게 비난을 할수 없다는건 누굴 비난할 수 없다는건가요? 현대기아?,명탐정l코나I경기,2022-06-22 11:45:00
906273,회사입장에서는 지금 시기에 원가절감을 해서라도 적정가격에 맞추고 싶엇을거고 또 소비자도 중국산을 쎳더라도 이 가격에 이 차가 필요한 분이 분명히 있습니다. 그런 상황에서 이런 정책?을 비난할수는 없다는 뜻입니다. 이런 결정이 성공이냐 실패냐는 나중에 판매량이 나오면 그때 알겠죠,감자농사G,2022-06-22 11:52:00
906273,괜히 저의 댓글로 두분이 언쟁하실 필요없으십니다..,타루카I모델3I아산,2022-06-22 12:05:00
906273,아닙니다. 언쟁이라기보단 토론이죠 ㅎ,감자농사G,2022-06-22 12:08:00
906273,"아무도 목소리를 내지않고 그저 주는대로 받기만 하면 변화는 일어나지 않습니다.제조사의 정책을 비난하는게 아니라, 소비자의 요구사항을 정당하게 요구하고, 기업은 수용하는 태도를 갖춰야할 시기인 것 같습니다.일방적으로 상황이 이러하니 이렇게 됐어 그러니까 그냥 사 라는 식의 방법과배터리 수급의 문제로 이러이러한 선택지가 있으니 고객님이 원하시는 배터리를 선택하실 수 있지만 상황에 따라 대기가 길어질 수 있다.라는 식의 방법 중 어떤 쪽이 소비자를 더 만족시키고 이 상황, 이런 문제에서 설득력이 생기겠습니까?",명탐정l코나I경기,2022-06-22 12:11:00
906273,"소비자가 알아야할 권리, 선택할 권리는 있습니다. 이번 문제는 제조사의 신뢰문제가 가장크네요",타루카I모델3I아산,2022-06-22 12:19:00
906273,"제 생각에도 아마 이번논란 탈출을 위해서구니로EV, 코나EV에서 썼던 최초구매자 평생배터리보증을 도입할것으로 봅니다.",jieI니로I서울,2022-06-22 10:40:00
906273,중고로 구매하는 사람은 고객도 아니다 이런 전략..흑...,명탐정l코나I경기,2022-06-22 10:55:00
906273,안사면 되는게아니죠. 신차 대기가 일년이상 걸리는데요. 그런 약점을 이용해서 소비자를 호구로보는 기아가 나쁜거죠. 돈 오천만원이 애들 눈깔사탕값인가. 니로불매운동이 산불처럼 번져야 정신 차릴라나?,청주n한심한,2022-06-22 10:53:00
906273,ㅋㅋㅋㅋ뉴스 기사에 나온 것 처럼 '일부' 전기차 동호회라고 일부라고 치부되는 마당에..무슨..니로불매운동이..ㅠㅠ,명탐정l코나I경기,2022-06-22 10:55:00
906273,급 공갑 드려요,케니I E하6 I세종,2022-06-22 17:03:00
906273,감사함당 흐흐,명탐정l코나I경기,2022-06-22 17:16:00
906273,아이오닉5 충격으로 3초만에 전소라는데... 중국산 테스트용 배터리 달고다니다 3초반에 터지면 차량 바꿔준들 내가 살아있을까 하는 생각도 듭니다.,비둘기I아이오닉I서울,2022-06-24 12:52:00
906273,ㅎ...그렇네요,명탐정l코나I경기,2022-06-24 13:14:00
906116,잘하셨어요 다른차도많이들어올텐데 더좋은차 구매하시길바랍니다 현기가현기했네요,등돈Ii4I용인,2022-06-22 07:29:00
906116,현기 구매해본적이한번도없지만 제네시스도그렇고 최근엔 그래도 이미지좋았는데 개버릇남못주나봅니다,등돈Ii4I용인,2022-06-22 07:30:00
906116,수출용은 lg라고 하더군요.,귀연 lev6l 부천,2022-06-22 07:31:00
906116,역시 현기가 현기 했네요.. 국내 소비자 호구네요,니이로 전기 ll 화성,2022-06-22 07:32:00
906116,부품변경시 신뢰성검증은 기본이고 아마 협력업체에도 강력하게 요구하는부분일거 같은데 정작 본인들은 안한거 같군요 조용한거보니 문제생기는 부분이 저렇게 제조업체 변경할때 많이 생기죠 본인들이 더 잘 알겁니다,케이엠l아5예약l경기,2022-06-22 07:34:00
906116,안전도 검사는 커녕 가격만 보고 장착시킨거 같네요.,니이로 전기 ll 화성,2022-06-22 07:34:00
906116,언제쯤 차 빨리 나올가요,인성문제있어I대전,2022-06-22 07:34:00
906116,제글 어디에 상품가격 깍아줘야 한다는 말이있죠? 처음 엘지였다가 바꾼이유중 가격 싸게 제시한게 크다는 의미입니다. 그리고 물건팔때 가장 중요한 정보는 원산지 표기가 기본아닌가요? 법이 없다고 이따구로 파는 기아차가 당당한건지 묻고싶네요,니이로 전기 ll 화성,2022-06-22 07:55:00
906116,진짜로 시비는 아니구요.... 모든 제품들이 원가 상승을 이유로 가격을 올릴때가 있기에 불만이 나올수는 있는거 같아요.,춥똥I볼트I서울,2022-06-22 07:58:00
906116,싸게 제시했으니 싸게 구입한거는 사실인거구요. 그사실을 알리는게 카페의 기능인거죠. 기사는 보고 오지도 않았죠? 기사나 보고 댓글 다세요.. 가격깍아달라는 안티선동이라고 몰아가지 말구요. 그런말 한적도 없는데 자기해석 멋대로하지 말구요.,니이로 전기 ll 화성,2022-06-22 08:23:00
906116,구 니로EV에서 신형이 CATL로 바꿨음에도 가격인상이 크죠. 출시가격을 이전 모델에 맞추는 것이 합리적 경영이 아닐까 싶습니다,노웨이브ㅣ경기,2022-06-22 12:08:00
906116,적은글에도 가격얘기 몰아갈때 부터 이상한거 아닌가요? 몰아갈 생각이나 하지말고 배터리는 님이나 공부하세요.,니이로 전기 ll 화성,2022-06-22 14:07:00
906116,계속 기사거리로 뜨고 본인들도 배터리관련 접수를 많이 받는걸 알고 있으면서 아직도 입닫고 살사람은 사라는식의 운영은 정말 실망이네요 catl이 중국이라고 무작정 까는게 아니라 기아의 태도가 문제라는겁니다,대포l계약중l경기,2022-06-22 08:00:00
906116,리튬폴리머 조차도 아니었다니..,청도팬더l볼트e6l대구,2022-06-22 08:04:00
906116,CATL이면.. 괜찮은 베터리 아닌가요??? 베터리 시장 1등으로 알고 있었는데;;,리얼리얼I니로I인천,2022-06-22 08:39:00
906116,인산철이 주력이고 검증됫는데 한국식 삼원계는 시도에서 화재 많이낫엇고 삼원계 도입해서 말이 많은듯,세델l충북,2022-06-22 08:48:00
906116,검증된 배터리가 아니라 니로ev는 안된 배터리를 선택해서 저는 취소결정을 했습니다.,니이로 전기 ll 화성,2022-06-22 09:02:00
906116,베스트셀링카인 니로ev에 중국기업 배터리를 쓰다니ᆢ 충격이네요.,스파트필름l서울,2022-06-22 09:06:00
906116,egmp 가 아니라 테스트 하기에 적합 하다고 판단했을 가능성도 있다고 봅니다. 형제인 구아이오닉을 단종시켰듯 니로도 문제생기면 단종... 그리고 ev00모델 주력 판매 현대가 아이오닉00이 가능한건 구오닉은 문제가 없었고 단지 주행거리만 짧았죠. 불은 코나에서 났기때문에 ㅠ,비둘기I아이오닉I서울,2022-06-22 09:13:00
906116,저도 배터리 사고없어서 니로 예약한건데 catl 이라니... 취소해야겠어요,버플,2022-06-22 09:42:00
906116,수출도 CATL..기본형에 LG 탑재하려고 했으나 코나 화재이슈로 기본형을 미룬거로 들었어요,바나나튀l모델3l경기,2022-06-22 10:24:00
906116,수출 차량도 catl 이란 말씀이신거죠? 지금 취소전화했다가 딜러랑 와이프가 한번더 고심해 보라고 해서 정말 차갑게 생각중입니다..,니이로 전기 ll 화성,2022-06-22 10:28:00
906116,"네, 판단은 개인 몫입니다만 중국산이라는 색안경 때문이라면 다시 생각해보심이 좋을거 같네요벤츠 EQS도 CATL꺼 쓰는데 품질이슈된것 못들었구요..단순히 성능/품질에 대해서 우려라면 다시 생각해 보시는게 좋을거 같고물론 중국을 배척하겠다!!라는 호불호의 문제라면 취소하시는게 맞겠죠",바나나튀l모델3l경기,2022-06-22 10:34:00
906116,중국이라는 제품 믿음이 안가는건 사실입니다. 만약 차만 빨리 나온다면 다른 차를 선택했겠지만 지금 같은 차가 귀한 시국이라 취소정도는 아니고 고심 정도였던 상황에서 처음으로 시도하는 배터리라서 안정성 검증이 안되있다는 기사 내용을 보고 취소결정을 했습니다. 혹시 지금 생산하는 배터리 벤츠도 똑같이 적용되는 모델인지 아시는지요,니이로 전기 ll 화성,2022-06-22 11:07:00
906116,"사양은 다릅니다, 다만 NCM인것은 동일하고 업계에서 케메스트리라고 부르는 소재들은 동일하나 사이즈가 다른거고, 차량 특성에 따라 마이너한 차이들은 있습니다.사실 저도 중국/일본 제품은 배척하는 주의라 취소하신것에 공감합니다.",바나나튀l모델3l경기,2022-06-22 11:20:00
906116,동일한 소재이나 크기만 다르다 정도로 이해하면 되는거지요? 생각지도 않는 배터리 문제라 비교군이 필요하다 생각입니다. 정보감사합니다,니이로 전기 ll 화성,2022-06-22 11:22:00
906116,배터리 성능에 문제 없다고 자신한다면 보증을 늘려주는것도 방법일텐데요,잠티IEQAI서울,2022-06-22 22:38:00
906116,공론화가 되야 할까 말까 하겠죠,니이로 전기 ll 화성,2022-06-22 22:42:00
905758,"멋지십니다. 기회비용이란것도 무시못하죠, 분명 아무렇지않을겁니다.",칸타루Iix3I대구,2022-06-21 18:48:00
905758,일어나지도 않은일 지래짐작 의심하고 불신하기가 싫어서요.... 가장큰이유는 지금타고있는차가 간당간당해서 빨리 바꾸고싶어요 ..ㅋㅋㅋ,변싼체로발견l당진,2022-06-21 18:51:00
905758,진짜 여기서만 이러고 실제로는 다 줄서있는게 아닌가,가솔링,2022-06-21 18:48:00
905758,전 그냥 줄서있어요,깐돌이l니로l강릉,2022-06-21 18:50:00
905758,본인의사가 중요 합니다 주위에 아무리 떠들어봤자 본인이 타고 다니는 차 입니다 전 인수 결정 합니다,다그래I계약중I경북,2022-06-21 18:51:00
905758,,변싼체로발견l당진,2022-06-21 18:52:00
905758,나중일은 나중에 생각하자. 화이팅!!,오궁l니로l인천,2022-06-21 19:02:00
905758,고가의 배터리를 현대기아차가 검증도 없이 사용할까요. 독일 프리미엄 브랜드는 왜 사용할까요. 만약 기술상하자가 있다면 코나 이슈처럼 무상교체가 됩니다.걱정하지 마세요.,수퍼맨아빠IGV60I경남,2022-06-21 19:05:00
905758,".맞아요 저랑 같은 생각 이네요 lg도 코나,볼트에서 불났죠",엘몽이I니로I경기광주,2022-06-21 20:03:00
905758,본인이 필요하면 구매하는거죠^^딴지걸사람도없고요~~빤낭받으세요,유리파파I대전,2022-06-21 19:09:00
905758,"ㅋ ㅋ. 아무렇지도않게 생각하는 나같은사람때문에 현기차가 정신안차리는겁니다, 국내고객을 호구로 생각하는겁니다 등등 이런 댓글 달릴까봐요 ㅋ",변싼체로발견l당진,2022-06-21 19:12:00
905758,저도 호구소리들을까봐 인증도 못하지만...어제 받았는데 너무 잘나가서 놀랐어요ㅎㅎ저처럼 받을사람은 다 받으시는것 같아요.,사랑스런 은지,2022-06-21 19:40:00
905758,딱 제 생각과 일치하셔서 반가운 글이네요!ㅎㅎ 여기 카페는 뭔 이슈 하나만 터지면 이 때다 싶어 물고 뜯는데 실상은 고작 몇 명 취소한 거 가지고 기아는 꿈쩍도 안 합니다. (물론 기아가 잘했다는 건 아닙니다. 배터리에 대해 사전안내 없이 출시한 건 저도 양아치라 생각돼요.) 어쨌든 대기기간이 엄청나기에 더더욱 꿈적도 안 할 겁니다. 실제로 제 담당카마에게 순번 물어보니 전혀 줄어들지 않았고 오히려 늘어났답니다.,자두맛캔디IGV60I용인,2022-06-21 20:03:00
905758,저는 받았어요. 보증이 안되는것도 아니고 연장해서 잘 타려구요!,오늘부터ㅣ쏘울ㅣ인천,2022-06-21 20:08:00
905758,저도 받습니다~ㅎ 보조금과 세금 혜택이 너무 혜자라..,니로당I고흥,2022-06-21 20:44:00
905758,"중국산 배터리??위험한다,불안하다 말도많고..저는 개인택시 운행합니다..전국적으로 신형 니로EV택시 서울에 1대 있고,제가 전국 2번째로 출고 하는걸로 알고 있습니다.어차피 여러분들보다 제가 더많이,더빨리 키로수는 올라 갈거구요..제가 이 카페에서 활동하는동안 이상있는점 있씁 그때그때 올릴게요이런다,저런다 말도 많치만 어차피 우리 생활 거의 대부분에 중국산은 많이 어울러져 있잖아요..근데 다들 쫌 아쉬운 부분이 있어도 먹고,쓰고 했고 지금도 이용하잖아요..긍적적으로 생각할렵니다..전기차 첨 나올때 사는사람 미친놈이라 했습니다(배터리 터진다고)낼 출고합니다",까꿍이 애비I광주,2022-06-21 23:04:00
905758,현대기아가 전기차 구매자들은 개돼지 호구취급하는거지요. 떳떳하면 미리 말을하고 가격도 낮춰야지 지금까지 공식입장 안내놓는게 괴씸하네요. 저는 취소하고 ev6 계약했네요. 지금까지 기다린게 짜증이네요;;,샛별이l남양주,2022-06-22 01:00:00
904870,저같으면; 전동시트옵션 이런게아니라 진짜 중국산배터리 화재날수도잇는데 목숨이 더 중요한거아닐까요?,얌생ㅣ코나ㅣ평택,2022-06-20 22:19:00
904870,정말 난감하네요..한숨만,산오이서울,2022-06-20 22:31:00
904870,저도 너무겁나요,디카 인천,2022-06-20 22:21:00
904870,겁나기보다는 나중에 코나처럼 충전용량80프로 제한 할것같아서요,산오이서울,2022-06-20 22:32:00
904870,니로가 시작일뿐.. 곧 국산 현기차 전부 중국산 배터리 섞어 쓰다가 중국산이 대부분인 수순으로 갈듯...ㅜㅜ 단가싸움엔 장사 없어요 모든 업종이,가가멜I경기,2022-06-20 22:25:00
904870,합리적인 대안도 없으니 더 망설여지네요,산오이서울,2022-06-20 22:35:00
904870,장거리 위주시고 급충 많으시면 EV6 깡통이라도 가는게 낫지 싶네요..,쌍댕파파I모3Yl경기,2022-06-20 22:25:00
904870,ev6 GT LINE도 타고 있답니다.^^ 그냥 깡통 아이오닉도 고민중 입니다,산오이서울,2022-06-20 22:36:00
904870,중고차 팔때 생각해보면...국산배터리 중고살래? 중국산 배터리 중고살래? 저라면 니로 구형 국산배터리 살것 같은데요...,고고고I볼트EVI서울,2022-06-20 22:29:00
904870,저두요ㅜ,디카 인천,2022-06-20 22:30:00
904870,나중에 판매가 결정 요인중 하나가 될듯 하네요.,산오이서울,2022-06-20 22:37:00
904870,저두요..,숨은공간찿기,2022-06-20 23:10:00
904870,지인ev6넘좋더라구요 ㅠ,디카 인천,2022-06-20 22:29:00
904870,EV도 좋은데 하나더 영입 하려다가 출고당일 이런 이슈가 발생되네요.,산오이서울,2022-06-20 22:37:00
904870,무조건 취소합니다. 그리고 저도 예약도있는거 내일 취소전화 하려구요,샛별이l남양주,2022-06-20 22:31:00
904870,오락가락 하고 있답니다ㅜㅜ,산오이서울,2022-06-20 22:38:00
904870,당장 차가 필요하지 않으면 전 포기 합니다!,보리 대구,2022-06-20 22:32:00
904870,좋은 의견 감사합니다.,산오이서울,2022-06-20 22:38:00
904870,저랑 같은 고민 하시네요ㅠ 전 아직 멀었지만 고민만 열심히 하고 있습니다~ㅎㅎ,사케라또l서울,2022-06-20 22:36:00
904870,하필 오늘...심지어 아침에 추가 서류 준비 다했는데,산오이서울,2022-06-20 22:38:00
904870,신뢰가 깨진차. 중고차값 방어 안될겁니다. 전 그래서 취소했습니다. 한두가지어야지요. 중국산 배터리쓴 것도 문제이지만 배터리에 대한 오라카락 이정도면 대충만든차 아닌가싶내요. 완전 사기수준이죠.,미래에너지I경북,2022-06-20 22:38:00
904870,코나처럼 될듯 하기도 합니다.,산오이서울,2022-06-20 22:39:00
904870,취소한다에 많은 의견이.,산오이서울,2022-06-20 22:41:00
904870,찜찜하면 취소추천요... 차 사는데 처음부터 고민이면 접는게 맞다고 봅니다.,부엉이l모델3l세종,2022-06-21 07:01:00
904870,저라면 받아요 벤츠도 그밧데리 쓰는건 아시죠?,유강호I쏘부 아5I일산,2022-06-21 08:07:00
904075,위치상으로는 배터리 뒤쪽 닿은 듯 합니다 ...,옥고I쏘부I부산,2022-06-20 09:00:00
904075,네 배터리에 걸렸어요ㅠ,이건뭐니l니로evl양산,2022-06-20 09:01:00
904075,와 죠졌다...,명탐정l코나I경기,2022-06-20 09:06:00
904075,ㅠㅠ,이건뭐니l니로evl양산,2022-06-20 09:07:00
904075,아니 근데 니로나 코나ev는 딱보면 차체 밑으로 배터리가 나와있어서 불안해보이긴하는데...이럴수가..이건..앞뒤로 견인해서 빼면 빼박 손상인데..,명탐정l코나I경기,2022-06-20 09:08:00
904075,렉카로 들어야겟는데요. 며칠전 테슬라 돌에 배터리 손상되서 1500인가 견적 나왓다던데 조심하셔야 할듯. 저는 그래서 자갈밭 안가요 ㄷ ㄷ ㄷ,션볼로I코나I성남,2022-06-20 09:06:00
904075,ㅠㅠ 일단 시동끄고 불렀어요 느낌이 쎄한대,이건뭐니l니로evl양산,2022-06-20 09:08:00
904075,배터리팩 아니고 배터리팩 냉각수 호스 파손이죠. 근데 노출되서 쉽게 파손된거다. 와 수리를 assy 로 한다고 해서 수리비가 엄청나게 나와서 논란이었죠.,낡은기어I볼트EVI수원,2022-06-20 17:31:00
904075,렉카밑부분안상하게 위로 들어야할꺼같은데요,KiNIGV60I청주,2022-06-20 09:09:00
904075,차들어내고 기아가봐야겠네요ㅠ,이건뭐니l니로evl양산,2022-06-20 09:10:00
904075,아~~~~차량 살짝 들어서 빼야 할거 같은데요.ㅠㅠ사업소 한번 들어가 보세요,아트라스I모델3I울산,2022-06-20 09:12:00
904075,그래야겠네요ㅠ,이건뭐니l니로evl양산,2022-06-20 09:14:00
904075,배터리에 충격갔으면 화재 위험도 조심하셔야될듯 합니다,메테우스l충남,2022-06-20 09:34:00
904075,일단은 차빼서 운행되는데 서비스 한번 가 볼려구요,이건뭐니l니로evl양산,2022-06-20 09:59:00
904075,꼭 점검받으세요 혹시모르니…,메테우스l충남,2022-06-20 10:56:00
904075,이번거 사고보고나니 이러면 불안함 ㅜㅜ 조심해서 잘 빼셨나여,조나탄I수원,2022-06-20 09:46:00
904075,넵 다행이도 윈지로 땡겨서 뺐어요 지금 서비스 가 볼려구오ㅡ,이건뭐니l니로evl양산,2022-06-20 10:00:00
904075,그래도 확 지나간게 아니라 다행인 !!,꼬북I아이오닉5I청주,2022-06-24 13:31:00
903852,제가 관심을 가진 18년도에도 전기차 인기는 뜨거웠습니다. 코나 9개월 걸려서 받았어요. 매년 급성장 하고 있었는데 고유가시대라 더욱더 관심 받는 거 같아요. 유가 안정 돼도 전기차 인기는 식지 않을것입니다.,포스I코나I남양주,2022-06-19 21:22:00
903852,18년도에도 그랬군요~ 그당시때쯤에 넥쏘를 평창에서 처음보고 혁신적이고 대세로 자리잡을줄 알았는데 실상은 인프라도 어려운 사정이 되버렸네요~,퍼커I수원,2022-06-19 21:28:00
903852,https://www.hyundai.co.kr/news/CONT0000000000031156 우리나라 최대 자동차 기업의 계획을 보시면 2030년까지 연 323만대니까 절반은 전기차로 바꿀 모양입니다. 제네시스는 25년부터 전기차만 판매하구요,오아식스I니로I제주,2022-06-19 21:38:00
903852,네하이브리드+순수 전기차 시대겠죠,술쟁이I볼트EVI양산,2022-06-19 21:29:00
903852,지금 기름값오르기전부터 못사서 난리였어요,분바l조에l창원,2022-06-19 21:29:00
903852,곧있음 내연기관 차들이 모두 단종되지 않을까요?,서회장IQ4I양주,2022-06-19 21:31:00
903852,"당연하죠, 고로 전기차 관련 주식은 사서 2030년에 파시면 됩니다무조건 전기차 시대로 갑니다",겸둥이I아이오닉I인천,2022-06-19 21:33:00
903852,탈원전 난리쳐서 블랙아웃 발생하지 않을지 걱정입니다.,찐전기IGV60IEV6I당진,2022-06-19 22:01:00
903852,멀쩡한 원전 멈춘건 없는데요... 몇년 사이 블랙아웃이 있었나요??? 전기차 늘어난다고 블랙아웃 안생겨요..,낡은기어I볼트EVI수원,2022-06-19 22:13:00
903852,내연차회사들 나중에 전기차안말들면 벌금뚜들겨맞아요 시대흐름이에요 스마트폰처럼요,박곰 니로ev 천안,2022-06-19 22:18:00
903852,"요즘 4-5년 앞도 예측하기 어려운 시대입니다. 과연 누가 다시 고금리 시대가 도래하고, 인력난의 시대가 오고, 세계화가 무너지고 보호무역주의로 돌아갈지 알았겠습니까... 저도 지금봐서는 전기차가 대세로 갈 것이다라고 생각하긴 하지만, 한편으로는 배터리 수명문제, SOH가 떨어지면서 발생하는 화재문제로 한순간에 전기차가 나락으로 떨어질수도 있다고 생각합니다. 환경부에서도 전기차 수명이 10년이고, 그 이후에는 효율도 급락하고 화재발생위험도 올라간다고 합니다. 지금 60kwh급의 전기차가 출고된지 5년정도 밖에 안됐습니다.... 전기차 화재가 사회문제로 대두되면 전기차 입지 자체가 흔들릴것입니다. 이 뿐만아니라 리튬공급망을 장악하고 있는 중국문제도 있어 한순간에 경유차처럼 훅 갈 수도 있다고 생각합니다. 사실, 전기차가 알고보면 친환경적이지도 않습니다. 지금도 전기차 생산, 사용, 폐기 등 전 과정을 고려하면 내연기관차 대비 30~70% 이산화탄소를 배출합니다 특히나 미국에서 요즘 팔리고 있는 바이오에탄올과 비교하면 차이가 더 커지죠... 이런것도 위와 같은 이유 혹은 또다른 이유로 몰락의 시대가 도래하면 환경문제도 대두되어 '경유차는 클린디젤이 아니었다.'처럼 '전기차에게 뒤통수 맞았다' 식으로 여론이 싹 바뀔수도 있죠",Cold HKl 볼트l서울,2022-06-20 19:35:00
903852,흐름에 맞춰 가겟죠 완벽한 대체는 안될거같구요..,그릿l타이칸l서울,2022-06-20 08:11:00
903232,헐~ 중국산 배터리라니... ㅡㅡ,대멀총각I니로l충남,2022-06-18 22:16:00
903232,catl무시할 회사가 아닐텐데요 세계판매량어마어마할텐데요 성능상은 문제될것이 없을것으로 보입니다 국내기업꺼 사용하면 더 좋았겠지만요,깐돌이l니로l강릉,2022-06-18 22:19:00
903232,성능은 떨어집니다. 인산철이 가격은 약간 낮아요. 구매 전략으로 취해본 것 같아요.,인오션I니로I서울,2022-06-19 00:40:00
903232,인산철이 폭발화재에 보다 안전한걸로 알아여 그렇다면 전 주행거리보다 안전쪽으로 생각하렵니다,깐돌이l니로l강릉,2022-06-19 00:51:00
903232,이번 니로는 인산철 안써요 ㅋㅋ,황도I예정I대전,2022-06-19 01:38:00
903232,뭐든 신경안써요 6월중 출고되면 인수 넘어가면 취소하려 맘먹었어요 ㅜㅜ,깐돌이l니로l강릉,2022-06-19 01:39:00
903232,흠... catl배터리? 가 어떤 회사인지 어떤배터리를 만드는지 좀 더 알려주었으면 좋았을텐데,첵스와후르트링,2022-06-18 22:20:00
903232,인산철 기술력 알아주죠. 화재걱정 없고요.,아리i아이오닉5i전북,2022-06-18 22:24:00
903232,테슬라 등에 납품하고 세계 1위 회사입니다,쭉돌이l니로l대구,2022-06-18 22:24:00
903232,그런가요?? 감사합니다 불 덜난다고 얼핏 들었던거같은데 맞나요??,첵스와후르트링,2022-06-18 22:27:00
903232,CATL이 리튬인산철 많이 팔아서 이득을 봤지만 리튬이온은 주력이 아니었죠. 최근에 리튬이온도 키우겠다고 한것이고 각 제조사마다 동일 리튬이온이라도 특성이 다릅니다. 그래서 겨울철 주행거리가 줄어든듯 보이네요. 테슬라 모델3도 LG셀이나 파나소닉셀이냐에 따라 저온에서의 출력 특성이 다르죠.,죠리뿅IMODEL3I서울,2022-06-18 22:35:00
903232,헐... 저온주행거리문제가 저것때문이였던거였나요?? 히터로직이 아닌거네요..?,첵스와후르트링,2022-06-18 22:37:00
903232,히터와는 전혀 상관없을겁니다. 그동안 만들어놓은 로직을 돈 시간 들여 바꿀이유도 없기 때문이죠.,죠리뿅IMODEL3I서울,2022-06-18 22:37:00
903232,아 왠지 유투브보니까 히터온도가 27도밖에 안올라간다고 그러더라구요 의아했는데... 차 나오면 취소시켜야겠는데요 ㅠㅠ,첵스와후르트링,2022-06-18 22:38:00
903232,국내 거의 모든 전기차가 최대 히터 온도가 27도 입니다. 일부 차종이 28도 정도 있는 수준이구요. 27도가 진짜 27도만 되는게 아니라 27도로 실내 온도를 빨리 올리기 위해 더 높은 온도를 내게끔 합니다.,죠리뿅IMODEL3I서울,2022-06-18 22:41:00
903232,니로ev 저온 주행거리는 히터가 아니라 배터리 자체가 그런걸지도 모르겠네오,우주사과i니로i대전,2022-06-18 22:47:00
903232,아무래도 앞서 말했듯 동일 리튬이온 배터리라도 제조사 마다 특성이 달라서 그럴 가망성이 높을듯 합니다.,죠리뿅IMODEL3I서울,2022-06-18 22:48:00
903232,저온 주행 거리 짧고 무거워요 수명도 짧구요. 싼 차니까 가격을 낮추어 보려고 시도한 것 같은데 성공할지는 모르겠네요.,인오션I니로I서울,2022-06-19 00:39:00
