"id","title","content","likes","url","author","views","created_at","updated_at"
"2397092","너무 비참함에 죽고싶습니다ㅜㅜ 억울해요..[429]","  너무 답답하고 하소연 할 곳이 없어 여기 올립니다.저는 부산 모처에서 미용실을 운영중입니다. 오픈한지 2년 중에  여러 일이 있었지만 이렇게 어이없고 사람 미치게 하는 일이 생긴건 난생 처음 입니다!! 3월 1일 샴푸실  전동의자에서 작은 불꽃이 튀어 작은 화재가 발생하였습니다. 그때 컷트후 샴푸 중이었습니다. 탄내가 나서 샴푸하시던 손님 얼른 마무리하고 샴푸실 밖으로 이동 시키고 전기차단후  작은불꽃이 있는 전동의자 하단에 얼른 소화기로 진화시키고  119를 불러 화재신고후 손님께 거듭 사죄의 말을 드리고 계산해드렸고 손님은 괜찮다며 웃으며 나가셨습니다. 첫방문손님이어서 더 고개를 숙여야했습니다ㅜ  몇분후 소방서에서 여러 소방관들이 도착하신후 화재상황을 조사해야해서 정신없이 여기저기 왔다갔다 하는중에  10분이 지났나 아까 컷트한 고객이랑 어머니가 같이 오셔서 갑자기 버럭 하며 내 아들 바지 왜이렇게 만들었냐며 새바지 사달라면서 갑자기 떼쓰기 시작했습니다. 아들은 20대 초반에 다큰 성인이었는데 엄마라는 사람이 동네 방네 큰 소리 치는데 ㅜㅜ  미치겠는겁니다. 알고 보니 검은 바지에 소화기 가루가 묻어있었습니다.   일단 큰소란을 잠재우자 싶어서 바지 가져오면 드라이 크리닝해드린다고 말하고는 겨우 보냈습니다.  옆에 있던 소방관께서 소화기분말가루는  물세탁 만  해도충분히 지워진다고  말씀하셨어요.  그런데 위아래 옷 전부를 아들이 가져오더군요 ㅡㅡ  전화해서  윗옷은 이상 없어서 세탁은 못해드리며 원래 바지세탁만 원하지 않았냐   그것만 해준다고   했더니 고성을 지르며  새바지 타령을 또 하는겁니다ㅜ 안그래도 화재때문에 정신없는  와중에 이런 사람까지ㅡㅡ 진짜 짜증이  치밀어 올랐습니다. 그래도 또 할수없이  둘다 세탁소 맡기고 문자 보내고 끝이났다 생각했어요.  그날  오후 5시 쯤 넘어서인가 남편을 대동하고  또  와서 난리를 치기 시작하더군요.   청소거리는 산더미에 바닥은엉망이고   제가 제발 가달라고 몇번을 말했습니다. 근데 작정을 하고 온건지테이블을  탕탕치면서 않아서 안가는겁니다ㅡㅡ  이동네에서 장사도 못하게 해주겠다 협박하고... 진짜  왜이러는건지ㅡㅡ   결국 경찰을불렀어요.경찰이 있는중에도 큰소리 치면서  하지도 않은 욕을 했다하질 않나  아들이 정신적 충격을 받아서 침대에 누워있다면서 보상을 어떻할거냐면서 협박을 하질 않나ㅜ 아...  진짜 내가왜 이런일을 격는건지... 근데 경찰은 도움이 전혀 되질않더군요.... 실랑이 끝에  그아주머니가 밀치는 바람에 쿵소리를 내며 넘어지고 말았습니다.  허리에 통증이 오는걸 꾹 참았습니다.근데 엄살부리냐며  막말하고는 가더라구요 진심 욕이 치밀어 올랐습니다  도저히 못참겠어서  경찰에 업무방해 폭행으로고소했습니다ㅡㅡ   사람을 완전  핫바지로 본건지 참을 수 없었습니다.진단서 끊어서 제출하고 조서도 작성했습니다. 시간도 많이 걸리더라구요. 일하는데 피해가 너무 컸습니다.  그래서 합의할 생각 추호도 없다  했죠.왜냐면 사과를 한적이 한번도 없었습니다.  그러고는 신경을 쓰지않고 있었습니다. 그런데...  9월 2일  법원에서 뭔가 날라왔습니다 뭔가 자세히 보니... 민사소송이었습니다  뭔 날벼락인지ㅡㅡ  상대는 3월 1일 그때 컷트 손님이었어요 그때 화재로 인해 정신적 충격이 커서 손해배상하라는 식이었죠. 아.. 무려 천만원을 달랍니다.ㅡㅡ 그런사람이 군복무 중이고....  아픈사람이  군복무가 가승합니까?    진짜 불이 나서 그을려서 화상이라도 입었으면  저는 살인자가 되었겠네요ㅡㅡ  사람 엿맥이면서 되지도 않은 소리 하니 ㅡㅡ 미칠것 같았습니다.  변호사 대동하고 소장을 날렸더라구요ㅜ   진짜 너무 비참합니다. 손해는 내가 봤는데 오히려 상대방이 저렇게 나올줄 상상도 못해봤습니다.   진짜 상식적으로 이해가 너무 안갑니다. 이사람들 왜 이러는걸까요?  안그래도 코로나 영향으로 힘들어죽겠는데 ㅜ  아 진짜 죽고싶네요.  이젠 단골 손님 외엔 받지도 못하겠습니다...........  끝이 안나는 싸움을 하는것 같아요.첫 오픈때  인테리어 사기당해서 그때도 힘들었는데 또 이런일이 생기다니... 삶에 회의가 드네요 세상에  이런일이 저한테 생긴게 저한테는 지옥 같습니다.  일도  무섭고 사람도 무섭고  머리가 너무 아프네요....  또다른 자영업 하는 피해자가 안생기길 도와주세요...    ","1,020","https://www.bobaedream.co.kr//view?code=freeb&No=2397092","zang0a","78,468","2021.09.03 14:24",""
"2386797","민주당 국회의원 나리들~~~","요즘 방송이나 뉴스등의 토론에서 연일 국짐당 애들한테처 발리고 다니느라 욕본다. 180석 갖고도 찐따짓 하는라~~~뉴스토론 들어보면 성일종 김재원 이런 애들하고 토론 할때 보면 국짐당에서 현정부의 무능이니 실정이니 경제폭망이니국제적 망신이니 등등 개소리 씨부릴 때 아주 선비 납셨더라.그것도 아주 씹선비 질 하느라.......욕보더라......이명박근혜 10년동안 말아 처먹은 무능 실정 경제폭망 국제적망신등등 이제 절반정도 본 궤도에 올려 놓은 말 한마디 못하냐?오늘 아침에도 성일종이가 좃나게 쿠팡 화재 하고 세월호 참사하고비교 해 대면서 이재명 지사 깔때 강훈식이가 고작 한다는 말이비교할 걸 비교 하라면서 10분동안 처 발리는데 듣는내내 기가차고코가 막히더라......맨날 고따위 교회오빠같은 소리 지꺼리니까 국짐이 버러지들이 기고만장 해 있는 것이다.사람이 아닌것들 한테는 사람대접을 해 주지 말아야 한다.....씨발롬들아. ","0","https://www.bobaedream.co.kr//view?code=freeb&No=2386797","blackjjo","281","2021.08.23 13:41",""
"2065837","역시 엘지 배터리가 문제일까요?[8]"," Id3가 엘지 배터리를 썼다던데 이번 네덜란드에서 일어난 id3 화재사건을 보면서 그거에 대해서 곰곰히 생각하게 됩니다. 코나ev도 불나고 볼트ev도 불나고 일렉시티도 불나고 이번에 일어난 id3까지 다 엘지제 배터리인데... 근데 이거는 한 건만 이렇게 보고되었기 때문에 엘지베터리때문에 불났다 라고 확실히 단정지을 수 없을 거 같아요. 차량 자체에서 문제가 일어날 수 있는 가능성도 배제할 수 없으니까 말이죠.다만 우리가 엘지 배터리가 문제라고 보는 이유는 그동안 엘지 배터리를 단 차량에서 불이 많이 났기 때문에 그렇게 추측하는 거지 확실히 단정짓기는? 살짝 좀 이를 것 같다는 저의 판단입니다.","0","https://www.bobaedream.co.kr//view?code=national&No=2065837","고등어임","1,096","2021.08.22 20:12",""
"2061805","솔까말, 인류 종말의 시작이 시작된 게 아닌가 싶어.[7]","솔까말 코로나 사태는 상징적인 이벤트 같은 느낌이고. '온실가스 배출로 인한 기후변화' 로 인류 종말 프로젝트가 어쩌면 이미 시작됐을 수도 있겠다는 느낌이 들어.  남유럽 미국 서부 시베리아 화재 난 거 봐라. 이거. 정말 뭔가 시작된 거 같다는 느낌이 확 들지.  정말 무서운 건 우리가 아무리 탄소배출 제로로 만든다 해도 ( 그것도 거의 현실 불가능한 계획이지만 )  이미 tipping point 를 넘어선 것이라면 자연 생태계 스스로 온실가스를 다량 배출해서 파괴적인 기후변화를 피하기 어렵다는 거지.  지금도 이 난리인데 20~30년 뒤에 어떨 지 생각해보라구.    ","3","https://www.bobaedream.co.kr//view?code=national&No=2061805","뽕돌이2","624","2021.08.10 00:00",""
"2367864","현대차 에서 제 차를 안 돌려주면 횡령 맞죠?[4]","   7월1일 화재난 코나....   7월5일 1차 화재감식 하고  그 이후에 화재조사 진척이 없는거 같고 보상 대신 자차보험으로 처리하려고    7월29일 폐차를 결정 했습니다. 그리고 폐차 진행 해주겠다고 현대고객팀장이 이야기 했고 관련 서류 주겠다고 했습니다.      8월2일 지인으로부터 박병일 명장 연락처를 얻었고 연락을 통해 명장님께 제 차좀 봐달라고 사정을 해서 어렵게 수락을 받았습니다.   8월3일  박병일 명장님 주소로 차 보내줄것을 현대에 요청 했는데..요청 했는데...ㅠㅠ      현대 왈 : 화재 조사중이라 못 보내드립니다.   차주 왈 : 내가 내돈 주고 구매한거니까 내껀데 왜 안 주냐..   현대 왈 : 조사가 안 끝났다.   차주 왈 : 소방서는 화재조사 끝났으니 현대는 조사 안해도 된다. 내 물건 내놔라.   현대 왈 : 만나서 이야기 하자...   차주 왈 : 차 보내고 만나자.......   .....   결론 없이 20분 이상 전화통화 함         이거 횡령 아닌가요?","9","https://www.bobaedream.co.kr//view?code=freeb&No=2367864","toangel79","758","2021.08.05 12:27",""
"2361570","불난 전기차 코나... 화재조사만 1개월째 ...[6]"," 7월1일 어느 한 아파트아침6시경 자명종이 울리듯 화재경보 사이렌이 울려 댄지 벌써 1 개월이 지나가려고 합니다. 현대차는 화재조사를 총괄하겠다고 나섰지만 7월 5일 단 한차례 화재 감식을 하다가 완충된 밧데리에 겁 먹고 화재감식을 중단 했습니다.그리고 7월30일 지금까지 화재 감식을 진행하지 않고 있습니다. 이유는 휴가철이라서~~휴가철이라서 화재조사를 못하고 있습니다. 보상은? 명분없는 보상이 안된다고 합니다.화재조사가 끝나야 보상 해줄수 있다고 합니다. 열 받아서 화재 조사 중지하고 폐차 하겠다고 했더니폐차하면 화재보상 해드리기 어렵다고 했습니다.저는 협박처럼 느껴졌습니다 잠시후 현대측은 말을 바꿔 선 보상을 해줄수 있다고 합니다그리고 화재조사를 마무리 하고 싶다고 합니다 결론.. 대한민국 대기업에 이런 회사도 있습니다. 화재 발생한지 1개월이 지났지만 화재조사를 미루고 휴가철이라서 화재 조사를 못 끝냈다라는 이유로 피해 고객(불난 코나 차주)에게 보상을 해지 않기 위해 변명만 늘어놓고말바꾸기로 불난 코나 차주를 두번 이상 열 받게 합니다. 대한민국 화재 조사 기간이 1개월이상 걸리나요?","5","https://www.bobaedream.co.kr//view?code=freeb&No=2361570","toangel79","364","2021.07.30 07:57",""
