"id","title","content","likes","url","author","views","created_at","updated_at"
"4186095","이번 코나 화재로[3]","Lg 화학 배터리쪽 문제라 될 가능성이 무지 높아졌네요 코나도 불나고 볼트도 불나고  bms  업데이트로  과충전 과방전  민감도 대폭적 조종까히 했는데 화재가 났다는건 배터리쪽 문제 같습니다 ","1","https://www.bobaedream.co.kr//view?code=strange&No=4186095","분닥세인트","977","2021.01.26 16:52",""
"4185200","현대차 ""코나 전기차 화재 차량 접근 불가...경찰 수사 후 가능[3]"," 현대자동차가 23일 대구 달서구에서 발생한 코나 전기차(EV) 화재 사고 차량에 아직 접근조차 못 한 것으로 나타났다.현대차 관계자는 25일 “아직 내부적으로 화재 사고 차량을 접근할 수 없는 상황”이라며 “경찰 수사 방향이 결정되고 나면 자체적으로 차량에 접근해 화재 사고 원인 등을 파악할 수 있다”고 설명했다.일부 매체 보도에 따르면 현대차는 25일 코나 전기차 1차 화재 사고 원인 발표를 할 것이라는 예측이 나왔다. 하지만 경찰 수사 방향이 아직 나오지 않으면서 현대차의 사고 원인 조사 발표는 시일이 걸릴 전망된다.코나 전기차는 23일 오후 4시 11분께 대구 달서구 한 택시회사 앞 전기차 급속충전장소에서 발생됐다. 화재 사고는 충전 도중에 발생했고 지나간 시민이 화재 사고를 목격한 후 차량 충전구와 연결된 충전기를 뺀 것으로 나타났다.화재 사고가 난 코나 전기차는 지난해 12월 리콜 조치를 받은 것으로 대구 달서소방서 화재조사 결과 나타났다. 현대차는 지난해 10월부터 코나 전기차 화재 사고 방지를 위해 배터리 관리 시스템(BMS) 업데이트를 진행하는 리콜을 시작한 바 있다.","9","https://www.bobaedream.co.kr//view?code=strange&No=4185200","투카티1199S","1,330","2021.01.26 08:44",""
"4182535","PC방 주인들 울린 도둑 검거..집에서 나온 부품들"," [뉴스데스크] ◀ 앵커 ▶그런데 이렇게 모두가 힘든 시기에 이걸 노리고 범죄를 저지르는 나쁜 사람들이 있다고 합니다.보통 24시간 운영하는 PC방들이 요즘 코로나 방역 조치로 밤 9시면 문을 닫고 있는데요.새벽 시간에 이렇게 문을 닫은 PC방들을 돌면서 비싼 컴퓨터 부품들을 훔친 사람이 경찰에 붙잡혔습니다.윤상문 기자가 보도합니다.◀ 리포트 ▶경기도 부천의 한 원룸 건물.어제 저녁 8시 반쯤 이곳에 살던 한 남성이 경찰에 붙잡혔습니다.최근 경기도 곳곳의 PC방에 침입해 컴퓨터를 해체하고 고가의 부품을 털어 간 혐의를 받는 55살 남성 A씨입니다.[경찰 관계자] ""(집 안에) 컴퓨터 관련 부품들이 있긴 있었습니다. 절도 피해품으로 추정되는 것들…""최근 두 달 사이 이렇게 털린 PC방들만 6곳으로 피해 금액은 1억 원이 넘습니다.코로나19 방역 조기로 PC방 영업이 제한된 새벽 시간에 범행은 이뤄졌습니다.[PC방 사장/경기 양주(지난 19일)] ""저희가 코로나가 아니었으면 문을 닫을 시간이 없잖아요. 24시간 돌아가니까…""경기도 양주와 파주 부천 등 경기도 곳곳에서 비슷한 피해가 잇따랐는데 경찰은 모두 A씨가 저지른 범행으로 보고 있습니다.경찰 관계자는 ""CCTV 상의 용모나 침입해 절도를 저지른 뒤 현장에 빈 음료수 병을 남기는 등 범행 수법이 유사하다""며 추가 범행이 있는지 계속 조사할 예정이라고 밝혔습니다.경찰은 A씨에 대해 구속영장을 신청할 예정입니다.철판이 심하게 구부러지고 강한 불길에 창문도 다 녹아내렸습니다.오늘 새벽 2시 반쯤 경남 밀양의 한 과수원에 있는 간이 주택에서 불이 났습니다.불은 50여 분 만에 꺼졌는데 집 안에서는 70대 남성 등 2명이 숨진 채 발견됐습니다.이 중 한 명의 시신은 심하게 훼손돼 아직까지 신원이 확인되지 않고 있습니다.경찰은 부검을 통해 숨진 사람의 신원을 밝히는 한편 국과수 합동 감식을 통해 정확한 화재 원인을 조사할 예정입니다.어제 오후 경남 거제시 주변 해상에서 침몰한 대형어선 '127대양호'의 실종 선원 3명은 이틀째 이어진 수색에서도 아직 발견되지 않고 있습니다.해경은 경비함정과 항공기 등을 투입해 침몰 지점을 중심으로 수색을 벌이고 있지만 높은 파도와 강한 바람으로 어려움을 겪고 있다고 전했습니다.해경 관계자는 침몰한 선박과 선원들을 발견할 때까지 수색을 계속할 예정이라고 밝혔습니다.MBC뉴스 윤상문입니다.","5","https://www.bobaedream.co.kr//view?code=strange&No=4182535","카리스마4097","2,604","2021.01.24 20:49",""
"4181271","인생이 힘들고 억울한사람만 ..[7]","한줄로 요약이 안되는 한줄요약 난독 -> 우울증 -> 마약 -> 정신병원 ->  퇴원후 교통사고 -> 직장잃음 -> 새출발 -> 바로 화재 -> 다시 마약-> 구속 -> 교도소 오진으로 멀쩡한이빨 한개빼고 다뽑힘->  출소 -> 새출발 이사 -> 폭행에 뼈부러짐 -> 강도&화상-> 폭행 하나남은 이빨 잃음 ->  도움의 손길 새출발-> 심장질환 & 고혈압 -> 운동으로 새출발-> 코로나 자가격리중 화재로 사망 중간엔 친한친구에게 결혼할 여자 뺐김....  쓰다가 지칠정도로 운이없.. 어떤가요?횽님의 삶은... 힘좀나시나요?           ....                                                           ","6","https://www.bobaedream.co.kr//view?code=strange&No=4181271","Saramin","2,926","2021.01.23 23:54",""
"2004608","리콜한 코나 화재, 아이오닉5에도 악재네요.[5]","리콜 받은 코나에서 또 불이 났습니다.결국 원인 파악이 안된다는 뜻이네요.아이오닉5 초기 흥행에도 빨간불일 듯...   ","2","https://www.bobaedream.co.kr//view?code=national&No=2004608","망한자영업자","1,457","2021.01.23 19:47",""
