"id","title","content","likes","url","author","views","created_at","updated_at"
"2909323","펜션매수 후 문제가 많은데 법적절차 밟아도 될까요?[11]","본 내용은 한치의 거짓도 없는 진실만을 적었으며 거짓일시 모든 법적인 책임을 받을 것을 약속합니다 매수자는 펜션을 2022년 3월경 유튜브를 통해 매물 건을 확인하여 2022년 5월 26일 매수함 매수인은 건물 토지 등을 구매해본 경험이 전혀 없고 펜션일도 전혀 해보지 않은 상태로 무턱대고 유튜브를 보고 너무 마음에 들어 부모님을 설득하여 전액 대출을 받아 구매하게 됨.펜션은 코로나 여파로 가장 장사가 잘 되던 시기였고 유튜브에서 연매출 6억 관리가 잘된 좋은 펜션으로서 광고를 하였음. 유튜브 매도가는 20억이었으며 매수인은 1억 낮추어 19억에 구매 하였고 일부 무너진 토지를 재건하는 조건 약속하에 구매를 하였음.계약서를 쓸 때 매도인은 현 상태 그대로 판매한다고 말을 하였고 그 것이 펜션 상태가 않 좋기에 현상태 그대로 판매 한다고 생각지도 못하였음. 그 이유로는 5월26일 구매 후 다음날 바로 장사를 하였으며 이미 많은 돈을 지불하였기에 우리는 리모델링을 할 계획도 2~3년간 없다고 하였음. 매도인은 성수기를 잘 보낼수 있게 도와주겠다며 적극적이었기에 펜션에 많은 하자가 있을거라고는 전혀 상상하지 못하였음. 매도인은 계약당시 펜션에 있는 하자 내용 및 매도자가 도의적으로 꼭 알려야 할 사항들 까지 전혀 알려주 않았음.매도인이 전혀 말하지 않은 매수인이 발견한 내용들  1.    건물 누수 40여곳.계약당시 전혀 물새는 곳이 없지만 혹시 있다면 고쳐 주겠다고 함. {사진첨부}누수를 확인 후 매도인이 업자를 불러 방수를 진행하였지만 1년 넘는 시간동안 물새는 곳은 그대로이며 매도인은 업자에게 돈을 주었으니 매도인에게 따지지 말고 업자랑 이야기를 하라고 함. 지난 14개월 동안 누수 문제로 엄청난 스트레스를 받았으며 방수공사로 인해 수차례 객실을 비우고 해야 했기에 심적으로 너무나 힘든 상황임물새는 곳이 이렇게 많고 단순 누수가 아닌 객실&관리실에 치명적인 누수가 발생 중이며 이 것을 인지하였다면 절대 구매를 않함. 2.    토사 유출 및 토지 붕괴 펜션 위쪽으로 다른 사람들 땅이 있고 다른 사람들 땅에는 배수 시설을 해 놓았는데 그 모든 배수가 펜션 토지로 흘러가게 되어있음. 비가 오게 되면 많은 양의 토사가 바다로 유출되는데 그 토사가 펜션내 토사임을 확인하였음. 계약당시 무너진 토지를 재건하여 원상복구 시켜주는 조건으로 계약을 한 것인데 그 무너진 토지가 다른 사람들땅에 위치한 배수로가 원원인 것을 전혀 알지 못하였음. 결국에는 매도인이 매도당시 무너진 토지를 원상복구 해주었지만 매수한지 14개월만에 복구한 토지는 다시 무너져 내림. 현재 배수시설은 펜션부지내에서 절대 해결이 안되며 위에 땅주인들과 협의하여 배수시설을 다시해야하는데 사실상 어려움. 이러한 배수상태를 미리 인지 하였다면 절대 매수하지 않았음. 매도인은 현재 자기는 책임이 없다 하고 있음. 3.    객실 내 난방 고장 전 객실은 전기난방으로 시설되어있으며 난방이 잘 안되는 것은 둘째고 난방을 틀면 객실내에서 전기스파크가 일며 화재가 발생함. 매수전에 이미 한객실은 전기난방 결함으로 화재가 있었으며 전객실이 난방에서 스파크가 튀며 이미 모든 난방시설에 컨트롤박스는 새까맣게 타있음. 과열로 인한 전기선 단선이며 매도인은 단선된 난방을 다시 전기선으로 연결하여 사용하였으며 언제든지 바로 스파크가 튈 수 있음 (사진첨부) 이러한 난방문제는 매수당시 여름시작이기에 한참뒤 겨울이 되어서야 인지함난방시설문제를 인지 하였다면 절대 매수하지 않음 4.    6억 매출 매도인은 연 6억매출을 낸다고 펜션을 광고하였음. 매수인은 기존의 매도인의 펜션광고 노력을 똑같이 하였고 이에 추가로 더욱 많은 광고를 하고 시설도 최신식으로 리모델링하면서 더욱 높은 매출을 창출하고자 노력하였는데 6억에 반도 매출을 못내고 있음.2022년 총 매출 2억5천4백만원2023년 1월~6월매출 8천만원  5.    전 시설 노후화 매수당시 펜션에 대부분의 가구 및 가전은 2010년 구매했던 그대로의 상태였으며 이렇게 많은 시설들이 노후화 되었음은 상상도 하지 못하였음. 건물로 공급하는 물펌프 마저 오래되어 건물 전체를 단수가 빈번하였으며 매도인은 물펌프 코드를 껏다 키면 된다 하며 노하우라며 가르쳐주었음. 매수인은 이런 상황을 전혀 인지 하지못하여 애를 먹었으며 펜션 매수 후 노후화의 심각성을 인지하여 모든 가전가구 시설등을 교체하였고 있는 그대로 판다는 매도인의 내용의 이유를 알게됨. 6.    부지내 묘지 펜션 부지내에 묘지가 있었고 수풀로 가려져 있어 2023년 겨울 수풀이 죽으면서 발견함 객실에서 손님이 묘지를 직접 볼 수 있는 직선거리 20미터 정도에 묘지가 있었음. 묘지가 그렇게 부지내 있었다면 구매를 않 함. 다행히 2023년 4월경 묘지가 이장되었고 묘지가 있다는 것을 알게 된 후 심리적으로 너무 힘들었음. 묘지 이장 련하여 매도인의 도움은 전혀 없었음. 7.    정화조 고장 펜션에는 2개의 정화조가 있으며 이 정화조는 이미 수년전부터 고장이 나 제 기능을 상실하였음. 매도인은 이미 수년전부터 인지 하였고 정화조 때문에 매우 골치를 아파하였고 매수인은 이것을 정화조 청소업체로부터 듣게되어 정화조의 기능상실과 정화조 주변 악취의 원인을 확인하였음.매수인은 정화조 문제를 인지하였다면 계약조건을 달리 하였을 것임.매수인은 민박사업자 등록에 있어 정화조의 문제가 있어 수차례 매도인을 설득하여 2천만원을 받음. 그렇지만 이 2천만원에는 객실 및 관리실 누수피해 원상복구 비용도 포함되어 있는 금액이라 적은 금액이었지만 매수인이 너무 스트레스를 받아 그냥 2천만원 받고 끝내기로 결정함 매수인은 방수업체에서 누수를 잡았다고 하여 수리비 2천만원을 써서 누수피해 받은곳을 수리 하였지만 결과적으로 다시 누수가 발생하여 복구한 부분이 다시 원상태로 누수피해를 받음.  8.    관리실 및 까페 불법 사용매수인은 계약당시 관리실(펜션주 가정집)로 쓰고 있는 공간과 손님들이 무료로 사용하고있는 까페를 확인 하고 구매하였음. 한참 뒤에야 관리실과 까페로 쓰고있는 공간이 사실은 건축물대장에 창고로 명시되었음을 확인함. 유튜브 광고내용상에 있던 관리실과 까페는 사실 창고용도로만 쓸수 있는 곳이었고 계약당시 매도인은 이곳이 관리실이고 까페이다 라며 안내를 했으며 원래 법적 사용 용도는 전혀 알려주지 않았음. 구매당시 12개의 객실을 판매한다고 안내 받았지만 법대로라면 실은 10개의 객실만 판매 할 수 있는 상황임.이것을 인지하였다면 매수인은 절대 구매를 안하였을 것임. 9.    바비큐 시설 펜션은 실내에서 바비큐를 사용하는 구조인데 이것을 매도인은 숯불을 사용하여 바비큐시설을 설치 해 두었고 손님들 대부분이 객실내에서 숯불바베큐 시설을 좋아하였고 매수인도 마음에 들었으나 객실내에서 숯불조리 하는 것은 여러가지 소방시설 갖추었어야 했는데 전혀 소방시설을 하지 않았기에 민박사업자 허가가 않나 매수인은 멀쩡한 전 객실 설치된 바비큐 시설을 모두 전기그릴 교체 할 수 밖에 없었고 이는 계획하지 않은 큰 비용 소비와 함께 펜션 이미지에 있어 타격을 받음. 10.    카드매출 점유 새로운 민박사업자를 내기위해서는 6개월간 남해군에 거주하여야 했기에 매수인은 매도인의 명의로 매수 일 다음날 장사를 하였으며 카드매출160만원은 전부 매도인 통장으로 갔고 매도인은 이 돈을 주지 않고 있음 처음에는 준다고 하였지만 나중에는 2천만원 수리비 준 것이 아까워 안주고 있는 실정임. 11.    부동산 중계인 펜션 건물매수 태어나 처음인 매수인에게 부동산 중계인은 이것저것 알려주고 도와주었어야 할 도의적 의무가 있을텐데 부동산 중계인은 이것들을 전혀 알려주지 않았고 중계하였음. 애초에 건물을 살 때 객실내부도 한번 보지 않았고 건축물대장 보는 법 토지용도 및 정황들을 좀더 알려주었다면 계약서상 내용을 좀더 잘 썻을 텐데 본 매수인은 그저 다망가진 까페 용품들에만 신경을 썻음. 나중에는 건축물대장 등을 잘 보지 않은 우리의 잘못이라고 말함총 12개의 객실 중 법대로라면 10개의 객실만 팔았어야했는데이것은 민박사업자 낼 때 알게 되었으며 중계인은 매수인 본인이 101호로 직접전입신고 하지 않았느냐며 내가 다 알고 있다는듯이 말하였음.중계인 본인들도 건물의 상태가 10년이상 된 것들 토지상태 건축물대장등을 좀더 신경써주고 했다면 계약서의 내용은 많은 것이 바뀌어 있었을 것임지금은 계약서상 내용은 그 어느 것 하나도 매수인에게 도움되는 것이 없는 상황임.  저는 아내 아들 총 3명의 식구를 데리고 경기도에서 남해로 오게되었고 큰 희망과 기대를 품고 일을 시작하였습니다. 매수한지 하루만에 이삿짐도 전혀 풀지 않은 상태로 펜션 영업을 하게 된 것입니다.하지만 희망도 잠시 끝도 없이 나오는 하자들로 인해 우리가족의 행복도 금이 가게되었고 아내와 아들은 서울로 떠난지 10달이 되었습니다.겨울이 오면 난방화재 때문에 너무나 겁이 나고 여름이면 토사유출 및 토지붕괴로 잠못 이루며 365일 누수가되고있는 객실과 펜션주 가정집은 온갖 스트레스를 야기 중이며 사실은 내가 살고 있는곳이 창고라는 사실도 너무나도 안타깝습니다. 제가 2억짜리 건물을 산것도 아니고 20억이나 주고 관리가 잘되고 좋은 펜션을 산 것인데 지금 현실이 믿기지가 않을 뿐입니다.모든 동네사람들에게 20억주고 샀다고 말하면 다들 까무러치게 놀라고 있습니다.                             ","3","https://www.bobaedream.co.kr//view?code=freeb&No=2909323","약과도넛","766","2023.07.20 12:59",""
"5815653","안녕하세요. 두번 망한 자영업자 입니다 ㅎㅎ[262]","친구들에게 카톡이 와서 보배에 글이 있다고해서 알게되었습니다. 많은 형님들께서 힘내라고 해주셔서 너무 감사합니다! 사실 저 글을 쓴 이유는.. 지금 참 씁쓸한 기분을 어디 털어놓을 곳이 없어서였고..절대절대 누구를 탓하거나 원망하려는 의도는 전혀 없습니다. 대비를 제대로 못한 전적인 제 잘못이죠 ㅠㅠ 코로나 시절 시도때도 없이 알림이 울려서 건방지게 꺼놓은제 잘못이고 좀더 간절하지 못했던 제 잘못이죠 ㅎ 또한.. 화재보험에 당연히 특약으로 풍수해가 있는줄 알았고11만원을 내고있었기에 정확히 확인하지 않은 것도 제 잘못입니다. 정말 정말 더욱 꼼꼼하게 살아야겠다고 생각하는 계기가 되었습니다 ㅎㅎ 그리고..매장 안에 약 1.5m 정도 물이 차서...천장을 제외한 모든 부분이 흙탕물에 젖었고 대부분의고가의 장비도 명을 다 하였습니다 일찍이 차단을 해주신 건물주님 덕분에 열심히 깨끗한 물로세척하고 열심히 말리고 있는 중입니다.덕분에 작게나마 희망회로를 돌려볼수 있네요 정말 기분 좋게도 좋은 친구들을 둬서 아침부터 9시쯤 까지빡씨게 일하고 왔습니다. 그리고 많은 주변 분들께서 도움도 주시고 선물도 주시고응원도 해주시고 ~ 지금은 슬퍼하거나 고생스럽다고 느낄 시간이 없네요 한편으로는 발목정도 찼을때 뭐라도 더 했어야 했나 싶다가도몸 안다쳤으니 다행인건가 싶기도 하고 기분 참 묘해요.참 간사하죠 ㅎ 뭐 일단 오늘은 아침부터 군인분들과 소방관분들 그리고 자원봉사자분들과 공무원분들께서 아침부터 나오셔서 폐기물 수거도 해주시고 매장안에 물도 뿌려주시고 그랬어요 좀 뭐랄까... 약간 실감도 나고 뉴스로만 보던 일이 나에게일어나고 눈앞에서 그분들이 고생하시는거 보니 대단하다 싶더라구요 다들 본인 일처럼 마구마구 헤집고 다니시고 적극적인 모습들이 진짜 개 멋있었습니다!!!! 모든걸 원상태로 돌릴때까지 경주마처럼 달려볼생각입니다. 아 그리고... 9월 초에 제주도는 무슨 일이 있어도 갈껍니다. 철없다. 정신 못차렸다고 하실수도 있지만 저희 부모님께서 제가 어릴적 너무너무 힘들게 사셨고두분다 자영업자셔서 어린 저를 데리고 놀러도 제대로 못가고대부분의 시간을 집에서 혼자 보내거나 어머니 가게에서 보낸게 아직도 미안해 하십니다. 저는 집돌이라....전혀 그럴필요 없다고 성인이된 이후로매번 말하고 있지만 많이 아쉬우신가봐요. 그리고 2년 전쯤 제주도를 한번 가려다가 문제가 있어서 못갔습니다. 그때 부모님이 너무 아쉬워 하셨는데.. 그걸 다시 보고싶은 생각은 없습니다. 물론 예약을 다 취소하고 안가면 200만원 정도 아낄수있겠지만 전 그 여행이 훨씬 가치있다고 생각하기에꾸역꾸역 가려고 합니다. 부모님과 아내가 걱정없이 갈수있게 더욱 박차를 가하여모든걸 정상화 하고 여전히 웃는 얼굴로 아무일 없었던것 처럼그저 행복하게 다녀왔으면 좋겠습니다. 아무튼 응원 해주신 보배형님들 너무 감사합니다!!! 사진은 아직 초반에 찍은거고..지금은 완전 깨끗합니다!! ㅋㅋ내일은 더 깨끗할 예정!!!   ","1,561","https://www.bobaedream.co.kr//view?code=strange&No=5815653","뿌웽","87,084","2023.07.17 21:52",""
"5811161","노다문[사랑더]씨와 김치냉장고666"," 다들 아시다시피 666은 적그리스도의 숫자...확진자 수가 666명이고서울대 비리... 적발된 숫자가 666명...흠... 일단 노다문씨가 올리신 사진을 더보도록 합시다.  흠 다른날인가요? 같은날의 다른뉴스인가요?알수는 없지만 또 환자가 666명이라...이게 적그리스도를 나타내는건가요? 노다문씨가 올리신 사진을 더봅시다..  ????. 코로나 국민 지원금이...1조 2천 666억 지급되었다는 뉴스인데..666억 이니까.. 666이다.. 이건 조금 비약 아닌가요?  아니 이건 아니잖아요? 검정고시 합격자가 666명인데 어쩌라구요 ㅠㅠ설마 이거보다 더 심한 666의 증거는 없겠죠?   이건 위에 서울대 비리랑 같은 뉴스같고..다음은?  대전.. 김치..냉장고..화재...6년간 66건이니 666이다라구요?일루미나티 새끼들... 정말 졸렬하네..김치냉장고로 지들이 존재한다는걸 알리고 지랄났음 ㅠㅠ 제가...ㅋ<----이거 666개 써드려요? ㅋㅋㅋㅋㅋㅋㅋㅋㅋㅋㅋㅋㅋㅋㅋㅋㅋㅋㅋㅋㅋㅋㅋㅋㅋㅋㅋㅋㅋㅋㅋㅋㅋㅋㅋㅋㅋㅋㅋㅋㅋㅋㅋㅋㅋㅋㅋㅋㅋㅋㅋㅋㅋㅋㅋㅋㅋㅋㅋㅋㅋㅋㅋㅋㅋㅋㅋㅋㅋㅋㅋㅋㅋㅋㅋㅋㅋㅋㅋㅋㅋㅋㅋㅋ 아이고 안할란다 ㅋㅋㅋㅋㅋㅋㅋ","1","https://www.bobaedream.co.kr//view?code=strange&No=5811161","미스박닭똥집","201","2023.07.14 13:07",""
"5800965","노다문=사랑더씨와 과학적 사고.[1]"," 다들 아시다시피 666은 적그리스도의 숫자...확진자 수가 666명이고서울대 비리... 적발된 숫자가 666명...흠... 일단 노다문씨가 올리신 사진을 더보도록 합시다.  흠 다른날인가요? 같은날의 다른뉴스인가요?알수는 없지만 또 환자가 666명이라...이게 적그리스도를 나타내는건가요? 노다문씨가 올리신 사진을 더봅시다..  ????. 코로나 국민 지원금이...1조 2천 666억 지급되었다는 뉴스인데..666억 이니까.. 666이다.. 이건 조금 비약 아닌가요?  아니 이건 아니잖아요? 검정고시 합격자가 666명인데 어쩌라구요 ㅠㅠ설마 이거보다 더 심한 666의 증거는 없겠죠?   이건 위에 서울대 비리랑 같은 뉴스같고..다음은?  대전.. 김치..냉장고..화재...6년간 66건이니 666이다라구요?일루미나티 새끼들... 정말 졸렬하네..김치냉장고로 지들이 존재한다는걸 알리고 지랄났음 ㅠㅠ 제가...ㅋ<----이거 666개 써드려요? ㅋㅋㅋㅋㅋㅋㅋㅋㅋㅋㅋㅋㅋㅋㅋㅋㅋㅋㅋㅋㅋㅋㅋㅋㅋㅋㅋㅋㅋㅋㅋㅋㅋㅋㅋㅋㅋㅋㅋㅋㅋㅋㅋㅋㅋㅋㅋㅋㅋㅋㅋㅋㅋㅋㅋㅋㅋㅋㅋㅋㅋㅋㅋㅋㅋㅋㅋㅋㅋㅋㅋㅋㅋㅋㅋㅋㅋㅋㅋㅋㅋㅋㅋㅋ 아이고 안할란다 ㅋㅋㅋㅋㅋㅋㅋ","4","https://www.bobaedream.co.kr//view?code=strange&No=5800965","미스박닭똥집","224","2023.07.05 23:14",""
"127620","일본 방위대 현역 교수가 언론사에 제보한 심각성[5]"," 필자는 방위대 교수 等松春夫요약하면1. 작년 졸업한 479명중 72명이 임관거부2. 작년 4월에 입학한 1학년 488명중 100명 가까운 인원이 퇴교. 2~3학년에도 퇴교자 많음3. 미디어나 논객들은 정신적인 약함이나 우크라이나 전쟁을 이유로 추정하지만 오히려 우수하고 사명감이 강한 학생들이 방위대 교육에 실망해서 퇴교하는 경향이 강함4. 교관40명중 30명이 방위성 내 순환보직 인원인데 갑질이나 문제를 일으킨 인원을 여기(방위대)로 좌천시키는 경우가 많음5. 30명의 교관중 석사/박사학위 들고있는 인원은 몇 명 없음6. 교수직이 계급따라 자동부여식이라 학위 없는 경우가 많아서 전문성 낮음 (1좌(대령)이상이면 교수. 2좌~3좌(소~중령)면 준교수)7. 교관보직 이후에도 공부도 연구도 안하고 매뉴얼만 따라 수업하고 심지어 음모론에 빠지는 경우도 있음8. 음모론쪽에 빠진 교관이 외부에서 직업우/익 논객 초청해서 강연하는 경우도 있음9. 이런 직업우/익 논객 초청강연 문제는 다른 간부학교 등에서도 있음10. 2020 봄에는 코로나 상황판단 실패하고 집단생활 강행11. 軟禁 (연금)과 가까운 생활 때문에 자살미수 5건 대량의 탈영 스트레스가 원인인 방화로 추정되는 화재 대규모 도박 사건 등이 발생12. 2020 10월에 특별감사에서 방위대 지휘부에 책임을 묻는 고발서를 제출했으나 5시간 뒤에 감사단 차석대표(육자대 1좌)가 교수연구실 방문해서 고발서 반송. 고발서 봉인은 열여있었음13. 2020 11월에 방위대신(국방부장관)에 고발서 보냈으나 묵살당함이하는 편집부가 방위대에 사실확인 취재를 한 결과 방위대가 인정한 사실1. 72명 임관거부는 맞는데 2023 졸업자는 446명중 임관거부 46명으로 코로나 전 수준으로 회복함(고발자는 코로나 전 수준 자체가 문제가 있다고 지적)2. 2022 4월~2023 3월 까지의 1년간에 2~3학년 합쳐서 40명이 퇴교한건 사실. 취재전까지 방위대는 2~3학년의 퇴교자수를 공개 안했었음3. 5건의 자살미수- 무엇이 자살미수냐의 기준 판단은 어렵지만 자해행위를 방위대가 파악하고 있는건 5건 맞음4. 탈영과 방화- 학생이 정해진 절차를 안지키고 외출하는 경우가 있었던 거는 사실임. 동시기에 원인 모를 화재도 있었음5. 대규모 도박사건- 학생이 도박행위를 한 것은 사실. 2020에 17명을 처분했고 퇴교1명 정학3명 훈계9명 주의4명출처 : DC 방위대(일본판 사관학교) 상황 심각하네원문 : 【방위대현역 교수가 실명 고발】자살 미수 탈주 수상한 불 신입생을 오리로 한 도박 사건…개혁 급무의 위기에 처하는 방위대학교의 왜곡된 교육    ","27","https://www.bobaedream.co.kr//view?code=army&No=127620","불친절한이웃","6,179","2023.07.01 11:28","2023.07.01 12:54"
