"id","title","content","likes","url","author","views","created_at","updated_at"
"1970373","코나ev 중고 매물 엄청 나오네요(fire)[12]","화재 사건 터지기 전이랑 직후 까진10대 내외였는데오늘 조회해보니 중고 매물 50대네요.  케이카에도 매물 많이 늘어나는 중.... 사건 여파가 상당한 것 같습니다. 가격 자체는 아직 큰 변동이 없으나 매물이 엄청 나올 듯하네요.향후 몇달 지나고 해결방안 지지부진하면 가격도 급락하겠죠. 역시 전자제품이든 차든 1세대 모델은 ㅠㅠ ","2","https://www.bobaedream.co.kr//view?code=national&No=1970373","망한자영업자","3,577","2020.10.12 00:27",""
"2103340","울산화재 이재민 지원되는 금액[2]","이번 울산 아파트 화재로 이재민들 호텔에서 숙식과 식비가 나온다던데2인1실 6만원 식비8천원4인가족 기준 호텔비 12만원+식비(2.4만원×4)하루 22만원 정도인가요?아파트 복구하는데 얼마나 걸리는지 모르겠는데1달이라고 하면 650만원 정도...이렇게 지원되는거 맞나요?코로나 상황이라 학교 체육관 같은곳에서 안지낸다고 하던데... ","3","https://www.bobaedream.co.kr//view?code=freeb&No=2103340","spe02","596","2020.10.11 18:43",""
"2103177","[박용진의원실] 국회 국정감사, 현대차 사장과 조우했습니다.[5]","안녕하십니까 보배드림 선배님들더불어민주당 국회의원 박용진 의원실입니다. 잘 지내셨지요?그간 보배드림에서 오간 여러 큼직한 이슈들과 시시콜콜한 사는 이야기들 따뜻한 응원의 댓글더 잘하라는 질책의 글 다 읽고 있었습니다.부족함을 알고 끊임없이 노력하는 의원실이 되겠습니다. 지금 국회는 국정감사로 한창 떠들썩한 시즌입니다.의원들이 각자 그동안 어떤 정책을 펼쳐왔는지 민생에 얼마나 도움이 되는 사안을 다루고 있는지 국민들에게 평가받는 시기이기도 하지요. 저희 의원실은 지난 10월 8일 공정위 국정감사에서 8월부터 지속적으로 국토부와 논의해오기도 했던 현대차동차 결함 문제를 다루었습니다.그동안은 예결위를 통해 국토부 장관에게 질의했던 문제지만 리콜 문제는 공정위에서도 다룰 수 있기 때문에 이렇게 정무위원회 국정감사에 현대자동차의 품질·생산 부문 서보신 사장을 증인으로 불러 질의할 수 있었습니다. 첫 번째로는 요즈음 화재(?)의 차량 코나EV 화재 사태에 대해서 질의했습니다. 울산공장에서 화재가 났을 때의 내부조사서가 있는지 코나 구입 시 정부로부터 지원되는 보조금 조치방안에 대해 맹렬히 추궁하던 중 서 사장의 입에서“기술·제작 상 책임을 인정하고 리콜하겠습니다.” 라는 말이 나왔습니다.공교롭게도 이 날 딱 리콜을 발표하기로 결정을 했었더군요. 국정감사에서 사장이 차량결함 관련 국회에 증인으로 출석하는 날 발표라니... 할많하않입니다만. 그래도 리콜을 이끌어내는데 일조해냈습니다. 두 번째 질의는 그동안 관심 가지고 다루어왔던 신형 그랜저에 대해서 질의했습니다. 현대차 설립 이후로 전례가 없는 오일게이지 교체(무려 3차례에 걸쳐) 문제와 무상수리 관련 문제점에 관련한 질의를 했습니다. 현대차는 5월 29일 이전에 생산된 더 뉴 그랜저에 문제가 있어 엔진오일이 감소할 수 있다는 사실을 자체적으로 인지하고 뒤늦게 엔진 개선조치를 했다고 털어놓았습니다.5월 29일 이전 생산된 차량 중에 문제가 발생하는 차량이 1퍼센트 미만인데 그 부분에 대해서는 다 무상수리 해준다는 대답도 들었습니다. 너무 하고 싶은 말도 많았고 얻어내고 싶은 말도 많았으나 제한시간 3분이라는 국회 의사진행 시스템의 제약 때문에 더 추궁하지 못했습니다. 아쉬움이 많이 남았습니다. 더 나은 조치를 약속받았어야 하는데... 이렇게 이번 국감을 통해 자동차 결함에 있어서 제일 많은 국민들이 힘들어하고 관심 있어하는 두 차량에 대해 추궁하고 어느 정도의 답변도 들었는데요 결론부터 말하자면 가야 할 길이 아직도 너무 멉니다. 코나 차주를 비롯한 소비자들은 아직도 배터리 관리시스템을 업데이트한 뒤에야 이상이 있으면 배터리를 교체해주겠다는 현대차의 리콜방침에도 불만을 터트리고 있습니다. 그랜저 차주들도 불안감을 해소하기는커녕 현대차의 근본적 대책없는 대응으로 계속 마음졸이게 생겼습니다. ""문제가 있는 차량을 무상수리해준다.""라는 말조차도 쉽사리 믿을 수 없습니다. 한번에 될 일이라고 생각하지도 않았습니다. 저희는 계속 그래왔듯 남은 2020년 총력을 다해 차량결함 관련 문제를 잡고 늘어질겁니다.지금까지 질의했던 내용들 다 보배 선배님들의 제보 통해서 증거를 수집해왔습니다. 보배드림 선배님들에게 계속 신세 지겠습니다. 감사합니다.------------------------------------------------------------ * 더 뉴 그랜저 무상수리 / 코나 리콜 관련 문제가 발생한 점이 있었다면 내용을 자유롭게 아래 메일로 보내주십시오. *gangbuk24@gmail.com[형식]1. 소유차량명 연식2. 증상이나 조치사항 및 관련 증거자료(사진이나 영상 서비스센터 방문 내역)3. 연락받으실 휴대폰 번호 ------------------------------------------------------------ 현대자동차는 더 잘할 수 있습니다. 결국 우리 국민이 제일 많이 타는 차입니다. 더 나은 품질을 갖출 수 있는 현대차의 가능성을 봐서라도 발전을 위해서라도 일부러 저희가 쓴 소리를 하는 것입니다.대기업과 맞서게 되는 일이 가끔 고되다고 생각될 수 있겠지만 항상 저희 등 뒤에 있는 국민들을 생각하겠습니다. 감사합니다.이번 국정감사에서 질의했던 영상은 이렇게 링크 걸어드립니다. 관심있게 지켜봐주시고 많은 제보 및 고견 부탁드립니다.https://www.youtube.com/watch?v=tUBMscP03G8&t=169shttps://www.youtube.com/watch?v=BmLzT9BAcbk  ","11","https://www.bobaedream.co.kr//view?code=freeb&No=2103177","박용진의원실","389","2020.10.11 11:22",""
"1969854","현대차 품질담당 사장은 코나 화재 관련 국감에서 기억이 없어짐[5]","품질담당 사장이 코나 화재 관련하여 질의하는 국감장에 불려왔는데언제 화재가 났었는지도 모르고내부 조사 보고서가 있는지도 모르고정확한 솔루션도 없는데 그냥 리콜하고.. 국감만 나오면 치매가 되는건지.. 무조건 모른다고 교육받고 온건지.. 리콜같지 않은 리콜하면서 솔루션이라고 하는건 기술이 있는건지 대충 시간벌기인지.. ","5","https://www.bobaedream.co.kr//view?code=national&No=1969854","110리밋","801","2020.10.10 20:19",""
"3980421","'화재 이재민에 호텔 지원 과잉' 지적에 ....[3]","울산시장 ""코로나 예방""............https://news.v.daum.net/v/20201010162309023 ","3","https://www.bobaedream.co.kr//view?code=strange&No=3980421","사랑3","1,631","2020.10.10 17:31",""
"3978493","코나 가솔린은 괜찮은거죠?[5]","전기차만 그런거 아닌가제가 우리 회사에도 코나가 많이 있는데대부분 기름으로 가는 모델인가 그럴거에요전기도 있고 가솔린도 있고그거 우리 회사 주차장에 세워놓고 그러던데전기만 화재 발생이 있고기름으로 가는건 아직 화재 발생이 없었죠?","0","https://www.bobaedream.co.kr//view?code=strange&No=3978493","피피오피피피","2,391","2020.10.09 09:40",""
"1969304","이건 리콜이 아니죠.. 불나는 코나 점검일 뿐..[8]","문제가 배터리 라고 발표하고LG는 배터리 아니라고 하고..옥수수 삶아서 구경해야될 분위기인데현대차는 화재 4일만에 대책을 내 놓은 것도 의심스럽고 리콜이라고 하는 것이 점검해서 이상있으면 고쳐주겠다는건데이게 리콜인지... https://news.v.daum.net/v/20201009051013888https://tv.kakao.com/embed/player/cliplink/413064320?service=daum_news&m_use_inline=true&ios_allow_inline=true&m_prevent_sdk_use=true&wmode=opaque&popup=1&autoplay=1","4","https://www.bobaedream.co.kr//view?code=national&No=1969304","110리밋","1,257","2020.10.09 05:55",""
"1969279","현대차 정말 대단한듯..[6]","코나ev 화재 원인도 정확히 모르면서배터리 제조업체인 lg화학탓!!! ","6","https://www.bobaedream.co.kr//view?code=national&No=1969279","망한자영업자","2,545","2020.10.09 00:39",""
