"id","title","content","likes","url","author","views","created_at","updated_at"
"5760933","노다문=사랑더=러뷰모씨의 놀라운 현명함.[7]"," 다들 아시다시피 666은 적그리스도의 숫자...확진자 수가 666명이고서울대 비리... 적발된 숫자가 666명...흠... 일단 노다문씨가 올리신 사진을 더보도록 합시다.  흠 다른날인가요? 같은날의 다른뉴스인가요?알수는 없지만 또 환자가 666명이라...이게 적그리스도를 나타내는건가요? 노다문씨가 올리신 사진을 더봅시다..  ????. 코로나 국민 지원금이...1조 2천 666억 지급되었다는 뉴스인데..666억 이니까.. 666이다.. 이건 조금 비약 아닌가요?  아니 이건 아니잖아요? 검정고시 합격자가 666명인데 어쩌라구요 ㅠㅠ설마 이거보다 더 심한 666의 증거는 없겠죠?   이건 위에 서울대 비리랑 같은 뉴스같고..다음은?  대전.. 김치..냉장고..화재...6년간 66건이니 666이다라구요? 제가...ㅋ<----이거 666개 써드려요? ㅋㅋㅋㅋㅋㅋㅋㅋㅋㅋㅋㅋㅋㅋㅋㅋㅋㅋㅋㅋㅋㅋㅋㅋㅋㅋㅋㅋㅋㅋㅋㅋㅋㅋㅋㅋㅋㅋㅋㅋㅋㅋㅋㅋㅋㅋㅋㅋㅋㅋㅋㅋㅋㅋㅋㅋㅋㅋㅋㅋㅋㅋㅋㅋㅋㅋㅋㅋㅋㅋㅋㅋㅋㅋㅋㅋㅋㅋㅋㅋㅋㅋㅋㅋ 아이고 안할란다 ㅋㅋㅋㅋㅋㅋㅋ ","77","https://www.bobaedream.co.kr//view?code=strange&No=5760933","미스박닭똥집","3,770","2023.05.31 13:17",""
"2217095","감전차 화재..ㅣ 제발 지하주차장 금지시켜라[8]","천안 지하주차장 내차 보상도 못받았다..지웰시티푸르지오.. 시설 보험료만 엄청내고 있다홀라당 아파트 순식간에 타버린다.. 화재 진압도 안된다.. 스프링쿨러  있으나 마나하다.. 불나면 그냥 뛰어내려오세요.. 엘베 다정지며.. 불 순식간에 올라옵니다.https://www.bobaedream.co.kr/view?code=nnews&No=221362 경주 전기차 화재[경주소방서 제공. 재판매 및 DB 금지](경주=연합뉴스) 손대성 기자 = 24일 오전 1시 8분쯤 경북 경주시 율동 한 펜션 앞에 주차된 코나 전기차에서 불이 나 차량이 모두 탔다.불이 나자 경주소방서는 인력 38명과 장비 16대를 동원해 30여분 만에 모두 껐다.이 불로 인명 피해는 없었으나 차량이 모두 타고 건물 외벽이 일부 탔다.경찰과 소방당국은 화재 원인을 조사하고 있다.경주 전기차 화재[경주소방서 제공. 재판매 및 DB 금지]sds123@yna.co.kr출처-연합뉴스제보는 카카오톡 okjebo<저작권자(c) 연합뉴스 무단 전재-재배포 금지> ","6","https://www.bobaedream.co.kr//view?code=national&No=2217095","와이런다카노노","816","2023.04.25 08:26",""
"2206727","국내에서 1세대 코나 일렉트릭이 중간에 단종 된 거 말입니다[2]","비슷한 시기에 출시된 동급의 같은 집안의 1세대 니로 전기차와의 경쟁에서 밀리는 와중(코나 내연기관 및 하브 모델도 실내 특히 뒷좌석이 좁은데 코나 일렉트릭은 더 좁음. 니로는 코나에 비해서 많이 여유로움)에  화재사고가 계속 터져서 언론에 융단폭격 맞고 그로 인해 소비자 평이 더 안 좋아져서 계산기 두들겨보니 단종하는 것이 이익 측면에서 나아서 단종한 거라 생각되는데 맞나요?   궁금해서 물어봅니다","1","https://www.bobaedream.co.kr//view?code=national&No=2206727","esssem","350","2023.03.20 10:01",""
"5669880","물건 큰 남자의 고충[6]","초 3때 엄마가 청바지 사오셨는데 며칠 입고 고름같은 물이 나오기 시작함 여름에 냄새가 심해지니깐 초딩이 혹시 성병 인줄 알고 병원 데리고 감 의사 왈 초딩인데 고추가 노무 커서 청바지에 쏠렷다고하심  다 나을 때까지 몸에 꼭끼는 옷 입지 말라고 주의 진통제 몇알 주심 그때부터 청바지를 못입고 다님 청바지 한번 입어보는게 소원임 아빠와 사우나갔는데 때밀이 아저씨가 내고추를 몇번 건드리심 꾹 참고 있는데 마지막 비누칠 단계에서 풀발기해버림 화장실 가면 고추가 물에 자동 잠수하거나 변기 앞에 닿아버림 엄마가 청바지 못입는  나를 위해 아빠 단골 맞춤집에 가서 바지 한벌 맞춰입으라고 돈받아서 갔더니 아줌마 줄자를 들고 사이즈재는데 가랭이부터 엉덩이 사이즈 재고 허벅지 윗부분 재면서 물건을 만지기 시작하는데 물건이 풀발기 함 배꼽둘레 사이즈를 재는 줄자 사이즈에 페니스 굵기도 포함되고아줌마가 손으로 물건을 잡아 내려버림 (풀 발기시 페니스 끝부분이 배꼽보다 위로 올라가기때문인데  )지금 생각하면 거의 미성년자 성추행 수준임여친이 만지고 싶을때 바지 좌측 가랑이를 만지면 됨 발기하지않아도 보통 성인 발기 길이 보다 길고 두꺼워서 바지 입어도 성기 모양이 그대로 드러나서 좌측 가랭이에 허벅지와 함께 있다는걸 알고있음 전성기땐 준 재벌 딸을 만난적있는데 이 아가씨 부친이 4대그룹 포함 서울 대형빌딩 약 30여개 유지 관리 보수 방범 화재까지 토탈 케어 전문 회사 사장님이고놀기 좋아해서 ~~나이트는 물론 트젠바 여보클럽 이태원등 전전하기도했음 건전 마사지 업소 가면 더 괴로운 게반바지 입고 누워있어도 물건 크기가  두드러져서여자들이 어떻게 해서든  꼭 만짐 허벅지 마사지때는 허벅지 만지는 척 하면서 물건 만지고 배 맛사지할때는 풀발기 되어 배꼽을 지나치기에 또 만지고 옆으로 누웠을때는서혜부 마사지 해줄때 또 만지고 계속 만짐 아로마 마사지받을때는 더욱 난감해지는게 1회용 종이팬티를 입기때문에 발기하면 팬티 위로 돌출되고 옆으로 누우면 옆으로 빼져나와서 페니스를 감출 방법이 없음  하지말라고 해도 계속 만져지는 통에 쉬거나 잠을 잘수가 없음 심지어 마사지 다 끝나고 샤워하러 들어가도 문열고 따라 들어와서 자기 치마를  걷어서 올림 내가 왜 그러시냐고 떨면서 물어보면 샤워시켜주는데 물 튈까봐  그런다고 하면서 팬티도 벗어서 내려버리고 비누칠 해주면서 또 만짐 ㅜㅜ그리곤 항상 하는 말이 어느업소나마담이나 아가씨나 똑같은 멘트 날림 손님 수만명 봤지민이렇게 크고 이쁘게 생긴 물건은 첨 본다고 함 아가씨들은 항상 내 전번 따고 자기 비번 날 알려줌어떤 아가씨는 자기 얻 산다고 주소도 보내주고 쉬는 날  밥도 먹고 술과 고기도 먹자고 함  어떤 아가씨는 남산 둘레길 못가봤다고같이 가자고하고 어떤 아가씨는 동거하는 친구와 쓰리썸 제안도 함 나는 좋은 대학 나오고 좋은 직장 다니고 다른 동료들처럼 시간쪼개서 대학원도 갔어야하는데 페니스 큰탓에  아가씨들 유혹과 유흥에 빠져 세월 보내느라 더이상 공부와 취미를 발전시키지못함 돌이켜보면 프랑스 철학자 파스칼이 클레오파트라 코가 조금만 낮았으면 역사가 바뀌었을거라고 했듯 나의 페니스 사이즈가 조금만 작았어도 내 인생은 바뀌었을 거임  다음 이야긴 큰 가슴 여친의 고충을 보배형들에게 소개 예정임 ㅎ","9","https://www.bobaedream.co.kr//view?code=strange&No=5669880","명예뉴욕시민","3,565","2023.03.17 18:57","2023.03.17 19:03"
"2825383","아파트 전기차 화재 1건에 60억대 손실 발생..","    전기차  차주 파산... 전부 다 책임공방  책임 시시비비 갈리는 중..   대도록  아파트 공동주택 거주자는 구매 안하는 것이     자꾸 베터리 주식 구매자들  우리나라 배터리 기술이 중국보다 우월하다고 하는데.   전기차 화재 대부분   국내 리튬이온  배터리에서 화재 나고 있습니다..    현대차  코나  왜   중국 배터리  CATL 장착 했을까요  . 국민에게 욕 먹을 것 알면서 .   ","0","https://www.bobaedream.co.kr//view?code=freeb&No=2825383","2100년출생","384","2023.03.08 09:24","2023.03.08 09:25"
"5624484","거대 민주당의 국회가 국민 아가리 다물게 하는 법을 입안!![2]","민주당이 아니라 공산당이네 공산당!!이거 국회에서 통과되면 민주당 씹새끼들 다 쳐죽여야 함. 댓글을 못쓰게 해야 코로나 사기같은 족같은 사기도 맘대로 치고 아무 효과도 없는 좆같은 백신도 아무 저항 없이 마구 맞추고 그 덕에 제약사에서 뒷 돈도 받아 냠냠하고....이태원 압사 사고 같은 거 났을 때 아무 방해도 안받고 시체팔이 맘대로 하지...민주당 이 좆같은 새끼들은 대갈통 속에 공산주의가 가득 차 있다. 이 족같은 새끼들이 장기집권 했더라면 진짜 토착왜구쑈 반일쑈 같은 거 한참 보다 보면 언론의 자유 표현의 자유 종교의 자유 차례차례 없어져버리고 어느 순간 공산주의 되 있었을거다.민주당 아니 공산당 악마들 다 쳐죽여야 나라가 정상적으로 유지될 수 있다.  https://pal.assembly.go.kr/law/readView.do?lgsltpaId=PRC_C2X3I0C1M2Y6K1J1T1T2V2Z9E3K1O42월 13일까지사회재난의 정의 : 화재 붕괴 폭발 교통사고(항공사고 및 해상사고를 포함한다) 화생방사고 환경오염사고 등으로 인하여 발생하는 대통령령으로 정하는 규모 이상의 피해와 에너지","0","https://www.bobaedream.co.kr//view?code=strange&No=5624484","노다문","154","2023.02.11 15:49",""
"2195956","BMS, 배터리를 잘만들어도 그럼에도 전기차 화재가 나는 이유[60]","안녕하십니까. 중국전기차 전문 Shuri입니다.짱개 아님. 제가 쓴 글 보기를 하시면 전기차에 중요한 배터리와 BMS의 개념과생산 공정에 대해서 기록해 두었으니 참조해 주십시오.사전에 정보를 드리면 배터리의 경우 그냥 쉽게 말씀드리면 에너지양을 고려하면10kWh당 1~2시간정도 타들어갑니다.(평균 온도 500도씨)아이오닉이 77.4kWh정도이니 7~15시간 정도라고 볼 수 있겠네요.Tesla의 경우 88.8kWh의 Model Y 퍼포 도 있으니 최대 20시간 정도까지 타들어 갈 수 있겠네요.(물론 공시가 아니라 추정인 Model Y) 그리고 화재 지연기술은 보통 배터리팩에 문제가 발생한 후  배터리의 열폭주에 의한 화재를 대부분 5~15분까지 막아줍니다.성수동 Tesla 사건을 보시면 부글부글 끓는소리가 난지 약 15분후 화재가 발생한것으로 알고 있습니다. 물론 BMS는 한 4시간 전부터 경고를 보냈구요.(물론 이게 당장의 최선인건 좀 아쉬움 이러면 차에 문제가 생긴 후 최소 4~5시간을 둬야지 알수 있는거니깐...) 내연차의 경우 50L 기준 1.5시간에서 2시간을 탑니다. 다만 이때의 온도는 1200~2천도씨 까지 올라갑니다.그리고 연료통이나 엔진에 충격이 가해지면 폭팔의 가능성이 있습니다.즉 내연차는 특정상황에는 더 위험한것도 맞습니다. 그런데... 저렇게 열심히 관리를 하는데도 왜 전기차의 화재가 날까? 크게 전기차의 화재는 3종류 입니다.1. 충전중2. 충격3. 냉각 부족 1. 충전중 화재의 경우 대부분 BMS의 오류라고 보시면 됩니다.BMS가 균일한 수준으로 Cell들의 충전을 해야 하는데 Cell 하나만 특정하게 전기를 밀어넣으면전하가 한쪽에 몰려서 +극과 -극의 특성에 의해... 배터리 팩 내에서 전하들이 미쳐날뛰는 현상이 발생합니다.이럴경우 이들의 제어에 실패하면 화재가 날수 있습니다. 대부분 20년 이후 개발/생산된 전기차는 차단기능이 있어서 이런현상이 발생시 즉시 충전이 차단됩니다.보통의 경우 20년 이후 개발된 전기차는 400v 시스템을 지원하기 때문에 그냥 쉽게 400v지원=충전중 열폭주 방지라고 생각하셔도 큰 문제는 없을 것입니다.(유럽쪽은 22년 이전까지 400v는 아니지만 안전에는 그나마 신경을 써서 온도 감지 센서에 의해 차단은 됩니다.) 역시 생산 중 불량은 PPM 단위로 관리되기 때문에 일반적으로는 문제는 없다고 보시면 됩니다.이론상 25만대당 1대정도의 불량입니다. 2. 충격은 너무 다양하고 배터리 뿐만아니라 각종 윤활유 냉각유 등등이 화재가 날수 있습니다.이번 아이오닉 연석타고 상가돌진 화재가 비슷한 건이라고 할 수 있겠습니다.차량의 공간은 한정되어 있고 공조기 모터 배터리 인버터 등등등 수많은 물건이 한정된 공간에 들어가야합니다.아이오닉의 경우 제 예상으로는 공조시스템이 가장 바닥에 깔린것으로 보이며연석을 타고가다 이 공조시스템의 파이프가 파손되고 흘러나온 냉각유에서 파이프 마찰불꽃에 의해 불이 붙은것으로 추정됩니다.기름에 의한 화재는 위에서 말씀드린대로 빠르고 고온으로 타기에 순식간에 번지는 특성이 있지요.그래서 더 위험해 보였을것으로 보이나 이 역시도 2시간 안에 진화된 것으로 알고 있습니다. 현기 등 대부분 전기차들은 현재 모듈과 팩의 커버로 보호되고 있습니다.이에 따라 화재가 나더라도 전이가 쉽지않은 구조이기도 합니다.대부분의 이 커버들은 난연소재로 1200도씨를 2시간~4시간 까지 견디는 것으로 알고 있습니다.보통의 전기차 화재들은 2~4시간내 진화되는걸 보면 배터리가 생각보다 팡팡 터지지 않는것을 알 수 있습니다. 성수동 Tesla 화재의 경우 소방관 출동후 2시간 만에 진압이라고 하니 모듈1개수준이거나 그보다 적을 것으로 추정됩니다.(실제 진압시간은 20분내외였다고 하니 1개도 안탄거긴 하지만요.) 물론 배터리 팩이 자동차에 적용되면서 특정부위가 약할 가능성을 배제할 순 없습니다.제가 설계 전문이 아닌지라..... 이러한 특정부위 충돌 약점 부분은 업체별로 다를 수 있긴 합니다.그리고 내연차도 배터리 팩에 가해지는 충격량을 고려하여 비슷하게 충돌하면엔진이나 연료통에 그 충격량이 가해지면 화재가 발생할 것으로 예상됩니다.다만 배터리 팩은 그 면적이 넓다는 점이 약점이라고 할 수는 있겠습니다. 3. 냉각 부족최근 유럽 전기차 특히 독일쪽에서 리콜을 보면 냉각시스템 오류가 많음을 알 수 있습니다.물론 여기도 바보가 아닌지라 냉각시스템 오류로 인해 온도가 올라가면 BMS가 주행을 차단하긴 합니다.다만 이런 냉각 시스템 오류로 인하여 온도 제어 특히 냉각 능력을 잃으면 화재가 발생할 겁니다. 원래 에너지라는것이 변환시에는 열이 발생합니다.석탄 > 불로 변환하면 빛 에너지와 열에너지가 발생합니다.수력의 낙차로 터빈을 돌림 > 중력에너지가 터빈에 마찰열을 발생시킵니다. 다만 물 자체가 열을 어느정도 흡수하기에 증기가 발생하기도 합니다. 전기 역시도 에너지가 변환되어 바퀴로 운동에너지로 바뀌면서 열이 발생합니다. 이때의 열제어가 안되면 불이 나는거죠. 이렇게 전기차 화재의 가장 큰 3가지를 알아보았습니다. 예외 및 주의 사항1. 다만 Cell의 세월성 불량은 현재 기술로 잡아 낼 수가 없습니다.통상적인 세월성 불량은 제작후 2~3년 이후 발생하는 편인데 이것 때문에 코나라던가 볼트의 화재가 발생한겁니다.이 부분은 모든 전기차 제조사 및 배터리 Cell 제조사들의 초미의 관심사 입니다.이건 그레이딩에서 발견하기 힘든건 맞습니다.하지만 이것도 최근 Big Data화 된 Data에서 전압이 너무 높거나 낮은 부분을 발견해 내면서 많이 줄어들고 있는것으로 알고 있습니다.2. 내연차의 경우 화재원이 엔진이더라도 보통 그 사이에 공조 장치등 다른 장치를 넣어서 엔진 폭팔을 어느정도 지연시키는 설계가 많습니다. 하지만 전기차의 경우 충격량이 보통 배터리를 때릴수 밖에 없는 구조로 인하여 시속 80이상일 경우에는 내연차 보다 조금은 더 위험한건 맞습니다. 다만 이부분은 전기차 역시도 설계를 통하여 역시 충격 상쇄용 구조물들을 넣어 어느정도 해결하고 있습니다. 예를들어 옆면이 경우 문짝을 최대한 낮추거나 문짝과 아예 파트를 분리하고 좀더 강성이 좋은 금속을 사용하거나 등등의 방법으로요.어떻게 보면 전면의 프렁크도 충격량 상쇄의 한 방법이기도 합니다.  이래서 충격에 의한 화재 자체도 어떻게 보면 전기차가 설계로 커버하여 내연차 보다 방지or확산이 좋아지는 부분도 있습니다. 이 역시 20년 이후 설계된 400v 이상의 플랫폼 전기차라면 충분히 수준에 도달해 있다고 봐도 된다고 판단합니다. 3. 자동차라는 한계 때문에... 사실 공조기 등 오일을 쓰는걸 최대한 줄여야 하는건 맞습니다. 그래야 화재에서 점점 멀어지는게 맞으니까요. 4. 열폭주가 원인을 알수없다는 소리를 많이 하지만 실제로 근본원인은 전하의 이동입니다. 전하의 이동이 열을 만들고 위에서 말씀드린대로 폭주할정도로 전하가 이동하면 열폭주인겁니다. 이 전하의 이동을 만들어내는걸 원인 불명이라고 하는데...현재까지 제가 아는 경우는 셀 전압차를 못 맞춘경우라고 봐도 될 정도입니다.이런건 보통 BMS 설계문제거나 불량 Cell 두가지일 확률이 제일 높은것으로 알고 있습니다.(물론 제가 품질은 아니지만 근무하면서 화재 분석에서는 대부분 BMS 오류라서 펌웨어 업데이트로 해결하는걸 본 경험이 있습니다.) 5. 그러나 모듈의 화재가 만약 사람의 탑승공간 밑에서 발생한다면 위험한 것은 맞습니다.이부분은 모든 전기차 업체가 해결해야할 문제인것도 맞습니다.다만 아무리 높게잡아도 25만대당 1대가 날까 말까입니다.실제로 원인 불명 화재(열폭주) 에 대해 통계를 찾아보면중국업체인 BYD도 BEV에서는 100만대당 2~3대수준입니다.Xpeng도 100만대당 4~5대 수준이고요.현기는 제가 안구해봐서 모르겠는데... 더 낮을걸요?(코나는 배터리 Cell 불량이니 뺴고...봐야 할겁니다.)  결론제가 전기차를 사세요 말씀드리는게 아닙니다.현재 엔지니어들과 설계자 디자이너들이 자신을 갈아넣으며 전기차를 설계하고 있고...아직 위험한 부분도 있지만 지금 시중에 풀리는 3초만에 800도 이런건 개소리라는걸 말씀드리고 싶었습니다.(사실 3초만에 800도씨 달성하면 노벨상 감일걸요...?)(그리고 3초만에 800도씨면 포스코에서 용광로에 리튬 배터리를 던져 넣을것 같은데요? 용광로 멈췃다 다시 돌리려면 4개월간 열을 가해야 한다고 합니다. 뭐 좀 극단적으로 예를 든거긴 합니다. ㅎㅎ)그리고 열폭주 너무 걱정 안하셔도 됩니다. 제가 아는 한 이론상 ppb(10억개당) 수준입니다.","123","https://www.bobaedream.co.kr//view?code=national&No=2195956","Shuri","11,902","2023.02.02 17:28",""
