id,title,content,likes,url,author,views,created_at,updated_at
523124,지금시국에서 살만한 전기차가 없는듯요,전기차중고로 찾아보면구오닉 2천초반신오닉 2천중후반코나 3천니로 3천3백모델3 4천중반코나 화재로 코나빼고 반현대 이미지 커져 현대빼면남는건 니로정도테슬라는 이슈가 안되서 그렇지 수리비 살벌하네요솔직히 전기차3천이면 왠만한 국산차 살가격인데내연차살려고 보니 지칠공에서도 불나고 현대는 또 기고만장~~이러니 에혀 이거사나 저거사나다 난리이니 자포자기하나 봅니다,0,https://cafe.naver.com/ca-fe/ArticleRead.nhn?clubid=21771803&page=12&userDisplay=50&inCafeSearch=true&searchBy=0&query=%EC%BD%94%EB%82%98+%ED%99%94%EC%9E%AC&includeAll=&exclude=&include=&exact=&searchdate=2020-07-312021-01-31&media=0&sortBy=date&articleid=523124&referrerAllArticles=true,동막골II전북,702,2020-10-26 06:57:00,
523076,소송에 참여하는 회원들을 대리하여 현대자동차에 발송할 내용증명(법무법인 정세 작성)을 공개합니다,,,https://cafe.naver.com/ca-fe/ArticleRead.nhn?clubid=21771803&page=12&userDisplay=50&inCafeSearch=true&searchBy=0&query=%EC%BD%94%EB%82%98+%ED%99%94%EC%9E%AC&includeAll=&exclude=&include=&exact=&searchdate=2020-07-312021-01-31&media=0&sortBy=date&articleid=523076&referrerAllArticles=true,아그립바l코나l세종,"1,722",2020-10-25 22:15:00,
523036,가입인사드립니다,1. 자기소개 : 반갑습니다2 한글별명의 뜻 : 비타민요정I코나대전3 관심있는 전기차 : 코나4 지역 : 대전5 전기차 보유/계약/미보유 : 보유6 가입계기 : 코나화재7 하고 싶으신 말씀 : 코나 팔고 싶네요,0,https://cafe.naver.com/ca-fe/ArticleRead.nhn?clubid=21771803&page=12&userDisplay=50&inCafeSearch=true&searchBy=0&query=%EC%BD%94%EB%82%98+%ED%99%94%EC%9E%AC&includeAll=&exclude=&include=&exact=&searchdate=2020-07-312021-01-31&media=0&sortBy=date&articleid=523036&referrerAllArticles=true,비타민요정I코나대전,23,2020-10-25 20:05:00,
523028,10년만에 새차 사고 조롱거리 됐어요..,"오늘 남편이랑 코나 뽑고 장거리 한번 뛴다고 부산 갔는데지나가는 행인들이""어? 불나는 차다~ㅋㅋㅋ""이러는거 들리고..지나가면서 뒤까지 쳐다보며 수근거리고..하..너무 굴욕적이에요..10년만에 비싼돈주고 새차 뽑았는데왜 조롱거리가 된거죠...오히려 대중들이 다 알게된 덕분에 현대가 리콜이니 뭐니 말이라도 나오니 잘됐다고 해야될까요......ㅋ심지어 전 6월이후 출고라고 리콜도 안해준다는데...정말 안전해서 안해주는거 맞겠죠...?ㅋㅋㅋㅋㅋ",0,https://cafe.naver.com/ca-fe/ArticleRead.nhn?clubid=21771803&page=12&userDisplay=50&inCafeSearch=true&searchBy=0&query=%EC%BD%94%EB%82%98+%ED%99%94%EC%9E%AC&includeAll=&exclude=&include=&exact=&searchdate=2020-07-312021-01-31&media=0&sortBy=date&articleid=523028&referrerAllArticles=true,코둥이I코나I인천,"1,481",2020-10-25 19:24:00,
523020,안녕하세요~,1. 자기소개 : 40대 후반 직장인2 한글별명의 뜻 : 그냥 별뜻은 없답니다--'3 관심있는 전기차 : 코나4 지역 : 광양5 전기차 보유/계약/미보유 : 보유6 가입계기 : 최근 화재 리콜관련7 하고 싶으신 말씀 :걱정없이 탔으면 좋겠습니다,0,https://cafe.naver.com/ca-fe/ArticleRead.nhn?clubid=21771803&page=12&userDisplay=50&inCafeSearch=true&searchBy=0&query=%EC%BD%94%EB%82%98+%ED%99%94%EC%9E%AC&includeAll=&exclude=&include=&exact=&searchdate=2020-07-312021-01-31&media=0&sortBy=date&articleid=523020&referrerAllArticles=true,스틸루I코나EVI전남,25,2020-10-25 18:29:00,
522997,"경찰 ""남양주 코나 전기차 화재 피해자, 국과수 감정 원치 않아”",,0,https://cafe.naver.com/ca-fe/ArticleRead.nhn?clubid=21771803&page=12&userDisplay=50&inCafeSearch=true&searchBy=0&query=%EC%BD%94%EB%82%98+%ED%99%94%EC%9E%AC&includeAll=&exclude=&include=&exact=&searchdate=2020-07-312021-01-31&media=0&sortBy=date&articleid=522997&referrerAllArticles=true,코나주인l 세종,"1,107",2020-10-25 17:39:00,
522936,ESS화재 국감때도 중국남경공장 배터리가 문제라는 식으로 얘기나왔는데요,,1,https://cafe.naver.com/ca-fe/ArticleRead.nhn?clubid=21771803&page=12&userDisplay=50&inCafeSearch=true&searchBy=0&query=%EC%BD%94%EB%82%98+%ED%99%94%EC%9E%AC&includeAll=&exclude=&include=&exact=&searchdate=2020-07-312021-01-31&media=0&sortBy=date&articleid=522936&referrerAllArticles=true,동막골II전북,232,2020-10-25 13:48:00,
522926,코나 화재관련 청원입니다. 민원이 답입니다.,https://www1.president.go.kr/petitions/Temp/VHESKM모두 동의합시다.,1,https://cafe.naver.com/ca-fe/ArticleRead.nhn?clubid=21771803&page=12&userDisplay=50&inCafeSearch=true&searchBy=0&query=%EC%BD%94%EB%82%98+%ED%99%94%EC%9E%AC&includeAll=&exclude=&include=&exact=&searchdate=2020-07-312021-01-31&media=0&sortBy=date&articleid=522926&referrerAllArticles=true,로로l코나l하남미사,376,2020-10-25 13:22:00,
522913,실험) 코나로 오닉이 완속충전 될까?? ㅎㅎ,"궁금해서 해봤습니다.코나로 오닉이 충전한다.구성은코나 베터리 80agm ㅡ 인버터3kw ㅡ비상충전기 ㅡ 오닉 완속 충전사진처럼 가능하네요오닉 10%->11% 3키로 증가 15분 충전 했고.., 인버터 케이블 제법 발열이.., 더 했다간 순정35sq 못 버틸거 같아 중지했어요.",0,https://cafe.naver.com/ca-fe/ArticleRead.nhn?clubid=21771803&page=12&userDisplay=50&inCafeSearch=true&searchBy=0&query=%EC%BD%94%EB%82%98+%ED%99%94%EC%9E%AC&includeAll=&exclude=&include=&exact=&searchdate=2020-07-312021-01-31&media=0&sortBy=date&articleid=522913&referrerAllArticles=true,슈나이더I오닉COI부산,869,2020-10-25 12:28:00,
522894,벌써 코나 중고매물로 59대가 나왔네요..,몇대없었는데.. 이번 화재와용접부 크랙 등등 같은 전기차주로써조속히 잘 처리되시길 진심 바래봅니다.,1,https://cafe.naver.com/ca-fe/ArticleRead.nhn?clubid=21771803&page=12&userDisplay=50&inCafeSearch=true&searchBy=0&query=%EC%BD%94%EB%82%98+%ED%99%94%EC%9E%AC&includeAll=&exclude=&include=&exact=&searchdate=2020-07-312021-01-31&media=0&sortBy=date&articleid=522894&referrerAllArticles=true,뀰링l아이오닉l청주,"1,280",2020-10-25 11:15:00,
522843,불타지 않는 SK이노 배터리 비결은 '분리막',"불타지 않는 SK이노 배터리 비결은 '분리막'전기차 화재 사고가 연이어 발생하는 가운데 불타지 않는 SK이노베이션 배터리가 주목받는다. SK이노베이션의 배터리는 글로벌 배터리 업체 중 유일하게 단 한건의 화재도 일어나지 않았다. 이같은 비결이 자동차 안정성을 결정짓는 분리막 내재화에 있다는 평가가 나온다.23일 배터리 업계에 따르면 현대차와 기아차의 전기차인 코나와 니로는 LG화학과 SK이노베이션 배터리가 각각 공급된다. SK이노베이션에서 공급하는 니로에서는 단 한건의 화재가 발생하지 않았다. 반면 경쟁사 배터리가 들어간 코나에서는 14건의 화재가 발생했다. 전기차 화재의 원인은 구체적으로 밝혀지지 않았다. 현대차와 LG화학은 TF를 꾸려 원인 파악에 나선 상황이다. 앞서 국토교통부는 최근 화재 원인을 설명하며 배터리 셀 문제를 추정된다고 밝힌 바 있다.SK이노베이션은 자사 배터리의 안전성을 인정받는 이유로 분리막을 꼽았다. 세계 배터리 업체 중 유일하게 내재화 한 점이 이 회사의 강점이다. 분리막은 화재 등 배터리 안전성에 가장 직결적인 소재다.이 소재를 만드는 곳이 SK이노베이션에서 분리막 사업을 전담하는 SKIET다. SKIET는 한국에 이어 중국, 유럽에 공장을 공격적으로 확장하고 있다. 이같은 안정성을 기반으로 양극재 삼원계 고밀도 니켈 에서도 업계 1위를 유지하고 있다.SK이노베이션 관계자는 ""다품종을 하고 있는 배터리 업체들과 달리 중대형 파우치형 R&D에 집중했기에 화재가 일어날 모든 상황을 대비해 제품을 만들 수 있었다""며 ""SK이노베이션 배터리가 단 한건의 화재도 없었다는 점에서 글로벌 전기차 업체가 가장 선호하는 배터리로 자리잡을 수 있을 것이다""라고 말했다.http://it.chosun.com/m/svc/article.html?contid=2020102400537&Dep0=m.facebook.com&utm_source=m.facebook.com&utm_medium=unknown&utm_campaign=itchosun",0,https://cafe.naver.com/ca-fe/ArticleRead.nhn?clubid=21771803&page=12&userDisplay=50&inCafeSearch=true&searchBy=0&query=%EC%BD%94%EB%82%98+%ED%99%94%EC%9E%AC&includeAll=&exclude=&include=&exact=&searchdate=2020-07-312021-01-31&media=0&sortBy=date&articleid=522843&referrerAllArticles=true,뭉치I코니모3I서울,"2,904",2020-10-25 09:14:00,
522815,코나 리콜 후 당첨되신 분들,"코나 리콜 후에 경고등이 뜨면서 주행배터리 교체하셨다는 글들이 많이 올라오고 있는데요. 리콜 작업 당시에는 발견하지 못했지만 주행배터리에 이상 징후가 감지되면 생기는 현상이라고 이해합니다. 또한, 이러한 현상은 해당 주행배터리에 화재의 위험성이 존재한다고 현기에서 판단하는 기준이라고도 이해됩니다. 그렇다면, 이렇게나 많은 코나 차주분들이 잠재적 화재 위험을 가진 차들을 몰고 다니셨다는 말인데... 소름 돋네요...",0,https://cafe.naver.com/ca-fe/ArticleRead.nhn?clubid=21771803&page=12&userDisplay=50&inCafeSearch=true&searchBy=0&query=%EC%BD%94%EB%82%98+%ED%99%94%EC%9E%AC&includeAll=&exclude=&include=&exact=&searchdate=2020-07-312021-01-31&media=0&sortBy=date&articleid=522815&referrerAllArticles=true,웜커들I아이오닉I제주,525,2020-10-25 07:31:00,
522756,BMS 업데이트하고 왔습니다.,"2019년11월식 코나EV 오너입니다.리콜 통지문 받고 가까운 블루핸즈가서 소프트웨어 업그레이드하고 왔습니다.살고 있는 아파트에 완속 충전기가 잘 되어 있어서, 충전하는데는 무리가 없구요.퇴근해서 충전해놓고, 그 다음날 아침 출근할때는 완충되어 있어서, 충전은 전혀 불편함이없이 운행해 왔습니다.배터리 충전 설정은 그동안 100%로 설정해 놓았었구요.아파트 충전기 설치 모델이 EVRANG회사 모델인데, 100% 완중되면, 알아서 차단되니까 그동안신경 안쓰고 살았는데, 최근에 화재 사건 많이 난 이후로 100% 충전 종료 표시 뜨면 바로바로충전기 뽑아 줍니다. 주행거리는 업데이트 한 이후에 조금 줄어든 것 같습니다.다음주에 장거리 운행 계획이 있어서, 다녀온 후 변동 사항 남겨 보겠습니다.",0,https://cafe.naver.com/ca-fe/ArticleRead.nhn?clubid=21771803&page=12&userDisplay=50&inCafeSearch=true&searchBy=0&query=%EC%BD%94%EB%82%98+%ED%99%94%EC%9E%AC&includeAll=&exclude=&include=&exact=&searchdate=2020-07-312021-01-31&media=0&sortBy=date&articleid=522756&referrerAllArticles=true,저스틴코나광주,312,2020-10-24 21:27:00,
522677,사실 코나차주 입장으로 말씀드리면....,의선이형공식 기자회견에서대가리박고 사과해라.bmw는 최소한부품 전체 새로 교체해주기라도 했다.흉토부 흉기......그리고테슬라 모델3 이번에가격은 내리고전동트렁크 히트펌프 넣어주고흉기 니들은옵션 넣어주고 가격 올리면서실질적인 가격은 내렸다....즉당히 하지?,2,https://cafe.naver.com/ca-fe/ArticleRead.nhn?clubid=21771803&page=12&userDisplay=50&inCafeSearch=true&searchBy=0&query=%EC%BD%94%EB%82%98+%ED%99%94%EC%9E%AC&includeAll=&exclude=&include=&exact=&searchdate=2020-07-312021-01-31&media=0&sortBy=date&articleid=522677&referrerAllArticles=true,구구I코나EVI오산I,"1,068",2020-10-24 16:27:00,
522676,내년 출시될 아이오닉5 차박관련,"* 관련된 주제에 대해 미리 카페내 검색해 보셨습니까? : (네)* 전기차 종류, 지역 : 아이오닉5* 질문 내용 :내년 출시될 아이오닉5 관련해서모델s나 suv처럼 차박가능할까요?준중형cuv라해서 언듯 감이 안오네요ㅠ",0,https://cafe.naver.com/ca-fe/ArticleRead.nhn?clubid=21771803&page=12&userDisplay=50&inCafeSearch=true&searchBy=0&query=%EC%BD%94%EB%82%98+%ED%99%94%EC%9E%AC&includeAll=&exclude=&include=&exact=&searchdate=2020-07-312021-01-31&media=0&sortBy=date&articleid=522676&referrerAllArticles=true,오닉오살거얌,"1,056",2020-10-24 16:26:00,
522669,"[리콜후기] 리콜 후 100% 충전, 이상 변화 현상","리콜 후 며칠동안 계속 주행을 하니 주행가능거리가500km까지 올라가더군요. 그런가보다 하고 오늘100%까지 충전을 해보니 갑자기 10km가 사라지네요.보시다시피 99%에서 주행가능거리는 499km입니다.그런데 완충 후 확인해보니 주행가능거리가 490km네요..이거 뭔가 좀 쎄한 느낌이 드는데요.제가 지난 3월 BMS업데이트 하기 전 증상이 이것과꽤 유사합니다. 그때 배터리 모듈 교체를 받았지요.물론, 그때는 주행가능거리 평상시보다 20% 가량 적게줄어들었지만 이번 업데이트 후 갑자기 10km가 사라지는현상은 불안감이 들기에 충분합니다.코나의 배터리는 294개의 배터리를 98개의 셀로 만들고이것을 5개의 모듈 어셈블리에 나누어 넣은 형태인데원래 1개의 셀만 문제가 있어도 오류가 어떤 방향으로든증상으로 나타나게 되어 있습니다.(그래야만 하잖아요ㅠㅠ)BMS와 5개의 센서가 어디까지 관리할 수 있을지,배터리 마진과 화재의 연관성,일반 냉각수(녹색)이 화재 확산에 미치는 영향,리콜로 인한 충전중 10분 배터리 점검 로직 문제,차체 하부 보강 문제,그리고 보상 문제 등현대는 좀더 명확하게 소비자들에게 설명해야 합니다.이 시점이 현대가 세계 정상급의 전기차 제조 회사가되느냐 마느냐의 중요한 기점이라고 생각됩니다.더이상 국내 소비자를 외면하지 마시길 바랍니다.",1,https://cafe.naver.com/ca-fe/ArticleRead.nhn?clubid=21771803&page=12&userDisplay=50&inCafeSearch=true&searchBy=0&query=%EC%BD%94%EB%82%98+%ED%99%94%EC%9E%AC&includeAll=&exclude=&include=&exact=&searchdate=2020-07-312021-01-31&media=0&sortBy=date&articleid=522669&referrerAllArticles=true,바당보름I코나I제주,610,2020-10-24 16:14:00,
522640,코나ev 리콜..참,"작년 bmw보다 올해 코나가 더 시끄럽네요그도그럴것이 bmw는 모든 제조사의 내연기관차의 문제는 아니지만, 코나ev는 모든전기차의 잠재적인 불량가능성이 특정차량에 심하게 보여졌단 생각이 드네요..요즘 제일 씁쓸한건.. 몇몇 충전소, 주차장등에 코나이용금지라고 써있는걸 볼때입니다.이부분은 제조사가 잘못한 손해를 소비자가 보게되는거죠특히나 코나는 일종의 리콜확인서?같은 이차량은 조치가 된차량이라는 증빙자료가 별도로 없다보니..아마 코나이용금지를 적어놓은 시설에서 코나에 화재발생시에는 자기들도 미리 고지를 했으니 차주에게 책임을 묻겠죠..",1,https://cafe.naver.com/ca-fe/ArticleRead.nhn?clubid=21771803&page=12&userDisplay=50&inCafeSearch=true&searchBy=0&query=%EC%BD%94%EB%82%98+%ED%99%94%EC%9E%AC&includeAll=&exclude=&include=&exact=&searchdate=2020-07-312021-01-31&media=0&sortBy=date&articleid=522640&referrerAllArticles=true,예주니I아이오닉I서울,410,2020-10-24 14:29:00,
522636,와 현대의 적극적인 리콜,우리집 아래까지 찾아왔어요저는 입원중인데 마나님에게 전화를 하니 안받아서 올라가서셔 초인종을 눌러주세요 죄송합니다 라고 문자를 남겼는데 진짜 올라가서 키를 받으시고 조치를 취하고 키를 가저다 주시겠다고너무 이렇게 친절하시니 더 찜짐 합니다몇일전 2차 블루로 방문 리콜까지 했거든요 전부 le배터리 뭐시기 까지 했는데 또 찾아오시니까 이건 뭐지? 이렇게 까지 적극적이다는건이렇게까지 위험하다 아닐까요?왠지 코나 전부 베터리 교체 할것같은 불안한 느낌의 느낌 이네요 쩝,1,https://cafe.naver.com/ca-fe/ArticleRead.nhn?clubid=21771803&page=12&userDisplay=50&inCafeSearch=true&searchBy=0&query=%EC%BD%94%EB%82%98+%ED%99%94%EC%9E%AC&includeAll=&exclude=&include=&exact=&searchdate=2020-07-312021-01-31&media=0&sortBy=date&articleid=522636&referrerAllArticles=true,리마틴ll레이EVll김해,839,2020-10-24 14:22:00,
522602,"잇단 코나 전기차 화재, 타 들어가는 고객 마음부터 헤아려야","[기자수첩] 잇단 코나 전기차 화재, 타 들어가는 고객 마음부터 헤아려야소비자들은 구조적 결함을 의심하고 있지만 이번 리콜은 배터리관리시스템(BMS)을 업데이트하고, 점검을 통해 과도한 배터리셀 간 전압편차와 급격한 온도 변화 등 배터리 이상 징후가 발견됐을 때만 배터리를 즉시 교체해준다는 전제가 깔려 있다.당초 제조사 입장에서는 추가적으로 이상이 발견되지 않을 경우 업데이트된 BMS의 상시 모니터링 과정에서 추가 이상 변화 감지 시 충전중지와 함께 시동이 걸리지 않게 제한하며 경고 메세지를 소비자 및 긴급출동서비스 콜센터에 자동 전달해 화재 발생 가능성은 최소화할 수 있을 것이라고 강조했다.초기에 화재 문제가 터졌을 때 전기차 고객들이 우려를 드러내자 자동차 제조사는 수많은 차량 가운데 한 대의 사례라 일반화하기 어렵다는 입장을 내세웠고, 배터리업체는 특정 배터리의 문제가 아니라고 반박했다. 이런 상황에서 화재원인을 규명해야 할 국토부조차 제 역할을 수행하지 못하다가 국정감사가 시작될 즈음에서야 배터리 결함 가능성을 발표하면서 타이밍을 놓쳤다는 비판에서 자유롭지 못하게 됐다.하지만 국가와 산업을 우선 생각하다가 가장 중요한 근본인 고객 보호가 뒷전으로 밀려났다는 점을 짚어보지 않을 수 없다. 또한 열네 번의 화재가 날 때까지 고객의 목소리에 좀 더 귀 기울이지 않다가 호미로 막을 것을 가래로 막게 생겼다.이제 친환경과 미래를 지향하며 전기차 코나EV를 구입한 고객들은 차를 몰 때나 주차할 때나 주위의 따가운 시선을 의식하지 않을 수 없게 됐다.미래 전기차 시장의 리더가 되고자 드라이브를 거는 완성차 업체와 비약적인 발전에 가속도를 내는 배터리업체, 그리고 정부 당국은 타 들어가는 고객의 마음을 헤아려 철저한 원인 규명과 치밀한 대책 마련에 나서야 한다. 고객들이 자신의 애차(愛車)가 잠재적 발화물 취급을 받는다는 사실에 불쾌감보다는 생명에 대한 우려가 앞선다고 말하는 것이 어떤 의미인지 되새겨 볼 필요가 있다.http://www.updownnews.co.kr/news/articleView.html?idxno=224560",2,https://cafe.naver.com/ca-fe/ArticleRead.nhn?clubid=21771803&page=12&userDisplay=50&inCafeSearch=true&searchBy=0&query=%EC%BD%94%EB%82%98+%ED%99%94%EC%9E%AC&includeAll=&exclude=&include=&exact=&searchdate=2020-07-312021-01-31&media=0&sortBy=date&articleid=522602&referrerAllArticles=true,뭉치I코니모3I서울,551,2020-10-24 12:20:00,
522536,리콜후 급속 충전중 에러로 충전 멈춤,코나 리콜 후 충전할때가 되서 매번 100% 충전하던 급속충전으로 충전을 하던중 91%에서 멈춰서 가서 보니 이렇게 에러가 뜨고 충전이 멈췄네요 ㅠㅠ전에는 이런적이 한번도 없었는데요 ㅠㅠ충전거리도 얼마안되고 해서 혹시나 해서 다시 연결하고 충전 시작했더니 1%정도 지나고 92%에 다시 동일 에러로 멈췄네요 ㅠㅠ그래도 시동은 걸려서 집에는 왔습니다 ㅋㅋ다들 조심 운전하세요,0,https://cafe.naver.com/ca-fe/ArticleRead.nhn?clubid=21771803&page=12&userDisplay=50&inCafeSearch=true&searchBy=0&query=%EC%BD%94%EB%82%98+%ED%99%94%EC%9E%AC&includeAll=&exclude=&include=&exact=&searchdate=2020-07-312021-01-31&media=0&sortBy=date&articleid=522536&referrerAllArticles=true,지니어l코나l서울,622,2020-10-24 09:31:00,
522468,전기차 충전소 관련 의견 1분만 부탁드립니다.,"안녕하세요 저는 현재 전기차 충전소 관련하여 팀프로젝트를 진행 중인 대학생입니다.전기차 충전소와 관련하여 어떠한 문제점이나 불만이 있으신지 댓글로 알려주시면 너무나도 좋은 참고 자료가 될 것 같아 부탁드립니다. 특히 현대차 코나 EV등 국산 전기차 충전에서의 문제점도 알려주시면 감사하겠습니다.예상하기로는 충전소가 충분하지 않음, 잦은 고장, 충전소 당 충전기 수 부족, 오래 걸리는 충전시간 등이 있을 것 같습니다.감사합니다!!",1,https://cafe.naver.com/ca-fe/ArticleRead.nhn?clubid=21771803&page=12&userDisplay=50&inCafeSearch=true&searchBy=0&query=%EC%BD%94%EB%82%98+%ED%99%94%EC%9E%AC&includeAll=&exclude=&include=&exact=&searchdate=2020-07-312021-01-31&media=0&sortBy=date&articleid=522468&referrerAllArticles=true,온천원숭I서울,277,2020-10-23 23:49:00,
522441,코나 화재 기사를 보면서,모르고 있으면 남의 나라 이야기이지만전기차 소유자로서 코나 화재 동영상등을 보면아찔한 느낌이 드네요..테슬라나 타이칸도 초기에 화재 소식이 있었지만 ...빨리 원인을 찾고 기술이 안정화되어 불안하지 않게.운전했으면 해요,0,https://cafe.naver.com/ca-fe/ArticleRead.nhn?clubid=21771803&page=12&userDisplay=50&inCafeSearch=true&searchBy=0&query=%EC%BD%94%EB%82%98+%ED%99%94%EC%9E%AC&includeAll=&exclude=&include=&exact=&searchdate=2020-07-312021-01-31&media=0&sortBy=date&articleid=522441&referrerAllArticles=true,자유인 i pace 용산,288,2020-10-23 22:02:00,
522411,현대 자동차 불매운동~~!!,"코나 화재와,sk배터리 탑재,어이없는 bms업데이터등 코나ev 고객들을 기만하고,하루 하루 불안에 떨게하는 현대자동차 불매운동 해야 하는거 아닌가요?화재 원인도 모르는 불이 언제 날지도 모르는 차를 탈수밖에 없는 코나 차주는 매일 불안합니다..( 원인 알면서 모른척인지...?)40분 충전에 30분만 충전...언제 어디서든 ev경고등 들어와 운행중지될지...코나ev 주차장,충전소등 출입금지...스트레스로 대머리 되는건 아닌지...현대자동차 코나ev구입한 고객은 무슨 호구인가요?짜증이 치밀어 오르네요.코나ev 관련 국민청원 마구,마구 올려주세요~~~!",5,https://cafe.naver.com/ca-fe/ArticleRead.nhn?clubid=21771803&page=12&userDisplay=50&inCafeSearch=true&searchBy=0&query=%EC%BD%94%EB%82%98+%ED%99%94%EC%9E%AC&includeAll=&exclude=&include=&exact=&searchdate=2020-07-312021-01-31&media=0&sortBy=date&articleid=522411&referrerAllArticles=true,오뚜기l코나l포항,"1,149",2020-10-23 20:54:00,
522376,최근 코나 전기차 화재는 현대에서 미리 손을 쓴 모양이네요,자기 차에 화재가 발생하면당연히 원인을 밝히고보험사에서는 그에 따라 자차 처리될지혹은 책임소재에 따라서 청구하게 되는데차주가 감정의뢰를 하지 않았군요..그 말은현대차에서 모든 배상과 보상절차를 끝냈다는 얘기입니다..https://news.naver.com/main/read.nhn?mode=LSD&mid=sec&oid=092&aid=0002202843&sid1=001,0,https://cafe.naver.com/ca-fe/ArticleRead.nhn?clubid=21771803&page=12&userDisplay=50&inCafeSearch=true&searchBy=0&query=%EC%BD%94%EB%82%98+%ED%99%94%EC%9E%AC&includeAll=&exclude=&include=&exact=&searchdate=2020-07-312021-01-31&media=0&sortBy=date&articleid=522376&referrerAllArticles=true,블랙쿱I코나l경기,967,2020-10-23 19:27:00,
522373,"김현미 ""코나 전기차 화재 조사 결과 문제 발견되면 책임 묻겠다”",https://news.naver.com/main/read.nhn?mode=LSD&mid=sec&oid=092&aid=0002202843&sid1=001흠.......,1,https://cafe.naver.com/ca-fe/ArticleRead.nhn?clubid=21771803&page=12&userDisplay=50&inCafeSearch=true&searchBy=0&query=%EC%BD%94%EB%82%98+%ED%99%94%EC%9E%AC&includeAll=&exclude=&include=&exact=&searchdate=2020-07-312021-01-31&media=0&sortBy=date&articleid=522373&referrerAllArticles=true,주적은현대I코나I인천,404,2020-10-23 19:20:00,
