post_id,cmt_content,cmt_author,cmt_created_at
956437,글쎄요. 제 페리오닉과 EV6는 지차저 공용완속으로 실패한 적이 없어요. 물론 200V 3kW짜리 충전기로 콘센트에 꼽아 충전해도 아직 그런 적이 없었어요.,파랭이IEV6I대전,2022-08-08 00:40:00
956437,완속충전시 문제로 iccu 업글이 있었는데 관련이 있지 않을까요??,범 스톤Iev6I대구거창,2022-08-08 00:47:00
956437,아이오닉 gv70 모두 비슷한 문제가 있습니다. 70도 최소로 충전하고 있구요.. 충전기 온도 문제인데. 날씨 풀리면 괜찮아질것 같습니다,티케이leGV70l경남,2022-08-08 02:46:00
956437,가능하다면 충전 케이블을 48A 짜리 현대 정품을 충전기에 꽂아 쓰시면 됩니다.,티케이leGV70l경남,2022-08-08 02:47:00
956437,"저도 동일증상입니다1달 멀쩡히 타다가 최근 일주일에 충전중 실패 뜨네요.,저번주에 사업소에서 펌웨어 업데이트 했는데?..그게 원인 인지...최대에서 에러떠서 감소로 변경하니 에러없이 완충되었네요",의성l포터evl슬레이트,2022-08-08 06:46:00
956437,다른 완속충전기에서도 시도해보셨을까요?? 만약 정상적으로 된다면 충전기 고장의심도 해보심이 어떨까 싶습니다. 저도 겪은 문제라..,레토l아이오닉5l서울,2022-08-08 07:19:00
956437,저도 몇번 그런 증상 있었는데 아마 충전기 발열 때문이지 않을까 싶습니다. 충전기 케이블이 길어서 다 안 풀고 충전기에 말린 상태로 충전을 했을때 몇번씩 끊어지곤 했는데 최근 몇번은 충전 케이블을 다 풀어 바닥에 늘어트리고 하니 안 끊어 졌습니다.,이브llev6ll양산,2022-08-08 07:37:00
956437,니로도 그럽니다 차에 문제가 있는거 같아요 코나로 충전하면 괜찮네요,저스틴로즈I코나I경북,2022-08-08 22:32:00
956437,저도 그래요 현기 기술의 한계인가봐요 ㅠ,바람I모3EV6IIX3I서울,2022-08-18 19:33:00
956437,저도 지금 계속 그러는데 혹시 충전기는 어떤거 쓰시나요??,쭌쭌이IEV6I광주,2022-08-25 21:22:00
956437,1년도 안된 차지비입니다 최대충전시 5대중에 다 똑같이 중단됩니다,웅희윤파파IEV6I화성,2022-08-28 09:31:00
956437,저도 계속 에러가 나요~ 최소로 충전 합니다. 30일날 센터 방문 예약한 상태 입니다.,오조아I아오5I김해,2022-08-28 09:21:00
956437,시간 가능하실때 다른곳 급속.완속. EPIT.에서도충전테스트해보세요 그리고 테이타 남겨놓고 센터에 보여주세요 그래야 암말 안해요,웅희윤파파IEV6I화성,2022-08-28 09:30:00
956437,네~ 그래야겠네요~,오조아I아오5I김해,2022-08-28 09:31:00
950477,이거 실내v2l 없으면 못달지 않아요? ㅠㅠ 실내v2l 이런건 좀 기본으로 넣어주지 ㅠㅠ..,넷아트I오닉5I경남,2022-08-02 09:39:00
950477,운행중에는 V2L기능안될걸요....,탄탄이 니플 광주,2022-08-02 09:51:00
950477,됩니다,귀연 lev6l 부천,2022-08-02 10:08:00
950477,실내V2L은 무저건 넣어야할 옵션이죠ㅋㅋ 1년 넘게 너무 잘씁니다^^ 여행중에 와이프는 차안에서 에어컨 시원하게 틀어놓도 헤어드라이기로 머리말리고 라면도 끓여먹고 전자렌지 데워먹고^^ㅎㅎ 애들 집에서 만화볼때 혼자 주차장에서 시원하게 에어컨 틀어놓고 우영우 보면 세상 행복합니다^^ㅎㅎㅎ,전기만I전기차5I서울,2022-08-02 10:10:00
950477,창문 좀 열어놓고 실외v2l에 멀티탭 연결해서 쓰면안되나요;;??,아빠왔다I경기,2022-08-02 10:34:00
903767,"코나, 니로, 쏘부, 오리지날 아이오닉등 V2l 미적용 전기차에 설치하는 현대 튜익스 순정V2l 인버터 상품의 출시는 예정 없다니 꼭 필요하다면 사제를 설치하는 방법 밖에 없는것 같습니다.",오아식스I니로I제주,2022-06-19 20:30:00
903767,쓰고 보니 그런 상품 출시하면 엄청 잘팔리겠네요~ 1.5k라도 좋으니 이참에 현대에서 하나 출시하시길,오아식스I니로I제주,2022-06-19 20:40:00
903767,내연 플렛폼과 V2L은 연관이 없습니다. 신형니로와 니로 플러스는 ICCU 가 추가로 들어간것일뿐입니다. 다만 이 둘의 용량이 다릅니다. 신형 니로는 E-GMP 플렛폼에 쓰인것과 동일 용량이 들어가 3.6kw까지 출력이 가능하고 니로 플러스는 1.5kw까지만 가능합니다. 같은건 고전압 배터리에서 바로 빼내쓰는것 일뿐입니다. 인버터로 개조 하는것은 고저압 배터리에서 바로 못 빼내쓰고 12V 배터리를 거쳐서 쓰는것이라 한계가 있고 ICCU를 추가로 장착하고 다는건 외부에서 사제로 못하는 작업 입니다.,죠리뿅IMODEL3I서울,2022-06-19 20:34:00
903767,니로 플러스 V2L은 ICCU가 추가로 들어가는것은 아니구요 LDC 저전압 DC12V를 별도의 인버터를 추가하여 AC220로 변환해주는 시스템으로 알고있습니다.,뽕고,2022-07-15 10:43:00
866085,ICCU 소프트웨어 업데이트 해서 해결 안되면 교체해야 완속 충전 된다더라구요. 저도 소프트웨어 업데이트 하고도 완속 충전 안되서 센터 예약해놓고 기다리는중입니다..;,조단I아이오닉5I강원,2022-05-06 23:11:00
866085,교체라는말은 기계자체를 교체해야한다구요?? 조단님은 개인충전기인가요??,KDI아이오닉5I천안,2022-05-06 23:18:00
866085,완속은 개인충전기 공용충전기 다 안되요.. ICCU 교체해야될거 같습니다.,조단I아이오닉5I강원,2022-05-07 11:52:00
866085,무슨 저런충전기를 설치했데요;;,분바l조에l창원,2022-05-06 23:26:00
866085,그래도 급속은 잘 된답니다 ..,KDI아이오닉5I천안,2022-05-06 23:51:00
866085,완속이 기기가 더 많기도 하고 집밥은 완속이 좋은데 급속만 되면 차 한시간 이상 점거불가라 금방 빼줘야할텐데요 ㅠ,분바l조에l창원,2022-05-07 00:05:00
866085,네 ㅜ 이래저래 답답합니다. 추가 설치한다고는하는데 언제 할지도 모르구요,KDI아이오닉5I천안,2022-05-07 00:28:00
866085,530e 완속충전만 가는한 차량인데 저희 아파트 카드인식하고 충전기 물려도 시작버튼이 안뜨네요 ㅜㅜ 이런걸까요?,가즈아l530el서울,2022-05-07 23:44:00
866085,저는 애초에 시도를 안해봤어요관리실에서 안된다기에... 그렇다고 테스트를 해보자고 몇십하는 케이블을 살수도 없구요 ㅜㅜ,KDI아이오닉5I천안,2022-05-07 23:46:00
866085,아파트 다른 충전하는분 케이블이라도 빌려봐야할 판국이네요..,가즈아l530el서울,2022-05-07 23:47:00
831651,저도 그랬었는데 아이오닉5 리콜하고 나니 괜찮아 졌습니다.,중현I아이오닉5I서울,2022-04-06 01:30:00
831651,리콜연락이 와서 하셨나요?,둥이둥이l오닉l용인,2022-04-06 12:27:00
831651,"네 현대자동차에서 리콜 우편이 와서 했습니다. 부작용이 생길것 같이서 가능하면 리콜 안하려고 했는데, 스타코프 고객센터에서 리콜 받으면 해결 된다고 해서 리콜 받았습니다. 리콜 목록에 ICCU인가 업데이트가 포함되어 있었습니다.",중현I아이오닉5I서울,2022-04-06 16:48:00
831651,잘 해결되서 다행이네요..답해주셔서 감사합니다,둥이둥이l오닉l용인,2022-04-06 17:53:00
