id,title,content,likes,url,author,views,created_at,updated_at
1347528,현재 할인받고 아5 사는것과 페리 기다리는것 중 어떤게 더 좋을까요?,"하루 출퇴근 왕복 160 정도 나와서 주행량이 많습니다.내연기관 타고 있는데, 빨리 바꾸는게 유류비 절감이 많이 될 것 같습니다.집/회사 밥 모두 있어서 충전 걱정은 없습니다.중고 전기차가 많이 떨어졌다고 해서 찾아봤는데 생각보다는? 많이 안떨어진듯 하네요.프레스티지에 4륜 알아보는데 22년 이상식 보면 한 4천쯤은 줘야 하겠더라구요그런데 지금 아5 신차 보조금 받고 거의 딱 5천정도에 실구매 가능한것 같습니다.현재 바로 구매시엔 중고보단 신차가 나을듯 한데요,신차를 고민하자니 또 기다리면 페리소식이 있어서, 페리를 기다렸다가 사는게 어떤지..페리가 나올쯤이면 보조금이 또 어떻게 될 지 몰라서 ㅎㅎ여러분 의견이 궁금하네요.",1,https://cafe.naver.com/ca-fe/ArticleRead.nhn?clubid=21771803&page=9&userDisplay=50&inCafeSearch=true&searchBy=0&query=%EC%BD%94%EB%82%98+%ED%99%94%EC%9E%AC&includeAll=&exclude=&include=&exact=&searchdate=all&media=0&sortBy=date&articleid=1347528&referrerAllArticles=true,흰코I경기,611,2023-12-05 14:39:00,
1345223,현대자동차 기아 11월 전기차 판매 '반토막'.,"현대자동차 기아 11월 전기차 판매 '반토막'...하이브리드 판매는 '껑충'현대차 판매량 5.0% ↑...전기차는 44.5% ↓현대차는 11월 한달동안 아이오닉5 등 전기차량 판매량이 4433대로 집계됐다. 이는 지난해 같은 기간에 판매량 7989대보다 44.5% 줄어든 것이다. 사실상 거의 반토막이 났다. 올 10월과 비교해도 12.7% 감소했다.기아의 경우도 11월 전기차 판매량은 지난해 11월 이전에 출시된 차량 모델만 고려했을 때 2107대로 집계됐다. 기아 역시 전년 동월과 비교해서 44% 감소했다. 전월과 비교하면 30% 감소다.올 1월~11월 전기차 누적판매량도 5만8893대로, 전년 동기의 판매량 6만8076대보다 13.5% 떨어졌다. 같은 기간 '넥쏘' 수소차도 지난해 9718대에서 올해 4249대로 56.3% 감소했다. 지난해 11월 1096대나 팔렸던 '넥쏘'는 올 11월에 232대 판매하는데 그쳤다. 무려 78.8% 줄었다.거의 모든 전기차종 판매량이 마이너스 행진을 기록한 반면 하이브리드 차량 판매는 약진했다. 11월 현대차 하이브리드 차량 판매량은 1만6526대로, 전년 동월 4228대보다 자그마치 290.9%나 늘었다. 올 10월 판매량 1만3602대와 비교해도 21.5% 증가했다.11월 그랜저 하이브리드 판매량은 전년 동기 대비 531.4%, 코나 하이브리드 판매량은 474.7%, 싼타페는 398.1%나 늘어나면서 하이브리드 판매량 증가를 견인했다. 올 1월~11월 하이브리드 누계 판매량도 전년 같은 기간 판매량 5만1925대보다 137.8% 증가한 12만3465대를 기록했다.이처럼 올들어 전기차 판매가 부진하고 하이브리드 판매량이 늘어난데는 부족한 충전 인프라와 줄어든 보조금 영향이 크다는 분석이다. 전기차 구매부담이 늘어나면서 소비자들은 구매를 꺼리고 있고, 오히려 연비가 좋은 하이브리드쪽으로 발길을 돌리고 있는 것으로 보인다. 게다가 전기자동차에 대한 화재 위험성과 급발진 등 안전성이 담보되지 않는 것도 구매를 꺼리는 요인으로 작용하고 있다.https://www.newstree.kr/newsView/ntr202312010018현대차는 11월 한 달 간 전년 동월 대비 18.3% 증가한 7만 2058대를 판매했다. 최대 400만원까지 할인했던 그랜저는 7980대 팔렸고, 200만원 할인한 코나도 3209대 판매됐다. 최대 17%까지 할인했던 캐스퍼도 5701대 판매되며 전월대비 56.3%나많이 팔렸다.올들어 주춤한 전기차도 할인에 힘입어 판매량이 반짝 상승했다. 아이오닉 5는 1723대 판매되면서 전월 대비 17.1% 늘었고, 아이오닉 6 역시 618대로 전월 대비 30.9% 판매량이 늘었다. G80 전기차모델도 1723대 판매되며 전월 대비 76.3% 늘었다.다만 최대 600만원의 할인혜택을 제공했던 전기차 EV6는 오히려 판매량이 줄었다. EV6는 한달간 1096대 팔리면서 전년보다는 51.9%, 전월과 비교해도 29.9% 줄었다. EV9도 375대로 전월 대비 55.0% 줄었다.KG모빌리티도 토레스 전기차모델인 '토레스EVX' 신차효과를 톡톡히 보면서 내수 판매량 5000대를 돌파하는데 성공했다. KG모빌리티는 11월 국내시장에 5050대를 판매했다.지난달 첫 고객 인도를 시작한 토레스EVX는 한달간 1667대 판매됐다. 단일 모델 판매 5000대를 넘겼던 과거 토레스의 인기에는 못미치지만, 지난해 반도체 수급난으로 차량 출고가 어려웠던 것을 감안하면 올해 토레스EVX의 첫 성적은 양호하다는 평가다.연간 판매량 결산이 한달도 채 남지 않은 만큼 12월 한달 간 완성차 5사의 할인 프로모션도 이어질 전망이다. 현대차·기아는 전기차 재고 소진을 위해 EV 세일페스타를 자체적으로 실시하고, 중견 3사도 저금리 할부혜택과 차량 할인을 이어갈 방침이다.https://n.news.naver.com/article/119/0002775275?sid=101",2,https://cafe.naver.com/ca-fe/ArticleRead.nhn?clubid=21771803&page=9&userDisplay=50&inCafeSearch=true&searchBy=0&query=%EC%BD%94%EB%82%98+%ED%99%94%EC%9E%AC&includeAll=&exclude=&include=&exact=&searchdate=all&media=0&sortBy=date&articleid=1345223&referrerAllArticles=true,톰I아5모YI서울,"2,045",2023-12-01 19:39:00,
1341572,제 상황에서 전기차 추천하시나요??(초초단거리),"* 관련된 주제에 대해 미리 카페내 검색해 보셨습니까? : 넹* 전기차 종류, 지역 : 서울* 질문 내용 :연 5000km 탈까말까 합니다초초단거리 왕복 2km 미만 주 3~5회단거리 왕복 10km 미만 주 2~3회장거리 왕복 400km 이상 연 5~6회3인 가족에 가끔 2인 추가(부모님) 입니다.이거만 보면 가솔린 추천하실텐데문제가 초초단거리가 굉장한 오르막내리막입니다.500m 도 안되는 본가에 김치 가지러 가는데내리막 쭉 내려가서 다시 오르막 쭉 올라야 하고같은 아파트 단지에 사는 장모님댁은(대단지)대각선 끝과 끝인데다가 오르막 짱이네요.지금 1800cc 준중형 10년째 타고 있는데오르막 오를때 굉음이 우르르쾅쾅 ㅠㅠ단거리 과부하가 많으면 전기차가 괜찮다고 해서요.생각하는 모델은 올해 구입하면 아이오닉5 고좀 기다릴 생각으로 EV5도 고민하고 있습니다.아니면 좀 cc가 큰 가솔린을 타는게 좋을까요??가솔린은 그랜저2.4 생각하고 있어요.다른건 상관없고 좀 조용했으면 좋겠어요 ㅠㅠ충전은 집밥 가능합니다.최근 아파트 단지 내에 고속이 많이 설치됐어요.전기차로 갈지 아니면 가솔린으로 갈지추천부탁드립니다.",1,https://cafe.naver.com/ca-fe/ArticleRead.nhn?clubid=21771803&page=9&userDisplay=50&inCafeSearch=true&searchBy=0&query=%EC%BD%94%EB%82%98+%ED%99%94%EC%9E%AC&includeAll=&exclude=&include=&exact=&searchdate=all&media=0&sortBy=date&articleid=1341572&referrerAllArticles=true,음메송아지,792,2023-11-26 21:43:00,
1341233,"전기차 화재 사고 해마다 증가...""과충전·급속충전 금물""","전기차 화재 사고 해마다 증가...""과충전·급속충전 금물""전기차 보급이 늘어나면서 화재 사고가 해마다 늘어나고 있습니다.전기차의 경우, 불이 나면 빠르게 번지고 연소도 쉽지 않아 화재 원인에 대한 사전 예방이 중요합니다.시뻘건 화염이 어둠을 뚫고 자동차를 집어삼킬 듯 치솟습니다.지난 13일 새벽, 당진영덕고속도로를 달리던 전기 택시가 화물차를 들이받으며 시작된 불입니다.당시 사고로 50대 택시 기사가 다쳐 병원으로 옮겨졌습니다.하루 전날에는 공영주차장에서 충전하던 전기차에서 불이 났습니다.불이 나자 주차장 내부가 한 치 앞을 가늠하기 어려울 정도로 연기에 휩싸였습니다.전기차 보급이 빠르게 늘어나면서 전기차 화재도 해마다 증가하는 추세입니다.화재 발생 비율을 살펴보면 지난해 전기차 만 대 가운데 1.12대에서 화재가 나 5년 전과 비교해 3배 넘게 늘었습니다.전기차의 경우, 배터리에서 발생하는 열 폭주 현상으로 불이 옮겨붙는 속도가 빠르고 연소도 쉽지 않아 추가 피해로 번질 가능성이 큽니다.그렇다면, 언제 어떻게 전기차에서 불이 날까.무엇보다 충전이 완료된 이후에도 충전을 계속하거나 급속 충전을 반복하면 배터리에 침적물이 쌓이면서 불이 나기 쉽습니다.이 때문에 되도록 완속 충전을 하고 충전율도 80%대를 유지하는 것이 좋다고 전문가들은 조언합니다.이를 위해 전기차 충전 방식을 개선하는 것도 방법이라는 지적이 나옵니다.또, 전기차 충전 시 충전 단자에 물기가 새어 들어갈 경우, 감전·화재로 이어질 가능성도 있습니다.특히 겨울철의 경우 눈에 젖은 상태에서 충전하지 않도록 주의해야 합니다.강한 충격에도 화재가 발생하기 쉬운 만큼, 운전자들의 안전 운행 역시 필요합니다.다만 화재가 시작된 이후에는 개인이 초기 진화를 하기 쉽지 않아 우선 대피한 뒤 소방당국에 신고해야 피해를 줄일 수 있습니다.https://n.news.naver.com/article/052/0001964812?sid=102",1,https://cafe.naver.com/ca-fe/ArticleRead.nhn?clubid=21771803&page=9&userDisplay=50&inCafeSearch=true&searchBy=0&query=%EC%BD%94%EB%82%98+%ED%99%94%EC%9E%AC&includeAll=&exclude=&include=&exact=&searchdate=all&media=0&sortBy=date&articleid=1341233&referrerAllArticles=true,톰I아5모YI서울,"2,665",2023-11-26 08:46:00,
1340730,"전기차 LFP 배터리에 많이 쓰는 이유, 실 주행거리","우리가 전기차 LFP 배터리에 많이 쓰는 이유, 실 주행거리Why We're Excited about LFP Batteries for Electric Cars, Real Range2023년 11월 7일우리가 전기 자동차용 LFP 배터리에 열광하는 이유우리는 곧 다가올 새로운 기술, 특히 Ford, Rivian, Fisker 및 GM과 같은 브랜드의 인산철리튬(LFP) 배터리 화학 물질 확장에 대해 기대하고 있습니다.Tesla는 전 세계 Standard Range 모델의 팩을 사용하여 이미 몇 년 동안 LFP 게임에 참여해 왔습니다. 미국의 경우 이는 대부분 테슬라 모델 3 SR+였고, 나머지 세계에서도 LFP 기반 Standard Range Model Y를 사용할 수 있었습니다.Tesla는 장거리 및 성능 모델에서 주로 NCA(니켈 코발트 알루미늄 산화물)와 같은 니켈 기반 화학 물질을 사용하며 일부 오래된 팩은 NMC(니켈 망간 코발트 산화물)를 사용합니다.2024년을 예상하면 LFP 팩이 장착된 머스탱 마흐 Mustang Mach-E(""K3R4""가 포함된 VIN)가 더 많아질 것으로 예상됩니다.보급형 Fisker Ocean에 장착되어 있으며 LFP 리비안 전기차 출시가 곧 다가오고 있습니다. BMW는 2025년 출시를 위해 이 기술에 투자하고 있다고 밝혔으며 GM의 미래 예측 발표에서는 미래의 볼트 EV에 LFP 팩이 장착될 것이라고 발표했습니다.미래의 Bolt EV는 리튬인산철 배터리로 구동됩니다.이 전환이 주는 정책 및 비용 절감이 궁금하십니까?모든 새로운 LFP 모델과 데이터가 출시되기를 기다리는 동안 스탠다드 레인지 SR 모델 3 데이터를 수집하고 분석하여 이러한 배터리가 실제 세계에서 어떻게 유지되는지 이해해 왔습니다.그런데 왜 인산철(LFP) 배터리에 그렇게 열광하는 걸까요?비용 절감.LFP 배터리는 생산 비용이 더 저렴하며 이는 더 넓은 인구 집단의 쇼핑객을 위해 더 저렴한 EV를 의미합니다. NCA 배터리 셀은 kWh당 약 $120.30, NMC는 약 $112.70/kWh, LFP는 최저 $98.50/kWh입니다.더 긴 수명.LFP 배터리는 수명이 더 길기 때문에 NCA 또는 NMC 배터리보다 완전 충전 상태에서 방전 상태(또는 이와 동등한 수준)까지 더 많은 횟수를 사용할 수 있습니다.고속 충전으로 인해 노화에 대한 저항력이 높아졌습니다. Tesla의 예비 결과에 따르면 간헐적인 고속 충전은 주행 거리에 단기적인 급격한 영향을 미치지 않는 것으로 나타났습니다. 그러나 실험실 과학에 따르면 NCA 및 NMC 배터리는 빈번한 고전압, 고열 충전으로 인한 장기적인 성능 저하에 민감합니다. LFP 배터리의 경우에도 반드시 그런 것은 아닙니다. 이는 LFP 배터리가 3차원 결정 구조를 사용하고 분해되지 않고 고온을 견딜 수 있기 때문입니다.화재 위험이 낮습니다.리튬 이온 배터리 화재는 일반적으로 극심한 열 조건으로 인해 발생하며, 팩의 온도가 특정 한도를 초과할 때 발생하는 열폭주라는 현상에 의해 발생합니다. LFP 배터리의 경우 열폭주 온도는 270°C로 NMC의 경우 210°C, NCA의 경우 150°C입니다. 이로 인해 이동 중에도 매우 안전하게 사용할 수 있습니다.그리고 더 많은 LFP 기술을 채택하게 되어 기쁘지만 우리는 과학자이므로 LFP 팩 사용에 따른 절충안을 언급하고 싶습니다.에너지 밀도가 낮습니다.LFP 배터리는 동일한 크기의 배터리에서 약 30% 적은 에너지를 제공합니다. 즉, NCA 구동 차량과 동일한 주행 거리를 원한다면 더 많은 배터리를 추가해야 하며, 이는 더 많은 무게와 하드웨어를 의미합니다. 일부 모델의 경우 이는 0-60 가속도가 약간 낮아진다는 것을 의미합니다.영하의 온도에서는 성능이 저하됩니다.연구에 따르면 LFP 배터리는 구성에 따라 저온에서 전도성이 낮고 리튬 이온 확산이 느린 등 심각한 문제가 있는 것으로 나타났습니다. 실제로 이는 −20 °C(−4°F)보다 낮은 온도에서는 충전 속도가 좋지 않음을 의미합니다. NCM 배터리는 용량 유지 및 분극이 증가하여 성능이 훨씬 향상되었습니다. 그러나 개선되고 더욱 공격적인 열 관리를 통해 추운 날씨의 영향을 상쇄할 수 있을 가능성이 있습니다.여기서는 700대 이상의 LFP 기반 Tesla Model 3에 대한 예비 데이터를 사용하여 LFP 팩의 다른 특전 중 일부를 최근 Recurrent 차량에 포함된 340대의 니켈 기반 Model 3와 비교하여 안내합니다.LFP 모델의 위치LFP 및 비LFP Tesla 위치를 보여주는 지도LFP Tesla를 어디서 찾을 수 있는지 궁금하십니까?우리가 보는 것: 미국 전역에 걸쳐 LFP 및 비 LFP 배터리 팩이 상당히 고르게 분포되어 있습니다. LFP 팩은 보다 저렴한 표준 범위 모델로 제공되므로 많은 대도시 지역에서 인기를 얻고 있습니다.이것이 중요한 이유: 리튬 이온 배터리는 뜨거운 환경에 보관되는 것을 좋아하지 않지만 LFP 배터리는 열에 더 잘 견딜 수 있습니다. 더운 기후에 살고 있고 자동차가 햇빛 아래에 있어야 한다는 것을 알고 있다면, 결정을 내릴 때 이것이 좋은 고려 사항이 될 수 있습니다.트윈 트림 레벨.Nerdy Aside: LFP 배터리가 열 관련 노화 및 성능 저하에 대한 저항력이 더 높은 이유는 무엇입니까?간단히 말해서, LFP 구성의 Fe-PO 결합은 코발트 기반 배터리의 Co-O 결합보다 강하므로 남용(단락, 과열 등)될 경우 산소 원자를 제거하기가 훨씬 더 어렵습니다. 즉, 스트레스를 받는 경우 LFP 배터리는 급격한 온도 상승에 저항할 가능성이 더 높으며, 이로 인해 영구적인 배터리 손상이 발생하거나 심각한 경우 화재가 발생할 수 있습니다.추운 날씨또 다른 고려 사항은 추운 날씨입니다. 아직 미국의 극도로 추운 지역에서는 Model 3를 많이 볼 수 없지만, −20 °C(−4°F) 이하의 매우 추운(영하) 온도에서 팩이 얼마나 잘 충전되는지에 대한 의문이 있습니다. ). 그러나 극저온에서의 충전 속도는 영향을 받지만 주행 중 LFP 성능과 전력은 영향을 받아서는 안됩니다.캐나다, 노르웨이 및 기타 얼음이 많은 기후의 리뷰어와 테스터는 사전 조건을 적용한 경우에도 범위 손실이 NCA Model 3에서 볼 수 있는 것보다 몇 퍼센트 포인트 더 높을 수 있다고 보고합니다. LFP의 경우 빠른 충전을 위해 배터리를 충분히 따뜻하게 하면 시간이 더 오래 걸릴 수도 있습니다.최대 충전율운전자는 LFP Tesla를 100% 더 자주 충전합니다.우리가 본 것: 자동차에 LFP 배터리를 장착한 Tesla 운전자는 LFP가 아닌 배터리를 장착한 Tesla 운전자보다 90% 이상 훨씬 더 많이 충전합니다. LFP가 아닌 대부분의 모델은 50%~90% 충전 상태로 유지되는 반면, 대부분의 LFP 차량은 90%~100% 사이로 충전됩니다.이것이 중요한 이유: LFP 배터리는 높은 충전 상태를 더 잘 유지합니다. 즉, 정기적으로 100%까지 충전해도 다른 배터리 화학을 사용할 때만큼 성능 저하가 발생하지 않습니다.그럼...100%로 충전할까요, 아니면 80%로 충전할까요?우리가 가장 자주 받는 충전 질문 중 하나는 LFP Tesla 소유자로부터 우리의 충전 지침이 Tesla의 충전 지침과 충돌하는 이유를 궁금해하는 것입니다.모든 배터리를 30%에서 80% 사이의 충전 상태로 유지하도록 권장하지만 Tesla는 LFP 운전자에게 일일 주행 시 100%까지 충전해도 괜찮으며 일주일에 한 번 이상 충전할 것을 권장합니다.왜 불일치가 발생합니까? 두가지:LFP 화학 물질은 NCA 또는 NMC 배터리보다 높은 전하를 더 잘 견디는 것으로 알려져 있습니다. 이는 정기적으로 100%까지 충전된 LFP 배터리가 시간이 지남에 따라 동일한 방식으로 처리된 다른 배터리보다 성능 저하가 적다는 것을 의미합니다.LFP 배터리는 에너지 밀도가 낮기 때문에 추가 충전량은 이러한 팩을 장착한 자동차와 동등한 주행 거리를 의미합니다. 그러나 모든 리튬 이온 배터리의 경우 완전 충전을 피하면 수명이 연장됩니다. 단지 LFP 팩에서는 눈에 띄는 변화가 없을 수도 있습니다.Tesla의 배터리 관리 시스템(BMS)은 100% 충전 상태에서 재보정할 수 있으면 더욱 정확해집니다. 이는 모든 Tesla에 해당되지만 특히 LFP 모델에 해당됩니다. LFP 배터리는 전압 곡선이 매우 평탄합니다. 즉, NCA 배터리를 80%에서 보정하는 것보다 80%에서 보정하는 것이 더 어렵습니다. 이에 대해 더 자세히 알아보려면 계속 읽어보세요.(평평한 전압 곡선이 BMS 작업을 더 어렵게 만드는 이유)NCA 배터리를 사용하면 충전 상태가 증가함에 따라 전압이 선형적으로 증가하고 충전 상태가 감소함에 따라 전압이 감소합니다. 이는 BMS가 상대적으로 확인하기 쉬운 전압 정보를 사용하여 충전 상태를 추정할 수 있음을 의미합니다.그러나 LFP 배터리에서는 충전 상태에 따라 전압이 크게 변하지 않습니다. 이로 인해 특히 개별 셀의 경우 전압을 예측 변수로 사용하기가 더 어려워집니다. 주기적으로 100%까지 충전함으로써 BMS는 용량 예측을 재보정하고 이에 따라 범위 추정의 정확성을 재보정하기 위한 ""설정점""을 갖게 됩니다.실제 주행거리 범위올해 공개 조사를 통해 전 세계는 대부분의 Tesla에 표시된 대시보드 범위가 동일한 자동차가 실제로 얻을 수 있는 실제 달성 가능한 범위보다 높다는 사실을 알게 되었습니다. 평균 Tesla에서 관찰되는 일반적이고 달성 가능한 범위를 보여주기 위해 독점 값인 Real Range를 제시했습니다. 위의 차트는 Tesla가 일반적으로 얻는 EPA 범위의 정도와 이 값의 온도 의존성을 보여줍니다.적어도 Tesla Model 3의 경우 우리가 보는 것은 두 가지입니다.피크 주행거리는 LFP가 아닌 배터리에 비 LFP 배터리의 온도가 더 높을 때 발생하는 것으로 보입니다.LFP 모델은 LFP가 아닌 차량보다 EPA 주행거리 비율이 더 높은 것으로 보입니다.비록 예비적이긴 하지만 이 두 가지 결과는 모두 흥미롭습니다. 이는 NCA 팩의 약 60도와 비교하여 약 70도에서 가장 높은 범위를 얻는 것으로 보이는 LFP 배터리의 이상적인 작동 온도의 차이를 보여줍니다.그들은 또한 Standard Range Model 3에 대해 광고된 EPA 범위가 Long Range 및 Performance 모델에 대한 것보다 진실에 약간 더 가깝다는 것을 보여줍니다. Tesla 운전자가 자동차의 한계와 가능성을 이해하려면 현실 세계에서 실제 달성 가능한 범위가 무엇인지 아는 것이 중요합니다.Why We're Excited about LFP Batteries for Electric Cars",6,https://cafe.naver.com/ca-fe/ArticleRead.nhn?clubid=21771803&page=9&userDisplay=50&inCafeSearch=true&searchBy=0&query=%EC%BD%94%EB%82%98+%ED%99%94%EC%9E%AC&includeAll=&exclude=&include=&exact=&searchdate=all&media=0&sortBy=date&articleid=1340730&referrerAllArticles=true,톰I아5모YI서울,"3,417",2023-11-25 09:43:00,
1340597,"""눈앞에서 사람 불타""... 불붙은 아이오닉5 전기차 택시 운전자 구한 시민","""눈앞에서 사람 불타""... 불붙은 아이오닉5 전기차 택시 운전자 구한 시민부산에서 전기차 택시 건물 부딪쳐 화재귀갓길 30대 남성이 70대 운전자 구출해연제경찰서, 30일 유세림씨에 감사장 수여https://n.news.naver.com/article/469/0000772039?sid=102",1,https://cafe.naver.com/ca-fe/ArticleRead.nhn?clubid=21771803&page=9&userDisplay=50&inCafeSearch=true&searchBy=0&query=%EC%BD%94%EB%82%98+%ED%99%94%EC%9E%AC&includeAll=&exclude=&include=&exact=&searchdate=all&media=0&sortBy=date&articleid=1340597&referrerAllArticles=true,톰I아5모YI서울,705,2023-11-25 00:41:00,
1338545,전기차 배터리 인증제 도입 예정,,1,https://cafe.naver.com/ca-fe/ArticleRead.nhn?clubid=21771803&page=9&userDisplay=50&inCafeSearch=true&searchBy=0&query=%EC%BD%94%EB%82%98+%ED%99%94%EC%9E%AC&includeAll=&exclude=&include=&exact=&searchdate=all&media=0&sortBy=date&articleid=1338545&referrerAllArticles=true,일렉l스텝l,535,2023-11-22 10:11:00,
1332106,고속도로 달리던 아이오닉5 전기차 택시 충돌 후 화재...앞서가던 화물차 추돌 후 불,"고속도로 달리던 아이오닉5 전기차 택시 충돌 후 화재...앞서가던 화물차 추돌 후 불오늘(13일) 새벽 2시쯤 경북 청송군 파천면 청주영덕고속도로 영덕 방향 사일산 터널을 빠져나온 전기택시(아이오닉5)가 앞서가던 18톤 화물차를 추돌한 후 화재가 발생했다. 신고를 접수한 경북소방은 대규모 장비와 인력을 투입해 환자 이송과 화재진압에 나섰다. 이 사고로 택시기사 60대 변모씨가 얼굴 등을 크게 다쳐 병원으로 옮겨져 치료를 받고 있고 다행히 생명에는 지장이 없는 것으로 전해졌다. 경찰과 소방당국은 정확한 화재 원인과 피해규모, 사고 경위를 조사할 예정이다.(사진=송영훈 기자:한국도로공사 CCTV 캡쳐)오늘(13일) 새벽 2시쯤 경북 청송군 파천면 청주영덕고속도로 영덕 방향 사일산 터널을 빠져나온 전기택시(아이오닉5)가 앞서가던 18톤 화물차를 추돌한 후 화재가 발생했다.신고를 접수한 경북소방은 대규모 장비와 인력을 투입해 환자 이송과 화재진압에 나섰다.이 사고로 택시기사 60대 변모씨가 얼굴 등을 크게 다쳐 병원으로 옮겨져 치료를 받고 있고 다행히 생명에는 지장이 없는 것으로 전해졌다.경찰과 소방당국은 정확한 화재 원인과 피해규모, 사고 경위를 조사할 예정이다.https://www.nbntv.co.kr/news/articleView.html?idxno=3005696화물차 들이받은 전기차 화재...60대 운전자 다쳐오늘(13일) 새벽 2시쯤 당진영덕고속도로 영덕 방면 사일산 터널 앞에서 전기 택시가 앞서가던 화물차를 들이받았습니다.이 사고로 60대 택시 기사가 병원으로 옮겨졌고, 전기 택시에 불이 나 40여 분 만에 큰 불길이 잡혔습니다.경찰과 소방은 사고 경위와 화재 원인을 조사하고 있습니다.https://n.news.naver.com/article/052/0001959066?sid=102",0,https://cafe.naver.com/ca-fe/ArticleRead.nhn?clubid=21771803&page=9&userDisplay=50&inCafeSearch=true&searchBy=0&query=%EC%BD%94%EB%82%98+%ED%99%94%EC%9E%AC&includeAll=&exclude=&include=&exact=&searchdate=all&media=0&sortBy=date&articleid=1332106&referrerAllArticles=true,톰I아5모YI서울,"1,367",2023-11-13 08:30:00,
