post_id,cmt_content,cmt_author,cmt_created_at
1266121,이 글에서는 충전속도가 165kw찍는 상황에서는 3c 전체평균으로는 1.5c로 나왔다는데 어떻게 생각하시나요? 2시간 동안 풀악셀 해도 0.5c 라는게 좀 이해가 안되서요,아리장인I아5I공주,2023-08-16 00:02:00
1266121,"10~40% 구간이 2C 초과, 시간으로 보면 8분 정도 나오겠네요. 낮은 SoC에서는 C Rate를 높게 가져가도 배터리 수명 저하가 미미합니다. 그리고 LFP가 고방전 시 배터리 수명 저하가 크다는 루머가 자주 보이는데, NCM역시 DoD 100% 1C 만 되어도 수명이 절반 이하로 줄어듭니다.",베멤l모델3l부산,2023-08-16 07:45:00
1266121,"LFP는 인산철 배터리를 말합니다 배터리 지식도 없고 어떻게 묶음조합하고 충전을 하는지 정도 지식은 있어야 한다고 봅니다 직접 같은 A의 인산철 배터리와 리튬이온 배터리를 사서 자동차 방전됐을때 사용해보고 RC 드론에 사용해 보시면 어떤 배터리가 밀도가 높고 내부저항이 낮은지 알수 있습니다 지식도 없이 이렇다 저렇다 하는 것은 잘못된 지식을 전달 할수 있기 때문에 의견을 자제하는 것이 좋습니다 시중에 LFP,리튬이온 배터리 많습니다.",나I김포,2023-08-15 16:30:00
1266121,제가 다 맞지는 않지만 나름 저도 rc도 하고 인산철 보조베터리도 사용합니다 하이브리드 차량에 인산철이 왜 안들어갈까요? 훨신더 싼데 회사가 골이 비어서 안쓸까요... 자동차회사 부품하나도 10원까지 따집니다 부품이 몇개인데요 그만큼 인산철은 용도가 다릅니다 라는 저의 개인 생각입니다 다같이 생각해보자는 의견입니다🙂,달타냥l니로l광주,2023-08-15 16:34:00
1266121,"제가 인산철이 좋다고 드린 말씀이 아니었는데요 인산철은 순간출력이 안나와요 비행기 던지기로 이륙한번 실패하면 다시는 그배터리로 이륙이 안됩니다 (다시충전해야 함) 그리고 무거워요 단지 화재,폭팔에서 리튬퍼리머나 리튬이온보다 조금은 자유롭다는 것 외에는 장점이 없는 배타리입니다 지금 올리는 배터리는 50C배터리입니다 찦차,승합차등의 시동을 걸수 있는 순간 엄청난 출력을 냅니다 오해 없으시기 바랍니다",나I김포,2023-08-15 16:59:00
1266121,2C 출력은 순간출력을 낼수 없습니다.,나I김포,2023-08-15 16:35:00
1266121,재밌네요. 현대기아에서 코나 니로급 혹은 아이오닉 급에 lfp를 쓰면 그 유튜버는 또 뭐라고 할지 궁금해지네요. 현기차 전기차의 가격 경쟁력이 없는 상황에서 lfp를 안쓰고 경쟁력을 만들 수 있을지 의문이라서요. 모델Y가 lfp던 뭐던 5699에 살 수 있는데 아이오닉살까요 과연?,밤바,2023-08-15 16:39:00
1266121,그 유투버가 하는 말을 잘 들으셨는지 모르겠네요. 중저가에는 lfp가 괜찮다라고 합니다. 새로나온 코나 신차 리뷰할 때는 출력이나 정출력 구간 보고 앞으로 lfp를 넣으려는 거 같다라고 하기도 했습니다.lfp가 무조건 나쁘다가 아니라 중저가로 싸게 사면 좋다라고 하고 큰소리를내는건 lfp가 삼원계보다 좋다라고 할때지요.제 생각에도 물리적 한계 때문에 lfp가 삼원계를 넘어서기는 힘들거 같습니다.만약 테슬라가 플레이드 모델에 lfp를 달고 제로백 3초 내로 나오는 모델이 나온다면 그 때는 제생각이 틀렸다고 인정해야겠네요,한힘Igv60I파주,2023-08-15 16:57:00
1266121,Lfp가 삼원계보다 좋다고 하는 사람들이 있기는 한가요? 끽해야 100프로 충전 권장이라 삼원계대비 장점도 있다정도일텐데요. 솔직한말로 그냥 프레임 씌우는거에요. 자기가 여태껏 뱉은말들과 현기편들어야하는 상황이 충동하니 가상의 적을 만들어서 싸우게 하는걸로밖에 안보입니다.,밤바,2023-08-15 17:24:00
1266121,누구 얘기하는지 대충 추측이 되는데 그 양반은 레이ev 추천 안한다고 했고 나중에 아5 lfp 달고 나오면 그 차도 추천 안한다. 라고 했는데 현기 편들어야되는 사람이 구지 그럴 필요가 있을까요 판매량도 많은 차량인데요,아리장인I아5I공주,2023-08-15 23:53:00
1266121,영상 제대로 보시면 그런 말 못하실텐데..,리얼제로IeGV70I전북,2023-08-21 15:57:00
1266121,전기차 드래그할때 c-rate이 몇까지나 올라갈까요?아마도 초반에는 당연히 높을테구 금방 떨어질둣한데,파인I모델3I화성,2023-08-15 16:39:00
1266121,일단 예전 모트라인 160km로 트랙 돌렸을때 꼴등한 차량도 30분만에 방전된차는 없었던거 같은데 2c rate는 현실적으로 주행에서 나올수 없는 수치인듯하네요,파인I모델3I화성,2023-08-15 16:45:00
1266121,"테슬라 lfp 배터리 차량 가용 km가 줄어들었으면 중국, 노르웨이 등 해외에서 얘기가 나왔겠지요.여지껏 가용 km가 급격히 줄었다는 얘기는 못 들었네요. 그리고 테슬라에서 가용km가 줄어들어서 항의하는 고객 상대로 전담팀을 만들었다는 자료가 있다면 보여주시거나 출처를 좀 알려주세요. 구매예정자로써 참고하고 싶습니다.",포비돈I모델yI인천,2023-08-15 16:48:00
1266121,해당 기사는 저도 본 적 있습니다. 전 테슬라 모델에 해당하고 LFP에 국한된 내용 아니구요. 마치 LFP 배터리 차량의 문제로 말씀하시는 건 좀 아닌 것 같습니다.,포비돈I모델yI인천,2023-08-15 16:52:00
1266121,그건 맞네요 그럼 한번더 lfp차량에 대해 생각해보자는 글이라고 생각해주세요 저도 지금 니로 삼원계 타는데 레이lfp공부하다가 카페분들과 공유해서 저보다 더좋은 정보나 지식이 있는 고견을 들어보고 싶어서 그런거니 넓은 의견바랍니다,달타냥l니로l광주,2023-08-15 16:54:00
1266121,이미 작년에 모델3 LFP모델이 나와서 국내에 버젓이 잘 달리고 있습니다 그런데도 회자되지 않다 이제서야 라는 느낌이네요 저는 ㅋㅋ,엘까미네I외제EVI인천,2023-08-15 16:44:00
1266121,그땐 가격이 전혀 위협적이지 않았거든요 ㅎㅎ 이제 발등에 불떨어져 그렇습니다.,밤바,2023-08-15 16:46:00
1266121,"ㅎㅎㅎ 그러고 보니 그렇네요. 특정집단에 위협이 안 될땐 이렇게 lfp가 어쩌고 얘기가 없었는데, 토레스랑 모델y얘기 나오고 부터 고c-rate 얘기부터 시작해서 겨울철 어쩌고.... 에휴",디오니ㅣ모3ㅣ서울,2023-08-15 16:53:00
1266121,결국 모든건 돈입니다 중국산 lfp대용량을 현기구매시 베터리 할인까지 한다고하는데 소비자들이 가만히 있으면 안봐도 비디오입니다 그리고 이미 테슬라에 가용거리 소송까지 진행되고있는데(lfp인지는 모르겠으나) 이제와서 회자는 아닌것같습니다 서로 다투지말고 좋은 의견 나누자고 글썻는데 다른뜻은 없으니 넓은 의견 바랍니다🙂,달타냥l니로l광주,2023-08-15 17:06:00
1266121,소송건은 LFP아니고 매우 초창기 모델S관련입니다,엘까미네I외제EVI인천,2023-08-15 16:59:00
1266121,저도 전문가는 아니지라 정보 감사합니다,달타냥l니로l광주,2023-08-15 17:00:00
1266121,글이 서론부터 오해를 불러일으키는거 같은데 수정하시는게 어떠실지요 ㅎㅎ,엘까미네I외제EVI인천,2023-08-15 17:01:00
1266121,앗 그런가요? 다시볼께요,달타냥l니로l광주,2023-08-15 17:02:00
1266121,중국산 리튬인산철 배터리 전기차는 국내 시내버스 회사에서 겨울을 몇번이고 지내면서 수년째 사용중이더라구요. 전기차 선두그룹인 테슬라 및 중국 회사들을 시작으로 현대차 GM등 많은기업들이 채택하고 있으니 한동안 선입견에 의한 논란이 있겠지만 써보고 그럭저럭 나쁘지 않다는 경험이 쌓이면 논란은 자연스럽게 사라지지 않을까 생각합니다. 한국배터리 기업들도 LFP생산준비 한다더라구요,오아식스I니로I제주,2023-08-15 16:59:00
1266121,https://m.etnews.com/20210119000172인산철 쓴 전기버스 겨울애 인증 주행거리보다 안나오고 충전도 잘안된다는 기사가 있긴 하네요,어쩌l아이오닉6l수원,2023-08-15 17:52:00
1266121,다른거 다 떠나서 그냥 단가 낮출려고하는거자나요. 테슬라가 물꼬를 텄고 이제 현기가 좋다고 저렴이 전기차에 넣겠죠. lfp는 그냥 보급형 전기차를 더 저렴하게 만드는 용도입니다. 모델 s나 x에 넣고나서 성능에대해 이야기 하시죠. 아마 테슬라도 못넣을걸요?? ㅎㅎ,큰오가I대기중I부산,2023-08-15 18:44:00
1266121,네 회사는 이익을 추구하는데 우리세금으로 나라돈 취득하는 방법이 너무 사악합니다 그꼴이 좀 그래서...,달타냥l니로l광주,2023-08-16 11:05:00
1266121,주식쟁이들한테 속지마세요 국내에는 2차전지에 몰빵 투자한 사람들 천지입니다 그들에게는 LFP는 숙명의 적이지요 주식과 자유로운 엔지니어들은 LFP 충분히 좋다고 합니다 더구나 가격이 중요하기 때문에...,박스종I모델Yl화성,2023-08-15 19:49:00
1266121,넵,달타냥l니로l광주,2023-08-16 11:08:00
1266121,글 서두에 lfp가 태생이 ess에 퀵보드용 이라는 글을 쓰신건 분쟁질 하실라고 이런글 쓰신건가요? 안그래도 그것때문에 카페 분위기가 뒤숭숭한데.. 제가보기에는 의견이라고 쓰시고 분쟁질 하자는 거 밖에 안보입니다. 조회수 늘릴라는..글쓰시는.매너부터 지켜주세요.,파인볼I볼트I충남,2023-08-16 00:29:00
1266121,이거 한번 보세요 조회수 올려서 뭐하게요 제가 유튜버도 아니고.. 그리고 의견을 공유하는건데 분탕질이라느니 어떤분은 베터리 주식이야기도 계시던데요 솔직히 이글을 쓴 의도가 있긴해요 중국산베터리가 싫긴합니다 세금 지원도 안했으면 좋겠어요,달타냥l니로l광주,2023-08-16 16:51:00
1266121,아니 솔직히 레이ev 3천만원대의 차팔면서 원가가 얼마일까요? 저차에 정확하진 않지만 8~9백만원이나하는 국민세금을 준다는게 이해가 안갑니다 테슬라도 그렇고 베터리에 모터위에 껍데기쒸운건데... 저도 어거지가 있긴하지만 이미오바한거 전기차는 베터리가 절반입니다 개인적으로 안타깝네요,달타냥l니로l광주,2023-08-16 11:17:00
1266121,Lfp 의견 감사합니다!,앙찬I부산,2023-08-16 10:27:00
1266121,저도 혼자공부만하다 의견을 나누다보니 정말 여러생각들이 있네요 테슬라는 작년부터 lfp차량을 캐나다에서 사용했다는 의견에 계속 데이터를 찾는데 저는 없네요 조용한게 답인건지 확인하고싶은데 저는 레이 구매예정이였는데 작은 베터리에 lfp가 맞는지 데이터가 없네요 중국도 북반구는 소형 전기차가 테이터가 없습니다 흠,달타냥l니로l광주,2023-08-16 11:10:00
1266121,"모델3LFP 모델 타고 우리나라 겨울 나신 분이 문제 없다, 짐 많이 싣고 5명이 타고 여행가도 크게 안 줄어든다 라고 직접 얘기해주시는데도 전기차 타본적도 없는 방구석 전문가들 납셔가지고 LFP 까대는데 참 기가 찹니다.ㅎㅎㅎㅎ",멜빵I경기,2023-08-28 23:13:00
1265032,주행 가능거리 상당하네요,동탄l화성,2023-08-14 08:03:00
1265032,여름에는 500km 나오겠네요~,잭스패로우I모델 Y,2023-08-14 08:04:00
1265032,"배터리아재, 오x기어 그들이 LFP 안좋다고 했던거 거짓말로 드러나고 있음",박스종I모델Yl화성,2023-08-14 08:06:00
1265032,시장이 평가 하겠죠~,잭스패로우I모델 Y,2023-08-14 08:07:00
1265032,사실 다른건 없어요.삼원계대비 싸니까 ~ 이거 하납니다.,줍줍 I전기차I일산,2023-08-14 08:07:00
1265032,삼원계 이상으로 lfp 배터리도 기술력이 진일보하다는 거죠~,잭스패로우I모델 Y,2023-08-14 08:10:00
1265032,문제는 아직은 진일보하지 않았기때문에 지금 구매하시는분들은 그냥 지금의 인산철이지 진일보한 인산철이 아닙니다. 그냥 보통 성능의 배터리를 싸게 사는거니까 고성능이 필요없는 분들이 합리적으로 선택하는거죠.,줍줍 I전기차I일산,2023-08-14 08:12:00
1265032,과거에 비해 밀도도 높이고 있고 여러 개선 사항으로 향상된 lfp 배터리는 맞습니다 분명 한계점이 있겠지만 현재는 발전의 지속성이 있다고 생각합니다. 판단은 시장 몫이겠죠~,잭스패로우I모델 Y,2023-08-14 08:16:00
1265032,그쵸~ 과거보단~제말은 지금 인산철은 한참 개발중이고 개선중이라서 지금의 인산철은 삼원계를 뛰어 넘을순 없는데 마치 뛰어넘은 것 처럼 말씀하셔서요.,줍줍 I전기차I일산,2023-08-14 08:20:00
1265032,제 글에 오해가 있으셨나 봅니다. 감사합니다.,잭스패로우I모델 Y,2023-08-14 08:22:00
1265032,충전속도는요?,천넷대포Iev6l전북,2023-08-14 08:11:00
1265032,"저렴한것도 있는데 안전이 커요.워낙 코나볼트등 화재로 데여서,배터리가 부족하니 기존 추진하던 삼원계 물량은 유지하겠지만중국외 LFP점유율이 급상승 할겁니다.",jieI아이오닉6I서울,2023-08-14 16:39:00
1265032,인산철이라고 무조건 안전한게 아니고 삼원계대비 안전한거에요.카라반 10년정도 운영하고 있는데 카라반은 대부분 인산철을 쓰는데 카페에 올라오는 카라반 화재사고 보면 인산철배터리에서 발생하는 경우가 많습니다.,줍줍 I전기차I일산,2023-08-14 08:16:00
1265032,삼원계가 비교대상이니 삼원계보다 안전한게 선택이유가 되는거지요,jieI아이오닉6I서울,2023-08-14 08:37:00
1265032,네 중요한건 인산철이라고 불안나는건 아니니 경계하는 마음을 가지시라는 뜻입니다.,줍줍 I전기차I일산,2023-08-14 08:39:00
1265032,카라반에서 쓰는 인산철 배터리는 BMS가 아예 없지 않나요?,호크IxxI서울,2023-08-14 09:19:00
1265032,bms는 무조건 있어요. 충전도 셀별로 전압감지해서 이퀄충전도 합니다.,줍줍 I전기차I일산,2023-08-14 09:21:00
1265032,ㅎㅎㅎ 전기차용이 아무리 똑똑한들 완벽하진 않죠.,줍줍 I전기차I일산,2023-08-14 19:13:00
1265032,그래도 판매량 폭망일듯,시지l오닉 코나l대구,2023-08-14 08:22:00
1265032,"추이를 지켜봐야죠~ 돌풍일지,,, 폭망일지...",잭스패로우I모델 Y,2023-08-14 08:23:00
1265032,하다하다 이제 ncm보다 lfp가 더좋다고 하네.... 그냥 싼마이로 쓸만하다로 마무리하시죠 에너지 밀도 훨씬 낮은게 팩트인데 뭐가 구라니마니 모y rwd 저도 좋다고보는데 이런 말도안돼는 lfp찬양글보면 그냥 헛웃음..,꿀복이네Iid4I수원,2023-08-14 08:39:00
1265032,찬양한 사람이 있나요? 장단점을 말하는 거죠~,잭스패로우I모델 Y,2023-08-14 08:54:00
1265032,전세역전…이라는 말부터가,밤돌이I볼트I평택,2023-08-14 09:48:00
1265032,포괄적 의미로 받아 주셨으면 합니다.,잭스패로우I모델 Y,2023-08-14 09:50:00
1265032,lfp는 삼원계 배터리 보다 싸고 안좋습니다 그건 팩트이고이제 얼마나 안좋냐인데..운행시에 크게 차이없을거란 파와차이가 클것이다란 파가 싸우는거죠,오닉l모델yl경북,2023-08-14 09:00:00
1265032,"Ford knows LFP batteries perform poorly in the cold, but it's not concerned about it affecting customer experience based on its current data.""Ninety-five percent of Mach-E customers start their trips at ambient temperatures above freezing,"" says Ooms, who did not mention the location of drivers surveyed. ""And while we don’t have a full year of data yet, we do know that 89% of Lightning customers start their trips at temperatures above freezing. Knowing this, LFP batteries offering standard range and regular charging to 100% will be an attractive option for many Ford EV customers.""There is another issue with LFP batteries: reduced pickup truck towing power. ""For an F-150 Lightning customer [who] often tows or hauls, NCM batteries will be a great fit...because those customers value the power and longer range made possible by NCMs,"" Ooms says.https://www.pcmag.com/news/carmakers-are-switching-to-cheaper-ev-batteries-but-theres-a-big-trade",어쩌l아이오닉6l수원,2023-08-14 09:09:00
1265032,전기차에 관심가지다 열폭주로 보류하고 작년5월에 쏘렌토 구입했습니다.그러다 인산철이 나와서 다시 모y나 토레스 구매 고려중입니다.. 각자 본인에 맞는 제품을 구입하면 된다 생각해요.. 저같은 경우 사실 고밀도니 뭐니 별로 관심도 없고 알필요도 없다 생각해요.. 그런건 박사들이 고민하면 되고 전 저에맞는 사항을 보고 선택하면 되는거죠.......저 같은경우 그냥 기존 밧데리보다 안전하다 하나만으로도 구매가치는 충분하니까요..거기다 가격이 비슷해도 인산철을 사겠는데 가격마저 저렴하니...저 같이 생각하는 사람들도 분명 있을꺼에요... 제발 있기를ㅎㅎ,도치l관심l충남,2023-08-14 09:22:00
1265032,지금 인산철이 뜨는 이유는 결국 가격이죠.NCM보다 무겁고 성능 떨어져도 가격이 싸니까 당분간 대세가 될겁니다.,떡구님,2023-08-14 09:27:00
1265032,lfp가 좋으면 모델s나 모델x에 넣었음,소멸은신I모델YI인천,2023-08-14 22:00:00
1264820,내연이나 전기나 뽑기운과 잔고장은 마찬가지죠 ㅋㅋ 고민만 하시면 못삽니다,진박l코나볼트l서울,2023-08-13 18:57:00
1264820,전기차 한대 구입한다면 전 비추요 그리고 개인적으로 현기 전기차도 비추요.,바다l아이오닉5I경북,2023-08-13 18:59:00
1264820,고장이나 화재는 내연기관이 더 많아요,덴짱IEV6I성남,2023-08-13 19:04:00
1264820,언론이나 커뮤니티에서 이슈가 많이 돼서 그렇지 오히려 고장 빈도는 전기차가 적은편입니다. 솔직히 보증끝난 수입차는 거들떠보지도 말라는 격언(?)도 있을정도인데 내연기관이라고 안심하고 살 수 있나요.,경북I리엔나,2023-08-13 19:04:00
1264820,정말 몰라서 그런데요 뭔 고장이 많을까요?,찬빈도Ism3니로I인천,2023-08-13 19:04:00
1264820,고장이많은차를 굳이 사실필요는 없죠..,부엉이l아5아6l세종,2023-08-13 19:29:00
1264820,아5 작년 10월에 구매해서 7만을 바라보고 있는데 사엄소 들어간건 트렁크 잡소리랑 usb포트 교체 한것 밖에 없습니다 워셔액 넣구요 내연보다 관리할게 없습니다 신경쓸것도 없구요 찝찝하시면 구매 안하시는게 맞습니다,아리장인I아5I공주,2023-08-13 21:15:00
1264820,한두푼도 아니고 찝찝할땐 안사는게 낫습니다. 부모형제친척가족 다 걱정합니다,오모씨l코나l용인,2023-08-13 21:59:00
1264820,모든 전기차가 고질적인 문제가 있어 시기상조긴 하죠,거북l아이오닉5l시흥,2023-08-14 11:30:00
1261680,기아의 레이 전기차도 추천합니다.근거리 위주의 세컨드카로서는 크기나 가격에서 합리적일 듯 합니다.,수퍼맨아빠IGV60I경남,2023-08-09 15:28:00
1261680,gv70e추천,봉봉Iix3I경기,2023-08-09 15:28:00
1261680,렉서스 rz,은행I아5I제주,2023-08-09 15:30:00
1261680,근거리 용인데 다 좋은거네요~~~ gv60 도 추천해요,인천l넥쏘gv60포터,2023-08-09 15:34:00
1261680,미니도 괜찮겠네요,킹스턴l아이오닉l김해,2023-08-09 15:41:00
1261680,레이 추천오,꿈꾸는사람인l전북,2023-08-09 15:50:00
1261680,와이프 코나ev타고있는데 가격대비 가성비 괜찮습니다.,누드l코나l대전,2023-08-09 16:28:00
1261680,"폴스타2죠 ㅎㅎ 이건.전세계화재 0건, 볼보의 안전기능, 비교적 안정화된 지리자동차 전기차 시스템종종 와이프근거리용이라 경차 이야기 하시는데타는 자제분들 운전하시는 사모님 생각하시면한국문화상 경차는 아닌듯 합니다.아직도 경차 위협하는 몰지각한 놈들 많습니다.경차는 능숙능란하고 덩치좀 나가는 남자들에게 추천!",봉우리l이트론SBl부산,2023-08-09 16:51:00
1261680,푸조요~~ 할인하더라구요,붕붕I아6e2008I세종,2023-08-09 16:51:00
1261680,i3 펀카 강추요!!!,코코집시IID4I3I경기,2023-08-09 17:32:00
1261680,저는 EQA AMG Line 한표~~~,석석아빠,2023-08-09 20:20:00
1261680,e208 이 싸고 이쁩니다. 근거리면 더더욱.,초코칩3I모YI용인,2023-08-09 21:02:00
1261680,휠베이스가 긴 ev6는 불편할수 있어요휠베이스 짧은차가 동네마실 다니기 편할꺼에요,거북l아이오닉5l시흥,2023-08-09 21:11:00
1260095,저도 공감합니다....코나도 10년 16만이라서 갔더니.....주황색 고전압부분이있지만....해당부품은 3년6만이라고 돈나갔죠..ㅠㅠ,이니지니오닉코나강릉,2023-08-07 23:00:00
1260095,저도 같은 의견,전금l페리오닉l부산,2023-09-08 10:23:00
1257690,코나요.볼트가 맘에 안드는건 아니지만 남의 떡이 더 커보여서요.ㅋㅋ,롤꾸lEUVl스산,2023-08-04 07:45:00
1257690,확실히 남의 떡이 커보이는거 같아요 볼트사면 코나가 커보이고 코나사면 또 볼트 살껄 싶고 그럴거 같긴해용.. ㅋㅋㅋ 의견 감사합니다😊,호호I인천,2023-08-04 07:46:00
1257690,볼트요~^^ 제가타고있어요~ 넘 좋습니다!!,볼트EVl러버l전남순천,2023-08-04 07:49:00
1257690,오 볼트 실차주님이 추천해주시니까 믿음이 가네용ㅇ 고민이 깊어집니다.. 의견 감사해요🙏🏻,호호I인천,2023-08-04 07:51:00
1257690,코나요 볼트는 단존 아닌가용,제제이이경기도광주,2023-08-04 07:50:00
1257690,볼트 단종이 취소됐다고 본 것 같아서요!! 코나도 잘 나온거 같아서 넘넘 고민되네요ㅠㅠ 의견 감사합니다🙏🏻,호호I인천,2023-08-04 07:52:00
1257690,코나가 좋긴하지만 요새 화재이슈가 코나가 많아서 음,건방이i수원,2023-08-04 07:53:00
1257690,아 코나 화재 이슈가 있군요!!ㅠㅠ 몰랐는데.. 더 알아봐야겠네요!! 좋은 정보 감사합니다🙏🏻,호호I인천,2023-08-04 07:53:00
1257690,예전 제품이긴합니다 요새 제품은 아니에여,건방이i수원,2023-08-04 07:54:00
1257690,아 네네 그렇군용ㅋㅋㅋ 추가 정보까지 감사합니다..ㅎㅎ,호호I인천,2023-08-04 07:55:00
1257690,그건 모르겠습니더 출시한지 얼마안되서 주로 이야기나온건 구형코나ev였거든요,건방이i수원,2023-08-04 07:55:00
1257690,코나 신형도 화재 이슈있나용 못본듯 한에 아직은,제제이이경기도광주,2023-08-04 08:03:00
1257690,코나요,전동보이I볼트23I고양,2023-08-04 07:54:00
1257690,오 코나 추천해주시는 이유가 있을까요??ㅎㅎ,호호I인천,2023-08-04 07:55:00
1257690,옵션이 풍부합니다,전동보이I볼트23I고양,2023-08-04 07:55:00
1257690,아 역시 신형이라 옵션이 확실이 풍부하긴 한거 같더라구요!! 의견 감사합니다🙏🏻🙏🏻,호호I인천,2023-08-04 07:56:00
1257690,근데 옵션 넣으면... 그돈씨..가 되죠 ㅋㅋ 볼트 레드라인이랑 1000만원 차이날걸요?,미친바람IeuvI인천,2023-08-09 23:55:00
1257690,볼트나 코나나 도찐개찐 좀더 싼 볼트!,상승형재I구오닉I부산,2023-08-04 07:56:00
1257690,가성비는 확실히 볼트가 더 있는거 같긴해요!!ㅎㅎ 의견 감사합니다🙏🏻,호호I인천,2023-08-04 07:57:00
1257690,2대 다 좋은데...서비스는 코나가 더 낳고 저같은 경우 서비스 기간이 끝나도 합당한 수리를 교환을 받았는데...가난한 지엠은... 힘들다고 생각하죠.,레고니로서울,2023-08-04 07:57:00
1257690,확실히 그런 부분은 또 코나가 나을 거 같긴 하네요.. 점점 고민이 깊어집니다.. 의견 감사합니다🙏🏻,호호I인천,2023-08-04 07:58:00
1257690,화재나 급발진 이슈가 있는 차량은 걸르는게 좋죠. 땡땡 3년 티면서 화재뉴스 나올때마다 얼마나 불안한지 ㅠㅠ 이번에도 또 뉴스에 나오더군요,연천ll양택이,2023-08-04 08:03:00
1257690,아고고 계속 기사 보면서 맘졸이게 될 수 있을 것 같네요..ㅠㅠ 잘 생각해봐야겠어요!! 의견 감사합니다🙏🏻,호호I인천,2023-08-04 08:18:00
1257690,시내위주로 운행하시면 볼트 장거리 위주로 운행하시면 코나 추천드립니다,코난I대구,2023-08-04 08:04:00
1257690,오 제가 시내 위주로 탈 거 같긴 한데.. 아무래도 편의성 때문에 장거리는 코나라고 말씀주시는 걸까요~?,호호I인천,2023-08-04 08:18:00
1257690,이번에 코나 구형에서 신형으로 기변했습니다. 차가 확 바뀌었습니다..승차감 크기 실내공간 너무 좋아졌습니다. 비교대상이 안됩니다. 볼트가 좋은점이 뭐가있을까요?,하얀콩I코나l부여,2023-08-04 08:10:00
1257690,볼트가 더 저렴해서 딱 기본만 필요한 경우에는 가성비가 있을 것 같다고 생각이 들었거든용 ㅎㅎ 근데 실차주분이 코나 넘 좋다고 말씀하시니 돈 더보태서 코나로 가야하나 싶네용 ㅎㅎ 의견 감사합니다🙏🏻,호호I인천,2023-08-04 08:21:00
