post_id,cmt_content,cmt_author,cmt_created_at
1267502,"네 베멤님접하기 어려운 정보 그리고 지식들을 알기 쉽게 공유해주셔서 감사합니다. 윗 분한테 댓글을 남겼었는데 괜히 감정 소모하고 싸움으로 번질까봐 댓글은 삭제했어요. 아무리 설명해줘도 똑같은 말씀하시니.. 본 글의 내용, 댓글만 봐도 충분히 이해가 가야 정상인데 계속 반복적으로 말씀하시네요. S, X에 왜 적용 안 하는지는 테슬라 내부에서 알고 있을 문제이고 이미 객관적인 데이터로 답은 나왔는데 그 부분만 물고 늘어지네요.",포비돈I모델yI인천,2023-08-17 23:09:00
1267502,"본문 내용처럼 수명도 길고, 화재위험도 낮고, 고방전까지 감당 가능하고, 심지어 가격까지 저렴한 lfp 배터리인데 왜 그걸 두고 테슬라는 왜 모델 S,X에는 안쓰냐는 지극히 합리적인 질문으로 보이는데요본문 내용대로면 모델X awd 듀얼모터까지도 감당 가능합니다 가뜩이나 테슬라는 치킨게임으로 가격인하 중인데 왜 S,X에 왜 훨씬 싼 lfp를 안쓰냐는건 백번도 합당한 질문으로 보이네요 이번에는 모델X 스탠다드도 가격인하 일환으로 나온거 아시죠?이런 질문들에다 '그건 테슬라가 알지 나는 모르겠고 아무튼 lfp는 수명도 길고, 화재위험도 낮고, 고방전까지 감당 가능하고..' 뭐 꿈의 배터리 식으로 얘기하면 그게 답변일까요 아몰랑 일까요?테슬라만 그렇다면야 살펴볼 여지라도 있지 byd 처럼 특수한 경우 제외하면 lfp를 고출력 차에도 대거 적용하는 제조사가 몇이나 있길 한가요 참 위에 답변은 1도 못하면서 '아무튼 그건 제조사가 아는거고 아무튼 lfp 어쩌구 저쩌구..' 하면 그건 설득력이 1도 없는 술주정 같은 혼잣말 입니다",카탈리나ll서울,2023-08-17 23:13:00
1267502,"1. 현대기아는 왜 고출력 차량에 가장 적합한 NCA가 아닌 NCM을 쓸까요? 2. 포르쉐 타이칸은 최대 6C도 안되면서, 어째서 7000만원짜리 Si 혼합 배터리를 사용할까요? 3. BYD는 무슨 기술력이 있길래, LFP로 5C에 가까운 출력을 뽑아낼 수 있을까요? 제가 무슨 Chat GPT도 아니고... 제조사의 내부자가 아니면 알 수 없는 편협한 질문들에 어떻게 대답을 드립니까. 제발 상식을 가지고 융통성을 키우시기 바랍니다.",베멤l모델3l부산,2023-08-17 23:15:00
1267502,"상관없는 질문은 사양하겠습니다만 지금 하시는 논리 회로를 고대로 적용 하면요1,2,3번 왜 그러냐뇨? 그건 제조사가 알죠 제가 무슨 챗지피디도 아니고 제조사의 내부자가 아니면 모르는걸 물으면 어떻게 대답드립니까제발 상식을 갖으시길 바랍니다",카탈리나ll서울,2023-08-17 23:22:00
1267502,"정답입니다. ""그건 제조사가 알지요""",베멤l모델3l부산,2023-08-17 23:22:00
1267502,"? ㅋㅋ 재밌으신 분이네요 위에 설파하던 본문 내용은 다 어디로 가셨을까요..?전 byd의 기술력이나 포르쉐 si 혼합 배터리나 현대기아 ncm 여부는 모르고 그에 관해 뭐 주장한 적도 업습니다글쓴이분은 수명도 길고, 화재위험도 낮고, 고방전까지 감당 가능한 lfp를 그렇게 주장하다가 그럼 왜 제조사들이 고가라인엔 안쓰냐는 질문엔 '그건 제조사가 알지요' 하면 뭔가요ㅋ그럼 수명도 길고, 화재위험도 낮고, 고방전까지 감당 가능한 lfp를 제조사가 안쓰는 멍청하던가 아님 반대쪽이 멍청하던가 두개중 하나라고 얘기했을텐데요본문 얘기처럼 lfp가 그정도 캡파면 byd 외 그렇게 쓰는 제조사들이 하다못해 다섯손가락 정도는 나와야 지극히 상식적인 얘기 아니겠습니까?",카탈리나ll서울,2023-08-17 23:28:00
1267502,"테슬라는 LFP 사용하니까 현명한 제조사입니다. 현대기아도 EV5에 LFP 82kWh 넣으니까 현명한 제조사입니다. 선생님이 하고싶은 말은 이것이었는데, 저의 눈치가 없었네요.",베멤l모델3l부산,2023-08-17 23:28:00
1267502,"언제 누가 보급형 모델들에 lfp를 왜 안쓰냐 했나요ㅋ 고방전까지 감당되는 lfp인데 왜 테슬라 모델 x,s나 지커, 니오, 샤오펑 등등이나 고출력 전기차에선 안쓰냐 했을텐데요많이 힘드시죠? 참 한편으론 자가당착에도 계속해서 끌고가려는 고집 하나는 인정하겠습니다 지성의 얘기는 뭐 끝난거 같은데 전 이만 자러 갑니다",카탈리나ll서울,2023-08-17 23:35:00
1267502,이만 간다는 분이 몇 번이나 유턴하는건지 모르겠네... 여기가 그렇게나 댓글 맛집인가?,베멤l모델3l부산,2023-08-17 23:46:00
1267502,이거 보시구요. 공격적으로 댓글 달으시고 넌 원하는 대답할때까지 답이나 내놔라는 식은 좀 그렇네요.한 해 6만대 판매하는 차종에 새로 개발비 투자하여 lfp 적용하는 게 수익성이 있을까요? 아니면 안정성 확보되어 있고 추가 개발비 들지 않는 기존 배터리가 좋을까요? 왜 안 하는지는 테슬라만 알겠지만 저 같은 일반인도 객관적 데이터랑 시장 상황 등 따져보면 대충 알겠네요.,포비돈I모델yI인천,2023-08-18 08:20:00
1267502,"전기차는 통상 배터리 값이 그 차에 40%를 차지합니다 거기다 모델x,s같은 대용량 배터리를 ncm대비 20% +- 더 저렴한 lfp로 바꾸면 얼마가 세이브 될까요? 안정성 확보는 lfp가 다 됐다고 글쓴이가 계속 주장하는중이고요그리고 모델x,s만 그러면 이해라도 하지 다른 고출력차들이나 제조사들은 거의 전부 lfp를 채용하지 않고 있는데요 대충 위로 글쓴이 댓글 3개만 봐도 누가 억지 부리고 있는진 가슴 한 곳에선 느끼실 겁니다",카탈리나ll서울,2023-08-18 12:36:00
1267502,1년에 6만대 판매되는데 몇백억-천억 들 수도 있는 개발비 들여서 개발합니까?단순히 배터리만 바꾸면 된다고 생각하시나요?,포비돈I모델yI인천,2023-08-18 12:46:00
1267502,"그리고 글쓴이가 주장하는 게 아니라 테스트해보니 그렇게 나온 값들을 보여주시는 것 같은데요,",포비돈I모델yI인천,2023-08-18 12:48:00
1267502,"그리고 반대로 여쭤봅니다. S, x 뻬고 다른 차들 lfp 넣는 이유는 무엇입니까?추가로 lfp는 아직 ncm 대비 무게 당 에너지 밀도가 떨어지는 걸로 알고 있는데 당연히 당장 고가 모델에 적용하기엔 부족한 부분도 있으니 아직 적용이 안 된 거겠지요. S, x 나온지도 됐고 다음 버전땐 바뀔 수도 있겠네요.",포비돈I모델yI인천,2023-08-18 12:50:00
1267502,객관적인 시험 데이터 값을 보고 현명한 판단하시기 바랍니다 : ),포비돈I모델yI인천,2023-08-18 12:59:00
1267312,주행거리가 같으면 가격도 같이받죠.신형니로코나EV 중국회사 배터리로 변경해도 가격은 더 올렸는데요,jieI아이오닉6I서울,2023-08-17 08:04:00
1267312,니로 코나는 ncm 이구요 ㅋ lfp 배터리라면 얼마까지 수긍하느냐? 가 궁금한거죠 ㅋ,백반2인분l아5l양산,2023-08-17 08:06:00
1267312,"LFP가 밀도가 낮아서 대용량탑재가 곤란한 것이지같은 스탠급 3원계랑 비교하면 충전속도, 수명, 성능에서 거의 차이가 없는데 싸게 팔리가 없죠.테슬라 모델Y RWD가 저렴한것도 LFP사용보다 기가상하이 생산이라서입니다.재료원가차이는 200만원정도 입니다.나머지는 중국생산에 의한 원가절감이죠.",jieI아이오닉6I서울,2023-08-17 08:12:00
1267312,아... 그렇군요.. 하긴 기업은 같은 결과물내놓으면 가격은 같이 받겠네요 ㅠ,백반2인분l아5l양산,2023-08-17 08:14:00
1267312,"그렇지 않습니다. 중국에서 tesla의 60kwh짜리 배터리 팩은 5만위안(약900만원), 77kwh의 ncm배터리 팩은 9만위안(약 1700만원)으로 산정됩니다. 같은 용량이라고 대입해도 lfp팩이 유의미하게 쌉니다.다만 lfp셀 밀도가 떨어지기 때문에 같은 공간에 ncm용량만큼의 셀을 채울 수 없습니다.",디오니ㅣ모3ㅣ서울,2023-08-17 14:16:00
1267312,코나 니로 봐서는 페리 라면서 가격인상 할듯요,소멸은신I모델YI인천,2023-08-17 08:04:00
1267312,ncm 이면 갈수록 오를꺼고... lfp 로 바꾸면 어떻게 될까 싶었네요 ...,백반2인분l아5l양산,2023-08-17 08:07:00
1267312,중국산으로 생긴 이익 낼름,소멸은신I모델YI인천,2023-08-17 10:53:00
1267312,제조방식을 바꿔서 생산원가를 절감한게 크다고 해요.,톰I아5아6모3I설,2023-08-17 08:20:00
1267312,그럼 가격 좀 떨어지면 좋겠네요 ㅋ,백반2인분l아5l양산,2023-08-17 08:24:00
1267312,같은 성능이면 같은 가격 받겠죠.. LFP가 장안의 화재이군요.같은 리튬계열인데 결국 혼합물 이것저것 섞다보면 NCM이나 LFP나 경계가 모호해질것 같은 느낌적인 느낌..,바쁠껄I아이오닉I대구,2023-08-17 08:21:00
1267312,뭔가 다른 배터리 나올듯 하네요 ㅋㅋ 그때까지 살아있을런지 ㅋㅋ,백반2인분l아5l양산,2023-08-17 08:25:00
1267312,올겨울에 NCM과 LFP의 한판 대결에서 결과가 나올겁니다. 그때 선택하셔도 늦지 않습니다.,차는풀옵l아6l인천,2023-08-17 08:27:00
1267312,네.. 소비자는 지켜봐야겠네요 ㅋ 암튼 싼거 많이 나오면 좋겠네요,백반2인분l아5l양산,2023-08-17 08:30:00
1267312,소비자에게는 싸고 좋은게 최고죠..,차는풀옵l아6l인천,2023-08-17 08:32:00
1267312,LFP 싸구려라고 까대는사람들(xx기어) 근거로보면 천만원은 싸야죠 현실은 NCM이나 LFP 가격차이가 그렇게 크지않다는거고 현기가 LFP넣고 만들어도 그렇게 낮출일이 없다는건 팩트이지싶네요,수원ll니로ll도르르,2023-08-17 08:28:00
1267312,그렇네요 ㅠ 가격차가 많이 안나고 ㅠ 차값 떨어질일이 없을듯 하네요 ㅠ,백반2인분l아5l양산,2023-08-17 08:31:00
1267312,NCM넣고 매년 가격인상하던거 LFP넣고 동결이나 찌끔 내리는수준으로 생각하셔야합니다 그런면에서 y스탠의 가격정책이나 토레스evx의 가격은 지금 시기에는 가성비적으로 접근하기 좋은상품인거 같네요 저도 개인적으로 ev5 출시 기대하고 있지만 국내도 LFP넣고 실구매가 3천후반대정도 설정해주면 좋겠다는 생각입니다만 현기가 이윤극대화를 위해 그렇게 판매할생각은 없어보여요,수원ll니로ll도르르,2023-08-17 08:35:00
1267312,그럴거 같네요 ㅠㅠ,백반2인분l아5l양산,2023-08-17 10:05:00
1267312,Ncm대비 lfp가 30%정도 싸니까 77.4kwh 기준으로 거의 천만원 싸겠네요,카탈리나ll서울,2023-08-17 08:33:00
1267312,천만원 싸지면 좋겠네요 ㅋ,백반2인분l아5l양산,2023-08-17 08:34:00
1267312,21년이면 지금보다 500정도 쌌었나요?? 그만틈 베터리가 늘긴했지만 많이오른감이 있쥬,개물림l아이오닉l경기,2023-08-17 08:42:00
1267312,그정도 차이 나는거 같아요 ㅠ,백반2인분l아5l양산,2023-08-17 10:01:00
1267312,테슬라가 다음차를 얼마나 낮출지가 현대차의 가격마지노선이 되겠죠 테슬라가 싸게 나오시길 기다리심이 좋을것 같습니다.,산적IM3LRI천안,2023-08-17 08:53:00
1267312,모3롱 기대합니다 ㅋ,백반2인분l아5l양산,2023-08-17 10:01:00
1267312,에너지밀도가 낮으니 같은 공간에 넣을 수 있는 배터리 용량도 줄어들겠죠. 거기에 배터리 가격까지 싸니까 한 1500 - 2000만원은 싸야 말이 될 것 같습니다.,덴짱IEV6I성남,2023-08-17 09:27:00
1267312,그럼 대박인디.. 거리 줄어도 2000 이나 싸면 ㅋ,백반2인분l아5l양산,2023-08-17 10:04:00
1267312,2000,카카로트l경기,2023-08-17 10:22:00
1267312,언젠가는 가격이 떨어지겠지만 현.기 하는거 봐서는 그닥.... 가격이 좀 비싼건 사실이니.... 그돈씨 라는 생각도 너무 듬... 한 지금 파는것에 700만원~1000만원 떨어져도 기대효과는 크겠죠.,조재l아이오닉5l서울,2023-08-17 10:25:00
1267312,1000 정도만 떨어져도 좋네요,백반2인분l아5l양산,2023-08-17 12:22:00
1267312,현기에게 가격 내리라는 것은 현상황에서 어려울것 같은데요. ncm가격을 더올리고 lfp차는 현재 가격 그대로 갈것같은데요. 그래야 현대 기아죠. 절대로 실망시키지 않을겁니다. 현기 파이팅입니다.계속 가격 올려 주면 좋겠습니다. 그래도 살거니까요. 우리나라는 자동차회사가 현기밖에 없는줄알아요.그래도 lfp 넣었으니까. 500만원 낮추지않을까요.,금연I니로EVI하남,2023-08-17 10:34:00
1267312,500은 좀 아쉽네요 ㅠ,백반2인분l아5l양산,2023-08-17 12:22:00
1267312,배터리가격의 40%가 원자재가격이라는데 lfp로 바꾸면 500정도 낮아질거 같아요,거북l아이오닉5l시흥,2023-08-17 12:25:00
1266477,왜 갑자기 lfp배터리가 좋은게 됐죠? 토레스에 들어갈때는 신나게 까더니만 가성비가 좋은걸 성능이 좋은걸로 포장하지마세요.,귀연 lev6l 경기,2023-08-16 05:41:00
1266477,ㅋㅋㅋ 쌍용이 전기차를 뭘안다고.. lfp라니 어이없네… 싸구려 중국차만쓰지 ㅉㅉ오 전기차의 달인 테슬라여 lfp도 좋은 배터리군요 테멘!!이런 뉘앙스 입니다. 이전도 지금도 그냥 가성비 배터린데… 사용자 차이로 명품된….,외계돼지I용인,2023-08-16 05:55:00
1266477,쌍용이 님보단 많이 알지 않을까요..?,만두l오닉5l충남,2023-08-16 08:24:00
1266477,네 당연히 저보다 많이 알죠... 그냥 사람들이 그렇게 받아드리면서 lfp 느낌이 바뀐것 같다고 쓴것인데.... ㅜ 제가 이상하게 적었나보네요 ㅜ,외계돼지I용인,2023-08-16 08:27:00
1266477,ㅋㅋㅋㅋ,딩콩꽁I수원,2023-08-16 08:29:00
1266477,올 겨울 혹한기 지나보면 결론 나겠죠.,이터널I오닉5I대전,2023-08-16 05:57:00
1266477,이미 국내에서 모델3가 검증되었는데요?,안산백님I안산,2023-08-16 08:07:00
1266477,"노르웨이, 캐나다에서 이미 쓴지 오래됐습니다 뭘 더 검증합니까 ㅋㅋㅋ",박스종I모델Yl화성,2023-08-16 08:18:00
1266477,테슬라만 얘기하는게 아니라 LFP 도입할 모든 차를 얘기하는 겁니다.,이터널I오닉5I대전,2023-08-16 08:22:00
1266477,테슬라 까지도 않았고 중립적으로 쓴건데 누가 테슬라 오너 아니랄까봐 참 예의가 없네요. ㅋㅋ,이터널I오닉5I대전,2023-08-16 08:24:00
1266477,윗 글만봤을때 예의없는 발언을 한 사람들은 없는데...,딩콩꽁I수원,2023-08-16 08:30:00
1266477,그거 자격자심이에요 선생님..,재즈l모Yl시흥,2023-08-16 09:08:00
1266477,"ㅋㅋㅋ 만 안 달았어도 뭐라 안하죠. 듣는 사람 기분 나쁩니다. 그리고 테슬라 얘기 꺼내지도 안았는데 뭘 노르웨이, 캐나다 검증 타령 입니까?",이터널I오닉5I대전,2023-08-16 09:12:00
1266477,제가 왜 자격지심인지??? ㅋㅋㅋ 붙어 있으면 당연히 기분 나쁘죠?,이터널I오닉5I대전,2023-08-16 09:13:00
1266477,검증된 자료나 정보가 있나요?있으면 올려주세요!,콩이Igv70I 수원,2023-08-16 09:36:00
1266477,그 ㅋㅋㅋ 보고 기분나빠하는게 자격지심이라구요...,재즈l모Yl시흥,2023-08-16 09:40:00
1266477,테슬라 오너 아니랄까봐 참 예의없다는 말은 테슬라 오너는 다 예의가 없다는 말같이 들립니다.지나가는 테슬라 오너 기분나빠서 한마디 하고 갑니다 ㄷㄷ,존람보lM3Ll양산,2023-08-16 09:45:00
1266477,기분 나쁘셨다면 죄송합니다. 다만 테슬라의 테자도 꺼내지 않았는데 저런식으로 댓글 다니까 욱해서 쓴건데 다른 테슬라 오너가 또 거드네요. 저도 하이랜드 기다리고 있는 입장이니 이해해 주시길 바랍니다.,이터널I오닉5I대전,2023-08-16 09:48:00
1266477,네 그렇게 말씀해주시니 감사합니다.,존람보lM3Ll양산,2023-08-16 10:45:00
1266477,ㅋ 이건 뭐 그 좋고 싼걸 왜 테슬라마저 다 적용을 안할지를 생각하면 다들 모지리라 싸서 좋은데도 안쓰는 건가,편집광I오닉I경기,2023-08-16 06:09:00
1266477,"갑자기,,어느순간 부터,,테슬라가lfp 장착해서 판매 하는 순간부터국산 베터리 까기시작하네요,,그분들 대부분이 이번 모델y 계약자들일까요?",빗소리ll니플ll경남,2023-08-16 06:19:00
1266477,모델y lfp 가성비로 출시된 이후로.. 엄청 까였죠.. 그분들 대부분이 전부 기존 현기차 오너들일까요..?,정비사l부산,2023-08-16 06:24:00
1266477,전.. 앞으로 왠만하면 lfp 로 다바뀔까 걱정되네요 ㅠ 국산 NCM 으로 용량도 높은 마지막차량이 아6 아닐까해서 할인해줄때 샀어야 하나 싶기도 합니다,백반2인분l아5l양산,2023-08-16 07:00:00
1266477,왜 걱정일까요??? 화재로 부터 더 안전하다는데... NCM이 걱정아닌가요??....,까앙l모와이l경기,2023-08-16 08:29:00
1266477,화재걱정은 원래 안했어요... 선택권이 줄까봐 그런거죠,백반2인분l아5l양산,2023-08-16 08:56:00
1266477,현기도 나중에는 가격 낮추려고 lfp 배터리 쓸것 같아요.,섭섭이 ix50 서울,2023-08-16 07:54:00
1266477,LFP중국산배터리.. 가성비.,유니77서울,2023-08-16 08:01:00
1266477,아직도 lfp 중국산이니 뭐니 편견과 반감 가진분들이 많은듯 하네요. 물론 삼원계 한국산이 성능도 우수하고 잘팔리면 좋은것이지만 앞으로 전기차시장 판도가 그쪽이 아닌듯...테슬라나 토레스 겁나 까더니 현기가 lfp 써야하는 시점이 오니 여론 반전시키려고 기사들 많이 뜨네요. 무조건 lfp 까는 사람들 보면 좀 안타깝네요ㅎ 마치 폭락이들 같아요. 눈 가리고 귀 막고 홀로ㅋ,주니밍구l예정l서울,2023-08-16 08:07:00
1266477,lfp 배터리는 저가형 배터리죠... ncm 대비 발화점이 높아서 화재 안정성이 높을뿐 불이 안나는것도 아니구요....주행거리 개선된 부분은 고무적이지만 18인치 테스트였던거였구 1인치 늘어나면 주행거리 40에서 60키로 정도 차이나니 어느정도 이해되는 부분인데.... 어느날 갑자기 고오급 배터이가 돼버렸네요 ㅎㅎ,하리마코나인천,2023-08-16 08:12:00
1266477,고급이라고 한 사람들은 없죠 저급이라고 깐 사람들이 많을뿐 결과가 드러나고 있는데 3원계 대비 크게 떨어지지는 않는다이죠 대신 가격이 싸기 때문에 경쟁력있다지요,박스종I모델Yl화성,2023-08-16 08:21:00
1266477,빠떼리아저씨가 겁나 까던 lfp가 다시 주목을 받나보네요 ncm계열 배터리로 고가정책으로 가던 제조사들의 판매가 부진해지고 재고가 쌓이는 모습입니다. 우리나라 뿐만 아니라 보조금도 계속 줄어들면 lfp장착한 반값 혹은 가성비의 전기차가 더욱 판매하기에 수월하지 않을까 생각합니다. 저역시도 새차 기준 실구매가 3천만원대에 주행거리 제법 나오는 전기차를 세컨용으로 기다리고 있습니다. 모3 하이랜드도 기대가 됩니다 ㅋㅋ,릴리I쏘하I김포,2023-08-16 08:24:00
1266477,뭐 가격경쟁은 소비자가 이익을 취할수있습니다. 다만 그에 적합한 BMS가 적용되야겠지요. 최근 캠핑용 인산철 파워 뱅크 충전중 화재 발생해서 해당 모델 전량 업체에서 자발적 리콜 진행하고 있습니다. 3원계든 인산철이던 화재 발생하면 화재확률은 100%입니다. 뭐라도 저렴하고 안전한 배터리가 나오면 좋겠습니다,할배온l볼트아5l경기,2023-08-16 08:36:00
1266477,LFP전기차 중국에서 불 많이 나던데요. 불 안난다는건 잘못된 정보인것 같습니다.,바쁠껄I아이오닉I대구,2023-08-16 08:37:00
1266477,화재의 경우 중국에서 나오는 데이터는 믿지 마십시요. 인구부터 중국에서 나오는 대부분의 데이터는 조작된다고보시면 됩니다. 코로나 청정국인데 말 다했죠. MYR도 테슬라에서 매니지먼트/QC 하니까 사는거죠...,맥스큐lEV6l경남,2023-08-16 08:41:00
1266477,내년이후 아이오닉시리즈에도 저렴이 버전에 쓰면 그때 다시 말해요.,카카로트l경기,2023-08-16 09:54:00
1266477,"가격이 문제지요. lfp가 성능이 떨어지고 무거워지는데 가격이 오백 떨어진다 하면 안사고, 적어도 1500이상은 떨어지고 주행거리 좀 손해 보면 lfp로 가는것도 나쁘지 않아요.코나가 중국산 좀 떨어지는 삼원계를 쓰고도 가격이 이전보다 올라서 욕 엄청 먹었지요. lfp달고 가격이 그대로면 아이오닉은 나락 가는거지요.",한힘Igv60I파주,2023-08-16 12:54:00
1266477,"세상이치중 하나...싸고 좋은 물건은 없다..딱 가격만큼만 한다...싸고 좋은 물건이 있다면 비싼데 안좋은 물건은 사라지겠죠..ㅎㅎ^^전기차 시장은 투트랙 전략으로 가지않을까 싶네요..보급형 중저가 차량은 lfp 배터리로,고성능 고가 차량은 삼원계로,솔직히 까놓고 말해서 이번 모델y 계약하신분들 가격때문에 혹해서 사신거 아닌가요?기존 모델y 롱레인지랑 가격차이가 얼마 안난다면 그래도 lfp 선택하셨을라나??",마이쭌I아5 EV6I부산,2023-08-16 10:39:00
1266477,🥳🥳🥳 정답!!! 👏👏👏,꼬때지I아5EUVI경남,2023-08-16 15:31:00
1266477,ㅎㅎㅎ byd의 굴욕이네요.,디오니ㅣ모3ㅣ서울,2023-08-16 11:11:00
1266477,"다들 빠떼리에 흥분하는지.,투자가들인가? 각자 의견은 말하되 관철시키려 들지말자남의 의견은 듣기만하고 본인도 의견만 말하자.,내 지식이 커지면 부끄럽다.반대의견을 참지못하는 건 중병",오너I오닉5I경기,2023-08-16 13:38:00
1266477,저도 그렇게 느껴요 lfp 한창 욕하고 겨울어쩌고 파나소닉 짱짱거리더니 이젠 가성비를 넘어 성능도 짱짱거리네요ㅋ,라랄Iix3I울산,2023-08-16 15:30:00
1266477,"테슬라가 보급형 중저가로 가고 있다는 이야기입니다..프리미엄 브랜드 이미지는 이미 멀어졌고, 수익에 집중하는 모습이에요.그런 측면에서 LFP배터리 장착이 나쁘다고는 할 수 없죠.",시골박사IMY iX3I경기,2023-08-16 21:24:00
1266477,"LFP 화재안전 0.5C, 0.6C 얘기 아닌가요? 평지만 달려도 막 2C이상 찍히던 테스트 글을 봤는데...언덕가면 6c도 찍히고 2C 이상만 되도 안전성마저 역전된다던데... LFP가 2C이상에서 NCM보다 안전하다는 연구가 있나요? 100%충전이 무리를 주지 않는게 아니라 배터리 메모리가 안되서 모니터링이 안되니까 100% 완충 권장하는거 아닌가요? 수명이 더 길다는 건 원래 ESS용도로 썼을 때 그런거고 전기차 용으로 썼을 때 그럴지는 아직 모를 뿐더러...NCM도 폐차할 때까지 탈텐데 그게 LFP의 장점이 될런지요. 흔히들 차가 먼저 부식될거라 하는데. ESS용으로 삼원계보다 낫다는 건 원래 ESS용으로 개발한 배터리니까 그런거고. LFP는 싸서 수요확대용으로 보급형 저가 정책으로 쓰는 배터리 같은데 올려쳐서 삼원계 못지 않다는 뉘앙스라...음...",토도동l서울,2023-08-17 00:21:00
1266121,"전 잘 모르는 일반인인데, 예전 카페글에서 2 c-rate 라는건 2시간내내 풀악셀 밟는걸 의미한다고 본 것 같네요. 잠시 가속하는 일상적 운행에서는 큰 의미는 없는..",씨엔씨I서울I,2023-08-15 16:19:00
1266121,2c-rate는 30분에 풀방전되는 출력입니다.,디오니ㅣ모3ㅣ서울,2023-08-15 16:24:00
1266121,아 제가 잘못 생각하고 적었네요. 죄송합니다.,씨엔씨I서울I,2023-08-15 16:25:00
1266121,의미가 있습니다. LFP는 아니지만 고속도로에 많이 달리는 전기트럭이 있습니다.그럼 레이나 모와이나 토레스가 고속도로에 안나타나겠습니까? 풀악셀까진 아니더라도 2시간이상은 달릴텐데요.(레이는 모르겠지만-2시간이상 달릴려나요?),금연I니로EVI하남,2023-08-15 16:28:00
1266121,c rate는 평균값을 내는게 아닙니다.순간순간 출력에 따라 바뀌고 높은 c rate가 나오면 배터리에는 안좋습니다. 급가속 하자말라는 이유가 여기에 있습닏~,트니아빠I아5E208I부,2023-08-15 16:28:00
1266121,good 고출력을 발휘할수록 lfp는 특히 겨울철에 치명적인 단점이 발생합니다 수명에도 영향이있지요 모카에서 20년 탄다는데 정말 안타깝습니다 사람들이 많이 보는 유튜버인데,달타냥l니로l광주,2023-08-15 16:30:00
1266121,"""2시간"" 내내 풀악셀해봤자 0.5C입니다. 심지어 80km/h 이하에서는 정출력영역이 아니므로 풀악셀 해도 2C가 안나옵니다. LFP 얘기하는데 ""2C 풀악셀이 어쩌고 = 사짜 비전문가"" 취급하시면 됩니다.",베멤l모델3l부산,2023-08-15 16:31:00
1266121,현기하고 중국한테 돈 받았는갑죠현기도 lfp슬슬 쓰려고 하고 있으니,어쩌l아이오닉6l수원,2023-08-15 17:44:00
