post_id,cmt_content,cmt_author,cmt_created_at
1277629,어차피 배터리 내부 수입산임 한국에서 안나옴,아이폰ㅣ아5ㅣ안산,2023-08-30 09:15:00
1277629,중국 업체는 한국에 공장 세워서 공급하려하고한국 업체는 중국에 공장 세워서 공급하려하고….누굴 응원해야하는건지 ㅎㅎㅎ실업율 생각하면 중국 업체가 좋은거고….이것 참…,수녕군IMYI서울,2023-08-30 09:24:00
1277629,개인적 의견이지만 LFP 배터리 우리나라에서 생산필요 없을듯 한데요차라리 삼원계 안정화가 장기적으로 유리할텐데 아쉽네요,초코보79,2023-08-30 11:06:00
1277629,쩝,티코운전수IYI서울,2023-08-30 15:47:00
1276433,헐~ 이런 뉴스도 있군요!,예스이즈I경남,2023-08-28 22:09:00
1276433,기사내려갔네요,기시IEV6I중스,2023-08-30 13:09:00
1273943,"차종은 모르겠지만,, 대부분,, LG에너지솔루션 배터리 입니다.",난초농부쏘울ev화성,2023-08-25 14:54:00
1273943,설령 있다해도 발표안할겁니다. 특히 우리나라에서는 더더욱 그럴겁니다. 현기무서워서 누가 총대 메겠습니까.,금연I니로EVI하남,2023-08-25 14:55:00
1273943,불이 난다는게 생각보다 무섭네요,비브I경북,2023-08-25 15:03:00
1273943,충전중 화재는 모르겠고 국내 전기차 화재 2020년 11건 2021년 24건 2022년 44건 2023년 상반기 42건 발생2019년이전 화재일지를 보면 코나EV와 모델S가 1위2위를 다투고 있네요. 관련 내용을 보면 차종보다는 배터리회사를 봐야할것 같습니다.,들개Iev6I성남,2023-08-25 15:15:00
1272235,주행거리요...,떡구님 I 서울,2023-08-23 16:51:00
1272235,요즘은 배터리 DIY해서 400도 타던데요.중고 부품도 아마 신형 레이에서 조달 가능한 장점이 생기지 않을지.,레이2V 서울,2023-08-23 16:52:00
1272235,구형레이가 400을 탄다고요?,데이즈lEV6I경기,2023-08-23 16:52:00
1272235,그거 하는게 레이 신형 ev가격 가까이 나올겁니다 ㅎㄷㄷ 안정성도 보장이 안되고..,셀I넥쏘모3I인천,2023-08-23 16:55:00
1272235,배터리 모디파이하는 업체“들”이 생기고 있습니다.,레이2V 서울,2023-08-23 16:53:00
1272235,화재 발생시 어떻게 되나요? 만약 화재 발생해서 주변에 재산 피해라도 입였을 때 개조차량이면 소비자가 모두 책임지는 사태가 올 거 같은데요 ㅠㅠ 앵간한 사람은 파산 신청할듯요,폴쉐타I폴스타2I서울,2023-08-23 17:04:00
1272235,"기존 중고 전기차로 채울수 없는 부분을 레이는 특정목적(배달,영업, 차박)에 특화 돼 있어서 채울수 있습니다. 수요도 꾸준히 있을거 같습니다 전기차 한번 타볼까 하는 분들 대상으로 하는 차는 아니에요 전동 탈것(킥보드, 자전거) 동호회에서는 점프 라이딩하기 굉장히 좋은 차량으로 인식되고 있습니다",아침의라이더I경기,2023-08-23 17:39:00
1272235,주행거리영,세종I누누슴,2023-08-23 16:59:00
1272235,저도 새차요 비닐은 벗겨보고 싶어서요 ㅎ,귀연 lev6l 경기,2023-08-23 17:03:00
1272235,비닐 ㅋㅋㅋ 그쳐 그건 못참지,아침의라이더I경기,2023-08-23 17:14:00
1272235,,귀연 lev6l 경기,2023-08-23 17:38:00
1272235,새차 비닐다떼고 갖다줄라하세요고역입니당 ㅎㅎ,무사신l니로EVl부산,2023-08-24 14:22:00
1272235,내년 캐스퍼가 NCM으로 주행거리 300 내외로 나와줄수 있을까요,메타블루I코나I충북,2023-08-23 17:10:00
1272235,세컨카네 도심형차네 장보러갈거네 픽업용이네 등등 말씀하시는데요. 다 뻥입니다. 고속도로에서 많이 보인다에 맥심모카골드 한잔 걸겠습니다.,금연I니로EVI하남,2023-08-23 17:09:00
1272235,"단순 출퇴근용이면 코나/니로/볼트 중고가 나을수 있지만, 화물-차박-귀여움같이 특수목적이 있는 부분은 레이EV를 대체할수 없죠",서울I코나egv70I서울,2023-08-23 17:09:00
1272235,"여러 배달 업체, 공공기관 차량 등 수요는 있을 수 밖에 없는 포지션 입니다. 제 생각엔 휴게소 포터급으로 공영주차장 레이가 되지 않을까요?",윤셩I모3I서울,2023-08-23 17:21:00
1272235,새차가 최곱니다 뭐든 새거가 좋더라고요,백수I아이오닉I충청,2023-08-23 17:24:00
1272235,페리오닉 중고가 훨 낫다고 봅니다,소멸은신I모델YI인천,2023-08-23 17:28:00
1272235,지금타고있는 17년10월출고된 쏘울ev하고의 차이점을 못느끼겠네요...,정땡I구쏘울포터I제주,2023-08-24 08:14:00
1271992,레이 가솔린도 실제 연비 더 안좋은데 전비 잘나올지 궁금하네요. ㅎ,삼하I아이오닉5I울산,2023-08-23 12:08:00
1271992,아파트사시고 지하에 주차하신다면 겨울철 걱정 크게안하셔두됩니다,양I니로I경남,2023-08-23 12:08:00
1271992,저희 아파트 지하에 충전기 있어요 아파트 지하에 충전기 있으면 괜찮다라는 말이시죠,곰냥파파,2023-08-23 12:10:00
1271992,아니요 추운곳에 오래노출됐을때 배터리효율이 안좋아서 히팅펌프가 달린거에요. 주행중엔 모터돌리고 하느라 어느정도 열을 내니까 겨울이라고 전비 반토막나고 이러지않아요. 야외주차가 잦다면 추운곳에 노출되니 전비에 더 안좋다는말이었어요,양I니로I경남,2023-08-23 12:14:00
1271992,충전스트레스 장난아닐듯 그래도 저는 한국 경차최초 오토홀드와 착한가격(?)에 고고!,달타냥l니로l광주,2023-08-23 12:11:00
1271992,저는 자영업자고 가게용 전력이라 싸서 완속 충전 하니끼ㅣ 살려구요.부가세 환급도 되구요,발새I경기,2023-08-23 12:18:00
1271992,"세컨카로 시내 많이 안돌아다니시면 내연 레이가 좋을것 같아요, 와이프 출퇴근카로 살려고했다가 주행거리와 가격보고 미련없이 포기했습니다. 지금 아파트에 충전기보다 전기차가 적은데 늘어나는 숫자도 빠르고 레이 판매시작되고 많이 팔리면 집밥 충전 경쟁 심해서 스트레스입니다. 전기차 타보니 단거리 다녀도 400km이상되야 덜 피곤합니다. 충전구역 주차 14시간 되어있어 만충되도 안빼는 차들 많고 내차 충전 다되고 있으면 전회오는 경우도 많이 생깁니다.",딸기맛포도l경산l,2023-08-23 12:20:00
1271992,저정도 키로면 개인전용 있어야지 공용 충전기 쓰면 이웃들과 자주 충돌날듯...,까앙l모와이l경기,2023-08-23 12:18:00
1271992,가솔린 레이가 있는데 굳이?,스타트랙l코나l강릉,2023-08-23 12:18:00
1271992,겨울철이 걱정이네요,차담llev6ll수원,2023-08-23 15:24:00
1271992,그냥 빨리 사세요.,꼬때지I아5EUVI경남,2023-08-23 15:52:00
1271992,울산은 레이전기차 보조금 얼마 나오나요 ??,고고I니로I울산,2023-08-23 16:58:00
1271992,1년 뒤에 계약하면 늦어요. 올해 계약해도 내년 넘을 것 같아요.사전예약만으로도 올해 생산량은 넘을 것 같습니다.,수퍼맨아빠IGV60I경남,2023-08-23 22:20:00
1271992,"굳이 가솔 레이가 있는데 전기를 타실려는 이유가? 개인이 판단하시겠지만 마실용이라도 전기차는 최소 300이상 가는 차를 선택하시는걸 추천 드려요. 카페에 젤 많이 올라오는 글이 충전, 주행거리 입니다. 본인의 차량 구입의 목적이 조용한 전기차 구매라면 조금더모아 최소 코나 이상으로 보시고 유지비 라면 앞으로 전기차 유지비용은 계속 상승할테니 그점 감안하시어 선택하는게 좋지 않을까 합니다. 가게 완속 충전하시더라도 전기차 충전 콘센트 전류 생각하신다면 콘센트 열 많이 발생되어 건물에 매립되어있는 전선이 열받았다 식었다해서 피복경화가 빨리 옿수있어 운 없으면 전기화재로 이어질수도 있어요. 그래서 전기차 콘센트 충전기를 비상용 충전기라고 칭하죠. 윗분들 말씀 구구전절 다 맞는 글이니 좋은선택 하식 바래요~~",더 그린llQ4ll경남,2023-08-24 12:52:00
1271979,단종취소됨 검색해보셔요,정정IM3I전북,2023-08-23 11:49:00
1271979,아하,별빛소용돌이,2023-08-23 11:50:00
1271979,마이너브랜드에 실내가 작아요,김철수ㅣ오닉5ㅣ충북,2023-08-23 11:50:00
1271979,볼트 9개월 운행해본 경험으론그냥 충전속도요.. 그거 말곤 갠적으로 정말정말 만족하면서 탔음,갈릭반I아5아6I대구,2023-08-23 11:55:00
1271979,쉐보레에서 차를 찔끔찔끔 한국배치 줄세우기하다가 대항마나오니 저가로 렌트카대란 밧데리 이슈로2년버림 euv가 위급인데 가격차이별로없음 안팔리고 단종수순,팔라l니로euvl제주,2023-08-23 11:57:00
1271979,인기가 “상대적”으로 없긴 해도 안 팔린 건 아니죠. 국내에서 1만 대 넘긴 전기차 차종이니. 다만 형편없는 영업감각과 불운이 겹친 환장의 콜라보가 큰 문제었습니다. 한국GM의 물량 조절 실패(2017) 그럭저럭 잘 나갔으나 하반기 코나/니로 나옴(2018) 코나/니로 있는데 가격 버텨서 망함(2019) 배터리 용량 올려서 좀 팔아보려는데 화재 이슈 터짐(2020-2021) 페이스리프트하고 가격도 낮췄는데 배터리 전량교체 리콜로 타이밍 날아감(2022) 타이밍 잘 잡았으면 2만 대 이상 팔릴 수도 있었다 봅니다.,웨슬리I볼트EVI나주,2023-08-23 12:15:00
1271979,,연군ㅣ볼트ㅣ경기,2023-08-23 15:52:00
1271979,원래부터 쉐보레는 한국에 자동차 많이 팔 생각이 없습니다.본사한테 돈 땡겨오는 구조에요.,ㅇㅋI볼아6후륜I경기,2023-08-23 12:24:00
1271979,쏘울부스터 ev가 이분야에서는 더 이해가 안가는ㄷㄷ,늘고민중I서울,2023-08-23 12:30:00
1271979,그냥 좀 애매했던 차 같아요외형 무난 실내 무난 주행거리 무난 가격은 쏘쏘?,Teddyl고양,2023-08-23 13:11:00
1271979,충전 속도 아쉽죠 겨울에 정말 속터집니다 나머지 대만족,난엔젤I볼트l천안,2023-08-23 13:34:00
1271979,충전속도 극악입니다. 겨울에 3대차 볼트.조에.푸조차 미칩니다.,테슬라l모델Yl서산,2023-08-23 14:25:00
1271979,개인적으로 볼트+오픈파일럿 이 최강의 조합이라 생각합니다~~,장군I니로I경기,2023-08-23 15:48:00
1271979,'쉐',호빗,2023-08-23 23:01:00
1271979,인기가 없었던게 아니라 쉐보레에서 차를 한국에 안풀었습니다 대기자는 엄청 많았는데 한국에 들여오질 않아서 …저도 포기하고 비슷한가격에 id4를 샀던 기억이….ㅋ,요요IID4모델YI서울,2023-08-24 12:31:00
1271979,"디자인이 마티즈랑 비슷해서 망...bmw 몰때랑 끼어들기, 빵빵거림 차원이 다름;;",고무고무I볼트I대구,2023-08-24 12:34:00
1271979,결국 지금 euv타고 만족하고 있지만 배터리 이슈로 계약후 1년넘게 무대응으로 일관한 쉐보레 생각하니 다시 열뻗치네요,수원IEUVI꼬리표,2023-08-24 14:28:00
1271560,아6 중고,스필I아이오닉6I경기,2023-08-22 22:33:00
1271560,ㅇㅈ...,호롤노아I김포,2023-08-23 01:26:00
1271560,21년 초에 코나 배터리 화재로 19년식 프리미엄 차가 2000만원 까지 떨어졌을때 제가 코나 중고로 최적기라 추천했었습니다 씨알도 안먹히더니 아직도 2000초반이네요 ㅋ,똥글빵글l모3 70l일산,2023-08-22 22:37:00
1271560,코나EV,제이콥lNE1kNl과천,2023-08-22 22:42:00
1271560,코나 라고 생각해요,부산사라요,2023-08-22 22:43:00
1271560,가성비만 따지면 볼트ev 쏘울ev,lifeI쏘울evI당진,2023-08-22 22:49:00
1271560,구니로죠 공간감 배터리안정성 입증된,수원INIROI광교,2023-08-22 23:07:00
1271560,"구 아이오닉, 구 볼트 중고요~~",해치백빠I볼트evI서울,2023-08-22 23:32:00
1271560,주행거리가 짧아도 괜찮으시다면 미니 일렉트릭도 괜찮아요,일산l530el흑랑,2023-08-22 23:44:00
1271560,"뉴오닉, 구니로",오닉l모델yl경북,2023-08-22 23:52:00
1271560,신형 레이EV,시골박사IMY iX3I경기,2023-08-23 00:31:00
1271560,bmw i4,으즈라고,2023-08-23 00:37:00
1271560,신차 기준이면 중국산 ix3가 진짜 좋은거같은데.,허리요정l충남,2023-08-23 00:56:00
1271560,오닉 콤보. 배터리 교체된 볼트. 구니로 정도 네요,수남매아빠I니로l평택,2023-08-23 07:21:00
1271560,구코나 구니로 구볼트 감가 다맞아 거의 안떨어진다고봅니다,연군ㅣ볼트ㅣ경기,2023-08-23 10:48:00
1271560,볼트ev가 아닐까요? 일단 힘이 좋으니깐.,겟타I아이디4I안양,2023-08-24 10:21:00
1270178,다 완료된겁니다저도 코나 ev 19년식 탔었는데 20년후반인가 21년초반 쯤부터 고접압배터리 새거로 교체해주기 시작했어요,전기차l모3l경기,2023-08-21 11:32:00
1268770,"제일 중요한 메인 배터리 리콜 교체여부를 기본으로 확인하시고, 배터리가 장착된 하체도 충격파손 부분은 없는지 보시길 권유드립니다. 출고이후 리콜 정비기록이나 배터리교체 내역 등은 블루링크에 전부 기록되어 있으니 참고하시면 되구요",꿈지기I코나evI김포,2023-08-19 06:05:00
1268770,배터리도 문제지만 충전기도 초기에 비해 문제점이 조금 개선된거같네요,제희I경기,2023-08-19 08:08:00
1268335,ㅎㅎㅎ,백기사I서울,2023-08-18 13:12:00
1268335,잉? 코나 불나 모르시나요. bms 문젠데 거참..,크리스l모SYl경기,2023-08-18 13:16:00
1268335,배터리 문제 아니였나요? sk 배터리로 바꾸고부터 문제 없던걸로 기억합니다,경기I아침의라이더,2023-08-18 13:25:00
1268335,처음 리콜한게 bms 업데이트입니다.,크리스l모SYl경기,2023-08-18 13:29:00
1268335,배터리 문제였는데 bms 업데이트 해봤자죠,카탈리나ll서울,2023-08-18 13:30:00
1268335,그야 당연히 처음 조치 취할수 있는건 bms 리콜이죠 충전 제한 보수적으로 하는조치요 당장 배터리를 바꿀수는 없으니깐요,경기I아침의라이더,2023-08-18 13:31:00
1268335,베터리 끝까지 안바뀌주고 어쩔수없이 막판에 해준거에요. 첨부터 바뀌줄 맘도 없었던겁니다.,크리스l모SYl경기,2023-08-18 13:33:00
1268335,사후조치 문제는 별개고요 지금 bms 얘기중인거 아닌가요 당장 폭스바겐도 25년부터 현대모비스한테 bsa 납품받기로 했는데요. 기술력만 보면 현대 bms 가 업계 최고중에 하나는 맞지요,경기I아침의라이더,2023-08-18 13:34:00
1268335,당신말이 옳습니다,크리스l모SYl경기,2023-08-18 13:35:00
1268335,테슬라 지금까지 BMS문제 하나 없이 업데이트 안했으면 인정,온랑이Igv70I김포,2023-08-18 14:12:00
1268335,현대의 bms는 뭐.. 폭스바겐에 bsa 수주 하나만 봐도 더 논할 필요가 없죠,카탈리나ll서울,2023-08-18 13:33:00
1268335,누가 뭘 선도한다구요???,크리스I아6I사천,2023-08-18 13:52:00
1268335,iccu는 문제있어도 bms만 좋으면 된다???,소멸은신I모델YI인천,2023-08-18 13:55:00
1268335,폭바가 사가는거 보면 업계 탑은 확실함,morgan8274lgv60l광명,2023-08-18 13:56:00
1268335,세계를 선도 ? 우끼고있네,작은소년eg80양산,2023-08-18 14:09:00
1268335,,아련다솜I모델3l경북,2023-08-18 14:16:00
1268335,댓글들이 예상했던 ㅜㅜ,유진아빠I니로EVI대전,2023-08-18 14:58:00
1268335,화재랑 급발진을 인정안하는 선도는 의미없죠,연천ll양택이,2023-08-18 15:05:00
1268335,iccu: ???,호크IxxI서울,2023-08-18 16:59:00
1268335,그럼에도 불구하고 폭스바겐이 사가는거면 폭스바겐도 인정한거죠본인들이 만드는것보다 사서 쓰는게 이익이라고,거북l아이오닉5l시흥,2023-08-18 18:43:00
1268335,V2L을 최초 적용한걸 보면 선도하겠다는 자신감은 있다고 봐야죠. 그 과정의 문제들 또한 먼저 겪으며 성장의 밑거름이 될꺼라 봅니다. 세계1등 브랜드가 한둘이 아닌 나라인데 자동차분야 1등도 불가능은 아니라 봅니다.,드라이브갈까II경남,2023-08-18 19:55:00
1268335,"V2l최초적용은 gm의 gmc terradyne컨셉카에서 보여줬고, 그 다음은 쉐보레의 silverado가 2004년에 v2l을 달고 출시했습니다. 전기차에서는 2015년 출시된 BYD tang이 v2l기능을 탑재하고 출시되었습니다.",디오니ㅣ모3ㅣ서울,2023-08-18 22:36:00
1268335,민족 특성인지 다른 나라도 그런지 몰라도 자국 브랜드 무지성으로 까는건 최고인 듯. bms기술 현대보다 동등하거나 앞선 기업 테슬라 말고 어디 있음? 한편으로는 이래서 단시간에 선진국에 진입했나 하는 생각이 들기도하네요.,맛밤아학I경기,2023-08-19 00:43:00
1268335,"Iccu 문제가 발생한다고 뭐라고들 하시는데요...남들은 하지않는 분야니까 iccu라는 문제 자체가 생기지 않는거죠...당장 모든 브랜드 전기차를 다 타보니깐..독3사는 걍 맛탱이 갔고요. 일본차는 안타봐서 모름..진심으로 테슬라,현대 두 회사가 미래를 선도할거 같습니다.",하랑이l330el대구,2023-08-20 09:53:00
1267502,좋은 글 감사합니다.,삼I볼트EVI대전,2023-08-17 12:39:00
1267502,나왔네 꿈의 배터리~,온랑이Igv70I김포,2023-08-17 12:41:00
1267502,"현실의 국내 배터리 회사에서도 동일한 이야기를 하는군요. 현실이 꿈처럼 보인다면 잠이 덜 깨인 것이니, 점심에 세수 한 번 하시기 바랍니다.",베멤l모델3l부산,2023-08-17 13:48:00
1267502,쯧쯧,폭격기l 모3 l군산,2023-08-17 14:36:00
1267502,객관적인 데이터를 가지고 쓴 글에 아무 근거없는 비아냥 댓글은 본인의 인성만 드러날 뿐 입니다.,의자늘보l l울산,2023-08-17 17:28:00
1267502,NCM 배터리에 비해무겁고 부피가 크기 때문에 꿈의 배터리는 아닙니다.,카페인I서울,2023-08-22 16:42:00
1267502,유투브 그만보세요 ㅇㅌㄱㅇ 그딴거만 보니 현실이 안보이죠,독립투사I용인,2023-08-25 10:16:00
1267502,동일수준 기술력으로 제조시 기준 NCM은 열폭주에 의한 자체발화 있고 충격에 의해서도 열폭주가 생기지만LFP는 자체발화는 아닌 주변 가연재에 옮겨붙는수준 충분히 탈출할 시간을 줍니다. 또한 충격에 강하고요.....성능을 택할거냐 안전과 합리적인 가격을 택할거냐의 문제지 각각 장단은 있습니다.,듀스I코나EVI김해,2023-08-17 12:43:00
1267502,오토xx,하웁I모yI서울,2023-08-17 12:47:00
1267502,xx기어,페이비I여주,2023-08-23 22:07:00
1267502,오토기어요??,해피메롱I코나I수원,2023-08-24 17:15:00
1267502,꿈의 배터리네요성능좋고 싸고근데왜 중국에서도 고급차인니오/샤오펑/지커는 ncm을 쓰는지첨언하면 충돌나서 불나고 전소된 BYD전기차(LFP)중국 콰이쇼유같은 채널에 많이 나옵니다,morgan8274lgv60l광명,2023-08-17 12:53:00
1267502,"상용차 아닌 이상 160만km 탈 일이 없으니까요. 테슬라는 로봇택시 하겠다니까 5천만원대 메인스트림까지 LFP를 사용하고, 타 제조사는 50kg이라도 경량화 하려고 밀도 높고 비싼 NCM을 사용합니다. 어제 디오니 님 글 보니까 체리에서도 고급차에 CATL의 차세대 LFP인 M3P 쓴다고 발표 했습니다.",베멤l모델3l부산,2023-08-17 12:51:00
1267502,뭔가 단단히 착각하시는데액체전해질을 쓰는한 NCM이고 LFP고 결국 불은 나요NCM에서 산소 나와서 불이 붙나박아서 LFP에서 불이 붙나 똑같이 불 나요LFP는 저렴이 포지션. 그 이상도 이하도 아님.왜 고전압배터리 만드려는지는 아실까.,너궁띠I볼보C40I서울,2023-08-17 12:50:00
1267502,"뭔가 단단히 착각하시는데, LFP 불 안난다고 한 사람 여기에 아무도 없습니다. 고전압 배터리라는게 4.2V 이상을 말씀하시는거라면, 리프 1세대에서 LMO로 실패한 이후로 OLO MNX 상용화도 분위기 나쁜 것으로 아는데... 배터리 업계에 현직으로 계신가요? 요즘 나오는 논문들을 봐도 LFP 도핑이 망간리치보다는 활발히 보이더군요.",베멤l모델3l부산,2023-08-17 21:14:00
1267502,"참고로 배터리 수명 가장 많이 갈아 먹는건 방전, 계절의 온도 차이입니다. 특히 전해질이 액체인 원통형 배터리에는 취약이죠~",온랑이Igv70I김포,2023-08-17 12:52:00
1267502,수명 가장 크게 갉아먹는건 고전압/저전압 충방전시 발생하는 상전이에 의한 저항발생입니다,너궁띠I볼보C40I서울,2023-08-17 12:55:00
1267502,"파우치라고 액체전해질 안쓰는 것도 아니고, 상전이로 구조 깨져서 내부저항 올라가는건 본문에 방전율에 따른 온도 데이터가 있습니다. 아, 50도 내외의 고온에서 충방전 반복하면 전해질 열화에 의한 SoH 저하가 심각하다는 논문도 있기는 한데, 전기차에선 별 의미가 없다고 생각합니다.",베멤l모델3l부산,2023-08-17 13:02:00
1267502,"그렇게 말씀하셔도 LFP가 NCM의 포지션을 잡는건 아니죠상전이를 비교하는데 SoC 가 1:1비교가 안되는게, NCM 전압범위가 일반적으로 2.0-4.3V인데, LFP는 3.75V정도에요 애시당초 전압구간이 차이나는데 그걸 %로 바꿔서 낫다 라고 하는게 맞을까요?NCM811기준으로 상전이 일어나는 구간이 4.1V 내외인데 그거만해도 LFP SoC 100%일때보다 전압도 높고 에너지밀도도 높아요. 어차피 50도가 높은 온도는 아니지만 리튬거동이 불안정해져서 오히려 배터리가 불안정해지는 상태인데 그런 상태에서 NCM이랑 LFP를 비교하는건 그냥 LFP의 장점을 보여주려는 퍼포먼스 테스트이지 실제 테스트가 아닙니다.LFP가 NCM만으로는 못하는 가격경쟁력부분에서 앞설뿐이지 LFP가 NCM보다 성능적으로 우월한게 아니에요.물론 수명이 길다고는 하지만 NCM 성능 하락까지도 다들 못써요아니 SK on도, LG엔솔도 공개적으로 그렇게 포지셔닝하고 있다면서 LFP생산에도 주력하겠다는데, 도대체 왜 LFP가 꿈의배터리인냥 찬양하시는 분들이 계시는건지 모르겠네요.",너궁띠I볼보C40I서울,2023-08-17 13:17:00
1267502,오홋~ LFP 와 NCM 충방전 가용 전압 차이가 있어서 단순 충방전 횟수 비교 하면 안되는 거... 하나 배워 갑니다.,개똥철학l경기,2023-08-17 13:22:00
1267502,"제 글이 LFP 찬양처럼 보이셨다면 글을 똑바로 안읽었거나, 처음부터 색안경을 끼고 바라보신 것이겠지요? 계속 전압 구간에 따른 상전이를 얘기하시는데, 전기차의 주행거리는 전압도, 전류도 아닌 배터리 용량[kWh]이 결정합니다. 고전압이 중요하면서 배터리 단가를 신경 안쓰면 다들 LCO 4.5V까지 올려서 쓰던가, NCM도 4.5V 써야지요. 그리고 50도에서의 충방전 데이터는 완전히 무의미하거나, LFP에 편향적이지도 않습니다. 고성능 전기차들은 트랙모드에서 배터리 온도 50도, 5C 이상의 풀악셀을 심심찮게 겪습니다. 3C 이상의 급속충전 시에는 분리막이 버틸까 싶은 60도까지도 올라가더군요. 제 글을 보고 LFP가 무적이고 최고라고 오해하는 독자가 있다면, 그 분이 난독인 것이지 저를 비난할 이유가 있습니까? 굳이 수정이 필요하거나 논리적으로 오류가 있는 부분이 있으면, 토론을 통해서 충분히 반영해드립니다. 국내에도 볼트EV 40만km 사례가 있고, 캐나다에도 모델3 60만km 사례가 있습니다. 평균적인 전기차는 20만km(약 500 Cycle) 이전에 폐차할테니 하이니켈의 단점이 없겠지만, 위의 사례처럼 50만~100만km 주행에는 LFP가 더 적합하다는건 제가 직접 말하지 않아도, 본문을 똑바로 읽은 분들이면 유추할 수 있기 때문에 적지 않은 것입니다.",베멤l모델3l부산,2023-08-17 13:37:00
